index_id	category	text
817	sports	Kun radikoj en Running Tours Barcelona (el Barcelono) kaj en Running Copenhagen (el Kopenhago), ĝi ricevis la aliĝon de Running Tours Prague (kun sidejo en Prago), inter aliaj.
1763	travel	Ĉiujare dekoj da vizitantoj estas vunditaj, ĉar ili ne estas tenintaj sin je adekvata distanco. Ĉar tiuj ĉi bestoj estas grandaj, sovaĝaj kaj eventuale danĝeraj, gardu ilian spacon.
1290	politics	Israelo postulas daŭran armean ĉeeston en la valo dum dek jaroj post subskribo de interkonsento, dum la PA konsentas lasi la ĉeeston por nur kvin jaroj.
1775	entertainment	La ĉefa loka biero estas Number One. Ĝi ne estas kompleksa biero, sed ĝi estas agrabla kaj refreŝiga. La alia loka biero nomiĝas Manta.
642	science/technology	La uzo de la interreto kaj la Tut-Tera Teksaĵo permesas al lernantoj havi aliron al informo ajnmomente.
1544	politics	Je la 17a de septembro 1939 la pola defendo estis jam rompita, la sola espero restis retiriĝi kaj reorganiziĝi laŭ la Rumana pontokapo.
1148	health	"Proparolanto de Medicinistoj sen Limoj Richard Veerman diris: ""Angola estas laŭvoje al sia plej malbona epidemio, kaj la situacio restas tre malbona en Angolo"", li diris."
801	health	Oni modere trinku alkoholaĵojn. Alkoholo influas ĉiun malsame kaj tre gravas, ke oni konu sian limon.
1741	travel	Oni planas, ke la ponto plene refunkcios en Septembro 2017, kiam laŭplane oni estos kompletigintaj la brazilajn doganajn transirejojn.
1140	entertainment	Kvankam Winfrey estis malĝoja dum adiaŭo, ŝi certigis siajn fanojn, ke ŝi revenos.
1267	health	Edgar Veguilla ricevis vundojn de brako kaj makzelo, dum Kristoffer Schneider bezonis rekonstruan operacion de sia vizaĝo.
1774	entertainment	Ili estas kelkfoje homplenaj familiaj plaĝoj kie vendejoj vicas abunde laŭ la bordo. Naĝado estas sekura.
862	health	Sed en aliaj partoj de la mondo, kie la bakteria faŭno estas nova al vi, estas plej probable, ke vi havos problemojn.
1069	politics	"Ŝanĝi la mediprotektan leĝoprojekton de konservativuloj Layton petis dum la renkontiĝo kun la ĉefministro, proponante ""detalan kaj kompletan reverkon"" de la mediprotekta leĝoprojekto de la Konservativa partio."
325	geography	Sciencistoj de la Nacia Uragana Centro antaŭvidas, ke Danielle plifortiĝos al uragano ĝis merkredo.
1314	health	Lia esplorado montris, ke liverado de hormono plirapidigis maturiĝon de feta pulmo ĉe la bebo.
704	travel	Sed tamen ne tro zorgu pri ĉi tio, ĉar oni ofte interŝanĝas turistojn por plenigi la aŭtojn.
528	sports	La moderna skerma sporto estas praktikata en ĉiuj niveloj, de studentoj lernantaj en universitato ĝis profesiaj kaj Olimpikaj konkursoj.
532	sports	La ludanto, kiu por fini la golfejon bezonis malpli da batoj, aŭ svingoj de la klabo, venkas.
1643	science/technology	Oni povas nur demandi sin, kio iĝos la klavaro, kiam io pli nova venos.
868	travel	Por helpi al vi alklimatiĝon, en la unuaj tagoj konsideru esti neŝparema je hoteloj Okcidento-stilaj kaj Okcidento-rangaj, kaj tiaj manĝaĵoj kaj servoj.
124	entertainment	Longe antaŭ The Daily Show kaj The Colbert Report, Heck kaj Johnson pripensis publikigaĵon, kiu parodios novaĵojn — kaj novaĵraportojn — kiam ili estis studentoj en UW en 1988.
1159	politics	En Francio balotado tradicie estis teknologie simpla travivaĵo: voĉdonantoj izolas sin en budo, metas la anticipe presitan paperfolion kun indiko de sia preferata kandidato en koverton.
701	travel	Kubaj civitanoj posedantaj usonan verdan karton devas viziti ekvadoran konsulejon por esti sendevigitaj je tiu ĉi kondiĉo.
560	health	Por ekzameni viktimon vi devas unue ĉirkaŭrigardi la lokon por certiĝi pri via sekureco.
167	politics	Pro la atako la rilatoj inter Barato kaj Pakistano multege streĉiĝis.
301	politics	Atingoj de Vautier ekster reĝisorado inkluzivas malsatstrikon en 1973 kontraŭ tio, kion li opiniis politika cenzurado.
40	entertainment	"John Grant, el WNED Bufalo (la televidstacio produktanta Legantan Ĉielarkon), diris: ""Leganta Ĉielarko instruis al infanoj, kial legi, ... la amon al legado — [la programero] kuraĝigis la infanojn preni libron kaj legi."""
1414	politics	La Artikoloj postulis unuaniman konsenton de ĉiuj ŝtatoj antaŭ ajna ŝanĝo, kaj ŝtatoj rilatis al la centra registaro tiel facilanime, ke iliaj reprezentantoj ofte forestis.
1789	travel	Ĉiujn ŝanĝojn aŭ petojn oni tamen devas direkti unue al la vojaĝa agento kaj ne rekte al la hotelo.
754	travel	Kelkaj hoteloj heredis la oran epokon de vaportrajnoj kaj transoceanaj vaporŝipoj, antaŭ la dua mondmilito, en la 19a jarcento aŭ frua 20a jarcento.
1142	politics	Finaj rezultoj de namibiaj prezidentaj kaj parlamentaj elektoj montris, ke la aktuala prezidento, Hifikepunye Pohamba, estas elektita kun granda marĝeno.
1022	politics	La anonco estis farita post kiam Trump interparolis telefone kun turka prezidento Recep Tayyip Erdoğan.
538	travel	Turistoj povas viziti diversajn vidindaĵojn de certa lando aŭ ili povas simple preferi koncentri sin je nur unu areo.
155	geography	Dek kvin el tiuj ŝtonoj estis atribuitaj al la meteorita pluvo de pasinta julio.
1278	health	Kvankam tri homoj estis en la domo, kiam la aŭto koliziis kontraŭ ĝi, neniu el ili vundiĝis.
1197	sports	Inter ili Nederlando, kies Anna Jochemsen finis la naŭa en la virina stara klaso en Super-G hieraŭ, kaj Finnlando, kies Katja Saarinen veninta la deka en la sama evento.
1541	politics	Germanio estis komuna malamiko en la Dua mondmilito, kio gvidis al kunlaboro inter Sovetunio kaj Usono. Post la milito kunpuŝiĝo de sistemoj, procezoj kaj kulturoj kaŭzis disiĝon de la landoj.
1111	health	La epidemio igis la baratan registaron entrepreni tiajn rimedojn, kiel instalado de porkokaptiloj en la serioze damaĝitaj areoj, disdonado de miloj da kontraŭmoskitaj retoj kaj ŝprucado de pesticidoj.
889	geography	Enlanda Antarkto estas dezerta plataĵo kovrita de 2 ĝis 3 kilometroj da glacio.
324	geography	La ŝtormo, lokita proksimume 3000 mejlojn for de Miamo, Florido, havas maksimumajn daŭrajn ventojn de 40 mejloj hore (64 km/h).
118	entertainment	La publikiganto de la ludo, Konami, anoncis hodiaŭ en japana ĵurnalo, ke ili ne eldonos la ludon Ses Tagoj en Faluĝa.
1018	entertainment	Gosling kaj Stone ricevis kandidatigojn kiel Plej bona aktoro kaj Aktorino respektive.
523	health	Estas same lacige, kiel vekiĝi ĉiujn dudek aŭ tridek minutojn kaj spekti televidon.
1637	science/technology	Oni ankaŭ povas havi alojojn, en kies konsisto estas malgrandaj kvantoj da nemetalaj elementoj kiel karbono.
749	travel	La ago eniri en vian propran aŭton kaj ekiri for en longa aŭtovojaĝo havas esencan allogon pro sia simpleco.
1575	science/technology	Duuma nombro povas havi nur unu el du valoroj, t. e. 0 aŭ 1, kaj tiuj ĉi numeroj estas nomataj duumaj ciferoj - aŭ bitoj, uzante komputilistan slangon.
524	health	La efiko dependas de tio, kiel ofte dum nokto via cerbo provas atingi lucidan sonĝon.
358	science/technology	"Tion ili faras emisiante miniaturan partiklon de lumo nomatan ""fotono""."
999	health	Same kiel kelkaj aliaj ekspertoj, li estas skeptika pri kuracebleco de diabeto, rimarkante, ke tiuj ĉi eltrovoj havas nenian rilaton al homoj, kiuj jam havas diabeton de la tipo 1.
1359	science/technology	Leonoj estas la plej sociaj katoj, ili vivas en grupoj nomataj gregoj.
311	entertainment	La paro geedziĝis en Teksaso unu jaron antaŭe kaj venis al Bufalo por festi kun amikoj kaj parencoj.
1917	entertainment	Boatado estas nacia ŝatokupo en Finnlando: unu el ĉiuj sep aŭ ok finnoj posedas boaton.
1771	geography	La plaĝoj de Noth Shore (en la Nordhavena distrikto) estas ĉe Pacifiko kaj etendiĝas de Long Bay en la nordo ĝis Devonport en la sudo.
361	science/technology	Fotonoj estas eĉ pli malgrandaj ol la aferoj, el kiuj konsistas atomoj!
196	health	La testo de Arias estis pozitiva pri milda kazo de la viruso, informis prezidenta ministro Rodrigo Arias.
951	travel	Vi devas zorgeme elekti el alianco vian kompanion de ofta fluganto.
878	health	Kontaĝa malsano estas tiu, kiu estas facile transdonebla, kiam oni estas proksima al infektita homo.
214	sports	Kaj golfo kaj rugbeo pretas reveni al la Olimpiaj Ludoj.
509	health	"Ĝi ne estas lerna malkapablo, sed lerna perturbo; ĝi ""renkonteblas ĉe 3 ĝis 5 elcentoj de ĉiuj infanoj, eble ne malpli ol 2 milionoj da usonaj infanoj""."
332	entertainment	La festado komenciĝis de speciala spektaĵo fare de la monde konata grupo Cirque du Soleil.
835	travel	En aliaj kazoj, nur gastantoj ekster turismaj loĝejoj bezonas enregistriĝi, sed ĉi tio tamen faras la leĝon multe malpli klara kaj tial anticipe informiĝu.
298	politics	En tiu ĉi leĝodona sesio estis farita ŝanĝo, kiam la dua frazo estis forigita komence fare de la Domo de Reprezentantoj kaj poste akceptita en simila formo fare de la Senato lunde.
392	politics	Kiam la batalo por Francio finiĝis, Germanio komencis sin prepari invadi la insulon de Britio.
1211	entertainment	En 1989 li helpis krei The Simpsons kun Brooks kaj Groening, kaj li respondecis pri dungo de la unua verkista teamo de la programo.
204	travel	La Twin Otter provis alteriĝi en Kokoda hieraŭ kiel flugo CG4684 de Airlines PNG, sed lastmomente ĉesis jam unufoje.
916	science/technology	La tradukmotoroj multege pliboniĝis kaj nuntempe ili ofte proponas pli-malpli ĝustajn tradukojn (kaj volapukaĵojn pli malofte), sed necesas ioma zorgo, ĉar ili ankoraŭ povas esti farintaj mison.
535	entertainment	Estas kiam homoj iras al loko, kiu multe diferencas de ilia kutima ĉiutaga vivo, por ripozi kaj amuziĝi.
658	health	Dum somero, atentu ankaŭ la kulojn de Nordio. Kvankam ili ne transportas malsanojn, ili povas kaŭzi malkonforton.
353	science/technology	La akvaj molekuloj kreas sur la akva surfaco nevideblan membranon, kiu ebligas, ke aĵoj kiel kudrilo flosas sur la akvo.
1520	health	Oliver Sacks en sia artikolo The President's Speech indikis, ke homoj, kiuj ne povas kompreni parolon pro cerba traŭmo, tamen povas ĝuste pritaksi sincerecon.
1331	politics	Li supozeble provos elektiĝi kiel prezidento en 2016.
295	health	Helikopteroj savis la dek du ŝipanojn, kaj la sola vundo estis ies rompita nazo.
569	science/technology	Populacio estas aro de organismoj de certa specio en donita geografia areo.
926	science/technology	Se vi uzas flugroboton, sufiĉe anticipe kontrolu, kion oni rajtas filmi kaj kiuj permesoj kaj aldonaj permesiloj necesas.
854	travel	MetroPlus estas pli komforta, malpli plena je homoj kaj tamen iomete pli multekosta, sed ĝi estas ankoraŭ pli malmultekosta ol ordinaraj metrobiletoj de Eŭropo.
225	science/technology	Malluma energio estas tute nevidebla forto, kiu senĉese influas la universon.
1598	science/technology	Ili faris du eksperimentojn, markante aŭ la DNA en la bakteriofago per radioaktiva fosforo aŭ la proteinon de la bakteriofago per radioaktiva sulfuro.
771	entertainment	La festivaloj ĉe la temploj de Keralo estas tre vidindaj pro la periodaj procesioj de elefantoj kun ornamoj, la templa orkestro kaj aliaj festaĵoj.
856	travel	Portado por aliuloj. Neniam lasu viajn sakojn ekster via vidokampo, ĉefe transirante inernacian landlimon.
23	sports	Hodiaŭa Ludanto de la Tago estas Alex Ovechkin el Washington Capitals.
432	politics	Luksemburgio havas longan historion, sed ĝia sendependeco datiĝas de 1839.
1804	travel	Safario estas eble la plej alloga afero por turistoj en Afriko kaj tio plej elstara por multaj vizitantoj.
533	sports	La ludo estas ludata sur herbejo, kaj la herbo ĉirkaŭ la truo estas tondita pli mallonge, oni nomas tion verdaĵo.
434	politics	Luksemburgio ĉiam klopodis resti neŭtrala lando, sed ĝi estis okupita de Germanio kaj dum la unua mondmilito kaj dum la dua mondmilito.
128	entertainment	La arta evento estas ankaŭ parto de kampanjo fare de Bukareŝta Urbestraro, kiu penas reŝarĝi la bildon de la Rumania ĉefurbo kiel kreema kaj bunta metropolo.
810	sports	Kvankam kanjonado kombinas elementojn de naĝo, grimpo kaj salto, tamen oni bezonas relative malmulton da trejniteco aŭ bonfizika stato por komenci fari ĝin (en komparo kun rokogrimpado, aparatplonĝado aŭ alpa skiado, ekzemple).
1327	science/technology	Kometoj eventuale povas esti fonto de akvoliverado por la Tero, kaj ankaŭ de organika materio, kiu povas formi proteinojn kaj subteni vivon.
638	science/technology	En 1977 doktoro Damadian finis konstruadon de la unua “plenkorpa” MRB-skanilo, kiun li nomis ”Indomitable”.
269	sports	21-jara Jesus aliĝis al Manchester City pasintan jaron, en januaro de 2017, de brazila klubo Palmeiras kontraŭ raportita pago de 27 milionoj da pundoj.
1364	science/technology	Tigro estas en la sama grupo (Genus Panthera) kun leonoj, leopardoj kaj jaguaroj. Tiuj ĉi kvar katoj estas la solaj, kiuj povas rori.
989	geography	Glaĉeroj estas nestabilaj kaj ili suprenfluas el la montoj. Ĉi tio estigos fendojn aŭ faŭltojn, kiujn neĝaj pontoj povas kaŝi.
864	health	Ĉi tial okazas la skurĝoj de Delhi Belly, la malbeno de la faraono, la venĝo de Moktezumo kaj iliaj multaj amikoj.
595	science/technology	Ĉelo estas la plej malgranda struktura kaj funkcia unuo de viva (estaĵo) organismo.
571	science/technology	Kiam la individuoj montras kelkajn variaĵojn de certa trajto, ili estas plurformaj.
924	science/technology	Reguloj pri ordinara fotado validas ankaŭ por filmado, sed eble eĉ pli multe.
570	science/technology	Kiam ĉiuj individuoj en populacio estas identaj laŭ certa fenotipa eco, ili estas konataj kiel unuformaj.
1273	sports	Kvar skiistoj en la virina grupo de sidantoj fiaskis fini siajn kurojn, kaj 45 el la 117 skiistoj en la giganta slalomo fiaskis kvalifikiĝi en la vetkuro.
1400	politics	"Sur la malantaŭo de la Deklaro de Sendependeco estis la vortoj: ""Originala Deklaracio de Sendependeco datita la 4an de julio 1776""."
664	travel	Al multo da familioj en Usono, vojaĝo al Walt Disney World egalas al gravega pilgrimo.
1737	travel	Komunaj taksioj estas rapidaj kaj komfortaj transportiloj por veturi al proksimaj lokoj, kiel Paro (150 Nu) kaj Punakha (200 Nu).
457	science/technology	Alia malavantaĝo de zomaj lensoj estas, ke la maksimuma aperturo (rapido) de la lenso estas kutime malpli alta.
1051	politics	La unua inter ĝiaj 78 rekomendoj estas, ke nova diplomatia iniciato devas esti entreprenita ĝis la fino de tiu ĉi jaro por sekurigi la limojn de Irako kontraŭ malamikaj enmiksiĝoj kaj por reestabli diplomatiajn rilatojn kun ĝiaj najbaroj.
870	travel	Se vi intencas kampadi, kunportu kampadan faldliteton aŭ hamakon por teni vin for de serpentoj kaj skorpioj, inter aliaj.
1735	travel	Ĉar la interdistriktaj busoj ofte estas homplenaj, estas konsilinde aĉeti bileton kelkajn tagojn antaŭe.
1852	sports	Pensu pri la skia itinero, kvazaŭ ĝi similus al migrada itinero.
816	sports	Sukcedinte Go Running Tours, la Global Running Tours interligas dekojn da provizantoj de turisma kurado en kvar kontinentoj.
986	geography	Tipaj al Norvegujo estas krutaj fjordoj kaj valoj, kiuj subite cedas la pason al ebenaĵo alta kaj pli-malpli plata.
1786	travel	Vojaĝaj agentoj ofte havas interkonsentojn kun specifaj hoteloj, sed vi eble povos rezervi per tiaj agentoj alispecajn loĝejojn, kiel kampadejojn.
833	travel	Ĉi tio eble postulas, ke oni plenigu formularon ĉe la loka policejo aŭ iru al la enmigradaj oficejoj.
597	science/technology	Se vi rigardos vivajn estaĵojn per mikroskopo, vi vidos, ke ili konsistas el malgrandaj kvadratoj aŭ globoj.
1281	health	Komence li estis akceptita en malsanulejon James Paget en Great Yarmouth.
1472	politics	La armeajn elspezojn de usona imperiismo en konkero de Filipinoj pripagis mem la filipina popolo.
1011	sports	Ni konsentas kun la deklaro de UOK pri tio, ke la interesoj de niaj atletoj kaj kluboj, kaj ankaŭ ilia sporto, povas esti pli bone provizitaj per moviĝo antaŭen kun signifaj ŝanĝoj ene de nia organizo, ol per senigo je atestilo.
1674	science/technology	Tio provizas al ni multe da informo kaj materialo por konstrui simulmodelojn, kiuj helpas al ni kompreni procezojn en nia menso.
805	health	Konsideru tion, ke vi ricevu okulekzamenon en via lando, precipe se via asekuro kovras ĝin, kaj ke vi kunportu la preskribon por plenumi ĝin en alia loko.
1542	politics	Du jarojn post la fino de la milito, la iamaj aliancanoj jam estis malamikoj, kaj la malvarma milito komenciĝis.
134	science/technology	Ruĝan tajdon kaŭzas pli alta ol kutime koncentriĝo de Karenia brevis, trovebla en naturo unuĉela mara organismo.
740	geography	Ĝi estas arkipelago kun 15 insuloj disaj en 2,2 milionoj da kvadrataj kilometroj sur maro.
1183	health	Supozataj kazoj de H5N1 en Kroatio kaj Danio restas nekonfirmitaj.
1352	science/technology	La satelito estis sendita en kosmon per raketo. Sciencistoj uzas teleskopojn en kosmo, ĉar la atmosfero de la Tero distordas parte lumon kaj vidaĵon.
1880	travel	Vojaĝantoj, kiuj planas seksoŝanĝ-operacion eksterlande, devas certiĝi, ĉu ili portas validajn dokumentojn por la reveno.
1588	science/technology	La ĉefa celo de scienco estas kompreni per scienca metodo, kiel la mondo funkcias. Tiu metodo fakte gvidas plejparton de scienca esplorado.
877	health	Infekta malsano estas tia, kies kaŭzo estas patogena agento, ekzemple virusoj, bakterioj, fungoj aŭ aliaj parazitoj.
1851	sports	Ĝi rilatas al alpa-stila skia migrado aŭ montogrimpado, sed ĝi kutime ne implicas ilin, ĉar ĉi tiuj lastaj okazas sur kruta tereno kaj postulas multe pli rigidajn skiojn kaj botojn.
1152	sports	Ilia disciplinita defendado, pilkmanuma kapablo kaj bonega teama laboro apartigis ilin kaj estis evidente, ke ili estis la venkinda teamo.
1082	politics	Administranto de Vikikomunejo Adam Cuerden esprimis sian frustriĝon pro la forigoj, komentante por Vikinovaĵoj pasintan monaton.
1241	science/technology	Ĉirkaŭ 3 minutojn post la lanĉo, surŝipa kamerao montris multajn pecojn de izolŝaŭmo defali de la fuelujo.
1190	politics	"Perry deklaris, ke li ""revenus al Teksaso por rekonsideri la rezultojn de la ĉi-vespera kunveno, por decidi, ĉu estas vojo antaŭen por mi mem en tiu ĉi konkurado"", sed pli poste diris, ke li restas en la konkurado kaj partoprenos la Sud-Karolinan antaŭelekton la 21an de januaro."
498	health	Dum multaj jarcentoj la Romia imperio gvidis al grandaj gajnoj en la kampo de medicino kaj formis multon el la scio, kiun ni havas hodiaŭ.
276	politics	Stearns enketas, ĉu impostoj estas uzataj por financi abortigojn per Planned Parenthood, en sia rolo de prezidanto de la Subkomitato pri Kontrolo kaj Enketado, kiu estas sub ombrelo de la Komitato pri Energio kaj Komerco ĉe la Domo de Reprezentantoj.
1865	travel	Se oni ekdeklaras vojaĝaverton kontraŭ la vizitota lando, tio eble influos vian vojaĝan san-asekuron aŭ vian asekuron kontraŭ nuligo de vojaĝo.
1337	science/technology	Esploristoj de Univeresitato Princeton en Usono kaj Upsala Universitato en Svedio rakontis, ke la novaj specioj evoluis nur en du generacioj, kvankam tiu procezo kredeble okupis pli da tempo, pro pariĝo inter endemia darvina fringo, Geospiza fortes, kaj la enmigrinta kakta fringo, Geospiza conirostris.
1264	politics	Huhne eksiĝis kaj estos anstataŭita en la registaro de parlamentano Ed Davey. Parlamentano Norman Lamb, kiel oni atendas, reprenos la postenon de ministro pri komerco, kiun Davey forlasas.
1790	entertainment	En kelkaj festivaloj, la plej granda parto de la ĉeestantoj decidas kampi surloke kaj la plimulto konsideras tion esenca parto de la sperto.
490	politics	Kvankam fine Ĥruŝĉov sendis tankojn por restarigi ordon, li ja cedis al kelkaj ekonomiaj postuloj kaj konsentis nomumi la popularan Wladyslaw Gomulka kiel ĉefministron.
827	travel	Tiuj, kiuj estas pretaj oferi komforton, tempon kaj antaŭvideblecon por redukti kostojn preskaŭ al nenio, vidu vojaĝojn je minimuma buĝeto.
1433	science/technology	Ĝi deklaras, ke la plej efekta loko de la ĉefa subjekto estas ĉe la kruciĝo de linioj, kiuj dividas la bildon je trionoj vertikale kaj horizontale (vidu ekzemplon).
1939	geography	Izmiro estas la trie plej granda urbo en Turkujo, kun loĝantaro de ĉirkaŭ 3,7 milionoj, la due plej granda haveno post Istanbulo kaj tre bona nodo de transporto.
720	geography	Aldone al la blanksablaj plaĝoj kaj montaj pejzaĝoj, la lando havas la plej malnovan eŭropan urbon en Ameriko, kiu nuntempte estas parto de Sandomingo.
1198	sports	Mitchell Gourley de Aŭstralio finis la dekunua en la vira stara Super-G. Ĉeĥa partoprenanto Oldrich Jelinek finis la deksesa en la vira sida Super-G.
153	geography	Tio kredeble estas la kvina fojo en historio, kiam homoj spektis ion, kio evidentiĝis esti kemie konfirmita marsa materialo falinta sur la Teron.
1206	health	Hamilton konfirmis, ke la malsanulejo de la Universitato Howard akceptis la pacienton en stabila kondiĉo.
1828	travel	Estas rimarkinde, ke poŝtelefona servo estas tamen multe pli forta ĉi tie ol en multaj aliaj sekcioj de la vojo, ekzemple Pennsylvania Wilds.
1207	health	La paciento vizitis Niĝerion, kie kelkaj kazoj de ebolo okazis.
522	health	Kun malpli da ROM-oj dum nokto, tiu stato por havi veran dormon kaj ripozon de la korpo, iĝas malpli ofta sufiĉe por kaŭzi problemon.
821	travel	Vojaĝaj agentejoj ekzistas ekde la 19a jarcento. Servo de vojaĝa agento estas kutime uzinda por vojaĝo, kiun oni projektas super sia antaŭa vojaĝa sperto koncerne naturon, kulturon, lingvon aŭ malriĉajn landojn.
1064	sports	Sed post perdo de la kapitana pordeto, Barato faris nur 36 kurojn, perdinte 7 pordetojn por fini la transdonojn.
306	health	Kiel kaŭzo de morto estas anoncita enhepata koledoka kancero.
1478	science/technology	Teknologia determinado estas termino kiu praktike kovras vastan gamon da ideoj, de teknologia puŝo aŭ la teknologia imperativo ĝis strikta senco ke homan destinon pelas subkuŝa logiko ligita al sciencaj leĝoj kaj ilia manifestiĝo en teknologio.
529	sports	La sporton oni ĉefe praktikas en duela formato, unu skermanto duelas kun alia.
340	health	Zayat ne estis vundita en la akcidento.
1993	travel	Ili krome prezicigas itinerojn de konataj vojoj por migrado kaj bicikado.
350	science/technology	Tio tamen estas tre malfacile solvebla problemo, pasos jaroj ĝis kiam ni vidos konstruitajn utilajn fuziajn reaktorojn.
1724	travel	La insulo Hongkongo donas al la teritorio Hongkongo ties nomon kaj ĝi estas la loko, kiun multaj turistoj rigardas kiel tiun plej interesan.
1013	sports	USA Gymnastics kaj la UOK havas la saman celon — fari la gimnastikan sporton, kaj la aliajn, laŭeble plej sekura, por ke sportistoj sekvu siajn revojn en sekura, pozitiva kaj plenpova medio.
1380	science/technology	Ne ne certas, sed povas esti, ke ĝi havis bifidan langon. Ĝia dieto inkluzivis testudojn, grandajn fiŝojn, aliajn mozasaŭrojn, kaj eble ĝi eĉ estis kanibalo.
94	travel	La aviadilo flugis al Irkutsk kaj estis sub administrado de la internaj trupoj.
758	travel	Vojaĝanto kun amaso da mono povus pripensi flugadon ĉirkaŭ la mondo interrompitan de restadoj en multaj el tiuj ĉi hoteloj.
1066	politics	Lin bonvenigis singapura vicpremiero Wong Kan Seng, kaj li diskutis problemojn de komerco kaj terorismo kun la singapura ĉefministro Lee Hsien Loong.
22	politics	Malgraŭ tiuj akuzoj, Ma gajnis facile sur platformo por firmigo de rilatoj kun la ĉina ĉeftero.
1415	sports	La nacia futbalteamo de Italio, kaj ankaŭ la nacia futbalteamo de Germanio, estas la dua plej sukcesa teamo en la mondo kaj estis ĉampionoj de la Mondpokalo de FIFA en 2006.
63	politics	La Nacia Kongreso de Brazilo debatis pri legiĝo dum 10 jaroj, kaj tiaj civilaj edziĝoj nuntempe estas laŭleĝaj nur en Rio Grande do Sul.
753	travel	Suraŭta tendumado estas ebla, se vi havas grandan unukorpan aŭton, SUV, kvarpordan aŭton aŭ kombinaŭton kun kuŝigeblaj seĝoj.
1625	geography	La ĉefa rivero Amazono estas 6387 km (3980 mejlojn) longa. Ĝi kolektas akvon el kelkmil pli malgrandaj riveroj.
372	science/technology	Aliaj sciencistoj argumentas, ke tiuj plantoj estas tre venenaj, do ne estas verŝajne, ke dinosaŭroj entute manĝis ilin, malgraŭ tio ke hodiaŭ bradipo kaj aliaj animaloj, kiel papago (posteulo de dinosaŭroj), povas manĝi venenajn foliojn kaj fruktojn.
227	geography	Sciencistoj malkovris landformojn superŝutitajn tra la luna surfaco, nomatajn lobaj deklivoj, kiuj evidente rezultiĝas de malrapida kuntiriĝo de la Luno.
634	science/technology	MRB funkcias baze de fizika fenomeno konata kiel nuklea magneta resonanco (NMR), kiu estis malkovrita en la 1930aj jaroj de Felix Bloch (laborinta en Universitato Stanford) kaj Edward Purcell (de Universitato Harvard).
962	politics	Kun armena subteno, oni kreis novan respublikon. Sed tamen neniu establita nacio, eĉ ne Armenujo, oficiale agnoskas ĝin.
568	science/technology	La diversaj aranĝoj havas diversajn kapablojn, respondas al diversaj ondolongoj kaj havas diversajn gradojn de sentemo, ili krome bezonas diversan prilaboron por kompreni la datenojn kaj diversan kvanton por optimuma funkciado.
193	sports	Schumacher, emerita de 2006 post kiam li venkis la ĉampionecon de Formula 1 sep fojojn, devis anstataŭi la vunditan Felipe Massa.
1016	politics	Kiel KNS li asistis Carter pri diplomatia traktado de la mondaj aferoj, kiel la agordoj de Camp David en 1978; normaligo de la rilatoj inter Usono kaj Ĉinio en la malfruaj 1970-aj; la Irana Revolucio, kiu sekvigis la Iranan ostaĝan krizon; la Sovetia invado en Afganion en 1979.
675	travel	Kun zorga planado, tio ĉi estas farebla per ordinara aŭto, sed uzi 4×4 estas tre konsilinde kaj estas multaj lokoj nur alireblaj per 4×4 kun granda interaksa distanco.
329	sports	En la tempo de sia partopreno en la teamo, li enpafis 403 golojn en 468 ludoj.
402	science/technology	Submarŝipoj uzatis en la unua kaj la dua mondmilito. Tiam ili estis ankoraŭ tre malrapidaj kaj havis limigitan pafdistancon.
