index_id	category	text
25	sports	Tiun vesperon la unua efika transdono fare de Oveĉkin helpis novulon Nicklas Backstorm fari ludovenkan golon.
1606	science/technology	Scienco nun indikas, ke tiu amasa karbona ekonomio formovis la biosferon de unu el ĝiaj stabilaj statoj, kiu estis subtenanta homan evoluon dum la lastaj du milionoj da jaroj.
79	sports	La du flankoj renkontiĝis en la granda duonfinalo, kie Noosa antaŭis la venkintojn je 11 poentoj.
952	travel	Vi eble pensas, ke estas intuicie aliĝi al la flugkompanio, per kiu vi plej ofte flugas, sed vi devus konscii, ke la proponitaj privilegioj estas ofte malsamaj, kaj ke la poentoj de ofta fluganto povas esti pli multaj en alia flugkompanio sub la sama alianco.
995	travel	Inter aliaj flugkompanioj, proponas ĉi tiajn tarifojn Air Canada, Delta Air Lines, Lufthansa (en flugoj el Usono kaj Kanado) kaj WestJet.
266	science/technology	Rusia surtera kontolejo aktivigis la fuzilojn, kaj la normala pozicio de la stacio estis reakirita.
112	politics	La decido de s-ro Rudd subskribi la klimatan interkonsenton de Kioto izolas Usonon, kiu estos de nun la sola evoluinta lando, ne ratifinta la interkonsenton.
1050	politics	La raporto multe kritikas preskaŭ ĉiun nuancon de la nuna politiko de la ekzekutivo rilate Irakon kaj ĝi instigas al tuja ŝanĝo de direkto.
1609	travel	Kial transportaj sistemoj sekvigas tiajn plendojn, kial ili malsukcesas ĉiun tagon? Ĉu transport-inĝenieroj estas simple nekompetentaj?
1316	sports	Ankaŭ kolegoj luktistoj omaĝis Lunan.
291	geography	La signifa tertrema aktiveco, el kiu rezultis la fazŝanĝo, okazis la 10an de marto ĉe la nord-orienta flanko de la kaldero ĉe la vulkansupro.
1215	travel	La fruaj raportoj diras, ke la aviadilo revenis al Afganio post kiam oni malpermesis, ke ĝi faru krizan alteriĝon en Urumĉio.
1270	sports	Krom la merkreda evento, Carpanedo konkuris en du individuaj vetkuroj ĉe la Ĉampionecoj.
663	entertainment	San-Francisko estas krome inter la plej oportunaj lokoj en la lando rilate aliajn aziajn kuirartojn: la korean, la tajan, la hindan kaj la japanan.
91	politics	Lodin krome diris, ke oficialuloj decidis nuligi la duan fazon de elektoj por ŝpari por afganoj la kostojn kaj la sekurecajn riskojn de pliaj elektoj.
371	science/technology	Triceratopo eble uzis sian fortan bekon por deŝiri la foliojn antaŭ manĝado de la trunko.
1806	travel	Kelkaj bestoj, kiel elefantoj kaj ĝirafoj, emas alproksimiĝi al aŭtoj, kaj ordinaraj iloj havigas bonan rigardadon.
930	travel	Vi eble ne bezonas vizon por mallonge iri en iujn landojn kiel turisto aŭ por negoco, sed iri kiel internacia studento ĝenerale bezonas restadon pli longan ol viziti kiel ordinara turisto.
33	sports	Piquet la juna estis maldungita post la Hungara Grand Prix de la jaro 2009.
0	health	Kiel anoncis lunde sciencistoj de la Medicina Lernejo ĉe la Universitato Stanford, ili inventis novan diagnozilon, kiu povas ordigi ĉelojn laŭ tipo: eta presebla integra cirkvito, kiu povas esti produktata per kutima inkŝpruca presilo kontraŭ eble ĉirkaŭ unu usona cendo po ĉiu.
200	geography	Felicia, antaŭe klasifikita kiel ŝtormo de kategorio 4 laŭ la uragana skalo de Saffir-Simpson, malfortiĝis ĝis tropika depresio antaŭ malapero en mardo.
873	entertainment	Se vi sentas vin pli aventurema, profitu la okazon por prepari kelkajn sukojn aŭ fruktokirlaĵojn:
774	entertainment	Internaciaj Hortikulturaj Ekspozicioj estas specialigitaj eventoj, kie montriĝas floraj prezentadoj, botanikaj ĝardenoj kaj io ajn rilate plantojn.
1377	science/technology	Ni konstruas niajn domojn el plantoj kaj faras vestojn el plantoj. Plejparto de manĝaĵoj, kiujn ni manĝas, estas vegetaĵoj. Sen vegetaĵoj animaloj ne povus pluvivi.
203	geography	Pluvoj estis parte akompanataj de tondro kaj oftaj fulmoj.
1365	science/technology	La tigra roro ne estas kiel la plenvoĉa roro de leono, sed pli kiel frazo el raŭkaj, elkriaj vortoj.
1176	sports	Estis la finala matĉo por All Blacks, jam gajnintaj la trofeon du semajnojn antaŭe.
879	health	Multaj registaroj postulas, ke la vizitantoj, kiuj eniras la landon, kaj la loĝantoj, kiuj foriras la landon, estu vakcinitaj kontraŭ diversaj malsanoj.
110	science/technology	Stardust establos novan tuttempan rekordon kiel la plej rapida kosmoŝipo revenanta sur la Teron, superante la antaŭan rekordon establitan en majo de la jaro 1969 dum la reveno de la komanda modulo de Apollo X.
1494	science/technology	Vivtena agrikulturo estas simpla, ofte organika, sistemo uzanta ŝparitajn semojn indiĝenajn por la ekoregiono kun rotacio de kultivaĵoj aŭ aliaj relative simplaj teknikoj por grandigi rikolton.
1086	science/technology	La teamo serĉis la efikon, kiun kaŭzus la tajdaj fortoj inter la malluma materio de la galaksio kaj la malluma materio de la Lakta Vojo.
1623	geography	Amazono estas ankaŭ la plej larĝa rivero sur la Tero, foje ses mejlojn larĝa.
1222	entertainment	La rokbando devis turnei tra Usono kaj Kanado ĝis la 16a de septembro.
1357	science/technology	Fine, estas multaj malgrandaj katoj (inkluzive de senhejmaj dorlotkatoj), kiuj manĝas la multe pli grandnombran predon kiel insektojn, ronĝulojn, lacertojn kaj birdojn.
216	sports	Skvaŝo, karateo kaj rulsketado provis eniri la olimpian programon, kiel ankaŭ basbalo kaj softbalo, kiujn oni voĉdone eksigis de la Olimpiaj Ludoj en 2005.
327	sports	Naskita en kroata ĉefurbo Zagrebo, Bobek gajnis popularecon ludante por Partizan de Beogrado.
277	politics	Eksa ŝtatestro de Masaĉuseco Mitt Romney gajnis la antaŭbaloton de la Respublikana Partio en Florido marde kun pli ol 46 elcentoj de la voĉoj.
428	geography	La teritorio de Turkio estas pli ol 1600 kilometrojn (1000 mejlojn) longa kaj 800 km (500 mejlojn) larĝa, kun pli-malpli ortangula formo.
1709	travel	Goma estas turisma urbo de la Demokratia Respubliko Kongo en la ekstrema oriento apud Ruando.
565	health	Tiuj, kiuj partoprenis en regula aktivado, bezonis pli da subteno koncerne la negativan percepton de doloro, komprenante la diferencon inter kronika doloro kaj malkomforta sento pro normala fizika moviĝo.
742	travel	Kvankam ĝi estas pli malgranda, ĝi elvokas ĉe la maljunaj vizitantoj tian Havajon, kia ĝi estis, antaŭ ol ĝi fariĝis ŝtato, sen ĉiuj tiuj grandegaj turismaj hoteloj kaj konstruaĵoj.
531	sports	Dum normala raŭndo oni ludas per dek ok truoj, ludantoj kutime komencas de la unua truo de la golfejo kaj finas je la dek oka.
729	travel	Bowen Island estas populara por unutaga aŭ semajnfina ekskurso, proponante kajakadon, marŝadon, butikojn, restoraciojn kaj pli.
1427	science/technology	Ekzemple, la plej kutima en la mondo formato por foti senmovajn bildojn estas 35 mm, kiu estis la dominanta filma dimensio ĉe la fermo de la epoko de analoga filmo.
865	health	Same kiel problemoj pri spiro en malpli varmaj klimatoj, intestaj problemoj estas tre oftaj en varmaj klimatoj, sed en la plejparto de la kazoj ili estas sendube ĝeno sed ne vera danĝero.
205	travel	Proksimume dek minutojn antaŭ kiam ĝi devis alteriĝi laŭ la dua provo, ĝi malaperis.
374	science/technology	Persono, kiu pezas 200 funtojn (90 kg) sur la Tero, pezus ĉirkaŭ 36 funtojn (16 kg) sur Iono. Do la gravito certe altiras vin malpli.
275	politics	Politiko de Komen ekskvalifikis Planned Parenthood pro la daŭra enketado pri tio, kiel Planned Parenthood elspezas kaj raportas pri sia mono, gvide de Representative Cliff Stearns.
1991	travel	Enlandaj akvovojoj povas esti bona temo, sur kiu oni bazu feriojn.
349	science/technology	Sciencistoj laboras pri kreado de reaktoro, kiu povus don energion en la sama maniero.
1325	science/technology	Curtis Cooper, profesoro pri matematiko kaj komputilscienco ĉe la Universitato de Centra Misurio, la 25an de januaro malkovris la plej grandan konatan por hodiaŭ priman nombron.
1854	travel	Eŭropo estas relative eta mondoparto, sed ĝi havas multajn sendependajn landojn. En normalaj cirkonstancoj, por vojaĝi tra plurajn landojn oni bezonas refoje plenumi vizopetojn kaj pasportkontrolojn.
946	geography	La kanalo Blanka Maro-Balta Maro estas kunligo de la Arkta Oceano kun la Balta Maro tra la lagoj Onega kaj Ladoga kaj Sankt-Peterburgo, ĉefe per riveroj kaj lagoj.
182	politics	"""Estas grave nun kaj de la vidpunkto de publika sanprotektado kaj vidpunkte de perspektivo de juĝagado, ke la leĝo estu akceptita laŭeble plej baldaŭ"", diris registara proparolanto."
1288	politics	La dokumento, laŭ la liko, referencos la disputon pri limoj, kiujn Palestino volas havi baze de la limoj antaŭ la mezorienta milito de la jaro 1967.
1639	science/technology	Atomoj estas tiel nekredeble malgrandaj, ke trilionoj da ili povus ŝoviĝi en punkton fine de tiu ĉi frazo.
69	entertainment	La bando nuligis la koncerton ĉe War Memorial Stadium en Maui, kiu devis kolekti 9 000 personojn, kaj petis pardonon de fanoj.
12	sports	Antaŭ nelonge li malgajnis al Raonic en Brisbane Open.
508	health	"Atentomanka perturbo ""estas neŭrologia sindromo, kies klasika difino estas trio da simptomoj inkluzive de impulsemo, distriĝemo kaj hiperaktiveco aŭ ekscesa energio""."
1794	travel	Se vi navigos nordan Baltikon vintre, zorgu pri la loko de la kajuto, ĉar iro tra glacio kaŭzas sufiĉe teruran bruon en tiuj plej trafitaj.
667	entertainment	Multaj biletoj vendataj interrete en aŭkciaj retejoj kiel eBay aŭ Craigslist estas parte uzitaj biletoj por pluraj tagoj kaj parkoj.
127	entertainment	Multaj iliaj verkistoj antaŭeniris ĝis havi grandan influon sur la parodiajn novaĵesendajn spektaĵojn de Jon Stewart kaj Stephen Colbert.
1236	sports	Giancarlo Fisichella perdis kontrolon pri la aŭto kaj finis la vetkuron tre rapide post la starto.
160	sports	Stewart, Gordon, Kenseth kaj Harvick finas la dekon de la plej bonaj pozicioj en la Stirista Ĉampioneco dum kvar vetkuroj restas en la sezono.
1732	geography	Sundarbans kovras areon de 3850 km², el kiu proksimume unu triono estas kovrita de akvo aŭ marĉoj.
1940	geography	Estinte iam la antikva urbo Smirno, ĝi estas nun moderna, evoluinta kaj vigla komerca centro, situante ĉe grandega golfo kaj ĉirkaŭite de montoj.
37	entertainment	Ĉi tiu programero de PBS havas pli ol du dekduoj da Premioj Emmy, kaj ĝia daŭro estas nur iom malpli ol tiu de Sesame Street kaj Mister Rogers' Neighborhood.
726	entertainment	Estas kelkaj restoracioj ĉirkaŭ la ĝardeno kaj posttameze kaj vespere oni ofte donas senpagajn koncertojn el la centra kiosko.
1507	science/technology	Skafaldumado povas esti kaj virtuala kaj reala, en aliaj vortoj, kaj instruisto estas varianto de skafaldo kaj la malgranda paperklipo en Microsoft Office.
1318	sports	"Dustin ""Goldust"" Runnels komentis, ke ""Luna estis same strangega, kiel mi... eble eĉ pli... mi amas ŝin kaj mi sopiros pri ŝi... espereble ŝi estas en pli bona loko."""
379	science/technology	Fazoj okazas, ĉar nur unu flanko de Venuso (aŭ de la Luno) fronte al la Suno estas prilumita. La fazoj de Venuso kongruis kun la teorio de Koperniko, ke la planedoj iras ĉirkaŭ la Suno.
1237	sports	Lia samteamano Fernando Alonso gvidis plejparton de la vetkuro, sed finis ĝin tuj post sia reviviga halto, eble pro malbone ŝovita dekstra antaŭa rado.
375	science/technology	La Suno, malkiel la Tero, ne havas kruston, sur kiu vi povus stari. La tuta Suno konsistas el gasoj, fajro kaj plasmo.
1736	travel	La plimulton de la distriktoj ligas etaj japanaj busoj Coaster, kiuj estas komfortaj kaj fortikaj.
534	travel	Verŝajne la plej ordinara tipo de turismo estas kion plej multaj homoj asocias kun vojaĝado: distra turismo.
48	sports	S-ro Reid sukcesis stiri la Nov-Zelandan A1GP aŭton, Black Beauty, kun rapideco super 160 km/h sep fojojn tra la ponto.
246	politics	"Ekde sendependiĝo de Pakistano de la Brita regado en 1947, la pakistana prezidento nomumis por regi en FATA ""politikajn agentojn"", kiuj plenumas preskaŭ kompletan aŭtonomian kontrolon super la areoj."
1217	politics	Pro internaciaj sankcioj, novaj flugaparatoj ne estas aĉeteblaj.
1916	entertainment	Malgraŭ tio, ke la ĉebordaj arkipelagoj kaj la plej grandaj lagoj estas fakte sufiĉe grandaj por ĉia jaĥto, malpli grandaj boatoj kaj eĉ kajako donas alian sperton.
1192	health	La fotisto estis transportita al Medicina Centro Ronald Reagan de UCLA, kie li pli poste mortis.
559	science/technology	Protonoj havas pozitivan elektran ŝarĝon, kaj neŭtronoj havas neniun ŝarĝon. La elektronoj havas negativan elektran ŝarĝon.
107	geography	Kiam la kapsulo atingos la Teron kaj eniros la atmosferon ĉirkaŭ la 5a antaŭtagmeze (orienta tempo), ĝi atendeble iĝos luma spektaĵo por loĝantoj de Norda Kalifornio, Oregono, Nevado kaj Utaho.
549	sports	Certe unuaranga duonmejlulo, persono kiu povas venki du minutojn, devas disponi certan rapidecon, sed eltenemo ĉiel devas esti akcelata.
1923	travel	Veturi per aviadilo povas esti timiga sperto negrave aĝon kaj devenon, precipe se oni neniam flugis aŭ se oni travivis traŭmatan sperton.
126	entertainment	Al Gore kaj generalo Tommy Franks porokaze citas siajn ŝatatajn kapliniojn (tiu de Gore estis la raporto de The Onion pri tio, kiel li kaj Tipper havis la plej bonan seksumadon de sia vivo post lia malgajno en la voĉdono de elektantaro en 2000).
983	health	La birda gripo (birda influenco en pli formala dirmaniero) kapablas kaŭzi infekton kaj al birdoj kaj al mamuloj.
915	science/technology	Kelkaj el la aplikaĵoj de ĉi tiu kategorio eĉ povas traduki en fremdajn lingvojn tekstojn de afiŝoj aŭ aliaj objektoj de la reala mondo, kiam la uzanto direktas saĝtelefono al tiuj objektoj.
330	sports	Alia homo neniam partoprenis pli da ludoj aŭ enpafis pli da goloj por la klubo ol Bobek.
563	health	La studo malkovris, ke deprimo, timo kaj emo al malbonaj atendoj peris la rilaton inter doloro kaj handikapo inter la suferantoj pro sakrodoloro.
496	health	Ĥirurgoj havis scion pri diversaj sedativoj, inter aliaj pri morfino el ekstrakto de papavaj semoj kaj skopolamino el hiskiamaj semoj.
919	science/technology	Tio povas ŝparigi al vi la monon de aĉeto, jen de novaj mapoj por navigilo, jen de aparta navigila aparato, aŭ de luo de navigilo el kompanio de luaŭtoj.
1504	science/technology	Edukita nur de nehomaj animaloj, la sovaĝiĝinta infano montras kondutojn (kadre de fizikaj limigoj) preskaŭ tute similajn al tiuj de la certa zorganta animalo, kiel ankaŭ ĝia timo aŭ indiferento rilate homojn.
1422	politics	En 1683 trupoj de la dinastio Qing (1644-1912) okupis okcidentan kaj nordan bordajn areojn de Tajvano kaj proklamis Tajvanon provinco de Imperio Qing en 1885.
202	geography	"La precipitaĵo ĝis 6,34 coloj laŭ mezurilo sur Oahu, estis priskribita kiel ""utila""."
109	science/technology	La kapsulo moviĝos kun rapido ĉirkaŭ 12,8 km aŭ 8 mejloj sekunde, sufiĉe rapide por veturi de San-Francisko ĝis Los-Anĝeleso dum unu minuto.
1521	science/technology	Li eĉ supozas, ke tiaj kapabloj interpreti homan konduton povas esti kunhavitaj de animaloj tiaj kiel hejmaj hundoj.
1479	science/technology	Plej multaj interpretoj de teknologia determinismo kunhavas du ĝeneralajn ideojn: ke la evoluo de teknologio mem sekvas vojon grandparte preter kulturaj aŭ politikaj influoj, kaj ke teknologio siavice havas por socioj „sekvojn” esence proprajn, kaj ne socie kondiĉitajn.
1163	politics	Kandidatoj povas sendi reprezentantojn por atesti ĉiun fazon de la procezo. Vespere volontuloj kalkulas la voĉojn sub atenta kontrolo, laŭ specifaj proceduroj.
1696	geography	La plimulto de la pli etaj insuloj estas landoj sendependaj aŭ ligitaj al Francio, kaj konataj kiel luksaj plaĝaj feriejoj.
866	travel	Se vi vojaĝas al evolulando unuafoje, aŭ al nova parto de la mondo, ne subtaksu la eventualan kulturan ŝokon.
1809	sports	Paralimpikoj estos inter la 24a de Aŭgusto kaj la 5a de Septembro 2021. Kelkaj okazaĵoj estos en aliaj lokoj de la tuta Japanujo.
119	entertainment	La ludo sin bazas sur la Dua Batalo de Faluĝa, brutala batalo inter usonaj kaj irakaj fortoj.
1175	sports	Por la Springboks ĝi finis kvin-matĉan serion de malvenkoj.
198	health	Krom febro kaj gorĝa doloro, mi fartas bone kaj estas en bona formo por plenumi mian laboron per telekomunikiloj.
144	science/technology	"""Tio signifas, ke ĉio devas esti ŝovita malantaŭen"", diris esploristo ĉe la Esplorservo de la Granda Rifto en Etiopio kaj kunaŭtoro de la esploro, Berhane Asfaw."
1167	entertainment	En siaj fruaj tagoj la programo estis prezentita nur ĉe la longdaŭra interretradia paĝaro TogiNet Radio, dediĉita al parola radio.
908	science/technology	La kompanioj de amaskomunikiloj rutine mensogas pri ties celo, asertante, ke ĝi estas “malhelpi piratadon”.
1196	sports	Pro tio ke nur dek ok medaloj akireblas dum tago, kelkaj landoj malsukcesis trafi la medalan podion.
111	science/technology	“Ĝi moviĝos super la okcidenta bordo de norda Kalifornio kaj prilumos la ĉielon de Kalifornio tra centra Oregono kaj ĝis Nevado kaj Idaho al Utaho”, diris Tom Duxbury, projekta manaĝero de Stardust.
1722	travel	Same kiel ĉiuj Sudafrikaj Naciaj Parkoj, ekzistas tagaj konservado-enirkotizoj por la parko.
1989	travel	Krome estas kelketaj busoj, kiuj iras norden al Hebron, la tradicia tomboloko de la patriarkoj el la Biblio Abraham, Isaak kaj Jakob kaj ties edzinoj.
512	health	ADP influas rilatojn kun aliaj samaĝuloj, ĉar aliaj infanoj ne povas kompreni, kial ili agas en tia maniero aŭ kial ili literumas tiel aŭ ke ilia nivelo de matureco estas alia.
1182	health	Francio estas la sepa lando de la Eŭropa Unio trafita de tiu ĉi viruso post Aŭstrio, Germanio, Slovenio, Bulgario, Grekio kaj Italio.
393	politics	Germanio kodis la nomon de la atako “Operaco marleono”. Plejparto de la pezaj armiloj kaj provizoj de la brita armeo estis perditaj dum evakuado el Dunkirk, do la armeo estis sufiĉe malforta.
1908	science/technology	La servon ofte uzas ŝipoj, inkluzive de tiuj plezuraj, kaj ankaŭ ekspedicioj, kiuj havas bezonojn de deforaj datumoj kaj voĉo.
592	science/technology	Animaloj konsistas el multaj ĉeloj. Ili ion manĝas kaj digestas tion interne. Plejparto de animaloj povas sin movi.
550	sports	Iom da transterena kurado vintre, kombinita kun laboro en sportejo por la supra parto de la korpo, estas la plej bona preparado por la sezono de kurado.
1210	entertainment	Dum la 1980aj li laboris pri tiaj programoj, kiel Taxi, Cheers kaj The Tracy Ullman Show.
1232	entertainment	Ankaŭ Lakkha Singh prezentis la chhappan bhog bhaĝanon. Lin akompanis kantisto Raju Khandelwal.
1891	travel	Vojaĝantoj, kiuj facile adaptiĝis al la nova kulturo, fojfoje havas apartan malfacilecon readaptiĝi al sia denaska kulturo.
1798	entertainment	Kelkaj lokoj proponas alkoholaĵojn senpage, sed ebrieco difektas mensan kapablecon kaj ĉiu bona vetludanto konscias, kiom gravas esti sobra.
738	travel	CafeNet El Sol peras rezervojn je la tarifo de 30 usonaj dolaroj aŭ de 10 dolaroj por unutagaj biletoj; legu detale en ĝia retejo de Corcovado.
1298	politics	La protestoj, foje perfortaj, estis elvokitaj de malsukcesa organizado de elektoj, kelkaj prokrastitaj de 2011.
577	science/technology	La ĉelo estas la baza unuo de ĉiuj vivaj estaĵoj, kaj ĉiuj organismoj konsistas el unu aŭ pli multaj ĉeloj.
733	sports	Dum la vintro ĝuu kelkajn el la plej bonaj skiadoj en Nordameriko kaj dum la somero provu aŭtentikan montan bicikladon.
1624	geography	Plenaj 20 elcentoj de la akvo, kiu elfluas en la oceanojn el la riveroj de la planedo, venas de Amazono.
185	sports	Li loĝis en hotelo de la teamo antaŭ matĉo kontraŭ Bolonia, planita por dimanĉo.
1158	geography	"""Ilia temperatura konduto ne estas tiel stabila, kiel en grandaj kavernoj de la Tero, kiuj ofte retenas sufiĉe konstantan temperaturon, sed ĝi kongruas kun tiuj, kiuj estas profundaj kavoj en la grundo"", diris Glen Cushing de astrogeologia teamo de la Usona Geologia Esplorejo kaj de la Nord-Arizaona Universitato situanta en Flagstaff, Arizono."
190	travel	Pasaĝeroj ricevis akvon, ĉar ili atendis en 90-grada (F) varmego.
1233	entertainment	Ĵaŭde dum la ŝlosila prezento de Tokyo Game Show, prezidanto de Nintendo Satoru Iwata malkaŝis la aspektigon de la kontrolilo por la nova konzolo de la kompanio Nintendo Revolution.
1548	politics	Plej menciindas inter la lastatempaj ekzemploj la Nord-Atlantika kampanjo de la dua mondmilito. La usonanoj klopodis movi homojn kaj materialojn tra la Atlantika Oceano por helpi Brition.
647	entertainment	Tiel multaj el ni trovas sin mem spektantaj televidprogramon, kiu rakontas al ni pri procezo aŭ sperto, en kiu ni neniam partoprenos, nek aplikos la scion.
1522	science/technology	La esploro en la dudeka jarcento montris, ke estas du aroj de genetika variado: kaŝita kaj reprezentita.
601	science/technology	Nitrogeno kiel gaso plu havas la samajn karakterizaĵojn, kiel likva nitrogeno. La likva stato estas pli densa, sed la molekuloj estas daŭre la samaj.
1747	sports	Argentino estas tre konata pro tio, ke ĝiaj teamoj kaj ludantoj de poloo estas inter la plej bonaj en la mondo.
142	sports	La decido de NBA sekvis pozitivan rezulton de testado de ludisto el Utah Jazz pri la viruso de KOVIM-19.
1802	travel	Videblecon ankaŭ povas limigi jen neĝo falanta aŭ venta, jen kondensado, jen glacio sur la fenestroj de la veturilo.
825	travel	Se vi volas malmultekoste vidi la mondon, ĉu pro bezono, vivstilo aŭ defio, estas kelkaj manieroj fari tion.
1144	politics	Koaliciaj kaj afganaj trupoj eniris la regionon por sekurigi la lokon kaj aliaj koaliciaj flugaparatoj estis senditaj por helpi.
1850	sports	Dorsosakturismo per skioj: Ĉi tiu agado ankaŭ nomiĝas kampa skio, skivojaĝado aŭ skia migrado.
1033	science/technology	Ili trovis, ke la Suno funkcias laŭ la samaj bazaj principoj, kiel aliaj steloj: la aktiveco de ĉiuj steloj en la sistemo evidentiĝis esti pelata de nenio alia krom ilia brilo kaj ilia turniĝado.
1848	sports	La ideo de skiado estas tre malnova: kavernaj pentraĵoj, kiuj prezentas skiantojn, datiĝas jam de 5000 a.K.!
228	geography	Tiuj ĉi deklivoj estas trovitaj ĉie tra la Luno kaj aspektas eroziitaj minimume, indikante, ke la geologiaj eventoj kreintaj ilin, estis relative antaŭnelongaj.
292	geography	Malhelaj nuboj sen rilato al iu vulkana aktiveco estis rimarkitaj ĉe la malsupro de la monto.
1225	sports	Del Potro havis fruan avantaĝon en la dua serio, sed ankaŭ tiu bezonis decidludon, kiam la rezulto atingis 6-6.
1416	sports	Inter popularaj sportoj estas futbalo, basketbalo, volejbalo, akvopoloo, skermo, rugbeo, biciklado, glacihokeo, rulhokeo kaj aŭtosporto F1.
129	entertainment	La urbo estos la unua en sud-orienta Eŭropo gastiganto de CowParade, la plej granda publik-arta evento en la mondo, inter junio kaj aŭgusto de tiu ĉi jaro.
1003	science/technology	Li konstruis WiFi-pordosonorilon, kiel li rakontis.
271	health	D-ro Lee krome esprimis sian zorgon pri raportoj el Turkio, kie infanoj nun infektiĝis de la viruso A(H5N1) de birda gripo sen iĝi malsanaj.
103	politics	La komentoj, rekte elsenditaj per televido, estis la unua fojo, kiam grava irana fonto agnoskis, ke la sankcioj havas ian efikon.
14	sports	"⁣Post la matĉo, Argila Reĝo diris: ""Mi estas simple ekscitita pri la reveno al la finalaj raŭndoj de la plej gravaj eventoj. Mi estas ĉi tie por provi gajni ĉi tion""."
1412	politics	Al la Kongreso mankis ajna potenco kolekti impostojn kaj, ĉar ne estis nacia ekzekutivo aŭ justico, ĝi konfidis plenumon de siaj decidoj al instancoj de la ŝtatoj, kiuj ofte ne estis kunlaboremaj.
1811	travel	Se vi rezervis la flugojn kaj loĝejojn por 2020, antaŭ ol oni anoncis la prokraston, vi verŝajne estas en komplika situacio.
1681	science/technology	Teknologio proponas solvon en formo de virtualaj ekskursoj. Studentoj povas rigardi muzeajn artefaktojn, viziti akvarion aŭ admiri belegan arton, sidante en sia klasĉambro.
335	entertainment	Turka stelulino Sezen Aksu elpaŝis kun la itala tenoro Alessandro Safina kaj greka kantisto Haris Alexiou.
378	science/technology	Post ĉirkaŭ tri mil jaroj, en 1610, itala astronomo Galileo Galilei uzis teleskopon por observi, ke Venuso havas fazojn, ĝuste kiel la Luno.
1367	science/technology	Sciencistoj opinias, ke ocelotoj sekvas kaj trovas manĝeblajn animalojn (predon) per odoro, flarante la spurojn sur la grundo.
703	travel	Ĉar gviditaj vizitoj estas pli ĉipaj por pli grandaj grupoj, se vi estas sola aŭ nur kun unu amiko, provu do renkonti aliajn personojn kaj ariĝu kvarope, kvinope aŭ sesope por havigi al vi pli bonan unuopan tarifon.
297	politics	La proponata amendo jam trapasis ambaŭ domojn en 2011.
80	sports	Maroochydore poste venkis Caboolture en la anticipa finalo.
1823	travel	Senimposta aĉetado estas la eblo aĉeti varojn sendevigite de impostoj kaj akcizoj en certaj lokoj.
836	travel	Arkitekturo rilatas al dezajno kaj starigo de konstruaĵoj. La arkitekturo de loko ofte estas turisma vidindaĵo je propra rajto.
880	travel	Ĉi tiaj kondiĉoj ofte povas dependi de tio, kiujn landojn la vojaĝanto vizitis aŭ intencas viziti.
1143	politics	Ankaŭ la reganta partio, Sud-Okcident-Afrika Popola Organizo (SWAPO), retenis plejmulton en la parlamentaj elektoj.
650	science/technology	Via hotelo aŭ gastigantoj (se vi loĝos en gastejo aŭ privata domo) verŝajne havos vifion aŭ konektitan al interreto komputilon, kaj en ĉiuj loĝlokoj haveblas interretkafejoj aŭ aliaj lokoj kun publika vifio.
702	travel	Via pasporto devas esti valida almenaŭ 6 monatojn post viaj veturdatoj. Vi necesas ir- kaj reven-bileton aŭ preterir-bileton por provi la daŭron de via estado.
1604	travel	Ĉiumatene homoj postlasas urbetojn per aŭtoj por iri al sia laborloko, kaj estas preterpasataj de aliaj, kies celo estas la loko, kiun ili ĵus forlasis.
