index_id	category	text
657	health	La tre longaj tagoj dum somero povas kaŭzi problemojn por akiri sufiĉan dormon, inter aliajn rilatajn sanproblemojn.
948	travel	Kompreneble, kiam vi alvenos al la plezurhaveno, ĉio estos tre antaŭvidebla. Vi renkontos aliajn boatajn petveturantojn kaj ili donos sian informon al vi.
1892	travel	Revenante hejmen post kiam vi loĝis eksterlande, vi jam adaptiĝis al la nova kulturo kaj perdis kelkajn kutimojn el la denaska kulturo.
1707	travel	Rilate butikumadon, Kazablanko estas inter la plej seninteresaj lokoj tra Maroko.
1729	geography	Sundarbans estas la tutmonde plej granda ĉemara mangrovarbaro, etendiĝante 80 km (50 mejlojn) trans la marbordo pluen al Bangladeŝo kaj Barato.
1574	science/technology	Preskaŭ ĉiuj nun uzataj komputiloj baziĝas sur prilaborado de informo, kiu estas kodita en formo de duumaj nombroj.
692	travel	Ĉar oni bezonas la Angkor Pass por iri en la templon, nepre kunportu la pasporton, kiam vi iros al Tonle Sap.
1155	geography	"Ĉiuj enirejoj de la kaverno, kiujn oni nomis ""La Sep Fratinoj"" havas minimume 100 ĝis 250 metrojn (328 ĝis 820 futojn) laŭ diametro."
1810	sports	Gastiginte la ludojn en 1964, Tokio iĝos la nura azia urbo gastiginta du somerajn olimpikojn.
64	politics	La originan leĝoprojekton skizis eksurbestro de San-Paŭlo Marta Suplicy. La proponata leĝo, post la ŝanĝo, nun estas en la manoj de Roberto Jefferson.
1330	politics	"Li menciis la onidirojn kiel ""politikajn klaĉojn kaj stultaĵojn."""
1448	politics	Ankaŭ inter ĉiuj dinastioj estis nestabila epoko de dividitaj provincoj. La plej konata el tiaj periodoj estis la Epoko de Tri Reĝlandoj, kiu daŭris dum 60 jaroj inter la dinastioj Han kaj Jin.
636	science/technology	En la jaro 1970 Raymond Damadian, medicinisto kaj esplorsciencisto, malkovris la bazon por uzi magnetan resonancan bildigon kiel medicinan diagnozilon.
1677	science/technology	Inter ekzemploj estas kontrolo, planado kaj enhorarigo, kapablo respondi diagnozojn kaj demandojn de kliento, kaj ankaŭ rekonado de manskribo, voĉo kaj vizaĝo.
1398	entertainment	Se vi spektis la filmon National Treasure, vi povas pensi, ke trezormapo estis desegnita sur la malantaŭo de la Deklaro de Sendependeco.
1605	travel	En tiu ĉi dinamika navedado ĉiu iamaniere estas envolvita kaj kontribuanta en transporta sistemo bazita sur uzo de privataj aŭtoj.
982	travel	Eĉ se vi trairas la subtropikan ĝangalon per veturilo, sufiĉas, ke la pordoj estu malfermitaj kelkajn sekundojn dum via eniro, por ke la kuloj eniru la veturilon kune kun vi.
366	science/technology	La plej grava organo de la cirkuliga sistemo estas la koro, kiu pumpas la sangon.
1651	science/technology	Enhavaj teorioj koncentriĝas sur eltrovo de tio, kio igas homojn agi aŭ defias ilin.
941	science/technology	Kutimiĝinte al la aranĝado kaj redaktado en interreto, tiam vi eble kreos vian propran retejon.
876	health	Tiuj, kiuj ne bone scias pri medicina ĵargono, sciu, ke la vortoj infekta kaj kontaĝa havas apartajn signifojn.
661	entertainment	Danke al sia ofta prezentado en muziko, filmoj, literaturo kaj popola kulturo, la urbo kaj ĝiaj monumentoj iĝis tutmonde konataj.
1112	health	La registaro promesis ankaŭ kelkajn milionojn da flakonoj kun encefalita vakcino, kio helpos prepari sanagentejojn por la sekva jaro.
1329	politics	Cuomo, 53-aĝa, komencis sian regadon pli frue ĉi-jare kaj pasintan monaton subskribis leĝprojekton, kiu leĝigas samseksajn edziĝojn.
1053	politics	S-ino Kirchner anoncis pri sia intenco kandidatiĝi por prezidenteco en la Argentina Teatro, la sama loko, kie ŝi komencis sian kampanjon por elektiĝi al Senato en 2005, kiel membro de la delegitaro de la provinco Buenos Aires.
1948	travel	Bonvolu memori, ke vi esence estas vizitanta amastombejon kaj ankaŭ lokon kun preskaŭ nekalkulebla signifo por grava parto de la loĝantoj de la mondo.
923	science/technology	Oni aliras ĉi tiujn servojn ĝenerale per senpaga telefonnumero, kiun oni povas voki senpage per la plej multaj telefonoj.
173	science/technology	Post mapado de marfundo la vrako estis trovita per submara teleregata aparato.
1087	science/technology	Samkiel la Luno aplikas tiron al la Tero, kaŭzante tajdojn, ankaŭ la Lakta Vojo aplikas forton al la Sagitaria galaksio.
1328	science/technology	Sciencistoj esperas kompreni, kiel formiĝas planedoj, speciale kiel la Tero formiĝis, ĉar kometoj ekkoliziis kun la Tero antaŭ longe.
914	science/technology	Aplikaĵoj de realtempa teksto-tradukado: aplikaĵoj kapablaj aŭtomate traduki kompletajn partojn de teksto el unu lingvo en alian.
1341	science/technology	Tio nomiĝas pH de kemiaĵo. Vi povas fari indikanton per uzo de suko de ruĝa beto.
336	entertainment	"Por fini, turka dancgrupo Fire of Anatolia prezentis spektaĵon ""Trojo""."
1005	entertainment	Ĉe la fino de 2017, Siminoff aperis ĉe venda televidkanalo QVC.
1671	science/technology	La korelacio inter cerba patologio kaj konduto igas sciencistojn daŭrigi la esploradon.
1597	science/technology	Hershey kaj Chase uzis bakteriofagojn, aŭ virusojn, por enplanti sian DNA en bakterion.
1008	health	Unu antikorpa koktelo, ZMapp, komence montris promesplena en la kampo, sed formalaj studoj indikas, ke ĝi estas malpli utila, ol oni deziras, pri evitigo de morto.
1313	health	Laborante en la malsanulejo, Liggins komencis esplori antaŭtempan akuŝon dum sia libera tempo.
665	travel	La “tipa” vizito inkluzivas flugon al la Internacia Flughaveno de Orlando, iron per buso al surloka hotelo de Disney, pasigon ĉirkaŭ unu semajnon sen forlasi la areon de Disney, kaj revenon al hejmo.
242	geography	La luna sondilo ne nur portas gravajn sciencajn instrumentojn, sed ankaŭ la bildon de la barata nacia flago, desegnita sur ĉiu flanko.
383	politics	Ĉi tiun ŝiparon gvidis Olavo Trygvasson, norvego ambicianta repreni sian landon de la dana superrego.
954	travel	Turkish Airlines havas flugojn al 39 lokoj en 30 nacioj en Afriko ekde 2014.
979	travel	Ili povas esti danĝeraj, se la vizitanto sekvas la miraĝon, malŝparante necesan energion kaj haveblan akvon.
217	sports	La voĉdonon ankoraŭ devas ratifi la plena IOK en sia oktobra kunveno en Kopenhago.
1036	travel	Dum sia vojaĝo Iwasaki renkontis problemojn plurfoje.
1583	health	MS estas malsano, kiu afekcias la centran nervan sistemon, kiu konsistas el la cerbo, la spina medolo kaj la optika nervo.
1063	sports	Batantoj de meza ordo Sachin Tendulkar kaj Rahul Dravid bone ludis kaj faris cent-kuran partnerecon.
458	science/technology	Tio igas malmultekostajn zomajn lensojn apenaŭ uzeblaj sen fulmlumo en malhelaj kondiĉoj.
831	travel	En dormovagonoj, pasportoj povas esti kolektitaj de konduktoro por ne interrompi la dormadon.
220	sports	Malgraŭ siaj komentoj, li diris, ke li subtenos la britajn konkursantojn ĉe la Olimpiko 2012 okazonta en Londono.
1119	health	Post la okazinta akcidento, Gibson estis transportita al malsanulejo, sed mortis tuj baldaŭ.
1650	geography	Eble estas pliaj maroj sur la proksima flanko, ĉar la krusto estas malpli dika. Estis pli facile por lafo elverŝiĝi sur la surfacon.
813	sports	Taga migrado laŭ facila vojo postulas malmultan preparon kaj ĝin povas ĝui ĉiu ajn homo en modere bonfizika stato.
1353	science/technology	Oni bezonas gigantan raketon pli ol 100 futojn altan por meti sateliton aŭ teleskopon en kosmon.
925	science/technology	Se oni ne rajtas fari foton de io, eĉ ne enpense oni rajtas fari videon de ĝi.
1164	science/technology	ASUS Eee PC, pli frue lanĉita tutmonde pro kostefikaj kaj funkciaj faktoroj iĝis multe diskutata temo en 2007 Taipei IT Month.
273	health	Ekzistas timo, ke pacientoj povas daŭre infekti pliajn homojn, farante siajn ĉiutagajn farindaĵojn, se la gripaj simptomoj restos mildaj.
947	geography	Ĉar la Onega Lago estas ankaŭ ligita al Volgo, ankoraŭ eblas veni el Kaspio tra Rusujo.
1191	politics	Bachmann, kiu gajnis la neoficialan provbaloton de Ames aŭguste, decidis ĉesigi sian kampanjon.
1070	politics	Ekde kiam la Federacia Registaro enmiksiĝis por preni sur sin financadon de la malsanulejo Mersey en Devonport, Tasmanio, la ŝtata registaro kaj kelkaj federaciaj parlamentanoj ĉiam kritikis tiun agon kiel artifikon kaj preparadon por la federaciaj elektoj anoncotaj ĝis novembro.
497	health	Ili iĝis kompetentaj pri amputado por savi pacientojn de gangreno kaj ankaŭ pri premligiloj kaj arteriaj forcepsoj por haltigi sangofluon.
1914	travel	Finnlando estas bonega vojaĝcelo por boatado. La „Lando de mil lagoj” havas ankaŭ milojn da insuloj en la lagoj kaj en la ĉebordaj arkipelagoj
360	science/technology	La sekva bildo montras atomojn emisii fotonojn. Certe en realeco fotonoj estas multe malpli grandaj ol tiuj en la bildo.
1549	politics	Samtempe la germana mararmeo, uzante ĉefe U-boatojn, provis haltigi tiun trafikon.
186	travel	La buso veturis al Six Flags St. Louis en Misurio, kie la bando devis ludi antaŭ homamaso, ĉiuj biletoj estis venditaj.
598	science/technology	Robert Hooke, angla biologo, vidis per mikroskopo malgrandajn kvadratojn en korko.
163	travel	Kontraŭmina ŝipo de klaso Avenger, la ŝipo navigis al Puerto Princesa en Palavano.
537	travel	Se la tasko de onia vizito al certa loko estas konatiĝi kun ĝia historio kaj kulturo, tiam turismo de tiu tipo estas konata kiel kultura turismo.
365	science/technology	Pro tio ke elektro fluas en konektilon, kie estas metala parto de la ampolo, kaj ĝi povas doni al vi severan elektran ŝokon, se vi tuŝos la internon de la konektilo aŭ la metalan bazon de la ampolo, kiam ĝi ankoraŭ estas parte en la konektilo.
918	science/technology	Uzante en la saĝtelefono aplikaĵon de navigilo de tutmonda loktrova sistemo, vi povas plej facile kaj taŭge movi vin, kiam vi estas ekster via hejmlando.
944	travel	Ĝi ankaŭ povas esti bona rimedo streĉi la buĝeton, ke oni havigu al si pli longan restadon en iu loko, ĉar multaj volontulaj postenoj provizas loĝon kaj manĝon kaj kelkaj pagas etan salajron.
1856	travel	Kondiĉe, ke oni restas ene de tiu ĉi areo, oni ĝenerale povas transiri landlimojn sen neceso trapasi pasportkontrolejojn.
10	politics	Ĉirkaŭ 11:29 la protestantoj ekmoviĝis laŭ Whitehall, preter la Trafalgara placo, laŭ la Strando, preter Aldwych kaj laŭ Kingsway al Holborn, kie en la hotelo Grand Connaught Rooms la Konservativa partio aranĝis sian Printempan Forumon.
893	geography	Ĉar ĉi tiuj ne estas tre lertaj, la vojo devas longe deturni sin ĉirkaŭ la transantarkta montaro por veni sur la altebenaĵon.
282	politics	Oni protestis ankaŭ en Parizo, Sofio en Bulgario, Vilno en Litovio, La-Valeto en Malto, Talino en Estonio, kaj Edinburgo kaj Glasgovo en Skotlando.
1362	science/technology	Leonaj gregoj funkcias sufiĉe simile al gregoj de lupoj aŭ hundoj, kiuj surprize similas al leonoj (sed ne al aliaj grandaj katoj) laŭ konduto, kaj ankaŭ tre mortigaj por la predo.
530	sports	Golfo estas ludo, en kiu ĉiu ludanto uzas klabon por enbati pilkojn en truojn.
730	travel	Ĉi tiu aŭtenta komunumo estas en Howe Sound, tuj apud Vankuvero, kaj oni povas facile aliri al ĝi per planitaj akvotaksioj deirantaj de Granville Island en centra Vankuvero.
840	entertainment	Sed tamen preskaŭ ĉiuj kazinoj supre menciitaj ofertas trinkaĵojn kaj en multaj el ili okazas distraĵo de marko (ĉefe en tiuj grandaj tuj en la ĉirkaŭaĵo de Albuquerque kaj Santa Fe).
698	travel	Estas postulate de Ekvadoro, ke ĉiu kuba civitano ricevu invitleteron antaŭ ol eniri la landon tra internaciaj flughavenoj aŭ limaj enirejoj.
1826	travel	Se vi ne kutimas veturi tra kamparaj vojoj, estu ege atenta: plej abundas krutaj deklivoj, mallarĝaj koridoroj kaj kurbegaj ĝirejoj.
339	health	Li estis tuj prizorgita de la ĉe-traka medicinisto kaj transportita al loka malsanulejo, kie li pli poste mortis.
226	science/technology	Ĝia ekzisto estas konata nur pro ĝiaj efikoj je la vastiĝo de la universo.
24	sports	Li faris 2 golojn kaj 2 efikajn transdonojn en la venko de Washington 5-3 super Atlanta Thrashers.
1117	entertainment	"Lia 1 000a marko estis la belega ""Grandaj Faroj de Svedaj Reĝoj"" de David Klöcker Ehrenstrahl en 2000, kiu estas listigita en la Libro de Mondaj Rekordoj de Guinness."
1792	entertainment	Memoru, ke muziko sur la ĉefaj scenejoj povas esti ĉesinta, sed eble estas partoj de la festivalo, kie ĝi estos sonanta daŭre ĝis malfrua nokto.
674	travel	Se oni eniras Sudan Afrikon per aŭto, tio estas eksterordinara maniero vidi la entenan belecon de la regiono kaj krome viziti partojn ekster la normalaj turismaj itineroj.
1098	health	Tamen la elcentaĵo de XDR-TB en la tuta grupo de tuberkulozuloj ŝajnas esti negranda; 6 000 el la totalo de 330 000 infektitaj en ajna certa momento en Sud-Afriko.
892	travel	Ĝi estas kompaktigita neĝo kun plenigitaj fendoj kaj ĝi estas markita per flagoj. Oni povas traveturi ĝin nur per specialaj traktoroj, kiuj trenas sledojn kun fuelo kaj provizoj.
380	science/technology	Post kelkaj pliaj jaroj, en 1639, angla astronomo nomata Jeremiah Horrocks observis transiron de Venuso.
921	science/technology	Ĉiu angulo de la vendejo estas plenplena de konfuza aro de antaŭpagitaj telefonkartoj, kiujn oni povas uzi en telefonoj ĉu pagaj ĉu ordinaraj.
65	politics	Protestantoj esperas kolekti 1,2 milionojn da subskriboj sub la peticio por prezenti ĝin al la Nacia Kongreso en novembro.
912	science/technology	Ankaŭ neniel necesas, ke vi akiru lokan numeron de la komunumo, kie vi loĝas; vi povas akiri satelitan interretan konekton en sovaĝejo de Chicken, en Alasko, kaj havigi al vi numeron asertantan, ke vi estas en suna Arizono.
987	geography	Tiuj altebenaĵoj ofte estas nomitaj “vidde”, kun la signifo de larĝa malferma spaco sen arboj, de vastaĵo sen limoj.
819	travel	Dum vojaĝo oni atendu, ke aferoj ne estu tiaj, kiaj ili estas “hejme”. Kondutoj, leĝoj, manĝaĵoj, trafiko, loĝado, normoj, lingvo kaj cetero iom malsamas de tie, kie oni loĝas.
798	travel	Ankaŭ disdonu kopiojn de polico/kontaktoj al kunvojaĝantoj kaj parencoj aŭ amikoj, kiuj estas pretaj helpi de hejmo.
1035	science/technology	Ju pli malgranda estas la Rossby indico, des malpli aktiva estas la stelo koncerne magnetajn inversiojn.
1228	entertainment	Famaj kantistoj tra la lando prezentis bhaĝanojn, aŭ preĝkantojn, al la piedoj de Ŝri Ŝjam.
1039	science/technology	Tio ebligos retrokongruecon kun 802.11a, 802.11b kaj 802.11g, kondiĉe ke la baza stacio havas duoblan radion.
1375	science/technology	Plantoj faras oksigenon, kiun homoj enspiras, kaj ili forprenas karbonan dioksidon, kiun homoj elspiras.
772	entertainment	Monda Foiro (kutime nomita Monda Ekspozicio aŭ nur Ekspo) estas vasta internacia festivalo pri arto kaj scienco.
735	travel	Sirena estas la sola gardistejo, kiu proponas dormejon kaj varmajn manĝaĵojn, aldone al tendumejo. La Leona, San Pedrillo kaj Los Patos disponigas nur tendumejon sen restoracia servo.
1350	science/technology	Kiam vi telefonas al iu, kiu estas milojn da mejloj for, vi uzas sateliton.
1419	geography	"Pro la kunmeto/grupo de insuloj, kiujn Japanio havas, Japanio ofte estas nomata, en geografia senco, ""arkipelago""."
1601	travel	Natur-bazita turismo allogas homojn interesitajn pri vizitado de naturaj areoj por ĝui la vidaĵon, inkluzive de flora kaj faŭna viva naturo.
1812	sports	Politikoj de nuligo estas diversaj, sed, koncerne malfruan Marton, la plimulto de politikoj de nuligo bazitaj sur kronviruso ne etendiĝas ĝis Julio 2020, por kiam oni planis la Olimpikojn.
270	sports	Ekde tiam la brazilano ludis por la klubo en 53 matĉoj en ĉiuj konkursoj kaj enpafis 24 golojn.
1920	travel	Ĉi tio signifas, ke vi povas plene uzi kelkajn tagojn por viziti la historian urbon, revenante nokte sur la ŝipon por dormi tie.
1431	science/technology	Pluraj popularaj formatoj (formataro APS, ekzemple) estas egalaj aŭ tre proksimaj al tiu ĉi proporcio.
832	travel	Registriĝo estas aldona postulo de la vizaj formalaĵoj. En kelkaj landoj, oni devas registri ĉe la lokaj aŭtoritatoj onian estadon kaj la adreson de tie, kie oni loĝas.
1769	politics	En la streboj al sendependiĝo, kiujn organizis la movado Mau, paca renkontiĝo ĉe la urbo okazigis la mortigon de la supera ĉefo Tupua Tamasese Lealofi III.
130	politics	Hodiaŭa anonco pludaŭrigis la faritan ĉi-jare en marto registaran sindevigon pripagi aldonajn vagonojn.
955	travel	Se vi havas kroman tempon por vojaĝi, kontrolu, kiel via ensuma kotizo al Afriko diferencas de kotizo ĉirkaŭ la mondo.
47	sports	Jonny Reid, kunstiranto de la Nov-Zelanda A1GP teamo, hodiaŭ eniris historion stirinte plej rapida tra la 48-jara ponto trans la haveno de Auckland, Nov-Zelando, laŭleĝe.
1038	science/technology	La normo 802.11n funkcias en la frekvencoj kaj 2,4 GHz kaj 5,0 GHz.
1268	health	Pafilo de Uka misfunkciis, kiam li celis kapon de la kvina viro. Schneider daŭre sentas doloron, restas blinda je unu okulo, mankanta parto de lia kranio kaj vizaĝo estas rekonstruita el titano.
1418	geography	Japanio havas proksimume 7000 insulojn (la plej granda estas Honŝuo), kio igas Japanion la 7a plej granda insulo en la mondo!
1899	entertainment	Oni projekcias la scenojn sur la piramidojn kaj lumigas la diversajn piramidojn.
272	health	Kelkaj studoj supozigas, ke la malsano devas iĝi malpli mortiga antaŭ ol povi kaŭzi tutmondan epidemion, li rimarkis.
943	travel	Loĝi kaj volontuli en eksterlando estas bonega maniero koni malsaman kulturon, renkonti novajn homojn, koni sin mem, akiri perspektivojn kaj eĉ akiri novajn kapablojn.
1201	health	La pactrupoj de UN, kiuj alvenis en Haition post la tertremo de 2010, estas kulpigitaj pri la disvastiĝo de la malsano, kiu komenciĝis apud la truptendaro.
267	science/technology	La kazo estis procesita en Virginio, ĉar ĝi estas hejmo de la gvida interretprovizanto AOL, la kompanio, kiu iniciatis la proceson.
1708	travel	Ĉirkaŭ la malnova urbocentro estas facile trovi vendejojn de tradiciaj marokaj varoj, ekzemple taĵinoj, ceramikaĵoj, ledaĵoj, nargileoj kaj tuta gamo de brilaĵoj, sed ĉio estas por turistoj.
928	travel	Nuntempe oni malofte rezervas flugojn rekte de flugkompanio sen antaŭe serĉi kaj kompari prezojn.
1391	geography	En la varma klimato de Meza Oriento la domo ne estis tiel grava.
1229	entertainment	Kantisto Sanju Sharma komencis la vesperon, lin sekvis Jai Shankar Choudhary, ankaŭ prezentinta la chhappan bhog bhaĝanon. Kantisto Raju Khandelwal akompanis lin.
586	science/technology	Tiuj teleskopoj uzis kombinaĵon de du lensoj por montri la forajn objektojn kaj pli proksimaj kaj pli grandaj.
1695	geography	Madagaskaro estas nekompareble la plej vasta kaj, rilate la faŭnon, ĝi estas sendependa kontinento.
802	health	Inter la eblaj longatempaj sanproblemoj pro troa trinkado, estas difekto al hepato kaj eĉ blindiĝo kaj morto. La eventuala danĝero kreskas, se oni trinkas alkoholon neleĝe produktitan.
1881	politics	La volemo liveri pasportojn sen indikita genro (X) aŭ ĝisdatigitajn dokumentojn akordajn al dezirata nomo varias de registaro al registaro.
1379	science/technology	Ĝiaj longaj makzeloj estis provizitaj per pli ol 70 akregaj dentoj, kune kun kroma aro en ĝia buŝtegmento, kio signifas ke nenio kio renkontis ĝin povis eskapi.
1550	politics	Se la aliancanoj fiaskus, Germanio verŝajne povus konkeri Brition same kiel la reston de Eŭropo.
333	entertainment	Ĝin sekvis la Istanbula Ŝtata Simfonia Orkestro, janiĉara bando kaj kantistoj Fatih Erkoç kaj Müslüm Gürses.
719	geography	Domingo (en la hispana: República Dominicana) estas nacio de Karibio kovranta la orientan duonon de la insulo Hispaniolo, kiun ĝi kunokupas kun Haitio.
1780	travel	Dum la tuta jaro okazas multaj ekskursoj al la rifo kaj vunditoj pro iu ajn el tiuj ĉi kaŭzoj estas maloftaj.
1841	travel	Se, rajdante, oni falas de ĉevalo la piedon kaptita de piedingo, oni povus esti trenita de eventuale forkuranta ĉevalo. Por plej malgrandigi ĉi tiun riskon, eblas fari diversajn sekurecaranĝojn.
471	politics	Laŭ la koncepto, ĉiuj eŭropaj nacioj devis klopodi malebligi, ke unu nacio iĝu potenca, kaj tial naciaj registaroj ofte ŝanĝis siajn aliancojn por subteni ekvilibron.
1634	science/technology	Tio estis pli kiel la kvar statoj de materio (en la sama ordo): solida, likva, gasa kaj plasma, kvankam li plu teoriadis, ke ili iĝas novaj substancoj por formi kion ni vidas.
1255	science/technology	La esploristoj observis formiĝon de kristaloj en kata urino, aldoninte melaminon kaj cianuran acidon.
845	entertainment	Sed tamen nuntempe ekzistas establitaj grafitiistoj, grafitiaj eventoj kaj “laŭleĝaj” muroj. En tiu kunteksto, grafitioj ofte similas pli al artaĵo ol al nelegebla skribraĵo.
1776	entertainment	Estas multaj trinkindaj vinoj el Francujo, sed vinoj el Nov-Zelando kaj Aŭstralio eble enveturas pli bone.
1845	travel	La montopintoj prezentas mirigajn panoramojn. Grimpistoj el ĉiu parto de la mondo senĉese kreas novajn vojojn el la senfinaj ebloj de la muroj.
1151	sports	Sud-Afriko aspektis sendube nepreparita dum la maĉo kontraŭ siaj sudaj fratinoj, sed iom post iom pliboniĝis en la daŭro de la turniro.
1054	politics	"La debaton kaŭzis malkonkordo pri la elspezoj por savado kaj rekonstruado sekve de la uragano Katrina, kiun iuj financaj konservativuloj jam humure moknomis ""Novorleana afero de Bush""."
1859	geography	Ĉar la difino ŝanĝiĝas laŭloke, en lokoj kiel Nord-Ameriko aĝolimo eble estos pli malgranda ol en Eŭropo.
1007	health	Kvankam unu eksperimenta vakcino aspektas kapabla malpliigi la ebolan mortindicon, ĝis nun neniu kuracilo klare montriĝis uzebla por kuraci la ekzistantan infekton.
1076	politics	"Gordon Johndroe, proparolanto de Bush, nomis la promeson de Norda Koreio ""grava paŝo al la celata atingo de kontrolebla malnukleigo de la Korea duoninsulo""."
1099	geography	La satelitoj, ambaŭ el kiuj pezis pli ol 1 000 funtojn kaj moviĝis je rapideco de proksimume 17 500 mejlojn hore, koliziis 491 mejlojn super la Tero.
1100	science/technology	Sciencistoj diras, ke la eksplodo pro la kolizio estis grandega.
367	science/technology	Sango iras de la koro laŭ tuboj nomataj arterioj kaj revenas al la koro laŭ tuboj nomataj vejnoj. La malplej grandaj tuboj nomiĝas kapilaroj.
770	entertainment	La plimulto de la templaj festivaloj okazas kiel parto, jen de la templa datreveno, jen de la naskiĝtago de prezidanta dio, jen de grava okazaĵo ligita al la templo.
279	politics	Kiel ŝtato kun majoritata balotsistemo, Florido aljuĝis ĉiuj kvindek de siaj delegitoj al Romney, puŝante lin supren kiel gvidan kandidaton por la nomumo de la Respublikana Partio.
357	science/technology	Por reveni al sia antaŭa energinivelo, ili devas deĵeti la superfluan energion, kiun ili ricevis de la lumo.
797	science/technology	Se vi vojaĝas kun tekokomputilo aŭ tabulkomputilo, konservu kopion en ties memorilo aŭ disko (alireblaj sen interreto).
211	health	Ne estis kono pri ajna grava lezo, sed minimume kvin homoj ĉeestintaj en la momento de la eksplodo estis traktitaj pro simptomoj de ŝoko.
815	travel	Tutmonde ekzistas preskaŭ 200 organizaĵoj de kurado-turismo. La plej multaj el ili funkcias sendepende.
238	geography	"Kiom ni scias, estas nur unu planeda korpo, videble pli vigla ol Titano, kaj ĝia nomo estas la Tero"", aldonis Stofan."
1636	science/technology	Elementoj kiel kalcio kaj kalio estas konsiderataj kiel metaloj. Certe, estas ankaŭ metaloj kiel arĝento kaj oro.
761	travel	Tiam oni ricevas presitan kaj/aŭ retan liston de disponeblaj gastigantoj, foje kun atestoj kaj komentoj de aliaj vojaĝantoj.
1676	science/technology	Esplorado en AI envolvas produktadon de maŝinoj por aŭtomatigi taskojn, kiuj postulas inteligentan konduton.
848	entertainment	La plimulto de bumerangoj haveblaj en Aŭstralio fakte ne kapablas reveni. Por komencantoj estas plej bone ne provi ĵetadon dum venta vetero.
1089	science/technology	Tiu ĉi teorio diras, ke la plej malluma materio ĉirkaŭ galaksio ĉirkaŭas galaksion kiel speco de haloo kaj konsistas el multaj malgrandaj partikloj.
984	health	Ĝis nun oni raportis malpli ol mil kazojn en homoj, sed kelkaj el ili estis mortaj kazoj.
305	sports	Japana ĵudisto Hitoshi Saito, gajninto de du Olimpikaj oraj medaloj, mortis 54 jarojn aĝa.
697	travel	En Jerusalemo estas multnombraj lokoj historiaj, arkeologiaj kaj kulturaj, aldone al la viglaj kaj homplenaj komercocentroj, kafejoj kaj restoracioj.
826	travel	Ĝenerale ili konsistas el du kategorioj: ĉu labori dum vojaĝado, ĉu limigi la elspezojn. Tiu ĉi artikolo celas tiun ĉi lastan.
1672	health	Estas longatempe konata fakto, ke diversaj tipoj de cerba difektiĝo, traŭmoj, lezoj kaj tumoroj influas konduton kaj ŝanĝas kelkajn mensajn funkciojn.
536	travel	Plaĝoj, temaj parkoj kaj kampadejoj ofte estas la plej popularaj lokoj, kie distraj turistoj frekventas.
1909	science/technology	Via loka provizanto de telefona servo povus plie informi vin pri la konekto al tiu ĉi servo.
611	science/technology	Komplikaj animacioj povas esti produktitaj per komputiloj, kaj tiaj animacioj estas pli kaj pli uzataj en televido kaj kino.
157	sports	Post la vetkuro Keselowski restas la gvidanto de Stirista Ĉampioneco kun 2250 poentoj.
1294	politics	Martelly hieraŭ ĵuris en nova naŭ-membra Portempa Elekta Konsilio (CEP).
1803	travel	Aliflanke, glacia kaj neĝa vetero estas normala en multaj landoj, sed trafiko fluas plejparte seninterrompe la tutan jaron.
359	science/technology	"Sciencistoj nomas tiun procezon ""stimulita emisio de radiado"", ĉar la atomoj estas stimulitaj de la brila lumo, kio kaŭzas emision de fotono de lumo, kaj lumo estas speco de radiado."
302	politics	Franca leĝo estis ŝanĝita. Lia aktivismo komenciĝis en la aĝo de 15, kiam li aliĝis la Francan Reziston dum la Dua Mondmilito.
455	science/technology	Tio iĝas malpli grava problemo, kiam produktantoj de lensoj atingas pli altajn normojn en lensoproduktado.
