index_id	category	text
1034	science/technology	光度と自転の組み合わせから、プラズマ流に関係する星のロスビー数が決定されます。
450	geography	セレンゲティ地域には、セレンゲティ国立公園、タンザニアのンゴロンゴロ保全地域とマスワ動物保護区、ケニアのマサイマラ国立保護区などがあります。
1019	entertainment	最優秀作品賞、監督賞、撮影賞、衣装デザイン賞、映画編集賞、作曲賞、美術賞、音響編集賞、録音賞、脚本賞などにノミネートされました。
26	sports	その夜の2つ目のゴールは、彼の今季60点目のゴールとなりました。1シーズンで60点以上を記録した選手は、1995～1996年のジャロミア・ジャグとマリオ・ルミュー以来という快挙でした。
1292	sports	NPWSとオーストラリアのスポーツ射撃協会（NSW）の提携により、スポーツ射撃協会の狩猟プログラムで有資格ボランティアが募集されました。
1795	travel	サンクトペテルブルクのクルーズには街での滞在時間が含まれています。クルーズの乗客はビザが免除されます（条件を確認してください）。
939	travel	持ち込み可のものと不可のを確認し、法律で定められた限度を超えるものは申告しましょう。
693	geography	エルサレムはイスラエルの首都でありかつ最大都市ですが、他国のほとんどや国連から正式に首都として認められていないのが現状です。
778	science/technology	使い果たしても補充しやすく、現在のデジタル一眼レフカメラとほぼ同等の解像度が得られます。
1147	health	医療慈善団体のマンゴラ、国境なき医師団および世界保健機関は、それがこの国で記録された最悪の疫病の大流行であると述べています。
1263	politics	公訴局長官のキアー・スターマー王室顧問弁護士は今朝、ハーン氏とプライス氏の両氏を起訴するという声明を発表しました。
1847	sports	スキーは旅の主なアクティビティであり、「スキー狂」と呼ばれる多くの愛好家たちが、特定の場所でのスキーを中心とした休暇を計画しています。
994	travel	死別運賃をまだ提供している航空会社は数社のみですが、この運賃で葬儀直前の旅費がわずかに割り引きになります。
927	science/technology	空港の付近や群衆の頭上にドローンを飛ばすことは、たとえ違法ではないとしても、ほぼ間違いなく良からぬ考えでしょう。
811	sports	ハイキングとは、野外で自然環境を楽しむ徒歩旅行ですが、通常はハイキングコースを歩くことになります。
285	politics	ラトビアとスロバキアはともにACTAに加盟する予定ですがその手続きが遅れています。
1342	science/technology	キャベツの汁は化学物質に反応し、酸性かアルカリ性（塩基性）かによって色が変わります。
1800	travel	雪道や凍った道は摩擦が少なく、アスファルト道路を走るような運転はできません。
1297	politics	この委員会は、10月から始まった反体制派の抗議が広範囲に広がったことに対してマルテリー大統領が打った対策でした。
1048	politics	警告の内容は、現時点でイラクでどのような行動をとっても、宗派間抗争や暴力の拡大、あるいは混沌への滑落を阻止しうると保証できる者はいないというものでした。
547	politics	2,400人の主力突撃部隊は、トレントンの北9マイルの地点で川を渡り、グリーン指揮下とサリヴァン指揮下の2つの部隊に分かれ、夜明け前の攻撃を開始しました。
1127	health	フルークは、女性の健康がないがしろにされていることを口外しないように圧力がかけられていることについて書きました。
120	entertainment	また、ACMAは、インターネット上で動画が配信されていたにもかかわらず、ビッグ・ブラザーのウェブサイトにメディアが保存されていなかったため、ビッグ・ブラザーはオンラインコンテンツ検閲法に違反していなかったことを明らかにしています。
1113	health	今年、歴史的に最も被害が甚大だった地域にワクチンを届けるという計画でしたが、資金不足と他の疾病に比べて優先順位が低いという理由で遅れていました。
1442	politics	この戦術に対する反応が限られていたため、ドイツはその無制限の水中戦にも同様の反応を想定していました。
830	travel	国境を越える列車に乗る場合には、運行中に検査を受けねばならないことがあるので、有効な身分証明書を携帯してください。
1824	travel	税金の高い国を訪れる旅行者は、特に酒類やたばこなどの商品でかなりの金額を節約できることがあります。
1533	health	バイオリズムに基づくその他の手段としては、睡眠前に水分（特に水や利尿作用のあるお茶）を多めに摂って、排尿するために起きざるをえない状況にするなどです。
1982	entertainment	お花見と呼ばれる桜の花の鑑賞は、8世紀から日本の文化の一部となっています。
657	health	日の長い夏が続くと、十分な睡眠がとれず、健康上の問題につながる可能性があります。
948	travel	一度マリーナに行けば、すべてが明らかになるのでご安心ください。他のボートヒッチハイカーと出会い、情報を共有できるでしょう。
1892	travel	海外で暮らしてから帰国すると、新しい文化に順応した分だけ母国文化の習慣のを失っているものです。
1707	travel	カサブランカはモロッコで最も買い物を楽しみにくい場所の1つです。
1729	geography	スンダルバンスは世界最大の沿岸マングローブ地帯であり、海岸からバングラデシュとインドの内陸地域まで80 km（50マイル）にわたって広がっています。
1574	science/technology	事実上、今日使用されているすべてのコンピュータは、2進数で符号化された情報の操作に基づいています。
692	travel	寺院に入るにはアンコールパスと呼ばれる入場券が必要なので、トンレサップを訪れる際には忘れずにパスポートを携帯しましょう。
1155	geography	洞窟の入口は7つあって「セブン・シスターズ」と呼ばれ、いずれも直径100～250 m(328～820フィート)ほどです。
1810	sports	東京は、1964年の開催以来、夏季オリンピックを2回開催したアジアで唯一の都市となります。
64	politics	法案の原案は、元サンパウロ市長のマルタ・スプリシー氏によって起草された。提案された法案は、修正された後、ロベルト・ジェファーソンの手に渡りました。
1330	politics	彼はこの噂を「政治的なおしゃべりと愚かさ」と呼びました。
1448	politics	また、各王朝の間には、分断された地方の不安定な時代がありました。これらの時代のうち最もよく知られているのは、漢と晋の時代に挟まれ、60年間にわたって続いた三国時代です。
636	science/technology	1970年、医学博士であり研究者でもあるレイモンド・ダマディアン氏は、磁気共鳴画像を医学診断の道具として利用するための根拠を発見しました。
1677	science/technology	例を挙げると、制御、計画、スケジュール管理、顧客の診断や質問に回答する機能、ならびに手書き文字、音声、顔の認識などがあります。
1398	entertainment	映画「ナショナル・トレジャー」を見たことがある人は、アメリカ独立宣言書の裏に宝の地図が書かれていると思っているかもしれません。
1605	travel	このダイナミックな往復輸送においては、誰もが自家用車をベースにした輸送系と何らかの形でつながり、それを支えています。
982	travel	亜熱帯雨林を車で走行するにしても、乗り降りのためにドアを開けている数秒だけで蚊が車内に入ってくるのに十分な時間です。
366	science/technology	循環器系の主要器官は心臓であり、血液を送り出す役割を果たす臓器です。
1651	science/technology	コンテンツ理論は、人の心をくすぐるものやアピールするものを見つけることを中心にしています。
941	science/technology	ウェブ上での書式設定や編集に慣れてきたら、後ほど自分のウェブサイトを作成できるかもしれません。
876	health	医療専門用語に馴染みのない方のために付け加えると、感染性と伝染性という言葉は、異なる意味を持っています。
661	entertainment	音楽、映画、文学、大衆文化に頻繁に登場することで、サンフランシスコとそのランドマークは世界中に知られるようになりました。
1112	health	数百万本の脳炎ワクチンも政府から約束されており、来年に向けて保健機関の準備に役立ちます。
1329	politics	今年初めに知事職に就き、先月、同性婚を合法化する法案に署名したクオモ氏、53歳。
1053	politics	キルヒネル夫人は、アルゼンチン劇場で大統領選に出馬するという意向を表明しました。2005年にブエノスアイレス州の代表団の一員として上院選への出馬を表明したのもこの劇場でした。
1948	travel	自分が訪れたのは本質的に巨大な集団墓地であり、世界の人口の大多数にとって計り知れないほどの意味を持つ墓地であることをお忘れにならないでください。
923	science/technology	これらのサービスにアクセスするには、多くの場合、ほとんどの電話から無料で通話できるフリーダイヤルの番号にかけます。
173	science/technology	海底マッピングに続いて、ROVを使用して難破船が発見されました。
1087	science/technology	月の引力で地球に潮の満ち引きが起きるように、天の川は射手座銀河にも力を及ぼしています。
1328	science/technology	科学者たちは、はるか昔に彗星が地球と衝突して以来、どのように惑星が形成され、特に地球がどのように形成されたかを理解したいと考えています。
914	science/technology	リアルタイムテキスト翻訳アプリ - テキストのセグメント全体をある言語から別の言語に自動的に翻訳できるアプリケーションです。
1341	science/technology	これを化学物質のpHといいます。紫キャベツの絞り汁で試験紙を作ることができます。
336	entertainment	最後にトルコのダンスチーム「ファイヤー・オブ・アナトリア」が「トロイ」を披露しました。
1005	entertainment	2017年後半にシミノフ氏はテレビショッピング「QVC」に出演しました。
1671	science/technology	脳病理と行動の相関関係は、科学者たちの研究を裏付けるものです。
1597	science/technology	ハーシーとチェイスはファージ（ウイルス）を使い、そのDNAをバクテリアに移植しました。
1008	health	抗体カクテルの1つであるZMappは、当初はこの分野で有望視されていましたが、正式な研究では期待されたほどの死亡予防効果がないことが示されました。
1313	health	その病院に勤務しながら、リギンズは余暇を利用して早産についての研究を始めました。
665	travel	「典型的」な観光は、オーランド国際空港に乗り入れ、ディズニーワールド内にあるホテルまでバスでに移動し、ディズニーワールドから出ることなく約1週間を過ごし、帰宅するというものです。
242	geography	月面探査機は、3つの重要な科学機器を搭載しただけでなく、本体の各面にインドの国旗が描かれています。
383	politics	この艦隊を率いたのは、デンマークの支配から自国を取り戻すという野望を抱くノルウェー人のオラフ・トリグヴァッソンでした。
954	travel	トルコ航空は2014年現在、アフリカ30カ国39都市に就航しています。
979	travel	旅行者が蜃気楼を追いかけて貴重な体力や残りの水を浪費した場合、これらが危険につながる可能性があります。
217	sports	投票は、10月にコペンハーゲンで開催されるIOCの総会で承認されなければなりません。
1036	travel	旅の途中、岩崎さんは何度もトラブルに見舞われました。
1583	health	MSは、脳、脊髄、視神経からなる中枢神経系に影響を与える病気です。
1063	sports	中軸のバッツマン、サチン・テンドルカール、ラホール・ドラヴィッドが連携してうまく試合を運び、100ランを達成しました。
458	science/technology	そのため、安価なズームレンズはフラッシュを使わないと低照度の状態では使いづらくなります。
831	travel	夜行寝台列車では、乗客の睡眠を妨げないように、車掌がパスポートを回収してくれることがあります。
220	sports	彼のコメントにもかかわらず、彼はロンドンで開催されている2012年のオリンピックで英国の競争相手をサポートすると述べました。
1119	health	事故発生後、ギブソン氏は病院に搬送されましたが、その後まもなく死亡しました。
1650	geography	地殻が薄いため、近い方には海が多くなることがあります。溶岩が浮上しやすくなっていました。
813	sports	歩きやすい道を日帰りでハイキングする場合、ほとんど準備は必要ありません。体調の良い人なら誰でも楽しむことができます。
1353	science/technology	衛星や望遠鏡を打ち上げて宇宙空間に配備するためには、まず高さ100フィート以上の巨大ロケットが必要です。
925	science/technology	写真撮影が許可されない場合にビデオで記録しようと考えてはいけません。
1164	science/technology	ASUSのEee PCは、コスト面と機能面で世界に先駆けて発売され、2007 Taipei IT Monthで話題となりました。
273	health	インフルエンザの症状が軽度のままだと、患者がふだんどおりに生活を送ってしまい、より多くの人に感染が広がるという懸念があります。
947	geography	オネガ湖はヴォルガにもつながっているので、カスピ海からロシアを経由して来ることも可能です。
1191	politics	8月にエイムズの模擬投票で勝利したバックマン議員は、選挙戦を終了することに決めた。
1070	politics	連邦政府がタスマニア州デボンポートのマーシー病院の資金調達を引き継ぐために介入して以来、州政府と一部の連邦議員は、この行為を11月までに招集される連邦選挙の前哨戦での煽り行為だとして批判しています。
497	health	彼らは、患者を壊疽から救うための四肢切断術、血流を止める止血帯、そして動脈クランプにも精通していました。
1914	travel	フィンランドは、ボート遊びにはもってこいの国です。「千の湖の国」であるフィンランドには、湖や沿岸の群島にも何千もの島があります。
360	science/technology	次の写真は、原子が光子を放出している様子です。もちろん、実際には写真よりもはるかに微小です。
1549	politics	同時に、ドイツ海軍は主にUボートを使用して、この輸送を阻止しようとしていました。
186	travel	バンドが乗ったバスが向かった先はミズーリ州のシックスフラッグスセントルイスで、満員の観客に演奏を披露するためだ。
598	science/technology	英国の自然哲学者ロバート・フックは、顕微鏡でコルクの切片を観察し、たくさんの小部屋が見えることを確認しました。
163	travel	アベンジャー級掃海艇は、パラワン島のプエルト・プリンセサに向かっていました。
537	travel	特定の場所を訪れる目的がその場所の歴史や文化を知ることである場合、その種の観光は文化観光と呼ばれます。
365	science/technology	これは、電球の一部がソケット内にあるときに、ソケットや電球の金属部に触れると、電球の金属部が接しているソケットに流れる電流によって激しい感電を起こすことがあるためです。
918	science/technology	母国を離れている間に目的地への行き方を調べるには、スマートフォンでGPSナビゲーションアプリを活用するのが最も簡単で便利な方法です。
944	travel	また、ボランティアの仕事で部屋と食事が付き、多少の給料をもらえることも多いので、予算を増やしてどこかに長期滞在できるようにするのも良い方法です。
1856	travel	この圏内に留まっている限り、通常は出国審査を何度も受けることなく国境を越えることができます。
10	politics	11時29分頃、デモ隊は英国政府に向かい、トラファルガー広場を通り過ぎて、ストランド街沿いにアルドウィックのそばを通り抜け、キングスウェイをホルボーンに向かって進みましたが、そこでは保守党がグランドコンノートルームズホテルで春季フォーラムを開催していました。
893	geography	これらはあまり小回りがきかないので、自然歩道を通って高原に出ようとすると南極大陸の山々をぐるりと回らなければなりません。
282	politics	抗議行動は、パリ、ブルガリアのソフィア、リトアニアのヴィリニュス、マルタのヴァレッタ、エストニアのタリン、スコットランドのエディンバラおよびグラスゴーでも発生しました。
1362	science/technology	ライオンのプライドは、狼や犬の群れに似た行動を示し、動物は驚くほど行動のライオン（が、他の大きな猫）に似ていて、獲物を逃さずに仕留めます。
530	sports	ゴルフとは、クラブで打ってボールを穴に入れるゲームです。
730	travel	この本格的なコミュニティはバンクーバー沖のハウ・サウンドに位置し、バンクーバーの商業地区にあるグランビル島から定期的に運航している水上タクシーで簡単に訪れることができます。
840	entertainment	しかし、上記のカジノのほぼすべてが飲み物を提供しており、そのいくつか（主にアルバカーキとサンタフェのすぐ近くにある大規模なカジノ）は有名ブランドのエンターテイメントを提供しています。
698	travel	エクアドルでは、キューバ人が国際空港や辺境の入国ポイントを経由してエクアドルに入国する前に、招待状を受け取ることを義務付けています。
1826	travel	田舎道の運転に慣れていない方は、急勾配、狭い車線、急カーブに注意し、気を抜かないでください。
339	health	彼はすぐに現場の医療スタッフの手当てを受け、地元の病院に搬送されましたが、その後死亡しました。
226	science/technology	その存在が知られているのは、宇宙の膨張に影響を与えたからにほかなりません。
24	sports	ワシントンがアトランタ・トラッシャーズに5-3で勝利した際には2ゴール2アシストを記録しています。
1117	entertainment	彼の1,000枚目の切手は、デビッド・クレッカー・エーレンストラールが2000年に発行した素晴らしい「スウェーデン国王たちの偉業」でギネスブックにも掲載されています。
1792	entertainment	メインステージの音楽が終わっても、フェスティバルには夜遅くまで演奏を流し続けるセクションがあるかもしれないことを覚えておいてください。
674	travel	車でアフリカ南部に入るというのは、この地域の美しいものを観光できるだけでなく、通常の観光ルートから外れた場所にも行けるすごい方法です。
1098	health	しかし、結核患者全体に占めるXDR-TBの割合はまだ低いようで、こうしている間にも南アフリカでは33万人のうち6,000人が感染している。
892	travel	クレバスが圧雪で埋まり、旗で印をつけてあります。燃料や物資を積んだソリを積み込んだ専用トラクターでしか移動できません。
380	science/technology	そして数年後の1639年にイギリスの天文学者ジェレミア・ホロックスが金星の通過を観測しました。
921	science/technology	街角のどこの店にも、公衆電話や一般電話で使えるプリペイド式のテレホンカードがずらりと並んでいます。
65	politics	抗議者たちは、120万人の署名を集めて11月の全国大会に提出しようと考えています。
912	science/technology	居住地の自治体で番号を発行してもらう必要もありません。アラスカ州チキンの荒野で衛星からインターネットに接続して番号を選択すりれば、日当たりの良いアリゾナ州にいることになります。
987	geography	これらの台地はよく「ヴィッデ」と呼ばれますが、これは木々がなく開けた広い空間、無限の広がりを意味しています。
819	travel	旅行先では、「自国」とは違うことを予想しましょう。マナー、法律、食べ物、交通、宿泊施設、基準、言語など、あなたの居住地とはある程度異なります。
798	travel	旅仲間や無事の帰宅を願って協力してくれる親戚、友人にも保険契約書と連絡先の写しを渡しておきましょう。
1035	science/technology	ロスビー数が小さいほど磁気反転に関して星の活性が低下するわけです。
1228	entertainment	全国から集まった有名な歌手たちがシュリーシャムの足元にバジャン（聖歌）を捧げました。
1039	science/technology	これにより、基地局がデュアルバンド無線を搭載していれば、802.11a、802.11b、802.11gとの下位互換性を確保することができます。
1375	science/technology	植物は人間が吸う酸素を作り、人間が（息として）吐き出す二酸化炭素を取り込んでいます。
772	entertainment	世界博覧会（通称は万国博覧会、または単に万博）は、芸術と科学を展示する大規模な国際的祭典です。
735	travel	シレナはキャンプに加えて、寮宿泊や温かい食事を提供している唯一の森林管理施設です。ラ・レオナ、サン・ペドリロ、ロス・パトスはキャンプ場のみで、食事サービスはありません。
1350	science/technology	何千マイルも離れた場所にいる相手に電話をかけると自動的に衛星を経由した通話になります。
1419	geography	日本は島々の集まりなので、地理的によく「群島」と呼ばれます。
1601	travel	自然との触れあいを重視した観光は、野生の動植物を含めた景観を楽しむ目的で自然地域を訪れることに興味を持つ人々を魅了しています。
1812	sports	キャンセルポリシーはさまざまですが、3月下旬の時点で、ほとんどのコロナウイルス関連のキャンセルポリシーは、オリンピックが予定されていた2020年7月まで延長されません。
270	sports	以降、このブラジル人選手は同クラブから53試合に出場し、24ゴールを決めています。
1920	travel	つまり、夜は船で寝泊まりしながら、2～3日かけて歴史的な街を観光できるということです。
1431	science/technology	一般的な記録形式（例えば、APS系の記録形式）の多くは、このアスペクト比と同等かそれに近いものです。
832	travel	登録はビザ取得のための追加要件です。国によっては、現地当局に滞在先と住所を登録しなければならない場合もあります。
1769	politics	マウ運動によって組織された独立闘争の間に、町で開かれた平和的な集会で最高責任者トゥプア・タマセーゼ・レアロフィ3世が殺害されました。
130	politics	本日の発表では、今年3月に掲げられた政府の公約を延長して、増便分の資金を提供することも発表されました。
955	travel	さらに移動時間が長くなる場合は、アフリカまでの総運賃の見積もりが世界一周運賃と比較してどのくらいかを確認してください。
