index_id	category	text
375	science/technology	太陽には、地球のような地殻（つまり、人間が立てる場所）はありません。太陽全体がガスと火とプラズマでできています。
1736	travel	ほとんどの地区には日本製のコースターバスが運行し、いずれも快適で頑丈な小型バスです。
534	travel	おそらく、最も一般的な観光事業の形態は、ほとんどの人が旅行と関連付ける観光レクリエーションです。
48	sports	リード氏は、ニュージーランドのA1GPカーである「ブラックビューティー」で時速160 km以上で7回も橋を渡る走行に成功しました。
246	politics	1947年にイギリスの支配からパキスタンが独立して以来、パキスタン大統領はFATAを統治するために「政治エージェント」を任命しており、FATAはほぼ完全な自治権を行使しています。
1217	politics	国際的な制裁により、新しい航空機を購入することができません。
1916	entertainment	沿岸の群島と最大の湖は、確かにヨットを楽しめる大きさですが、小型ボートやカヤックでもまた違った体験ができます。
1192	health	撮影者はロナルド・レーガンUCLAメディカルセンターに搬送され、その後死亡しました。
559	science/technology	陽子は正電荷を帯び、中性子は無電荷です。電子は負電荷を帯びた粒子です。
107	geography	カプセルが地球の大気圏に突入するのは午前5時頃（東部時間）の予定で、北カリフォルニア、オレゴン、ネバダ、ユタの人々の目にまばゆい光跡が映ると期待されています。
549	sports	もちろん、2分を切る一流のハーフランナーは、それなりのスピードがあるはずですが、どんなことがあっても持久力を伸ばしていかなければなりません。
1923	travel	飛行機の旅は、あらゆる年齢層や経歴の人々にとって恐ろしい経験になる可能性があり、特に飛行機に乗ったことがなかったり、トラウマになるような出来事を経験したことのある人の場合にはその傾向があります。
126	entertainment	アル・ゴア氏とトミー・フランクス将軍は、さりげなく自分たちのお気に入りの見出しを口にします（ゴア氏が挙げた見出しは、2000年の選挙区での敗北後、彼とティッパーが人生で最高のセックスをしていたとオニオン紙が報じたときのことでした）。
983	health	鳥インフル（正式には鳥インフルエンザ）は、鳥類と哺乳類のいずれにも感染する恐れがあります。
915	science/technology	このカテゴリのアプリケーションの中には、ユーザーがスマートフォンを対象物に向けると、現実世界の看板やその他の対象物に書かれた外国語テキストを翻訳できるものもあります。
330	sports	ボベックほどこのクラブで多くの出場回数やゴールを挙げた選手は他にいません。
563	health	この研究では、腰痛患者の痛みと障害の関係には、抑うつ、恐怖、破局化が介在していることがわかりました。
496	health	外科医らにはケシの種子から抽出したモルヒネやヘルバネの種子から抽出したスコポラミンなど、各種の鎮静剤の知識がありました。
919	science/technology	GPS用の新しい地図を購入したり、スタンドアロン型GPS端末を購入したり、レンタカー会社で借りたりするよりも安上がりです。
1504	science/technology	人間以外の動物に育てられて成長した野生児は、人間を恐れたり、人間に無関心であるなど、その動物とほとんど同じような行動を（物理的な範囲内）を示します。
1422	politics	1683年に清朝（1644～1912年）軍が台湾西部および北部の沿岸部を占領し、1885年に台湾を清国の省とすることを宣言しました。
202	geography	降水量は、オアフ島の雨量計で6.34インチに達し、「有益」と記録されました。
109	science/technology	カプセルの速度は約12.8 km/秒（8マイル/秒）で、サンフランシスコからロサンゼルスまで1分しかかからないほどの速さです。
1521	science/technology	人間行動を解釈するそのような能力は、飼い犬などの動物にも共通しているのではないかとまで彼は示唆しています。
1479	science/technology	技術決定論のほとんどの解釈は、2つの一般論を共有しています。1つは技術の発展自体が文化的・政治的な影響を大きく超えた道をたどっていること、もう1つは技術が社会的に条件づけられたものではなく、むしろ内在する社会に「影響」を与えることです。
1163	politics	候補者は、その手続きのどの部分にも代表者を立ち会わせることができます。夕方には、特定の手順に従い、厳重な監視の下でボランティアによって開票されます。
1696	geography	小さい島々の大半は独立国か、またはフランスに関係する国々であり、有名な高級ビーチリゾートもあります。
866	travel	初めて途上国を旅行する場合、または世界各国の初めての地域を旅行する場合、潜在的なカルチャーショックを過小評価してはいけません。
1809	sports	パラリンピックの開催期間は2021年8月24日から9月5日までの予定です。日本全国の各地で催される競技もあります。
119	entertainment	このゲームは、アメリカ軍とイラク軍の間で繰り広げられた第二次ファルージャの戦闘を題材にしたもので、両軍の激戦を再現しています。
1175	sports	スブリングボックにとっては、5連敗が止まりました。
198	health	熱と喉の痛みを除けば、気分も良く、在宅で仕事をこなせる状態です。
144	science/technology	「それはすべてを元に戻さなければならないことを意味します」とエチオピアのリフトバレー調査所の研究者であり、本研究の共著者であるベルハネ・アスフォー氏は言いました。
1167	entertainment	当初、番組はトークラジオに特化したインターネットラジオサイト「TogiNet Radio」のみで取り上げられ、これは長寿サイトです。
908	science/technology	マスコミ関係の企業は、この目的について「海賊版を防するため」と主張して日常的に嘘をついています。
1196	sports	1日に授与されるメダルは18個のみなので、多くの国が表彰台に上がれませんでした。
111	science/technology	「スターダストはカリフォルニア州北部の西海岸を通過し、カリフォルニアからオレゴン州中央部、ネバダ州、アイダホ州、ユタ州を通過して空を照らすでしょう」とスターダストのプロジェクトマネージャーであるトム・ダックスベリー氏は語りました。
1722	travel	南アフリカにあるすべての国立公園と同様に、この公園には毎日保護費と入園料がかかります。
1989	travel	また、聖書の家長アブラハム、イサク、ヤコブ、そして彼らの妻たちが埋められているという伝説の埋葬地であるヘブロン方面に北上するバスも何本かあります。
512	health	ADDは仲間との関係に影響を及ぼします。ADDを持つ子がなぜそのように振る舞い、なぜそのように字を綴り、なぜ成熟度が違うのかを他の子供たちは理解できないためです。
1182	health	フランスは、オーストリア、ドイツ、スロベニア、ブルガリア、ギリシャ、イタリアに次いで欧州連合で当該ウイルス感染の被害を受けた7番目の国です。
393	politics	ドイツはこの攻撃に「シーリオン作戦」という暗号名を付けました。イギリス軍の重火器や物資のほとんどは、ダンカークから避難したときに失われていたので、軍はかなり弱体でした。
1908	science/technology	このサービスは、娯楽船をはじめとする船舶や、遠隔地でデータや音声を必要とする探検隊に頻繁に利用されています。
592	science/technology	動物の体は多数の細胞でできています。動物は食物を摂取して体内で消化します。ほとんどの動物は動くことができます。
550	sports	冬場にクロスカントリー走をしながら、ジムに通って上半身を鍛えれば、ランニングシーズンに向けて最高の準備となります。
1210	entertainment	1980年代には「タクシー」、「チアーズ」、「トレイシー・ウルマン・ショー」などの番組で活躍しました。
1232	entertainment	ラッカ・シンがチャッパン・ボグ・バジャンを披露し、歌手のラジュ・カンデルワルが共演しました。
1891	travel	新しい文化に易々と馴染めた旅行者も、現地固有の文化に馴染むのには苦労することがあります。
1798	entertainment	会場によっては、アルコール飲料を提供しています。しかし、酔うと判断力が鈍るので、優れたギャンブラーは誰でもしらふでいることの大切さを知っています。
738	travel	カフェネット・エル・ソルでは、30ドルで予約を受け付けており、1日券なら10ドルです。詳細についてはコルコバドのページをご覧ください。
1298	politics	ときには暴力的になるこの抗議行動は、予定されていた選挙が実施されなかったことが引き金となって、2011年以降に発生しました。
577	science/technology	細胞とは、あらゆる生物の体の基本単位であり、生物はいずれも1つ以上の細胞で構成されています。
733	sports	冬には北米で最高のスキーを楽しみ、夏には本格的なマウンテンバイクに乗ってみましょう。
1624	geography	地球上の川から海に注ぐ水の20%は、アマゾン川から流れ出ています。
185	sports	日曜日に予定されていたボローニャ戦の試合を前に彼はチームのホテルに宿泊していました。
1158	geography	「そうした熱挙動は、一定の温度をかなり保てる地球上の大洞窟ほど安定していないことが多いのですが、地中に深い穴ができる点は一致しています」と、米国地質調査所(USGS)宇宙地質学チームとアリゾナ州フラッグスタッフにあるノーザンアリゾナ大学のグレン・クッシング氏は述べています。
190	travel	華氏90度の暑さの中で待つ間、乗客に水が配られました。
1233	entertainment	木曜日の東京ゲームショウの基調講演で、任天堂の岩田聡社長は、同社の新型ゲーム機「ニンテンドーレボリューション」コントローラーのデザインを発表しました。
1548	politics	最近の最も注目すべき例として、第二次世界大戦の北大西洋作戦があります。アメリカはイギリスを助けるために大西洋を渡って人員や物資の輸送を試みました。
647	entertainment	ですから、私たちの多くは、テレビ番組で放映されるプロセスや経験に私たちが参加したり知識を応用したりはできないことに気づくわけです。
1522	science/technology	20世紀の研究では、遺伝的変異には隠れたものと発現したものの2つの遺伝子プールがあることがわかっています。
601	science/technology	気体としての窒素には液体窒素と同じ性質があります。液体の方が高密度ですが、分子数は同じです。
1747	sports	アルゼンチンは、世界最高のポロチームとポロ競技選手を擁することで有名です。
142	sports	ユタ・ジャズの選手が新型コロナウイルス感染検査で陽性反応を示したことを受けて、NBAの決定が下されました。
1802	travel	また、雪が降ったり吹きつけたり、車窓が結露や氷で覆われて視界が制限されることもあります。
825	travel	必要に迫られたり、ライフスタイルやチャレンジのために、安く見たいと思っているのであれば、いくつかの方法があります。
1144	politics	連合軍とアフガニスタン軍が当該区域に進入して現地の安全を確保し、支援のために連合軍のその他の航空機も派遣されています。
1850	sports	スキーによるバックパック旅行：このアクティビティは、バックカントリースキー、スキー旅行、スキーハイキングとも呼ばれます。
1033	science/technology	彼らは、太陽が他の星と同じ基本原理で動いていることを発見しました。星系内にあるすべての星の活動は、その光度と自転によってのみ駆動され、その他の要因はないことがわかりました。
1848	sports	スキーの概念は非常に古く、洞窟に描かれたスキーヤーの絵は紀元前5000年にまでさかのぼります。
228	geography	このような傾斜面は月のいたるところに見られ、風化は最小限に抑えられているようで、傾斜面を作り出した地質学的事象がかなり最近のものであることを示しています。
292	geography	山麓に火山活動とは無関係の暗雲が報告されています。
1225	sports	第2セットでは、デル・ポトロが序盤から優位でしたが、6-6に追いつかれた後、またもやタイブレークが必要となりました。
1416	sports	人気のスポーツは、サッカー、バスケットボール、バレーボール、水球、フェンシング、ラグビー、サイクリング、アイスホッケー、ローラーホッケー、F1モーターレースなどです。
129	entertainment	ブカレスト市では、今年6月から8月にかけて、世界最大のパブリックアートイベント「カウパレード」がヨーロッパ南東部で初めて開催されます。
1003	science/technology	彼はWi-Fiで鳴るドアベルを作ったそうです。
271	health	リー博士は、トルコの子供たちがA型（H5N1）鳥インフルエンザウイルスに感染したという報告にも懸念を示しました。
103	politics	このコメントはテレビで生中継されたもので、イランの高官が制裁の効果を認めたのは初めてのことでした。
14	sports	試合後にキング・オブ・クレーは、「最も重要なイベントの決勝に戻ってきたことに興奮している。これに勝つためにここに来た」と語りました。
1412	politics	議会には課税する権限がなく、国の執行機関や司法機関がなかったため、議会のすべての行為を州当局に頼っていましたが、州当局はしばしば非協力的でした。
1811	travel	延期が発表される前に2020年の航空券や宿泊施設を予約していた方は、面倒な状況に陥る可能性があります。
1681	science/technology	技術は、仮想社会科見学による学習方法を提供します。生徒たちは、教室に居ながらにして、博物館の工芸品を見たり、水族館を訪れたり、美しい芸術を鑑賞したりできます。
335	entertainment	トルコの歌姫セゼン・アクスは、イタリアのテノール歌手アレッサンドロ・サフィーナやギリシャの歌手ハリス・アレクシウと共演しました。
378	science/technology	約3,000年後の1610年、イタリアの天文学者ガリレオ・ガリレイが望遠鏡を使って観測し、金星にも月と同じように満ち欠けがあることを発見しました。
1367	science/technology	科学者たちは、オセロットは地面の匂いを嗅いで餌になる動物（獲物）が通った場所を探し、追いかけると考えています。
703	travel	人数の多い団体ならばツアーがお得になるので、1人旅や友人と2人で旅行する代わりに、寄り集まって4～6人の団体で参加すれば、1人当たりの料金がお得になります。
297	politics	改正案は2011年にすでに両院を通過している。
80	sports	その後、マルーチドールは予選決勝でカブールチュールを破りました。
1823	travel	免税ショッピングとは、特定の場所で消費税や物品税が免税された商品を買い物できる機会のことです。
836	travel	建築は、建物の設計や建設に関係しています。場所によっては、建築物自体が観光名所となっています。
880	travel	これらの要件は、旅行者がどの国を訪問したことがあるか、または訪問しようとしているかによって異なる場合があります。
1143	politics	また、南西アフリカ人民機構（SWAPO）も与党として議会選挙で過半数の議席を維持しました。
650	science/technology	ホテルや宿泊先（ゲストハウスや個人宅に滞在している場合）には無線LANやインターネットに接続されたPCが設置されている可能性が高く、どの集落にもインターネットカフェや公共の無線LANが設置されている場所があります。
702	travel	旅行日からパスポートの有効期限まで6か月以上なければなりません。滞在期間を証明するには、復路または第三国行きの航空券が必要です。
1604	travel	毎朝、小さな田舎町を出発して職場に向かう人々は、自分たちの出発地付近に職場がある人たちとすれ違います。
817	sports	バルセロナの「Running Tours Barcelona」やコペンハーゲンの「Running Copenhagen」をルーツに、プラハを拠点とする「Running Tours Prague」などがすぐに参加しました。
1763	travel	毎年、適切な距離を保たなかったために、何十人もの旅行客が負傷しています。こうした野生動物は大型で潜在的に危険であるため、縄張りに入らないようにしましょう。
1290	politics	イスラエルは、この協定が結ばれれば10年間にわたる峡谷での駐留継続を要求するとしていますが、その一方でパレスチナ自治政府が同意している駐在期間は5年間のみです。
1775	entertainment	主な地ビールは「ナンバーワン」という名称で、手の込んだビールではないものの、爽やかで飲み心地がスッキリとしたビールです。もう1つの地ビールは「マンタ」という名称です。
642	science/technology	インターネットやウェブを利用することで、学習者はいつでも情報にアクセスできるようになります。
1544	politics	1939年9月17日までに、ポーランドの防衛はすでに破られており、唯一の希望はルーマニアの橋頭堡に沿って退却し、再編成することでした。
1148	health	国境なき医師団のリチャード・ヴェールマン報道官は次のように述べています。「アンゴラでは過去最悪の大流行が予想され、状況は非常に悪いままだ。」と述べました。
801	health	お酒はほどほどに飲むようにしましょう。アルコールの影響は人それぞれであり、自分の限界を知ることは非常に重要です。
1741	travel	橋の全面開通は2017年9月の予定で、ブラジル税関の検問が終わる頃になると予想されています。
1140	entertainment	ウィンフリーは最後の場面で涙を流しましたが、ファンには戻ってくることをはっきりと伝えました。
1267	health	エドガー・ベギラさんは腕と顎を負傷し、クリストファー・シュナイダーさんは顔の再建手術が必要なほどの重症を負いました。
1774	entertainment	これらはたまに混雑する家族向けのビーチで、海岸にはさまざまな店舗が並んでいます。安全に泳ぐことができます。
862	health	しかし、細菌学的な動物相を経験していない他の地域では、問題に直面する可能性がはるかに高いのです。
1069	politics	レイトン氏は首相との会談で保守党の環境法案に対する変更を求め、保守党の環境法案の「徹底的かつ完全な書き直し」を求めました。
325	geography	国立ハリケーンセンターの科学者らによれば、ダニエルはこのまま発達して水曜日までにハリケーンになると予測されます。
1314	health	ホルモンを投与すると胎児の肺の成熟が早まることが彼の研究でわかりました。
704	travel	しかし、この場合は警戒心を解いてはいけません。多くの場合、観光客はごちゃ混ぜに乗車させられるからです。
528	sports	近代スポーツのフェンシングは、大学生からプロやオリンピック競技まで、さまざまなレベルで行われています。
532	sports	最少の打数またはクラブのスイング数でコースを終えた選手が勝利します。
1643	science/technology	さらに新しいものが登場したら、キーボードはどうなるのだろうかと思ってしまいます。
868	travel	特に、最初の数日間は、慣れるために、欧風の高級なホテルや食事、サービスにお金をかけることを検討してみてはいかがでしょうか。
124	entertainment	ヘックとジョンソンは、The Daily ShowやThe Colbert Reportよりもずっと以前の1988年にUWの学生だった頃のニュースをパロディー化した出版物を構想していました。
1159	politics	フランスでは、投票は伝統的に旧式な設備で実施されます。有権者はブースで隔離され、あらかじめ印刷された候補者を示す用紙を封筒に入れます。
701	travel	米国のグリーンカードを保有するキューバ市民は、エクアドル領事館を訪れて免除を受ける必要があります。
560	health	被害者を保護するには、まず現場を調査して安全を確保しなければなりません。
167	politics	この攻撃は、インドとパキスタンの関係に大きな負担をかけました。
301	politics	監督業以外でヴォーティエの業績としては、1973年に政治的検閲に反対してハンガーストライキを実施したことが挙げられます。
40	entertainment	WNED Buffalo（リーディングレインボーの放送局）のジョン・グラント氏は、「リーディングレインボーという番組は子供たちに、なぜ本を読むのかを教えてくれました。本を手に取って読むように子供たちに促してくれたのです」と語りました。
1414	politics	条項の改正には、全州から全会一致の同意が必要でしたが、各州は中央政府を軽視していたので、代表者が欠席することもしばしばでした。
1789	travel	しかし、変更願いや要望は、ホテルに直接ではなく、まず旅行代理店に連絡してください。
754	travel	第二次世界大戦前の19世紀から20世紀初頭にかけて利用された蒸気鉄道や外洋定期船の黄金時代の遺産を受け継いでいるホテルもあります。
1142	politics	ナミビアの大統領選挙と議会選挙の最終結果は、現職のヒフィケプニェ・ポハンバ大統領が大差で再選されたことを示しています。
1022	politics	本件は、トランプ大統領がトルコのレセップ・タイップ・エルドアン大統領と電話会談した後で発表されました。
538	travel	観光客は、1国のさまざまなランドマークを訪れることも、1つの地域のみに集中するという選択肢もあります。
155	geography	これらの岩石のうち15個は、昨年7月に落下した隕石群に 起因するものです。
1278	health	車の衝突時には３人が家の中にいましたが、怪我人はいませんでした。
1197	sports	具体的には、昨日のスーパーGで女子スタンディングクラスでアンナ・ヨシェムセンが9位に終わったオランダや、同じイベントでカチャ・サーリネンが10位に終わったフィンランドなどです。
1541	politics	第二次世界大戦ではドイツは共通の敵であり、ソ連とアメリカの協力につながりました。終戦後、両国は制度やプロセス、そして文化の衝突により、反目し合うことになりました。
1111	health	この大流行により、インド政府は深刻な影響を受けた地域への豚捕獲員の配置、数千張の蚊帳の配布、殺虫剤の散布などの措置をとりました。
889	geography	南極大陸の内陸部は、厚さ2～3 kmの氷に覆われた荒涼とした台地です。
324	geography	暴風雨は、フロリダ州マイアミから約3,000マイルの位置にあり、最大持続風速は40マイル（時速64キロ）です。
118	entertainment	ゲームメーカーのコナミは本日、日本の新聞で、「Six Days in Fallujah」というゲームをリリースしないことを明言しました。
