index_id	category	text
47	sports	A1GPニュージーランドチームのコ・ドライバーであるジョニー・リードは本日、48年以上の歴史があるニュージーランドのオークランド・ハーバー・ブリッジを違反なく最速で駆け抜け、歴史に名を刻みました。
1038	science/technology	802.11n規格に準拠していれば、2.4Ghzまたは5.0Ghzのどちらの周波数でも通信可能です。
1268	health	ウカの武器は5人目の男の頭に向けられて失敗した。シュナイダーには痛みがあり、片目は失明し、頭蓋骨の一部が欠損し、顔はチタンで再建されている。
1418	geography	日本には約7,000の島々があり、その最大は本州列島で、世界で7番目に大きい島とされています。
1899	entertainment	夜空の下でピラミッドに映像が浮かび、ピラミッドが次々とライトアップされます。
272	health	一部の研究は、世界的な流行になる前に、この病気による致死性を低下させなければならないと示唆している、と彼は指摘した。
943	travel	外国での生活やボランティア活動は、異文化を知り、新しい人々と出会い、自分について学び、視野を広げ、さらには新しい技術を身に付けられる優れた方法です。
1201	health	2010年の地震後にハイチ国内でコレラが大流行したが、その発生源が国連平和維持軍の部隊の宿営地だった疑いが浮上し、軍が非難を受けています。
267	science/technology	この事件は、告発を扇動した大手インターネットサービスプロバイダーAOLの本拠地であるバージニア州で起訴されました。
1708	travel	旧メディナ周辺では、タジン、陶器、革製品、フックアなど、モロッコの伝統的な商品を売る場所が簡単に見つかりますが、それらはすべて観光客向けです。
928	travel	今日の空の旅では、まず航空券を検索して価格を比較するのがふつうであり、航空会社に直接予約を入れることはほとんどありません。
1391	geography	中東の温暖な気候に暮らす人々にとって家屋はそれほど重要ではありませんでした。
1229	entertainment	夜は、歌手のサンジュ・シャルマから始まりました。ジャイ・シャンカール・チャウドダリが後に続き、ラッカ・シンもチャッパン・ボーグ・バジャンを披露しました。歌手のラジュ・カンデルワルが共演しました。
586	science/technology	これらの望遠鏡は、2つのレンズを組み合わせたもので、遠方にある物体を近くにあるように拡大して見せる働きをします。
1695	geography	マダガスカルは群を抜いて最大の島であり、野生生物の生息地としては独自の大陸です。
802	health	過度の飲酒を続けた場合に考えられる健康被害としては、肝臓障害、失明や死亡といったものがあります。違法に製造されたアルコールの摂取は、潜在的に高い危険性を伴います。
1881	politics	性別の記載がないパスポート（性別欄「X」）を発行したり、本人の希望に応じた名前や性別に更新した書類を発行する政府の意思はさまざまです。
1379	science/technology	その長い顎には70本以上の鋭い歯が並び、口蓋には別の歯列があり、つまりここを通ったら逃げ道はないということになります。
1550	politics	連合国が敗れていたら、ドイツはおそらくヨーロッパの他国と同じように英国を征服できていたことでしょう。
333	entertainment	次いで、イスタンブール国立交響楽団、ヤニサリーバンド、歌手のファティヒ・エルコッチとミュスルム・ギュルセスが登場しました。
719	geography	ドミニカ共和国（スペイン語：República Dominicana）は、カリブ海に浮かぶ国で、ヒスパニオラ島をハイチと分け合って島の東半分を占めています。
1780	travel	サンゴ礁への旅行は一年中行われ、サンゴ礁での上記のい原因によるする怪我は稀にしかありません。
1841	travel	馬から放り出される瞬間に鐙に足が引っかかっていると、逃げようとする馬に引きずられてしまう恐れがあります。この危険を最小限に抑えるために、いくつもの安全対策を講じることができます。
471	politics	そのコンセプトは、欧州では一国の強大化を防ぐために、どの国の政府もしばしば同盟関係を変えながらバランスを維持するというものでした。
1634	science/technology	これは固体、液体、気体、プラズマという物質の4態（この順）に近いものですが、彼の理論はそれらが新しい物質に変化してこの世界に見えるものを形成することも説いていました。
1255	science/technology	研究者らは、メラミンとシアヌル酸の添加によって猫の尿に形成された結晶を観察しました。
845	entertainment	しかし、現在では、著名なグラフィティアーティスト、グラフィティイベント、そして専用の「合法的」な壁面が存在します。この文脈におけるグラフィティペインティングの多くは、判読不能な記号類ではなく美術品に類似する扱いとなります。
1776	entertainment	フランスワインも手に入りやすいのですが、せっかくの旅ですからニュージーランドやオーストラリアのワインを試してみましょう。
1845	travel	頂上から眺めると、息をのむような景色が広がります。世界各地の登山家たちが、無限の可能性を秘めた壁に囲まれ、新しいルートを確立し続けています。
1151	sports	南部の姉妹国との対戦では明らかに錆びついているように見えましたが、南アフリカは大会が進むにつれて着実に調子を上げていきました。
1054	politics	この議論は、ハリケーン・カトリーナの去った後の救済と復興にかかる支出をめぐる論争に端を発していました。一部の財政保守派は、ユーモアを込めてこれを「ブッシュのニューオリンズ政策」と呼んでいます。
1859	geography	この定義には地理的な変動があり、北米などでは欧州よりも年齢制限の範囲が狭まる可能性があります。
1007	health	実験的なワクチンでエボラの死亡率が減るように見えますが、今までのところ、既存の感染症の治療に適しているとはっきり実証された薬剤はありません。
1076	politics	ブッシュ大統領の報道官であるゴードン・ジョンドロー氏は、北朝鮮の公約を「朝鮮半島の検証可能な非核化を達成するという目標に向けた大きな一歩」と表現しました。
1099	geography	重さが1,000ポンドを超え、時速約17,500マイルで移動していた人工衛星は、地球の上空491マイルのところで衝突しました。
1100	science/technology	科学者によると、この衝突による爆発は大規模なものでした。
367	science/technology	血液は、動脈と呼ばれる管を通って心臓から送り出され、静脈と呼ばれる管を通って心臓に戻ります。最小の管は毛細血管と呼ばれます。
770	entertainment	寺院の例祭のほとんどは、寺院ごとの記念日、主宰神の誕生日、その他の祝い事、または寺院に関連する他の主要行事の一環として催されます。
279	politics	勝者総取りの州として、フロリダ州ではロムニー氏は50人の代議員を獲得したことで、共和党指名候補の筆頭候補に押し上げられました。
357	science/technology	かつてのエネルギー準位に復帰するためには、光から得た余分なエネルギーを除去しなければなりません。
797	science/technology	ノートパソコンやタブレットを携行して旅行する場合は、（インターネットなしでアクセス可能な）メモリやディスクに保存しておいてください。
211	health	重傷者は報告されていませんが、爆発時に現場にいた5人以上がショック症状に陥って治療を受けました。
815	travel	国際的には、200近くの旅ラン運営組織があります。そのほとんどが独立系です。
238	geography	「私たちの知る限り、タイタンよりもダイナミズムを発揮する惑星は1つだけで、その名は地球です」とストファン氏は付け加えました。
1636	science/technology	カルシウムやカリウムなどの元素は金属とされています。もちろん、銀や金などの金属もあります。
761	travel	利用可能な宿泊先の一覧は、印刷物やオンラインで提供され、他の旅行者による評価や意見が掲載されることもあります。
1676	science/technology	AI研究には、知能を必要とする行動が求められるタスクを自動化する機械の製作が関わってきます。
848	entertainment	オーストラリアで手に入るブーメランのほとんどは、実際は戻って来ません。初心者の方は、風の強い場所では投げない方が良いでしょう。
1089	science/technology	この理論によると、銀河の周りにある暗黒物質のほとんどは、一種のハローのように銀河を取り巻き、たくさんの小粒子でできていると言われています。
984	health	人間について報告された症例は1000件以下ですが、致死的な症例もあります。
305	sports	オリンピックで2つの金メダルを獲得した日本人柔道家の斉藤仁さんは54歳で亡くなりました。
697	travel	エルサレムには、数多くの歴史的、考古学的、文化的遺跡があり、活気に溢れた賑やかな商店街、カフェ、レストランがあります。
826	travel	基本的には、旅行中に仕事をするか、出費を抑えるかの2つに分かれ、この記事では後者に焦点を当てています。
1672	health	さまざまなタイプの脳損傷、外傷、病変、腫瘍が行動に影響を与え、精神機能の一部に変化をもたらすことが長い間にわかってきました。
536	travel	ビーチ、テーマパーク、キャンプ場は、観光レクリエーション客がよく訪れる最も一般的な場所です。
1909	science/technology	このサービスへの接続方法については、居住地の電話会社が詳しい情報を提供してくれるはずです。
611	science/technology	コンピューターで高度なアニメーションを制作でき、そういったアニメーションがテレビや映画で放映されることが増えています。
157	sports	レース後もケセロウスキーが2,250ポイントを獲得してドライバーズチャンピオンシップのトップをキープしている。
1294	politics	昨日、マルテリーは9人のメンバーで構成される新しい臨時選挙管理委員会会（CEP）で宣誓しました。
1803	travel	一方、多くの国では氷雪の多い状況が普通ですが、交通は1年中ほぼ途切れることなく続いています。
359	science/technology	科学者たちはこのプロセスを「放射線の刺激放出」と呼びますが、これは明るい光によって原子が刺激を受けて光の粒子を放出するためであり、光は放射線の一種です。
302	politics	フランス法が改正されました。彼の活動の始まりは15歳のとき、第二次世界大戦中にフランスのレジスタンスに参加したことでした。
455	science/technology	レンズメーカーが生産するレンズが高い基準に達するにつれ、これは問題ではなくなりつつあります。
25	sports	この夜、オベーチキンの最初のアシストは、ルーキーのニックラス・バックストロームが決めた決勝ゴールでした。
1606	science/technology	科学は今、この大規模な炭素経済によって、過去200万年間にわたって人間の進化を支えてきたその安定した状態の1つから生物圏を外したことを示しています。
79	sports	この両チームはメジャー準決勝で相まみえ、11点差でヌーサが勝ち抜きました。
952	travel	よく利用する航空会社に入会する方がわかりやすいと思われるかもしれませんが、航空会社ごとに特典が異なることが多く、同じアライアンス内の異なる航空会社の方がマイレージポイントがたまる場合があることを知っておくとよいでしょう。
995	travel	該当する航空会社は、エア・カナダ、デルタ航空、ルフトハンザ、ウェストジェットなどです。
266	science/technology	ロシアの地上管制管が一連のジェット機を稼働し、宇宙ステーションは正常な姿勢を取り戻しました。
112	politics	ラッド氏が京都議定書に署名したことで、米国は孤立し、先進国で議定書に批准しない唯一の国となった。
1050	politics	本報告書は、イラクに対する行政府の現在の政策のほぼすべての側面を強く批判し、即時の方向転換を促すものです。
1609	travel	なぜ、交通機関はこのような苦情を生み、日常的に故障するのでしょうか。交通機関の技術者が無能なだけなのでしょうか。それとももっと根本的な問題があるのでしょうか。
1316	sports	仲間のレスラーたちもルナに敬意を表しました。
291	geography	相変化につながる大きな地震活動は、3月10日に火山の山頂カルデラの北東側で発生していました。
1215	travel	初期の報告では、この飛行機はウルムチへの緊急着陸を拒否された後、行く先を変更してアフガニスタンに向かったとされています。
1270	sports	水曜日のイベントの後、カルパネドは選手権で2つの個人レースに出場しました。
663	entertainment	サンフランシスコはその他のアジア料理でも全米で指折りの都市であり、韓国料理、タイ料理、インド料理、日本料理など各国の店が揃っています。
91	politics	ロディン氏はまた、アフガニスタンの人々が負担することになる決選投票にかかる費用と安全保障上のリスクを避けるために、当局が出馬を中止することにしたと述べました。
371	science/technology	トリケラトプスは木の幹を食べる前に、その強靭なくちばしで葉をはぎ取っていた可能性があります。
1806	travel	象やキリンなど、一部の動物は車に近寄ってくる傾向があるので、標準的な機器を利用すればはっきりと観察できます。
930	travel	観光やビジネスで短期滞在するのであればビザがいらない場合もありますが、留学生として渡航する場合は、一般的にカジュアルな観光客として渡航するよりも長期滞在が必要となります。
33	sports	ピケJr.は2009年のハンガリーGP後に解雇されました。
0	health	月曜日にスタンフォード大学医学部の科学者たちは、細胞を種類別に分類できる新しい診断ツールを発明したと発表しました。それは標準的なインクジェットプリンタで印刷して製造できる小型チップであり、原価は1枚あたり1円ほどす。
200	geography	フェリシアは、かつてサフィール・シンプソン・ハリケーン・スケールでカテゴリー4の嵐でしたが、徐々に弱まって熱帯低気圧になり、火曜日に散逸しました。
873	entertainment	もっと冒険したいと思ったら、この機会にスムージーを絞るかブレンドしてみてはいかがでしょうか。
774	entertainment	国際園芸博覧会は、園芸に特化した催しであり、花の展示、植物園、その他植物栽培に関わるあらゆるもが展示されます。
1377	science/technology	私たちは植物で家を造り、植物から衣類を作ります。日々食べる食材の多くが植物です。植物がなければ動物は生きていけません。
203	geography	降雨によっては雷雨や頻繁な雷を伴うものもありました。
1365	science/technology	虎の咆哮は、ライオンのような雄叫びではなく、どちらかというと威圧的な脅し文句のような咆哮です。
1176	sports	その試合はすでに2週間前にトロフィーを獲得したオールブラックスの最後の試合でした。
879	health	多くの政府は、入出国者に様々な病気の予防接種を義務づけています。
110	science/technology	スターダストは、1969年5月にアポロX号のコマンドモジュールを帰還させた際の記録を更新し、地球に帰還した宇宙船の最速記録を更新することになります。
1494	science/technology	自給自足農業とは、生態系地域に自生している保存された種子を、輪作やその他の比較的単純な技術と組み合わせて収量の最大化を図るシンプルなシステムで、多くの場合は有機的な農業です。
1086	science/technology	このチームが求めていた効果は、銀河系の暗黒物質と天の川の暗黒物質の間で働く潮汐力による作用だったのでしょう。
1623	geography	アマゾン川は地球上で最も広い川でもあり、川幅が6マイルに及ぶ場所もあります。
1222	entertainment	そのロックバンドは9月16日までアメリカとカナダをツアーで回る予定でした。
1357	science/technology	最後に、昆虫、げっ歯類、トカゲ、鳥といったはるかに多数の小さい獲物を餌とする小型の猫（野良猫を含む）が数多く生息しています。
216	sports	スカッシュ、空手、ローラースポーツは、2005年にオリンピックから除外された野球やソフトボールと同じようにオリンピック種目の候補に挙がりました。
327	sports	クロアチアの首都ザグレブで生まれたボベックは、パルチザンベオグラードで活躍していた頃に有名になりました。
277	politics	元マサチューセッツ州知事のミット・ロムニー氏は、火曜日に行われたフロリダ共和党大統領選挙で46%以上の得票率で勝利しました。
428	geography	トルコの領土は、長さ1,600 km以上、幅800 km以上でのほぼ長方形です。
1709	travel	ゴマはコンゴ民主共和国の観光都市でルワンダに近い極東にあります。
565	health	定期的な活動に参加している人は、慢性疼痛と正常な身体運動から生まれる不快感との違いを区別する痛みの否定的知覚については、より多くの支援が必要でした。
742	travel	小さいながらもここを訪れると、年配の旅行客の中には、大きな観光ホテルなどが開発されていなかった州制施行前のハワイを思い出す人もいます。
531	sports	通常のラウンドでは18ホールを回り、選手は原則としてコースの第1ホールから開始し、第18ホールで終了します。
729	travel	ボーエン島は、カヤック、ハイキング、買い物、食事などを楽しめる日帰り旅行や週末のお出かけに人気のスポットです。
1427	science/technology	例えば、世界で最も普及している静止画写真のフィルム形式は35 mmで、これはアナログフィルム時代の終わり頃には主流のフィルムサイズでした。
865	health	寒冷気候で呼吸器系の問題が起きやすいように、高温気候で腸の問題が起きるのはかなり一般的で、ほとんどの場合、明らかに迷惑を被りますが、本当に危険ではありません。
205	travel	2回目の進入から着陸しようとしていた約10分前に姿を消しました。
374	science/technology	地球で体重200ポンド（90kg）の人はイオでは約36ポンド（16kg）になります。当然、重力は軽くなります。
275	politics	コメンの政策は、クリフ・スターンズ下院議員が行っている、米国家族計画連盟による資金使途や報告方法に関する調査が保留中であるため、同連盟を不適格としました。
1991	travel	内陸の水路に沿った散策は休日を過ごすうえで面白いテーマになるでしょう。
349	science/technology	科学者たちは、同じようにエネルギーを生み出せる原子炉の開発に取り組んでいます。
1325	science/technology	セントラルミズーリ大学の数学者でコンピュータサイエンスのカーティス・クーパー教授は1月25日、これまでに知られている素数の中で最大の素数を発見した。
1854	travel	ヨーロッパは比較的小さな大陸ですが、独立国が多数あります。通常の状況では、複数の国を旅行しようとすると、ビザの申請や入国審査がに何度も必要になります。
946	geography	白海・バルト海運河は、オネガ湖、ラドガ湖、サンクトペテルブルクを経由して北極海とバルト海を結び、河川や湖が運河の一部になっています。
182	politics	「公衆衛生と刑事司法の両方の観点から、この法案をできるだけ早く成立させることが重要であると」、政府の広報担当者は述べている。
1288	politics	漏れ聞いた情報によれば、当該文書は国境紛争に言及するもので、パレスチナの希望は1967年の中東戦争前の国境に基づくものです。
1639	science/technology	原子は想像を絶するほど微小なので、この文の最後のピリオドに何兆個という原子が収まる可能性がありまです。
69	entertainment	バンドはマウイ島の戦争記念スタジアムで90,000人を集客する予定でしたが、その公演をキャンセルし、ファンに謝罪しました。
12	sports	最近では、ブリスベン・オープンでラオニッチに敗れています。
508	health	注意力欠如障害とは、「神経学的症候群であり、その古典的定義は衝動性、注意力散漫、多動またはエネルギー過多の3つの症状です。
1794	travel	冬に北バルト海を横断する場合は、船室の位置を確認してください。氷の中を突き進む際に最も影響を受ける船室では恐ろしいほどの騒音が鳴り響きます。
667	entertainment	eBayやCraigslistなどのオークションサイトで販売されオンラインで購入できる入場券の多くは使いかけの複数日分のパークホッパーチケットです。
127	entertainment	そうした作家たちの多くは、ジョン・スチュワートやスティーブン・コルバートのニュースパロディ番組に大きな影響力を及ぼすようになりました。
1236	sports	ジャンカルロ・フィジケラがマシンをコントロールできなくなり、スタート直後にレースから脱落しました。
160	sports	ドライバーズ選手権のトップ10にはスチュアート、ゴードン、ケンゼス、ハーヴィックらが入賞し、シーズンは残り4レースとなりました。
1732	geography	スンダルバンスの面積は3,850 km²で、その約3分の1は水域/湿地帯で覆われています。
1940	geography	かつてはスミルナの古代都市でしたが、今では巨大な湾を中心に山に囲まれた、近代的に開発された賑やかな商業中心地となっています。
37	entertainment	このPBSの番組はエミー賞を20回以上も受賞しており、この番組よりも長寿の番組は「セサミストリート」や「ミスター・ロジャースのご近所さんになろう」しかありません。
726	entertainment	庭園の周りにはレストランが何件もあり、午後や夕方には中央の見晴台で無料のコンサートが開かれることもあります。
1507	science/technology	スキャフォールディングにはバーチャルとリアルの両方があります。言い換えれば、教師はスキャフォールディングの一形態であり、Microsoft Officeのクリップ人形もそうです。
1318	sports	ダスティン・「ゴールドダスト」・ラネルズは、「ルナは俺と同じくらい異常だった…あるいはそれ以上だったかも...彼女を愛しているし、彼女がいなくて寂しくなるよ…叶うならば、彼女には天国にいてほしい」とコメントしました。
379	science/technology	金星の位相は、太陽に面した金星（または月）の側面のみが明るくなるために発生します。金星の満ち欠けは、惑星は太陽の周りを回っているというコペルニクスの理論を裏付けるものでした。
1237	sports	チームメイトのフェルナンド・アロンソはレースの大半をリードしていましたが、ピットストップ直後に右フロントホイールの収まりが悪かったためか、レースから脱落しました。
