index_id	category	text
912	science/technology	Pɩfɛyɩnɩ ɖɔɖɔ kɩjɛyʋʋ se  ɩwɛɛna mayaɣ nakɛyɛ mɩ-tɛ cejewiye yaa haɖaa mba pa-taa ɩwɛɛ yɔ. Ɩñɩtɩ ɩlɩzɩ mayaɣ nakɛyɛ ŋga kawɩlɩɣ sɩ ɩwɛ Arizona wɩsɩ taa yɔ, pɩtɩŋna Ɩnternɛtɩ heelim ñɩɣyʋʋ ŋgʋ kʋwɛ ɛssɔtaa Cikeŋ tɛtɛ laʋ taa yɔ.
987	geography	"Ñʋʋ yɔɔ tayɩ pʋŋ ɩnɩ payaɣ-ɩ se ""vidde"", pɩ-tɔbʋʋ lɛ se tɛtʋ ndʋ tɩwalaa nɛ tɩwɛ haaa, tɩŋ fɛyɩ tɩ-yɔɔ, tɛtʋ ndʋ tɩfɛyɩnɩ kamaɣ yɔ."
819	travel	"Alɩwaatʋ ndʋ iwoki nɔmɔʋ yɔ, ɩtɩlɩ ɛsɩɩ se pɩ-tɩŋa pɩɩkaɣ wɛʋ ɛzɩ pɩwɛʋ ""mɩ-tɛ"" yɔ. Sɔnzɩ, paɣtʋ, tɔɔnaɣ, habɩyɛ yɔɔ ɖɔnɛ, ɖɩzʋyɛ, paɣtʋ kila, nɛ lɛɛbʋ mbʋ yɔ, pɩkaɣ nabʋyʋ taa wɛʋ ndɩ nɛ ɖenɖe ɩwɛɛ yɔ."
798	travel	Ɩcɛlɩ ɖɔɖɔ mɩ-paɣtʋ takayɩsɩ lɛzɩŋ/yaa taabalaa mba mɩ nɛ wɛ iwoki nɔmɔʋ, mɩ-lʋlɩyaa nɛ taabalaa mba papɩzɩɣ nɛ pasɩnɩ kpɛdɛyɛ yɔ pa-masɩ.
1035	science/technology	Alɩwaatʋ ndʋ Rossby akɔnta mayaɣ wɛɣ ñɩɩ nɛ pɩkpaɖɩ yɔ, tɩɩŋa ɛɛlakɩ tʋmɩyɛ ɖɔɖɔ sakɩyɛ pɩlɩɩnɩ ɛzɩma kɔhɔŋ wondu lɛɛtʋ yɔ.
1228	entertainment	Hendu teyaa mba pa-hɩla sɛwa yɔ paha bhajans waa ɛjaɖɛ kpeekpe taa, yaa Ɛsɔ sɛtʋ hendu, Shri Shyam nɩŋgbanzɩ tɛɛ.
1039	science/technology	Pɩkaɣ yebu se kɩla nɔɔ kʋɖʋmaɣ nɛ kɩ-wayɩ mba 802.11a, 802.11b nɛ 802.11g nɛ tʋmɩyɛ ɖɩlaɖɛ wɛɛnɩ raadiyoowaa mba palakɩ tʋmɩyɛ nabʋlɛ taa yɔ.
1375	science/technology	Tɩŋ lɩzɩɣ helim kɩbam mbʋ ɛyaa feziɣ yɔ, nɛ ɩkpakɩɣ helim kɩdɛkɛdɩm mbʋ ɛyaa ñalɩzɩɣ yɔ (pʋ-tɔbʋʋ se palɩzɩɣ-ɩ alɩwaatʋ ndʋ petisiɣ fezuu yɔ).
772	entertainment	Ɛjaɖɛ kpeekpe yɔɔ wondu pɛdʋʋ kɩyakʋ (ŋgʋ payaɣ ɖoŋ ɖoŋ se kedeŋa kpeekpe yɔɔ wondu wɩlʋʋ, yaa kɛlɛʋ yem se Expo yɔ) kɛ ɛjaɖɛ kpeekpe yɔɔ ajana wondu nɛ lɛɣtʋ ñɩnʋʋ kazandʋ sɔsɔtʋ.
735	travel	Sirena ɖeke kɛnɩ laŋ yɔɔ kandɩyʋʋ tʋmɩyɛ nɖɩ ɖɩhaɣ ɖɩzʋyɛ nɛ tɔɔnasɩ nzɩ sɩwɛ miŋ yɔ, pɩtasɩna kizinzikiŋ lɛ. Lewoona, Saŋ Pedriyoo nɛ Losi Patoosi, kizinzikiŋ ɖeke pahaɣ, tɔɔnaɣ fɛyɩ.
1350	science/technology	Alɩwaatʋ ndʋ ŋyaɣ nɔɔyʋ wepi eposini-ŋ nɛ miles waa kudokiŋ sakɩyɛ, ŋwɛɛ ŋtɩŋɩɣnɩ satellite yɔɔ.
1419	geography	Lɩm hɛkʋ taa tɛtʋ sakɩyɛ ndʋ kɩwɛna yɔ tɩ-yɔɔ lɛ, ɖoŋ ɖoŋ lɛ payaɣ Japɔŋ se ʺarɩsipɛɛlɩʺ yaa ʺlɩm hɛkʋ taa tɛtʋ sɔsɔtʋʺ.
1601	travel	Kedeŋa maɣmaɣ tɛ kɔjɔka hɔŋ aleɣya nʋmɔʋ wodaa se pɔcɔna kedeŋa wɛtʋ nɛ tʋŋ nɛ tɛtɛ kpɩna.
1812	sports	Politiiki lɩmaɣza wena pakpakɩɣ se paatasɩɣ labʋ aleɣya naayɛ yɔ apɩzɩɣ awɛɛ ndɩ ndɩ, ɛlɛ lakɩŋ fenaɣ kaatɛŋ lɛ, politiiki lɩmaɣza ana a-taa sakɩyɛ wena añɩkɩɣ nesi koroona kʋdɔmɩŋ yɔɔ yɔ, aatalɩɣ hasɩyaɖɛ 2020 taa, paaɖʋwa se palakɩ ajɛya kɩgbɛndʋʋ Aleɣya lɛ.
270	sports	Kpaɣnɩ mbʋ lɛ, Preeziili tʋ ɛnʋ ɛmabɩ ɛgbɛyɛ tɛ maacɩwaa 53 nɛ ɛɖʋzɩ kpaɣlaa 24.
1920	travel	Pʋtɔbʋʋ se ɩpɩzɩɣ ɩwolo ɩna kɩyakɩŋ cabɩ kɛ tɛtʋ sɔsɔtʋ nɛ pɩsʋʋ taa lɛ, iɖoo mɛlɛ yɔɔ ɖoo taa.
1431	science/technology	Wɛtʋ paɣlɩka sakɩyɛ (Paɣlɩka tindimiye APS mbʋ yɔ) wɛ kɩmaŋ nɛ pɩñɔtɩnɩ wɛtʋ kɛdɩnʋʋ mbʋ.
832	travel	Hɩɖɛ maʋ kɛ ɖɔɖɔ mbʋ pɩ-tɔm cɛyaa pʋcɔ nɛ pala ɛyʋ ɛjaɖɛ lɛɛɖɛ taa wobu takayaɣ yɔ. Ajɛya naayɛ taa lɛ, pʋpɔzʋʋ se iwolo ñʋndɩnaa cɔlɔ nɛ payʋsɩ alɩwaatʋ ɛzɩma ɩcakɩ peeɖe nɛ mi-kuduyuu mayaɣ.
1769	politics	Mawuu ɛgbɛyɛ nɖɩ ɖɩlʋkɩ se pɩsa nɛ ɛyaa wɛɛ pa-tɩ yɔɔ yɔ, ɖi-kigbeɣluu ŋgʋ palabɩ tɛtʋ sɔsɔtʋ taa hɛɛɛ wɛtʋ taa yɔ, kiyeba nɩ wiyaʋ sɔsɔ weyi payaɣ se Tupua Tamasese Lealofi III yɔ.
130	politics	Tɔm ndʋ posusi sɔnɔ yɔ tɩtasɩ tuzuu tamaɣ ŋga komina labɩ Lakɩŋ fenaɣ taa pɩnaɣ kanɛ se kɩhaɣ liidiye nɛ paya lɔɔɖa nɛ pɔsɔzɩ yɔ.
955	travel	Yee ɩwɛna alɩwaatʋ sakɩyɛ sɩ iwoki nɔmɔʋ kɔyɔ, ɩcɔna nɛ ɩna  sɩ ɛzɩma pʋpɔzʋʋ liidiye Afrika taa nɛ keteŋga yɔɔ ɛzɩma pʋpɔzʋʋ.
47	sports	Jonny Reid weyi ɛkɛ lɔɔɖɩyɛ sayʋ naalɛ tʋ A1GP Niyuu Seelandɩ ɛgbɛyɛ taa yɔ, sɔnɔ ɛ-hɩɖɛ sɛwa mbʋ pʋyɔɔ yɔ ɛsa lɔɔɖɩyɛ lɛɛ lɛɛ nɛ pɩkpaɖɩ Auckland Harbour kondoloko Niyuu Seelandɩ, ŋgʋ kɩwɛnɩ pɩnzɩ 48 yɔ kɩ-yɔɔ.
1038	science/technology	802.11n raadiyoo lakɩ tʋmɩyɛ nimasɩ 2.4Ghz nɛ 5.0Ghz yɔɔ.
1268	health	Paa Uka kaatʋʋzɩ ɛ-malɩfa ɛyʋ kagbanzɩ tʋ ñʋʋ yɔɔ kɔyɔ ɛtɩpɩzɩ nɛ ehiɣ-ɩ. Schneider kaawɛɛ ɛnɩɣ siziŋ kaahɛzaɣ, ɛ-ɛsɩyɛ kʋɖʋmɖɩyɛ yʋlʋmaa, ɛ-ñʋmbɔɔyaɣ hɔɔlʋʋ nakʋyʋ fɛyɩ nɛ ñɩɣyʋʋ ŋgʋ payaɣ se titaanɩ yɔ pakpaɣ nɛ pɔñɔɔzɩnɩ ɛ-ɛsɩndaa.
1418	geography	Japɔŋ wɛnɩ lɩm hɛkʋ taa tɛtʋ nɛ pɩñɔtɩnɩ 7000 (ndʋ tɩkɩlɩ paɣlʋʋ kɛlɛ Honshu), piyeba nɛ Japɔŋ pɩsɩ lɩm hɛkʋ taa 7 ñɩndʋ ndʋ tɩkɩlɩ paɣlʋʋ ɛjaɖɛ yɔɔ yɔ.
1899	entertainment	Kuduyɩŋ weyi ɩñʋŋ wɩ cʋlʋcʋlʋ yɔ ɛ-tɔm palakɩna mʋsɩ nɛ pakpazɩɣ-ɩ mɩŋ nɛ pɩnaɣ kuduyɩŋ sakiyɛ.
272	health	Ɛyɔɔdaa se nabɛyɛ ñɩnaa lɛ pana se pʋtɔma kʋdɔŋ lɛɣzɩɣ nɛ kɩɩtasɩɣ kʋʋ ɛyaa sakɩyɛ pʋcɔ kɩkɔɔ nɛ kɩpɩsɩ ɛjaɖɛ kpeekpe kʋdɔŋ kɩɖɛɖɛʋ.
943	travel	Ɛkɔndʋ ɛjaɖɛ taa wobu sɩ ɩla sɩnaʋ tʋmɩyɛ, sɩŋna-mɩ nɛ nɩtɩlɩ lalaa sɔnzɩ nɛ pɛ-wɛtʋ, pɔ-ɖɔnɛ, pa-ñɩm. Pɩsɩŋna-mɩ nɛ ɩkpɛlɛkɩ nɛɛ ɩtɩlɩ mɩ-tɩ, ɩtɩlɩ mɩ-ɖɔnɛ nɛ ɩhiɣ lɛɣtʋ nɛ lɔnsɩŋɖɛ kɩfaɖɛ.
1201	health	ONU sɔɔjanaa mba pɔkɔm Hayiiti pɩnaɣ 2010 tɛtʋ ñamsʋʋ wayɩ se pakandɩyɩ laŋhɛzɩyɛ yɔɔ yɔ, ɛyaa maɣzɩɣ se pɔ-cɔlɔ pɩlɩnaa nɛ kʋdɔŋ ŋgʋ kɩpaɣzɩ sɔɔjanaa pɩlʋʋ cɔlɔ yɔ kɩyɛlɩ.
267	science/technology	Paya tɔm ndʋ Firjinii mbʋ pʋyɔɔ yɔ peeɖe ɛntɛrnɛɛtɩ haʋ tʋmɩyɛ AOL kaawɛɛ, nɛ nɖɩ yanɩ tɔm.
1708	travel	Medina kɩbɩnʋʋ hɔlɩŋ taa, pɩfɛyɩ kaɖɛ se ɛyʋ ɛna Maroc ñɩma wondu ɛsɩ cʋʋ wondu, hookahs, nɛ wondu lɛŋtʋ ɛlɛ, aleɣyaa nʋmɔʋ woɖaa tɩyɩɩna
928	travel	Lɛlɛyɔ alɩwaatʊ taa, nɔmɔʋ ɖɛʋ nɩ ɛsɔtaa lɔɔɖɩyɛ, paa weyi ɛñɩnɩɣ sɩ ɛna liidiye nɖɩ pamʋʋ lona ndɩ ndɩ taa nɛ ɛna sɩ le wɛ taɣyɛɛ.
1391	geography	Soŋaɣ ŋga kɛwɛ Wɩsɩ ɖɩlɩyɛ Hɛkʋ taa egeetiye taa yɔ kɔ-yɔɔ lɛ, ɖɩɣa tɔm taakɩlɩ cɛyʋʋ.
1229	entertainment	Hendu teyu Sanjan Sharma paɣzɩnɩ ɖanaɣ hendu teu mbʋ, ɛ-wayɩ lɛ Jai Shankar Choudhary. Ete ɖɔɖɔ chhappan bhog bhajan. Hendu teyu Raju Khandelwal kaatɩŋaɣ-ɩ.
586	science/technology	Pɛkpɛŋdɩ ñɩnɩŋ weyɩ pɔcɔŋna se pana polɩŋ wa nɩnɩŋ weyɩ pɔcɔŋ na se panan polɩŋ naalɛ se ɛyɔ ɛpɩsɩna ɛñɔtɩna mbʋ ɛcɔŋna yɔ ɛtɩ nɛ pɩsɩ pɩpaɣlɩ.
1695	geography	Pɩlɩnaa ɛgbamdʋ wezu caʋ lɛ, Madagascar keŋna tɛtʋ ŋdʋ tɩkɩlɩ paɣlʋ tɩtɩ yaɣ yɔ.
802	health	Ɛyʋ ɛñɔʋ sʋlʋm kadadayaɣ yɔ, kʋdɔmɩŋ weyi ɩpɩzɩɣ ɛkpa-ɩ nɛ ɛsɩndaa yɔ, ɩ-taa nɩɩyɩ lɛ hɔyɛ wɛɛkʋʋ, halɩ pɩpɩzɩɣ pɩkɔna yʋlʋnzɩ nɛ sɩm. Nɛ yee potipuu sʋlʋm mbʋ camɩyɛ yɔ, Kala ana apɩzɩɣ akpa ɖoŋ nɛ pɩkɩlɩ.
1881	politics	Pɩpɩzɩɣ nɛ pɩwɛɛ ndɩ ndɩ, ɛzɩma kominawaa sɔɔlɩ faaa se pala ɛyaa nɔmɔʋ wobu takayɩsɩ nzɩ sɩ-taa pamaɣ yem se (X) nɛ pɩwɩlɩ se paasɩŋ se pɛkɛ abalʋ yaa halʋ nɛ paɖʋʋ pɛ-ɛyʋtʋ kɩfatʋ yɔ.
1379	science/technology	Ɖɩ-tamasɩ kaaɖaɣlɩ pɩdɩɩfɛyɩ nɛ sɩ-taa nɛ kela 70 wena awɛ lɔŋ ɛzɩ sɩɣa yɔ, nɛ lɛɛna ñɛwɛɛ kalaŋ taa, pɩwɩlɩɣ se ye ɖɩkatɩ nabʋyʋ yɔ, pɩɩpɩzɩɣ nɛ pɩlɩɩ ɖi-nesi tɛɛ.
1550	politics	Jewaa tɔla, Caama mpa kpa ɖoŋ pιtɔtɔɔ yɔ, pakaa mʋʋ Krandɩ-Pretaañɩ mpa nɛ Europa tɛtʋ kpeekpe nɛ pɩpɩsɩ pañιm.
333	entertainment	Pʋwayɩ lɛ Isitanbuuli Ɛjaɖɛ symponie hendu teyaa, sɔɔjanaa ɛgbɛyɛ naɖɩyɛ nɛ hendu teyaa Fatih Erkoç nɛ Müslüm Gürses patɩŋ ɛ-wayɩ.
719	geography	Repubiliki Dominiki (Spanish: República Dominicana) kɛ Karayib mba ɛjaɖɛ nɖɩ ɖɩkpaɣ wɩsɩ ɖɩlɩyɛ taa lɩm hɛkʋ taa tɛtʋ ndʋ payaɣ se Hisipaniyola yɔ tɩ-hɔɔlʋʋ nɛ Hayiti ñakpaɣ hɔɔlʋʋ lɛɛkʋ.
1780	travel	Pɩnaɣ kpeekpe taa ɛyaa woki nʋmɔŋ kaaŋ agbeɣla taa, pɩwɛ kaɖɛ se nɔɔyʋ ɛmʋ heŋ peeɖe.
1841	travel	Yee kpaŋnɔ yɔɔ caɣyʋ ɛtɔlaa ɛlɛ ɛ-naŋgbaŋaɣ nakɛyɛ kpɛndɩ kɛwɛ asabɩyɛ naɖɩyɛ taa kɔyɔ, yee kpaŋnɔ ɛwɛ seu yɔɔ kɔyɔ, pituu-i tataa. Pɩsa kaɖɛ nɖɩ ɖɩtaatalɩ lɛ, papɩzɩɣ nɛ pala  yɔɔ kandɩyʋʋ ɖʋtʋ natʋyʋ.
471	politics	Lɩmaɣzɩyɛ kaakɛnaa se Erɔɔpɩ ajɛɛ kpeekpe ñakaɣ pana se ataayele nɛ ɛjaɖɛ naɖɩyɛ kɩlɩ wɛʋ ɖoŋ, nɛ pʋyɔɔ lɛ kominawaa lɛɣzaɣ agbaa wena paɖʋwa yɔ se pɩsa nɛ po-ɖoŋ wɛɛ kɩmaŋ.
1634	science/technology	Pɩ-wɛɛ zɩɩ wonuu tɛ kɩlɛɛzɩŋ nɩɩnzaa yɔ (pɩlʋʋ kʋɖʋmtʋ ndʋ tʋyɔɔ)  wondu ndʋ ti-kpendelaa yɔ, wondu ndʋ ti-gbeŋ lɩm tɩyɛ yɔ, wondu ndʋ ti-kʋyʋ heelɩm tɩyɛ yɔ, nɛ wondu ndʋ tɩ-wɛ hɛkʋ nɛ hɛkʋ ŋgɔniye tɩyɛ yɔ, pʋcɔɔ lɛ ɩɩ-hɛ pʋdɔma lɩmaɣzɩyɛ nʋmʋʋ nɛ ɛ-tɔŋ se wondu tʋ-nɛ tɩ-lɛɛzʋʋ nɛ tɩ-pɩsʋʋ wondu lɛɛtʋʋ zɩɩ mbʋ ɖɩ-naɣ yɔ.
1255	science/technology	Ñɩnɩyaa sɔzɩ melamine nɛ acide cyanurique agu hɩm taa lɛ, pana se pɩlabɩ putowee cikpena.
845	entertainment	Ɛlɛ sɔnɔ, tɔlɩm tayaa nɛ tɔlɩm taʋ ɖʋtʋ ndʋ paɣtʋ haɣ waɖɛ yɔ, tɩwɛɛ. Hɔɔlʋʋ ŋgʋ kɩ-taa lɛ, pɩtɩtasɩ wɛʋ ɛzɩ anjaʋwaa mba paanaɣ camɩyɛ yɔ, ɛlɛ ɛzɩ wondu lɩzʋʋ nɩ tɔlɩm yɔ.
1776	entertainment	Fransɩɩ vɛɛwaa sakɩyɛ wɛɛ se pɔñɔɔ, ɛlɛ vɛɛwaa mba papɩzɩɣ powoni-wɛ nɔmɔʋ kɛlɛʋ yɔ, mba lɛ Nuvɛɛlɩ-zelandɩ nɛ Ositralii mba.
1845	travel	Ŋwɛ peeɖe pʋŋ ñʋŋ taa kɔyɔ, ŋnaɣ ɛjaɖɛ yɔɔ kpayɩ kpayɩ, nɛ pɩwɛ ɛzɩ ŋtaaɖɛɛ yɔ. Ɛjaɖɛ kpeekpe hɔɔlɩŋ ndɩ ndɩ taa ɛyaa mba powoki peeɖe pʋŋ kpaʋ yɔ, pehikiɣ pa-tɩ nʋmaŋ kɩfaŋ kolonzɩ nzɩ sɩfɛyɩ kalʋʋ yɔ, sɩ-hɛkɩŋ taa.
1151	sports	Pɩnaɣaɣ kaɣlaa se Afrika Hadɛ Kiŋ maɖaa taañɔɔzɩ pa-tɩ camɩyɛ ɛzɩ po-koobiya halɩñɩma mba palɩnɩ hadɛ kiŋ yɔ, ɛlɛ pɩwɛɛ nɛ pɩɖɛɣnɩ ɛsɩndaa lɛ pɛwɛɛ pamakɩ camɩyɛ nɛ pɩkpaɖɩɣ.
1054	politics	Tɔm hɔm kaapaɣzɩ alɩwaatʋ papaɣzɩ yɔɔdʋʋ liidiye nɖɩ palabɩnɩ tʋmiyɛ nɛ pasɩnɩ ɛyaa mba pɩkʋ-wɛ nɛ pamanɩ kuduyiŋ Tɛʋ Helim Sɔsɔm Katrina wayɩ yɔ ; lambuu mʋyaa nabɛyɛ yɔɔdɩ pi-tɔm nɛ hoŋa se pɩkɛ ʺBush tɛ Nuvɛɛlɩ Orileeyɔɔ Đama nɩnʋʋ.ʺ
1859	geography	Lɩmaɣza wena ɛyaa wɛna wondu ndʋ tɩ-yɔɔ yɔ, alɩɣna ɖenɖe pɛwɛɛ yɔ pɩ-cɔlɔ. Amerika nɛ hayo kiŋ lɛ, pɩnzɩ wɛ ŋñɩɩ nɛ pɩkɩlɩ Erɔɔpɩ.
1007	health	Paa ɖatʋ kʋɖʋmtʋ ɖeke pamaɣzaa nɛ pana se tɩpɩzɩɣ nɛ tɩla nɛ Ebola kʋdɔŋ ɛtaakɩlɩ kʋʋ ɛyaa kɔyɔ, halɩ nɛ sɔnɔ kɔyɛ naɖɩyɛ fɛyɩ se ɖɩpɩzɩɣ nɛ ɖɩwaa kʋdɔŋ ŋgʋ.
1076	politics	Bush tɔm ɖɛzɩyʋ Gordon Johndroe yɔɔdaa se ɛzɩma panɩnɩ ɖama nɛ Kooree Hayo Kiŋ Ñɩŋgʋ yɔ ʺpɩkɛ nɩŋgbaŋaɣ sɔsɔɔ ŋga kakaɣ wɛɛ sɩnʋʋ nɛ wiɖiyɩ lɛ pala nɛ Kooree ajɛɛ tɩŋa yele niikileeyɛɛrɩ ɖoŋ labɩnʋʋ tʋmɩyɛ.ʺ
1099	geography	Sateliitiwaa mba pa-naalɛ, pa-taa paa ŋgʋ lɛ ki-yuŋ kaatalɩ ɛzɩ pawʋndɩnaa 1,000 mbʋ yɔ nɛ peseɣ ɛzɩ mayɩlɩnaa 17,500 paa ñɩɣyʋʋ ŋgʋ yɔ, pɔkɔm nɛ poyooni ɖama Tɛtʋ ñʋʋ yɔɔ ɛzɩ mayɩlɩnaa 491 mbʋ yɔ.
1100	science/technology	Lɛɣtʋ ñɩnɩyaa tɔma se pakatɩ ɖama nɛ paya yaʋ mbʋ yɔ pɩcaɣ sɔɔndʋ pɩdɩɩfɛyɩ.
367	science/technology	Calɩm lɩɣnɩ ñamɩyɛ taa lɛ, pɩɖɔŋ calɩm hosi kɩsɛɛmasɩ taa nɛ pɩɩpɩsɩɣ ñamɩyɛ taa lɛ, pɩɖɔŋ calɩm hosi kɩkpɛɛdɩsɩ taa. Calɩm hosi nzɩ sɩkɩlɩ ññɩɩ yɔ, sɩwɛ ɛzɩ kʋca hosi.
770	entertainment	Kpaamɩŋ kazandʋ ndʋ, pɔtɔkɩ tɩ-taa sakɩyɛ ɛzɩ kpaaŋ lʋlʋʋ kazandʋ yaa ɛsɔ weyi ɛwɛ kpaaŋ ŋgʋ kɩ-taa yɔ ɛ-lʋlʋʋ kazandʋ yɔ, yaa lɛɛbʋ mbʋ payɩ pɩkɛ sɔsɔm nɛ pɩlakɩ nɔɔ kʋɖʋmaɣ nɛ kpaaŋ ŋgʋ yɔ.
279	politics	Floriidi kaakɛ egeetiye nɖɩ ɖɩ-waɖʋ mʋʋ pɩtɩŋa yɔ, nɛ kɩcɛlɩ ki-tiyiyaa nɩɩnʋwa Romney, nɛ pituyi-i nɛ ɛsɩndaa se ɛkɛ Republiki mba ɛgbɛyɛ nɔɔ ɖɛyʋ ɛjaɖɛ ñʋʋdʋ lɩzʋʋ caca tɔʋ taa.
357	science/technology	Pɩsa nɛ pɛwɛɛnɩ kiɖe tɛɛ ɖoŋ lɛ, pʋpɔzʋʋ se pelesi ɖoŋ kɩfaŋ weyi pamʋ ñalɩmɩyɛ cɔlɔ yɔ.
797	science/technology	Yee ɩkpɛndɩnɩ mɩ-nʋmɔʋ ɖɔm taa nesi tɛɛ ordinatɛɛrɩ yaa taablɛɛtɩ kɔyɔ, ɩsɩɩ takayaɣ ŋga kɛ-lɛzʋʋ nakʋyʋ pɩ-taa peeɖe (ɩpɩzɩɣ nɛ ɩtʋlɩ-kɛ paa ɛntɛrɩnɛɛtɩ ɛfɛyɩ kɔyɔ).
211	health	Nɔɔyʋ tɩmʋ heŋ sɔsɔŋ nɩɩyɩ, ɛlɛ ɛyaa ɛzɩ kagbanzɩ kaawɛ peeɖe alɩwaatʋ ndʋ ɖaŋ yawa yɔ nɛ pɛwɛ pɔcɔŋnɩ pe­-ɖeɖe mbʋ pʋyɔɔ yɔ pefiɣnaa.
815	travel	Kedeŋa kpeekpe yɔɔ, heelim mʋʋ agbaa wena aɖiɣni tʋmɩyɛ labʋ yɔ, añɔtɩnɩ 200. A-taa sakɩyɛ lakɩ tʋmɩyɛ a-tɩ yɔɔ.
238	geography	Stofan sɔzaa se : ʺNdʋ ɖɩsɩma yɔ lɛ, ɛsɔdaa wonuu kʋɖʋmʋʋ ɖeke wɛnɩ kpekpeka nɛ pɩkɩlɩ Titaanɩ, nɛ kɩ-hɩɖɛ lɛ Tɛtʋ.
1636	science/technology	Pɔ-kpaɣ mɔɔ taa ñɩm sʋsɔm nɛ kaŋwa ɛzɩɩ ñɩɩtʋ. Toovenim, ɖɩ-naɣ ñɩɩtʋ lɛɛtʋ ɛzɩ lidiye nɛ sika.
761	travel	Mba papɩzɩɣ nɛ pamʋ agɔma, pamaɣ pa-hɩla nɛ pʋwayɩ lɛ, palɩzɩ-yɛ menziini taa yaa paɖʋ-yɛ ɛntɛrɩnɛtɩɩ yɔɔ, nabʋyʋ taa pɔsɔzʋʋ nɔmɔʋ wobiyaa lalaa masɩ yaa tɔm ndʋ pɔcɔɔlʋʋ yɔ.
1676	science/technology	Ñɩnʋʋ Al hɔɔlʋ taa sɩŋna pɔñɔsɩ ñɩyʋ kɩpɩsɩ kɩlaa tʋmɩyɛ nɖɩ pɔpɔsʋʋ-kʋ alɩwatʋ ndʋ palapɩ-kʋ se kɩla tʋmɩyɛ kɩtɩ yɔɔ
848	entertainment	Ositralii ɛjɛɖɛ taa wondu ndʋ ɛyaa lɔʋ yɔ, tɩ-taa sakɩyɛ ɩɩpɩsɩɣ. Pʋyɔɔ pɩkɩlɩɣ ɖeu se mba pɛkpɛlɩkɩɣ kɩkpɛlɩkʋ yɔ, pataalɔ heelim taa yem.
1089	science/technology	Pamaɣzɩɣ se kɩkpɛɛdɩm mbʋ tɩɩnzɩ tindimiye sɔsɔyɛ naɖɩyɛ cɔlɔ yɔ, pɩ-hɔɔlʋʋ sɔsɔʋ cɔʋ tɩɩnzɩ tindimiye sɔsɔyɛ nɖɩ nɛ pɩta nɛ pɩwɛ yuleee nɛ pɩ-taa nɛ wondu cikpetu sakɩyɛ.
984	health	Ɛyaa mba pana pɔ-yɔɔ kʋdɔŋ ŋgʋ yɔ patɩtalɩ kudoku, ɛlɛ kɩkʋ pa-taa nabɛyɛ.
305	sports	Judo aleɣya laɖʋ Japɔŋ tʋ Hitoshi Saito weyi ɛɛmʋ Olɛmpiki sika lɩyɩŋ naalɛ yɔ, ɛsɩbɩ alɩwaatʋ ndʋ ɛwɛnɩ pɩnzɩ 54 yɔ.
697	travel	Jerusalem wɛna caanaʋ taa wondu nɛ tɛtʋ naa ndi ndi nɛ wondu ɖɩyaɖɛ nɛ tɔnaɣ ɖɩtɔɔ lona wona a-wɛ kpekpeka nɛ ɛyaa ɖɔʋ a-taa ɖɩɖɔ yɔ.
826	travel	Ɖeyi ɖeyi lɛ, papɩzɩɣ patayɩ-wɛ hɔɔlɩŋ naalɛ taa : ɩpɩzɩɣ nɛ iɖiɣni tʋmɩyɛ labʋ alɩwaatʋ ndʋ ɩwɛ mɩ-nʋmɔʋ wobu taa yɔ, yaa ɩpɩzɩɣ ɩñaɣ pana nɛ ɩtaakɩlɩ mi-liidiye wɛɛkʋʋ. Kɛdɛzaɣ hɔɔlʋʋ kʋnɛ kɩ-yɔɔ takayaɣ kanɛ kakaŋ ñʋʋ
1672	health	Eyaa kaasɩmaa ɖoo lɔŋ se feŋteɣlɩm wɛɛkʋ ndi ndi tokuuna ɛyʋ wɛtʋ nɛ e-feŋteɣlɩm.
536	travel	Teŋgu nɔɔ, tɔm cɔlʋ ɖιcaɣyɛ nɛ haɖaa cikpema taa ɖamιŋ kɛna lona wena ɛsιyekpena mba kιla sɔɔlʋ yɔ.
1909	science/technology	Pɩwɛna mɩtɛ kaŋgalafu tʋmɩyɛ kɩjɛyʋʋ sɩ peheyi-mɩ mbʋ pʋɖɔŋ tʋmɩyɛ ndɩ ɖɩ-taa nɛ ɖɩ-tɛ tɩlasɩ ndɩ ndɩ.
611	science/technology	 Pa-pɩzɩɣ pa-kpa ciɣdiɣ kɩlɛmɩŋ siŋŋ siŋŋwaa kɛ ɔrdinatɛɛrɩnaa yɔɔ, kɛyɔ pɩ-tɛ kɩlɛmɩŋ kɛ pa-kɩlɩɣ lɩzɩɣ llɛɛlɛyɔ kɛ televisɔŋnaa nɛ filimnaa taa
157	sports	Palabɩ seya nɛ pɩtɛ, Keselowski kaakɛnɩ lɔɔɖa sayaa maacɩnaa taa kajalaɣ mbʋ, nɛ ɛɛwɛnɩ kpaɣla 2250.
1294	politics	Martelly yeba nɛ alɩwaatʋ pazɩ Caca Tɔʋ Lɔŋ Tasɩyaa (CEP) mba pɛkpɛndɩ nakʋ yɔ poɖuuna ɖeɖe.
1803	travel	Hɔɔlʋʋ lɛɛkʋ taa lɛ, ɖɔmbɛ wena atɔlʋʋ tɛtaa nɛ akiɣ kpaagbaa yɔ nɛ ɖɔmbɛ lɛɛna yem, awɛ ɖeyi ɖeyi ajɛɛ  sakɩyɛ taa nɛ pɩwɛɣ a-yɔɔ ɖɔm yɔɔ pɩnaɣ kpeekpe taa.
359	science/technology	Lɛɣtʋ ñɩnɩyaa yaɣ lakasɩ nzɩ se ʺémission stimulé de rayonnementʺ mbʋ pʋyɔɔ yɔ ñalɩmɩyɛ ñaŋŋ seɣtiɣ atom pee, nɛ pɩla nɛ ñalɩmɩyɛ tɛ photon mɩzɩ pa-tɩ, ye mbʋ ñamɩlɩyɛ kɛ wonuu ŋgʋ kɩmɩzɩɣ kɩ-tɩ yɔ.
302	politics	Pɛlɛɣzɩ Fransɩɩ paɣtʋ. ɛɛwɛnɩ pɩnzɩ 15 lɛ ɛpaɣzɩ ɛ-lʋbɩyɛ alɩwaatʋ ndʋ ɛsʋ mba palʋkaɣ Fransɩ yɔɔ Caama You naalɛ ñɩŋgʋ taa yɔ.
455	science/technology	Kaɖɛ nɖɩ ɖɩwɛɛ nɛ ɖɩpasɩɣ pazɩ pazɩ mbʋ pʋyɔɔ yɔ ñɩnɩŋ weyi ɩlakɩ nɛ wondu paɣlʋʋ yɔ i-luɖaa wɛɛ nɛ poluki ñɩnɩŋ weyi ɩwɛ camɩyɛ nɛ pɩkɩlɩ.
25	sports	Kpaɣɖɛ nɖɩ Ovechkin sɩnaa nɛ pacalɩ ɖʋzʋʋ ɖoo ana yɔ, nɖɩ lɛ kpaɣɖɛ nɖɩ Nicklas Backstrom ɖʋzaa nɛ pawa maacɩ yɔ.
1606	science/technology	Lɔŋ caʋ wɩlɩ se sakɩyɛ lɔrɛ kpaɣʋ tokuuna kedeŋa maɣmaɣ ɖɩɣɖɩɣ caɣʋ ɛsɩndaa ɖɛnaɣʋ kpaɣ pɩŋsɩ million waa naalɛ
79	sports	Pa-naalɛ paataa pʋcɔ nɛ pama Kɛdɛzaɣ maacɩ nɛ peeɖe Noosa wabɩ nɛ kɩyalaa 11.
952	travel	Pʋwɛ mbʋ se ɩmaɣzɩ ɛsɔtaa lɔɔɖɩyɛ piliŋga ŋga ɩtɩɩkɛyɩɣ nɛ iwoki nɔmɔʋ tam yɔ kɔ-yɔɔ, ɛlɛ pʋwɛɛ sɩ ɩtɩlɩ waɖɛ nɖɩ pahaɣ pɩlɩɩna tɩ-ñɔnɔʋ yɔ pɩwɛna kɛsɛwa yaa ñʋʋ leleŋ ɖɔɖɔ ɖoli nɔɔyʋ.
995	travel	Ɛsɔdaa lɔɔɖa agbaa wena alakɩ mbʋ yɔ a-taa naayɛ lɛ Air Canada, Delta Air Lines, Luftansa ɛsɔdaa lɔɔɖa wena alɩɣnɩ Etazuunii yaa Kanadaa yɔ a-hɔɔlʋʋ taa, nɛ WestJet.
266	science/technology	Rusii ñɩma mba paawɛ tataa yɔ patʋsɩ miŋ nɩɩyɩ nɛ tɩɩnzɩ taa wobu lɔɔɖɩyɛ tasɩ hiɣu ɖɩ-wɛtʋ maɣmaɣ.
112	politics	Mr Rudd kpaɣ lɩmaɣzɩyɛ nɖɩ se ɛñɩkɩɣ nesi Kyoto ɖama nɩnʋʋ ɛjaɖɛ wɛtʋ yɔɔ takayaɣ taa yɔ, ɖiyeba nɛ pɩkazɩ Etaazuunii ɖeke, lɛɛlɛɛyɔ nɖɩ kɛnɩ ñɩm ɛjaɖɛ nɖɩ ɖɩkazaa se ɖɩtɩñɩɣ nesi takayaɣ ŋga ka-taa.
1050	politics	Tɔm ndʋ tɩyɔɔdɩ tɔm kɩdɛkɛdɩtʋ kpem pɩlɩɩnɩ Komina politiki hɔɔlɩŋ kpeekpe Iraakɩ yɔɔ nɛ kɩpɔzɩ se kpɛdɛyɛ lɛ, pɛlɛɣzɩ nʋmɔʋ.
1609	travel	Epe labɩ nɛ lɔrɛ kpaɣʋ ke tɩlasɩ pɩɣyʋʋ wɛ mbʋ, ebe labɩ paa evemiye nɖɩ lɛ lɔrɛ wɛɛkɩ mbʋ? Lɔrɛ laɖaa nɛ añɔɔsɩyaa kɩlɩ ɛjaŋdʋ naawe? Yaa nabʋyʋ wɛ pɩɖɔŋ yaawe?
1316	sports	Lʋbɩyaa lalaa ɖɔɖɔ ha samtʋ Luna.
291	geography	Tɛtʋ ñamsʋʋ nabʋyʋ laba pɩlɛɣzɩ tɛtʋ wɛtʋ Lakɩŋ fenaɣ 10 wiye Kaldera pʋʋ ŋgʋ kɩtɔʋ miŋ yɔ kɩ-tɛ hayo kiŋ nɛ wɩsɩ ɖɩlɩyɛ hɔɔlʋʋ taa.
1215	travel	Kajalaɣ tɔm yɔɔdʋʋ se pañɩnaɣ se petisi ɛsɔdaa lɔɔɖɩyɛ kpɛdɛyɛ Ürümqi ɛlɛ pekizi, nɛ pʋyɔɔ pɛkɛzɩ-ɖɩ nɛ papɩsɩ Afɩganistaanɩ.
1270	sports	Pɩtasɩnɩ mbʋ pɩlabɩ Cɩla wiye yɔ lɛ, Carpanedo labɩ seya naalɛ hola aleɣya santaɖaŋ taa.
663	entertainment	San Francisko ɛjaɖɛ ma aleɣya nʋmɔʋ wobu akɔmaa ɖɛsɩ sɩsɔsɩ nɛ cikpesi sakɩyɛ
91	politics	Lodin yɔɔdaa ɖɔɖɔ se ñʋndɩnaa kpaɣ lɩmaɣza se paatasɩɣ labʋ caca hɔɔlʋʋ naalɛ ñɩŋgʋ se pɩsa nɛ Afiganistaanɩ mba ɛtaawɛɛkɩ liidiye nɛ pɩtasɩ-wɛ kɔnʋʋ kaɖɛ pɛɛyɛ nʋmɔʋ taa.
371	science/technology	Tricératops pɩzaɣ se ɛtɩŋnɩ ɛ-njʋyɛ nɖɩ ɖɩwɛ ɖoŋ yɔ ɖɩ-yɔɔ nɛ ɛlɩzɩ hatʋ pʋcɔ nɛ ɛtɔɔ tɩŋ hɔɔyɛ.
1806	travel	Kpɩna naayɛ ɛzɩ tuŋ nɛ liŋ ɖɛŋ ɖɛŋ tɩnaa mbʋ yɔ, pɔsɔɔlɩ ñɔtɩnaʋ lɔɔɖa kpam nɛ yee ɛyʋ ɛwɛnɩ wondu ndʋ pʋpɔzʋʋ kɔyɔ, pɩsɩɣnɩ-ɩ nɛ ɛna-yɛ camɩyɛ.
930	travel	Paa ɩfɛyɩna ɛkɔndɣ waɖɛ sɩ ɩkɛ ɛsɩyɛkpena tɩnaa ajɛya naayɛ taa, yee ewoki sukuli labʋ yɔ ɩwɛna caɣyɩtʋ sɩ ɩwɛna takayaɣ ŋga kahaɣ-mɩ waɖɛ sɩ ɩcaɣ alɩwaatʊ sakɩyɛ yɔ.
33	sports	 Pese Hɔŋgiri tɛ Grand Prix pɩnaɣ 2009 nɛ pɩtɛ lɛ, pɔɖɔɔnɩ Piquet Jr.
0	health	Hodo wiye, Stanford Đɔkɔtɔnaa Sukuli Kɩtɛzʋʋ taa lɛɣtʋ ñɩnɩyaa susaa se polubi kʋdɔmɩŋ maɣzʋʋ wonuu kɩfalʋʋ ŋgʋ kɩpɩzɩɣ nɛ kɩlɩzɩ kuludasɩ paa nzɩ lɛ nɛ sɩ-hɔɔlʋʋ yɔ : pɩkɛ wonuu ŋgʋ kɩwɛ tayɩ nɛ papɩzɩɣ nɛ palɩzɩ-kʋ menziiniwaa mba palɩzɩɣ takayɩsɩ nɛ tɔlɩm yɔ pɔ-yɔɔ nɛ paa ŋgʋ lɛ kɩfɛyɩ liidiye nɛ pɩcɛzɩ Etaazuunii faɖam kʋɖʋmʋʋ.
200	geography	Felicia kaakɛ tɛʋ sɔsɔʋ ŋgʋ kɩwɛ Tindimiye 4 taa Saffir-Simpson Helim Tɛŋ Sɔsɔŋ Kɩgalʋʋ taa, nɛ pʋwayɩ lɛ kɩhɛɛ nɛ kɩpɩsɩ tropiki tɛʋ cikpeluu nɛ Piya wiye lɛ, kɩfɛɛ.
873	entertainment	Yee ɩñɔyɩ mɩ-tɩ yɔ, ɩtɩŋna pʋ-yɔɔ nɛ ɛñazɩ tiŋ pe yaa isidi nabʋyʋ naa ndɩ ndɩ nɛ pɩla sʋlʋm kɩpam.
774	entertainment	Ɛjaɖɛ kpeekpe yɔɔ saɖɩñɛnaa wondu ndʋ palɩzɩɣ nɛ pawɩlʋʋ yɔ, pɩkɛ mbʋ pɩwɛ ŋgee yɔ, nɛ pɩ-taa palɩzɩɣ wondu ndɩ ndɩ nɛ pawɩlɣ ɛzɩ hɛtʋ, tɩŋ hɛtʋ kaɖasɩ nɛ mbʋ payɩ pitukuuni tɩŋ yɔ.
1377	science/technology	Đɩmaɣ ɖa-ɖɩsɩ pɩtɩŋnɩ tɩŋ yɔɔ nɛ ɖɩlakɩ ɖo-tokonaa pɩtɩŋnɩ tɩŋ yɔɔ. Tɔɔnasɩ nzɩ ɖɩtɔkɩ yɔ, sɩ-taa sakɩyɛ lɩnɩ tɩŋ cɔlɔ. Ye tɩŋ ɩfɛyɩ kɔyɔ, pɩlakɩ kaɖɛ se kpɩna ɩcaɣ wezuu.
203	geography	Tɛŋ ɛnɩ ɩ-taa nɩɩyɩ kaakɔmnɩ tɛʋ nazʋʋ nɛ añɩlɩza ɖoŋ ɖoŋ.
1365	science/technology	Kpou tɛ mʋʋdʋʋ fɛyɩ ɛzɩ mʋʋzʋʋ haʋ kɩ-nɔɔ camɩyɛ nɛ kɩmʋʋdʋʋ yɔ, ɛlɛ pɩwɛ ɛzɩ ɛyʋ yɔɔdʋʋ hoŋa tɔm nɛ ekou yɔ.
1176	sports	Pɩɩkɛ All Blacks waa tɛ maacɩ kɛdɛzaɣ ñɩŋgʋ, paatɛm wabʋ kuupi pɩlakɩ kpɩtaŋ naalɛ yɔ.
879	health	Kiwiyissi sakɩyɛ siki niye se paɖaa kʋdɔmɩŋ ndɩ ndɩ tɛ ɖatʋ kɛ manzʋʋ malɩɩ waa.
110	science/technology	Stardust kaɣ kɛʋ tɩɩnzɩ taa wobu lɔɔɖɩyɛ nɖɩ ɖɩkɩlɩɣ seu ɛyaa wezuu caɣʋ taa nɛ ɖɩlɩnɩ ɛsɔdaa nɛ ɖɩpɩsɩ Tɛtʋ yɔɔ, nɛ ɖi-seya cɛzɩ mbʋ pɩlabɩ Agoza fenaɣ 1969 taa alɩwaatʋ ndʋ Apollo X tɩɩnzɩ taa lɔɔɖɩyɛ pɩsaɣ yɔ.
1494	science/technology	Kʋtɔɔm haɖaʋ wɛ kɛlɛʋ, nɛ ɖoŋ ɖoŋ lɛ kɩɩlakɩnɩ tʋmɩyɛ anaasayɩ huɖe, ɛlɛ kɩlakɩnɩ tʋmɩyɛ ɖomaɣ ŋga pɔtɔsaa nɛ kalɩnɩ egeetiye taa nɛ pɩtasɩnɩ tɔɔnasɩ nzɩ pahayɩɣ yɔ sɩ-lɛɣzʋʋ nɛ lɛɣtʋ lɛɛtʋ ndʋ tɩwɛ kɛlɛʋ yɔ se pɩsa nɛ tɔɔnaɣ la nɛ pɩkpaɖɩ.
1086	science/technology	Mbʋ pañɩnaɣ se pana yɔ lɛ mbʋ pɩlɩɣ ɖoŋ weyi ɩlɩɣnɩ kɩkpɛɛdɩm mbʋ pɩwɛ tɩɩnzɩ tindimiye sɔsɔyɛ nɖɩ ɖɩ-taa nɛ kɩkpɛɛdɩm mbʋ tɩɩnzɩ tindimiye sɔsɔyɛ nɖɩ payaɣ se Milky Way yɔ ɖɩ-taa yɔ.
1623	geography	Amazooni kɛnɩ kideŋ kpeekpe yɔɔ pɔsɩ wandamwaa taa kɩkpaɖaɣ. Ka-walanzi pɩzɩɣ pi-talɩɩ zɩɩ miles waa loɖo.
1222	entertainment	Pɩɩwɛɛ se rɔɔkɩ hendu teyaa mba pɔcɔɔ Etaazuuni nɛ Kanada nɛ pɩkɔɔ pɩtalɩ Salaŋ fenaɣ kɩyakʋ 16 wiye.
1357	science/technology	Kɛdɛzaɣ ɖeɖe lɛ, agunaa cikpema sakɩyɛ wɛɛ (pɩkpɛndɩnɩ agunaa mba ɛyaa ɖɔkʋʋ yɔ) mba pɔtɔkɩ kpɩna cikpena sakɩyɛ ɛzɩ ɛnsɛkɩtɩwaa, kayɩsɩ, kamasɩ nɛ sumasɩ.
216	sports	Sikuwasɩ, karatee nɛ rolɛɛrɩ aleɣya kaañaɣ pana se asʋʋ Olɛmpiki ɖʋtʋ taa, pɩtasɩnɩ beezibɔɔlɩ nɛ sɔfɩtɩbɔɔlɩ mba paalɩzɩ-wɛ pɩnaɣ 2005 Olɛmpiki aleɣya taa yɔ.
327	sports	Palʋlɩ Bobek Krowasii tɛtʋ sɔsɔtʋ Zagrɛɛbɩ taa, ɛlɛ ɛyaa sakɩyɛ kɔm nɛ patɩlɩ-ɩ alɩwaatʋ ndʋ ɛmakaɣ Partizan Belgrade taa yɔ.
277	politics	Masasusɛɛtɩ egeetiye yɔɔ cɔnɩyʋ kɩbɩnʋ Mitt Romney wabɩ Piya wiye Floriidi taa Republiki mba tɛ politiki tɛ ɛjaɖɛ ñʋʋdʋ lɩzʋʋ kajalaɣ caca tɔʋ nɛ 46%.
428	geography	Turikii ɛjaɖɛ ɖaɣlɩkɩŋ cɛzɩ kilomɛtanaa 1600 (mi 1000) nɛ walanzɩ kɛ kilomɛtanaa 800, nɛ ɖɩwɛ kpatayɩ ɛzɩ pɔɔyʋʋ yɔ.
1709	travel	Goma kɛ Koŋgoo Demokratik taa tɛtʋ sɔsɔtʋ ndʋ tɩ-taa agɔma sɔɔlɩ kɔm se pekilimi yɔ, nɛ tɩwɛ wɩsɩ ɖɩlɩyɛ kɛdɛzaɣ hɔɔlʋʋ taa Ruwanda ɛjaɖɛ cɔlɔ.
565	health	Mba palakɩ tʋmaa ɖoŋɖoŋ yɔ pɔpɔsaɣ sɩnaʋ taʋmaɣ ŋga katɩ tʋʋzɩ yɔ pɩlɩna wɩzasɩ nɩʋ nɛ cɛyɩtʋ wezuu caɣʋ nɛ hoɖe tʋmiyɛ labʋ.
742	travel	Paa kɩwɛ ŋñɩɩ nɛ pɩkɩlɩ yɔ, kɩtɔzʋʋ-ɖʋ ɛzʋtʋyaa mba pekilimi Hawayii yɔɔ yɔ, pʋcɔ nɛ pamaɣ ɛjaɖɛ nɖɩ, ɛsɩyɛgbena agɔma ɖɩsɩ nɛ ɛsɩndaa wobu lɛɛbʋ taatɩɩwɛda lɛ.
531	sports	Pɔŋ hiu nɛ litoozo taa pamakι ɖʋʋ ɖama yɔɔ ɖama yɔɔ kɛ aleeya anɛ aɖeɖe, mpa pamakι kʋ yɔ, papasʋna pɔʋ kajala ŋkʋ nɛ powolo pɛtɛzιna hiu nɛ litoozo ŋkʋ kɛ seya taa.
729	travel	Bowen Island gɛnɩ kɩyaku kʋyʋmʋ kɔzɔɖɔ tɛm dɛ yɛlʋ, nɩ yɛlʋ mɓʋ pdaa lɛ ansayi kpɩyɩŋ sau wɛ, ɖama katʋʋ, faɖɛ na daa woɓu, tɔkɩyɛ, nɛ pdassɩ pɩyɔɔ.
1427	science/technology	Foto ŋgʋ palɩzaa yɔ kɩ-kɩlɛmʋʋ paɣlɩka kʋɖʋmaɣ ŋga kakɩlɩ tɔyʋʋ ɛjaɖɛ yɔɔ kɛlɛ 35 mm, pɩɩkɛ filim paɣlɩka ŋga kakɩlɩ tɔyʋʋ alɩwaatʋ ndʋ fotonaa mba palɩzaɣ nɛ filimwaa yɔ tɩtɛŋaɣ yɔ.
865	health	Ɛzɩma feziŋ ɩɩtalɩɣ ɛyaa lona wena a-taa wɛ nikaɣ yɔ, mbʋ ɖɔɖɔ lotu taa kʋdɔmɩŋ tɔyɩ ɖenɖe soŋaɣ wɛɛ yɔ. Kʋdɔmɩŋ ɩnɩ ɩcɛyɩɣ ɛyaa ɖoŋ ɖoŋ, ɛlɛ pɩkɔŋna kaɖɛ sakɩyɛ.
205	travel	Pɩlabɩ ɛzɩ cɛcɛsɩ hiu mbʋ yɔ pɔcɔ nɛ pɩwɛɛ se kɩñaɣ pana nɛ kitii nabʋlɛ ɖeɖe, kɩmʋʋ.
