index_id	category	text
1544	politics	Salaŋ fenaɣ kɩyakʋ 17 wiye pɩnaɣ 1939 taa, paatɛm yɔkʋʋ sɔɔjanaa mba pakandɩyaɣ Polɔɔñɩ yɔɔ yɔ, nɛ lidaʋ ŋgʋ kɩɩkazaa yɔ lɛ se papɩsɩnɩ wayɩ nɛ pɔñɔɔzɩ pa-tɩ Rumaanii kondoloko ñʋʋ yɔɔ.
1148	health	Médecins Sans Frontières nɔɔ ɖɛyʋ Richard Veerman yɔɔdaa se : ʺKʋdɔŋ kɩɖɛɖɛʋ ŋgʋ kidiɣni sʋʋ Aŋgola ɛjaɖɛ taa yɔ, kɩkɛ kɩdɛkɛdʋʋ nɛ pɩkpaɖɩ pɩtɩŋa, nɛ wɛtʋ ndʋ tɩ-taa Aŋgola wɛɛ yɔ, tɩfɛyɩ ɖeu.ʺ
801	health	Ɩtaaɖɛlɛsɩ sʋlʋm kɩbɩbɩm ñɔʋ. Sʋlʋm fɛyɩnɩ ɖoŋ kʋɖʋmɩŋ ɛyaa tɩŋa yɔɔ, nɛ pɩcɛyaa siŋŋ se ɩtɩlɩ mɩ-kamaɣ.
1741	travel	Pa-ɖʋ taɣmaɣ se pɩpɔsʋ sɛ patʋlɩkʋʋ kpaakpa aloma fenaɣ pɩnaɣ 2017 alɩwaatʋ ndʋ Brasil sɔja-naa tɛm kamasɩ yaɣ wiluu.
1140	entertainment	Paa Winfrey kaawilaɣ alɩwaatʋ ndʋ ɛlakaɣ wele wele mba pɔsɔɔlɩ ɛ-tɔm yɔ, eheyi-wɛ se ɛkaɣ pɩsʋʋ.
1267	health	Edgar Veguilla kaamʋ heŋ e-nesi nɛ ɛ-tamaɣ yɔɔ, nɛ Kristoffer Schneider ɛlɛ yɔ, palabɩ-ɩ tʋmɩyɛ se pɔñɔɔzɩ ɛ-ɛsɩndaa.
1774	entertainment	Pɩɩkɛ kidiilimiŋ weyi nabʋyʋ taa hɔŋ sakɩyɛ kɔŋ ɩ-yɔɔ yɔ, nɛ faɣlɛ sakɩyɛ kaawɛ pɩ-cɔlɔ. Peeɖe lɩm yaʋ taakɔŋnɩ kaɖɛ naɖɩyɛ.
862	health	Ɛlɛ ajɛya hɔɔlɩŋ lɛɛŋ weyi ɩ-taa ɩkatɩɣ kʋdɔmɩŋ pee kɩfana yɔ ɩ-taa, pɩpɩzɩɣ pɩwɛɛ-mɩ kaɖɛ nɛ pɩkɩlɩ.
1069	politics	Laɣton kaapɔzaa se pɛlɛɣzɩ ‘Kɔnsɛɛrvatɛɛrɩwaa’ tɛ ɛjaɖɛ wɛtʋ paɣtʋ takayaɣ taa tɔm alɩwaatʋ ndʋ pa nɛ Minisi Kajalaɣ Ñɩnʋ palabɩ kediɣzaɣ yɔ, nɛ ɛpɔzɩ se ʺpatasɩ maʋ camɩyɛ tɔm kpeekpeʺ ndʋ tɩwɛ Kɔnsɛɛrvatɛɛrɩwa tɛ ɛjaɖɛ wɛtʋ paɣtʋ takayaɣ taa yɔ.
325	geography	Lɛɣtʋ ñɩnɩyaa mba pɛwɛ Helim Tɛʋ Sɔsɔʋ Tʋmɩyɛ Đɩlaɖɛ yɔ pɔyɔɔdaa se Danielle kaɣ kpaʋ ɖoŋ nɛ pɩɩtalɩɣ Cɩla wiye lɛ, kɩpɩsɩ helim tɛʋ sɔsɔʋ.
1314	health	Ɛ-ñɩnʋʋ tʋmɩyɛ wɩlaa se ye paha kɔyɛ naɖɩyɛ yɔ, piyeki nɛ pɩɣa ŋga kɛwɛ ko-ɖoo lotu taa yɔ, ka-hʋzɩŋ pɩɩ lɛɛ lɛɛ nɛ pɩkpaɖɩ.
704	travel	Paa mbʊ yɔ, pɩʈɩ pɔsɩ se ɛyʋ eɖoo tɔm ŋdʋ tɩyɔɔ, mbʊ pʋyɔɔ yɔ, aleɣya nʋmɔʋ woɖaa naɣ se pʋpɔsʋ se paɖʋ saŋsɩ pɔ-lɔrɛ taa.
528	sports	Ɛsι-kʋliye alιwaatʋ hola-maɣzʋ kɛ paɖayɛ hɔɔlʋ taa le ɖιnaɣ hɔlιŋ ŋtι-ŋtι, sukuli piya hɔɔlʋ pιkɔɔ pιtalι sukuli kιtɛɛzʋ taa nɛ sʋsaa hɔlʋ taa nɛ pιtɛzιna kataɣ taa lιʋ nɛ ɖama falasʋ taa.
532	sports	Maɖʋ wei ebombo waa kazι pazι yɔ, yaa ŋkpɛyɛ taa maɖaa tɛzʋna mabʋ se paakɛ waɖaa.
1643	science/technology	Ɛyʋ pɔɔzʋʋ ɛdɩ se ɛbɛɛ ɔrdɩnatɛɛrɩ masɩ-kpata kaɣ pɩsʋʋ kɛ bɩyʋ kɩfam kɔŋ pɩ-lɩɩ lɛ.
868	travel	Ɩmaɣzɩ sɩ ɩlakɩ kpanzɩɩtʋ nɛ wɩsɩ ɖɩ-ɖʋyɛ tɛ ɖɔnɛ, agɔma kuduyɩŋ kɩpaŋ nɛ kɔyɔka ñɩŋ, tɔɔnaɣ nɛ tʋma sɩ pɩsɩna-mɩ nɛ pɩmalɩnɩ-mɩ.
124	entertainment	Alɩwaatʋ sakɩyɛ pʋcɔ nɛ palɩzɩɣ The Daily Show nɛ The Colbert Report lɛ, Heck nɛ Johnson paamaɣza se palɩzɩɣ tɔm susuu takayaɣ nakɛyɛ ŋga kakaɣ labʋ tɔm susuu wɛɛ hoŋa-tɔm susuu ndʋ peɖiɣni wɩlʋʋ yɔ- alɩwaatʋ ndʋ paakɛ sukulibiya UW taa pɩnaɣ 1988 taa.
1159	politics	Fransɩ ɛjaɖɛ taa, caca tɔʋ tɩkɛ mbʋ palakɩ pɩtɩŋnɩ menziiniwaa yɔɔ yɔ : caca tɔyaa sʋʋ caca ɖɩdɔyɛ pe-ɖeke, nɛ palɩzɩ weyi pɔsɔɔlɩ-ɩ tɔʋ yɔ takayaɣ ŋga palɩzɩ kɔ-yɔɔ mba pɔtɔʋ-wɛ caca yɔ, nɛ paɖʋ takayaɣ ŋga aŋvelɔɔpɩ taa.
701	travel	Cuba ñɩma mba pɛ-wɛnɩ America taɣkaɣyaɣ ŋga kaɣhaɣ wɛ waɖɛ se pasʋʋ America ɛjaɖɛ taa yɔ, powokɩ Equateur ɛ-jaɖɛ lonee taa caɣyʋ tʋmɩyɛ taa nɛ pɛ cɛlɩ-wɛ taɣkaɣyaɣ ŋga kaɣhaɣ wɛ wadɛ se papatasɩ wɛʋ cɛyɩtʋ natʋyʋ taa pɩlɩ-nɛ takayɩsɩ tɔm taa.
560	health	Pʋcɔ nɛ ŋ-cɔna kʋdɔndʋ yɔɔ lɛ, pɩpɔsʋʋ se ŋ-cɔna hɔlʋʋ taa kpɛɛɛ nɛ ŋ-tisi se cɛyɩtʋ natʋyʋ fɛyɩ pʋcɔ.
167	politics	Ɛyaa kʋʋ mbʋ, pɩkɔnɩ kaɖɛ siŋŋ taabalɩyɛ nɖɩ ɖɩɩwɛ Ɛndɩ nɛ Pakistaanɩ pɛ-hɛkʋ taa yɔ, ɖɩ-yɔɔ.
301	politics	Vautier labɩ tʋma wena nɛ afɛyɩ ɖiyuu taa yɔ, a-taa kɛlɛ apɩɣya nɔɔ hɔkʋʋ mbʋ ɛlaba se ɛlʋbɩnɩ kañatʋ lakasɩ politiki nʋmɔʋ taa pɩnaɣ 1973 taa.
40	entertainment	John Grant weyi ɛlɩnɩ WNED Buffalo (Reading Rainbow ɖɩlɩyɛ) yɔ ɛyɔɔdaa : « Reading Rainbow kpɛlɩkɩɣ piya tɔm kalʋʋ,…se sɩsɔɔlɩ tɔm kalʋʋ-- piseɣtiɣ piya se sɩkpaɣ takayaɣ nɛ sɩkalɩ-kɛ.»
1414	politics	Paɣtʋ ndɩ ndɩ ndʋ pɩɩpɔzaa se ajɛɛ tɩŋa itisi tɩ-yɔɔ pʋcɔ nɛ palabɩnɩ-tʋ tʋmɩyɛ, nɛ ajɛɛ taakpakɩɣ komina sɔsɔʋ tɔm nɛ palakɩnɩ tʋmɩyɛ paa ññɩɩ nɛ pʋyɔɔ ɖoŋ ɖoŋ lɛ, po-lone taa caɣyaa taakɔŋ kediɣzisi.
1789	travel	Paa mbʋ yɔ, mbʋ payɩ ŋsɔɔlaa se pɛlɛɣzɩ yaa mbʋ payɩ ŋpɔzʋʋ yɔ, nɔmɔʋ wobu ɛgbɛyɛ taa tʋmlaɖʋ pɩwɛɛ se ŋpɔzɩ, taapɔzɩ agɔma ɖɩɣa kpaagbaa.
754	travel	Agɔma ɖɩsɩ nasɩyɩ wɛnɩ ñɩm mbʋ sulukiŋ habɛɛ wena alakɩ tʋmɩyɛ nɛ hohou yɔ nɛ mɛlɛnaa mba pasɩɣlɩɣ ɛyaa yɔ peyeba ñɩɣlɩm pɩnzɩ taa yɔ, pʋcɔ nɛ palakɩ Caama you naalɛ ñɩŋgʋ, pɩnzɩ 19 taa yaa pɩnzɩ 20 ɖɩbaɣzɩyɛ.
1142	politics	Kɛdɛzaɣ akɔntanaa mba palɩnɩ Namibii ɛjaɖɛ ñʋʋdʋ lɩzʋʋ nɛ paɣtʋ lɩzɩyaa lɩzʋʋ caca tɔʋ taa yɔ, pawɩlɩɣ se ɛjaɖɛ ñʋʋdʋ kɩbɩnʋ Hifikepunye Pohamba tasɩ wabʋ nɛ ɛɖɛɛ ɛ-wayɩ tʋ yɔɔ sakɩyɛ.
1022	politics	Trump yɔɔdɩnɩ Turiki Ɛjaɖɛ ñʋʋdʋ Tayyip Erdogan kaŋgalaafu yɔɔ nɛ pɩtɛ lɛ posusi tɔm ndʋ.
538	travel	Ɛsɩyekpena mba pɩsʋ nɛ palɩzɩ lona ŋtɩ-ŋtɩ ɛjaɖɛ naɖɩyɩ taa yaa lone kʋyʋɖɩyɛ.
155	geography	Pamaɣzɩɣ se ɛsɔdaa pɩyɛ naɖɩyɛ mɩzɩnɩ Hasɩɖɩyaɖɛ fenaɣ taa nɛ pɩha kaaŋ ɛnɩ ɩ-taa hiu nɛ kagbanzɩ.
1278	health	Paa ɛyaa naadozo kaawɛ ɖɩɣa taa alɩwaatʋ ndʋ lɔɔɖɩyɛ yɔkɩ-kɛ yɔ, pɩtɩkʋ pa-taa nɔɔyʋ.
1197	sports	A-taa kɛlɛ Peeyiiba, nɛ Anna Jochemsen weyi ɛkɛ nakʋ tʋ halaa tɛ Super-G taa ɖeɖe yɔ, nɛ Fɛɛlandɩ nɛ Katja Saarinen weyi ɛkɛ hiu tʋ hɔɔlʋʋ kʋɖʋmʋʋ ŋgʋ kɩ-taa yɔ.
1541	politics	Caama kaakɛ pa-naalɛ po-koyindu Caama You II taa, piyeba nɛ URSS nɛ Etaazuuni pala tʋmɩyɛ nɔɔ kʋɖʋmaɣ taa. You tɛma lɛ, lʋbɩyɛ nɖɩ ɖɩɩwɛ ɖʋtʋ ndʋ tɩ-taa, mbʋ piɖiɣni labʋ yɔ nɛ sɔnzɩ hɛkʋ taa yɔ, pɩlaba nɛ ajɛɛ tɔlɩ
1111	health	Ɛzɩma kʋdɔŋ paɣzɩ ɖɛʋ ɛyaa lɛɛ lɛɛ yɔ pituyi Ɛndɩ komina nɛ kɩla ɖʋtʋ tʋnɛ : paɖʋ menziiniwaa mba panaɣ afanaa yɔ lona wena a-taa kʋdɔŋ sa miŋ yɔ, patayɩ sɔbɔla sakɩyɛ nɛ pamɩzɩ pɔtʋ kɔɔ.
889	geography	Antaartiki Hɛkʋ taa kɛ piyaɣ ŋga kɔ-yɔɔ nabʋyʋ fɛyɩ nɛ ɖɔmbɛɛ sɔsɔna huuzini kɔ-yɔɔ nɛ pɩtalɩ kilomɛtanaa 2-3.
324	geography	Tɛʋ sɔsɔʋ kaaposini Miami, Floriidi taa ɛzɩ miles waa 3000, nɛ ki-helim seɣaɣ ɛzɩ 40 mph (kilomɛtanaa 64 paa ñɩɣyʋʋ ŋgʋ.)
118	entertainment	Aleɣya lubiyu Konami yɔɔdɩ sɔnɔ Japɔŋ tɔm susuu takayaɣ nakɛyɛ taa se paakaɣ lɩzʋʋ aleɣya Six Days in Fallujah (Kɩyakɩŋ Loɖo Fallujah tɛtʋ taa).
1018	entertainment	Gosling nɛ Stone pa-naalɛ pamʋ nimiye se pɛkɛ filim taa ɛyaa mba pakɩlɩ wɛʋ niye yɔ.
523	health	Pɩnɩɣ-ŋ nɩʋ mbʋ yɔ, pɩwɛ ɖɔɖɔ ɛzɩ ye paawɛɛ pefeziɣ-ŋ paa cɛcɛsɩ nɛɛlɛ yaa niidozo nzɩ se ŋcɔnɩ teelee yɔ.
1637	science/technology	Ɛyʋ pɩzʋʋ ɖʋɖɔ ɛ-na pɩñɛyɩtʋ ndʋ tɩ-taa wɛ wondu ñɩɩ ndʋ tɩ-dɛkɛ ñɩɩtʋ ɛzɩɩ  heelim taa mbʋ pʋ-kʋʋwezu nɛ ansaayɩ yaɣ se karbɔɔnɩ yɔ.
749	travel	Se ɛyʋ ɛkpa ɛ-maɣmaɣ ɛ-lɔɔɖɩyɛ taa nɛ ewolo nʋmɔʋ ɖooo poliŋ taa lɔɔɖɩyɛ nɖɩ ɖɩ-taa, pɩkɛ mbʋ pɩwɛ kɛlɛʋ nɛ ɛyaa sɔɔlɩ pɩ-labʋ yɔ.
1575	science/technology	Mansɩ tɩkasɩ naalɛ wɛ sɩɩ koyɩŋdinaa yɔ  ɛsɩ 0 na 1 yɔ, nɛ waadasɩ nsɩ, pacɔŋna sɩ ezɩɩ pee, yee ɛyʋ ɛkʋlʋʋ computa tɛ kʋnʋŋ.
524	health	Ɛzɩma pɩlakɩ-ŋ yɔ pɩlɩɣnɩ tam ɛzɩma ña-fɩtɩyɩm ñakɩ pana se ŋɖozi kpayɩ kpayɩ paa ɖoo wena yɔ
358	science/technology	Palakɩ mbʋ alɩwaatʋ ndʋ palɩzɩɣ ñalɩmɩyɛ piye cikpeɖe nɖɩ payaɣ se ʺphotonʺ yɔ.
999	health	Ɛzɩ lɛɣtʋ ñɩnɩyaa lalaa yɔ, ɛpɩtaɣ se ɛzɩ papɩzɩɣ nɛ pawaa sikiɖi kʋdɔŋ na, nɛ ɛyɔɔdɩ se mbʋ pana ñɩnʋʋ taa yɔ piitukuuni ɛyaa mba pɛtɛm wɛnʋʋ sikiɖi kʋdɔŋ kajalaɣ ñɩŋgʋ yaa Type 1 yɔ.
1359	science/technology	Mʋʋzɩŋ kɛ agunaa mba pakɩlɩ sɔɔlʋʋ ɖama cɔlɔ caɣʋ yɔ, pekpeɣliɣ ɖama tindima sɔsɔna wena payaɣ se cajayɛ yɔ a-taa.
311	entertainment	Paaɖɔkɩ nesi Texas pɩlakɩ pɩnaɣ yɔ nɛ pʋwayɩ lɛ pɔkɔɔ Buffalo se pa nɛ pa-taabalaa nɛ pɔ-hɔʋ taa mba pɔtɔɔ kazandʋ.
1917	entertainment	Aleɣya mɛlɛnaa saʋ kɛnɩ Fɛɛlandɩ ɛjaɖɛ taa aleɣya wena ɛyaa kɩlʋʋ labʋ se pamʋnɩ helim yɔ, nɛ ye pakpaɣ ɛyaa lʋbɛ yaa lutozo kɔyɔ, pɛwɛnɩ mɛlɛ kʋɖʋmʋʋ.
1771	geography	Hayo Kiŋ Teŋgu nɔɔ kidiilimiŋ (Hayʋ Kiŋ Mɛlɛnaa Ɖɩzɩŋɩyɛ egeetiye taa) kaawɛ Pasifiiki Teŋgu yɔɔ nɛ ɩɖaɣlɩ kpaɣnɩ Lɔɔŋ Bee hayo kiŋ nɛ piwolo pɩtalɩ Tevɔɔpɔɔrɩ hadɛ kiŋ.
361	science/technology	Halɩ photon waa wɛ ññɩɩ nɛ pɩkɩlɩ mba palabɩnɩ atom pee yɔ.
196	health	Minisi Ɛjaɖɛ Ñʋʋdʋ Rodrigo Arias yɔɔdaa se pamaɣzɩ Arias nɛ pana kʋdɔŋ sɔtʋ ndʋ tɩfɛyɩ ɖoŋ yɔ ɛ-yɔɔ.
951	travel	Pʋwɛna-mɩ kɩjɛyʋʋ sɩ ɩlɩzɩ ɩsɔtaa lɔɔɖɩyɛ tɛ piliŋga pɩlɩɩna kɛ-tɛ nɔmɔʋ ɖɔm yɔ.
878	health	Kʋdɔŋ kɩɖɛdɩʋ kɛna kʋdɔŋ nŋgʋ kɩɖɛɣ kɛlɛʋ yee nɔɔyʋ ɛñɔtɩna kʋdɔndʋ yɔ.
214	sports	Pakaɣ pɩsɩnʋʋ gɔlɩfɩ nɛ rugibii pa-naalɛ Olɛmpiiki Aleɣya taa.
509	health	Kʋdɔŋ ŋgʋ kiiyeki se pataakpɛlɩkɩ tɔm, ɛlɛ pɩwɛ kaɖɛ se pɛkpɛlɩkɩ tɔm ; nɛ ʺkitukuuni piya mɩnʋʋ yɔɔ lɛ 3 yaa 5, pʋtɔma yɔ Amerika piya ɛzɩ miliiyɔɔwaa 2 mbʋ yɔ wɛnɩ-kʋʺ.
332	entertainment	Papaɣzɩ kazandʋ nɛ ŋgee aleɣya wɩlʋʋ wena aleɣya ɛgbɛyɛ Cirque du Soleil nɖɩ ɖɩ-hɩɖɛ sɛ ɛjaɖɛ kpeekpe yɔɔ yɔ, ɖɩlaba yɔ.
835	travel	Hɔɔlɩŋ lɛɛŋ taa lɛ, ɛyaa mba pasʋʋ ɖɩsɩ nzɩ sɩtɩkɛ agɔma ɖɩzʋyɛ yɔ, pa-hɩla ɖeke pɩwɛɛ se pama. Piyeki nɛ ɛyaa mba ɩɩtasɩɣ paɣtʋ taa nɩʋ camɩyɛ, pʋyɔɔ lɛ ɩpɔzɩ lɔŋ nɛ pʋcɔ.
298	politics	Palabɩ lɛɣzɩtʋ paɣtʋ lɩzɩyaa kediɣzaɣ kanɛ ka-taa alɩwaatʋ ndʋ Paɣtʋ Lɩzɩyaa Ɛgbɛyɛ Kajalaɣ ñɩnɖɛ kaacalɩ hɩzʋʋ tɔm loyaɣ naalɛ ñɩŋga, nɛ pʋwayɩ lɛ Paɣtʋ Lɩzɩyaa Ɛgbɛyɛ naalɛ ñɩnɖɛ ñakpaɣ tɔm loyaɣ ŋga kɔ-ɖɔndɩ nɛ palabɩnɩ tʋmɩyɛ Hodo wiye.
392	politics	Kiyo Fransɩ yɔɔ nɛ pɩtɛ lɛ, Caama paɣzɩ kɩ-tɩ ñɔɔzʋʋ se kɩwadɩ Krandɩ Pretaañɩ lɩm hɛkʋ taa tɛtʋ yɔɔ.
1211	entertainment	Pɩnaɣ 1989 taa, ɛsɩnɩ Brooks nɛ Groening nɛ palɩzɩ Simpsons waa, nɛ ɛnʋ mʋnɩ kajalaɣ tʋmlaɖaa mba pama aleɣya ana a-tɔm yɔ.
204	travel	Twin Otter ñɩnaɣ se kitii Kokoda ɛzɩ Airlines PGN tɛ ɛsɔdaa lɔɔɖɩyɛ CG4684 yɔ, ɛlɛ kɩɩtɛm ñaɣʋ pana nɛ kɩtɩpɩzɩ.
916	science/technology	Tɔm ɖɛzʋʋ wondu wɛɛ nɛ tɩkpasɩɣ ɖɩ-tʋmɩyɛ labʋ, nɛ pɛɖɛzɩɣ-tʋ camɩyɛ, kpaʋ nɩ coɖuu patɩtasɩ wɛʋ tɔm ɖɛzʋʋ taa.
535	entertainment	Pιkɛ alιwaatʋ ŋtʋ ɛyaa kʋyʋʋ nɛ powolo lone ŋɖι ɖιwɛ ŋtι nɛ pɛtɛ kιyakιŋ kpeekpe wezu caɣʋ yɔ nɛ pɛhɛzι nɛ peleyi.
658	health	Ɛ-kpa mɩdɩ nɛ hayo kiŋ pɔtʋʋ soŋaɣ tɛ alɩwaatʋ taa. Paa tɩɩɖɛɛzɩɣ kʋdɔŋ nakʋyʋ yɔ, tɩpɩzʋʋ tɩcɛyʋʋ ɛyaa
353	science/technology	Lɩm pee kpɛndɩɣ nɛ ala ɛzɩ tɔnɛ nɖɩ paanaɣ lɩm yɔɔ nɛ mbʋ yebina nɛ wondu ɛzɩ ɛjɔʋ yaɣ lɩm mbʋ pɩ-yɔɔ.
1520	health	Tɔm ndʋ Oliver Sacks mawa nɛ tɩ-ñʋʋ lɛ se Ɛjaɖɛ ñʋʋdʋ Tɔm Yɔɔdʋʋ yɔ tɩ-taa, ɛwɩlɩ ɛzɩma ɛyaa pɩzɩɣ nɛ paanɩɣ tɔm ndʋ pɔyɔɔdʋʋ mbʋ pʋyɔɔ yɔ pa-fɩtɩyɩm taa nɛ kʋdɔŋ yɔ, ɛlɛ papɩzɩɣ nɛ pana ɖeyi ɖeyi se nɔɔyʋ yɔɔdʋʋ toovenim yaa ɛɛyɔɔdʋʋ.
1331	politics	Ɛyaɣ maɣzɩɣ se ɛkɛɣ wɛʋ mba pañɩnɩɣ se pɔtɔ-wɛ caca nɛ pɛkɛ ɛjaɖɛ ñʋʋdʋ yɔ pa-taa pɩnaɣ 2016 taa.
295	health	Elikɔpɩtɛɛrɩwaa yabɩ ɛyaa hiu nɛ naalɛ mba paawɛ kɩ-taa yɔ pa-ñʋʋ nɛ ɛyʋ kʋɖʋm weyi ɛmʋ heŋ yɔ, ɛ-mɔɔʋ yɔkɩna.
569	science/technology	Saɣmaɣ kena wezuu kpɩna nɛ wondu kpɛŋɖʋʋ alɩwaatʋ natʋyʋ tɛtʋ hɔlʋʋ nakʋyʋ yɔɔ.
926	science/technology	Yee ŋ-lakɩ ɛsɔtaa ñɩɣyʋ se ŋ-pkpaɣna kɩlɛmɩŋ kɔyɔ, pʋwɛɛ se ŋ-na ŋ-wɛna waɖɛ takayaɣ nɛ mbʋ pʋpɔzʋʋ yɔ nɛ pʋcɔ.
854	travel	Hɛzɩyɛ wɛ Meetroo Pliisi taa nɛ pɩkɩlɩ nɛ pɩɩñɩɣdʋʋ ɛyʋ, ɛlɛ kɩwɛ liidiye pazɩ nɛ pɩkɩlɩ, paa kɩfɛyɩ liidiye nɛ pɩtalɩ Erɔɔpɩ sulukiŋ tikeenaa kɔyɔ.
225	science/technology	Đoŋ kɩkpɛɛdɩŋ kɛ ɖoŋ weyi paatɩɩnaɣ-ɩ yɔ nɛ ɛlakɩ tʋmɩyɛ tam kedeŋa yɔɔ yɔ.
1598	science/technology	Palaba maɣsɩtʋ naalɛ; maɣsɩtʋ lɛŋdʋ nɛ phosphorɩ nɛ naalɛ ñɩŋdʋ nɛ sulfurɩ.
771	entertainment	Keralaa tɛtʋ taa kɛ paaŋ kazandʋ wɛ cɔnaʋ pɩdɩɩfɛyɩ, ɖɩnaɣ pɩ-taa tuŋ weyi pacanɩ-ɩ yɔ ɛ-canɖaŋ, kpaaŋ taa soo nɛ kazandʋ lɛɛtʋ.
856	travel	Lalaa wondu sɩɣlʋʋ - Mɩ-ɛsa ɩwɛɛ mi-wondu yɔɔ tam, kɔzɩ kɔzɩ yee ɩtɛzɩɣ ajɛya ndɩ ndɩ kamasɩ kɔyɔ.
23	sports	Sɔnɔ Evemiye pombo maɖʋ kɛnɩ Alex Ovechkin weyi ɛlɩnɩ Wasɩŋtɔŋ Tɛtʋ Sɔsɔtʋ taa yɔ.
432	politics	Lukizɛmbuuri wezuu caɣʋ tɔm leɖaa ɛlɛ kɩmʋ tɩ-yɔɔ wɛʋ kpaɣnɩ pɩnaɣ 1839 na.
1804	travel	Afrika taa, lakʋ taa yɛlʋʋ mbʋ pɩ-taa nɔɔyʋ wɛɣ nɛ eɖiyiɣ ɛyaa yɔ, pʋhɔŋ ɛsɩyɛgbena tɩnaa sakɩyɛ, nɛ mbʋ pa-taa sakɩyɛ kɩlɩ sɔɔlʋʋ.
533	sports	Pamakι bombo waa mpaa ñιtʋ yɔɔ kɛna nɛ pɔʋ ñιtʋ tɛɛ nɛ kιwɛɛ ñιι nɛ payaa kʋ se ñιtʋ lιm.
434	politics	Lukizɛmbuuri kaañaɣ pana paa ɛzɩmtaa se kɩkɛ ɛjaɖɛ nɖɩ ɖɩɩtɩnɩɣ hɔɔlʋʋ nakʋyʋ yɔɔ yɔ, ɛlɛ Caama wadɩ kɩ-yɔɔ Caama You I nɛ Caama You II taa.
128	entertainment	Ajana aleɣya ɖʋtʋ ndʋ tɩɩkɛ ɖɔɖɔ pana wena Pukarɛɛsɩ Maalika ñakaɣ se pɩsa patasɩ naʋ Rumaanii tɛtʋ sɔsɔtʋ ndʋ ɛzɩ tɛtʋ sɔsɔtʋ ndʋ tɩwɛ kajʋka nɛ tiluki wondu kɩfatʋ yɔ.
810	sports	Canyoning aleɣya taa, pɛkpɛndɩɣ lɩm yaʋ, kpaʋ nɛ maʋ; ɛlɛ pɩtɩcɛyɩ se ɛyʋ ɛhayɩsɩ ɛ-tɩ sakɩyɛ yaa ɛwɛɛ ɖoŋ sakɩyɛ pʋcɔ nɛ ɛpaɣzɩ a-labʋ (pɩwɛ ndɩ nɛ pʋŋ kpaʋ, teŋgu tɛɛ tibu yaa pʋʋ taa sikii labʋ mbʋ yɔ).
1327	science/technology	Pʋtɔma yɔ kpɛzɩyaa cɔlɔ lɩm lɩnaa nɛ pɩkɔɔ tɛtʋ yɔɔ nɛ pɩkpɛndɩnɩ wondu cikpetu ndʋ tɩɖɔkʋʋ wezuu.
638	science/technology	"Pɩnaɣ 1977 taa Dr Damadian tɛma ñɩyʋ ,ngʋ kɩnaɣ ɛyʋ tomnaɣ kpekpe taa mbʋ pɩɖɔŋ yɔ maʋ nɛ ɛpɩsɩ ɛyaa-kʋ se ""Paawakɩm kaʋ""."
269	sports	Jesus weyi ɛwɛnɩ pɩnzɩ 21 yɔ ewobi Manchester City taa pinde Kɔlaɣ fenaɣ pɩnaɣ 2017 taa, ɛlɩnɩ Preeziili ɛgbɛyɛ Palmeiras taa nɛ pɛhɛyɩ ɛ-yɔɔ livre sterling miliiyɔɔwaa 27.
1364	science/technology	Kpou wɛ tindimiye kʋɖʋmɖɩyɛ (Genre Panthera) taa nɛ mʋʋzɩŋ, maayɩnaa, nɛ kpemtɔɔyɩsɩ. Ñɩtʋ taa agunaa mba pe-ɖeke papɩzɩɣna nɛ pamʋʋdɩ.
989	geography	Pɔsɩ nzɩ sɩ-taa lɩm pɩsɩɣ ɖɔmbɛ yɔ sɩfɛyɩ sɩ-tɩ yɔɔ, ɛlɛ sikpeŋ pʋʋ kpeekpe taa. Piyeki nɛ pɩyaɣ pɛnla wena ɖɔmbɛ kaɣ a-yɔɔ huuzuu pʋwayɩ yɔ.
864	health	Mbʋ pɩlɩ Deelii Beelii lakasɩ taa yɔ, nɔɔ kɩdɛkɛdaɣ ŋga Pharaɔɔ lɔwa yɔ, Monteezumaa kɩmɩyɛ kpaʋ, nɛ pa-tabalaa sakɩyɛ.
595	science/technology	tomnaɣ hɔɔlaɣ kɛnɩ tomnaɣ egbeliye cikpeɖe kpaagba nɖɛ nɖɩ ɖɩ-wɛnɩ wezuu yɔ. Nɖɩɩ pa-yaɣnɩ anglisi taa se ''sell''.
571	science/technology	Alɩwaatʋ ndʋ saɣmaɣ taa cacasɩ wɛ ndi ndi yɔ, pɩwɩlɩ se patɩna ɖee kʋɖʋm.
924	science/technology	Kɩlɛmɩŋ lɩzʋʋ nɛ kɛlɛm kɛlɛm waa kpaɣʋ wɛna paɣtʋ kʋyʋmtʋ.
570	science/technology	Alɩwaatʋ ndʋ saɣmaɣ nakɛyɛ taa ɛyaa nɩɣzɩna ɖama yɔ pɩlɩna cacasɩ nasɩyɩɩ yɔɔ yɔ, paɣhaɣ wɛ yɩɖɛ nɖɩ ɖɩwɩlɩ se palɩna ɖee kʋɖʋm.
1273	sports	Ski laɖaa naanza mba pɛwɛ halaa mba pacaɣaa yɔ pa-taa yɔ patɩpɩzɩ pɛtɛ pe-seya, nɛ ski laɖaa kpeekpe 117 mba palabɩ Sɩlalɔm Sɔsɔʋ yɔ pa-taa lɛ, 45 tɩpɩzɩ nɛ pehiɣ lone seya taa.
1400	politics	Pama tɔm tʋnɛ Tɩ-yɔɔ Wɛʋ Takayaɣ wayɩ : ʺTɩ-yɔɔ Wɛʋ Takayaɣ Kajalaɣ Ñɩŋga ŋga pama-kɛ Hasɩɖɩyaɖɛ fenaɣ kɩyakʋ 4 wiye pɩnaɣ 1776 taa yɔʺ. Tɔm ndʋ tɩwɛ takayaɣ ŋga kɛ-tɛɛ kiŋ nɛ pama-tʋ kiŋgiɖe.
664	travel	Walt Disney ɛjaɖɛ taa wobu wɩlɩ nʋmɔʋ sʋsɔʋ wobu pɩcɛlɩ na Amerika hɔŋ.
1737	travel	Eyʋ ɛ-lɩna ɖelɩ nɛ ewoki ɖeelɛŋɖɛ, taxii naa wɛ lɛɛlɛ nɛ camɩyɛ ɛsɩɩ Paro (NU150) nɛ Punakha (NU200).
457	science/technology	Zoom ñɩnɩŋ wɛtʋ kɩdɛkɛdɩtʋ lɛɣtʋ lɛ se ɛzɩma kɩlɛmʋʋ pɔʋ kuluu yɔ (seya), ɖoŋ ɖoŋ lɛ pɩtɩwalɩ nɛ pɩɖɔɔ.
1051	politics	Lɩmaɣza 78 wena kɩtasaa yɔ a-taa kajalaɣ ñɩnɖɛ lɛ se pala ɖʋtʋ kɩfatʋ ajɛɛ hɛkʋ taa taabalɩyɛ nʋmɔʋ taa pʋcɔ nɛ pɩnaɣ kanɛ kɛtɛ nɛ pɩkandɩyɩ Iraakɩ kamasɩ yɔɔ nɛ pataalabɩ kɩdɛkɛdɩm nɛ pɩñɔɔzɩ taabalɩyɛ nɖɩ ɖɩwɛ ɖɩ nɛ ɖɩ-cɔlɔ mba pɛ-hɛkʋ taa yɔ.
870	travel	Yee ɩwoki  caɣʋ yɔ, ɩkpendɩna caɣyaa tɛ kaɖʋ yaa kamaka nɛ pɩsa nɩ ɩpɔsi mɩ-tɩ nɛ ɖʋmaa, pɩcɩsɩ nɛ tɛtɛ wondu.
1735	travel	Esɩna mbʊ tɛtʋ taa lɔɖɛ sʊʊ alɩwaatʋ tɩnɛ yɔ, pɩwɛ soocɩ se ɛyʋ ɛya tikee avena naayɛ pʋcɔ kɩyakʋ ngʋ paɣcaɣ lɔɔɖɩyɛ kpaɣʋ yɔ.
1852	sports	Ɩkpaɣ sikii nʋmɔʋ ɛzɩ nɔmɔʋ ɖɔm nʋmaŋ lɛɛŋ yɔ.
816	sports	Ɛgbɛyɛ nɖɩ ɖɩlɛɣzɩ Global Running Tours lone taa nɛ payaɣ-ɖɩ se Go Running Tours yɔ, kedenzi naanza taa, ɖɩlakɩ tʋmɩyɛ nɔɔ kʋɖʋmaɣ nɛ tʋmlaɖaa mba pɛpɛdɩɣ seya wondu yɔ, pa-taa hiŋ sakɩyɛ.
986	geography	Ɛzɩ pɩwɛɣ Nɔrɩvɛɛzɩ taa yɔ, lɩm nɛ kɛdɛnzɩ tɛŋ kpa lɛ, pʋʋ ŋgʋ kɩ-ñʋʋ taa wɛ tayɩ yɔ kɩ-yɔɔ ŋtɔlʋʋ.
1786	travel	Nɔmɔʋ wobu agbaa taa tʋmlaɖaa nɛ agɔma ɖɩsɩ nasɩyɩ panɩɣna ɖama, paa mɩ-maɣmaɣ ɩpɩzɩɣ ɩtɩŋna nɔmɔʋ wobu ɛgbɛyɛ taa tʋmlaɖʋ nɔɔyʋ yɔɔ nɛ ɩya ɖʋzʋyɛ lɛɛna, ɛzɩ kizinzikiŋ tɛtʋ mbʋ yɔ.
833	travel	Pɩpɩzɩɣ nɛ pɩpɔzɩ se iwolo polisinaa cɔlɔ nɛ payʋsɩ takayaɣ nakɛyɛ, yaa iwolo ɛjaɖɛ lɛɣzʋʋ tʋmɩyɛ naɖɩyɛ taa.
597	science/technology	Yee ɛyʋ ɛ-cɔŋnɩ wezuu wonduu lɔŋ ɛsɛñɩnɩŋ tɛɛ kɛyɔɔ, n'naɣ se pʋ-wɛɛ zɩɩ cacabe hɔɔlʋ yaa malɩfabɛ manɩ-dʋ.
1281	health	Kiɖe tɛɛ lɛ pasɩ-ɩ James Paget Đɔkɔtɔ taa, Great Yarmouth taa.
1472	politics	Liidiye nɖɩ Etaazuuni wɛɛkaa se kɩtɔɔ kewiyitu Filiipini yɔɔ yɔ, Filiipini mba maɣmaɣ hɛyɩnɩ-ɖɩ.
1011	sports	Đitisiɣ tɔm ndʋ USOC yɔɔdaa yɔ tɩ-yɔɔ, se pɩwazɩɣ ɖo-hola aleɣya laɖaa nɛ pa-agbaa nɛ hola aleɣya wena palakɩ yɔ, ye ɖiwobi pɩ-yɔɔ nɛ ɖɩlakɩ lɛɣzɩtʋ ndʋ pʋpɔzʋʋ yɔ ɖɛ-ɛgbɛyɛ taa nɛ pɩkɩlɩ se pamʋ pɔ-cɔlɔ waɖɛ nɖɩ pɛwɛna yɔ.
1674	science/technology	Pʋnɛ pɩsɩna eyʋ se ɛhɩɣ lɔŋsɩnɖɛ kɩfaɖɛ nɛ wondu kɩfatʋ se taɣmaɣ ŋga kasɩnɛ-ɩ wɛtʋ ndi ndi taa se ɛpɩsɩ ɛna se cɛyɩtʋ mba pɛwɛ-nɩ ɛyʋ feŋteɣlɩm.
805	health	Ɩla ɖʋtʋ nɛ pɔkɔɔ pamaɣzɩ mɩ-ɛsa mɩ-ɖɩɣa, kɔzɩ kɔzɩ yee ɩwɛnɩ Assurance kɔyɔ. Ɩtaasɔɔ se ɩkpɛndɩna takayaɣ ŋga kɔ-yɔɔ pama yɔ nɛ paatɛzɩ-kɛ ɖom lɛɛɖɛ.
1542	politics	You tɛma nɛ pɩla pɩnzɩ naalɛ lɛ, taabalaa kɩbɩma pɩsɩ lɛɛlɛɛyɔ koyindinaa, nɛ Niŋkaɣ You paɣzɩ
134	science/technology	Teŋgu taa lɩm kɩsɛɛmɩm huu lɩnɩ ɛzɩma teŋgu taa ñɩɣyʋʋ ŋgʋ kɩwɛnɩ kuludaɣ kʋɖʋmaɣ nɛ payaɣ-kɛ se Karenia brevis yɔ, kɔɖɔ lɩm taa nɛ pɩkpaɖɩ ɛzɩma pʋpɔzʋʋ yɔ, pɩ-cɔlɔ.
740	geography	Pɩkɛ lɩm hɛkʋ taa tɛtʋ kɩgbɛndʋʋ mbʋ pɩ-taa wɛ lɩm hɛkʋ taa tɛtʋ ɛzɩ 15 mbʋ yɔ, mbʋ papɩzɩɣ patayɩ-pʋ teŋgu sɔsɔʋ walanzɩ mbʋ pɩtalɩɣ kilomɛtawaa miilliyɔɔwaa 2.2 mbʋ yɔ tam nabʋlɛ.
1183	health	Pamaɣzɩɣ se H5N1 kpa nabɛyɛ Krowaasii nɛ Tanemaarkɩ taa, ɛlɛ patɩmaɣzɩtɩ-wɛ se pana.
1352	science/technology	Tɩɩnzɩ taa kpaʋ lɔɔɖa yɔɔ patɩŋɩɣna nɛ petiyiɣni satellite ɛsɔdaa. Lɛɣtʋ ñɩnɩyaa tɩŋɩɣnɩ ɛsɔdaa ɛsañɩnɩŋ yɔɔ se pana ɛsɔdaa mbʋ pʋyɔɔ helim mbʋ pɩcɔ Tɛtʋ nɛ pɩta yɔ, pikotuu ñalɩmɩyɛ nɛ ɛzɩma ɖɩnaɣ wondu yɔ.
1880	travel	Nɔmɔʋ woɖaa mba palakɩ ɖʋtʋ se palabɩ-wɛ tʋmɩyɛ agbaɣdaa ɛjaɖɛ taa se pɩsa nɛ papɩsɩ pa-tɩ abalaa yaa halaa yɔ, pɩwɛɛ se pɔcɔna camɩyɛ nɩ pana se pɛwɛnɩ takayɩsɩ kɩbanzɩ nzɩ sɩhaɣ-wɛ nɔmɔʋ se papɩsɩ pɛ-ɛjaɖɛ taa yɔ.
1588	science/technology	Lɛɣtʋ ñɩnʋʋ taɣmaɣ lɛ se pɔcɔna nɛ pana se ɛzɩmaɣ kedeŋa ɖɔŋ pɩlɩna lɛɣtʋ ñɩnʋʋ paɣtʋ yɔɔ. Lɛɣtʋ ñɩnʋʋ paɣtʋ ndʋ wɩlɩɣ nʋmɔʋ lɛɣtʋ ñɩnʋʋ.
877	health	Kʊdɔŋ kɩɖɛɛzʊʊ kɛ kʊdɔŋ ŋgʊ kɩlɩʊna mɩɩsʊ ɛzɩ viriisɩ , bakiteri , kpɛŋgbɛka yaa ɖalaa lɛla cɔlɔ
1851	sports	Nɔɔ kʋɖʋmaɣ wɛ pɩ-hɛkʋ taa, ɛlɛ ɖoŋ ɖoŋ lɛ paapɩzɩɣ nɛ pɔyɔɔdɩ se pɩkɛ sikii nʋmɔʋ ɖɔm yaa pʋŋ kpaʋ, mbʋ palakɩ-pʋ piyisi nzɩ sikpilaa kpem yɔ sɩ-yɔɔ yɔ, ɖenɖe pʋpɔzʋʋ sikiiwaa nɛ naakoma wena acɛyɩ camɩyɛ yɔ.
1152	sports	Ɛzɩma pakandɩyaɣ pombo yɔɔ, pɔɖɔkʋʋ pombo nɛ lɛɣtʋ nɛ pɛkpɛndɩ nɛ pamakɩ nɔɔ kʋɖʋmaɣ taa camɩyɛ yɔ, piyeba nɛ pɛɖɛɛ lalaa yɔɔ nɛ pɩnaɣaɣ kaɣlaa se paakɛ pombo ɛgbɛyɛ nɖɩ lalaa ñɩnaɣ se pawa yɔ.
1082	politics	Tʋmɩyɛ nɖɩ payaɣ se Commons yɔ ɖɩ-ñʋʋdʋ Adam Cuerden yɔɔdɩ ɛzɩma pɩtaalabɩ-ɩ leleŋ pɩlɩɩnɩ tʋma wena pasɩnzaa yɔ a-yɔɔ alɩwaatʋ ndʋ ɛyɔɔdɩnɩ Wikinews fenaɣ ŋga kɛɖɛwa yɔ ka-taa yɔ.
1241	science/technology	Pɔtɔ-kʋ nɛ pɩla cɛcɛsɩ 3 mbʋ lɛ, kamera ŋgʋ paakpɛndɩnaa yɔ kɩwɩlɩ se kpootu hɔɔlɩsɩ sakɩyɛ paɖʋwa se nabʋyʋ etaaluli sɩkpɛzɩnɩ kokoɖe nɖɩ ɖɩ-taa paaɖʋʋ sanzɩ yɔ.
1190	politics	Perry yɔɔdaa se ɛkaɣ ʺpɩsʋʋ Texas nɛ ɛtazɩ mbʋ pɩlɩ ɖoo anɛ a-tɛ caca tɔʋ taa yɔ, nɛ mana se nʋmɔʋ nakʋyʋ wɛɛ se matɩŋ-kʋ caca ŋgʋ kɩ-taaʺ, ɛlɛ pʋwayɩ lɛ ɛyɔɔdɩ se ɛkaɣ wobu pɩ-yɔɔ caca ŋgʋ kɩ-taa nɛ ɛmaɣzɩ ɛ-tɩ nɛ lalaa Karoolini caca tɔʋ kajalaɣ ñɩŋgʋ ŋgʋ pakaɣ labʋ Kɔlaɣ fenaɣ kɩyakʋ 21 wiye yɔ kɩ-taa.
498	health	Pɩnzɩ mɩnɩŋ sakɩyɛ taa, Roma kewiyaɣ sɔsɔɔ yeba nɛ pehiɣ kɛzɛsɩ sakɩyɛ ɖɔkɔtɔnaa lɛɣtʋ nʋmɔʋ taa nɛ pekpeɣli mbʋ ɖɩsɩm sɔnɔ yɔ pɩ-taa sakɩyɛ.
276	politics	Stearns ɖiɣni ñɩnʋʋ se ɛna se ɛzɩ Planned Parenthood wɛɛ nɛ kɩkpakɩɣ tikee liidiye nɛ kɩlɩzɩɣnɩ hosi na, ɛnʋ weyi ɛkɛ kɔɔmiite cikpeluu ŋgʋ kifeŋiɣ nɛ kɩñɩnɩɣ wondu yɔ kɩ-ñʋʋdʋ yɔ, ŋgʋ kɩwɛ Tadɩyɛ nɛ Đoŋ Đɩɣa Kɔɔmiite tɛɛ yɔ.
1865	travel	Yee pawɩlɩ niye ɛjaɖɛ nɖɩ ɖɩ-taa ɩcaɣ wobu kɔyɔ, pɩpɩzɩɣ nɛ pɩwɛɛnɩ ɖoŋ mɩ-tɛ Assurance waa yɔɔ.
1337	science/technology	Princeton Sukuli Kɩtɛzʋʋ ŋgʋ kɩwɛ Etaazuuni nɛ Uppsala Sukuli Kɩtɛzʋʋ ŋgʋ kɩwɛ Suyɛɛdɩ yɔ pa-taa ñɩnɩyaa yɔɔdaa se sumaɣ kɩfalaɣ ŋga kalɩ kpanɖaŋ naalɛ ɖeke taa na, paa pamaɣzɩɣ se lɛɣzɩtʋ ndʋ tɩkpakɩɣ alɩwaatʋ sakɩyɛ nɛ pɩkpaɖɩ yɔ, pɩlɩɩnɩ tɛtʋ taa Darwin sumaɣ ŋga payaɣ se Geospiza fortes nɛ sumaɣ Geospiza conirostris ŋga kalɩnɩ ɖoli nɛ kɔkɔɔ peeɖe, palʋlʋʋ taa.
1264	politics	Huhne kizi ɛ-tʋmɩyɛ nɛ Paɣtʋ Lɩzɩyʋ Ed Davey kaɣnɩ-ɩ lɛɣzʋʋ tʋmɩyɛ taa. Pamaɣzɩɣ se Paɣtʋ Lɩzɩyʋ Norman Lamb kaɣnɩ pɩsʋʋ Minisi weyi ɛcɔŋnɩ tadɩyɛ yɔɔ yɔ, Davey lone taa.
1790	entertainment	Kazandʋ sakɩyɛ hɔɔlʋʋ taa lɛ, mba paɖʋʋ nesi minziiki kazandʋ yɔ, pakpakɩɣ lɩmaɣza se pesiki kizinzikiŋ lone nɖɩ ɖɩ-taa, nɛ mba powobi kazandʋ ndʋ yɔ pa-taa sakɩyɛ kpakɩɣ kazandʋ hɔɔlʋʋ ŋgʋ ɛzɩ mbʋ pɩ-tɔm cɛyɩ sɩŋŋ yɔ.
490	politics	Paa kɛdɛzaɣ ɖeɖe Krushchev etiyini you lɔɔɖa nɛ papɩsɩnɩ ɖiɣ ɖiɣ caɣʋ kɔyɔ, ɛlabɩ mbʋ pɔpɔzɩ tɔsʋʋ nʋmɔʋ taa yɔ pɩ-taa nabʋyʋ, nɛ etisi se Wladyslaw Gomulka weyi ɛ-hɩɖɛ sɛwa yɔ ɛpɩsɩ Minisi Kajalaɣ Ñɩnʋ kɩfalʋ.
827	travel	Mba pɔsɔɔlɩ faaa se pakpaɣ ɖɩɣa taa hɛzɩyɛ, alɩwaatʋ nɛ tɩ ñɔɔzʋʋ nɛ palaa kɩlaʋ se pɩsa nɛ pataahɛyɩ liidiye sakɩyɛ yɔ, ɩtasɩ kalʋʋ nʋmɔʋ wobu liidiye nɖɩ pʋpɔzʋʋ kpidikpidi yɔ,  ɖɩ-yɔɔ tɔm.
1433	science/technology	Kɩyɔɔdʋʋ se lone kɩbanɖɛ nɖɩ ɖɩ-taa pɩwɛɛ se pʋyʋ sɔsɔm ɛwɛɛ lɛ ɖenɖe canzɩ nzɩ sɩtayɩɣ kɩlɛmʋʋ hɔɔlɩŋ naadozo taa sɩŋʋʋ yɔɔ nɛ hɩnʋʋ yɔɔ yɔ, sɩkpɛndɩɣ yɔ (cɔnɩ kɩɖaʋ).
1939	geography	Izimiiri kɛnɩ Turkii ɛjaɖɛ taa tɛtʋ sɔsɔtʋ tozo ñɩndʋ, tɩ-taa ɛyaa kpɛndɩ miiliyɔɔwaa 3 nɛ kudokiŋ 700. Isitambuuli wayɩ lɛ, peeɖe mɛlɛnaa ɖɩzɩŋɩyɛ naalɛ ñɩnɖɛ wɛɛ, nɛ nʋmɔʋ wobu ɖɔŋ camɩyɛ siŋŋ peeɖe.
