index_id	category	text
811	sports	L'excursionisme és una activitat a l'aire lliure que consisteix a caminar en entorns naturals, sovint per rutes de senderisme.
285	politics	Tant Letònia com Eslovàquia han ajornat el procés d'incorporació a l'ACTA.
1342	science/technology	El suc de col llombarda canvia de color segons com d'àcida o bàsica (alcalina) sigui una substància.
1800	travel	La fricció és baixa a les carreteres gelades i nevades, i no hi pots conduir com si estiguessis sobre l'asfalt nu.
1297	politics	La comissió fou la resposta de Martelly a les protestes generalitzades contra el règim que s'iniciaren el mes d'octubre.
1048	politics	Adverteix que no hi ha ningú que pugui garantir que cap acció a l'Iraq en aquest moment aconsegueixi aturar la guerra sectària, la violència creixent o una deriva caòtica.
547	politics	La força d'assalt principal, de 2.400 homes, havia de creuar el riu nou milles al nord de Trenton, i després dividir-se en dos grups, un sota Greene i un sota Sullivan, amb l'objectiu de llençar un atac abans de l'alba.
1127	health	Fluke escrigué que els esforços d'alguns per a dissuadir les dones de parlar sobre la salut femenina foren frustrats.
120	entertainment	L'ACMA també va trobar que tot i que el vídeo estava publicat a Internet, Big Brother no havia trencat les lleis de censura del contingut en línia, ja que els mitjans no s'havien guardat al web de Big Brother.
1113	health	Les previsions d'entrega dels vaccins a les zones històricament més afectades enguany s'han endarrerit per manca de fons i poca priorització davant d'altres malalties.
1442	politics	Com que hi havia una resposta limitada a aquesta tàctica, Alemanya s'esperava una resposta similar a la seva guerra submarina sense restriccions.
830	travel	A alguns trens que travessen fronteres es realitzen inspeccions mentre el tren està en marxa i heu de tenir un document d'identitat vàlid quan embarqueu a un d'aquests.
1824	travel	Els viatgers lligats a països amb forta taxació de vegades poden estalviar-se una quantitat de diners considerable, sobretot en productes com ara begudes alcohòliques i tabac.
1533	health	Altres opcions basades en els bioritmes inclouen beure molts líquids (sobretot aigua o te, un conegut diürètic) abans de dormir, de manera que un s'obliga a aixecar-se per orinar.
1982	entertainment	La contemplació de les flors de cirerer, acció coneguda com hanami, forma part de la cultura japonesa del segle VIII ençà.
657	health	Els dies d'estiu extremadament llargs poden comportar problemes per a dormir un temps suficient i problemes de salut associats.
948	travel	Tingues per cert que una vegada entris al port esportiu tot serà molt evident. Coneixeràs altres autoestopistes de vaixell i compartiran la seva informació amb tu.
1892	travel	Quan tornes a casa després d'haver viscut a l'estranger, ja t'has adaptat a una nova cultura i perdut alguns dels hàbits de la cultura natal.
1707	travel	Casablanca és un dels llocs menys interessants per a fer compres al Marroc.
1729	geography	Els Sundarbans són el cinturó de manglar litoral més gran del món, s'estenen 80 km (50 mi) cap a l'interior de Bangladesh i l'Índia des de la costa.
1574	science/technology	Pràcticament tots els ordinadors que fem servir avui es basen en la manipulació d'informació que es codifica en forma de nombres binaris.
692	travel	Es necessita el pas Angkor per a poder entrar al temple, per això, no us oblideu de portar el passaport quan aneu a Tonlé Sap.
1155	geography	"Totes les entrades a les cavernes, que es designaren ""Les Set Germanes"", tenen un diàmetre d'almenys 100 a 250 metres (328 a 820 peus)."
1810	sports	Tòquio serà la primera ciutat asiàtica que haurà acollit dos Jocs Olímpics d'estiu, per haver acollit els jocs en el 1964.
64	politics	El projecte de llei original va ser redactat per l'exalcaldessa de São Paulo, Marta Suplicy. La proposta de llei, després de ser esmenada, està ara en mans de Roberto Jefferson.
1330	politics	"Va titllar els rumors de ""xerrameca política i bajanades""."
1448	politics	També entre cada dinastia hi havia un període inestable de províncies dividides. El més conegut d'aquests períodes va ser l'època dels 3 Regnes que va tenir lloc durant 60 anys entre les dinasties Han i Jin.
636	science/technology	L'any 1970 Raymond Damadian, un metge i assistent de recerca, va descobrir les bases per a usar l'escaneig de ressonància magnètica com a eina per a la diagnosi mèdica.
1677	science/technology	En són exemples el control, la planificació i la programació, la capacitat de respondre als diagnòstics i preguntes del client així com el reconeixement de l'escriptura, la veu i el rostre.
1398	entertainment	Si has vist la pel·lícula National Treasure, potser t'imagines que al darrere de la Declaració d'independència hi han escrit un mapa del tresor.
1605	travel	En aquest dinàmic vehicle tothom, d'alguna manera, està connectat amb, i dóna suport a, un sistema de transport basat en cotxes privats.
982	travel	Encara que condueixis a través de la selva subtropical, amb uns pocs segons amb les portes obertes mentre entres al vehicle n'hi ha prou perquè els mosquits hi entrin amb tu.
366	science/technology	El principal òrgan del sistema circulatori és el cor, que s'encarrega de bombar la sang.
1651	science/technology	Les teories de contingut se centren a trobar què agrada o interessa a la gent.
941	science/technology	Una vegada que t'hagis familiaritzat amb el format i l'edició del lloc web, aleshores podràs crear el teu propi lloc.
876	health	Per a aquells poc familiars amb l'argot mèdic, les paraules infecciós i contagiós tenen significats diferents.
661	entertainment	La seva freqüent representació en la música, les pel·lícules, la literatura i la cultura popular han ajudat a fer que la ciutat i els seus punts de referència siguin reconeguts arreu del món.
1112	health	El govern també ha promès molts milions de vials de vaccí per l'encefalitis. Aquests vials ajudaran les agències sanitàries a preparar-se per l'any que ve.
1329	politics	Cuomo, de 53 anys, va començar el seu govern a inicis d'enguany i signà una llei el mes passat per a legalitzar el matrimoni de parelles del mateix sexe.
1053	politics	La Sra. Kirchner va anunciar la seva intenció de presentar-se a la presidència al Teatre de l'Argentina, el mateix lloc on va engegar la campanya al Senat de 2005 com a membre de la delegació provincial de Buenos Aires.
1948	travel	Si us plau, recordeu que bàsicament esteu visitant un cementiri de massa i un lloc amb un significat gairebé incalculable per a una part significativa de la població mundial.
923	science/technology	Se sol accedir a quests serveis a través d'un número de telèfon gratuït que es pot trucar des de la majoria de telèfons sense haver de pagar.
173	science/technology	Es va trobar el derelicte després de cartografiar el fons marí usant un ROV.
1087	science/technology	Així com la lluna exerceix una atracció sobre la terra, que provoca les marees, la Via Làctia exerceix una atracció sobre la galàxia de Sagitari.
1328	science/technology	Els científics esperen entendre com es formen els planetes, sobretot com es va formar la Terra, d'ençà que uns cometes van col·lidir amb la Terra fa molt temps.
914	science/technology	Les aplicacions de traducció de text a temps real - aplicacions que poden traduir automàticament fragments de text sencers d'una llengua a una altra.
1341	science/technology	D'això se'n diu el pH d'una substància. Podeu fer-vos un indicador usant suc de col llombarda.
336	entertainment	"Com a final de l'espectacle, la companyia de dansa turca Fire of Anatolia va mostrar al públic la seva funció ""Troy""."
1005	entertainment	Cap a finals de 2017, Siminoff va aparèixer en la cadena de televisió de compres QVC.
1671	science/technology	La correlació entre les patologies cerebrals i el comportament avala les investigacions dels científics.
1597	science/technology	Hershey i Chase van fer servir fags, o virus, per a implantar el seu propi ADN en un bacteri.
1008	health	Un còctel d'anticossos anomenat ZMapp al principi semblava prometedor, però estudis formals van indicar que tenia menys beneficis dels desitjats per a prevenir la mort.
1313	health	Mentre treballava a l'hospital, Liggins va començar a investigar el part prematur durant el seu temps lliure.
665	travel	"La visita ""típica"" consisteix a volar a l'aeroport internacional d'Orlando, viatjar amb autocar a un hotel de Disney, passar una setmana sense sortir de les instal·lacions de Disney i tornar cap a casa."
242	geography	A més de portar tres instruments científics importants, la sonda lunar també duia la imatge de la bandera nacional índia pintada per tots els costats.
383	politics	Aquesta flota la dirigia Olaf Trygvasson, un noruec que ambicionava recuperar el seu país de la dominació danesa.
954	travel	Turkish Airlines vola a 39 destinacions a 30 països africans des del 2014.
979	travel	Això pot ser perillós si el viatjer persegueix el miratge, desaprofitant la preciosa energia i l'aigua restant.
217	sports	El vot s'ha de ratificar pel COI al complet a la seva reunió d'octubre a Copenhagen.
1036	travel	Durant el seu viatge, Iwasaki va ficar-se en un embolic en diverses ocasions.
1583	health	L'EM és una malaltia que afecta el sistema nerviós central, format pel cervell, la medul·la espinal i el nervi òptic.
1063	sports	Els batedors de mitjana categoria, Sachin Tendulkar i Rahul Dravid, van jugar bé i establiren una col·laboració de cent carreres.
458	science/technology	Això dificulta l'ús d'objectius de zoom econòmics en condicions de poca llum sense un flaix.
831	travel	El conductor pot recollir els passaports als trens nocturns per no haver d'interrompre el son.
220	sports	Malgrat els seus comentaris, donarà suport als rivals britànics a les Olimpíades del 2012 que tindran lloc a Londres.
1119	health	Després de l'accident, Gibson va ser transportat a un hospital, però va morir poc temps després.
1650	geography	Pot ser que hi hagi més mars lunars a la cara visible perquè l'escorça és més prima. Era més fàcil que la lava sortís a la superfície.
813	sports	Per a una excursió d'un dia per un camí senzill cal poca preparació, i qualsevol persona moderadament en forma s'hi pot unir.
1353	science/technology	Cal un coet gegant més alt de 100 peus d'alçada per a col·locar un satèl·lit o telescopi a l'espai.
925	science/technology	Si el simple fet de fer una foto d'alguna cosa està prohibit, cal treure's del cap la idea de fer-ne un vídeo.
1164	science/technology	L'ordinador ASUS Eee, llançat abans a escala mundial pels seus factors d'estalvi i funcionalitat, va esdevenir un tema d'interès al Mes de la Tecnologia de Taiwan de 2007.
273	health	Preocupa que els pacients puguin seguir infectant altres persones amb la seva vida diària si els símptomes de la grip es mantenen lleus.
947	geography	El llac Onega també està connectat amb el Volga, de manera que encara es pot arribar al mar Caspi a través de Rússia.
1191	politics	Bachmann, que va guanyar l'Ames Straw Poll a l'agost, ha decidit donar per acabada la seva campanya.
1070	politics	La intervenció del govern federal, fent-se càrrec del finançament de l'hospital Mersey a Devonport, Tasmània, ha comportat crítiques per part del govern estatal i d'alguns diputats federals que consideren aquesta acció un acte propaganda encoberta per la precampanya de les eleccions federals que se celebraran aquest novembre.
497	health	Van esdevenir hàbils en l'amputació per a salvar pacients de la gangrena i en els torniquets i en l'hemostàsia per a tallar el flux sanguini.
1914	travel	"Finlàndia és una important destinació de navegació. La ""terra dels mil llacs"" té també milers d'illes, dins els llacs i en els arxipèlags costaners."
360	science/technology	La imatge següent mostra els àtoms emetent fotons. Per suposat, els fotons són en realitat molt més petits que els que mostra la figura.
1549	politics	Contemporàniament, la marina alemanya, usant sobretot submarins, intentava aturar aquest tràfic.
186	travel	El bus es dirigia a Six Flags St. Louis a Missouri perquè a la banda toqués davant d'una multitud amb entrades esgotades.
598	science/technology	Robert Hooke, un biòleg d'Anglaterra, va observar petits quadrats de suro amb un microscopi.
163	travel	El vaixell, un buc antimines de classe Avenger, es dirigia a Puerto Princesa, a Palawan.
537	travel	Quan l'objectiu de la visita a un lloc en concret és conèixer la seva història i cultura estem parlant de turisme cultural.
365	science/technology	El motiu n'és que l'electricitat que circula per l'endoll on hi ha la part metàl·lica de la bombeta us pot electrocutar greument si toqueu l'interior de l'interruptor o la base metàl·lica de la bombeta mentre encara es troba parcialment dins l'endoll.
918	science/technology	Utilitzar aplicacions de navegació GPS al teu telèfon intel·ligent pot ser la manera més fàcil i còmoda de navegar fora del teu país d'origen.
944	travel	També pot ser una bona manera d'allargar un pressupost per poder allargar l'estada a algun lloc, ja que molts treballs voluntaris s'ofereixen amb pensió completa i en alguns es paga un petit sou.
1856	travel	Mentre us mantingueu a aquesta zona, generalment podeu travessar fronteres sense haver de tornar a passar el control de passaports.
10	politics	Cap a les 11:29, la protesta va pujar cap a Whithall, travessar Trafalgar Square, més enllà del carrer Strand, passant per Aldwych i Kingsway en direcció a Holborn, on el Partit Conservador realitzava el seu Fòrum de Primavera a l'hotel Grand Connaught Rooms.
893	geography	No són molt àgils, per la qual cosa el camí ha de fer un llarg recorregut al voltant de les Muntanyes Transantàrtiques per arribar a l'altiplà.
282	politics	També hi va haver protestes a París, Sofia a Bulgària, Vílnius a Lituània, La Valetta a Malta, Tallin a Estònia i Edimburg i Glasgow a Escòcia.
1362	science/technology	Les bandades de lleons es comporten en gran mesura com les gossades o les bandades de llops, que són animals amb un comportament sorprenentment semblant al dels lleons (tot i que no al d'altres grans fèlids) i igualment mortals per a la seva presa.
530	sports	El golf és un joc en què els jugadors utilitzen pals per colpejar pilotes i mirar de ficar-les en un forat.
730	travel	Aquesta comunitat autèntica es troba a Howe Sound, al costat de Vancouver, i s'hi pot accedir fàcilment mitjançant taxis aquàtics programats que surten de l'illa de Granville, al centre de Vancouver.
840	entertainment	Tanmateix, gairebé tots els casinos esmentats més amunt serveixen begudes, i molts d'ells ofereixen entreteniment de primera classe (sobretot els més grans, als voltants d'Albuquerque i de Santa Fe).
698	travel	L'Equador requereix que els ciutadans cubans hagin rebut una carta d'invitació abans d'entrar a l'Equador a través d'aeroports internacionals o punts d'admissió fronterers.
1826	travel	Si no esteu acostumats a conduir per carreteres rurals, aneu amb compte: hi predominen els pendents pronunciats, els trams estrets i les corbes tancades.
339	health	Va ser atès immediatament per l'equip mèdic del circuit i se'l va traslladar a un hospital local, on va morir més tard.
226	science/technology	Només se sap de la seva existència pels seus efectes en l'expansió de l'univers.
24	sports	Va fer 2 gols i 2 assistències en la victòria 5 a 3 de Washington contra els Atlanta Thrashers.
1117	entertainment	"El seu segell número 1.000 va ser el magnífic ""Great Deeds by Swedish Kings"" de David Klöcker Ehrenstrahl el 2000, que figura al Llibre Guinness de Rècords Mundials."
1792	entertainment	Cal recordar que encara que s'hagi acabat la música als escenaris principals hi poden haver seccions del festival que segueixin tocant fins ben entrada la nit.
674	travel	Entrar a l'Àfrica del Sud en cotxe és una forma impressionant de veure tota la bellesa de la regió i d'arribar a llocs fora de les rutes turístiques més habituals.
1098	health	Ara bé, el percentatge de XDR-TB en tot el grup de gent amb tuberculosi encara sembla ser baix; 6.000 persones d'un total de 330.000 infectats en un moment donat a Sud-àfrica.
892	travel	És neu compactada amb fissures emplenades i senyalades amb banderes. Només es pot travessar en tractors especialitzats, que arrosseguen trineus amb combustible i subministraments.
380	science/technology	Uns anys més tard, el 1639, un astrònom anglès anomenat Jeremiah Horrocks va observar un trànsit de Venus.
921	science/technology	Totes les botigues de queviures tenen una confusa multitud de targetes de telèfon prepagades que es poden usar tant per telèfons de pagament com per telèfons normals.
65	politics	Els manifestants esperen recollir una petició d'1,2 milions de firmes per presentar-la al Congrés Nacional el novembre.
912	science/technology	Tampoc no necessiteu un número local de la comunitat on viviu; podeu aconseguir una connexió a Internet per satèl·lit a les regions més desolades de Chicken, Alaska i seleccionar un número que afirmi que sou sota el sol d'Arizona.
987	geography	"Aquests altiplans es denominen sovint ""vidde"", que vol dir espai amb amplitud, obert i que no té arbres, és a dir, una extensió il·limitada."
819	travel	"Quan viatges, no t'esperis que les coses siguin ""com a casa"". Els modes, les lleis, el menjar, el trànsit, l'allotjament, els estàndards, la llengua i altres seran, fins a cert punt, diferents del lloc on viu."
798	travel	També lliura còpies de la pòlissa / contacte als companys de viatge i als parents o amics que estiguin disposats a ajudar.
1035	science/technology	Com més petit sigui el nombre de Rossby, menys activa serà l'estrella respecte a les inversions magnètiques.
1228	entertainment	Cantants famosos d'arreu del país oferiren bhajans, o cançons devotes, als peus de Shri Shyam.
1039	science/technology	Això garanteix la retrocompatibilitat amb 802.11a, 802.11b i 802.11g, sempre que l'estació base tingui ràdios duals.
1375	science/technology	Les plantes fabriquen l'oxigen que els humans respirem i prenen el diòxid de carboni que els humans exhalem (és a dir, que expirem).
772	entertainment	Una Fira Mundial (sovint anomenada Exposició Mundial, o simplement Expo) és un gran festival internacional d'arts i ciències.
735	travel	Sirena és l'única estació de guardaboscos que ofereix allotjament a dormitoris i àpats a més a més del càmping. La Leona, San Pedrillo, i Los Patos només ofereixen càmping, sense servei de menjar.
1350	science/technology	Quan truques a algú que es troba a milers de quilòmetres de distància, estàs utilitzant un satèl·lit.
1419	geography	"A causa del grup d'illes que té el Japó, sovint l'anomenem, en termes geogràfics, un ""arxipèlag"""
1601	travel	El turisme basat en la natura atrau a les persones interessades en visitar les zones naturals amb el fi de gaudir del paisatge, incloent la vida silvestre de plantes i animals.
1812	sports	Les polítiques de cancel·lació varien, però des de finals de març la majoria de polítiques de cancel·lació degudes al coronavirus no s'estenen a juliol del 2020, quan s'havien de celebrar els Jocs Olímpics.
270	sports	D'aleshores ençà, el brasiler ha jugat 53 partits amb el club en totes les competicions i ha marcat 24 gols.
1920	travel	Això vol dir que és possible visitar el centre històric de la ciutat fent servir un parell de dies sencers tornant a dormir al vaixell de nit.
1431	science/technology	Molts formats comuns (la família APS de formats, per exemple) són iguals o s'acosten molt a aquesta relació d'aspecte.
832	travel	Registrar-se és un requisit addicional per al procés del visat. En certs països, cal que registreu la vostra presència i l'adreça on us allotgeu amb les autoritats locals.
1769	politics	Durant la lluita per la independència organitzada pel moviment Mau, una reunió pacífica en la ciutat va resultar en la mort del líder suprem Tupua Tamasese Lealofi III.
130	politics	El comunicat d'avui amplia, a més, el compromís que el govern va assumir el mes de març d'enguany per finançar vagons addicionals.
955	travel	Si et sobra temps per viatjar, calcula quant et costa en total el desplaçament a Àfrica en comparació amb una volta al món.
47	sports	Jonny Reid, copilot de l'equip A1GP New Zealand, ha fet història avui en ser el més ràpid legalment sobre el Pont del Port d'Auckland, que té 48 anys.
1038	science/technology	L'estàndard 802.11n funciona tant en freqüències de 2.4 Ghz com de 5.0 Ghz.
1268	health	L'arma d'Uka va fallar mentre apuntava cap al cap del cinquè home. Schneider contínuament pateix, té ceguera a un ull, una part que del crani que li falta i una cara reconstruïda de titani.
1418	geography	El Japó compta amb gairebé 7.000 illes (Honshu n'és la més gran), cosa que converteix aquest país en la 7a illa més gran del món.
1899	entertainment	Les escenes de la història es mostren sobre les piràmides, que s'il·luminen alhora.
272	health	Alguns estudis senyalen que la malaltia ha d'esdevenir menys letal abans de poder provocar una epidèmia global, va fer notar.
943	travel	Viure i fer voluntariat a un país estranger és una molt bona forma de conèixer una cultura diferent, conèixer gent nova, aprendre sobre un mateix, aconseguir un sentit de la perspectiva i fins i tot obtenir noves habilitats.
1201	health	A qui s'està culpant de propagar la malaltia que es va iniciar a prop del campament de la tropa és a les forces de pau de les Nacions Unides, que van arribar a Haití després del terratrèmol del 2010.
267	science/technology	El cas fou processat a Virgínia perquè és la seu del proveïdor d'Internet capdavanter AOL, l'empresa que va iniciar els càrrecs.
1708	travel	Als voltants de l'antiga Medina podem trobar fàcilment llocs de venda de productes marroquins tradicionals, com ara tajins, terrissa, objectes de pell, narguils, i un ampli ventall de souvenirs, però és tot pensat per als turistes.
928	travel	Avui en dia, és molt poc habitual fer reserves de vols directament amb l'aerolínia, sense cercar i comparar preus abans.
1391	geography	En el clima càlid de l'Orient mitjà, l'habitatge no era tan important.
1229	entertainment	El cantant Sanju Sharma va encetar el vespre, seguit per Jai Shankar Choudhary. També va presentar el bhajan chhappan bhog. El cantant, Raju Khandelwal, l'acompanyava.
586	science/technology	Aquests telescopis feien servir una combinació de dues lents per a fer que els objectes llunyans apareguessin més a prop i més grans.
1695	geography	Madagascar és la més gran amb diferència, i un continent en si mateixa quant a la vida salvatge.
802	health	Els possibles efectes sobre la salut de beure en excés, a llarg termini, poden incloure danys hepàtics i fins i tot la ceguera i la mort. El perill potencial augmenta quan es consumeix alcohol produït il·legalment.
1881	politics	La disponibilitat dels governs a emetre passaports on no s'especifica el sexe (X) o documents actualitzats per a mostrar el nom o sexe desitjats és variable.
1379	science/technology	Les seves llargues mandíbules tenien més de setanta dents esmolades com ganivets, acompanyades d'un joc addicional al cel de la boca, de manera que no hi havia via de fugida per a res que s'interposés en el seu camí.
1550	politics	Si els aliats haguessin fracassat, és probable que Alemanya hagués pogut conquerir la Gran Bretanya, tal com ho va fer amb la resta d'Europa.
333	entertainment	A continuació van actuar l'Orquestra Simfònica Estatal d'Istanbul, una banda de geníssers, i els cantants Fatih Erkoç i Müslüm Gürses.
719	geography	La República Dominicana (en espanyol: República Dominicana) és un país caribeny que ocupa la meitat oriental de l'illa de la Hispaniola, que comparteix amb Haití.
1780	travel	Durant tot l'any es fan molts viatges a l'escull i són rares les lesions degudes a qualsevol d'aquestes causes.
1841	travel	Si un genet es llança del cavall però té un peu enganxat a l'estrep, podria ser arrossegat si el cavall fuig corrent. Per tal de minimitzar aquest risc es poden prendre diverses precaucions de seguretat.
471	politics	El concepte era que totes les nacions europees havien de mirar d'evitar que una sola nació esdevingués massa poderosa, i per a això era freqüent que els governs dels diferents països canviessin les seves aliances a fi de mantenir l'equilibri.
1634	science/technology	S'assemblava més als quatre estats de la matèria (en el mateix ordre): sòlid, líquid, gas i plasma, tot i què a més, segons la seva teoria, canviaven per convertir-se en substàncies noves que formen allò que veiem.
1255	science/technology	Els investigadors van observar la formació de cristalls en l'orina dels gats mitjançant l'addició de melamina i àcid cianúric.
845	entertainment	"Tanmateix, avui en dia hi ha artistes de renom, esdeveniments relacionats amb el grafit i murs ""legals"". Les obres de grafit en aquest context sovint tenen més d'obres d'art que de gargots il·legibles."
1776	entertainment	S'hi poden prendre molts vins francesos, però els vins de Nova Zelanda i Austràlia no acaben de tolerar bé els viatges.
1845	travel	Hi ha unes vistes impressionants des dels pics. Escaladors de totes parts del món estableixen contínuament noves rutes entre la seva inacabable extensió de parets.
1151	sports	Tenien un aspecte clarament rovellat al partit contra les seves germanes del sud, Sud-àfrica, així i tot, van anar millorant progressivament a mesura que va avançar el partit.
