index_id	category	text
738	travel	Cafenet El Sol ofereix un servei de reserves per 30 dòlars dels EUA o 10 dòlars pels abonaments d'un dia. Per a més informació, visiteu la seva pàgina de Corcovado.
1298	politics	Les protestes, de vegades violentes, es van desencadenar per la manca de celebració d'eleccions, algunes d'elles previstes pel 2011.
577	science/technology	La cèl·lula és la unitat bàsica de totes les coses vives i tots els organismes es componen d'una o més cèl·lules.
733	sports	A l'hivern gaudiu del millor esquí a Nord-amèrica, i a l'estiu proveu una mica d'autèntic ciclisme de muntanya.
1624	geography	El 20 per cent de l'aigua que surt dels rius del planeta cap als oceans prové de l'Amazònia.
185	sports	Estava allotjat a l'hotel de l'equip abans d'un partit programat el diumenge contra el Bolonya.
1158	geography	El seu comportament tèrmic no és estable com les grans coves a la Terra, que sovint tenen una temperatura força constant, però és coherent amb la hipòtesi que siguin profunds clots al terra, va dir Glen Cushing de l'equip d'astrogeologia United States Geological Survey (USGS) i de la Northern Arizona University ubicada a Flagstaff, a Arizona.
190	travel	Es va donar aigua als passatgers mentre esperaven a una temperatura de 90 graus (F).
1233	entertainment	En la presentació principal de dijous del Tokyo Game Show, el president de Nintendo Satoru Iwata va revelar el disseny del comandament de la Nintendo Revolution, la nova consola de la companyia.
1548	politics	Un dels exemples recents més rellevants va ser la campanya nord-atlàntica de la Segona Guerra Mundial. Els estatunidencs intentaven desplaçar homes i materials a través de l'Oceà Atlàntic per ajudar la Gran Bretanya.
647	entertainment	Molts de nosaltres ens trobem mirant un programa de televisió que ens informa sobre un procés o experiència en què mai no participarem ni n'aplicarem els coneixements.
1522	science/technology	En el segle XX, la investigació ha demostrat que hi ha dos conjunts de variació genètica: amagada i exposada.
601	science/technology	El nitrogen en estat gasós segueix tenint les mateixes propietats que el nitrogen líquid. L'estat líquid és més dens, però les molècules segueixen sent les mateixes.
1747	sports	L'Argentina és famosa per comptar amb un dels millors equips i jugadors de polo de tot el món.
142	sports	La decisió de l'NBA arriba després que un jugador de l'Utah Jazz hagi resultat positiu en una prova pel virus de la COVID-19.
1802	travel	La visibilitat també es pot veure reduïda per la neu que cau o que és desplaçada pel vent, o per la condensació o el glaç sobre les finestretes del vehicle.
825	travel	Si vols veure món amb pocs diners, ja sigui per necessitat, estil de vida o repte, hi ha diverses maneres de fer-ho.
1144	politics	Les tropes de la coalició i les tropes afganes s'han desplaçat a la zona per a assegurar el lloc i altres avions de la coalició s'hi han desplaçat per a oferir assistència.
1850	sports	Viatjant amb motxilla en esquís: aquesta activitat també s'anomena esquí rural, turisme d'esquí o excursionisme d'esquí.
1033	science/technology	Han descobert que el Sol funcionava sota els mateixos principis bàsics que altres estrelles: s'ha vist que l'activitat de totes les estrelles del sistema depèn de llur brillantor, llur rotació i res més.
1848	sports	El concepte de l'esquí és molt antic  hi ha pintures rupestres simbolitzant esquiadors d'abans del 5000 aC!
228	geography	S'han trobat aquests salts de falla arreu de la lluna i semblen haver estat mínimament modificats per la climatologia, la qual cosa indica que els esdeveniments geològics que els van crear han estat força recents.
292	geography	S'ha informat de l'existència de núvols foscos a la base de la muntanya sense relació amb cap activitat volcànica.
1225	sports	Del Potro tenia l'avantatge en el segon set, però també aquí ha calgut un desempat després d'assolir el 6-6.
1416	sports	Els esports més coneguts són el futbol, el bàsquet, el voleibol, el waterpolo, l'esgrima, el rugbi, el ciclisme, l'hoquei sobre gel, l'hoquei sobre patins i l'automobilisme d'F1.
129	entertainment	La ciutat serà la primera en l'Europa sud-oriental a acollir CowParade, l'esdeveniment d'art públic més important al món entre juny i agost d'enguany.
1003	science/technology	Va dir que havia construït un timbre Wi-Fi.
271	health	El Dr. Lee també ha mostrat la seva preocupació sobre els informes on alguns infants a Turquia han resultat infectats amb la grip aviària A(H5N1) sense emmalaltir-se.
103	politics	Les declaracions, en directe per televisió, constitueixen la primera vegada que fonts iranianes admeten que les sancions estan tenint efecte.
14	sports	"Després del partit, el rei de la terra batuda va dir, ""estic simplement emocionat d'haver tornat a les rondes finals dels esdevniments més importants. Sóc aquí per a intentar guanyar""."
1412	politics	El Congrés no tenia poder per a imposar impostos, i, com que no n'hi havia cap d'executiu o de judicial nacional, va recaure sobre les autoritats de l'estat, que sovint eren poc cooperatives, per a fer complir tots els seus actes.
1811	travel	Si vas fer la reserva dels vols i l'allotjament per a l'any 2020 abans que s'anunciés l'ajornament, podries trobar-te en una situació delicada.
1681	science/technology	La tecnologia ofereix la solució amb viatges de camp virtuals. Els estudiants poden veure artefactes de museus, visitar un aquari o contemplar la bellesa de l'art mentre estan asseguts amb la seva classe.
335	entertainment	La diva turca Sezen Aksu va actuar amb el tenor italià Alessandro Safina i el cantant grec Haris Alexiou.
378	science/technology	Uns tres mil anys després, el 1610 l'astrònom italià Galileo Galilei va utilizar un telescopi per descobrir que Venus té fases, igual que la lluna.
1367	science/technology	Els científics creuen que els ocelots segueixen i troben els animals que es mengen (preses) amb l'olfacte, ensumant els rastres que deixen pel terra.
703	travel	Les visites són més econòmiques per a grups més grans, així que si us trobeu sol o només amb un amic, mireu d'ajuntar-vos amb altra gent i formar un grup de quatre a sis per a un preu per persona millor.
297	politics	L'esmena proposada ja estava aprovada per les dues cambres el 2011.
80	sports	Va ser durant la Final Preliminar quan Maroochydore va guanyar a Caboolture.
1823	travel	Les compres duty free són una oportunitat per a comprar béns exempts de taxes i impostos en certs llocs.
836	travel	L'arquitectura s'ocupa del disseny i la construcció d'edificis. L'arquitectura d'un indret sol ser un atractiu turístic per ella mateixa.
880	travel	Sovint aquests requisits depenen dels països que el viatger ha visitat precedentment o pretengui visitar.
1143	politics	El partit governant, l'Organització Popular d'Àfrica Sudoccidental (SWAPO), també va retenir la majoria a les eleccions parlamentàries.
650	science/technology	El vostre hotel o amfitrió (si us quedeu a una pensió o a una casa privada) probablement tindrà wifi o un ordinador connectat a Internet, i tots els assentaments tindran un cibercafè o alguna localització amb wifi públic.
702	travel	El passaport ha de ser vàlid durant com a mínim 6 mesos després de les dates del viatge. Es requereix un tiquet de viatge tancat/d'anada i tornada per demostrar la durada de l'estada.
1604	travel	Cada matí, la gent surt en cotxe dels petits pobles rurals per a anar al seu lloc de treball i passen al costat d'altres el lloc de treball dels quals és el lloc que acaben de deixar.
817	sports	Amb arrels al Running Tours Barcelona de Barcelona i al Running Copenhagen de Copenhagen, s'hi uniren ràpidament el Running Tours Prague amb base a Praga i d'altres.
1763	travel	Cada any, dotzenes de visitants resulten ferits per no haver deixat una distància suficient. Aquests animals són grans, salvatges i potencialment perillosos, així que dona'ls el seu espai.
1290	politics	Israel exigeix una presència militar ininterrompuda a la vall durant deu anys un cop s'hagi signat un acord, mentre que l'AP només es compromet a acceptar-la durant cinc anys.
1775	entertainment	"La cervesa local més coneguda és la ""Number One""; no es tracta d'una cervesa complexa, però és agradable i refrescant. L'altra cervesa local es diu ""Manta""."
642	science/technology	L'ús d'internet i del World Wide Web permet als estudiants de tenir accés a la informació tothora.
1544	politics	El 17 de setembre de 1939 les defenses poloneses ja havien estat penetrades i l'única esperança era retirar-se i reorganitzar-se al cap de pont romanès.
1148	health	"El portaveu de Metges Sense Fronteres Richard Veerman va dir: ""Angola es dirigeix cap al seu pitjor brot de tots els temps i la situació es manté molt negativa""."
801	health	Beveu begudes alcohòliques amb moderació. L'alcohol afecta cadascú de manera diferent, i és molt important que conegueu el vostre propi límit.
1741	travel	Es preveu que el pont sigui plenament funcional el setembre de 2017, quan s'espera que les duanes del Brasil estiguin enllestides.
1140	entertainment	Tot i que Winfrey es va acomiadar entre llàgrimes, va assegurar als seus fans que tornarà.
1267	health	Edgar Veguilla va ser ferit en un braç i la mandíbula mentre que Kristoffer Schneider va necessitar cirurgia reconstructiva per a la seva cara.
1774	entertainment	Aquestes són a vegades platges familiars plenes amb una bona gamma de botigues al llarg de la costa. Nedar és segur.
862	health	Però en llocs del món, on la fauna bacteriològica és nova per a tu, és molt més probable que tinguis problemes.
1069	politics	"A la reunió amb el primer ministre, Layton ha demanat canvis en el projecte de llei mediambiental dels conservadors, i ha reclamat una ""reformulació profunda i completa"" de la proposta mediambiental del partit conservador."
325	geography	Els científics del Centre Nacional d'Huracans prediuen que Danielle pujarà d'intensitat fins a la categoria d'huracà el dimecres vinent.
1314	health	La seva recerca va mostrar que si s'administrava una hormona, s'acceleraria la maduració pulmonar fetal del nadó.
704	travel	Tanmateix, això no us hauria d'amoïnar gaire, perquè els turistes sovint es combinen per a omplir els cotxes.
528	sports	L'esport modern de l'esgrima es practica a molts nivells, des dels estudiants que l'aprenen a la universitat fins als professionals i els competidors olímpics.
532	sports	Guanya el jugador que necessita menys cops, o swings del club, per a completar el circuit.
1643	science/technology	Hom tan sols es pot preguntar en què es convertirà el teclat quan sorgeixi quelcom més nou.
868	travel	Sobretot els teus primers dies, considera gastar els diners en hotels, menjar i serveis d'estil occidental i de qualitat per a ajudar-te a aclimatar-te.
124	entertainment	Molt abans de The Daily Show i The Colbert Report, Heck i Johnson van visionar una publicació que parodiés les notíciesi reportatges de notíciesquan eren estudiants a la UW l'any1988.
1159	politics	A França, les eleccions han estat, tradicionalment, una experiència no gaire tecnològica: els votants s'aïllen en una cabina i posen dins un sobre un full de paper preimprès amb el candidat que han escollit.
701	travel	Els ciutadans cubans que tenen una tarja verda dels EUA han de visitar el Consolat Equatorià per a obtenir una exempció a aquest requeriment.
560	health	Abans de comprovar l'estat de la víctima, heu d'inspeccionar l'escena a fi de garantir la pròpia seguretat.
167	politics	L'atac va sobrecarregar les relacions entre l'Índia i el Pakistan.
301	politics	Els èxits de Vautier fora de la direcció inclouen una vaga de fam del 1973 contra allò que ell veia com censura política.
40	entertainment	"John Grant, de l'emissora WNED de Buffalo (la ràdio que acollia Reading Rainbow) va dir que ""Reading Rainbow va ensenyar els nens per què calia llegir, ...l'amor per la lectura; [el programa] els animava a agafar un llibre i llegir""."
1414	politics	Els Articles necessitaven l'aprovació unànime de tots els estats abans que es poguessin esmenar i els estats es van prendre tan lleugerament el govern central que els seus representants sovint s'absentaven.
1789	travel	Qualsevol petició o suggeriment s'hauria d'enviar primer a l'agència de viatges i no a l'hotel.
754	travel	Alguns hotels tenen un llegat de l'edat daurada dels trens de vapor i els transatlàntics; abans de la Segona Guerra Mundial, al segle XIX o a principis del segle XX.
1142	politics	Els resultats finals de les eleccions presidencials i parlamentàries de Namíbia han indicat que el president en funcions, Hifikepunye Pohamba, ha estat reelegit amb un marge folgat.
1022	politics	L'anunci es va realitzar després que Trump mantingués una conversa telefònica amb el president turc, Recep Tayyip Erdo?an.
538	travel	Pot ser que els turistes visitin diferents llocs emblemàtics d'un país en particular o que senzillament decideixin concentrar-se en una sola àrea.
155	geography	Quinze d'aquestes roques s'atribueixen a la pluja de meteors del juliol passat.
1278	health	Tot i que hi havia tres persones dins la casa quan es va produir l'impacte del cotxe, ningú no va resultar ferit.
1197	sports	Entre ells hi ha els Països Baixos, amb Anna Jochemsen acabant en novena posició en la categoria de peu femenina a la Super-G ahir, i Finlàndia amb Katja Saarinen acabant desena en la mateixa prova.
1541	politics	Alemanya era l'enemic comú a la Segona Guerra Mundial, la qual cosa va facilitar la col·laboració entre la Unió Soviètica i els Estats Units. Amb l'armistici va arribar la topada de sistemes, processos i cultures, i tots dos països es van enemistar.
1111	health	El brot ha portat el govern indi a emprendre mesures com ara desplegar caçadors de porcs a les zones greument afectades, la distribució de milers de cortines de mosquits i la fumigació de pesticides.
889	geography	L'interior de l'Antàrtida és un altiplà desolat cobert per 2 a 3 km de gel.
324	geography	La tempesta, localitzada aproximadament a 3.000 milles de Miami, Florida, té vents sostinguts màxims de 40 mph (64 km/h).
118	entertainment	El publicador de jocs, Konami, ha declarat avui a un diari japonès que no llançaran el joc Sis Dies a Falluja.
1018	entertainment	Gosling i Stone van rebre nominacions al millor actor i la millor actriu, respectivament.
523	health	Això és tan esgotador com si us haguéssiu de llevar cada vint o trenta minuts a mirar la televisió.
1637	science/technology	Hom també pot tenir aliatges que incloguin petites quantitats d'elements no metàl·lics, com ara el carboni.
749	travel	Pujar al cotxe i encetar un llarg viatge per carretera té un atractiu intrínsec en la seva simplicitat.
1575	science/technology	Un número binari només pot tenir un de dos valors possibles, és a dir, 0 o 1, i aquests números es coneixen com a dígits binaris o bits, segons l'argot informàtic.
524	health	L'efecte depèn de la freqüència amb què el vostre cervell intenta fer somnis lúcids cada nit.
358	science/technology	"Això ho duen a terme emetent una petita partícula de llum que anomenem ""fotó""."
999	health	Comparteix l'escepticisme d'altres experts sobre la possibilitat de curar la diabetis, i assenyala que aquests resultats no tenen rellevància en persones que ja tenen diabetis de tipus 1.
1359	science/technology	Els lleons són els felins més socials i viuen en grans grups anomenats bandades.
311	entertainment	La parella s'havia casat a Texas un any abans i van arribar a Buffalo per celebrar-ho amb amics i parents.
1917	entertainment	La navegació esportiva és un passatemps nacional a Finlàndia, amb una barca per cada 7 o 8 persones.
1771	geography	Les platges de North Shore (al districte de North Harbour) donen a l'oceà Pacífic i s'estenen des de Long Bay, al nord, fins a Devonport, al sud.
361	science/technology	Els fotons són fins i tot més petits que allò que compon els àtoms!
196	health	Segons el ministre de la presidència Rodrigo Arias, Arias ha resultat positiu a un cas lleu del virus.
951	travel	Hauríeu d'escollir amb atenció la vostra companyia de Viatger Freqüent en una aliança.
878	health	Una malaltia contagiosa és una malaltia que es transmet fàcilment quan s'està a prop d'una persona infectada.
214	sports	El golf i el rugbi són a punt de tornar als Jocs Olímpics.
509	health	"No es tracta d'una dificultat d'aprenentatge, sinó d'un trastorn de l'aprenentatge; ""afecta entre un tres i un cinc per cent de tots els nens, potser fins a 2 milions d'infants dels Estats Units""."
332	entertainment	Les celebracions s'iniciaren amb un programa especial pel grup de fama mundial Cirque du Soleil.
835	travel	En altres casos, només s'han de registrar els qui no es queden en allotjaments turístics. Ara bé, això fa que la llei sigui molt més obscura, així que cal esbrinar-ho amb antelació.
298	politics	En aquesta sessió legislativa es va produir un canvi quan es va eliminar la segona frase primer per la Cambra de Representants i després es va aprovar de manera similar per part del Senat dilluns.
392	politics	Acabada la batalla de França, Alemanya va començar a preparar-se per a envair l'illa de Bretanya.
1211	entertainment	L'any 1989 va contribuir a crear Els Simpson juntament amb Brooks i Groening i va ser el responsable de contractar el primer equip de guionistes del programa.
204	travel	El Twin Otter havia intentat d'aterrar a Kokoda ahir com a vol Airlines PNG CG 4684, però ja havia hagut d'avortar un cop.
916	science/technology	Els motors de traducció han millorat dràsticament, i en l'actualitat solen oferir traduccions més o menys correctes (i cada vegada menys galimaties), però sempre cal parar-hi atenció, perquè encara es poden equivocar.
535	entertainment	És aleshores quan la gent va a un lloc molt diferent del seu dia a dia per relaxar-se i divertir-se.
658	health	En l'estiu, aneu amb compte també amb els mosquits nòrdics. Tot i que no transmeten cap malaltia, poden ser irritants.
353	science/technology	Les molècules d'aigua formen una pell invisible sobre la superfície de l'aigua que permet que coses com l'agulla surin sobre l'aigua.
1520	health	Oliver Sacks, en el seu article El Discurs del Rei, indicava com les persones que no són capaces d'entendre el discurs per culpa de danys cerebrals però així i tot són capaces d'avaluar la sinceritat de forma precisa.
1331	politics	S'especula que es presenti a les eleccions presidencials del 2016.
295	health	Uns helicòpters van rescatar els dotze membres de la tripulació i l'única lesió ha sigut un nas trencat.
569	science/technology	Una població és el conjunt d'organismes d'una espècie concreta en una àrea geogràfica determinada.
926	science/technology	A l'hora d'utilitzar un dron, verifica amb prou de marge que estàs autoritzat per enregistrar i quins permisos o llicències addicionals et calen.
854	travel	MetroPlus és més còmode i està menys concorregut, però és una mica més car, encara que segueix sent més barat que els bitllets de metro normals a Europa.
225	science/technology	L'energia fosca és una força completament invisible que actua de manera constant sobre l'univers.
1598	science/technology	Van fer dos experiments marcant l'ADN del virus amb fòsfor radioactiu o la proteïna del virus amb sofre radioactiu.
771	entertainment	És molt interessant veure els festivals del temple de Kerala; hi ha processons periòdiques d'elefants endomassats, una orquestra del temple i altres festivitats.
856	travel	Portar coses d'altri - Mai no perdis de vista les teves bosses, sobretot quan travessis fronteres internacionals.
23	sports	El jugador del dia d'avui és Alex Ovechkin, dels Washington Capitals.
432	politics	Luxemburg té molta història, però no es va independitzar fins al 1839.
1804	travel	Probablement els safaris siguin el principal atractiu turístic d'Àfrica i el més rellevant per a molts turistes.
533	sports	A aquest joc s'hi juga sobre gespa i la gespa al voltant del forat se sega més curta i s'anomena green.
434	politics	Luxemburg sempre ha intentat mantenir-se com un país neutral, però va ser ocupat per Alemanya tant a la Primera Guerra Mundial com a la Segona Guerra Mundial.
128	entertainment	L'esdeveniment artístic també forma part d'una campanya de l'Ajuntament de Bucarest que pretén rellançar la imatge de la capital romanesa com a metròpoli creativa i plena de color.
810	sports	El barranquisme combina elements de la natació, l'escalada i el salt, però requereix relativament poc entrenament o forma física per a començar (en comparació amb l'escalada de muntanya, el submarinisme o l'esquí alpí, per exemple).
1327	science/technology	Els cometes podrien haver estat una font d'aigua enviada a la terra juntament amb matèria orgànica que pot formar proteïnes i mantenir la vida.
638	science/technology	"L'any 1977, el Dr. Damadian va completar la construcció del primer escàner d'imatges per resonància magnètica ""de cos sencer"", que va batejar com a l'Indomable."
269	sports	L'any passat, el gener de 2017, el Manchester City va comprar Jesus, de 21 anys, al club brasiler Palmeiras per un import de 27 milions de lliures esterlines.
1364	science/technology	El tigre és del mateix grup (gènere pantera) dels lleons, lleopards i jaguars. Aquests quatre fèlids són els únics que poden rugir.
989	geography	Les glaceres no són estables, sinó que flueixen per la muntanya. Això provocarà esquerdes, escletxes, que poden quedar ocultes amb ponts de neu.
864	health	"D'aquí venen diarrees del viatger com ""l'estómac de Delhi"", ""la maledicció del faraó"", la ""venjança de Moctezuma"" i moltes altres variants."
595	science/technology	Una cèl·lula és la unitat estructural i funcional més petita d'un organisme (cosa) vivent.
571	science/technology	Els individus que mostren diferents variants d'un tret particular són polimòrfics.
924	science/technology	Les normes sobre la fotografia normal també s'apliquen a l'enregistrament de vídeo, fins i tot més encara.
570	science/technology	Es diuen monomorfs tots els individus d'una població que comparteixen una característica fenotípica en particular.
1273	sports	Quatre esquiadores del grup femení d'assegudes no acabaren les seves curses, i 45 del total de 117 esquiadors de l'eslàlom gegant no aconseguiren classificar-se en la cursa.
1400	politics	"Escrites al darrere de la Declaració d'Independència hi havia les paraules ""Declaració d'Independència original amb data 4 de juliol de 1776"". El text es troba a la part inferior del document, cap avall."
664	travel	Podem dir que fer un viatge al parc de Walt Disney World suposa un veritable pelegrinatge per a moltes famílies estatunidenques.
1737	travel	Els taxis compartits són una manera ràpida i còmoda de desplaçar-se a llocs propers, com ara Paro (Nu 150) i Panakha (Nu 200).
457	science/technology	Un altre desavantatge de les lents d'augment és que l'obertura màxima (la velocitat) de la lent sol ser menor.
1051	politics	La primera de les 78 recomanacions és que la nova iniciativa diplomàtica es prengui en consideració abans de la fi d'enguany per a assegurar les fronteres de l'Iraq davant de les intervencions hostils i re-establir les relacions diplomàtiques amb els seus veïns.
870	travel	Si planeges acampar a l'aire lliure, porta un catre d'acampada o una hamaca per mantenir-te lluny de serps, escorpins i altra fauna similar.
1735	travel	Com que els autobusos entre districtes sovint van plens, és recomanable comprar un tiquet amb uns quants dies d'antelació.
1852	sports	Imagina't una ruta d'esquí com quelcom similar a una ruta de senderisme.
816	sports	El successor de Global Running Tours, Go Running Tours, connecta dotzenes de proveïdors de corredors a l'aire lliure a quatre continents.
986	geography	Típics per a Noruega ho són els fiords empinats i valls que de sobte donen pas a un altiplà, més o menys alt.
1786	travel	Els agents de viatges sovint tenen acords amb hotels concrets, tot i que podeu reservar altres formes d'allotjament, com ara campaments, a través d'un agent de viatges.
833	travel	Per aconseguir-ho pot ser necessari omplir un formulari amb la policia local o visitar les oficines d'immigració.
597	science/technology	Si observes éssers vius al microscopi, t'adonaràs que estan formats per petits quadrats o boles.
1281	health	Primer va ser hospitalitzat a l'hospital James Paget de Great Yarmouth.
1472	politics	Les despeses de guerra de l'imperialisme nord-americà durant la conquesta de les Filipines foren sufragades per la pròpia gent filipina.
1011	sports	Estem d'acord amb la declaració del Comitè Olímpic dels Estats Units que es pot servir millor l'interès dels atletes i clubs, i el seu esport, amb avanços significatius dins l'organització, en comptes de treure la certificació.
1674	science/technology	Això ens proporciona un munt d'informació i material per a construir models de simulació que ens ajuden a entendre processos en la nostra ment.
805	health	Considereu realitzar-vos un examen ocular a casa, especialment si l'assegurança us ho cobreix, i porteu la recepta per a emplenar-la a qualsevol altre lloc.
1542	politics	Dos anys després del final de la guerra, els antics aliats eren ara enemics i la guerra freda començà.
134	science/technology	La marea roja la causa una concentració superior a l'habitual de Karenia brevis, un organisme marí unicel·lular natural.
740	geography	Es tracta d'un arxipèlag de 15 illes disseminades en 2,2 milions de km² d'oceà.
1183	health	Encara no s'han confirmat els casos sospitosos de H5N1 a Croàcia i Dinamarca.
