index_id	category	text
1054	politics	"El debat es va desencadenar arran de la polèmica sobre la despesa en assistència i reconstrucció després de l'huracà Katrina, que alguns conservadors fiscals van etiquetar humorísticament de ""New Orleans Deal de Bush."""
1859	geography	La definició té diferències geogràfiques, allà on el límit d'edat pot ser inferior en llocs com ara Nord Amèrica en comparació amb Europa.
1007	health	Tot i que una vacuna experimental sembla que podria reduir la mortalitat de l'Ebola, fins ara, no s'ha pogut demostrar de forma clara que hi hagi medicaments adients per a tractar la infecció existent.
1076	politics	"El portaveu de Bush, Gordon Johndroe, va qualificar la promesa de Corea del Nord de ""gran pas cap a l'objectiu d'assolir la desnuclearització verificable de la península de Corea""."
1099	geography	Els dos satèl·lits, que pesaven més de 450 kg i que viatjaven a més de 25.000 km per hora, van xocar a uns 800 km sobre la Terra.
1100	science/technology	Els científics afirmen que l'explosió causada per la col·lisió fou descomunal.
367	science/technology	La sang surt del cor a través d'uns conductes anomenats artèries i hi retorna en conductes anomenats venes. Els conductes més petits s'anomenen capil·lars.
770	entertainment	La majoria dels festivals del temple se celebren com a part de l'aniversari del temple o de l'aniversari de la deïtat que presideix o qualsevol altre esdeveniment associat amb el temple.
279	politics	"Regit pel principi de ""tot per al guanyador"", l'estat de Florida va aportar tots els seus cinquanta delegats a Romney, portant-lo al capdavant de la nominació del Partit Republicà."
357	science/technology	Per a poder tornar al nivell d'energia anterior, s'han d'alliberar d'energia extra que han obtingut de la llum.
797	science/technology	Si viatges amb un ordinador portàil o una tauleta, desa-hi una còpia a la memòria o al disc (que s'hi pugui accedir sense Internet).
211	health	No hi ha constància de danys personals greus, però almenys cinc dels presents en el moment de l'explosió van rebre tractament per símptomes de xoc.
815	travel	Internacionalment, hi ha gairebé 200 organitzacions turístiques en funcionament. La majoria d'aquestes operen de manera independent.
238	geography	"Pel que sabem, hi ha només un cos planetari amb un dinamisme major que el de Tità, i el seu nom és la Terra"", va afegir Stofan."
1636	science/technology	Els elements com el calci i el potassi es consideren metalls. És clar que també hi ha altres metalls com l'argent i l'or.
761	travel	Aleshores s'ofereix un llistat d'amfitrions disponibles bé en forma impresa bé en línia, de vegades amb citacions i opinions d'altres viatgers.
1676	science/technology	La recerca en IA implica fer màquines per a automatitzar tasques que necessiten un comportament intel·ligent.
848	entertainment	La majoria dels bumerangs disponibles a Austràlia són, de fet, bumerangs que no tornen. És millor que els principiants no intentin de llançar-los amb vent
1089	science/technology	Aquesta teoria diu que la majoria de la matèria obscura al voltant d'una galàxia es troba ubicada al voltant d'una galàxia en una mena d'halo, i està formada per moltes partícules minúscules.
984	health	En humans s'han detallat menys d'un miler de casos, però alguns han resultat fatals.
305	sports	El judoka japonès Hitoshi Saito, guanyador de dues medalles d'or olímpiques, ha mort a l'edat de 54 anys.
697	travel	Jerusalem té molts llocs d'interès històrics, arqueològics i culturals, a més de centres comercials, cafès i restaurants d'allò més animats i concorreguts.
826	travel	Bàsicament, es divideixen en dues categories: o bé treballa durant el viatge o bé procura de limitar les teves despeses. Aquest article se centra en la segona opció.
1672	health	Se sap fa molt de temps que els diferents tipus de danys, traumatismes, lesions i tumors cerebrals afecten el comportament i provoquen canvis en algunes funcions mentals.
536	travel	Habitualment, els llocs més freqüentats pels turistes recreatius són platges, parcs temàtics i càmpings.
1909	science/technology	El teu proveïdor de serveis de telefonia local t'hauria de poder donar més informació sobre com connectar-te a aquest servei.
611	science/technology	Es poden construir animacions sofisticades amb ordinadors, i aquesta casta d'animació es fa servir de manera creixent en televisió i pel·lícules.
157	sports	Després de la carrera, Keselowski roman el líder del Campionat dels Pilots amb 2.250 punts.
1294	politics	Ahir Martelly va prendre jurament a un nou Consell Electoral Provisional (CEP) de nou membres.
1803	travel	D'altra banda, les condicions de neu i gel són normals a molts països, i el trànsit segueix sense gaires interrupcions durant tot l'any.
359	science/technology	"Els científics anomenen aquest procés ""emissió estimulada de radiació"" perquè s'estimulen els àtoms amb la llum blanca, provocant l'emissió d'un fotó de llum, i la llum és un tipus de radiació."
302	politics	La llei francesa es va canviar. El seu activisme va començar als 15 anys quan es va unir a la Resistència Francesa durant la Segona Guerra Mundial.
455	science/technology	Això és cada vegada menys important perquè els fabricants de lents estan assolint estàndards més elevats en la producció de lents.
25	sports	La primera assistència de la nit d'Ovechkin va ser en el gol guanyador del joc pel novell Nicklas Backstrom;
1606	science/technology	La ciència ens mostra avui que aquesta descomunal economia del carbó ha desencaixat un dels estats estables de la biosfera, que ha donat suport a l'evolució de l'home durant els dos darrers milions d'anys.
79	sports	Les dues parts es van confrontar a la gran semifinal, en la que Noosa va perdre per 11 punts.
952	travel	Tot i que hom pot pensar que és lògic unir-se a la línia aèria amb què vola més sovint, cal tenir present que els privilegis que ofereixen solen ser diferents i que altres línies aèries dins de la mateixa aliança poden donar més punts de viatger freqüent.
995	travel	Entre les companyies que ho ofereixen hi ha Air Canada, Delta Air Lines, Lufthansa per a vols amb origen als EUA o el Canadà, i WestJet.
266	science/technology	El control de terra rus va activar els propulsors i l'estació va recuperar l'altitud normal.
112	politics	La decisió del Sr. Rudd de signar l'acord pel clima de Kyoto aïlla els Estats Units, que ara seran l'única nació desenvolupada que no el ratifica.
1050	politics	L'informe és força crític amb gairebé tots els aspectes de l'actual política de l'executiu cap a l'Iraq, i urgeix a canviar-ne l'estratègia immediatament.
1609	travel	Per què els sistemes de transports generen aquesta mena de queixes, per què fallen diàriament? És que els enginyers de transport són incompetents? O està succeint quelcom més fonamental?
1316	sports	Companys lluitadors també han retut homenatge a Luna.
291	geography	La significant activitat sísmica resultat del canvi de fase s'havia produït el 10 de març a la cara nord-oriental de la caldera del volcà.
1215	travel	Les primeres informacions diuen que l'avió s'havia desviat de tornada a l'Afganistan després que li fos negat un aterratge d'emergència a Ürümqi.
1270	sports	Més enllà de l'esdeveniment de dimecres, Carpanedo va competir en 2 curses individuals al Campionat.
663	entertainment	San Francisco és, a més, un dels millors indrets del país on gaudir d'altres cuines asiàtiques: coreana, tailandesa, índia i japonesa.
91	politics	Lodin també va dir que les autoritats van decidir cancel·lar la segona votació perquè els afganesos s'estalviessin les despeses i el risc per a la seguretat d'unes altres eleccions.
371	science/technology	Un triceratop podria haver usat el seu fort bec per a eliminar les fulles a estirades abans de menjar-se la soca.
1806	travel	Alguns animals, com els elefants o les girafes, tendeixen a apropar-se als cotxes, i l'equipament estàndard permetrà unes bones vistes.
930	travel	Encara que potser no necessites visat per a visites curtes, per fer turisme o negocis a certs països, anar-hi com a un estudiant internacional normalment requereix una estada més llarga que anar-hi com un turista ocasional.
33	sports	Piquet Jr. fou acomiadat després del Gran Premi d'Hongria del 2009.
0	health	Dilluns, científics de la Facultat de Medicina de la Universitat de Stanford van anunciar la invenció d'una nova eina per fer diagnòstics que pot separar les cèl·lules per tipus: un petit xip que pot ser imprès i fabricat usant impressores d'injecció estàndards per probablement un cèntim americà cadascun.
200	geography	Felicia, qui fou una tempesta de categoria 4 en l'escala dels huracans de Saffir-Simpson, es va afeblir en un cicló tropical abans de dissipar-se dimarts.
873	entertainment	Si us crida l'aventura, no deixeu passar l'oportunitat d'esprémer o de barrejar alguns sucs de fruites:
774	entertainment	Les Exposicions Hortícoles Internacionals són esdeveniments especialitzats que exposen aparadors florals, jardins botànics i qualsevol altra cosa relacionada amb les plantes.
1377	science/technology	Construïm les nostres cases amb plantes i fem roba amb plantes. La majoria del que mengem són plantes. Sense plantes, la majoria d'animals no podria sobreviure.
203	geography	Algunes de les pluges venien acompanyades de tempestes i llamps freqüents.
1365	science/technology	El rugit del tigre no és com el rugit a veu completa del lleó, sinó més aviat semblant a una frase cridada de paraules d'enuig.
1176	sports	Va ser el darrer partit dels All Blacks, que ja havien guanyat el trofeu feia dues setmanes.
879	health	Molts governs requereixen que els visitants que entrin o els residents que surtin dels seus països siguin vacunats per a una sèrie de malalties.
110	science/technology	Stardust instaurarà un nou rècord històric al convertir-se en la nau que torna a la Terra més ràpidament, batent el rècord previ establert el maig de 1969 durant la tornada del mòdul de comandament de l'Apol·lo X.
1494	science/technology	L'agricultura de subsistència és un sistema simple, sovint orgànic, que utilitza llavors guardades natives de l'ecoregió combinades amb la rotació de cultius o altres tècniques relativament simples per a maximitzar el rendiment.
1086	science/technology	L'efecte que l'equip estava buscant seria causat per les forces de marea entre la matèria obscura de la galàxia i la matèria obscura de la Via Làctia.
1623	geography	L'Amazones també és el riu més ample de la Terra, a vegades fa sis milles d'amplada.
1222	entertainment	La banda de rock havia d'estar de gira pels Estats Units i el Canadà fins al 16 de setembre.
1357	science/technology	Finalment, hi ha molts de petits fèlids (inclosos els gats domèstics assilvestrats) que mengen les petites preses que són de lluny més abundants, com ara petits insectes, rosegadors, llangardaixos i ocells.
216	sports	L'esquaix, el karate i els esports de patinatge han intentat entrar al programa olímpic així com el beisbol i el softbol, que foren eliminats dels Jocs Olímpics el 2005.
327	sports	Nascut a la capital croata, Zagreb, Bobek va esdevenir famós mentre jugava amb el Partizan de Belgrad.
277	politics	L'antic governador de Massachusetts Mitt Romney va guanyar les eleccions primàries presidencials del Partit Republicà de Florida el dimarts amb més d'un 46 per cent del vot.
428	geography	El territori de Turquia fa més de 1.600 quilòmetres (1.000 milles) de llarg i 800 km (500 milles) d'ample, amb una forma més o menys rectangular.
1709	travel	Goma és una ciutat turística de la República Democràtica del Congo, cap a l'extrem oriental, prop de Ruanda.
565	health	Els qui practicaven una activitat regular van requerir més assistència en termes de percepció negativa del dolor, tot distingint les diferències entre el dolor crònic i les molèsties que provoca el moviment físic normal.
742	travel	Tot i que són més petites, a alguns dels visitants de més edat els recorden a Hawaii abans que esdevingués un estat, sense els grans hotels turístics i la resta de construccions.
531	sports	En una ronda habitual es juguen divuit forats; els jugadors solen començar pel primer forat del recorregut i acabar pel divuitè.
729	travel	La Bowen Island és un passeig d'un dia o excursió de cap de setmana popular, que ofereix anar en caiac, senderisme, compres, restaurants i més.
1427	science/technology	Per exemple, el format de fotograma més comú al món és de 35 mm, que era la mida de film principal al tancament de l'era de les pel·lícules analògiques.
865	health	Com passa amb els problemes respiratoris en climes freds, els problemes intestinals en climes càlids són força comuns i en la majoria de casos són molestos però no realment perillosos.
205	travel	Va desaparèixer uns deu minuts abans que hagués d'aterrar, durant el segon intent.
374	science/technology	Una persona que pesi 200 lliures (90 kg) a la Terra pesaria unes 36 lliures (16 kg) a Io, de manera que, òbviament, la gravetat t'empeny amb menys força.
275	politics	La política de Komen ha provocat la desqualificació de Planned Parenthood arran d'una investigació oberta realitzada pel diputat Cliff Stearns sobre la manera com Planned Parenthood gasta els diners i els declara.
1991	travel	Els vies fluvials interiors poder ser un bon tema sobre què basar les vacances.
349	science/technology	Els científics treballen per crear un reactor que pugui generar energia de la mateixa manera.
1325	science/technology	Curtis Cooper, un matemàtic i professor d'informàtica a la University of Central Missouri, ha descobert el nombre primer més gran descobert a data de 25 de gener.
1854	travel	Europa és un continent relativament petit però amb molts països independents. En circumstàncies normals, viatjar entre diversos països implicaria haver de fer moltes sol·licituds de visat i controls de passaport.
946	geography	El canal Mar BlancMar Bàltic uneix l'Oceà Àrtic amb el Mar Bàltic, a través del Llac Onega, el Llac Ladoga i Sant Petersburg, majoritàriament mitjançant rius i llacs.
182	politics	En aquests moments és important, tant des de la perspectiva de la salut pública com de la justícia penal, que la normativa s'aprovi com més aviat millor, va afirmar un portaveu del govern.
1288	politics	El document, segons la filtració, farà referència a la disputa fronterera, que Palestina vol establir segons les fronteres d'abans de la guerra de l'Orient Mitjà de 1967.
1639	science/technology	Els àtoms són tan increïblement petits que bilions d'àtoms cabrien dins del punt final d'aquesta oració.
69	entertainment	La banda va cancel·lar l'espectacle a l'estadi War Memorial de Maui, que s'havia preparat perquè hi assistissin 9.000 persones, i es va disculpar amb els seguidors.
12	sports	Ha perdut recentment contra Raonic a l'Open de Brisbane.
508	health	"El Trastorn per Dèficit d'Atenció ""és una síndrome neurològica que clàssicament s'ha definit com una simptomatologia que inclou impulsivitat, tendència a la distracció i hiperactivitat o excés d'energia""."
1794	travel	Si creues el nord del Bàltic a l'hivern, comprova la ubicació de la cabina, perquè travessar el gel genera un soroll terrible en les més afectades.
667	entertainment	Moltes de les entrades que es venen per Internet a través de llocs de subhastes com ara eBay o Craigslist són entrades multidia usades parcialment.
127	entertainment	Molts dels seus escriptors han continuat exercint una gran influència sobre els nous programes de paròdies de Jon Stewart i Stephen Colbert.
1236	sports	Giancarlo Fisichella va perdre el control del seu cotxe i va acabar la carrera ben poc després de la sortida.
160	sports	Stewart, Gordon, Kenseth, i Harvick completen les deu millors posicions del Campionat de Pilots quan queden quatre curses aquesta temporada.
1732	geography	Els Sundarbans cobreixen una àrea de 3.850 km², de la qual al voltant d'un terç està coberta d'aigua/àrees pantanoses.
1940	geography	La que va ser l'antiga ciutat d'Esmirna, ara és un centre comercial modern, desenvolupat i concorregut, situat al voltant d'una badia enorme i envoltada per muntanyes.
37	entertainment	El programa PBS té més de dues dotzenes de premis Emmy, i la seva emissió només és més curta que la de Barri Sèsam i la de Mister Rogers' Neighborhood.
726	entertainment	Hi ha una sèrie de restaurants que envolten el jardí, i a la tarda i al vespre s'hi fan concerts gratuïts, sovint celebrats a la glorieta central.
1507	science/technology	Les bastides poden ser virtuals o reals: dit d'una altra manera, un professor és una forma de bastida, però també ho és el petit clip assistent de Microsoft Office.
1318	sports	"Dustin ""Goldust"" Runnels ha comentat que ""Luna era tan freaky com jo...pot ser fins i tot més...l'estimo i la trobaré a altar...espero que es trobi en un lloc millor."""
379	science/technology	Les fases s'expliquen perquè només s'il·lumina la cara de Venus (o de la Lluna) que mira al Sol. Les fases de Venus van recolzar la teoria de Copèrnic en la qual els planetes es mouen al voltant del Sol.
1237	sports	El seu company d'equip Fernando Alonso ha liderat la majoria de la cursa, però això s'ha acabat després de la seva parada tècnica, probablement per una roda frontal dreta mal inserida.
375	science/technology	El Sol no té una escorça com la terra sobre la qual podeu estar. Tot el Sol està compost de gasos, foc i plasma.
1736	travel	La majoria dels districtes estan servits per petits Autobusos Japonesos, que són còmodes i robustos.
534	travel	Potser el tipus de turisme més comú és aquell que la majoria de gent relaciona amb el fet de viatjar: el turisme recreatiu.
48	sports	El Sr. Reid va aconseguir conduir el nou cotxe A1GP de l'equip New Zealand a velocitats de més de 160 km/h, travessant el pont set vegades.
246	politics	"D'ençà que el Pakistan es va independitzar de l'Imperi Britànic el 1947, el president pakistanès ha nomenat ""agents polítics"" perquè governin la FATA, els quals exerceixen un control gairebé completament autònom sobre les zones."
1217	politics	Sancions internacionals han significat que no es pugui comprar un avió nou.
1916	entertainment	Tot i que qualsevol iot pot passar pels arxipèlags costaners i els llacs més grans, les barques més petites o fins i tot un caiac ofereixen una experiència diferent.
1192	health	El fotògraf va ser traslladat al Ronal Reagan UCLA Medical Center, on posteriorment va morir.
559	science/technology	Els protons tenen una càrrega elèctrica positiva mentre que els neutrons no tenen càrrega. Els electrons tenen una càrrega elèctrica negativa.
107	geography	S'espera que quan la càpsula arribi a la Terra i entri a l'atmosfera, cap a les cinc de la matinada (hora de l'est dels EUA), produeixi un espectacle de llums pels habitants del nord de Califòrnia, Oregon, Nevada i Utah.
549	sports	Un corredor de mitja milla de primera classe, un home que pot vèncer dos minuts, evidentment ha de posseir una velocitat considerable, però s'ha de cultivar la resistència a qualsevol mena de perill.
1923	travel	Viatjar en avió pot ser una experiència terrorífica per a gent de totes les edats i de tots els ambients, en particular si no han volat abans o si han patit una experiència traumàtica.
126	entertainment	Al Gore i el General Tommy Franks parlaven de manera informal dels seus titulars preferits (el de Gore fou quan The Onion publicà que ell i Tripper tingueren el millor sexe de la seva vida després de la seva derrota electoral del 2000).
983	health	La grip dels ocells, o més formalment grip aviària, pot infectar ocells i mamífers.
915	science/technology	Algunes aplicacions dins d'aquesta categoria fins i tot poden traduir textos en idiomes estrangers sobre rètols o altres objectes del món real quan l'usuari dirigeix el telèfon intel·ligent cap a aquests objectes.
330	sports	Ningú no ha jugat mai més partits ni ha marcat més gols per al club que Bobek.
563	health	L'estudi va descobrir que la por i la catastrofizació van fer de mediador per a la relació entre el dolor i la discapacitat dels que pateixen mal d'esquena.
496	health	Els cirurgians coneixien diversos sedatius, inclosa la morfina d'extractes de llavors d'opi i l'escopolamina de llavors d'herba queixalera.
919	science/technology	Podeu estalviar diners comprant nous mapes per a un GPS o un dispositiu GPS independent o llogar-ne un a una empresa de cotxes de lloguer.
1504	science/technology	L'infant salvatge, quan és criat només per animals no humans, presenta comportaments (sempre dins d'uns límits físics) gairebé del tot iguals als dels de l'animal que el cria, com ara la por o la indiferència en relació amb els humans.
1422	politics	L'any 1683, les forces de la dinastia Qing (1644-1912) prenen el control de les zones costaneres de l'oest i el nord de Taiwan, i declaren Taiwan una província de l'imperi Qing l'any 1885.
202	geography	"La pluja, que va assolir 6,34 polzades en una galga d'Oahu, va ser definida com a ""beneficiosa""."
109	science/technology	La càpsula viatjarà a uns 12.8 km o 8 milles per segon, prou ràpid per anar de San Francisco a Los Angeles en un minut.
1521	science/technology	Fins i tot suggereix que aquestes capacitats d'interpretació del comportament humà podrien ser compartides per animals com ara gossos domèstics.
1479	science/technology	"La majoria de les interpretacions del determinisme tecnològic comparteixen dues idees generals: que el desenvolupament de la tecnologia en si mateix segueix un camí en gran mesura més enllà de la influència cultural o política, i que la tecnologia, al mateix temps, té ""efectes"" a les societats que són inherents, en lloc d'estar socialment condicionada."
1163	politics	Els candidats poden enviar representants per a testimoniar cada part del procediment. Al vespre, els voluntaris compten els vots sota una forta supervisió, seguint procediments específics.
1696	geography	La majoria de les illes més petites són nacions independents, o associades amb França, i són conegudes com a centres turístics de luxe a la platja.
866	travel	Si viatges a un país en vies desenvolupament (o a una nova part del món) per primera vegada, no subestimis el potencial xoc cultural.
1809	sports	Els Jocs Paralímpics tindran lloc del 24 d'agost al 5 de setembre del 2021. Alguns esdeveniments es duran a terme en altres indrets del Japó.
119	entertainment	Aquest joc es basa en la Segona Batalla de Fallujah, una batalla violenta entre les forces nord-americanes i iraquianes.
1175	sports	Per als Springboks, va acabar una ratxa de cinc partits perduts.
198	health	Apart de la febre i el mal de coll, em trobo bé i en bona forma per fer la meva feina des de casa.
144	science/technology	Això implica que tot s'ha de tornar a revisar, ha dit l'investigador al Rift Valley Research Service a Etiòpia i coautor de l'estudi, Berhane Asfaw.
1167	entertainment	Durant els seus inicis, el programa només s'emetia a la històrica cadena de ràdio en línia TogiNet Radio, especialitzada en ràdio parlada.
908	science/technology	"Les empreses multimèdia menteixen una vegada i una altra sobre l'objectiu d'aquesta acció, adduint que es fa per ""prevenir la pirateria""."
1196	sports	Amb només divuit medalles disponibles per dia, un bon nombre de països ha fallat per aconseguir el podi de medalles.
111	science/technology	Es desplaçarà per la costa oest de Califòrnia i il·luminarà el cel des de Califòrnia fins al centre d'Oregon, per seguir cap a Nevada i Idaho i penetrar a Utah, va dir Tom Duxbury, responsable del projecte Stardust.
1722	travel	Com passa amb tots els parcs nacionals sud-africans, s'ha de pagar una tarifa diària de conservació i entrada.
1989	travel	També hi ha alguns autobusos que viatgen al nord fins a Hebron, lloc d'enterrament tradicional dels patriarques bíblics Abraham, Isaac i Jacob, i de les seves esposes.
512	health	El TDA afecta les relacions amb els altres companys perquè els altres nens no poden entendre per què ells actuen així com ho fan o per què lletregen així com ho fan o que el nivell de maduresa sigui diferent.
1182	health	França és el setè país de la Unió Europea que pateix aquest virus; segueix Àustria, Alemanya, Eslovènia, Bulgària, Grècia i Itàlia.
393	politics	"Alemanya va donar a l'atac el nom en clau ""Operació Lleó Marí"". La majoria de les armes pesades i els subministraments de l'exèrcit britànic s'havien perdut a l'evacuació de Dunkerque, per la qual cosa l'exèrcit era més aviat feble."
1908	science/technology	El servei se sol usar en les embarcacions, incloses les naus recreatives, així com en expedicions que necessiten dades i veus remotes.
592	science/technology	Els animals estan formats per moltes cèl·lules. Mengen coses i les digereixen en el seu interior. La majoria d'animals es poden moure.
550	sports	Algunes curses de camp a través durant l'hivern, combinada amb treball de gimnàs per la part superior del cos, és la millor preparació per a la temporada de curses.
1210	entertainment	Va treballar en programes com Taxi, Cheers i The Tracy Ullman Show a la dècada de 1980.
1232	entertainment	"Lakkha Singh també va presentar el ""bhajan"" del ""chhappan bhog"". El va acompanyar el cantant Raju Khandelwal."
1891	travel	Als viatgers als quals els ha estat fàcil d'adaptar-se a la nova cultura sovint els és particularment difícil de tornar-se a adaptar a la seva cultura nativa.
1798	entertainment	"Alguns recintes ofereixen begudes alcohòliques dins al casa. Tanmateix, l'embriaguesa altera el judici, i tots els bons ""gamblers"" saben que és important mantenir-se sobris."
