index_id	category	text
1158	geography	Glen Cushing ၊ ၵေႃႉဢၼ်ပဵၼ်ၵူၼ်းၼႂ်းၸုမ်း United States Geological Survey (USGS) ဢၼ်လဵပ်ႈႁဵၼ်းလွင်ႈလႅင်လၢဝ် (ၾႃႉမိုၼ်ႇမုင်ႈ) လႄႈ [ပဵၼ်ၵူၼ်း] ၼႂ်းၸၼ်ႉၸွမ် Arizona ပွတ်းႁွင်ႇ (Northern Arizona University) ဢၼ်ပၵ်းသဝ်းတီႈဝဵင်း Flagstaff ၊ ၸိုင်ႈ Arizona လၢတ်ႈဝႃႈ လူမ်းမႆႈၼၼ်ႉ ဢမ်ႇၼိမ်မိူၼ် ၼႂ်းထမ်ႈလူင် ဢၼ်မီးၼိူဝ်လိၼ်မိူင်း (ဢၼ်မီးလူမ်းမႆႈ ပိူင်တၢႆ)၊ ၵူၺ်းၵႃႈ မၼ်းၵႂႃႇၵွင်ႉၵၢႆႇၵၼ်တင်းလုၵ်းလိုၵ်ႉလူင်ၼႂ်းလိၼ်ၼၼ်ႉယူႇ ၼႆယဝ်ႉ။
190	travel	ၵူၼ်းဢွၵ်ႇတၢင်းၶဝ်လႆႈႁပ်ႉၼမ်ႉၵိၼ်ယွၼ်ႉၶဝ်လႆႈပႂ်ႉဝႆႉတီႈဢၼ်မီးလူမ်းမႆႈ 90(F) တီႇၵရီႇ။
1233	entertainment	လွင်ႈတၢင်ႇလၢတ်ႈ ၼႂ်းဝၼ်းၽတ်းၶွင် Tokyo Game Show ၼၼ်ႉ  ႁူဝ်ပဝ်ႈ Nintendo လႆႈပိုတ်ႇလၢတ်ႈ လွင်ႈလႆႈႁဵတ်းဢွၵ်ႇမႃး ၾၢင်ႁၢင်ႈၼဵၼ် (controller design)  ပဵၼ်ၶူဝ်းၶွင် ႁဵတ်းဢွၵ်ႇမႂ်ႇတႃႇၵုမ်ႇမၼီႇ ၼႆယဝ်ႉ။
1548	politics	ၼိူင်ႈၼႂ်းတူဝ်ယၢင်ႇဢၼ်မိူဝ်ႈဢမ်ႇႁိုင်ဢမ်ႇၼၢၼ်းမႃးၼႆႉဢၼ်ၵိုင်ႇလီတွင်းမၢႆဝႆႉလိူဝ်သေပိူၼ်ႈၼၼ်ႉ ပဵၼ် ပၢင်တိုၵ်း ဢတ်ႉလႅၼ်ႉတိၵ်ႉ ပွတ်းႁွင်ႇ  ၶွင်သိုၵ်းလုမ်ႈၽႃႉ ပွၵ်းၵမ်းသွင်း ။ သိုၵ်းဢမေရိၵၼ်ႇၶဝ် လႆႈၶတ်းၸႂ်ၶၢႆႉၵူၼ်းသိုၵ်းလႄႈၶိူင်ႈၶွင်ၶဝ်ၶၢမ်ႈ ၼမ်ႉပၢင်ႇလၢႆႇ  တႃႇၸွႆႈမိူင်းၿရိတ်ႉထဵၼ်ႇ။
647	entertainment	ၵူၼ်းႁဝ်းၵမ်ႈၼမ်ၼႆႉ ဝူၼ်ႉႁၼ်မႅၼ်ႈဝႃႈ ၸဝ်ႈၵဝ်ႇလႆႈတူၺ်းငဝ်းႁၢင်ႈသဵင် (ထီးဝီး) ဢၼ်ပၼ်တၢင်းႁူႉႁဝ်းၵပ်းၵၢႆႇလူၺ်ႈၶၵ်ႉတွၼ်ႈ ဢမ်ႇၼၼ် တူဝ်ထူပ်းသေဢၼ်ဢၼ် ၼႄႁဝ်းယူႇသေတႃႉၵေႃႈ ႁဝ်းသမ်ႉဢမ်ႇဢၢၼ်းၶဝ်ႈႁူမ်ႈၸွမ်း လႄႈ ဢမ်ႇဢဝ်တၢင်းႁူႉၼၼ်ႉမႃးၸႂ်ႉၼႂ်းၸၢတ်ႈပၢၼ်ႁဝ်းၼင်ႇၵဝ်ႇ။
1522	science/technology	လွင်ႈလဵပ်ႈႁဵၼ်းသွၵ်ႈႁႃၼႂ်းႁူဝ်ပၢၵ်ႇပီထူၼ်ႈသၢဝ်းၼႆႉႄၼဝႃႈ မီးၸိူဝ်ႉဢၼ်ပႅၵ်ႇပိူင်ႈၵၼ်သွင်မဵဝ်း: မဵဝ်းဢၼ်သိူင်ႇမူၵ်းဝႆႉႄလႈဢၼ်ၼႄၽၢင်ႁၢင်ႈ။
601	science/technology	ထၢတ်ႈၼႆႊထရူဝ်ႊၸဵၼ်ႊ (Nitrogen) ဢၼ်ပဵၼ်ထၢတ်ႈလူမ်းၼၼ်ႉ မီးၽၢင်ႁၢင်ႈမိူၼ်ၵၼ်တင်းထၢတ်ႈၼႆႊထရူဝ်ႊၸဵၼ်ႊ(Nitrogen) ဢၼ်ပဵၼ်ထၢတ်ႈၼမ်ႉၼၼ်ႉၵူၺ်း။ ၽၢင်ႁၢင်ႈဢၼ်ပဵၼ်ၼမ်ႉၼၼ်ႉ မၼ်းၵႅၼ်ႇလိူဝ်သေတႃႉ ၵူၺ်းၵႃႈၵွၼ်ႈလဵၵ်ႉလဵၵ်ႉဢွၼ်ႇ(molecules) ၸိူဝ်းၼၼ်ႉယင်းတိုၵ်ႉမိူၼ်ၵၼ်ယူႇ။
1747	sports	ၸိုင်ႈမိူင်းဢႃႇၵျိၼ်ႇတီးၼႃး ၼၼ်ႉ မီးၸိုဝ်ႈသဵင် ယွၼ်ႉပိူဝ်ႈမီး ၸုမ်းလဵၼ်ႈၽူဝ်ႇလူဝ်ႇလႄႈ ၵူၼ်းလဵၼ်ႈၽူဝ်ႇလူဝ်ႇ ဢၼ်ၶိုၵ်ႉလီသေပိူၼ်ႈ တီႈၼႂ်းလုမ်ၾႃႉၼႆႉယဝ်ႉ။
142	sports	လွင်ႈတႅပ်းတတ်း NBA ၶဝ်ဢိင်ၼိူဝ် လွင်ႈၸုမ်းၵူၼ်း Utah Jazz ၶဝ်ၸႅတ်ႈႁၼ်ၺႃးၸိူဝ်ႉမႅင်းတၢင်းပဵၼ် COVID-19 ၼၼ်ႉယဝ်ႉ။
1802	travel	မူၺ်ဢၼ်ႁူင်ႈတူၵ်းမႃးလႄႈဢၼ်လူမ်းထူဝ်းပတ်ႉမႃး ဢမ်ႇၼၼ် ဢၼ်ၵၢမ်ႈဝႆႉ၊ ဢမ်ႇၼၼ် ၼမ်ႉၶႅင်ဢၼ်မီးၼိူဝ်ၽၵ်းတူမၢၼ်ႇၵႃးၼၼ်ႉ ၸၢင်ႈႁဵတ်းႁႂ်ႈသူဢမ်ႇပေႃးႁၼ်လႆႈသင်။
825	travel	သင်ဝႃႈၶႂ်ႈၵႂႃႇလႄႇၼႂ်းလုမ်ႈၾႃႉၼႆႉသေဢမ်ႇၶႂ်ႈၸႂ်ႉငိုၼ်းၼမ်၊ တွၼ်ႈတႃႇတၢင်းလူဝ်ႇ၊ လွင်ႈယူႇသၢင်ႈၵိၼ်သဝ်း ဢမ်ႇၼၼ်တွၼ်ႈတႃႇလွင်ႈၶဵင်ႇတႃႉၼႆၸိုင်၊ မၼ်းမီးလၢႆးမၼ်းယူႇၵမ်ႈၽွင်ႈတႃႇတေႁဵတ်းၸိူင်ႉၼၼ်။
1144	politics	ၸုမ်းသိုၵ်းဢူၺ်းလီလႄႈၸုမ်းသိုၵ်းဢၢပ်ႊၾ်ၵၢၼ်ႊ(Afghan)ၶဝ်ၶဝ်ႈၵႂႃႇတီႈၼႃႈလိၼ်ၼၼ်ႉတႃႇဢဝ်ႁူမ်ႇလူမ်ႈပၼ်ဢွင်ႈတီႈၼၼ်ႉ လႄႈႁိူဝ်းမိၼ်ၸုမ်းဢူၺ်းလီၶဝ်ၵေႃႈထုၵ်ႇသူင်ႇႁႂ်ႈၵႂႃႇၸွႆႈထႅမ်ပႃး။
1850	sports	ၵၢၼ်ၶီႇသၵီႊသေပိူဝ်ႉထူင်လႄႇ (backpacking by ski)။ ၵၢၼ်တူင်ႉၼိုင်ဢၼ်ၼႆႉ ႁွင်ႉလႆႈထႅင်ႈလၢႆမဵဝ်း မိူၼ်ၼင်ႇ ၵၢၼ်ၶီႇသၵီႊလႄႇၸွမ်းထိူၼ်ႇလွႆ(backcountry ski)၊ ၵၢၼ်ၶီႇသၵီႊဢွၵ်ႇၶၢဝ်းတၢင်းလႄႇ (ski touring)၊ ဢမ်ႇၼၼ် ၵၢၼ်ၶီႇသၵီႊၶိုၼ်ႈလွႆ (ski hiking) ၼႆၵေႃႈႁွင်ႉလႆႈယူႇယဝ်ႉ။
1033	science/technology	ၶဝ်လႆႈၶူၼ်ႉႁၼ်ဝႃႈ ၵၢင်ဝၼ်းၼၼ်ႉ တူင်ႉၼိုင်ၸွမ်းပၵ်းပိူင်ငဝ်ႈၶၢမ်ႇပိုၼ်ႉ(basic principles) ဢၼ်မိူၼ်ၵၼ် ၸိူင်ႉၼင်ႇလၢဝ်ၸိူဝ်းၼၼ်ႉ၊ လႆႈႁၼ်ဝႃႈ လွင်ႈတူင်ႉၼိုင်လၢဝ်တင်းသဵင်ႈ ၼ်ႂးလွၵ်းလၢႆးၼၼ်ႉတႄႉ ၶဝ်လႆႈထုၵ်ႇဢီးၵႂႃႇ ၵွပ်ႈသၢႆလႅင်းႁိူဝ်ႈၶဝ် လႄႈ ၵွပ်ႈဢၼ်ၶဝ်ပၼ်ယူႇဝႆႉၼၼ်ႉၵူၺ်း၊ ဢမ်ႇမီးသင်ထႅင်ႈ တၢင်ႇဢၼ်။
1848	sports	တၢင်းဝူၼ်ႉတႃႇတေၶီႇ သၵဵၵ်ႉၼႆႉမၼ်းၵဝ်ႇႁႅင်းၼႃႇယဝ်ႉ— ႁၢင်ႈၵူၼ်းၶီႇသၵဵၵ်ႉ ဢၼ်ၸၼ်ဝႆႉတီႈၼႂ်းထမ်ႈ ၼႄဝၼ်းမၼ်းၶိုၼ်း ပေႃးၶႂ်ႈၵႆလိူဝ်ၵႆၸဵမ် 500 BC ၼၼ်ႉယဝ်ႉ။
228	geography	ၽင်ႇႁိုၵ်းၸိူဝ်းၼႆႉ လႆႈႁၼ်ၸွတ်ႈတူဝ်ႈၼိူဝ်လိူၼ် ယဝ်ႉ​ၵေႃႈမိူၼ်ဝႃႈထုၵ်ႇတၢင်းၽိင်ႈၾႃႉတိုဝ်ႉၺႃးဢိတ်းဢွတ်းသေ ၼႄဝႃႈ လွင်ႈပၢႆးလိၼ်ဢၼ်ႁဵတ်းႁႂ်ႈၶဝ်ဢွၵ်ႇပဵၼ်မႃးၼၼ်ႉ တိုၵ်ႉဢမ်ႇပႆႇပေႃးႁိုင်ၼႆၼၼ်ႉယဝ်ႉ။
292	geography	လႆႈမီးလွင်ႈပွင်ႇၶၢဝ်ႇမႃးဝႃႈ တီႈႁိမ်းတိၼ်လွႆၼၼ်ႉ မီးမွၵ်ႇၵုမ်ႈသီလမ် ဢၼ်ဢမ်ႇၵဵဝ်ႇၶွင်ႈၵပ်းၵၢႆႇတင်း လွင်ႈတူင်ႉၼိုင်လွႆၾႆးသင်ၼႆယဝ်ႉ။
1225	sports	တႄႇပူဝ်ႇတူဝ်ႇ ၼႆႉသၢႆငၢႆလီၸဵမ်ၸဝ်ႉ မိူဝ်ႈၵမ်းထူၼ်ႈသွင်ၼၼ်ႉယဝ်ႉ၊ ၵူၺ်းၼႃႇ ဝၢႆးသေႁွတ်ႈထိုင်  6 တေႃႇ 6 တႄႉ လူဝ်ႇလႆႈထိင်းသိမ်းလွင်ႈပဵင်းၵၼ် ႁၢၼ်ႉတေႃႇထိုင်ႇၶၢဝ်းလိုဝ်ႈယူႇ။
1416	sports	ၵၢၼ်လဵၼ်ႈႁႅင်းဢၼ်ပိူၼ်ႈသူင်လဵၼ်ႈၼၼ်ႉပဵၼ် ၵၢၼ်ပိတ်ႉမၢၵ်ႇၼင်၊ တၢင်းလဵၼ်ႈပၢသ်ႊၵဵတ်ႊပေႃႊလ်(basketball)၊ တၢင်းလဵၼ်ႈဝေႃႊလီႊပေႃးလ် (volleyball) ၊ တၢင်းလဵၼ်ႈမၢၵ်ႇၼင်ၼႂ်းၼမ်ႉ (water-polo) ၊ ၵၢၼ်ၽိုၵ်းလၢႆးလႅဝ်း (fencing)၊ တၢင်းလဵၼ်ႈရၵ်ႇပီႇ (rugby)၊ ၶီႇလႅင် (cycling)၊ တၢင်းလဵၼ်ႈႁွၵ်ႇၵီႇၼိူဝ်ၼမ်ႉၶႅင် (ice hockey) ၊ ႁွၵ်ႇၵီႇၵိင်ႈ (roller hockey) လႄႈ ၵၢၼ်ၶႄႉၶဵင်ႇႁေႃႈၵႃး F1 (F1 motor racing)။
129	entertainment	ဝဵင်းၼႆႉတေပဵၼ်ဝဵင်းဢွၼ်တၢင်းသုတ်းတီႈၼႂ်း ၸဵင်ႇၸၢၼ်းဝၼ်းဢွၵ်ႇယူႇရူပ်ႉ ဢၼ်ႁပ်ႉႁဵတ်းပွႆး CowParade၊ ပၢင်ပွႆးဢၼ်ၼႄပၢႆးမွၼ်း ၼႂ်းၵႄႈၵူၼ်းၼမ်ဢၼ်ယႂ်ႇသုတ်း တီႈၼႂ်းလူၵ်ႈ ၼႂ်းၵႄႈလိူၼ် June လႄႈ August ပီၼႆႉ။
1003	science/technology	မၼ်းၸၢႆးလၢတ်ႈဝႃႈ မၼ်းၸၢႆးလႆႈၵေႃႇသၢင်ႈ ႁိင်ႇၽၵ်းတူ ဝၢႆႇၽၢႆႇ ၼႆယဝ်ႉ။
271	health	Dr. Lee ၵေႃႈ လႆႈမွၵ်ႇလၢတ်ႈၼႄ လွင်ႈတၢင်းမႆႈၸႂ်မၼ်း ၵပ်းၵၢႆႇလူၺ်ႈၽိုၼ်လၢႆးငၢၼ်း ဢၼ်လၢတ်ႈဝႃႈ မိူဝ်ႈလဵဝ်လုၵ်ႈဢွၼ်ႇၼႂ်းမိူင်းတူႇရၵီႇ(Turkey) ၶဝ်ၼၼ်ႉ လႆႈၸပ်းတၢင်းပဵၼ် A(H5N1)ဝၢႆးရၢတ်ႉ  ဢၼ်ဢမ်ႇမီးလွင်ႈၶႆႈၼၢဝ်သင်ၼၼ်ႉ ၼႆယဝ်ႉ။
103	politics	ၶေႃႈၵႂၢမ်းႁၼ်ထိုင် ဢၼ်တူၺ်းၵမ်းသိုဝ်ႈၼၼ်ႉ ပဵၼ်ပွၵ်ႈထီႉၼိူင်ႈဢၼ်ၵူၼ်းထဝ်ႈၵႄႇ ၸၢဝ်း Iranian ယွမ်းႁပ်ႉဝႃႈ လွင်ႈပၼ်တၢင်းၽိတ်းႁၢမ်ႈတၢပ်ႈၸိူဝ်းၼႆႉ မီးလွင်ႈတိူဝ်ႉၶိူၵ်ႈသေဢၼ်ဢၼ်ယူႇၼႆၼၼ်ႉယဝ်ႉ။
14	sports	"ဝၢႆးသေပၢင်ပွၺ်းၶေႉၶဵင်ႇယဝ်ႉယဝ်ႉၼၼ်ႉ ၶုၼ်ႁေႃၶမ်း မိူင်းၶရေး လၢတ်ႈဝႃႈ၊ ""ၶႃႈႁဝ်း တိုၼ်ႇတဵၼ်ႈ လွင်ႈလႆႈပွၵ်ႈမႃးၶိုၼ်း ၼႂ်းပၢင်ၶေႉၶဵင်ႇပွၵ်ႈလိုၼ်းသုတ်း ၼႂ်းပၢင်ပွၺ်းဢၼ်လမ်ႇလွင်ႈသေပိူၼ်ႈၼၼ်ႉတေႉယဝ်ႉ။ ၶႃႈမႃးတီႈၼႆႈ ပဵၼ်တွၼ်ႈတႃႇၶတ်းၸႂ် ႁႂ်ႈပေႉပၢင်ၶေႉၶဵင်ႇၼႆႉယူႇယဝ်ႉ။"""
1412	politics	တႃႇတေတမ်းၶွၼ်ႇၼၼ်ႉ သၽႃးၶွၼ်ႇၵရႅတ်ႉ ဢမ်ႇမီးဢမ်းၼၢတ်ႈသေပိူင်ၼႆသေ ၵွပ်ႈပိူဝ်ႈ ဢမ်ႇလႆႈမီးၽူႈမီးဢမ်းၼၢတ်ႈႁဵတ်းသၢင်ႈ ဢမ်ႇၼၼ် ၽူႈတတ်းသိၼ်ၸၼ်ႉၸိုင်ႈမိူင်းၼႆလႄႈ တႃႇတေတဵၵ်းၸႂ်ႉႁႂ်ႈ ၼပ်ႉယမ်မၢႆမီႈတင်းမူတ်းၼၼ်ႉ မၼ်းလူဝ်ႇလႆႈပိုင်ႈဢိင်ၼိူဝ် ၽူႈဢုပ်ႉပိူင်ႇၸိုင်ႈ ဢၼ်ၵမ်ႉၼမ်ဢမ်ႇမီးလွင်ႈႁူမ်ႈသၢင်ႈ ၼၼ်ႉယူႇယဝ်ႉ။
1811	travel	သင်သူလႆႈသိုဝ်ႉဝႆႉထႃႈ ဝ်ႂႁိူဝ်းမိၼ် လႄႈ တီႈယူႇတၼ်းသဝ်း ပုၼ်ႈတႃႇ2020 ဢွၼ်တၢင်းပႆႇပိုၼ်ၽၢဝ် လွင်ႈသုတ်ႉၶၢႆႉပေႃးၼႆၸိုင် သူတေမီးလွင်ႈသုၵ်ႉသၢၵ်ႉယဝ်ႉ။
1681	science/technology	လွၵ်းလၢႆးပၢႆးၸၢၵ်ႈ(Technology)ၼႆႉ ဢဝ်တင်းၶၢဝ်းတၢင်းဢွၵ်ႇတူၺ်း ဢၼ်လႆႈႁၼ်မိူၼ်ၼင်ႇတေႉသေ ႁဵတ်းပၼ်လွင်ႈၵႄႈလိတ်ႈၵႂႃႇ။ လုၵ်ႈႁဵၼ်းၶဝ် ၸၢင်ႈလႆႈတူၺ်း ၶူဝ်းၶွင်ၸ်ႂႉတိုဝ်း တီႈၼ်ႂးႁူင်းၼႄ၊ ၵႂႃႇလႄႇလႆႈ တီႈႁွင်ႈၼႄပိုၼ်ႉတ်ႂႈၼမ်ႉ(aquarium)ဢၼ်ၼိုင်ႈ ဢမ်ႇၼၼ် လႆႈဢၢမ်းသေတူၺ်း လၢႆးမိုဝ်းႁၢင်ႈလီ မိူဝ်ႈၽွင်းၼင်ႈယူႇ ၼ်ႂးႁွင်ႈႁဵၼ်းၶဝ်ၼၼ်ႉယဝ်ႉ။
335	entertainment	ၽူႈႁွင်ႉၵႂၢမ်းၸိုဝ်ႈသဵင်လိုဝ်းလင်ၵူၼ်းယိင်းၸၢဝ်းၶိူဝ်း Turkish ၸိုဝ်ႈႁွင်ႉဝႃႈ Sezen Aksu ဢွၵ်ႇႁွင်ႉၵႂၢမ်းမူၼ်ႈၸႂ်ပၼ်ၸွမ်းၵၼ်တင်း Alessandro Safina ၽူႈႁွင်ႉၵႂၢမ်းၵူၼ်းၶိူဝ်း Italian ဢၼ်ႁွင်ႉသဵင် tenor  ႄလႈ ၽူႈႁွင်ႉၵႂၢမ်း Haris Alexiou ၵူၼ်းၶိူဝ်း Greek ဝႆႉယူႇယဝ်ႉ။
378	science/technology	ဝၢႆးသေ မွၵ်ႈသၢမ်ႁႅင်ပီႊပူၼ်ႉမႃး၊ ၼႂ်းပီႊ 1610 ၼၼ်ႉ Galileo Galilei ၽူႈလူင်ႉလႅၼ်ႇၽၢႆႇလိူၼ်လၢဝ်ၵၢင်ဝၼ်း (ၾႃႉမိုၼ်ႇမုင်ႈ) ၵေႃႉဢၼ်ပဵၼ်ၵူၼ်းၶိူဝ်း ဢီႇတလီႇ လႆႈၸႂ်ႉတိုဝ်းၵွင်ႈမုင်ႈတၢင်းၵႆ (telescope) သေ လဵပ်ႈႁဵၼ်းႁၼ်ဝႃႈ လုၵ်ႈလၢဝ် Venus ၵေႃႈ မီးလွင်ႈလၢႆႈၾၢင်ႁၢင်ႈမိူၼ်ၼင်ႇလုၵ်ႈလိူၼ်ၼၼ်ႉၵူၺ်းၼင်ႇၵဝ်ႇယဝ်ႉ။
1367	science/technology	ၸဝ်ႈပၢႆးသၢႆႊၶဝ် ဝူၼ်ႉႁၼ်ဝႆႉဝႃႈ မႅဝ်းထိူၼ်ႇ Ocelot ၼႆႉတွၼ်ႊတႃႇတေႁႃ လႄႈ လမ်းတူဝ်ၵိၼ်တူဝ်သတ်းၶဝ်ၼၼ်ႉ မၼ်းဢဝ် လႆႈဢဝ်ၶူႈလင်မၼ်းသေ ၼူမ်သႅဝ်ႊဢၢႆႊမၼ်းယဝ်ႉ။
703	travel	လွင်ႈလႄႇလၢဝ်းမိူင်းၼႆႉ ၵႃႈမၼ်းတေပေႃးလိူဝ် တႃႇၸုမ်းယ်ႂႇလိူဝ်ၼၼ်ႉ၊ ၵွပ်ႈၼၼ် သင်သူမီးၵေႃႉလဵဝ် ဢမ်ႇၼၼ် ၵွႆးမီးဢူၺ်းၵေႃႉ ၵေႃႉၼိုင်ႈၵွႆးၼႆ ၶတ်းၸ်ႂထူပ်း တင်းၵူၼ်းတၢင်ႇၵေႃႉသေ ၽွတ်ႈပဵၼ်ၸုမ်း ဢၼ်မီးသီႇၵေႃႉ တေႃႇထိုင်ႁူၵ်းၵေႃႉ တႃႇလႆႈၵႃႈၶၼ်ပေႃးလိူဝ် ပုၼ်ႈတႃႇၼိုင်ႈၵေႃႉၼၼ်ႉလႄႈ။
297	politics	ဢၼ်လႆႈတၢင်ႇၼႄဝႆႉ တႃႇမူၼ်ႉမႄးၼၼ်ႉ တင်းသွင်သၽႃး ႁပ်ႉၶၢမ်ႇႁၼ်လီၸွမ်း မိူဝ်ႈၼ်ႂးပီ 2011ၼၼ်ႉယဝ်ႉ။
80	sports	ဝၢႆးၼၼ်ႉ Maroochydore ၶႄႉၶဵင်ႇပေႉ Caboolture ၼႂ်း ပၢင်ၶႄႉၶဵင်ႇ Preliminary Final ယူႇယဝ်ႉ။
1823	travel	လွင်ႈလႄႇၵၢတ်ႇလတ်ႈၽူႈပႂ်ႉၼႆႉ ပဵၼ်သုၼ်ႇတိုဝ်ႉတၢင်းလီ တႃႇသိုဝ်ႉၵုၼ်ႇၶူဝ်းၶွင် ဢၼ်လွတ်ႈၶွၼ်ႇ လႄႈ မီးမႃးၼႂ်းပိုၼ်ႉတီႈ တီႈလႂ်တီႈၼိူင်ႈၵူၺ်းၼၼ်ႉယဝ်ႉ။
836	travel	ပၢႆးမွၼ်းၵၢၼ်ၸၼ်ၽၢင်ႁၢင်ႈၶူင်သၢင်ႈ (architecture) ၼၼ်ႉ ၵဵဝ်ႇလူၺ်ႈလွင်ႈၵၢၼ်ၸၼ်ၽၢင်ႁၢင်ႈလႄႈၵၢၼ်ၵေႃႇသၢင်ႈၶွင်ႁိူၼ်းတႅၵ်ႈ (building)။ ပၢႆးမွၼ်းၵၢၼ်ၸၼ်ၽၢင်ႁၢင်ႈၶူင်သၢင်ႈ(architecture) ၶွင်ဢွင်ႈတီႈဢၼ်ၼိုင်ႈၼၼ်ႉ ၵႆႉပဵၼ်ဢွင်ႈတီႈဢၼ်ၸၼ်ၸႂ်ၵူၼ်းလႄႇမိူင်းဢၼ်ၼိုင်ႈယူႇ။
880	travel	တၢင်းလူဝ်ႇၸိူဝ်းၼႆႉ ၵမ်ႉၼမ် လႅပ်ႈတေဢိင်ၼိူဝ်ဝႃႈ မိူင်းလႂ်လၢႆလၢႆ ဢၼ်ၵူၼ်းဢွၵ်ႇၶၢဝ်းတၢင်းၼၼ်ႉလႆႈၵႂႃႇမႃး ဢမ်ႇၼၼ် ယိူင်းဢၢၼ်းတႃႇၵႂႃႇ။
1143	politics	ပႃႇတီႇၽွင်းငမ်း၊ South West Africa People's Organisation (SWAPO) ၼၼ်ႉၵေႃႈ သိုပ်ႇၵမ်ဢဝ်ဝႆႉ တီႈတင်းၼမ် ၼႂ်းၵၢၼ်လိူၵ်ႈတင်ႈသၽႃးယဝ်ႉ။
650	science/technology	ႁူင်းလိုဝ်ႈသဝ်း ဢမ်ႇၼၼ် ၸဝ်ႈႁိူၼ်း (သင်သူယူႇ တီႈႁိူၼ်းၶႅၵ်ႇလိုဝ်ႈသဝ်း ဢမ်ႇၼၼ် ႁိူၼ်းသုၼ်ႇတူဝ်) လႅပ်ႈတေမီးပၼ်ဝၢႆႇၽၢႆႇ ဢမ်ႇၼၼ် သၢႆၼႅင်ႈၼႅတ်ႇ ၵွင်ႉၸူး PCဝႆႉ၊ ယဝ်ႉၵေႃႈ တီႈယူႇသေတီႈတီႈ ဢၼ်မီးသႅင်ႇဢိၼ်ႇတႃႇၼႅတ်ႉ ဢမ်ႇၼၼ် ဢၼ်မီး ဝၢႆႇၽၢႆႇတွၼ်ႈတႃႇ ၵူၼ်းတၢင်းၼမ်ၸႂ်ႉၼၼ်ႉ။
702	travel	ၼႂ်းဝၼ်းမိူဝ်ႈဢၼ်သူဢွၵ်ႇတၢင်းၼၼ်ႉ ဝႂ်ၶၢမ်ႈမိူင်းသူ တိုၼ်းလူဝ်ႇလႆႈၸႂ်ႉတိုဝ်းလႆႈထႅင်ႈ တီႈဢေႇသုတ်း 6 လိူၼ်လိူဝ်။ ဝႂ်ႁိူဝ်းမိၼ်ဢၼ်ၼိုင်ႈႁွပ်ႈ/ဝႂ်ႁိူဝ်းဝိၼ်ဢၼ်ၵႂႃႇၼႆႉ လူဝ်ႇတွၼ်ႈတႃႇတေၼေလၵ်းထၢၼ်တၢင်းႁိုင် ဢၼ်သူတေယူႇၼၼ်ႉယူႇယဝ်ႉ။
1604	travel	ၵူႊၼႂ်ၸဝ်ႉၼႆႉ ၵူၼ်းတၢင်းလၢႆလႆႈၽၢတ်ႇဢွၵ်ႇ ဝဵင်းၼႂ်းမိူင်းဢွၼ်ႇၼၼ်ႉသေ ၸွမ်းလူတ်ႉၵႃး တႃႇတေၵႂႃႇႁဵတ်းၵၢၼ်ၶဝ် တီႈဢွင်ႈၵၢၼ် လႄႈ မၢင်ႊၸိူဝ်းၵေႃႈလတ်းၵႂႃႇ ၽူႈၸိူဝ်း ဢၼ်ႁဵတ်းၵၢၼ်တီႈၵႆ ပဵၼ်ဢွင်ႈတီႈလိုၼ်းသုတ်းတီႈၶဝ်ဢွၵ်ႇမႃးၼၼ်ႉယဝ်ႉ။
817	sports	ၵွပ်ႈဝႃႈမီးငဝ်ႈၸုမ်းမၼ်းပဵၼ် ၸုမ်းဢွၼ်လႅၼ်ႈလႄႇၶွင်မိူင်းပႃႊသေႊလူဝ်ႊၼႃႊ (Barcelona's Running Tours) လႄႈ ၸုမ်းဢွၼ်လႅၼ်ႈၶွင်ဝဵင်းၶူဝ်ႊၽဵၼ်ႊႁေႊၵၼ်ႊ (Copenhagen's Running Copenhagen) သေလႄႈ ႁဵတ်းႁႂ်ႈၸုမ်းဢွၼ်လႅၼ်ႈလႄႇၶွင်းဝဵင်းၽရၢၵ်ႊ (Running Tours Prague) ဢၼ်ပၵ်းဝႆႉၼႂ်းဝဵင်းၽရၢၵ်ႊ(Prague) လႄႈတၢင်ႇၸုမ်း ၶဝ်ႈႁူမ်ႈၸွမ်းၶၼ်ၶၼ်ၽႂ်းၽႂ်းယူႇယဝ်ႉ။
1763	travel	ပီၼိုင်ႈၼၼ်ႉ၊ ၵူၼ်းမႃးလႄႇၼပ်ႉႁူဝ်သိပ်းမၼ်းလႆႈမၢတ်ႇၸဵပ်း ၵွပ်ႈပိူဝ်ႈၶဝ်ဢမ်ႇယူႇႁၢင်ႇၵႆပဵင်းပေႃး။ တူဝ်သတ်းၸိူဝ်းၼႆႉ ၶဝ်ယႂ်ႇ၊ ႁၢႆႉ လႄႈၸၢင်ႈပဵၼ်ၽေးႁၢဝ်ႈႁႅင်း၊ ၵွပ်ႈၼၼ် ႁႂ်ႈယူႇႁၢင်ႇၵႆၵၼ်တင်းၶဝ်ဝႆႉ။
1290	politics	Israel တုၵ်းယွၼ်းႁႂ်ႈလႆႈတင်ႈတပ်ႉၼႂ်းႁူၺ်ႈၼၼ်ႉတႃႇၶၢဝ်းတၢင်းသိပ်းပီ ဝၢႆးသေလူင်းလၢႆးမိုဝ်ႈၼႂ်းလိၵ်ႈႁူမ်ႈမၢႆၼၼ်ႉၵမ်းလဵဝ် ၵူၺ်းၵႃႈထႅင်ႈၽၢႆႇၼိုင်ႈ PA ႁၼ်လီႁႂ်ႈၶဝ်ပၵ်းတပ်ႉလႆႈတႃႇၶၢဝ်းတၢင်းႁႃႈပီၵူၺ်း။
1775	entertainment	ပီႊယႃႊဢၼ်ၸိုဝ်းလိုဝ်းၼႂ်းပိုၼ်ႉတီႈၼၼ်ႉ ပဵၼ်ပီႊယႃႊ ‘Number One’၊ ပီႊယႃႊၼႆႉမၼ်းဢမ်ႇႁဵတ်းႁႂ်ႈသုၵ်ႈသၵ်ႉၸႂ် ၵူၺ်းၵႃႈ မၼ်းႁဵတ်းႁႂ်ႈမူၼ်ႈသိူဝ်းလႄႈၸိုၼ်ႈပၢင်ႇမႃးယူႇယဝ်ႉ။ ပီႊယႃႊဢၼ်မီးၼႂ်းပိုၼ်ႉတီႈ ထႅင်ႈဢၼ်ၼိုင်ႈၼၼ်ႉတႄႉ ႁွင်ႉဝႃႈ ‘Manta’ ၼႆယဝ်ႉ။
642	science/technology	ၵၢၼ်ၸႂ်ႉတိုဝ်းၼႅင်ႈၵၢၼ်ၵူႈမိူင်းမိူင်း (Internet) လႄႈ ၼႅင်ႈယႂ်းတူဝ်ႈလုမ်ႈၾႃႉ (World Wide Web − WWW) ၼၼ်ႉႁဵတ်းႁႂ်ႈၽူႈလဵပ်ႈႁဵၼ်းၶဝ်ၶဝ်ႈထိုင်ၶေႃႈမုၼ်းလႆႈၵူႈၶၢဝ်းယၢမ်း။
