index_id	category	text
1089	science/technology	တီႇဢူဝ်ႇရီႇဢၼ်ၼႆႉလၢတ်ႈဝႃႈ သိင်ႇၶွင်ဢၼ်လပ်းသိုင်ႇသေပိူၼ်ႈႁိမ်းႁွမ်း ၵလႅၵ်ႇသီႇဢၼ်ၼိုင်ႈၼႆႉ မီးႁိမ်းႁွမ်း ၵလႅၵ်ႇသီႇ ဢၼ်မဵဝ်းမီးတူင်ႇဝူင်းလႅင်းဢၼ်မူၼ်းၼၼ်ႉယဝ်ႉ၊ လႄႈ ႁဵတ်းဝႆႉတၢင်းၽွင်လဵၵ်ႉဢွၼ်ႇတၢင်းၼမ်။
984	health	ဢၼ်ၸပ်းတီႈၵူၼ်းသေ လႆႈထုၵ်ႇပွင်ႇၶၢဝ်ႇဝႆႉၼၼ်ႉ မီးၽၢႆႇတႂ်ႈၼိူင်ႈႁဵင်လွင်ႈၵူၺ်း သေတႃႉ ၵမ်ႈၽွင်ၼႂ်းၼၼ်ႉ ၸၢင်ႊပဵၼ်ထိုင်တၢႆလႆႈယူႇယဝ်ႉ။
305	sports	ၽူႈလဵၼ်ႈၵျႃႇပၢၼ်ႇၵျူၻူဝ်ႇ ႁိတူဝ်ႇသျိႉ ၸၢႆးတူဝ်ႇ ဢၼ်လႆႈႁပ်ႉ ၶႅပ်းသူးၶမ်း ဢူဝ်လိမ်းပိၵ်ႇ သွင်ၶႅပ်းၼၼ်ႉ တၢႆၵႂႃႇမိူဝ်ႈဢႃႇယု 54 ၼၼ်ႉယဝ်ႉ။
697	travel	ဝဵင်းၵျေရုသလႅမ် ၼၼ်ႉ မီးတီႈၵိုၵ်းပိုၼ်း၊ တီႈၶူၼ်ႉႁႃၶူဝ်းၵဝ်ႇၶူဝ်းမွၼ် လႄႈ တီႈဢၼ်ၵဵဝ်ႇလူၺ်ႈၾိင်ႈငႄႈၾိင်ႈထုင်း တင်းၼမ်တင်းလၢႆ ၵိုၵ်းလူၺ်ႈ ၵၢတ်ႇလူင်၊ လၢၼ်ႉၵႃးၾႄး လႄႈ လၢၼ်ႉတၢင်းၵိၼ်ယႅမ်ႉ ဢၼ်ၵူၼ်းၼမ်ၵူၼ်းၵိုၼ်း ပေႃးဢမ်ႇထၢတ်ႇဢမ်ႇဝၢႆး ၸိူဝ်းၼၼ်ႉယဝ်ႉ။
826	travel	ပိူင်လူင်မၼ်းတႄႉ ၶဝ်ပဵၼ်မႃးၼႂ်းသွင်မဵဝ်းၼႆႉ လွင်ႈႁဵတ်းၵၢၼ်မိူဝ်ႈၽွင်းသူတိုၵ်ႉဢွၵ်ႇတၢင်း ဢမ်ႇၼၼ် လွင်ႈၶတ်းၸႂ်မၵ်းၶႅၼ်ႈ ၵၢၼ်ၸႂ်ႉတိုဝ်းငိုၼ်းသူ ၼၼ်ႉယဝ်ႉ။ လိၵ်ႈဢၼ်ၼႆႉပဵၼ်ဢၼ်လီၶဝ်ႈၸႂ်သုတ်း တွၼ်ႈတႃႉ တၢင်းလင်ယဝ်ႉ။
1672	health	လႆႈႁူႉၵၼ်မႃးၶၢဝ်းတၢင်းႁိုင်ဝႃႈ သႅၼ်းလွင်ႈလူႉလႅဝ်ဢွၵ်းဢေႃၵူၼ်းၼႆႉ  မၼ်းဢမ်ႇမိူၼ်ၵၼ် ႁွႆး​ၸဵပ်းၸတ်ႉတၢင်းၼႂ်း၊ တၢင်းၸဵပ်းလူၺ်ႈလွင်ႈတုမ်ႉယွၼ်ႈ လႄႈ တၢင်းႁဵတ်းဢၼ်တိူဝ်ႉၼႂ်းဢွၵ်း လႄႈတင်း တၢင်းႁဵတ်းဢၼ်လႅၵ်ႈလၢႆႊ ၵၢၼ်တူင်ႉၼိုင် ပၢႆးၸႂ်ၸိူဝ်းၼၼ်ႉယဝ်ႉ။
536	travel	ပၢင်ႇလၢႆႇ ၊ သူၼ်သိူဝ်းတီႈလႄႇၵျေႃႇ လႄႈ ၼႃႈလိၼ်ဢၼ်လႆႈႁဵတ်းတီႈယူႇသေလိုဝ်ႈသဝ်း ၼၼ်ႉပဵၼ် တီႈဢၼ် ၵူၼ်းလႄႇမိူင်းၸိူဝ်းလႆႈၸႂ်လိုဝ်ႈႁိူဝ်ႉၶဝ် ၵမ်းၵမ်းၵႆႉမႃးလႄႇ ၼႆယဝ်ႉ။
1909	science/technology	ၾူၼ်းပၼ်လွင်ႈႁႂ်ႊၼႂ်းပိုၼ်ႉတီႈသူ ထုၵ်ႇလီပၼ်လႆႈၶေႃႈမုၼ်း လွင်ႈၵပ်းသိုပ်ႇၸူး ၵၢၼ်ႁႂ်ႊဢၼ်ၼႆႉ ၼမ်လိူဝ်ၼႆႉယူႇ။
611	science/technology	ငဝ်းတူင်ႉႁၢင်ႈလူၼ်ႉ (animation) ဢၼ်ႁဵတ်းယၢပ်ႇလႄႈယုင်ႈယၢင်ႈၼၼ်ႉၸၢင်ႈႁဵတ်းဢွၵ်ႇၼႂ်းၶွမ်ႊၽိဝ်ႊတိူဝ်ႊ (computer) လႆႈလႄႈ၊ ၼႂ်းထီးဝီးလႄႈငဝ်းတူင်ႉၶဝ်ၵေႃႈလႆႈၸႂ်ႉငဝ်းႁၢင်ႈလူၼ်ႉၸိူင်ႉၼႆၼမ်ၶိုၼ်ႈမႃးတႄႉတႄႉ။
157	sports	ၼႂ်းပၢင်ၶႄႉၶဵင်ႇၼၼ်ႉ Keselowski တိုၵ်ႉပဵၼ်ၽူႈႁေႃႈၵႃးဢၼ်လူင်ႉလႅၼ်ႇထႅဝ်ၼႃႈယူႇ လူၺ်ႈမၢၵ်ႉဢၼ်လႆႈဝႆႉတႃႇ 2,250 မၢၵ်ႉ။
1294	politics	မိူဝ်ႈဝႃးၼႆႉ Martelly တိူင်ႇၵၢဝ်ႇၵႂၢမ်းသတ်ႉၸႃႇ ၼႂ်းၸုမ်းမႂ်ႇ Provisional Electoral Council (CEP) ဢၼ်မီးၽူႈၶဝ်ႈၸုမ်း 9 ၵေႃႉ။
1803	travel	ထႅင်ႈၽၢႆႇၼိုင်ႈသမ်ႉ သၢႆငၢႆဢၼ်ပဵၼ်ၼမ်ႉၶႅင်လႄႈမူၺ်တူၵ်းၼၼ်ႉ ပဵၼ်ပိူင်ဢၼ်ၵႆႉလႆႈႁၼ်ပဵၼ်ယူႇၼႂ်းလၢႆလၢႆမိူင်း၊ လႄႈသဵၼ်ႈသၢႆတၢင်းလူတ်ႉၵႃးၵေႃႈၵႂႃႇလႆႈငၢႆႈလီတင်းပီႊဢမ်ႇမီးလွင်ႈၶွင်ႉၶမ်သင်။
359	science/technology	"ၸဝ်ႈပၢႆးသၢႆႊၶဝ် လႆႈႁွင်ႉၶၵ်ႉၵၢၼ် ""stimulated emission of radiation""  ၼႆယဝ်ႉ။ ယွၼ်ႉဝႃႈ တုမ်ႇဢွၼ်ႇ atoms ၼၼ်ႉလႆႈပဵၼ်မႃး ပိူဝ်ႈ သၢႆႁိူဝ်ႈလႅင်း ဢၼ်ၸၢင်ႊပဵၼ်မႃး ၵွၼ်း သၢႆလႅင်း photon လႄႈ  သၢႆလႅင်းလႅတ်ႇဢၼ်ထွင်ႇမႃးၼၼ်ႉယဝ်ႉ။"
302	politics	မၢႆမီႈမိူင်းၽရၢင်ႇသဵတ်ႈလႅၵ်ႈလၢႆႈၵႂႃႇယဝ်ႉ။ မိူဝ်မၼ်းၸၢႆးၶဝ်ႈႁူမ်ႈ ၵၢၼ်လုၵ်ႉၽိုၼ်ႉၽရၢင်ႇသဵတ်ႈ ၼႂ်းသိုၵ်းလုမ်ႈၽႃႉ ပွၵ်ႈၵမ်းသွင်ၼၼ်ႉ ၽွင်းၼၼ်ႉဢႃႇသၢၵ်ႈမၼ်းၸၢႆး မီး 15 ၶူပ်ႇ။
455	science/technology	ၼႆႉႁဵတ်းပၼ်ႁႂ်ႈ မၢၼ်ႇၽီလူးၶႂၢၵ်ႈၸမ် ထုၵ်ႈဢွၵ်ႇပၼ်လႆႈၶႅပ်းႁၢင်ႈဢၼ် တၢင်းၶႅမ်ႉမၼ်းတႅၵ်ႈၵၼ်လႆႈၸွမ်း ဢၼ်လႆႈမႃးတီႈ မၢၼ်ႇၽီလူးပိူင်တၢႆဢၼ်ၸၼ်ၵႆၸၼ်ၸမ်ဢမ်ႇလႆႈၼၼ်ႉယဝ်ႉ။
25	sports	လွင်ႈၸွႆႈထႅမ်ဢွၼ်တၢင်းသုတ်းၶွင်ၶမ်ႈၶိုၼ်း ၶွင် ဢူဝ်ႇဝႃႇၶိၼ်ႇ ပဵၼ်ၵူဝ်းဢၼ်ႁဵတ်းႁႂ်ႈ​ပႄႉပၢင်ၶႄႉၶဵင်ႇ လူၺ်ႈ ၼိၵ်ႉၶရတ်ႉပႅၵ်ႉသတွမ်ႇ  ဢၼ်ပဵၼ်ၵူၼ်းမႂ်ႇ။
1606	science/technology	ပၢႆးသၢႆႊၼႂ်းဝၼ်းမိူဝ်ႈလဵဝ်ၼႆႉ ပိူင်းၼႄလွင်ႈ ဢၢႆႊထၢတ်ႈၵွၼ်းဢၼ်ၼႅၼ်ႈၼႃ ၶဝ်ၼႆႉမၼ်းႁေႃႈပႅတ်ႈ ဢွင်ႈတီႈဢၼ်တူဝ်မီးၸႂ်ၸၢင်ႊယူႇသဝ်းသိုပ်ႇၶီး ဢၼ်ပဵၼ်မိူဝ်ႈပူၼ်ႉမႃး မိူဝ်ႈ သွင်သႅၼ်ပီႊၼၼ်ႉယဝ်ႉ။
79	sports	တၢင်းသွင်ၽၢႆႇတေထူပ်းၺႃးၵၼ် တီႈပၢင်ၶႄႉၶဵင်ႇပိူင်လူင် ဢၼ်ပဵၼ်ၸူဝ်ႈပႆႇထိုင်ၵမ်းလိုၼ်းသုတ်းမိူဝ်ႈၸုမ်း Noosa သုမ်းၵႂႃႇ ၵူၼ်းဢၼ်ပႄႉမၼ်းတၢင်း 11 မၢတ်ႈ။
952	travel	ပိၵ်ႉသမ်ႉဝႃႈ သူလွမ်ဝူၼ်ႉဝႃႈ ၵၢၼ်လိူၵ်ႈၶဝ်ႈႁူမ်ႈၸွမ်းသၢႆၵၢၼ်မိၼ်ဢၼ်သူၵႆႉၶီႇသေပိူၼ်ႈၼၼ်ႉ ပဵၼ်တၢင်းလိူၵ်ႈဢၼ်ဢမ်ႇလႆႈဝူၼ်ႉယၢပ်ႇသင်ၼႆသေတႃႉ သူထုၵ်ႇလီဝူၼ်ႉသွၼ်ႇတူၺ်းဝႃႈ သုၼ်ႇလႆႈဢၼ်ၶႅမ်ႉဢၼ်ၶဝ်ပၼ်ဝႆႉၼၼ်ႉ တေၸၢင်ႈၵႆႉပိူင်ႈၵၼ် လႄႈ မၢၵ်ႉဢၼ်ၶဝ်ပၼ်ၵူၼ်းၵႆႉၶီႇႁိူဝ်းမိၼ်ၸွမ်းသၢႆၵၢၼ်မိၼ်တၢင်ႇသၢႆၸိူဝ်းပဵၼ်ဢူၺ်းလီၵၼ်ၼၼ်ႉၵေႃႈလႅပ်ႈတေၼမ်လိူင်ႇလိူဝ်ယူႇၼႆယဝ်ႉ။
995	travel	သၢႆၵၢၼ်မိၼ်ဢၼ်ပၼ်လွင်ႈၸိူဝ်းၼႆႉ ၶဝ်ပႃးသၢႆၵၢၼ်မိၼ် Canada၊ Delta Air Lines၊ Lufthansa တႃႇၵၢၼ်မိၼ်ဢၼ်လုၵ်ႉတီႈ U.S. ဢမ်ႇၼၼ် Canada လႄႈ WestJet ၸိူဝ်းၼၼ်ႉသေမႃးယဝ်ႉ။
266	science/technology	ၵၢၼ်ၵုမ်းၵမ်ၼိူဝ်လိၼ်ၶွင်မိူင်း Russia ၼၼ်ႉတႄႇၸႂ်ႉၵၢၼ်ႁိူဝ်းမိၼ် Jet သေ ႁွင်ႈၵၢၼ်ၵေႃႈလႆႈၶိုၼ်းတႄႇႁဵတ်းသၢင်ႈ ၵၢၼ်ငၢၼ်းၶိုၼ်းယူႇယဝ်ႉ။
112	politics	လွင်ႈတႅတ်းတတ်းသဵၼ်ႈၸႂ်ၶွင် ၸၢႆးရူတ်ႉ တႃႇလူင်းလၢႆးမိုဝ်း လွင်ႈလႆႈၸႂ်ၾိင်ႈၾႃႉၵျူဝ်ႇတူဝ်ႇ ၼၼ်ႉ ႁဵတ်းႁႂ်ႈမိူင်းႁူမ်ႈတုမ်ဢမေႇရိၵႃးယူႇႁင်းၶေႃၶေႃ လွင်ႈၼၼ်ႉမိူဝ်ႈလဵဝ် ႁဵတ်းႁႂ်ႈပဵၼ် မိူင်းၶိုၼ်းယႂ်ႇမိူင်းလဵဝ် ဢၼ်ဢမ်ႇလူင်းလၢႆးမိုဝ်းၼိူဝ်ၶေႃႈလႆႈၸႂ်ယူႇယဝ်ႉ။
1050	politics	ၽိုၼ်ပွင်ႇၶၢဝ်ႇၼၼ်ႉ မၼ်းလွင်ႈယႂ်ႇတေႃႇၵူႈၽၢႆႇၽၢႆႇၶွင်ပေႃႇလသီႇၽူႈပွင်ႈသၢင်ႈၸၼ်ႉသုင်ၶဝ် ဢၼ်မီးတေႃႇ မိူင်းဢီႊရၢၵ်ႉၶ်ၶဝ်ယၢမ်းလဵဝ် လႄႈပၼ်ႁႅင်းဢီးတႃႇႁႂ်ႈမီးလွင်ႈလႅၵ်ႈလၢႆႈၶေႃႈၸီႉသင်ႇၼၼ်ႉၵမ်းလဵဝ်။
1609	travel	ပဵၼ်သင်လႄႈ လၢႆးပိူင်ၵၢၼ်တေႃႉသူင်ႇၼႆႉ ႁဵတ်းႁႂ်ႈပဵၼ် လွင်ႈဢၼ်ဢမ်ႇပဵင်းပေႃးၸႂ်ၸိူင်ႉၼၼ်၊ ပဵၼ်သင်လႄႈၶဝ် တူၵ်းသုမ်းၼိူဝ်ၵၢၼ်ငၢၼ်း ဢၼ်ႁဵတ်းယူႇၵူႈဝၼ်း? ဢမ်ႇၼၼ် ဢိၼ်ႇၵျိၼ်ႇၼီႇယႃႇၽၢႆႇလူင်ႉလႅၼ်ႇလၢႆးပိူင်တေႃႉသူင်ႇၼၼ်ႉ ဢမ်ႇမီးၼမ်ႉၵတ်ႉလႄႈႁႃႉ? ဢမ်ႇၼၼ် ပဵၼ်ဝႆႉလွင်ႈဢၼ်လမ်ႇလွင်ႈလိူဝ်သေၼၼ်ႉႁႃႉ?
1316	sports	ဢူၺ်းၵေႃႉၸိူဝ်းပဵၼ်ၽူႈလဵၼ်ႈမူၺ်းပမ်ႉ (တၢင်းလဵၼ်ႈဢၼ်လႆႈၵၼ်ႉၵၼ်ပဵၼ်လုင်းပဵၼ်လုင်း) ၼၼ်ႉၵေႃႈ လႆႈၽၢၵ်ႇတွၼ်ႈၶေႃႈၵႂၢမ်းထိုင် ‘Luna’ ၸွမ်း။
291	geography	လွင်ႈဢိင်ႇသၼ်ႇ ႁႂ်ႈပေႃးၾၢင်ႉတူဝ်ႁူႉႁၼ်လႆႈၼၼ်ႉ ႁဵတ်းႁႂ်ႈသၢႆငၢႆလႅၵ်ႈလၢႆႈ ဢၼ်ပဵၼ်မိူဝ်ႈလိူၼ် March ဝၼ်းထီႉ 10 တီႈၸဵင်ႇႁွင်ႇဝၼ်းဢွၵ်ႇၶွင် လုၵ်းၸိၵ်းလွႆၾႆးၼၼ်ႉယဝ်ႉ။
1215	travel	လွင်ႈတၢင်ႇလၢတ်ႈမိူဝ်ႈၸဝ်ႉလၢတ်ႈဝႃႈ ႁိူဝ်းမိၼ်လၢႆႈသဵၼ်ႈတၢင်းမၼ်းမိူဝ်းၶိုၼ်းထိုင်မိူင်း Afghanistan ဝၢႆးသေဢမ်ႇလႆႈလွင်ႈတူၵ်းလူင်းတွၼ်ႈတႃႇလူင်းၼႂ်းဝဵင်း Ürümqi ၼၼ်ႉ။
1270	sports	ဝၢႆးသေၶပ်ႉမၢႆပၢင်ၶေႉၶဵင်ႇဝၼ်းပုတ်ႉပူၼ်ႉၵႂႃႇယဝ်ႉ  Carpanedo ယဝ်ႉတူဝ်ႈပၢင်ၶေၶဵင်ႇဢၼ်ၵဵဝ်ႇလူၺ်ႈၵေႃႉလဵဝ် သွင်ပၢင် တီႈၸုမ်းလႆႈဝႆႉၵွၵ်းၵႅဝ်ႈၶဝ်ၼၼ်ႉၼေယဝ်ႉ။
663	entertainment	တီႈမိူင်း San Francisco ၼႆႉပဵၼ်တီႈ ဢၼ်မီး ဝႅပ်ႇယၢင်ႇတၢင်းၵိၼ် ဢၼ်လီတီႈသုတ်း  ၼႂ်းမိူင်းဢေးသျႃးတၢင်ႇမိူင်းၶဝ်၊  မိူၼ်ၼင်ႇမိူင်းၵူဝ်းရီယိူဝ်း၊ မိူင်းထႆး၊ မိူင်းဢိၼ်ႇတီးယႃး၊ လႄႈၵျႃႇပၢၼ်ႇၶဝ်ၸိူဝ်းၼႆႉယဝ်ႉ။
91	politics	Lodin လၢတ်ႈထႅင်ႈဝႃႈ ၽူႈမီးပုၼ်ႈၽွၼ်းၶဝ် လႆႈတႅပ်းတတ်းတႃႇၵိုတ်းပႅတ်ႈပၢင်ၶေႉၶႅင်ႇၵမ်းလိုၼ်းသုတ်း ၼင်ႇႁိုဝ်ၵူၼ်းမိူင်းဢႅပ်ႊၾ်ၵၢၼ်ႇၶဝ်တေဢမ်ႇလႆႈသဵင်ႈ ၵႃႈၸႂ်ႉၸၢႆႇလႄႈမႆႈၸႂ်လွင်ႈႁူမ်ႇလူမ်ႈၶွင်ပၢင်လိူၵ်ႈတင်ႈထႅင်ႈပွၵ်ႈၼိုင်ႈ။
371	science/technology	Triceratops တူဝ်ၼိုင်ႈၼၼ်ႉ ၸၢင်ႈၸႂ်ႉတိုဝ်း ၸုၼ်ႇသူပ်းမၼ်း ဢၼ်ၵႅၼ်ႇၶႅင်ၼၼ်ႉသေ ထုၺ်ပႅတ်ႈမႂ်မၼ်းမူတ်းမူတ်း မိူဝ်ႈၼႃႈပႆႇၵိၼ် တူၼ်ႈလမ်းမၼ်းၼၼ်ႉ။
1806	travel	တူဝ်သတ်းမၢင်မဵဝ်း မိူၼ်ၼင်ႇ ၸၢင်ႉ လႄႈ မႃႉၶေႃးယၢဝ်း ၶတ်းၸႂ်ၶဝ်ႈႁႃၸမ် တီႈမီးၵႃး လႄႈ လၵ်းၸဵင်ဢၼ်ပဵၼ်ၶိူင်ႈ တႃႇတူၺ်းဢွင်ႇသႃႇယႃႇၸိူဝ်းၼၼ်ႉယဝ်ႉ။
930	travel	မိူဝ်ႈၵႂႃႇလႄႇလၢဝ်းသေမိူင်းမိူင်း ၸွမ်းလူၺ်ႈပဵၼ်ၵူၼ်းလႄႇလၢဝ်းမိူင်းၵေႃႉၼိူင်ႈၼၼ်ႉ သူဢမ်ႇလႅပ်ႈလူဝ်ႇဝႂ်ၶႂၢင်ႉၶၢမ်ႈမိူင်း တႃႇလႄႇလၢဝ်းၸူဝ်ႈၵႅပ်ႉ ဢမ်ႇၼၼ် တႃႇၼႃႈၵၢၼ်တႃငၢၼ်းၼႆသေတႃႉ ပေႃးသမ်ႉၵႂႃႇလူၺ်ႈ ပဵၼ်လုၵ်ႈႁဵၼ်းၵူႈမိူင်းမိူင်းတေႉ ၵမ်ႈပႃႈၼမ်ၵႆႉလူဝ်ႇလႆႈယူႇသဝ်းႁိုင်လိူဝ်သေ ၵႂႃႇလႄႇလၢဝ်းမိူင်း ၼင်ႇၵူၼ်းလႄႇမိူင်းသေႇသေႇၶဝ်ဢိူဝ်ႈ။
33	sports	ဝၢႆးသေ ပၢင်ပွႆးၶႄႉၶဵင်ႇႁေႃႈလူတ်ႉ Hungarian Grand Prix 2009 ယဝ်ႉၵႂႃႇၼၼ်ႉ Piquet Jr.  လႆႈထုၵ်ႇပူတ်းဢွၵ်ႇၵၢၼ်ပႅတ်ႈ ယူႇယဝ်ႉ။
0	health	မိူဝ်ႈဝၼ်းၸၼ်ၼၼ်ႉ ၽူႈလူင်ႈလႅၼ်ႇပၢႆးသၢႆႊ တီႈ ၸၼ်ႉၸွမ်သၻႅၼ်ႊၾူတ်ႉ ႁူင်းႁဵၼ်းယႃႈယႃၼၼ်ႉ လႆႈပိုၼ်ၽၢဝ်ႇ လွင်ႈၶူင်သၢင်ႈၶွင်ၶိူင်ႈထတ်းႁႃတၢင်းပဵၼ်ဢၼ်မႂ်ႇ ဢၼ်ၸၢင်ႈဝၢင်းမဵဝ်းသႄးလ် လူၺ်ႈမဵဝ်းမၼ်း - မၼ်းပဵၼ်ၶျိပ်ႉလဵၵ်ႉလဵၵ်ႉဢၼ်ၸၢင်ႈဢိတ်ႇလိၵ်ႈ ဢၼ်ၸၢင်ႈၶူင်ဢွၵ်ႇ လူၺ်ႈၵၢၼ်ၸႂ်ႉတိုဝ်းၸၢၵ်ႈဢိတ်ႇလိၵ်ႈၼမ်ႉမိုၵ်ႉဢၼ်လီပၢၼ်ၵၢင် လႅပ်ႈတေၸၢင်ႈလႆႈမွၵ်ႈ ၼိူင်ႈပႄး U.S (ယူႇဢႅတ်ႉ) တႃႇၼိူင်ႈဢၼ်။
200	geography	ၼႂ်းသႅၼ်းလူမ်းလႅင်ႉလူင်သီႇဢၼ် တီႈ Saffir-Simpson Hurricane Scale ၼၼ်ႉမဵဝ်းၼိူင်ႈဢၼ်ပဵၼ် Felicia ၊ လႆႈႁႅင်းဢူၼ်ႈၵႂႃႇ ပႅတ်ႈသေ လၢႆႊပဵၼ်ၵႂႃႇလူမ်းလႅင်ႉဢၼ်မႆႈ ၵွၼ်ႇပႆႇႁၢႆၵႂႃႇ ၼႂ်းဝၼ်းဢၢင်းၵၢၼ်းၼၼ်ႉယဝ်ႉ။
873	entertainment	ပေႃးသူယိၼ်းႁူႉဝႃႈ ၶႂ်ႈၸၢမ်းတူၺ်းလၢႆးမႂ်ႇၸိုင် ဢဝ်တိုဝ်ႉတၢင်းတႃႇဢိတ်ႇပဵၼ်ၼမ်ႉ ဢမ်ႇၼၼ် ဢိတ်ႇပဵၼ်ဢူၼ်သေ ႁဵတ်းၼမ်ႉမၢၵ်ႇမႆႉတူၺ်းလႄႈ။
774	entertainment	ပၢင်ပွႆးၵၢၼ်ပိုတ်ႇပၢႆးၼႄ ၵၢၼ်ၽုၵ်ႇသွမ်ႈတူၼ်ႈၸွမ်းႁိူၼ်းၼၼ်ႉ ပဵၼ်ပွႆးဢၼ်ၶိုၵ်ႉၶႅမ်ႉလူင်သေ ပၢႆးၼႄ မွၵ်ႇ၊ တူၼ်ႈၵူႈၸိူဝ်းလႄႈ ၶူဝ်းၶွင်ဢၼ်ၵပ်းၵၢႆႇၸွမ်းတူၼ်ႈၵူႈလွင်ႈၼၼ်ႉယဝ်ႉ။
1377	science/technology	ႁဝ်းဢဝ်မႆႉသေ ႁဵတ်းႁိူၼ်းတႃႇႁဝ်းယူႇသဝ်း ယဝ်ႉၵေႃႈဢဝ်တူၼ်ႈမႆႉ ႁဵတ်းသိူဝ်ႈၶူဝ်းတႃႇၼုင်ႈ။ တၢင်းၵိၼ်ဢၼ်ႁဝ်းၵိၼ်ၵမ်ႉၼမ် ပဵၼ်တူၼ်ႈမႆႉတူၼ်ႈတွၵ်ႇ။ ဢမ်ႇမီးတူၼ်ႈမႆႉၼႆႉ တူဝ်သတ်းၶဝ် တေႇဢမ်ႇသိုပ်ႇသၢႆၸႂ်လႆႈ။
203	geography	ၾူၼ်ဢၼ်တူၵ်းမႃးၵမ်ႈၽွင်ႈၼႆႉ မီးပႃးၾႃႉၽႃႇၾႃႉလင်လႄႈၾႃႉမႅပ်ႈၶိူဝ်းၶိူဝ်းယႂ်းယႂ်းမႃးၸွမ်း။
1365	science/technology	သဵင်ႁွင်ႉပၢဝ်ႇသိူဝ်ၼႆႉဢမ်ႇမိူၼ် သဵင်ႁွင်ႉတဵမ်ဢူၵ်းၶွင်သၢင်ႇသီႈ၊ ၵူၺ်းၵႃႈမၼ်းတေငၢႆးမိူၼ် သဵင်ပွင်ႉၶၢင်း၊ သဵင်သႅၼ်ႇႁွင်ႉ ၼၼ်ႉယဝ်ႉ။
1176	sports	မၼ်းပဵၼ်ပၢင်ၶေႉၶဵင်ႇၵမ်းလိုၼ်းသုတ်း တႃႇ All Blacks ၶဝ်၊ ၸိူဝ်းဢၼ်ယၢမ်ႈလႆႈသူးမိူဝ်ႈပူၼ်ႉမႃးသွင်ဝူင်ႈၼၼ်ႉယဝ်ႉ။
879	health	လူင်ပွင်ၸိုင်ႈတင်းၼမ် မီးၵၢင်ၸ်ႂ တႃႇႁ်ႂႈ ၶႅၵ်ႇၸိူဝ်းၶဝ်ႈမႃး ဢမ်ႇၼၼ် ၵူၼ်းၼ်ႂးမိူင်းၸိူဝ်းဢွၵ်ႇၼွၵ်ႈမိူင်းၶဝ် သမ်းယႃႈယႃႁႄႉၵင်ႈ တၢင်းပဵၼ်ၸိူဝ်းၵပ်းတၢမ်းၵၼ်ၼၼ်ႉ။
110	science/technology	Stardust တေၸတ်းပၢင်မၢႆတွင်းဢၼ်မႂ်ႇတႃႇၵူႊၶၢဝ်းယၢမ်း တႃႇႁိူဝ်းမိၼ်ၼွၵ်ႈလူၵ်ႈ ဢၼ်ဝႆးတီႈသုတ်း ဢၼ်တေလူင်းမႃးၸူးလူၵ်ႈလုမ်ႈၾႃႉၶိုၼ်း ၊ ဢၼ်ၼႆႉပူၼ်ႉပႅတ်ႈ လွင်ႈမၢႇတွင်းဢွၼ်တၢင်းၼႆႉ ဢၼ်ၸတ်းမႃးမိူဝ်ႈ လိူၼ် May ၼႂ်းပီႊ 1969 မိူဝ်ႈပွၵ်ႈၶိုၼ်းမႃးလူၺ်ႈ ၵၢၼ်သင်ႇ Apollo X ယူႇယဝ်ႉ။
1494	science/technology	ၵၢၼ်ႁႆႈၵၢၼ်သူၼ်တႃႇလဵင်ႉၼႃႈႁိူၼ်းၸဝ်ႈၵဝ်ႇၼၼ်ႉပဵၼ်လွၵ်းလၢႆးဢၼ်ငၢႆႈ၊ ၵမ်ႈၼမ်ဢမ်ႇၸႂ်ႉယႃႈယႃၶႃႈမူင်ႈမႅင်းလႄႈၽုၼ်ႇထၢတ်ႈသင်၊ ၵူၺ်းၸႂ်ႉလွၵ်းလၢႆးၵဵပ်းၸိူဝ်ႉၽၼ်းဢၼ်ၶႅမ်ႉလႄႈမႅၼ်ႈၸွမ်းသၽႃႇဝမၼ်းဝႆႉ လႄႈၸႂ်ႉလွၵ်းလၢႆးၵၢၼ်ၽုၵ်ႇသွမ်ႈမဵဝ်းဢၼ်ပၼ်ႇပုတ်ႈမၢၵ်ႇၶဝ်ႈတဝ်ႈၼမ်ႉတႃႇတေၽုၵ်ႇသွမ်ႈ၊ ဢမ်ႇၼၼ် ၸႂ်ႉလွၵ်းလၢႆးယူဝ်းယူဝ်းတႃႇတေႁဵတ်းႁႂ်ႈမၢၵ်ႇၶဝ်ႈတဝ်ႈၼမ်ႉၼမ်ၵိုၼ်းမႃး။
1086	science/technology	ၽွၼ်းတုမ်ႉယွၼ်ႈဢၼ်ၸုမ်းၽူႈလူင်ႉလႅၼ်ႇၶဝ်တိုၵ်ႉသွၵ်ႈႁႃယူႇၼၼ်ႉၸၢင်ႈပဵၼ်လႆႈဝႃႈ မၼ်းပဵၼ်မႃးယွၼ်ႉႁႅင်းၼမ်ႉၶိုၼ်ႈၼမ်ႉလူင်းၼႂ်းၵႄႈၵၢင် galaxy's dark matter လႄႈ Milky Way’s dark matter။
1623	geography	မႄႈၼမ်ႉဢမေႊသွၼ်ႊ (The Amazon) ၼႆႉ တၢင်းၵႂၢင်ႈမီးႁူၵ်းလၵ်း (mile) လႄႈမၼ်းပဵၼ်မႄႈၼမ်ႉဢၼ်ၵႂၢင်ႈလိူဝ်သေပိူၼ်ႈသုတ်းၼႂ်းလုမ်ႈၾႃႉၼႆႉ။
1222	entertainment	ဝူင်းႁႆႇတိုင်ႈၽဵင်းၵႂၢမ်းရွၵ်ႉၶ်ၶဝ်လႆႈဢွၵ်ႇၶၢဝ်းတၢင်းဢႅဝ်ႇ မိူင်းႁူမ်ႈတုမ်ဢမေရိၵႃႊ ႄလႈ မိူင်းႄၶၼႃၻႃႊ ေတႃႇထိုင် September 16။
1357	science/technology	ၵမ်းလိုၼ်းသုတ်းၵေႃႈ ၶိူဝ်းမႅဝ်းတူဝ်လဵၵ်ႉၵေႃႈ မီးမႃးတင်းၼမ် (ၶဝ်ႈပႃးတင်း မႅဝ်းလဵင်ႉ) ဢၼ်ၵၼ်လႆႈတူဝ်ထိူၼ်ႇလဵၵ်ႉၼမ်သေၼၼ်ႉတႄႉတႄႉ မိူၼ်ၼင်ႇ မႅင်း၊ ၼူ၊ ဢၢၵ်ႇၶၢင် လႄႈ ၼူၵ်ႉ ၸိူဝ်းၼႆႉယဝ်ႉ။
