index_id	category	text
1100	science/technology	የሳይንስ ሊቃውንት በግጭቱ ምክንያት የተፈጠረው ፍንዳታ ከፍተኛ እንደነበር ይናገራሉ።
367	science/technology	ደም አርተሪ በሚባሉ ትቦዎች ከልብ ይወጣል እና ቬን በሚባሉ ትቦዎች ወደ ልብ ይመለሳል። ትንንሾቹ ትቦዎች ካፒላሪ ይባላሉ።
770	entertainment	አብዛኛው በቤተመቅደስ የሚከበረው ፌስቲቫል እንደ ቤተ መቅደሱ እዩ በልዩ ወይም የአምላክ ልደት ወይም ሌላ ከቤተ መቅደሱ ጋር የሚገናኝ ትልቅ በዓል አካል ነው።
279	politics	ፍሎሪዳ አሸናፊ-ሁሉንም ይወስዳል ብላ እንደምታስብ ግዛት ሁሉንም ሃምሳ ልዑካኖቹዋን ለሮኒኒ ሰጠቻቸው፣ ይህ የሪፐብሊካን ፓርቲ ዋና ዕጩ እንዲሆን አድርጎታል።
357	science/technology	ወደ ቀደመው የኃይል ደረጃቸው ለመመለስ ከብርሃን ያገኙትን ተጨማሪ ኃይል ማስወገድ አለባቸው።
797	science/technology	ላፕቶፕ ወይም ታብሌት ይዘው የሚጓዙ ከሆነ፣ ቅጂውን በሜሞሪው ወይም በዲስኩ ውስጥ ያስቀምጡ (ያለ ኢንተርኔት የሚገኝ)።
211	health	ምንም ዓይነት ከባድ ጉዳት አልተመዘገበም፣ ነገር ግን በፍንዳታው ወቅት በቦታው የተገኙ ቢያንስ አምስት ሰዎች የድንጋጤ ምልክቶች ሕክምና ወስደዋል።
815	travel	በአለምአቀፍ ደረጃ፣ 200 የሚጠጉ በስራ ላይ ያሉ አስጎብኚ ድርጅቶች አሉ። ብዙዎቹ ብቻቸውን ነው የሚንቀሳቀሱት።
238	geography	እኛ እስከምናውቀው ድረስ ከታይታን የበለጠ ተለዋዋጭነትን የሚያሳየው አንድ የፕላኔቶች አካል ብቻ ነው ስሙም ምድር ነው ሲል አክሏል ስቶፋን።
1636	science/technology	እንደ ካልሲየም እና ፖታሲየም ያሉ ንጥረ ነገሮች እንደ ብረቶች ይቆጠራሉ። በእርግጥ እንደ ብር እና ወርቅ ያሉ ብረቶችም አሉ።
761	travel	የሚገኙ ተቀባዮች ዝርዝር ተጓዦችች ማጣቀሻዎች እና ግምገማዎች ጋር ታትሞ ወይም መስመር ላይ ይገኛል።
1676	science/technology	በ AI ውስጥ የሚደረግ ምርምር ብልህ ባህሪን የሚጠይቁ ስራዎችን በራስ-ሰር ለማከናወን ማሽኖችን መስራትን ያካትታል።
848	entertainment	በአውስትራሊያ ውስጥ የሚገኙት አብዛኛዎቹ ተወርዋሪ የእንጨት ጦሮች (boomerangs) በእርግጥም ተመልሰው የማይመጡ ናቸው። ስለዚህም ለጀማሪዎች የሚመከረው በነፋሻማ ቀን መወርወሩን እንዳይሞክሩት ነው።
1089	science/technology	ይህ ንድፈ-ሀሳብ በጋላክሲ ዙሪያ ያለው አብዛኛው የጨለማ ቁስ በጋላክሲው ዙሪያ በአንድ ሃሎ ውስጥ የሚገኝ ሲሆን ከብዙ ትናንሽ ቅንጣቶች የተሠራ ነው ይላል።
984	health	በሰው ልጆች ውስጥ ከመቶ ሺህ ያነሱ ጉዳዮች ሪፖርት የተደረጉ ሲሆን የተወሰኑት ግን ለሞት የተጋለጡ ናቸው።
305	sports	በሁለት የክረምት ኦሎምፒክ ጨዋታዎች ላይ የወርቅ ሜዳልያ ያሸነፈው፣ ጃፓናዊው judoka Hitoshi Saito፣ በ54 አመቱ ሞቷል።
697	travel	ኢየሩሳሌም ብዙ ታሪካዊ፣ አርኪኦሎጂካዊ ፣ ባህላዊ ቦታዎች ከንቁ እና ከተጨናነቁ የመሸጫ መዓከላት፣ካ ፌዎች እና ሬስቶራንቶች አሏት።
826	travel	በመሠረቱ በሁለት ዓይነቶች ውስጥ ይወድቃሉ፡- በሚጓዙበት ጊዜ መሥራት ወይም ወጪዎን ለመገደብ ይረዱ። ይህ ጽሑፍ በኋለኛው ላይ ያተኮረ ነው።
1672	health	የተለያዩ የአንጎል ጉዳት ዓይነቶች ፣ የስሜት ቁስሎች፣ ቁስሎች እና የውስጥ እብጠቶች በባህሪ ላይ ተጽዕኖ እንደሚያሳድሩ እና በአንዳንድ የአእምሮ ተግባራት ላይ ለውጥ እንደሚያመጡ ከረዥም ጊዜ ጀምሮ ይታወቃል።
536	travel	የባህር ዳርቻዎች፣ መጫወቻ ፓርኮች እና የካምፕ ምድሮች በሚዝናኑ ቱሪስቶች የሚዘወተሩ የተለመዱ ቦታዎች ናቸው።
1909	science/technology	የአከባቢዎ የስልክ አገልግሎት አቅራቢ ወደዚህ አገልግሎት ስለ ማገናኘት ተጨማሪ መረጃ ለመስጠት መቻል አለበት።
611	science/technology	የተወሳሰበ animations በኮንፒውተርስ ሊዋቀሩ የሚችሉ ሲሆን ይህን የመሰለው animations በቴሌቭዥንና በፊልም ላይ በስፋት አገልግሎት ላይ እየዋለ ነው።
157	sports	ውድድሩን ተከትሎ ፣ ካሰሎውስኪ 2,250 ነጥብ ያለው የነጂዎች ውድድር መሪ ነው።
1294	politics	ማርቴሊ ዘጠኝ አባላት ባሉት አዲስ የሽግግር ምርጫ ምክር ቤት (ሲኢፒ) ውስጥ ቃል ገብቷል።
1803	travel	በሌላ በኩል በብዙ ሃገራት በረዷማና በረዷማ ሁኔታዎች የተለመዱ ናቸው፣ እና ትራፊክ ባብዛኛው አመቱን ሙሉ ሳይቋረጥ ይቀጥላል።
359	science/technology	"የሳይንስ ሊቃውንት ይህ ሂደት ""የተነቃቃ የጨረር ልቀት"" በማለት ይጠሩታል ምክንያቱም አተሞች በብርሃን ስለሚነቃቁ እና የፎቶን ብርሃን ልቀትን ስለሚያስከትሉ፣ እና ብርሃን የጨረራ ዓይነት ነው፡፡"
302	politics	የፈረንሳይ ህግ ተቀየረ። የእርሱ አነሳሽነት የተጀመረው፤ 15 አመቱ እያለ በሁለተኛው የአለም ጦርነት ጊዜ የፈረንሳይን ተቃውሞ ከተቀላቀለ በኃላ ነው።
455	science/technology	ሌንስ አምራቾች በሌንስ ምርት ከፍ ያሉ ደረጃዎችን ሲያሳኩ ይህ አሳሳቢ መሆኑ እየቀረ ነው።
25	sports	የኦቨቺኪን የምሽቱን የመጀመሪያ ማቀበል በሮኪ ኒከላስ ባክስትሮም የጨዋታ አሸናፊ ግብ ላይ ነበር።
1606	science/technology	ሳይንስ አሁን እንደሚያመለክትው ይህ ግዙፍ የካርቦን ኢኮኖሚ ላለፉት ሁለት ሚሊዮን ዓመታት የሰውን ልጅ ዝግመተ ለውጥ ከደገፈው የተረጋጋ ሁኔታ ባዮስፌርን እንዳነቃነቀው ያሳያል።
79	sports	ሁለቱ ወገኖች ኖሳ በ11 ነጥብ ከአሸናፊዎች የወጣችበት የዋናው የግማሽ ፍፃሜ ላይ ይገናኛሉ።
952	travel	ምንም እንኳን እርስዎ በጣም ከሚበሩበት አየር መንገድ ጋር መቀላቀል አስተዋይነት ነው ብለው የሚያስቡ ቢሆኑም ፣ የሚሰጡት መብቶች ብዙውን ጊዜ የተለያዩ እንደሆኑ እና በተደጋጋሚ በረራ ማድረግች በተመሳሳይ ህብረት ውስጥ በሌላ አየር መንገድ የበለጠ የተሻለ እንደሚሆኑ ማወቅ ይኖርብዎታል።
995	travel	ከዩናይትድ ስቴትስ ወይም ከካናዳ እና ከዌስትጄት ለሚነሱ በረራዎች እነዚህን የሚያቀርቡ አየር መንገዶች ኤይር ካናዳ፣ ዴልታ ኤይር ላይንስ፣ ሉፍታንዛን ያካትታሉ።
266	science/technology	የሩሲያ የምድር ተቆጣጣሪ ጀቶችን በማስነሳቱ መደበኛ የጣቢያው ሁኔታ በድጋሚ ተመልሷል።
112	politics	የኮይቶን አየር ንብረት ስምምነት ለመፈረም የአቶ ሩድ የወሰነው ውሳኔ ዩናይትድ ስቴትስን ያገላል፣ እናም ካደጉ ሀገራት ውስጥ ይሄንን ስምምነት የማታጸድቅ ብቸኛ ሀገር ትሆናለች።
1050	politics	ሪፖርቱ ለአስፈፃሚው ወደ ኢራቅ ያለው የአሁኑ የአስፈፃሚ ፖሊሲ አቅጣጫ በሁሉም አኳያ ላይ በጣም ወሳኝ ነው እናም በአፋጣኝ አቅጣጫ እንዲለወጥ አሳስቧል።
1609	travel	የትራንስፖርት ስርዓቶች ለምን እንደዚህ አይነት ቅሬታዎች ያመጣሉ ፣ ለምን በየቀኑ ሳይሳካላቸው ይቀራል? የትራንስፖርት መሐንዲሶች በቃ ብቃት የላቸውም ማለት ነው? ወይም የበለጠ መሠረታዊ የሆነ ነገር እየተካሄደ ነው?
1316	sports	አብረዋት የሚሠሩ ታጋዮችም ለሉና ሃዘናቸውን ገለጹ፡፡
291	geography	በማርች 10 ላይ የወቅት ለውጥ ያስከተለ የተወሰነ የመሬት መንቀጥቀጥ ከእሳተ ገሞራው ሰርጎ ገብ በሰሜን ምሥራቅ በኩል ተከስቷል።
1215	travel	የመጀመሪያዎቹ ዘገባዎች አውሮፕላኑ በኡሩምቂ የድንገተኛ ጊዜ ማረፍ ከተከለከለ በኋላ ወደ አፍጋኒስታን ተመልሷል ይላሉ።
1270	sports	ከረቡዕ ዝግጅት ባሻገር፣ ካርፓኔዶ በሻምፒዮንሺፕ በሁለት የግል ውድድሮች ላይ ተወዳድሯል።
663	entertainment	በተጨማሪም ሳን ፍራንሲስኮ ልዩ የእስያ ምግቦች ከሚገኙባቸ ምርጥ ስፍራዎች ውስጥ አንዱ ነው - የኮሪያ፣ የታይ፣ የህንድ እና የጃፓን።
91	politics	ሎዲን ባለሥልጣናት አፍጋኖችን ሌላ ምርጫ ከሚያስከትለው ኪሳራ እና የፀጥታ ስጋት ለማዳን ሲሉ ሁለተኛውን ዙር ለመሰረዝ ወስነዋል ብለዋል።
371	science/technology	ትራሴራቶፖች ግንድላውን ከመብላቱ በፊት ቅጠሎቹን በኃይለኛ መንቁሩ በሙሉ ለማንጠፍ ይችል ነበር።
1806	travel	እንደ ዝሆኖች እና ቀጭኔዎች ያሉ አንዳንድ እንስሳት ወደ መኪናዎች የመቅረብ ዝንባሌ አላቸው ስለዚህ መደበኛ መሣሪያዎች ጥሩ እይታን ያስገኛሉ።
930	travel	ምንም እንኳን እንደ ቱሪስት ወይም ለቢዝነስ በተወሰኑ ሀገሮች ለአጭር የጉብኝት ቪዛ ባያስፈልግዎትም ፣ በአጠቃላይ እንደ ዓለም አቀፍ ተማሪ ወደዚያ መሄድ፣ ልክ እንደ ተራ ቱሪስቶች ወደዚያ ከመሄድ የበለጠ ረዘም ላለ ጊዜ መቆየትን ይጠይቃል።
33	sports	ፒኬ ጁንየር ከ2009ኙ ግራንድ ፕሪክስ በኋላ ተባሯል።
0	health	ሰኞ እለት፣ በስታንፎርድ ዩኒቨርሲቲ የህክምና ትምህርት ቤት ህዋሶችን በአይነት የሚያስቀምጥ አዲስ የምርመራ መሳሪያ እንደተፈጠረ አስታውቋል፡ እያንዳንዱን በአንደ የዩ.ኤስ ሳንቲም የሚሆን መደበኛ የኢንክጄት አታሚዎችን በመጠቀም ሊፈበረክ የሚችል ትንሽ መታተም የሚችል ቺፕ።
200	geography	ፌሊሺያ፣ አንዴ በሳፊር-ሲምፕሰን የአውሎ ንፋስ መለኪያ ላይ ምድብ 4 የሆነ ሀይለኛ ንፋስ የቀላቀለ ዝናብ ማክሰኞ ከመሠራጨቱ በፊት ወደ አንስተኛ ግፊት ወዳለው ንፋስ ተዳከመ።
873	entertainment	የበለጠ ጀብዱ የሚሰማዎት ከሆነ በአጋጣሚው ጭማቂ ለመጠጣት ወይም ጥቂት ማቀዝቀዣ የፍራፍሬ ጭማቂዎችን ለመጭመቅ ይሞክሩ-
774	entertainment	International Horticultural Expositions የአበባ አውደ ራዕይ ፣ botanical የአትክልት ስፍራ እና ማንኛውም ከአትክልቶች ጋር የተያያዘ ነገር በተለየ ሁኔታየሚቀርብበት ትዕይንት ነው።
1377	science/technology	ቤቶቻችንን ከእጽዋት እናደርጋለን እንዲሁም ከእጽዋት ልብሶችን እንሰራለን። የምንበላቸው አብዛኛዎቹ ምግቦች እፅዋቶች ናቸው። ያለ ዕፅዋት እንስሳት መኖር አይችሉም።
203	geography	አንዳንዱ ዝናብ በነጎድጓዶች እና ተደጋጋሚ መብረቆች የታጀበ ነበር።
1365	science/technology	የነብር ጩኸት እንደ አንበሳ የሙሉ ድምፅ ጩኸት አይደለም፣ ግን የበለጠ እንደ አረፍተ ነገር ጫጫታ እና ጩኸት ቃላቶች ነው፡፡
1176	sports	ከሁለት ሳምንት በፊት ዋንጫ ለበሉት ኦል ብላክስ ይሄ የመጨረሻ ውድድር ነበር።
879	health	በርካታ መንግስታት ጎብኚዎች ወደ ሀገራቸው ሲገቡ፣ አሊያም ነዋሪዎች ከሀገራቸው ሲወጡ፣ ለተለያዩ አይነት በሽታዎች ክትባት እንዲከተቡ ይጠይቃሉ።
110	science/technology	ስታርደስት፣ በግንቦት ወር 1969 የአፖሎ ኤክስ የማዘዣ ሞጁል በሚመለስበት ጊዜ የተያዘውን የቀድሞ ክብረ ወሰን በመስበር አዲስ የሁልጊዜም ክብረ ወሰን ታስመዘግባለች።
1494	science/technology	የራስን ኑሮ ለመምራት የሚደረግ እርሻ ቀላል ፣ ብዙውን ጊዜ ኦርጋኒክ ፣ ለሥነ-ምህዳሩ ተወላጅ የሆነውን የተቀመጠ ዘርን በመጠቀም ምርትን ከፍ ለማድረግ ከሰብል ማሽከርከር ወይም ከሌሎች በአንፃራዊነት ቀላል ቴክኒኮች ጋር በማቀላቀል የሚደረግ ቀላል ስርዓት ነው።
1086	science/technology	ቡድኑ እየፈለገው የነበረው ተፅዕኖ በጋላክሲው ምስጢራዊ ቁስ አካል እና የሚልኪ ዌይ ምስጢራዊ ቁስ አካል መካከል ባሉ የታይድ ኃይሎች የሚከሰት ነው።
1623	geography	በተጨማሪም አማዞን በምድር ላይ እጅግ በጣም ሰፊ ወንዝ ነው፣ አንዳንዴ ስድስት ማይሎች ሰፊ ይሆናል።
1222	entertainment	የሮክ ባንዱ እስከ ሴፕቴምበር 16 ድረስ ዩናይትድ ስቴትስ እና ካናዳን ለመጎብኘት ቀጠሮ ነበረው።
1357	science/technology	በመጨረሻም ፣ እንደ ነፍሳት ፣ አይጥ ፣ እንሽላሊቶች እና ወፎች ያሉ እጅግ በጣም ብዙ ትናንሽ እንስሳትን የሚበሉ ብዙ ትናንሽ ድመቶች አሉ (ልቅ የሆኑ የቤት እንስሳት ድመቶችን ጨምሮ)።
216	sports	ስኳሽ፣ ካራቴ እና ሮለር ስፖርቶች እንዲሁም በ 2005 ከኦሎምፒክ ውድድሮች ተመርጠው የወጡት ቤዝ ቦል እና ሶፍት ቦል ወደ ኦሊምፒክ መርሃ ግብሮች ለመግባት ሞክረዋል።
327	sports	በክሮኤሺያ ዋና ከተማ ተወልዶ፣ ዛግሪብ፣ ቦቤክ ለፓርቲዛን ቤልግሬድ ሲጫወት ታዋቂነትን አተረፈ።
277	politics	የቀድሞው የማሳቹሴትስ ገዢ ሚት ሮምኒ የፍሎሪዳ ሪፐብሊካን ፓርቲን ፕሬዝዳንታዊ የመጀመሪያ ምርጫን ከ46 ፐርሰንት በላይ ድምፅ አግኝቶ ሰኞ እለት አሸነፈ።
428	geography	የቱርክ ግዛት ከ 1,600 ኪ.ሜ በላይ (1,000 ማይል) በላይ እና 800 ኪ.ሜ (500 ማይል) ስፋት አለው ፣ በግምት አራት ማዕዘን ቅርፅ አለው።
1709	travel	ጎማ በኮንጎ ዲሞክራቲክ ሪፐብሊክ ምስራቅ ጫፍ ሩዋንዳ አቅራቢያ የምትገኝ የቱሪስት ከተማ ናት።
565	health	በመደበኛ እንቅስቃሴ የሚሳተፉ ሰዎች ሕመምን አሉታዊ በሆነ መንገድ በመገንዘብ ረገድ እገዛ የሚያስፈልጋቸው ሲሆን ይህም ለረጅም ጊዜ በቆየ ሕመምና ያለመመቸት ስሜትና በተለምዶ የአካል እንቅስቃሴ መካከል ያለውን ልዩነት ለመለየት ያስችላቸዋል።
742	travel	ቢያንስም አንዳንድ እድሜያቸው የገፋ የሁዋዪ ጎብኚዎችን የመንግስት ንብረት ከመሆኑ በፊት ከትልልቅ የቱሪስት ሆቴሎች እና ሌሎች ልማቶች በፊት የነበረውን ያስታውሳቸዋል።
531	sports	በመደበኛ ዙር ወቅት አስራ ስምንት ቀዳዳዎች ይጫወታሉ ፣ ተጫዋቾች ብዙውን ጊዜ በመጀመርያው ቀዳዳ ላይ በመጀመር በአሥራ ስምንተኛው ይጠናቀቃሉ።
729	travel	የBowen Island ታዋቂ የቀን ጉዞ ወይም የሳምንት መጨረሻ መዝናኛ ሲሆን ካያኪንግ፣ሀይኪንግ ፣ሱቆች ሆቴሎች እና ሌሎች መዳረሻዎች አሉት።
1427	science/technology	ለምሳሌ ፣ በዓለም ላይ በጣም የተለመደው አሁንም የምስል ፎቶግራፍ ቅርጸት 35 ሚሜ ነው፣ ይህ በአናሎግ የፊልም ዘመን ማብቂያ ላይ ዋነኛው የፊልም መጠን የነበረ ነው።
865	health	በቀዝቃዛ የአየር ንብረቶች ውስጥ ያሉ የመተንፈሻ አካላት ችግሮች፣ በሞቃታማ የአየር ንብረቶች ውስጥ ያሉ የሆድ ችግሮች በመጠኑ የተለመዱና በአብዛኛዎቹ ጊዜም በተለየ ሁኔታ የሚረብሹ ቢሆኑም አደገኛ ግን አይደሉም።
205	travel	ከሁለተኛ ሙከራው ወደ መሬት ከማረፉ ከአስር ደቂቃዎች በፊት ተሰወረ።
374	science/technology	በምድር ላይ 200 ፓውንድ (90kg) የሚመዝን ሰው በ IO ላይ ወደ 36 ፓውንድ (16 ኪሎ ግራም) ይመዝናል። ስለዚህ የስበት ኃይል በእርግጥ በእናንተ ላይ ያንሳል።
275	politics	በተወካዩ ክሊፍ ስተርንስ እየተካሄደ ያለውን የታቀደ ወላጅነት እንዴት ገንዘቡን እንደሚያወጣ እና ሪፖርት ማድረግ እንዳለበት በመጠባበቅ ላይ ባለ ምርመራ ምክንያት የኮሜን ፖሊሲ የታቀደ ወላጅነትን ሰረዘ፡፡
1991	travel	የውሃ የውስጥ መንገዶች በዓሉን መሠረት ለማድረግ ጥሩ ገጽታ ይሆናሉ።
349	science/technology	ሳይንቲስቶች በተመሳሳይ መንገድ ኃይል ሊያመነጭ የሚችል ሬአክተር ለመፍጠር እየሰሩ ነው።
1325	science/technology	በማዕከላዊ ሚዙሪ ዩኒቨርሲቲ የሂሳብ ሊቅ እና የኮምፒተር ሳይንስ ፕሮፌሰር የሆኑት ከርቲስ ኩፐር፣ እስከ ጃንዋሪ 25 ቀን ድረስ ትልቁን የብቸኜ ቁጥር አግኝተዋል።
1854	travel	አውሮፓ በአንፃሩ አነስተኛ አህጉር ብትሆንም ብዙ እራሳቸውን የቻሉ ሀገራት አሏት። በመደበኛ ሁኔታዎች በተለያዩ ሀገራት መጓዝ ማለት፤ በቪዛ ማመልከቻዎች እና በፖስፖርት ቁጥጥር ብዙ ጊዜ ማለፍ አለብዎት ማለት ነው።
946	geography	የነጭ ባሕር – ባልቲክ ቦይ የአርክቲክ ውቅያኖስን ከባልቲክ ባሕር ጋር ያገናኛል ፣ በኦኔጋ ሐይቅ ፣ በላዶጋ ሐይቅ እና በሴንት ፒተርስበርግ ፣ በአብዛኛው በወንዞች እና በሐይቆች በኩል።
182	politics	"""ሕጉ በተቻለ ፍጥነት እንዲተገበር አሁን ከህዝብ ጤና እና ከወንጀል ፍትህ አንፃር ጠቃሚ ነው ብለዋል የመንግሥት ቃል አቀባይ፡፡ """
1288	politics	ሰነዱ ፣ ሾልኮ በወጣው መረጃ መሠረት ማለት ነው፣ ፍልስጤም ከ 1967 የመካከለኛ ምስራቅ ጦርነት በፊት በጠረፍ ላይ ተመስርታ የምትፈልገውን የድንበር ውዝግብ የሚያመለክት ነው።
1639	science/technology	አቶሞች በጣም ትንሽ ከመሆናቸው የተነሳ ትሪሊየን የሚሆኑት በዚህ አረፍተነገር መጨረሻ ላይ ያለ ነጥብ ውስጥ መግባት ይችላሉ።
69	entertainment	በ9,000 ሰዎች እንዲሳተፍ በተደረገው በማዊድ ጦርነት የመታሰቢያ ስታዲየሙ ላይ ትርዒቱን በመሰረዙ አድናቂዎቹን ይቅርታ ጠይቋል።
12	sports	በብሪስቤን ኦፕን ውስጥ በሮአኒክ በቅርቡ ተሽንፏል።
508	health	"የትኩረት ጉድለት ህመም ""ስሜትን መረበሽ፣ ትኩረትን የሚወስድ እና ጤናማ ያልሆነ ኃይልን ወይም ከፍተኛ ኃይል የሚጨምር ምልክቶችን የሚያሳዩ የሚታወቅ የነርቭ በሽታ ነው""።"
1794	travel	በክረምት ወቅት ሰሜናዊውን ባልቲክን የሚያቋርጡ ከሆነ፤ በበረዶ ውስጥ መጓዝ በጣም ለተጎዱት በጣም አሰቃቂ ድምጽ ስለሚያስከትል የክፍል አቀማመጡን ያረጋግጡ፡፡
667	entertainment	እንደ ኢቤይ(eBay) ወይም ክሬግስሊስት(Craigslist) ባሉ የጨረታ ድር ጣቢያዎች በመስመር ላይ የሚሸጡ ብዙ ቲኬቶች በከፊል የብዙ ቀን ፓርክ-ሆፕ ቲኬቶች ናቸው።
127	entertainment	ብዙዎቹ ጸሐፊዎቻቸው በጆን እስታርት እና እስጢፋኖስ ኮልበርት ዜና አስቂኝ ትርኢቶች ላይ ከፍተኛ ተጽዕኖ ማሳደራቸውን ቀጥለዋል።
1236	sports	ጂያንካርሎ ፊሲቼላ መኪናውን መቆጣጠር አቅቶት ገና ከጅምሩ ውድድሩን አቋረጠ።
160	sports	በውድድሩ አራት ወቅቶችች የቀሩ ሲሆን ስቲዋርት፣ ጎርደን፣ ኬንሴዝ እና ሃርቪክ ለአሽከርካሪዎች ሻምፒዮና አሸናፊ የሚሆኑ አስር ቦታዎችን ይዘዋል።
1732	geography	ሰንዳርባን 3,850 ኪ.ሜ² ፣ ስፋት ይይዛል፣ ከዚህም አንድ-ሦስተኛው በውሃ/በረግረግማ ስፍራዎች የተሸፈነ ነው።
1940	geography	አንዴ በስምይርና ጥንታዊ ከተማ አሁን ዘመናዊ ከተማ የሆነው፣ ያደገ እና የተጨናነቀ የንግድ ቦታ ነው፤ በተራሮች የተከበበ ትልቅ ባሕረ ሰላጤ ነበረ።
37	entertainment	PBS ፕሮግራም ከሁለት ደርዘን በላይ የኤሚ ሽልማቶች አሉት፣ እና የታየበት ጊዜ ከሴሰሚ ስትሪት እና የሚስተር ሮጀርስ ኔይበርሁድ ይልቅ ያነሰ ነው።
726	entertainment	የአትክልት ስፍራውን የሚከቡ በርካታ ሬስቶራንቶች አሉ እናም ከሰዓት እና ማታ ላይ መሃል ላይ ካለው ትንሹ ጎጆ ውስጥ ነጻ ኮንሰርቶች በአብዛኛው ይኖራሉ።
1507	science/technology	ማጠቃለያ ምናባዊም እውነተኛም ሊሆኑ ይችላሉ በሌላ አገላለጽ አስተማሪ ልክ ማይክሮሶፍት ኦፊስ ላይ ወረቀት እንደሚያያይዝ ትንሹ ሰው አንድ የማጠቃለያ መንገድ ነው፡፡
1318	sports	ደስቲን “ጎልደስት” ረነልስ በሰጡት አስተያየት “ሉና እንደ እኔ በጣም እብድ ነበረች… ምናልባት ከኔ የበለጠ… እወዳታለሁ እና ትናፍቀኛለች… በተሻለው ቦታ እንደምትኖር ተስፋ አለን።”
379	science/technology	ደረጃዎች የሚከሰቱት ፀሐይን የሚመለከተው የቬነስ (ወይም የጨረቃ) ጎን ብቻ ስለሆነ ነው። የቬነስ ደረጃዎች ፕላኔቶች በፀሐይ ዙሪያ እንደሚዞሩ የኮፐርኒከስን ፅንሰ-ሀሳብ ይደግፋሉ።
1237	sports	የቡድን አባሉ ፈርናንዶ ኣሎንሶ ለአብዛኛው ውድድር መሪ ነበረ፤ ነገር ግን ለፍተሻ ከቆመ ቡኃላ ተጠናቀቀ፤ ምክኒያቱም በመጥፎ ሁኔታ የገባ የፊት ጎማ ሊሆን ይችላል።
375	science/technology	ፀሀይ ሊቆምበት የሚቻል እንደ መሬት ያለ ቅርፊት የለውም፡፡ መላው ፀሐይ የተሠራው ከጋዝ፣ ከእሳት እና ከፕላዝማ ነው፡፡
1736	travel	አብዛኞቹ ወረዳዎች ምቹ እና ጠንካራ በሆኑ ትናንሽ የጃፓን ኮስተር አውቶቡሶች ይገለገላሉ።
534	travel	ምናልባትም በጣም የተለመደው የቱሪዝም ዓይነት ብዙ ሰዎች ከጉዞ ጋር የሚያያዙት ነው: የመዝናኛ ቱሪዝም።
48	sports	አቶ ሪድ የኒውዚላንድ A1GP መኪና፣ ብላክ ቢዩቲን ከ 160 ኪሜ በሰዕት ፍጥነት በላይ በድልድዩ ላይ ከሰባት ጊዜ በላይ መንዳት ችሏል።
246	politics	"""ከ1947 ብሪቴይን አገዛዝ የፓኪስታን ነጻ መውጣት ጀምሮ፣ የፓኪስታኑ ፕሬዝደንት FATAን እንዲገዙ በቀጠናው ላይ ሙሉ በሙሉ ማለት ይቻላል አገዛዝ ያላቸውን የ”ፖለቲካ ኃይላትን” ሾመዋል።"""
1217	politics	እንደ ዓለም አቀፍ ማዕቀቦች አዳዲስ አውሮፕላኖችን መግዛት አይቻልም ማለት ነው።
