index_id	category	text
1916	entertainment	የጠረፍ እጅብ ደሴቶች እና ትልልቆቹ ሃይቆች ለማንኛውም መርከብ በበቂ ሁኔታ ትልቅ ቢሆኑም ትንሽ ጀልባዎች ወይም ትንሽ ጀልባ እንኳ የተለየ ተሞክሮ ያቀርባሉ።
1192	health	ፎቶግራፍ አንሺው ወደ ሮናልድ ሬገን UCLA የሕክምና ማዕከል ተጓጉዞ ከዚያ በኋላ ሞተ።
559	science/technology	ፕሮቶንስ ፖዘቲቭ የኤሌክትሪክ ሀይል ሲኖራቸው ኒውትሮንስ ደግሞ ምንም ሀይል የላቸውም። ኤሌክትሮንስ ኔጌቲቭ የኤሌክትሪክ ሀይል አላቸው።
107	geography	ወደ 5ጠዋት (የምስራቅ ሰዓት) ካፕሱሉ ወደ ምድር ሲደርስ እና ህዋ ውስጥ ሲገባ፣ ሰሜን ካሊፎርኒያ፣ ኦሬጎን፣ ኔቫዳ እና ዩታ ውስጥ ላሉ ሰዎች የብርሃን ትዕይንት እንደሚያሳይ ይጠበቃል።
549	sports	በእርግጥ፣ የመጀመሪያ ደረጃ የግማሽ ማይል ሰው፣ በሁለት ደቂቃ የሚያሸንፍ ሰው፣ በተወሰነ የፍጥነት ደረጃ የተያዘ መሆን አለበት፣ ነገር ግን በሁሉም አደገኛ ሁኔታዎች ጊዜ የመቋቋም ጽናት መጎልበት አለበት።
1923	travel	በተለይ ከዚያ በፊት በአውሮፕላን በረው የማያውቁ ከሆነ ወይም አንድ አሰቃቂ ሁኔታ አጋጥሟቸው የሚያውቅ ከሆነ፣ በአውሮፕላን መጓዝ ከብዙ እድሜ እና ቦታ ላይ ለመጡ ሰዎች አስፈሪ ተሞክሮ ሊሆን ይችላል።
126	entertainment	አል ጎር እና ጀነራል ቶሚ ፍራንክስ እንደመጣላቸው የሚወዷቸውን አርዕስቶች ያነሳሉ (የጎር ኦኒየኑ እና ቲፐር ከ2000ው የምርጫ ኮሌጅ ሽንፈት ቡኃላ የህይወታቸውን አስደሳች ወሲብ እያረጉ መሆኑን የዘገቡ ጊዜ ነው።)
983	health	የወፍ ጉንፋን፣ ወይም በመደበኛ የአቪያን ኢንፍሉዌንዛ የሚባለው፣ ወፎችንም ሆነ አጥቢ እንስሳትን ሊያጠቃ ይችላል።
915	science/technology	በዚህ ክፍል ስር ያሉ መተግበሪያዎች በምልክቶች ላይ ያሉ በባዕድ ቋንቋ የተፃፉ ጽሁፎችን ወይም ሌሎች በእውነተኛው አለም ላይ ያሉ ዕቃዎችን ተጠቃሚው ስልኩን ወደ እቃው ሲጠቁመው መተርጎም ሁሉ ይችላሉ።
330	sports	ከቦቤክ በላይ ብዙ ጨዋታዎችን ያሳየ ወይም ለክለቡ ብዙ ግቦችን ያስቆጠረ የለም።
563	health	ጥናቱ ድባቴ፣ ፍርሃት እና ትልቅ የሚያጠፋ ክስተት ይፈጠራል ብሎ ማሰብ በታችኛው ጀርባ የህመም ተሰቃዮች ላይ በህመም እና በአካል ጉዳተኝነት መሀል ያለውን ግንኙነት እንደሚያስታርቁ አግኝቷል።
496	health	ቀዶ ጠጋኞች ከፖፒ ዘሮች የወጣ ሞርፊንን እና ከኸርቤን ዘሮች ስኮፖላሚንን ጨምሮ ስለተለያዩ አደንዛዦች ዕውቀት ነበራቸው።
919	science/technology	አዳዲስ ካርታዎችን ለጂፒኤስ ወይም ለብቻው የጂፒኤስ መሣሪያ ከመግዛት ወይም ከመኪና ኪራይ ኩባንያ ከመከራየት ገንዘብ መቆጠብ ይችላል።
1504	science/technology	የሰው-ልጅ ባልሆኑ እንስሳት ሙሉ በሙሉ ሲያድጉ ፣ የዱር ልጅ ሙሉ በሙሉ እንደ ልዩ እንሰሳት የመሰሉ ባህሪያትን ያሳያል (ለምሳሌ በሰው ልጆች ላይ ፍርሃት ወይም ግዴለሽነት)።
1422	politics	በ 1683 የቺንግ ሥርወ-መንግሥት (1644-1912) ኃይሎች የታይዋን ምዕራባዊ እና ሰሜናዊ የባህር ዳርቻ አካባቢዎችን ተቆጣጥረው ታይዋንን በ 1885 የቺንግ ኢምፓየር አውራጃ መሆኗን አወጁ።
202	geography	"በኦዋሁ ላይ ባለው መለኪያ 6.34 ኢንች የደረሰው የዝናብ መጠን እንደ ""ጠቃሚ"" ሆኖ ተገልጿል።"
109	science/technology	ካፕሱሉ በአንድ ደቂቃ ውስጥ ከሳን ፍራንሲስኮ ወደ ሎስ አንጀለስ ለመሄድ በሰከንድ በ 12.8 ኪ.ሜ ወይም 8 ማይል ያህል ፍጥነት በሰከንድ ይጓዛል።
1521	science/technology	የሰው ባሕሪ የመለየት እንደዚህ ዓይነት ችሎታዎች እንደ ለማዳ ውሾች ባሉ እንሰሳትም ሊጋሩ እንደሚችሉ ጠቅሷል።
1479	science/technology	አብዛኛዎቹ የቴክኖሎጂ ቆራጥነት ትርጓሜዎች ሁለት አጠቃላይ ሀሳቦችን ይጋራሉ፥ የቴክኖሎጂ እድገት ራሱ ከባህላዊ ወይም ከፖለቲካ ተጽዕኖ ባሻገር እጅግ በጣም ብዙ መንገድን እንደሚከተል ፣ እና ቴክኖሎጂ በበኩሉ ከማህበራዊ ሁኔታ ይልቅ በተፈጥሯቸው ባሉ ህብረተሰቦች ላይ “ተጽዕኖዎች” አለው።
1163	politics	እጩዎች እያንዳንዱን የሂደቱን ክፍል እንዲታዘቡ ተወካዮችን መላክ ይችላሉ። ምሽት ላይ ድምፆች የተወሰኑ አሰራሮችን በመከተል በከባድ ቁጥጥር በበጎ ፈቃደኞች ይቆጠራሉ።
1696	geography	አብዛኛዎቹ ትንንሽ ደሴቶች እራሳቸውን የቻሉ ሃገራት ናቸው ወይም ከፈረንሳይ ጋር የተያያዙ ናቸው እናም የቅንጦት የባሕር ዳርቻ ሪዞርቶች በመባል ይታወቃሉ።
866	travel	በታዳጊ ሀገሮች ውስጥ ለመጀመሪያ ጊዜ የሚጓዙ ከሆነ - ወይም በአዲስ የዓለም ክፍል ውስጥ ካሉ - የባህሉ አስደንጋጭነትን አያቅልሉ።
1809	sports	ፓራሊምፒክ ከኦገስት 24 ቀን እስከ ሴፕቴምበር 5 2021 ድረስ ይካሄዳል፡፡ አንዳንድ ዝግጅቶች በመላው ጃፓን ውስጥ በሌሎች አካባቢዎች ይካሄዳሉ።
119	entertainment	ጨዋታው በአሜሪካ እና በኢራቅ ኃይሎች መካከል በተካሄደው አሰቃቂ ውጊያ በ Fallujah ሁለተኛ ውጊያ ላይ የተመሠረተ ነው።
1175	sports	ለ ስፕሪንግቦክስ የአምስት ግጥሚያዎችን የመሸነፍ ጎዙ አጠናቋል።
198	health	"""ከትኩሳቱ እና ከደረቅ ጉሮሮ በስተቀር ጤንነት ይሰማኛል እናም ስራዬን ከቤቴ ለመስራት በጥሩ ሁኔታ ላይ ነኝ።"
144	science/technology	ያ ማለት ሁሉም ነገር መመለስ አለበት” በኢትዮጵያ የሪፍት ቫሊ ምርምር አገልግሎት ተመራማሪው እና የጥናቱ ተባባሪ ጸሀፊው ብርሃኔ አስፋው እንዲህ ብሎ ተናገረ።
1167	entertainment	በቀደምት ጊዜያት ዝግጅቱ በበይነመረብ በሚሰራጨው በሬዲዮ ወሬ ላይ በሚያተኩረው የቶጊኔት የሬዲዮ ድረገጽ ላይ ብቻ ይተላለፍ ነበር።
908	science/technology	የሚዲያ ካምፓኒዎች “ውንብድናን ለመከላከል ነው” በማለት የዚህን ዓላማ በመደበኛነት ይዋሻሉ።
1196	sports	በቀን የሚገኙ አስራ ስምንት ሜዳሊያዎችን ብቻ በማግኘት፣ በርካታ ሀገሮች የሜዳሊያ መድረክን መስራት ተስኗቸዋል።
111	science/technology	“በሰሜናዊ ካሊፎርኒያ ምዕራባዊ ጠረፍ ላይ ይነሳና ሰማዩን ከካሊፎርኒያ በማዕከላዊ ኦሪገን እና ወደ ኔቫዳ እና አይዳሆ እና ወደ ዩታ ይሄዳል” ብለዋል የስታርደስት የፕሮጀክት ሥራ አስኪያጅ ፤ ቶም ዱክስበሪ።
1722	travel	እንደ ሁሉም የደቡብ አፍሪካ ብሔራዊ ፓርኮች ሁሉ ለፓርኩ የቀን በቀን ጥበቃና የመግቢያ ክፍያዎች አሉ።
1989	travel	በተጨማሪም ወደ ሰሜን ወደ ኬብሮን የሚሄዱ ጥቂት አውቶቡሶች አሉ፣ ባህላዊ የቀብር ስፍራው የመጽሐፍ ቅዱስ አባቶች አብርሃምን፣ ይስሐቅ፣ ያዕቆብንና ሚስቶቻቸውን።
512	health	ማስታወቂያ(ADD) ከሌሎች እኩዮች ጋር ግንኙነቶች ላይ ተጽዕኖ ያሳድራል ምክንያቱም ሌሎች ልጆች ለምን እንደሰሩ ወይም ለምን በሚሰሩበት ፊደል እንደሚጽፉ ወይም የጎልማሳ ደረጃቸው የተለየ መሆኑን መረዳት ስለማይችሉ ነው።
1182	health	በአውሮፓ ህብረት ውስጥ በዚህ ቫይረስ ከተጎዱት ሰባተኛ ሀገር ፈረንሳይ ናት፤ ኦስትሪያን፣ ጀርመንን፣ ስሎቬንያን፣ ቡልጋሪያን፣ ግሪክን እና ከጣሊያንን ተከትላ።
393	politics	ጀርመን ጥቃቱን “ኦፕሬሽን ሲላየን” ብላ ሰየመችው። የእንግሊዝ የጦር ኃይሉ ከባድ መሳሪያዎች እና አቅርቦቶች ከደንከርክ ሲለቅ ጠፍተው ስለነበር፣ ጦር ኃይሉ ደካማ ነበር።
1908	science/technology	አገልግሎቱ በተደጋጋሚ በማጓጓዛ ጥቅም ላይ ይውላል የመዝናኛ የእጅ ሙያ እና የርቀት ውሂብ እና የድምፅ ፍላጎት የሚያስፈልጋቸው ጉዞዎችን ጨምሮ።
592	science/technology	እንስሶች ከብዙ ህዋሶች የተገነቡ ናቸው። የሚመገቡት እና የሚፈጩት በውስጣቸው ነው። አብዛኛዎቹ እንስሳቶች መንቀሳቀስ ይችላሉ።
550	sports	አንዳንድ በክረምቱ ወቅት በክረምቱ ወቅት የሚሮጡ አንዳንድ የአካል ክፍሎች ከሰውነት የአካል ብቃት እንቅስቃሴ (ጂምናዚየም) ሥራ ጋር ተዳምረው ለሩጫው ወቅት ምርጥ ዝግጅት ናቸው።
1210	entertainment	በ1980ዎቹ ዘመን እንደ ታክሲ፣ ቺርስ እና ዘ ትሬይሲ ኡልማን ሾው ያሉ ዝግጅቶች ላይ ሠርቷል።
1232	entertainment	ላካ ሲንግ የ chhappan bhog bhajan ንም አቅርቧል። ዘፋኙ ራጁ ካንደልዋል አብሮት ነበር።
1891	travel	ከአዲሱ ባህል ለመላመድ ቀላል ጊዜ የነበራቸው ተጓዞች አንዳንድ ጊዜ ከነባር ባህላቸው ጋር ዳግም ለመለማመድ በተለየ መልኩ ሊቸገሩ ይችላል።
1798	entertainment	አንዳንድ ቦታዎች የአልኮል መጠጦችን በነፃ ያቀርባሉ። ነገር ግን፣ መስከር ዳኝነትን ያሰናክላል፣ እና ሁሉም ጥሩ ቁማርተኞች አለመስከር ያለውን ጥቅም ያውቁታል።
738	travel	ካፌኔት ኤል ሶል ለአንድ ቀን መግቢያዎች በዩኤስ$30፣ ወይም $10 ክፍያ የማስያዝ አገልግሎትን ያቀርባል፤ ዝርዝር ኮርኮቫዶ ገፃቸው ላይ።
1298	politics	የአንዳንዴ-ዓመፃዊ ሰላማዊ ሰልፎች የሚነሱት ምርጫዎችን ካለማድረግ ነው አንዳንዶቹ ከ2011 ጀምሮ።
577	science/technology	ሕዋስ የሁሉም ሕይወት ያላቸው ነገሮች መሠረታዊ ክፍል ነው፣ እና ሁሉም ሕይወት ያላቸው ነገሮች አንድ ወይም ከዚያ በላይ ሕዋሳትን ያቀፉ ናቸው።
733	sports	በክረምት ወቅት በሰሜን አሜሪካ ውስጥ በጥሩ የበረዶ መንሸራተት ይደሰቱ እና በበጋ ወቅት የተወሰኑ ትክክለኛ የተራራ ብስክሌት ይሞክሩ።
1624	geography	ከፕላኔትዋ ወንዞች ፈሶ ወደ ውቂያኖሶች የሚገባው ውሃ ሙሉ 20 በመቶ የሚመጣው ከአማዞን ነው።
185	sports	እሁድ ከቦሎኒያ ጋር ሊደረግ ከታቀደው ጨዋታ በፊት በቡድን ሆቴል ውስጥ ቆየ።
1158	geography	የሙቀት ባህሪያቸው ዓለም ላይ እንዳሉ ቋሚ ሙቀት እንደሚጠብቁ ትላልቅ ዋሻዎች የማይንቀሳቀስ አይደለም፣ ግን እነዚህ በመሬት ውስጥ ጥልቅ ጉድጓዶች ከመሆናቸው ጋር ተስማሚ ነው፣” አለ የዩናይትድ ስቴትስ ስነምድራዊ ጥናት (ዩኤስጂኤስ) አስትሮጂኦሎጂ ቡድን እና በፍላግስታፍ፣ አሪዞና የሚገኘው ሰሜን አሪዞና ዩኒቨርሲቲ ግሌን ከሺንግ።
190	travel	መንገደኞች በ 90(F)-ሙቀት ላይ ቆመው ሲጠብቁ ውሃ ተሰጣቸው፡፡
1233	entertainment	በሐሙሱ የቶኪዮ ጨዋታ ትርኢት መክፈቻ አቅርቦት ላይ የኒንቴንዶ ፕሬዝደንት ሳቶሩ ኢዋታ የኩባንያውን አዲሱን የኒንቴንዶ ሬቮሉሽን መሳሪያ ተቆጣጣሪውን ዲዛይን አቀረቡ።
1548	politics	ሊጻፍ የሚገባው ከዚህ የቅርብ ጊዜ ምሳሌዎች ውስጥ አንዱ የሰሜን አትላንቲክ የሁለተኛው የዓለም ጦርነት ዘመቻ ነው። አሜሪካኖቹ ብሪታንያን ለመርዳት ሰዎችን እና ዕቃዎችን በአትላንቲክ ውቅያኖስ ለማዘዋወር እየሞከሩ ነበር።
647	entertainment	በጣም ብዙዎቻችን መቼም ቢሆን ልንሳተፍበት የማንችለውን ወይም እውቀቱን ተግባራዊ ልናደርግበት የማንችለውን ሂደትን ወይም ልምድን የሚጠቁሙ የቴሌቭዢን ፕሮግራሞችን በመመልከት ላይ እንዳለን እራሳችንን እናገኘዋለን።
1522	science/technology	በሃያኛው ክፍለ ዘመን የተደረገው ጥናት የዘረመል ልዩነት ሁለት ገንዳዎች እንዳሉ ያሳያል-የተደበቁ እና የተገለጹ።
601	science/technology	ናይትሮጅን እንደ ጋዝ ከፈሳሽ ናይትሮጅን ጋር አንድ ዓይነት ባሕሪያት አለው። ፈሳሽ ሁኔታው ጥቅጥቅ ያለ ቢሆንም ሞሎኪውሎቹ አንድ ዓይነት ናቸው።
1747	sports	አርጀንቲና በአለም ላይ በጣም ምርጥ ከሆኑት የፖሎ ቡድኖች እና ተጫዋቾች አንዱን በመያዝ በደምብ ትታወቃለች።
142	sports	የኤንቢኤ ዉሳኔ የመጣዉ የዩታ ጃዝ ተጨዋች በ ኮቪድ-19 ቫይረስ መያዙን ተከትሎ ነዉ።
1802	travel	ዕይታ በሚወድቅ ወይም በሚነፍስ በረዶ ወይም በውሃ መጤዝ ወይም በመኪና መስታወቶች ላይ በሚኖር በረዶ ሊከለከል ይችላል።
825	travel	ዓለምን በርካሽ፣ አስፈላጊ ሆኖ፣ ለአኗኗር ዘይቤ ወይም፣ እራስዎን ለመፈተን፣ ያንን ለማድረግ መንገዶች አሉ።
1144	politics	የኮኦሊሽን እና የአፍጋኒስታን ወታደሮች ቦታውን ለማስጠበቅ ወደ አካባቢው የገቡ ሲሆን ሌሎች የኮኦሊሽን አውሮፕላኖችም እንዲረዱ ተልከዋል።
1850	sports	በበረዶ መንሸራተቻ ቦርሳ ይዞ መጓዝ፡ ይህ እንቅስቃሴ ባክካንትሪ የበረዶ መንሸራተት፣ የበረዶ ጉብኝት ወይም የበረዶ ተራራ መውጣት ተብሎ ይጠራል።
1033	science/technology	ጸሀይ የሚሰራበት መሰረታዊ መርህ ለሎች ኮከቦች ከሚሰሩበት መርህ ጋር ተመሳሳይ እንደሆነ አግኝተዋል፡ በስርዓቱ ውስጥ የሁሉንም ኮከቦች እንቅስቃሴ የሚመራው በማንፀባረቅ፣ በመሽከርከራቸው እና በሌላ በምንም እንዳልሆነ ተገኝቷል።
1848	sports	በበረዶ ላይ የመንሸራተት ሐሳብ በጣም የቆየ ነው - ዋሻዎች ላይ የበረዶ ተንሸራታቾችን እንዲገልጹ የተሰሳሉት ስዕሎች እስከ 5000ቢሲ ድረስ ይደርሳሉ!
228	geography	እነዚህ ሰርጦች በጨረቃ ሙሉ ላይ ተገኝተዋል እና በትንሹ የፈራረሱ ይመስላሉ፣ ይህ እነሱን የፈጠሯቸው ስነምድራዊ ክስተቶች የቅርብ ጊዜ እንደነበሩ ያመለክታል።
292	geography	ከእሳተ-ገሞራ እንቅስቃሴ ጋር ምንም ግንኙነት የሌላቸው ደመናዎች በተራራው ግርጌ መታየታቸው ተዘግቧል።
1225	sports	ዴል ፖትሮ በሁለተኛው ዙር ቀዳሚ ጥቅም ነበረው፣ ግን ይህም 6-6 ከደረሱ በኋላ የአቻ መለያ አስፈለገው።
1416	sports	ታዋቂ ስፖርቶች እግር ኳስ፣ ቅርጫት ኳስ፣ መረብ ኳስ፣ ውሃ-ፖሎ፣ የጎራዴ ጨዋታ፣ ራግቢ፣ ሳይክል መንዳት፣ የበረዶ ሆኪ፣ ሮለር ሆኪ እና ኤፍ1 የሞተር ውድድርን ያካትታሉ።
129	entertainment	ከተማዋ በደቡብ ምሥራቅ አውሮፓ በዘንድሮ ከጁን እስከ ኦገስት በዓለም ትልቁ የሕዝብ ሥነ-ጥበባት ዝግጅት የሆነውን፣ የከብት ትዕይንት (CowParade)፣ ለማስተናገድ የመጀመሪያዋ ትሆናለች።
1003	science/technology	እሱ እንዳለው፣ የWiFi የበር ደውል ሰራ።
271	health	ዶ/ር ሊ በተጨማሪም በቱርክ ያሉ ህጻናት በአሁኑ ወቅት በ ኤ(ኤች 5 ኤን 1) የወፎች የኢንፍሉዌንዛ ቫይረስ መታመም ሳያሳዩ ሪፖርት መደረጉ ስጋት እንዳለው ገልጸዋል።
103	politics	በቀጥታ ቴሌቪዝን ላይ የነበሩት አስተያየቶች ከፍተኛ ኢራናዊያን ምንጮች፣ ማዕቀቦች ጉዳት እንዳላቸው ያመኑበት የመጀመሪያ ጊዜ ነው።
14	sports	ከጨዋታው በኋላ፣ የሸክላው ንጉስ፣ “በጣም አስፈላጊ ለሆኑት ኩነቶች ወደ መጨረሻዎቹ ዙሮች ስለተመለስኩ በጣም ደስ ብሎኛል። እዚህ ያለሁት ይህንን ለማሸነፍ ነው።” ሲል ተናግሯል።
1412	politics	ምክር ቤቱ ግብር ለመጣል ስልጣን አልነበረውም፣ እና ምንም ብሔራዊ አስፈፃሚ ወይም ፍርድ ቤት ስለሌለ፣ ብዙውን ጊዜ ሁሉንም ህጎቹን ለማስፈፀም በማይተባበሩ የግዛት አመራሮች ይተማመን ነበር።
1811	travel	ማራዘሚያው ከመነገሩ ቀድመው የ2020 በረራዎትን እና ማረፊያዎትን አስመዝግበው ከሆነ አስቸጋሪ ሁኔታ ውስጥ ሊሆኑ ይችላሉ።
1681	science/technology	ቴክኖሎጂ ከምናባዊ የመስክ ጉዞ መፍትሄውን ይሰጣል። ተማሪዎች የሙዝየሞችን ቅርሶች በመመልከት ፣ የውሃ አካባቢያቸውን በመጎብኘት ወይም በክፍላቸው ሲቀመጡ የሚያምር ስነ-ጥበቦችን ማድነቅ ይችላሉ።
335	entertainment	ቱርካዊዋ ታዋቂ ስዘን አክሱ ከጣሊያናዊው ቴኖር አሌሳንድሮ ሳፊና እና ከግሪካዊው ዘፋኝ ሃሪስ አሌክዡ ጋር ትጫወተች።
378	science/technology	ከሦስት ሺህ ዓመታት ገደማ በኋላ በ 1610 ጣሊያናዊው የሥነ ፈለክ ተመራማሪ ጋሊልዮ ጋሊሌይ ጨረቃ እንዳለችው ቬነስ ደረጃዎች እንዳሏት በቴሌስኮፕ ተጠቅሟል።
1367	science/technology	የሳይንስ ሊቃውንት ኦሴሎትስ/የበረሃ ድመቶች በምድር ላይ ለነበሩበት ቦታ እየነፉ በማሽተት የሚመገቡትን (እንስሳትን) እንስሳት ተከትለው ያገኛሉ።
703	travel	ጉብኝቶች በቁጥር ከፍ ለሚሉ ቡድኖች ረከስ የሚሉ ሲሆን እርስዎ ብቻዎትን ከሆኑ ወይም ከአንድ ጓደኛዎ ጋር ከሆኑ ከሌሎች ሰዎች ጋር ለመገናኘት ይሞክሩና የስድስት ወይም የአራት ሰዎችን የያዘ ቡድን በመፍጠር በነብስ ወከፍ የተሻለ ተመን ለማግኘት ይችላሉ።
297	politics	የቀረበው ማሻሻያ በ2011 ሁለቱንም ቤቶች አልፎ ነበር።
80	sports	ከዛም ማሮሺዶር በቅድመ-መጨረሻ ደረጃ ላይ ካቡልቱርን አሸነፈ።
1823	travel	በተወሰኑ አካባቢዎች ግዴታ የሆነ ግብር ነጻ የሆኑ የተወሰኑ ዕቃዎችን የመግዛት ዕድል ዲዩቲ ፍሪ ሽመታ ነው።
836	travel	ስነ-ህንፃ ስለ ህንፃዎች ንድፍ እና ግንባታ ይመለከተዋል። የአንድ ቦታ ስነ-ህንፃ ብዙውን ጊዜ በራሱ መብት የቱሪስት መዳረሻ ነው።
880	travel	እነዚህ መስፈርቶች ተጓዙ የጉበኛቸው ሃገሮች ላይ እና ሊጎበኛቸው ያሰባቸው ሀገራት ላይ ሊመሠረት ይችላል።
1143	politics	የደቡብ ምዕራብ አፍሪካ ህዝቦች ድርጅት (ኤስ.ደብልዩ.ኤስ.ፒ.ኦ) ገዥው ፓርቲ፣ በፓርላማው ምርጫም ብዙዎችን እንደያዘ ቆይቷል።
650	science/technology	ሆቴልዎ ወይም አስተናጋጆችዎ (የእንግዳ ማረፊያ ወይም የግል ቤት ውስጥ የሚያርፉ ከሆነ) ዋይፋይ ወይም በይነመረብ ጋር የተያያዘ ፒሲ ይኖራቸዋል፣ እና ሁሉም መኖሪያዎች የበይነመረብ ካፌ ወይም የህዝብ ዋይፋይ ያለው አንድ ቦታ አላቸው።
702	travel	የያዙት ፓስፓርት ከጉዞዎት ቀናት ባሻገር ቢያንስ ለ6ወር ፈቃድ ያለው መሆን አለበት። የሚያደርጉትን ቆይታ ለማገዝ እንዲረዳ የደርሶ መልስ ቲኬት ያስፈልጎታል።
1604	travel	ሰዎች በየቀኑ ጠዋት ላይ ከትናንሽ የገጠር ከተሞች በመኪና ወደ ሥራ ቦታቸው ይሄዳሉ እና ሌሎች የሥራ መድረሻቸው ጥለውት የሔዱት ቦታ በሆነ ሰዎች ይታለፋሉ።
817	sports	በባርሴሎና የሩጫ ጉብኝቶች ባርሴሎና እና በኮፐንሃገን የሩጫ ኮፐንሃገን ተጀምሮ፣ ፕራግ እና ሌሎች ውስጥ የተመሰረተው የሩጫ ጉብኝቶች ፕራግ በፍጥነት ተቀላቅለውታል።
1763	travel	ተገቢውን እርቀት ባለመጠበቃቸው በየአመቱ ደርዘኖች ጎብኚዎች ተጎድተዋል። እነዚህ እንስሳት ትልቅ፣ የዱር፣ እና አደገኛ ሊሆኑ የሚችሉ ናቸው፤ ስለዚህ ቦታ ይስጧቸው።
1290	politics	እስራኤል አንድ ስምምነት ከተፈረመ በኋላ ለአስር ዓመታት በሸለቆው ውስጥ ቀጣይነት ያለው ወታደራዊ መገኘት ትፈልጋለች፣ PA በበኩሉ እንዲህ ዓይነቱን መገኘት ለአምስት ዓመታት ብቻ እንዲሆን ይስማማል።
1775	entertainment	"ዋናው የሀገር ውስጥ ቢራ 'ቁጥር አንድ' ነው፣ ውስብስብ ቢራ ሳይሆን፣ አስደሳች እና አርኪ ነው። ሌላው የሀገር ውስጥ ቢራ ""ማንታ"" ይባላል።"
642	science/technology	ከበይነ መረብና ከድሕረ ገፅ መረብ ጥቅሞች አንዱ ተማሪዎችን በማንኛውም ጊዜ ለመረጃ ቅርብ እንዲሆኑ ማስቻሉ ነው።
1544	politics	በሴፕቴምበር 17፣ 1939 የፖላንድ መከላከያ ተሰብሮ ነበር እናም የነበረው ብቸኛ ተስፋ ማፈግፈግ እና በሮማዊይንን የጦር አቋም ጋር ድጋሚ መደራጀት ነው።
1148	health	የሜዲሲንስ ሳንስ ፍሮንቲር ቃል አቀባይ ሪቻርድ ቬርማን በበኩላቸው፥ “አንጎላ ከመቼውም ጊዜ በላይ ወደ አስከፊ የወረርሽኝ ስጋት እያመራች ሲሆን ሁኔታው በአንጎላ እጅግ በጣም መጥፎ ነው” ብለዋል።
801	health	የአልኮል መጠጦችን በልክ ይጠጡ። የአልኮል መጠጥ ሁሉም ሰው ላይ በተለያየ ሁኔታ የሚጎዳ ሲሆን እርስዎም ልክዎን ማወቁ በጣም ጠቃሚ ነው።
1741	travel	የብራዚል የጉምሩክ ፍተሻ ይጠናቀቃል ተብሎ በሚጠበቅበት፣በሴፕቴምበር 2017 ድልድዩ ሙሉ በሙሉ እንዲሠራ ታቅዷል።
1140	entertainment	ምንም እንኳን ዊንፍሬይ በስንብቷ እያነባች ብትሆንም፤ ተመልሳ እንደምትመጣ ለአድናቂዎቿ ግልፅ አድርጋለች፡፡
1267	health	ኤድጋር ቬጉላ የክንድ እና የመንገጭላ ቁስሎች ተቀስቅሷል ኪሪስቶፈር ሽናይደር ለፊቱ መልሶ ማቋቋም የሚያስፈልገውን ቀዶ ጥገና ተፈልጓል።
1774	entertainment	እነዚህ አንዳንዴ የሚጨናነቁ የተለያዩ ዓይነት የባሕር ዳርቻውን የከበቡ ሱቆች የሚገኙባቸው የቤተሰብ የባሕር ዳርቻዎች ናቸው። መዋኘት የሚያስተማምን ነው።
862	health	ነገር ግን የባዮሎጂካል ባክቴሪያ ለእርስዎ አዲስ በሚሆኑባቸው ሌሎች የዓለም ክፍሎች ውስጥ፣ ወደ ችግሮች ውስጥ የመግባት እድሎ ከፍተኛ ነው።
