index_id	category	text
1881	politics	Deschiderea guvernelor la posibilitatea de a elibera pașapoarte pe care să nu fie declarat sexul (X) sau documente actualizate pentru a corespunde cu numele și sexul dorit este variabilă.
1379	science/technology	Fălcile sale lungi aveau peste 70 de dinți ascuțiți ca lama, alături de un set suplimentar în cerul gurii, ceea ce înseamnă că nimic din ce-i apărea în cale nu scăpa cu bine.
1550	politics	Dacă Aliații ar fi eșuat, Germania ar fi reușit probabil să ocupe Marea Britanie, cum a făcut-o cu restul Europei.
333	entertainment	A fost urmat de Orchestra Simfonică de Stat din Istanbul, o trupă de ieniceri și de cântăreții Fatih Erkoç și Müslüm Gürses.
719	geography	Republica Dominicană (în spaniolă: República Dominicana) este o țară din Caraibe, care ocupă jumătatea de est a Insulei Hispaniola, pe care o împarte cu Haiti.
1780	travel	Mulți vizitează reciful de-a lungul întregului an, iar rănile din oricare dintre aceste cauze sunt rare.
1841	travel	Dacă un călăreț cade din șa, dar rămâne cu un picior agățat de scară, calul îl poate târî după sine când o ia la goană. Pentru a minimiza acest risc, se pot lua o serie de măsuri de precauție.
471	politics	Idea era că toate națiunile europene trebuiau să urmărească să prevină ca o națiune să devină puternică, și astfel, guvernele naționale își schimbau deseori alianțele, pentru a menține echilibrul.
1634	science/technology	Aducea aminte mai degrabă de cele patru stări ale materiei, (în aceeași ordine): solidă, lichidă, gazoasă și plasmă, cu toate că el teoretizase și că se transformă într-o altă substanță pentru a lua forma pe care o vedem.
1255	science/technology	Cercetătorii au observat cristale formate în urina pisicii prin adăugarea de melamină și acid cianuric.
845	entertainment	„Cu toate acestea, în ziua de azi, există artiști graffiti consacrați, evenimente graffiti și «ziduri legale». Picturile graffiti, în acest context, se aseamănă deseori cu operele de artă mai degrabă decât cu semne distinctive ilegibile.”
1776	entertainment	Se pot găsi multe vinuri franceze, dar cele neo-zeelandeze sau australiene ar merge mai bine.
1845	travel	Culmile oferă priveliști uluitoare din vârful lor. Alpiniști din toate părțile lumii trasează continuu noi rute printre pereții cu un potențial nelimitat.
1151	sports	Practicând un joc dezorganizat împotriva surorilor sale din sud, Africa de Sud și-a revenit însă constant, pe măsură ce turneul avansa.
1054	politics	„Dezbaterea a fost declanșată de controverse în legătură cu cheltuielile pentru ajutor și reconstrucție în urma uraganului Katrina; pe care unii conservatori le-au numit în glumă «New Deal din Orleans al lui Bush».”
1859	geography	Definiția variază în funcție de localizarea geografică, unde limita de vârstă ar putea fi mai mică în locuri precum America de Nord decât în Europa.
1007	health	Chiar dacă un vaccin experimental pare în măsură să reducă mortalitatea Ebola, până acum nu s-a demonstrat în mod clar că există medicamente adecvate pentru tratarea unei infecții existente.
1076	politics	„Purtătorul de cuvânt al lui Bush, Gordon Johndroe, a spus că angajamentul Coreei de Nord reprezintă «un pas major către obiectivul unei denuclearizări care poate fi verificată a peninsulei coreene».”
1099	geography	Sateliții, ambii cântărind peste 1000 de livre și călătorind cu aproximativ 17.500 mile pe oră, s-au ciocnit la 491 de mile deasupra Pământului.
1100	science/technology	Oamenii de știință spun că explozia cauzată de coliziune a fost uriașă.
367	science/technology	Sângele pleacă dinspre inimă în vase numite artere și se întoarce la inimă în vase numite vene. Cele mai mici vase sunt numite capilare.
770	entertainment	Cele mai multe festivaluri ale templelor sunt celebrate cu ocazia aniversării templului, de ziua de naștere a zeității căruia îi este dedicat sau orice alte evenimente majore asociate cu templul.
279	politics	Ca stat în care câștigătorul ia totul, Florida i-a repartizat lui Romney pe toți cei cincizeci de delegați, plasându-l în fruntea cursei pentru candidatul Partidului Republican.
357	science/technology	Pentru a reveni la nivelul anterior de energie, trebuie să elimine energia suplimentară pe care a primit-o de la lumină.
797	science/technology	În cazul în care călătoriți cu un laptop sau o tabletă, salvați o copie în memoria sau pe discul acestuia (accesibilă fără conexiune internet).
211	health	Nu au fost raportate leziuni grave, dar cel puțin cinci persoane aflate la fața locului în momentul exploziei au fost tratate pentru simptome de șoc.
815	travel	La nivel internațional, există aproape 200 de organizații pentru turnee de alergare. Majoritatea operează în mod independent.
238	geography	Din câte cunoaștem, există un singur corp planetar care demonstrează mai mult dinamism decât Titan, iar numele lui este Terra”, adăugă Stofan.
1636	science/technology	Elementele precum calciul și potasiul sunt considerate metale. Bineînțeles, există și metale ca argintul și aurul.
761	travel	După aceea este alcătuită o listă cu oferte de cazare disponibile, tipărită și/sau online, care uneori cuprinde referințe și comentarii ale turiștilor.
1676	science/technology	Cercetarea în IA presupune fabricarea de mașini pentru automatizarea sarcinilor care necesită un comportament inteligent.
848	entertainment	Cele mai multe bumeranguri disponibile în Australia de fapt nu se întorc la punctul de lansare. Pentru începători e indicat să nu încerce să le lanseze în condiții de vânt.
1089	science/technology	Această teorie spune că materia întunecată dintr-o galaxie este localizată în jurul galaxiei ca un fel de aură și este compusă dintr-o mulțime de particule mici.
984	health	Au fost observate mai puțin de o mie de cazuri la oameni, dar unele dintre ele s-au dovedit fatale.
305	sports	Hitoshi Saito, judoka japonez câștigător a două medalii olimpice de aur, a murit la vârsta de 54 de ani.
697	travel	Ierusalimul are multe situri istorice, arheologice și culturale, precum și centre comerciale aglomerate și pline de viață, cafenele și restaurante.
826	travel	Pe scurt, acestea se împart în două categorii: ori lucrezi în timp ce călătorești, ori încerci să îți limitezi cheltuielile. Acest articol se concentrează pe cea din urmă.
1672	health	Se știa de mult că diferite tipuri de daune cerebrale, traume, leziuni și tumori afectează comportamentul și duc la schimbări în anumite funcții cerebrale.
536	travel	Plajele, parcurile tematice și campingurile sunt deseori locurile cel mai frecventate de turiști pentru recreare.
1909	science/technology	Furnizorul local de servicii telefonice ar putea să vă dea mai multe informații despre conectarea la acest serviciu.
611	science/technology	Animații sofisticate pot fi create pe calculator, iar acest tip de animație este folosit tot mai des în televiziune și în filme.
157	sports	După cursă, Keselowski rămâne liderul Campionatului Piloților, cu 2250 de puncte.
1294	politics	Martelly a depus ieri jurământul în fața unui nou Consiliu Electoral Provizoriu (CEP), format din nouă membri.
1803	travel	Pe de altă parte, gheața și zăpadă sunt condiții normale în multe țări, iar traficul se desfășoară în cea mai mare parte neîntrerupt pe tot parcursul anului.
359	science/technology	„Oamenii de știință numesc acest proces «emisie stimulată de radiații», deoarece atomii sunt stimulați de către lumina puternică, ducând la emiterea unui foton de lumină, iar lumina este un tip de radiație.”
302	politics	Legea franceză a fost modificată. Și-a început activitatea de activist pe când avea 15 ani și s-a alăturat Rezistenței franceze în timpul celui de-al Doilea Război Mondial.
455	science/technology	Aceasta este o problemă tot mai rară, dat fiind că producătorii de obiective ating standarde mai ridicate în fabricarea obiectivelor.
25	sports	Prima pasă a serii pentru Ovechkin a fost cea care a dus la golul câștigător înscris de începătorul Nicklas Backstrom;
1606	science/technology	Știința indică acum că această economie bazată masiv pe carbon a dislocat biosfera dintr-una din stările sale stabile, care a susținut evoluția umană în ultimele 2 milioane de ani.
79	sports	Cele două echipe s-au întâlnit în semifinala mare, în care Noosa a câștigat cu 11 puncte.
952	travel	Chiar dacă aveți tendința să vă alăturați companiei aeriene pe care o folosiți cel mai des, ar trebui să aveți în vedere că privilegiile sunt adesea diferite și punctele pentru zboruri frecvente vă pot aduce beneficii mai generoase la o altă companie aeriană din aceeași alianță.
995	travel	Companiile aeriene care includ aceste servicii sunt Air Canada, Delta Air Lines, Lufthansa, pentru zboruri din SUA sau Canada, și WestJet.
266	science/technology	Turnul rus de control la sol a activat avioanele și atitudinea normală a stației a fost recâștigată.
112	politics	Decizia dlui Rudd de a semna acordul climatic de la Kyoto izolează Statele Unite, care va fi acum singura țară dezvoltată care nu a ratificat acordul.
1050	politics	Raportul este extrem de critic cu privire la aproape fiecare aspect al politicii actuale a executivului față de Irak și solicită o schimbare imediată de direcție.
1609	travel	De ce oare sistemele de transport dau naștere la astfel de nemulțumiri, de ce eșuează zi de zi? Să fie oare pentru că inginerii de transporturi sunt pur și simplu incompetenți? Sau se întâmplă ceva mai grav?
1316	sports	Confrații wrestleri i-au adus și ei un omagiu Lunei.
291	geography	Activitatea semnificativă a cutremurului care a dus la schimbarea fazei a avut loc pe 10 martie, pe partea de nord-est a caldeirei de pe vârful vulcanului.
1215	travel	Rapoartele preliminare indicau că avionul fusese deviat înapoi spre Afganistan după ce i se refuzase permisiunea de a efectua o aterizare de urgență la Ürümqi.
1270	sports	După evenimentul de miercuri, Carpanedo a concurat în două curse individuale în cadrul Campionatelor.
663	entertainment	San Francisco este, de asemenea, unul dintre cele mai bune locuri din țară pentru alte bucătării asiatice: coreeană, thailandeză, indiană și japoneză.
91	politics	Lodin a mai spus că reprezentanții oficiali au decis să anuleze runda finală pentru a scuti afganii de cheltuielile și riscul de securitate privind organizarea altor alegeri.
371	science/technology	Un triceratops și-ar fi putut folosi ciocul puternic pentru a îndepărta frunzele înainte de a mânca trunchiul.
1806	travel	Unele animale, cum ar fi elefanții sau girafele, tind să se apropie de mașini, iar echipamentul standard va permite o bună vizualizare a lor.
930	travel	Cu toate că este posibil ca în cazul unor vizite turistice sau de afaceri scurte în alte țări să nu aveți nevoie de viză, o vizită ca student internațional presupune, de obicei, o ședere mai îndelungată decât în cazul unui turist obișnuit.
33	sports	Piquet Jr. a fost concediat după Marele Premiu al Ungariei din 2009.
0	health	Luni, oameni de știință de la Facultatea de Medicină a Universității Stanford au anunțat inventarea unui nou instrument de diagnosticare, care poate sorta celulele în funcție de tipul lor: un cip minuscul, printabil, care poate fi produs folosind imprimante obișnuite cu jet de cerneală, pentru aproximativ un cent american bucata.
200	geography	Felicia, odată o furtună de categoria 4 pe scara Saffir-Simpson de clasificare a intensității uraganelor, a slăbit, devenind o depresiune tropicală înainte de a se disipa marți.
873	entertainment	Dacă ai chef de aventură, profită de ocazie ca să faci un suc sau să amesteci niște smoothies:
774	entertainment	Expozițiile horticole internaționale sunt evenimente specializate, în cadrul cărora sunt prezentate aranjamente florale, grădini botanice și orice altceva ce are legătură cu plantele.
1377	science/technology	Ne facem casele din plante și facem haine din plante. Majoritatea alimentelor pe care le mâncăm sunt plante. Fără plante, animalele nu ar putea supraviețui.
203	geography	Unele precipitații au fost însoțite de furtuni cu tunete și fulgere frecvente.
1365	science/technology	Răgetul tigrului nu seamănă cu răgetul cu voce plină al unui leu, ci mai degrabă cu o propoziție de cuvinte ascuțite, strigate.
1176	sports	A fost ultimul meci pentru echipa All Blacks, care câștigase deja trofeul în urmă cu două săptămâni.
879	health	Multe guverne prevăd ca la intrarea vizitatorilor sau la plecarea rezidenților în și din țările lor, aceștia să fie vaccinați pentru o serie de boli.
110	science/technology	Stardust va stabili un nou record al tuturor timpurilor ca fiind cea mai rapidă navă spațială care s-a reîntors pe Pământ, depășind recordul anterior stabilit în mai 1969 în timpul revenirii modulului de comandă Apollo X.
1494	science/technology	Agricultura de subzistență este un sistem simplu, adesea ecologic, care folosește semințe păstrate, originare din aceeași regiune ecologică, alături de rotația culturilor sau alte tehnici relativ simple de a maximiza randamentul.
1086	science/technology	Efectul pe care îl căuta echipa ar fi fost cauzat de forțele mareice produse între materia întunecată a galaxiei și materia întunecată a Căii Lactee.
1623	geography	Amazonul este, de asemenea, cel mai lat fluviu de pe Pământ, având pe alocuri o lățime de șase mile.
1222	entertainment	Trupa rock urma să facă turnee în Statele Unite și Canada până pe 16 septembrie.
1357	science/technology	În cele din urmă, există multe feline mici (inclusiv pisici de companie libere) care mănâncă mult mai numeroasele prăzi mici, cum ar fi insecte, rozătoare, șopârle și păsări.
216	sports	S-a încercat includerea în programul olimpic a unor sporturi precum squash, karate și patinajul pe role, alături de baseball și softball, sporturi care au fost excluse de la Jocurile Olimpice din 2005.
327	sports	Născut în capitala Croației, Zagreb, Bodek a dobândit faimă în perioada în care a jucat pentru Partizan Belgrad.
277	politics	Mitt Romney, ex-guvernatorul statului Massachusetts, a câștigat marți alegerile primare prezidențiale ale Partidului Republican din Florida, obținând mai mult de 46 la sută din voturi.
428	geography	Teritoriul Turciei are o lungime de peste 1600 de kilometri (1000 de mile) și o lățime de 800 km (500 de mile), cu o formă aproximativ dreptunghiulară.
1709	travel	Goma este un oraș turistic din Republica Democratică Congo, situat în extremul estic, aproape de Rwanda.
565	health	Cei care luau parte în mod regulat la activități fizice au avut nevoie de mai mult sprijin în termeni de percepție negativă a durerii, distingând între durere cronică și senzația de disconfort datorată activității fizice normale.
742	travel	Cu toate că e mai mică, le reamintește vizitatorilor de Hawaii înainte să fi devenit stat, fără hotelurile mari pentru turiști și alte dezvoltări.
531	sports	Într-o rundă obișnuită sunt jucate optsprezece găuri, jucătorii începând de obicei cu prima gaură de pe teren și terminând cu a optsprezecea.
729	travel	Insula Bowen este o excursie de zi sau de sfârșit de săptămână populară, care oferă canotaj, drumeții, magazine, restaurante și multe altele.
1427	science/technology	De exemplu, cel mai obișnuit format static de fotografie din lume este de 35mm, care era mărimea dominantă de peliculă de la sfârșitul erei filmului analog.
865	health	Ca și în cazul problemelor respiratorii în climatele mai reci, problemele intestinale în climatele mai calde sunt destul de comune și, în majoritatea cazurilor, sunt în mod clar deranjante, însă nu foarte periculoase.
205	travel	Cu aproximativ 10 minute înainte de aterizarea programată după cea de-a doua apropiere, a dispărut.
374	science/technology	O persoană care cântărește 200 de livre (90 kg) pe Pământ ar cântări circa 36 de livre (16 kg) pe Io. Așadar forța de gravitație, bineînțeles, te trage mai puțin în jos.
275	politics	Politica Komen a descalificat Planificarea Familială datorită unei investigații în curs, despre cum Planificarea Familială își cheltuie și raportează banii, care este condusă de deputatul Cliff Stearns.
1991	travel	Apele navigabile interne pot fi o bună tematică pentru organizarea unei vacanțe.
349	science/technology	Oamenii de știință lucrează pentru a crea un reactor care poate produce energie în același mod.
1325	science/technology	Pe 25 ianuarie, Curtis Cooper, matematician și profesor de informatică la Universitatea din Central Missouri, a descoperit cel mai mare număr prim cunoscut până în prezent.
1854	travel	Europa este un continent relativ mic, dar cu multe țări independente. În mod normal, străbaterea mai multor țări ar însemna să treceți de repetate ori prin procedurile de obținere a unei vize și control al pașaportului.
946	geography	Canalul Marea Albă - Marea Baltică pune în legătură Oceanul Arctic cu Marea Baltică prin Lacul Onega, Lacul Ladoga și Sankt Petersburg, în cea mai mare parte prin râuri și lacuri.
182	politics	„În acest moment, este important atât din punct de vedere al sănătății publice, cât și al justiției penale ca legislația să fie adoptată cât mai curând posibil”, a declarat un purtător de cuvânt al guvernului.
1288	politics	Conform scurgerii de informații, documentul se va referi la disputa cu privire la frontiere, pe care Palestina le dorește trasate pe baza granițelor de dinainte de războiul din Orientul Mijlociu din 1967.
1639	science/technology	Atomii sunt atât de incredibil de minusculi, că trilioane ar putea să încapă în punctul de la capătul acestei fraze.
69	entertainment	Formația a anulat spectacolul de pe Stadionul Maui's War Memorial, la care urmau să participe 9 000 de persoane și a cerut scuze fanilor.
12	sports	Recent, a pierdut în fața lui Raonic la Brisbane Open.
508	health	„Tulburarea de deficit de atenție «este un sindrom neurologic al cărui trio de simptome definitorii clasice includ impulsivitatea, neatenția și hiperactivitatea sau excesul de energie».”
1794	travel	Dacă traversați Marea Baltică de Nord pe timp de iarnă, luați aminte la amplasarea cabinei, dat fiind că navigarea printre ghețuri produce un zgomot insuportabil pentru cei mai sensibili.
667	entertainment	Multe bilete vândute online prin intermediul unor site-uri de licitații precum eBay sau Craigslist sunt bilete pentru mai multe zile cu opțiunea park-hopper, parțial folosite.
127	entertainment	Mulți dintre scriitorii lor au ajuns să aibă o mare influență asupra programelor parodice de știri ale lui Jon Stewart și Stephen Colbert.
1236	sports	Giancarlo Fisichella a pierdut controlul asupra mașinii pe care o pilota și a încheiat cursa la scurt timp după start.
160	sports	Stewart, Gordon, Kenseth și Harvick completează primele zece poziții din Campionatul Piloților, rămânând patru curse din sezon.
1732	geography	Sundarbans acoperă o suprafață de 3850 km², din care aproximativ o treime este de află acoperite de apă/mlaștină.
1940	geography	Cândva orașul antic Smirna, este acum un centru comercial agitat, dezvoltat și modern, situat în jurul unui golf enorm și înconjurat de munți.
37	entertainment	Emisiunea PBS are peste 24 de premii Emmy, iar transmisia ei este mai scurtă doar decât cele ale Sesame Street și Mister Rogers' Neighborhood.
726	entertainment	Un număr de restaurante înconjoară grădina, iar după-amiaza și seara adesea au loc concerte gratis care folosesc ca scenă chioșcul central.
1507	science/technology	Schelele pot fi atât virtuale, cât și reale, cu alte cuvinte, un profesor este o formă de schelă, dar la fel este și micul om agrafă din Microsoft Office.
1318	sports	„Dustin Runnels, supranumit «Pulbere de Aur», a comentat că «Luna a fost la fel de excentrică ca mine... poate chiar mai mult... o iubesc și îmi va lipsi... sper că e într-un loc mai bun».”
379	science/technology	Fazele au loc deoarece doar partea laterală a lui Venus (sau a Lunii), orientată spre Soare, este iluminată. Fazele lui Venus au susținut teoria lui Copernic conform căreia planetele se învârt în jurul Soarelui.
1237	sports	Coechipierul său Fernando Alonso a fost în frunte pentru cea mai mare parte a cursei, dar a încheiat-o imediat după oprirea la boxe, cel mai probabil pentru că roata din dreapta față a fost avariată.
375	science/technology	Soarele nu are o crustă tare ca Pământul, pe care să poți sta. Întregul Soare este alcătuit din gaze, foc și plasmă.
1736	travel	Cele mai multe districte sunt deservite de mici autobuze japoneze de coastă, care sunt comode și robuste.
534	travel	Cel mai comun tip de turism este, poate, ceea ce majoritatea lumii asociază cu călătoria: turismul de agrement.
48	sports	Dl Reid a reușit să conducă mașina A1 GP a Noii Zeelande, Black Beauty, la viteze de peste 160 km/oră, de șapte ori peste pod.
246	politics	De la obținerea independenței Pakistanului față de stăpânirea britanică în 1947, președintele Pakistanului numește „agenți politici” care să guverneze FATA, care exercită un control aproape complet independent asupra acestor zone.
1217	politics	Sancțiunile internaționale au însemnat că nu puteau fi cumpărate avioane noi.
1916	entertainment	Cu toate că arhipelagurile din largul coastelor și lacurile cele mai mari sunt într-adevăr suficient de mari pentru orice iaht, ambarcațiunile mai mici sau chiar un caiac oferă o experiență diferită.
1192	health	Fotograful a fost transportat la centrul medical Ronald Reagan UCLA, unde a murit ulterior.
559	science/technology	Protonii au o sarcină electrică pozitivă, în timp ce neutronii nu au sarcină. Electronii au o sarcină electrică negativă.
107	geography	Când capsula se apropie de Pământ și intră în atmosferă, în jurul orei 5:00 (ora estică), va părea ca un adevărat spectacol de lumini locuitorilor din California de Nord, Oregon, Nevada și Utah.
549	sports	Bineînțeles, un atlet de primă clasă în cursa de jumătate de milă, unul care poate parcurge distanța în mai puțin de două minute, trebuie să aibă o viteză rezonabilă, dar trebuie, cu orice preț, să se antreneze pentru rezistență.
1923	travel	Călătoria cu avionul poate fi o experiență terifiantă pentru persoane de toate vârstele și din toate mediile, în special dacă zboară pentru prima oară sau au avut parte de o experiență traumatizantă.
126	entertainment	Ocazional, Al Gore și generalul Tommy Franks sunt menționați în titlurile preferate ale publicației (în ceea ce-l privește pe Gore, un articol celebru este acela în care The Onion a relatat că el și Tipper au avut cea mai bună partidă de sex din viața lor după pierderea alegerilor prezidențiale din anul 2000).
983	health	Gripa aviară, numită și gripa păsărilor, poate infecta atât păsările, cât și mamiferele.
915	science/technology	Unele aplicații din această categorie oferă posibilitatea chiar și de a traduce texte în limbi străine sau semne sau alte obiecte din lumea reală atunci în momentul în care utilizatorul îndreaptă telefonul inteligent către acele obiecte.
330	sports	Nimeni n-a jucat în mai multe partide și nu a înscris mai multe goluri pentru club decât Bobek.
563	health	Concluzia studiului a fost că depresia, frica și atitudinea catastrofică mediază legătura dintre durere și handicap la cei suferind de dureri de spate.
496	health	Chirurgii cunoșteau diferite sedative, inclusiv morfina din extracte de semințe da mac și scopolamina din semințe de măselariță.
919	science/technology	Poate economisi bani în loc să cumperi noi hărți pentru un GPS, sau un dispozitiv GPS independent sau să închiriezi unul de la o companie de închirieri de mașini.
1504	science/technology	Copilul sălbatic, când este crescut în totalitate de animale non-umane, prezintă comportamente (în limitele sale fizice) aproape în totalitate ca cele ale animalului care l-a îngrijit, cum ar fi frica sau indiferența față de oameni.
1422	politics	În 1683, forțele dinastiei Qing (1644 - 1912) preiau controlul asupra zonelor costale vestice și nordice ale Taiwanului și declară Taiwanul provincie a Imperiului Qing, în 1885.
202	geography	„Precipitațiile, care au atins 6,34 țoli la un punct de măsurare de pe Oahu, au fost descrise ca «benefice».”
109	science/technology	Capsula va călători cu aproximativ 12,8 km sau 8 mile pe secundă, suficient de rapid pentru a ajunge de la San Francisco la Los Angeles într-un minut.
1521	science/technology	El sugerează, chiar, că astfel de abilități de a interpreta comportamentul uman pot fi împărtășite de animale precum câinii domestici.
1479	science/technology	„Cele mai multe interpretări ale determinismului tehnologic împărtășesc două idei generale: că dezvoltarea tehnologică în sine urmează o cale în mare parte în afara influenței culturale și politice și că tehnologia, la rândui ei, are «efecte» asupra societății care sunt inerente mai degrabă decât condiționate social.”
1163	politics	Candidații pot să-și trimită reprezentanți pentru a fi martori la toate etapele procesului. Seara, voturile sunt numărate de voluntari sub supraveghere strictă, cu respectarea unor proceduri clare.
