index_id	category	text
116	science/technology	शास्त्रज्ञाः शङ्कन्ते यत् एन्केलाडसोपग्रहः भूविज्ञानरूपेण क्रियाशीलः शनिग्रहस्य शीत E वर्तुलस्य च कारणम् अस्ति।
1034	science/technology	प्रकाशमानता भ्रमणं च तारकस्य जीवद्रव्यप्रवाहसम्बन्धिनः रॉस्बीक्रमाङ्कस्य निर्धारणे उपयोजिते।
450	geography	Serengeti प्रदेशः Serengeti राष्ट्रीयोद्यानम्, Ngorongoro संरक्षणक्षेत्रम्, तथैव च Tanzania इत्यत्र Maswa आखेटसञ्चयम्, Kenya इत्यत्र Maasai Mara राष्ट्रीयसञ्चयम् इति धारयति।
1019	entertainment	अन्येषु नामाङ्कनेषु उत्तमः चित्रपटः, उत्तमः निर्देशकः, उत्कृष्टं चलचित्रणम्, उत्तमा वेषभूषा, उत्तमं चलचित्रसम्पादनम्, उत्तमं मूलसङ्गीतम्, उत्कृष्टा निर्मितिरचना, उत्तमं ध्वनिसम्पादनम्, उत्तमं ध्वनिमिश्रणम्, उत्तमा कथा च एते नामाङ्कनाः समाविष्टाः।
26	sports	तस्यां रात्रौ तस्य द्वितीयः अङ्कः तस्मिन् वर्षे 60 मितः अङ्कः आसीत्। सः यारोमिरयागरमहाभागानन्तरं तथा च मारियोलेमियुक्समहाभागानन्तरम् 1995-96 तः आरभ्य 60 अङ्काः कुर्वाणः प्रथमः क्रीडापटुः आसीत्।
1292	sports	एनपीडब्ल्यूएस एवं स्पोर्टिंग शूटर्स एसोसिएशन ऑफ ऑस्ट्रेलिया (एनएसडब्ल्यू) इंक इत्यनया संविभगितया सह, समर्थान् स्वयम्सेवकान् स्पोर्टिंग शूटर्स संघस्य खेटनक्रमादेशस्य अधः नियुक्तः कृतः।
1795	travel	सेटं पीटर्सबर्ग परिभ्रमणे नगरे समय: अन्तर्भुक्त अस्ति । क्रूज यात्रिनां वीजा अवश्यकताभ्याम् लघु कृतः (शर्तस्य परिक्षणं करतु) ।
939	travel	सुविधित करतु यह वं जानति इति किम त्व. कस्थिति किर्तु’ ‘शक्नोति अपि च किम न करिष्यति अपि च न्याय सीमाब; अधिक कतिपय घोषित व कर्तुं शक्नोति ।
693	geography	येरूशलम इसरायलस्य राजधानी महिष्ठं नगरं च अस्ति, यद्यपि अधिकतम अन्य राज्याः संयुक्त-राष्ट्राणि च तं इसरायलस्य राजधानी न गण्यते।
778	science/technology	यदि त्वं समाप्तं भवति, तत् इदं साधारणतः सुलभं प्रयासे पूर्णं कर्तुं शक्नोति, अपि च वर्तमान D S L R यस्य समाधानं दत्त: ।
1147	health	मङ्गोल इति वैद्यकीय दातृसंस्था, मेडेसिन्स सान्स फ्रंटियर्स विश्वारोग्यसङ्घटना च मन्यन्ते यत् एषः देशे स्थापितः भयङ्करतमः रोगप्रकोपः अस्ति।
1263	politics	सार्वजनिक अभियोजन निर्देशकः कोर स्टेर्मर क्यूसी अद्य प्रातःकाले एकः टिप्पणी दत्तवन्तः, यद्य हयूना एवं प्रिसे विपरिते एक मुकद्दमा करिष्यावः।
1847	sports	"स्कीइंग अनेक उत्साही जनानां सह एक प्रमुख यात्रा गतिविधिः अस्ति, याम् कदाचित् ""स्की-बम्स"" इति रुपेन ज्ञातः, एक विशेष स्थानेषु स्कीइंगस्य समीपे सम्पूर्ण अवकाशस्य कल्पनां कृतः ।"
994	travel	केवल कतिपय एयरलाईंस अधुना अपि शोक शुल्कस्य क्षयणं कुर्वन्ति, यः अंतिम निमिषेषु अंतिम संस्कार यात्राणां आवश्यकतायां अल्प शिथिलः भवति।
927	science/technology	विमान वंदस्य समीपे श्रीस्य उपरि दोन उशन प्रायः सर्वदा एक: कतु विचारः अस्ति, यद्यपि तत् ल क्षेत्रे अवैध इति न भवति ।
811	sports	दीर्घतम् पदयात्रा एकः वर्हि गतिविधिः भवति, यत्र प्राकृतिक वातावरणे चलनां अन्तर्भुक्तः भवति, प्रायः भ्रमणम् धावयः ।
285	politics	लात्विया स्लोवाकिया च द्वौ देशौ आक्टात् संश्लेषण परिक्रियान् विलम्बं अकुरुताम् |
1342	science/technology	केम्बुकस्य रसः वर्णपरिवर्तनं करोति अम्लः सर्जियुक्तः वा अनुयू।
1800	travel	तुषार अपि च तुषार घर्षणं इति लघु मात्रे भवति अपि च त्वं एवं चालयितुं न शक्नोति यस्य त्वं अविभूषित पथे अस्ति ।
1297	politics	सः आयोगः मार्टेली महोदयस्य सुविस्तीर्ण शासनकालस्य प्रति अक्टोबर मासे आरब्धवान् विरोधस्य प्रतिक्रिया अस्ति।
1048	politics	सः पूर्वमेव सूचयति यत् अस्मिन् क्षणे न कापि कार्यप्रणालिः साम्प्रदायिकं युद्धं, वर्धमानां हिंसां कलहं प्रति निपतनं वा रोद्धुं सक्षमा अस्ति इति न कश्चित् निश्चयेन कथयति।
547	politics	2400 सैनिकानां मुख्याक्रमणकारिणी सेना ट्रेंटनप्रदेशतः 9 मीलदूरस्थां नदीम् उल्लङ्घयते। ततः प्रभातपूर्वमाक्रमणं कर्तुं द्वयोः समूहयोः, ययोः एकः ग्रीनमहोदयाधीनः अपरः च सुलिवनमहोदयाधीनःस्तः, मध्ये विभाजिता भविष्यति।
1127	health	फ्लुकमहोदया लिखितवती यत् महिलाः आरोग्यविषये वक्तुं विरोधं कुर्वतां केषांचन जनानां प्रयत्नाः विफलीभूताः।
120	entertainment	ACMA इदं अन्विष्टवती यत् चलचित्रस्य आन्तरजाले प्रसारणानन्तरमपि बिगब्रदर आन्तरजालाशयनियमावलीं न भङ्गीकृतवान् यतः माध्यमाः बिगब्रदर इत्यस्य सङ्केतस्थले न सञ्चिताः।
1113	health	बहुसङ्क्रमितेषु प्रदेशेषु एतासां लसिकाकुप्यानां वितरणयोजनायां न्यूनवित्तस्य कारणात् अन्येभ्यः रोगेभ्यः न्यूनं प्राधान्यं च एताभ्यां कारणाभ्यां विलम्बः सञ्जातः।
1442	politics	यावत् इमां रणनीतिं प्रति अल्पः प्रतिसादः अविद्यत Germany देशः अपि स्वस्य अप्रतिबन्धितब्रुडनवयुद्धे एतादृशं प्रतिसादम् अपेक्षितवान्।
830	travel	कतिपय क्रॉस-बॉर्डर ट्रेने धावमान ट्रेनस्य निरीक्षणं कृतः अपि च तान ट्रेने कोऽपि एके अवरोहणं समये तस्य समीपे वैध आईडीः भवेत् ।
1824	travel	वृहत कराधानं देशं प्रति बाध्य यात्री कदाचित् अधिक मात्रे धनस्य रक्षं कर्तुं शक्नोति, विशेषतः मादक पेय अपि तबाकू यस्य उत्पादके ।
1533	health	जैवलयाधारिताः अन्ये प्रयोगाः सन्ति - निद्रायाः पूर्वम् अधिकाधिकं द्रवपानम् (विशेषतया जलपानं चायपानं वा, विख्यातं मूत्रवर्धकम्) येन जनः मूत्रविसर्गार्थं हठात् जागर्ति।
1982	entertainment	चेरी ब्लाशं पश्य, यां हनम् इति नामेषु ज्ञात: अस्ति, 8 शताब्दिभ्य जापानी संस्कृतिनां अंशः अभवत्।
657	health	ग्रीष्मकाले अतीव दीर्घदिवसानां कारणेन पर्याप्त निद्रायाः एवं संयुक्त आरोग्यस्य समस्याः भवति।
948	travel	आहे निश्चित इति भवद यः एक बार भद्य ब मारिवाहनयति तत् सर्व बहुत स्वल्य इति भविष्यति । व अन्य नौका सध्यात्रियां मिलिला अपि च श्व झाझा इति करिष्यति ।
1892	travel	विदेशे निवासात् परं गृहस्य प्रत्यागमनवेलायां,  भवान् केचन नव संस्कृतीनां अनुकुर्वाणः  केचन स्वगृह संस्कृतेः अभ्यासानां च त्यागः अनुगृहीतवान् |
1707	travel	मोरक्को राष्ट्रे क्रयणाय कैसाब्लांका एकः न्यूनतमः आकर्षकः स्थानः अस्ति।
1729	geography	सुंदरबनः विश्वे बृहत् वेलाभू  कञ्चडवृक्षाणां पट्टकः अस्ति, वेलाप्रान्तात् बंग्लादेशीय च भरतीय ग्राम्यनोकाश्रय प्रदेशे 80km (50 mi) विस्तारितः|
1574	science/technology	वस्तुतः साम्प्रतम् उपयुज्यमानाः सर्वे सङ्गणकाः द्विमानीयसङ्ख्यासु न्यस्तायाः सूचनायाः दत्तपरिभाषाधारिताः सन्ति।
692	travel	मन्दिरे प्रवेशाय अंगकोर मार्गः आवश्यकः अस्ति अतः स्वस्य पारपत्रं मा विस्मरतु यदा टोनले सपी गच्छति।
1155	geography	"गुहायाः सर्वाणि ""सप्तभगिन्यः"" इत्यभिधानानि प्रवेशद्वाराणि न्यूनतमं 100-250 मीटरमितानि (328-820 फीटमितानि) व्यासमयानि सन्ति।"
1810	sports	टोक्यो एकमात्र एशियाई नगरः भविष्यति, यः द्वौ ग्रीष्मकालीन ओलंपिकस्य मेजबानी कृतः, यः 1964 वर्षे क्रीडानां मेजबानी अकुर्वन् ।
64	politics	मार्टासप्लिसीप्रान्तस्य भूतपूर्वः महापौरः साओपाउलोमहाभागः मूलविपत्रस्य प्रारूपं लिखितवान्। संशुद्ध्यनन्तरं प्रस्तुतं विधानं रॉबर्टोजेफरसनमहाभागस्य अधीनम् अस्ति।
1330	politics	"सः किंवदन्तीः ""राजनैतिक जलपनं दुर्बुद्धिः च"" इति सम्बोधयति।"
1448	politics	तथैव च प्रत्येकस्मिन् राजवंशे विभक्तानां प्रदेशानाम् अस्थिरं युगम् आसीत्। एतेषु त्रिषु कालेषु हानराजवंशे तथा च जिनराजवंशे एतयोः मध्ये 60 वर्षाणि यावत् प्रचलत् Three Kingdoms युगं सुविख्यातम् आसीत्।
636	science/technology	१९७० तमे वर्षे वैद्यकीयः चिकित्सकः संशोधनशास्त्रज्ञः च रेमण्ड् डमडियन् महोदयः अयस्कान्तीयानुनादस्य प्रतिमाः वैद्यकीयनिदानसाधनस्य आधाररूपेण संशोधितवान्।
1677	science/technology	नियन्त्रणं, नियोजनं तथा च अनुसूचिकरणं, ग्राहकाणां निदानानि प्रश्नान् च अभिभाषितुं क्षमता तथैव च हस्ताक्षराभिज्ञानं, ध्वनिः मुखं च एतानि समाविष्टानि सन्ति।
1398	entertainment	यदि त्वं राष्ट्रीय स्मपदः इति चलनचित्रं पश्यति, तत् त्वं चिंतनं करिष्यति यत् स्वतंत्रताणां घोषणां पत्रस्य अंतरे मूल्यवतः कोशस्य मापिकां अलिखत् ।
1605	travel	एतस्मिन् गतिशीले शटलपरिवहने प्रत्येकः जनः निजयानाधारितेन साधारणपरिवहनेन सह सम्बद्धः अस्ति।
982	travel	यदि भवान् उष्णकटीबन्धीय वर्षावनेन वाहन चालयति, केचन् क्षणेभ्यः द्वाराणि उद्घाटितः यर्हि भवान् वाहनस्य अन्ते गच्छति मशकेभ्यः वाहनस्य अन्ते आगच्छनाय पर्याप्तः सन्ति।
366	science/technology	परिसंचरण तंत्रस्य प्रमुख अंग हृदयः, यः रक्ताय संचारति ।
1651	science/technology	विषयसिद्धान्ताः जनान् खणखणायतुं किं प्रेरयति अथवा तेभ्य़ः किं रोचते इत्यस्य अन्वेषणे केन्द्रीभूताः सन्ति।
941	science/technology	अन्तर्जाले त्वं संरूपणस्य सम्पादनस्य च अनन्तरं  निरातङ्कः भवति, तत्पश्चात्, त्वं भवतः स्वीय जालादेशं स्रष्टुं शक्नोति |
876	health	चिकित्सा शब्दजालस्य सह अपरिचित लोकानं प्रति संक्रामक अपि च संक्रामक शब्दस्य भिन्न अर्थः भवति ।
661	entertainment	तस्य संगीते, पटले, साहित्ये एवं प्रसिद्ध संस्कृत्यां सामान्यचित्रणं राज्यस्य निर्माणे सहाय्यं एवं तस्य सीमा विख्यातः ज्ञातम्।
1112	health	अनेक लक्षमिताः एन्सेफालिटिस वाक्सिन् कृतकस्थाल्यः सर्वकारेण प्रतिज्ञाताः, याः आरोग्यसंस्थाभ्यः आगामिनि वर्षे सहाय्यीभूताः भविष्यन्ति।
1329	politics	कुओमो, 53, पूर्वस्मिन् वर्षे स्वस्य पारिपाल्य आरब्ध्य एवं गतमासे समलैङ्गिक-विवाहान् अनुमतिं दत्वा एकः विधेयकः हस्ताक्षरङ्कितः कृतः।
1053	politics	श्रीमतिः किर्श्नरमहोदया स्वस्याः अध्यक्षाभ्यर्थितायाः उद्दिष्टम् अर्जेंटाईननाट्यगृहम् इत्यत्र स्थाने उद्घोषितवती। एतद् तदेव स्थानमस्ति यत्रतः सा 2005 वर्षे तस्याः ब्युनासआयरिसप्रान्तस्य शिष्टमण्डलस्य सभागृहस्य प्रतिनिधिरूपेण अभियानम् आरब्धवती।
1948	travel	कृपया स्मरति यत् भवान् निदानेन घनं गभीरं क्षेत्रं गच्छति, एवं एकस्मिन् क्षेत्रे यस्मै विश्वस्य जन्संख्यायाः महत्त्वपूर्णः भागः अपरिगण्य अर्थं अस्ति।
923	science/technology	 एतत् सेवायाम आगम्य प्राय: टोल-फ्री टेलीफोन नंबरस्थ माध्यमेम भवति भाम कोऽपि शुक्रस्य विना अधिकांश फोनाया कले कर्तु शक्नोति ।
173	science/technology	समुद्रतलस्य मानचित्रणानन्तरं भग्नावशेषः आर् ओ वि तन्त्रस्य साहाय्येन अन्वेषितः।
1087	science/technology	यथा चन्द्रमाः पृथिव्यां आकर्षणं उद्भावयति येन ऊर्मयः जायन्ते तथैव आकाशगङ्गा अपि धनुतारापुञ्जे आकर्षणं उद्भावयति |
1328	science/technology	वैज्ञानिकाः ग्रहनिर्माण अवगमनस्य आशां कुर्वन्ति, विशिष्टरूपेण पृथिव्याः निर्माणं, यतः केतवः पृथिव्याः बहु पूर्वं संघट्टते।
914	science/technology	रियल-टाइम टेक्स्ट ट्रांस्लेटर एप्स-एप्लिकेशन यः टेक्स्टस्य सम्पूर्ण सेगमेंट एक भाषाभ्यं अन्य भाषायाम् स्वचालित रुपेन अनुवादं कृते सक्षमः अस्ति ।
1341	science/technology	एतत् एकस्य रसायनस्य् pH कथ्यते। भवान् रक्त केम्बुकेन रसेन एकस्य देशकस्य निर्माणं कर्तुं शक्नोति।
336	entertainment	"अन्ते फायर आफ अनातोलिया इति तौरुष्किक नृत्यमण्डलः ""ट्राॅय"" इति प्रदर्शनं अकरोत्।"
1005	entertainment	2017 वर्षस्य उत्तरार्धे सिमनोफमहोदयः दूरदर्शनस्य क्युव्हीसी इति विपणिवाहिन्यां प्रकटीभूतः।
1671	science/technology	मस्तिष्कविकृतेः वर्तनस्य च सहसम्बन्धः शास्त्रज्ञेभ्यः तेषां संशोधने समर्थनं ददाति।
1597	science/technology	हर्षेमहोदयः चेसमहोदयः च जीवाणौ स्वDNA प्रत्यारोपयितुं विषाणूनाम् उपयोगं कृतवन्तौ।
1008	health	आरम्भे ZMapp नाम एकं प्रतिद्रव्यं एतस्मिन् क्षेत्रे आशां दर्शितवत् किन्तु औपचारिकम् अध्ययनम् असूचयत् यत् मृत्युरोधे तस्य लाभाः न्यूनाः सन्ति।
1313	health	यर्हि सः चिकित्सालये कार्यं करोति लिगिन्सः स्वस्य अतिरिक्तकाले अपूर्णकालश्रमस्य विषये अन्वीक्षणं आरब्धवान्।
665	travel	"""प्रारूपिक"" नमने ऑरलैंडो राष्ट्रीय विमानपत्तने उड्डयनं, क्षेत्रोपरि डिज्नी वसतिगृहे लोकयानेन गच्छतु, सामान्यतः एकः सप्ताहः डिज्नी विभवं त्यजनं विना व्ययतु एवं गृहे प्रत्यागच्छतु समावेशितः अस्ति।"
242	geography	तत्र त्रयः महत्वपूर्ण वैज्ञानिक उपकरणानां वहनात् परं चन्द्रपरीक्षा सर्वोस्थाने भारतीय ध्वजस्य मानचित्रं अपि भृतः ।
383	politics	अयं सैन्यदलः ओलाफ-ट्रिग्वासननाम्ना नार्वेदेशवासिना नीतः यः स्वदेशं डेनमार्कदेशस्य अधिकारात् पुनर्प्राप्तुं इयेष।
