index_id	category	text
1416	sports	लोकप्रिय क्रीडानां मध्ये फूटबाल, बास्केटबाल, भलीबाल, वाटर-पोलो, तलवारबाजी, रग्बी, साइकलिंग, आइस हाकी, रोलर हाकी अपि च एफ १ मोटर प्रतियोगिता इत्यादि अंतर्भूतः ।
129	entertainment	अस्मिन् वर्षे जून तथा अगस्तमासयोः मध्ये CowParade इति विश्वस्य विशालतमस्य जनसमारोहस्य आयोजनं कारयमाणम् इदं नगरम् आग्नेययोरोपखण्डस्य प्रथमं नगरं भविष्यति।
1003	science/technology	सः WiFi द्वारघण्टिकां निर्मितवान्। सः अवदत्।
271	health	डॉ ली पूर्व फलाफल पत्रस्यो विषये चिन्तां व्यक्तवम् यत् तुर्की देशो शिशुः रोगनां बिना A(H5N1) एवियन इन्फ़्लुइंजा वाइरसेनसंक्रमित अभवत् ।
103	politics	दूरचित्रवाण्यां दर्शितानि भाष्याणि वरिष्ठाः ईरानदेशीयसूत्राः प्रथमतः एव इदं स्वीकृतवन्तः यत् सम्मोदनं प्रभावितं जातम्।
14	sports	"⁣क्रीडानन्तरं क्लेसम्राट् अवदत्, ""महत्त्वपूर्णायाः स्पर्धायाः अन्तिमेषु मण्डलेषु स्थानं प्राप्तुम् अहम् अतीव उत्सुकः अस्मि। एतद् विजयप्राप्त्यर्थं प्रयतितुम् आगतः अत्र अहम्।"""
1412	politics	कांग्रेसस्य समीपे शुल्क निर्धारणस्य किंचित अपि शक्ति न आसीत्, अपि च कारणः कोऽपि राष्ट्रीय कार्यकारिणी एवं व्यायपालिका न आसीत्, इदं राज्यस्य अधिकारीनांउपरि निर्भरः आसीत्, यः प्रायः असहयोगी आसीत्, तस्य सभी कृत्यस्य कार्यकरी कारणं हेतु ।
1811	travel	यदि त्वं स्थगनस्य घोषणायां पूर्वे 2020 वर्षें कृते स्व उड़ान एवं आवासं रक्षितं कृतः, तत् त्वं कृते एकः कठिन स्थिति इति भविष्यति ।
1681	science/technology	तन्त्रज्ञानं आभासात्मिकाक्षेत्रयात्रारूपेण उपायं यच्छति। छात्राः कक्षायाम् एव उपविश्य सङ्ग्रहालये शिल्पकृतीः द्रष्टुं, कमपि मत्स्यालयं गन्तुम् अथवा सुन्दरां कलां प्रशंसितुं शक्नुवन्ति।
335	entertainment	तौरुष्किक गायिका सेजेन अक्सु, इटलीदेशीय अन्वयः एलेसेंड्रो सफीनाया एवं यवन गायकः हारिस एलेक्सीउ याभ्यां सह आचरणं अकरोत्।
378	science/technology	प्रायः त्रयसहस्त्र वर्षस्य पश्चात्, 1610 वर्षे इटालीवासी वैज्ञानिक गैलीलियो गैलीली इदं पश्यताम् एक दूरबीनस्य प्रयोग कृतः यतः शुक्रस्य चरणः भवति, यस्मात् चंद्रमा करोति ।
1367	science/technology	वैज्ञानिकः चिन्तयति यत् ओसेलोटस पशोः अनुसरण करोति अपि च खादितुम् (खाद्य) सुगंधेषु अनुसंधानं करोति, यद्य सः भूमें अस्ति ।
703	travel	पर्यतनः विशालसमूहेभ्यः न्यूनमूल्यं अस्ति, अतः यदि भवान् एकाकी अथवा एकेन मित्रेण सह अस्ति, तर्हि समीचीनं एकस्मै जनाय मानाय नवीन जनान् मिलित्वा समूहः निर्माणं कुर्यात्।
297	politics	प्रस्तुतं प्रतिसमाधानं पूर्वमेव द्वयोः गृहयोः २०११ तमे स्वीकृतवान्।
80	sports	तदनन्तरं मारूकायडोरमहोदयः काबूल्चरमहोदयं सामयिक्याम् अन्तिमस्पर्धायां पराजितवान्।
1823	travel	शुल्क मुक्त क्रीणं कार्य कतिपय स्थाने करतू अपि च उत्पाद शुल्कत: रक्षं प्राप्त वस्तु क्रीणं अवसरः अस्ति ।
836	travel	वास्तुकला वैचित्र्यं भवन निर्माणस्य च सम्बध्दः अस्ति । कस्यापि स्थानस्य वास्तुकला प्रायः स्वोचितेन प्रकारेण पर्यटकानां आकर्षकः भवति।
880	travel	एवं अवश्यकताः प्रायः इदं उपरि निर्भरं करोति यः यात्रीः किमर्थम् देशे गच्छः एवं यात्राणां कृते इच्छति ।
1143	politics	नैर्ऋत्य-आफ्रिकादेशस्य जनस्य सङ्घटना (SWAPO) इत्याख्यः शास्ता पक्षः अपि संसदीये निर्वाचने बहुमतं पुनः प्राप्तवान।
650	science/technology	भवतः वसतिस्थानं यजमानाः वा (यदि भवान् अतिथिगृहे निजगृहे वसन् आसीत् चेत्) प्रायः WiFiसंलग्नम् अथवा आन्तर्जालसंलग्नं सङ्गणकं धारयिष्यति। तथा च सर्वाः वसतयः कमपि आन्तर्जालालयं वा सार्वजनिकWiFiयुक्तं स्थानं वा धारयन्ति।
702	travel	भवतः पारपत्रं न्यूनातिन्यूनं भवतः यात्रा दिनाकाः अग्रे 6 मासेभ्यः मान्य भवेत्। वासस्य दैर्घ्यं सिद्धं कर्तुं प्रत्यागमनाय यात्रापत्रस्य आवश्यकता अस्ति।
1604	travel	प्रतिप्रभातं जनाः यानैः कार्यस्थलं गन्तुं लघुग्रामान् त्यजन्ति तथा च तानि वाहनानि तेभ्यः जनेभ्यः यच्छन्ति येषां कार्यस्थलम् अस्ति तद् स्थानं यद् एतैः त्यक्तम्।
817	sports	बार्सिलोनायां अनुगमन यात्रा मूलानां सहिते बार्सिलोना अपि च कोपेनहेगनस्य अनुगमन कोपेनहेगन, शीघ्रं प्राग अपि च अन्य अनुगमन यात्राः प्राक् अन्तर्भूतं भवति ।
1763	travel	प्रतिवर्षं, दर्जनः आईटीआई आगंतुक कषितः भवति, कारणः ते उचित दुरे न तिष्ठन्ति । इदं पशु बृहत् वन्य अपि च संभावित रुपे विपदसंकुलः अस्ति, इत्थम् तां स्व स्थानं दत्तः ।
1290	politics	इजराइल राष्ट्रः निवति गम्यमान सैनिकानां उपस्थितिः दशवर्षीय सन्धिं अभियाचते, तर्हि पीए तादृशी उपस्थितिं त्यक्तुं केवलं पञ्चवर्षाणां एव अङ्गीकरोति।
1775	entertainment	"मुख्य स्थानीय बियर नामांक एकः भवति, एतत् एक सङ्कुलम् बियर न अस्ति अपि च सुखद अपि च अक्लिष्ट अस्ति । अन्य स्थानीय बियरम् ""मंटा"" इति कथ्यते ।"
642	science/technology	आन्तर्जालस्य तथैव च विश्वव्यापीजालस्य प्रयोगः शिक्षार्थिनः सर्वकालेषु सूचनायाः प्राप्त्यर्थं अनुमन्यते।
1544	politics	सितम्बर 17, 1939 पर्यन्तं पोलिशरक्षा सम्पूर्णतया खण्डिता जाता। तथा च अपयानं रोमानियनसेतुमुखेन सह पुनर्रचना च केवलम् इति एव आशा आसीत्।
1148	health	"मेडेसिन्स सान्स फ्रंटियर इत्यस्याः संस्थायाः प्रवक्ता रिचर्डवीयरमनमहोदयः उक्तवान्, ""अङ्गोलादेशः हीनतमं रोगप्रकोपम् अनुभवति तथा च अङ्गोलादेशे स्थितिः अतीव हीना सञ्जाता।"" सः अवदत्।"
801	health	मद्यपानः संयमं कुरु (मद्यः प्रतिजनं पृथक रुपेन प्रभावित कृत, अपि च स्वसीमान्यम् ज्ञानः अतीव प्रयोजम् अस्ति ।
1741	travel	सेतुः सेप्टेंबर 2017 तमे पूर्णरूपेणा सक्रियः भविष्यति, यदा ब्राजील्य शुल्क-नियन्त्रण-बिन्दवः समापनं भविष्यति।
1140	entertainment	यद्यपि समारोपप्रसङ्गे विन्फ्रेमहोदया भावनाशीला भूता तथापि सा रसिकान् प्रतिज्ञातवती यत् सा पुनरागमिष्यति।
1267	health	एडगर वेगुइल्लम् हस्त एवं मुखे आघात प्राप्तवान्, यद्यपि क्रिस्टोफर स्निदरम् तस्य मुखस्य पुननिर्मानम् चिकित्साया प्रयोजनम् आसीत् ।
1774	entertainment	एतानि अनेक प्रकार विपणिभ्यः कदाचित् पारिवारसम्मर्द समुद्रतटाः भवन्ति | तरणं सुरक्षितः अस्ति |
862	health	परंतु विश्वस्य अन्य भागे, यद्य बैक्टीरियोलाजिकल जीवः त्वं प्रति नवः भवति, त्वं समस्यायाम् अंशग्रहन प्रति अधिकं संभावना अस्ति ।
1069	politics	"प्रधानमन्त्रिमहोदयोन सह मिलनसमये लेटनमहोदयः कॉन्झर्वैटिव्हपक्षस्य पर्यावरणीयस्य विपत्रस्य ""सम्पूर्णतया पुनर्लेखनार्थं तथा च"" विपत्रं परिवर्तयितुं न्यवेदयत्।"
325	geography	राष्ट्रीय मेघरूपचक्रवातः संस्थायाः वैज्ञानिकाः निर्दिशति यत् डेनिएल बुधवासर पर्यन्तं एका मेघरूपचक्रवातस्य रूपेण प्रबलः भविष्यति।
1314	health	तस्य अनुसन्धानं दर्शयति यत् यदि हार्मोनान् वाहितः कृतः तर्हि शिशोः गर्भफुफ्फुसयोः विकामस्य वेगे वृद्धि भवेत्।
704	travel	किन्तु, एतत् भवतः चर्चायै दूरे न भवेत्, यतः कारयानानि पूर्यितुम् बहुवारं पर्यटकान् अपकर्षन्ति।
528	sports	आधुनिका खड्गक्रीडा विश्वविद्यालये पठद्भ्यः छात्रेभ्यः व्यावसायिकस्तरेषु ऑलिम्पिकक्रीडास्पर्धायां एतादृशेषु विविधेषु स्तरेषु क्रीड्यते।
532	sports	न्यूनतमैः प्रहारैः लगुडस्य न्यूनतमाभिः दोलाभिः यः क्रीडापटुः क्रीडां समापयति, सः जयति।
1643	science/technology	जनः इदमेव कल्पितुं शक्नोति यत् कीलफलकस्य भविष्यं किं विद्येत् यदा किमपि नूतनं वस्तु प्रकटीभवति।
868	travel	विशेष रूपेण स्व प्रारंभनं दिवसे, अनुकुलने सहायता कृतं प्रति पश्चिमी शैली अपि च गुणवत्तां अतिथिशालायां, भोजन अपि च सेवाभ्यम् व्ययं कृते विचारं करतु ।
124	entertainment	द डेली शो तथा च द कोल्बर्ट रिपोर्ट इत्याख्ययोः मालिकयोः पूर्वं हेकमहोदयः जॉन्सनमहोदयः च यदा 1988 वर्षे UW इत्यत्र विद्यार्थिनौ आस्ताम् तदा तौ वार्तायाः वार्ताङ्कनस्य च विद्रूपकं कुर्वत् एकं विद्रूपकम् अकल्पेताम्।
1159	politics	फ्रान्सदेशे, मतदानं पारम्परिकरीत्या अल्पतन्त्रज्ञानाधारितः अनुभवः अस्ति। मतदातरः स्वान् एकस्मिन् केन्द्रे एकाकीकुर्वन्ति। स्वचितं प्रत्याशिनं सूचयत् पूर्वमुद्रितं पत्रं पत्रपुटे स्थापयनन्ति।
701	travel	क्यूबा नागरिकाः ये यू. एस. इत्येषां समीपे ग्रीन कार्ड अस्ति तान् एतत् आवश्यक्तयाः विनिर्मोक्षाय इक्वेडोरस्य वाणिज्य-दूतावासे गच्छेत्।
560	health	पीडितस्य जनस्य परीक्षणपूर्वं भवान् स्वसुरक्षार्थं स्थानं परीक्षेत।
167	politics	इदम् आक्रमणं भारतपाकिस्तानदेशयोः सम्बन्धेषु तीव्रः कर्षणरूपः आसीत्।
301	politics	पातस्य पृथक् वौटिएर महोदयस्य उप्लब्धयः 1973 तमे नयदोशवेचनायाः विरुद्धम् क्षुधा अनशनं समावेशति।
40	entertainment	"WNED बफेलो ( रेनबोस्य गृहस्थानक पठति) इत्यस्य जॉन ग्रँट वदति, ""रेनबो पठनं बालकान् किमर्थम् पठनम् इति पाठयति,... वाचनस्य प्रोत्साहन​: — [एतद् कार्यक्रम​:(शो)] बालकान् पुस्तकम् स्विकरन्ति वाचने उपमदति च​""।"
1414	politics	अनुच्छेदं मध्ये संशोधनस्य पूर्वे सर्व राज्यानां सर्वसम्मतिनां आवश्यकताः आसीत अपि च राज्यः केंद्र सरकारानां इदं सामान्य रुपे अचिन्तयति यत् तस्य प्रतिनिधि प्रायः अनुपस्थितः आसीत् ।
1789	travel	यद्यपि को अपि संशोधन एवं अनुरोधं प्रथम ट्रैवल एजेंटस्य माध्यमे प्रषयति, नः पोनतः अतिथिशालानां सह ।
754	travel	कोऽपी अतिथिशालायां स्टीम रेलवे एपीआई छ ओशन लाइनर्सस्य स्वर्ण युगस्य परम्परा अस्ति, द्वीतीय विश्व युद्धस्य पूर्वे, १९th अथवा २०th शताब्दानां प्रारम्भतः ।
1142	politics	नामिबियादेशस्य राष्ट्राध्यक्षीयानां संसदीयानां च निर्वाचनानां अन्तिमाः परिणामाः सूचयन्ति यत् अवस्थितः राष्ट्राध्यक्षः हिलफिकेपुन्येपोरम्बामहोदयः विशालेन समासेन पुनः निर्वाचितः।
1022	politics	ट्रम्पमहोदयस्य टर्कीराष्ट्राध्यक्षरेसेप-तैयिप-एर्दोगेनमहोदयेन सह दूरध्वनिमाध्यमेन जातं सम्भाषणानन्तरं एषा उद्घोषणा कृता।
538	travel	क्वचित् पर्यटकाः कस्यचित् देशस्य विशिष्टालक्षणयुक्तानि स्थानानि गच्छन्ति अथवा ते केवलं एकमेव प्रदेशं लक्षीकर्तुं इच्छन्ति।
155	geography	एतेषु १५ आश्मनः गतजुलैमासे अभवत् अशनीवर्षायां एव पतिताः।
1278	health	यद्यपि त्रयः जनाः गृहस्य अन्तः सन्ति यदा कारयानस्य प्रभावः जातः, तथापि कोऽपि पीडितः न अभवत्।
1197	sports	तेषु समाविष्टाः सन्ति - नैदरलैण्ड्सदेशः श्वः यस्य एनाजोकेम्सेनमहोदया Super-G समूहे महिलानां तालिकायां नवमं स्थानं प्राप्तवती। अन्यः च फिनलैण्डदेशः यस्य काट्जासारिनेनमहोदया तस्मिन्नेव समूहे दशमं स्थानं प्राप्तवती।
1541	politics	द्वितीये विश्वयुद्धे जर्मनीदेशः यु.एस्.एस्.आर्.-यु.एस्.ए.देशयोः सहकार्यं परिणयन् सामान्यः शत्रुः आसीत्। युद्धस्य अन्ते व्यवस्थासु प्रक्रियासु तथा च संस्कृतिषु उद्भूताः कलहाः नैकानां देशानां लोपे च परिणताः।
1111	health	अस्य रोगस्य उद्घट्टनात् भारतीयसर्वकारेण अतिसङ्क्रमितक्षेत्रेषु शूकरपाशीनाम् उपयोजनं, सहस्रानां मशकजालानां वितरणं तथा च कीटकनाशकानां तुषारसिञ्चनम् इति उपायान् योजिताः।
889	geography	अन्तर्देशीय अंटार्किका निर्जन गिरिप्रस्थः २-३ किलोमीटर् पर्यन्तं हिमेन परिवृत्तः अस्ति |
324	geography	चण्डवातः मियामी, फ्लोरिडा राज्यात् 3000 क्रोशेषु निकटे निविष्टः, अधिकतम प्रमाणित वायवः 40 क्रोशकः प्रति होरा ( 64 की.मी प्रति होरा ) सन्ति।
118	entertainment	क्रीडाप्रकाशिका कोनामीसंस्था जापानीवृत्तपत्रे निवेदितवती यत् 6 डेज् इति क्रीडां ते फालुजा इत्यत्र स्थाने न विमोक्ष्यन्ति।
1018	entertainment	उत्तमः अभिनेता इति गोसलिङ्ग उत्तमा अभिनेत्री इति स्टोन् च यथाक्रमं नामनिर्देशं प्राप्तवन्तौ |
523	health	भवतः कृते इदं प्रति 20-30 निमिषानन्तरं जागरित्वा दूरदर्शनस्य प्रेक्षणम् इव अवसादकरः वर्तते।
1637	science/technology	भवान् कौकिलीयसदृशानां अधातुमूलद्रव्याणि धारयतः मिश्रधातून् अपि प्राप्तुं शक्नोति।
749	travel	स्व चतुः चक्रिकायां उपविस्य अपि च दीर्घतम मार्ग यात्रे गच्छन: इति एतस्य सादगिनां एकः आंतरिक अपीलः भवति ।
1575	science/technology	द्विमानसङ्ख्या द्वयोः मूल्ययोः केवलम् एकं मूल्यं धारयति यथा 0 अथवा 1 तथा च सङ्गणकशब्दावल्याः उपयोगार्थम् एतौ अङ्कौ द्विमानाङ्कौ अथवा बिट्स इत्याख्यातौ।
524	health	एषः परिणामः भवतः मस्तिष्कं प्रतिरात्रं कतिवारं सुस्पष्टतया स्वप्नं द्रष्टुं प्रयतते एतस्योपरि आधारितः अस्ति।
