index_id	category	text
431	geography	तुर्की त्रय दिशानां समुद्रेन आवृतः अस्तिः पश्चिमे एजियन सागर, उत्तरे काला सागर अपि च दक्षिणे भूमध्य सागरः ।
403	science/technology	युद्धस्य आरम्भन्ये ते साधरणतः समुद्रस्य शीर्ष यात्राः अकुर्वन्, परंतु यस्य-यस्य रडार विकसितः भवति अति एव शुद्धता भवतः अपि च पनडुब्बिनां जलस्य अंतरे गंतुम् एवं न दृश्यवत् शक्तिशाली भवतः ।
1592	science/technology	यदा ग्रीकजनानां ज्ञानं न्यूनीभूतं, पाश्चिम जगत् स्वं ग्रीकदर्शनात् तथा च शास्त्रीयमूलेभ्यः विगलितं अभवत्।
993	entertainment	यद्यपि, शितस्य समये तान् समीपे एकः अन्य सुंदरता अपि च अकर्षणः भवति, अनेक हील स्टेशने स्वस्थ मात्रे तुषारः भवति अपि च अभिनेत्री एवं परङ्गस्य पेशकश कुर्वः।
755	entertainment	एतत् अथिथिशालाः आसीत् यत्र धनवान एवं दिनस्य प्रसिद्ध लोकाः तिष्ठतः, एपीआई छ प्रायः उत्तमं भोजन अपि च रात्री जीवनः अभवतः ।
1936	politics	1994 तमे, एतस्य रणस्य कारणेन पूर्वी मोलदोवायां स्व-घोषित ट्रांसनिस्ट्रिया गन्तन्त्रस्य निर्माणं अभवत्, यस्य स्वस्य शासनं मुद्रा च स्तः परन्तु किमपि UN सदस्य राष्ट्राः तं वैद्यं न प्रतीयते।
1205	health	डानियल् लन्टाग्ने, सङ्घटित राष्ट्राणां रोगविशेषज्ञः अवदत् प्रायशः शान्तिस्थापकेभ्यः एव एतत् बहिरुद्रेकः जातः |
1692	geography	दूरतरे उत्तरदिक्स्थानि विशालक्षेत्राणि विरलजनयुतानि तथा च कानिचन अनिवसितानि वन्यक्षेत्राणि विद्यन्ते।
280	politics	विरोध प्रदर्शनस्य आयोजकः वदत् बर्लिन कोलोन, हैम्बर्ग एक हंबर यस्य जर्मन नगरे 100,000 स्य समीप संख्यानां लोकः आगच्छत ।
247	politics	एषः गुप्तचरः पाकिस्तानी संविधानस्य अनुच्छेद 247 तस्य अनुगता सरकारी एवं व्ययिक सेवायां प्रदानस्य पृच्धीनताः भवति ।
1439	politics	शत्रुतानां प्रकोपानन्तरं सपदि Britain देशः Germany देशस्य नौकावरोधं कर्तुं प्रारभत।
1239	entertainment	"""साः अधिक मनोमोहाः अपि च सम्यकः गायति,"" सः समाचार संमेलेने एक प्रतिलेखे वुब्रूतः।"
743	geography	कुक द्वीप कोऽपि नगरः न अस्ति परंतु 15 विभिन्न द्वीप सहितं कृतः । एतानी शरोटोंगा अपि च एतुताकी प्रमुखः भवति ।
18	politics	विश्वव्याप्तौ विरोधनाः अभवन्। अनेके अपराधाभियोगाः भूताः। आईसलैण्डपाकिस्तानदेशयोः राजनेतारः निसर्गपत्राणि दत्तवन्तः।
1344	science/technology	हाइड्रोजन इआन्स् प्रणिकाः सन्ति यत् स्वस्य ऋणिकाः मुषिताः (यतः हाइड्रोजन-परमाणवः एका प्रणिका एका ऋणिका च युताः सन्ति)।
688	travel	परिमेय समयेन सह दर्शकाः कुत्र अन्यत्र समयं व्ययं कुर्युः।
556	science/technology	अणुः सर्वद्रव्याणां मूलबन्धकद्व्येषु एकः इति मन्यते।
1645	science/technology	भारयुक्तशकटस्य पर्वतोपरि विलोलं इव अस्ति इदम्। कोशकेन्द्रस्य विदारणं पुनरेकवारं ऊर्जायाः कमपि अंशं मोचयति।
907	science/technology	ते साधारणतः उच्च बैडविड्थ अपि च सेवानां उत्तम वास्तविकता पदयति । ते एन्किप्तेडः भवति अपि च इदं प्रकारे अनुसंधान इति कठिनःभवति ।
1071	politics	परं प्रधानमन्त्री जॉनहॉवर्डमहाभागः अवदत् यत् तास्मानिया सर्वकारस्य 45 दशलक्ष-आस्ट्रेलियाईमुद्रायाः दानस्य एषा कृतिः रुग्णालयस्य सुविधाः ह्रासात् संरक्षणार्थम् एव विद्यते।
555	sports	क्रीडापटवः मन्येयुः यत् ते उत्पादनमिच्छन्ति यदा तेन न केचित् लाभाः सन्ति।
1203	health	सैन्यस्य आगमनपूर्वं, हैतीदेशः 1800 वर्षादारभ्य रोगसम्बन्धसमस्याः न संगतः |
58	politics	रक्षिकाः उक्तवन्तः यत् लोपिकोलोमहोदयः प्रभावशाली आसीत् यतः सः प्रोवेंझोमहाभागस्य पालेर्मोनगरे महत्त्वपूर्णः जनः आसीत्। तस्य महदनुभवकारणेन सः स्वामीनां पुरातन्याः श्रेण्याः आदरम् अपि जितवान् आसीत् यतः ते प्रोवेंझोमहाभागस्य शक्तिजालवर्धनाय अप्रसिद्धेः नीतिम् अवलम्बितवन्तः।
1764	travel	एतत् उपरि, इदं विषये अवगतः अभवत् यत् गंध भालू अपि च अन्य वन्यजीवनां आकर्षित कृतः, इत्थम् गंधयुक्त खाद्य पदार्थानां वहयति एवं पचतः रक्षः अपि च एकः स्वच्छ शिविरः रक्षतु ।
195	sports	2009 वर्षस्य शेष सत्रे न्यूनतम समयः व्यतित मासाः वभून ।
1785	travel	अग्रिम बुकिंगतः यात्रीनां मनस्य शांति प्राप्नोति यः स्व गंतव्यं उपस्थितं पश्चात् त्वं समीपे सुप्तनं प्रति कुत्रचित भवति ।
600	science/technology	मात्राणि संयुगानि च एकस्याः अवस्थायाः अन्याम् अवस्थां प्राप्तुं शक्नुवन्ति किन्तु परिवर्तयितुं न शक्नुवन्ति।
553	sports	मध्यान्तरमात्रं धावनं सापेक्षतया महार्घा क्रीडा अस्ति। तथापि तस्यां क्रीडायां सहभागे आवश्यकानां साधनानां विषये बहवः मूढकल्पनाः सन्ति।
1720	geography	उद्यानं 19,500 km² छदति एवं 14 भिन्नः पर्यावरण-हितैषी क्षेत्रेषु भजितः अस्ति, प्रत्येक भिन्नः आरण्यकजीवानां समर्थनं करोति।
1622	geography	अमेजान् नदी पृथिव्यां द्वितीया दीर्घतमा तथा च विशालतमा नदी अस्ति। सा अपराविशालतमायाः नद्याः अपेक्षया ८ गुणितं जलं वाहयति।
1441	politics	Britain देशः सम्पूर्णमहासागरतः प्रविश्यमानं कमपि पोतं रोद्धुं अन्तर्राष्ट्रीयजलानि अखनत् येन उदासीननौकासु अपि भयं सञ्जातम्।
566	health	दृष्टिः अथवा द्रष्टुं क्षमता दृश्य-प्रणाली-संवेदी-अङ्गेषु नेत्रयोः उपरि वा आधारिता अस्ति।
1515	science/technology	अन्तर्जालस्य विशिष्ट स्वगुणाः समधिक प्रकाराः उपगमस्य उपयोगाः सुखानि च अनुगन्तव्याः भवन्ति |
585	science/technology	तथापि आद्याः सत्याः वाननिरीक्षण्यः 16 शतकस्य उत्तरकाले योरोपखण्डे निर्मिताः।
1689	geography	Ottawa इति Canadaदेशस्य मनोहरा, द्विभाषिका राजधानी विद्यते तथा च कलादालनानां पङ्क्तिबन्धं तथैव च Canadaदेशस्य भूतवर्तमानौ दर्शयतः सङ्ग्रहालयान् सुदर्शयति।
1256	health	इंफ्रारेड स्पेक्ट्रोस्कोपी (ए एटी आई आरस्य) तुलनात् एषः कृष्टलस्य संरचनात् प्रभंवितं गृहे स्थित प्राणीनाया मूत्राणां प्राप्नोति ।
60	science/technology	ऐपलसंस्थायाः मुख्य़ः कार्यकारी अधिकारी स्टीवजॉब्जमहोदयः मञ्चम् आगत्य स्वतुलोरुकस्यूतात् iPhone इति यन्त्रं बहिः निष्कास्य तस्य उद्घाटनम् अकरोत्।
32	sports	यथा अलोन्सोमहोदयस्य पुरतः वर्तमानानि अन्ययानानि इन्धनपूरणार्थम् रक्षायानस्य अधस्तात् गताः, सः विजयं प्राप्तुम् अग्रे गतः।
1411	politics	क्रांतिकारी युद्धनां मध्ये, त्रिरत राज्यः सर्वानां पुरवे एकं निर्बल केन्द्रस्य गठनं कृतः, यद्य कंग्रेसः एकमात्र घटकः आसीत्-परिसंघ लेखनस्य अनुसारेण ।
13	sports	नदालमहोदयः क्रीडाविजये कारणीभूतेषु 76 अङ्केषु 88% अङ्काः प्रथमक्षेपणे एव प्राप्तवान्।
1941	travel	विस्तीर्णाः मार्गाः, काच-अग्रभागः भवनानि एवं आधुनिक विपणयः बिन्दुकित रक्तवर्ण-पक्वेष्टकायाः चालः अस्ति, 18 शताब्दे आपणाः, एवं प्राचीन यावनदेवालयाः क्रैस्तदेवालयाः च, यद्यपि नगरस्य वातावरणं पारम्परिक तुरूष्कदेशीय तुलनायां भूमध्यसागरीय यूरोपस्य समानं अस्ति।
732	sports	ह्वीस्लर (वैंकूवरतः 1.5 घटिका परिचालन) व्यवहुल अस्ति परंतु 2010 वर्षस्य शीतकालीन ओलंपिकस्य काराणां प्रसिद्धः अस्ति ।
871	entertainment	प्रातः स्वगृहे कॉफीभ्यां परिपूर्णं करोतु अपि च रात्रौ विश्राम कृत कैमोमाइल चायभ्यः पूर्णं करोतु ।
886	geography	अंटार्कटिका पृथिव्यां शीतलं स्थानं अस्ति, दक्षिण धृवे च परितः अस्ति |
362	science/technology	शतकार्यसमयानन्तरं विद्युद्दीपस्य तन्तुः कालेन यावत् शोचयति एवं तत् विद्युद्दीपं कार्यं न करोति।
1578	health	विशिष्टविषस्य कृते विद्यमानानां विशिष्टप्रथमोपचारसूचनानां नामपत्रं परीक्षणीयम्।
996	travel	सर्व विषये, त्वं एयरलाईंनस्य सह दूरभाषा माध्यमेन आरक्षणस्य आवश्यकं भविष्यति।
197	health	राष्ट्रपति महोदयस्य स्वास्थ स्थिरः भवति, परंतु किंचित कालवंशात् गृहं पृथकं रक्षामः ।
460	entertainment	अधिकतराणि दूरदर्शनयन्त्राणि एवविध निर्मितानि यथा जनसामान्यस्य चित्तप्रसादनं भवेत् |
154	geography	२४००० पृथिवीपतितासु ज्ञातासु अशनिषु केवलं ३४ अशन्यः मङ्गलग्रहमूलाः इति निश्चितम्।
1160	politics	यदा अधिकारिणः मतदातृणां परिचयं साक्षीकुर्वन्ति, मतदाता तद् पत्रपुटं मतपेटिकायां निक्षिपति मतसूच्यां स्वहस्ताक्षरं करोति च।
1223	entertainment	5 आगस्ते प्रदर्शनं समये मंचतः पतिताम् पश्यात् मुख्य गायक स्टीवन टायलारस्य आघातप्राप्तं अनंतरं अनुस्थानः स्थगितवान् ।
54	politics	ऑस्ट्रेलियादेशस्य कोषाध्यक्षः तथा च प्रधानमन्त्री जॉनहावर्डमहोदयस्य उत्तराधिकारी पीटरकॉस्टेलोमहोदयः ऑस्ट्रेलियादेशे आण्विकविद्युदुद्योगाय समर्थनं दत्तवान्।
7	politics	डाउनिङ्गमार्गः इति प्रधानमन्त्रिणः अधिकृतनिवासस्थानस्य पुरतः विद्यमानस्य सुरक्षितप्रवेशद्वारस्य पुरतः व्हाईटहाल इत्यत्र स्थानीयवेलानुसारं 11:00 वादने (UTC+1) निदर्शनं प्रारब्धम्।
1010	sports	अमरिकीबाहुव्यायामसङ्घटना अमरिकीओलिम्पिकसमित्याः पत्राय समर्थनं दत्तवती तथा च सर्वेषां क्रीडापटूणां कृते सुरक्षितं पर्यावरणं समुन्नन्तुं ओलिम्पिकपरिवारस्य सम्पूर्णाम् आवश्यकतां स्वीकृतवती।
1174	sports	अन्तिमं गुणगणनम् एकगुणाङ्कभेदः विजयः आसीत् 21-20 येन ऑलब्लैकसङ्घस्य सततं 15 क्रीडाविजयस्य शृङ्खला खण्डिता।
1202	health	नियमाणुसारं, अन्तराष्ट्रीय संयुत्क्त राज्य शिबिरात् अवकरः सुव्यवस्थितः स्वच्छः न कुर्वन्ति | इत्यस्मात् कारणात् जीवाणुः हैतीम् महान् अर्टीबोनायिट् नद्याः उपनद्यां प्रविष्टः भवति |
958	travel	किमपि वायु-पारवहणः संयोगः दक्षिणभागे त्रयः समुद्रीय तरः न छदति (एवं आकाशदलः किमपि तरः न छदति)।
354	science/technology	आधुनिक हिमः लोठचारस्य क्षुरपत्रे मध्ये उत्तान पुटेन सह् द्विगुणधारा सन्ति। द्विगुणधारा हिमं समीचीनतरं ग्रहणं अनुमन्यते यदि अभिनतः कृतः तर्हि अपि।
505	science/technology	एतेषां अन्तर्जालस्थलानां गुणात्मक आलोकः वर्तते, अन्तर्भभतः यत् सारल्येन एकस्य कक्षापृष्ठस्य निर्माणसामर्थ्यः यस्मिन् अन्तर्जाले अभिप्रायलेखनम्, दृश्यचित्रं, मानचित्रं अन्यवैशिष्ट्यानि भवेयुः |
1333	science/technology	तत् कृत्रिम-उपग्रहः आधारितः तन्त्रशास्त्रस्य उपयोगं करोति पुरा भूमि-तजोन्वेष-आधारित तन्त्रशास्त्रं वायु-यातायात-वशीं न अनुमन्याय विमानचालकान् सम्यक् सूचनाय दातुं शक्नोति।
1173	sports	दक्षिण-आफ्रिकादेशः त्रिदेशीयायां रग्बीक्रीडायां ऑलब्लैकसङ्घम् (न्यूझीलंडसङ्घम्) दक्षिण-आफ्रिकादेशस्य रूस्टनबर्ग इत्यत्र स्थिते रॉयलबाफोकेंगक्रीडाप्राङ्गणे पराजितवान्।
945	travel	बाइकिंग्स: काला समुद्र अपि च कैस्पियन समुद्रभ्याम मन्जु गमन कृते रुसी जलमार्गस्य व्यवहार कृतः भरोट । तत् मा मार्गस्य कतिपय अंशस्य अएतत् पर्यन्त उपयोग कर्ता शक्नोति । विशेष परमिट स्य संभावित आवश्यकता या परिक्षण केरठ, याम प्राप्त इति कठिन: भविष्यति ।
1012	sports	अमरिकीबाहुव्यायामसङ्घटना स्वतन्त्रान्वेषणाय समर्थनं ददाति येन लैरीनासरमहोदयेन कृतलैङ्गिकशोषणात् हतशिष्टजनैः वर्णिता लैङ्गिकशोषणस्य अव्यक्ता तीव्रता या सुदीर्घकालम् अव्यक्ता भवेत्, सा प्रकाशं प्राप्नुयात् तथैव आवश्यकं यथायोग्यं परिवर्तनं च अपि स्वीकरोति।
712	travel	गैलापागोसस्य जले 60 अधिकतमाः पोताः गच्छति - येषाम् आकारः 8 तः 100 पर्यन्तं सन्ति।
1654	science/technology	द्वौ लोकप्रियौ विषयसिद्धान्तौ स्तः - Maslow's आवश्यकतानां पदानुक्रमः तथा च Hertzberg's द्विकारकसिद्धान्तः।
76	politics	"तथापि सः पूर्वोक्तस्य स्ववचनस्य पुनरावृत्तिं अकरोत् यत् रोए.वी.वैडमहोदयः ""सर्वोच्चन्यायालयस्य"" निर्देशस्य सन्ततं समर्थनं करोति स्म।"
637	science/technology	चत्वारि वर्षानन्तरं स्वाधिकारपत्रं दत्तं यत् MRI क्षेत्रे विश्वे प्रदत्तम् आद्यं स्वाधिकारपत्रम् आसीत्।
1694	geography	पूर्व अफ्रीकी द्वीपाः भरतीय महासागरस्य अन्ते सन्ति पूर्वी अफ्रीकी वेलायां दूरे।
1559	travel	सर्वप्रथमं ज्ञातं परिवहनम् अस्ति चलनम्। मनुजाः 2 दशलक्षवर्षेभ्यः पूर्वं होमो ईरेक्टस (स्थितिस्थः जनः) इत्यस्य उद्मज्जनेन सह स्थितिस्थचलनं प्रारभन्त।
679	geography	विक्टोरिया जल प्रपातः जिम्बाब्वे राष्ट्रस्य वारुणी खण्डे एकं नगरं अस्ति, लिविंगस्टोन, जाम्बिया नगराभ्यां परपक्षे बोत्सवानायाः समीपे च।
1049	politics	मध्य-आशियाप्रान्ते अमरिकादेशस्य नीतिः इति विषये मुक्तचर्चायाः तथा च सर्वसम्मत्याः याचनया सह एषः वृत्तान्तः प्रारभते।
557	science/technology	सरलीकृतबोहरप्रतिमानानुसारं सः अतीव क्लिष्टः विषयः अस्ति यस्मिन् सूर्यं मण्डलीकुर्वाणः ग्रहाः इव विद्युदणुभिः मण्डलीकृतं कोशकेन्द्रम् अस्ति - पश्यत आकृतिम् 1.1
