index_id	category	text
955	travel	यदि भवतः कृते अतिरिक्त प्रयाण समयः अस्ति चेत्, भवतः आफ्रिका प्रयाण मूल्यस्य सर्व प्रपञ्च मण्डल प्रयाण मूल्यस्य च उपमितिः करोतु |
47	sports	अद्य न्यूझीलैण्डदेशस्य A1GP सहचालकः इतिहासं कृतवान् यदा सः 48 वर्षीयपुरातने ऑकलैण्ड नौकाश्रयसेतौ सर्वाधिकवेगेन वाहनं सशास्त्रीयं चालितवान्।
1038	science/technology	802.11एन् प्रमाणं 2.4गिगाहर्ट्झकम्पनलहरीषु 5.0गिगाहर्ट्झकम्पनलहरीषु, द्वयोः अपि प्रवर्तते।
1268	health	पंच पुरुषस्य सिरे निर्णय शस्त्र विफलं भवति, स्केनेडरे निरंतरं पीड़ा, एकम नेत्रे अंधापनः, सिरस्य एकखंड चः टाइटेनियमस्य सहाए मुखः निर्मितः ।
1418	geography	Japan देशः Japan देशं विश्वे 7th विशालतमं द्वीपं कारयन्ति प्रायः 7,000 द्वीपानि (विशालतमम् अस्ति Honshu) धारयति।
1899	entertainment	दृश्यां पिरामिडस्य उपरि प्रदशितिं अकरोत अपि च विभिन्न पिरामिड इदं उपरि भवति ।
272	health	डॉ ली पूर्व फलाफल पत्रस्यो विषये चिन्तां व्यक्तवम् यत् तुर्की देशो शिशुः रोगनां बिना A(H5N1) एवियन इन्फ़्लुइंजा वाइरसेनसंक्रमित अभवत् ।
943	travel	एक विदेशी देशे तिश्तः अपि स्वयंसेवा कृतः एक भन्न संस्कृति’ ‘नातस्य, नव लोक मिलिला, श्व “विषये ज्ञात”, परिप्रेक्षस्य भावना प्राप्त कृत अपि च नव कौशल ग्रहनस्थ एक: सौम्य मार्ग: अस्ति ।
1201	health	संयुक्त राष्ट्र शांतता रक्षक:, 2010 वर्षे भूकम्पानन्तरम् यद् हैते आगत्य,तेषां सैन्यस्य शिबिरस्यसमीपे आरम्भं रोगस्य प्रसारणाय दोषी निश्चितम् अगच्छन्।
267	science/technology	वार्जियायाम् मुक़द्दमा चालितवन्तः, कारणः एषः प्रमुख इन्टरनेट सेवा प्रदाता ए ओ एलस्य गृह अस्ति, यः कारख़ानाः आरोपम् प्रोत्साहितः ।
1708	travel	प्राचीन मेडिनां परितः पारम्परिक मोरोक्कन वस्तुभ्यः स्थनाः सरलतया लभ्यते, टैगिन्स, मृत्तिकपात्राणि, चर्मवस्तवः, हुक्काः एवं गीगॉज़ इत्येषां पूर्ण स्पेक्ट्रम, परन्तु एतेभ्यः सर्वेभ्यः पर्यटकेभ्यः।
928	travel	अद्य समय वायुयान यात्रा केवल वारल इति थोनतः एयरलाइनस्य माध्यमेन आरक्षण इति करोति, प्रथम पाद बिना अपि च मूल्यस्य पुल्या वृक्ति कृते ।
1391	geography	मध्यपूर्वस्य गर्म जलवायुनां, गृहः इत्थम् महत्वपूर्ण न आसीत् ।
1229	entertainment	गायकः संजु शर्मा सायंकाले प्रारंभयत्, तस्य अनंतरं जयशंकर चौदरीः च्छप्पन भोगस्य भजनं कृतः । राजू खंडेलवालोऽपि सहयोगः कृतः ।
586	science/technology	एतासु दूरदर्शिकासु द्वौ मध्योन्नतकाचयोः संयोगः अस्ति येन दूरस्थानि वस्तूनि समीपतराणि विशालतराणि च दृश्यन्ते।
1695	geography	मेडागास्कर विशालतम एवं स्वस्य महाद्वीपं सन्ति यदा तत् आरण्यजीवानां आगच्छति।
802	health	अत्यधिक मद्यपानस्य संभावित दीर्घकालीन स्वास्थ घटनानं मध्ये हृदरोग अपि च अंधता अपि च मृत्युं अपि अंतर्भुक्त भविष्यति । अवैधरुपेन उत्पादित मद्य सेवनस्य संभावित विपदः बृद्धिर्भवति ।
1881	politics	लीगनाम् सह पासपोर्ट चलनं कृतं सरकारानाम् इच्छाः (x) एवं वांछित नाम एपीआई छ लंगतः मिलित्वानां अद्यतन कृत दस्तावेज़ पृथक-पृथक अस्ति ।
1379	science/technology	अस्य दीर्घहनुषु सप्ताधिकाः अतितीक्ष्णदन्ताः बद्धाः, अपि च अस्य मुखस्य उपरिभागे एकः अतिरिक्तगुच्छः आसीत्‌, यस्यार्थः यत्‌ अस्य मार्गे यदि कमपि वस्तु आयाति तर्हि तस्य वस्तुनः कृते कोऽपि सुरक्षोपायः नास्ति।
1550	politics	यदि मित्रराष्ट्राणि अस्मिन् कार्ये विच्युतानि तर्हि जर्मनदेशः अवशिष्टं योरोपखण्डमिव ब्रिटनदेशं जेतुं शक्यते।
333	entertainment	इस्तांबुल राज्य सिम्फनी आर्केस्ट्रा, एकं जनिसरी बैंड एवं फ़ातिह एर्कोक तथा मुस्लिम गुरसेसी गायकौ तस्य अनुसरणं कृतः।
719	geography	डोमिनिकन गणराज्यः (स्पैनिश् रिपब्लिका डोमिनिकाना) एकः करेबियन् देशः हिस्पानियोला प्रदेशस्य पूर्वार्धे  व्यापृतः, हैती राज्यस्य सह रेखां भजति |
1780	travel	सम्पूर्ण वर्षे शिलानां अनेक यात्रां कृतः, अपि च शिले इदं मध्ये कोऽपि करणवशात विघ्नितः भव इति दुर्लभः अस्ति ।
1841	travel	यदि एक आरोहकाय अश्वात् प्रसितिः, परंतु ताम् पादः रकाबे प्रतिबंधतिः, तत् अश्वणाम् पलायित्वात् ताम् परिकृषस्य संभवः भवति, इदं संभावनं सीमित कारणं हेतु, अनेक सुरक्षा सावधानं परिगृहीत करिष्यति ।
471	politics	इयं सङ्कल्पना आसीत् यत् European राष्ट्राणि किमपि एकं राष्ट्रं बलवत्तरं न भवेत् इत्यर्थं प्रयतेरन्। तदर्थं राष्ट्रीयसर्वकाराणि सन्तुलनरक्षणार्थं नैकवारं स्वेषां मित्राणि पर्यवर्तयन्त।
1634	science/technology	इदं पदार्थस्य चतस्रः अवस्थाः इव आसीत् (सानुक्रमम्) - स्थायुः, द्रवम्, वायुः, जीवद्रव्यं च। यद्यपि सः इदमपि प्रतिपादितवान् यत् ते यद् किमपि वयं पश्यामः तद्रूपं प्राप्तुं नूतनेषु पदार्थेषु परिवर्तन्ते।
1255	science/technology	शोधकर्ताः मार्जारस्य मुत्रे मेलामाइन अपि च सायन्यूरिक एसिडं मिश्रित्य क्रिस्टलस्य निर्माणं कृतः ।
845	entertainment	"यद्यपि सद्यस्कालीन स्थापित भित्तिचित्र कलाकारः भित्तिचित्र घटनाः अपि च ""न्यायीक"" द्वारः अस्ति। इदं संदर्भे भित्तिचित्र चित्र प्रायः अवैध टैगस्य उपरि कलकृतियानां सह मिलित्वाः।"
1776	entertainment	अनेक फ्रेंच मदिराः अस्ति परन्तु न्यूजीलैंड अपि च ऑस्ट्रेलिया देशयोः मदिरा उत्तमं यात्रा कर्तुं शक्नुतः ।
1845	travel	शिखरस्य सम्मेलने शृङ्गेभ्यः दृश्यं श्वासहरं भवति । विश्वस्य सर्व स्थानेभ्यः पर्वतारोहकाः निरन्तरं स्व मार्गस्य क्षमतानां मध्ये नव मार्ग स्थापितं कृतः।
1151	sports	तस्य दक्षिनाभि भगिणीप्रति क्रीडा निश्चित रूपेण निष्क्रमः दर्शयति, तथापि दक्षिणाफ्रिका देशः प्रतियोगितायां धीरं प्रगतिपथे जातः |
1054	politics	"कैटरीनाचक्रवातस्य आगमनानन्तरं आपत्सहाय्यार्थं तथा च पुनर्निर्माणार्थं निधिविषये विवादः सञ्जातः। यत् केचन वित्तीयपुराणमतवादिनः ""बुशमहोदयस्य नूतनः ओर्लियन्सव्यापारः"" इति उपहसितवन्तः।"
1859	geography	परिभाषायां भौगोलिक भिन्नताः आईटीआई भवति यत्र यूरोपस्य तुल्ये उत्तर अमेरिका यस्य स्थानेषु आयुः अल्पः भविष्यति ।
1007	health	यद्यपि एका प्रायोगिका सङ्क्रमनिवारिका इबोलाविषाणोः कारणात् भवन्तीं मर्त्यतां न्यूनीकर्तुं सक्षमा दृश्यते तथापि न कान्यपि औषधानि विद्यमानस्य सङ्क्रमणस्य उपचारार्थं सुयोग्यानि दृश्यन्ते।
1076	politics	"बुशमहोदयस्य प्रवक्ता गॉर्डनजॉन्ड्रोमहोदयः उत्तरकोरियादेशस्य इदं प्रतिवचनम् ""कोरियनद्वीपकल्पे सत्यापितस्य अण्वस्त्रमुक्तेः ध्येयप्राप्त्यर्थं एकं विशालं पदमस्ति"" इति आहूतवान्।"
1099	geography	तौ उभौ उपग्रहौ भारं 1000 पौन्डाभ्याम् अधिकं आसीत् आसन्न 17500 मील प्रति घण्टा वेगेन अध्वगति पृथिव्याम् 491 मैलेषु संघट्टते।
1100	science/technology	वेज्ञानिकाः वदन्ति, एतद् संघर्षणात् विस्फोटः दृढः आसीत् |
367	science/technology	रक्त हृदयात् दूरे धमनि नामक नलिकायाम् गच्छति अपि च शिरा नामक नलिकायै हृदये पुनः आगच्छति । सर्वस्य स्थूल नलिकायै कशिका एव वदतः ।
770	entertainment	मन्दिरस्य अधिकांश उत्सव: मन्दिरस्य वर्षागांठ एवं पीठासीन देवतानां जन्मदिवस एवं मंदिरं सह संबंध को अपि अन्य प्रमुख कार्यक्रमस्य अंशस्य रुपे पालित: इति ।
279	politics	एक विजेता रुपेण सर्वा राज्य शूल्का फ्लॉरिडा तस्य सभी पश्यात् प्रतिनिधिनां रोमानिनां सम्मानितम् कृतवान्, तेषां रिपब्लिकम दलस्य नमकरणम् हेतु सर्वप्रथमस्य धावकः रूपेण उपस्थापयती ।
357	science/technology	पूर्वं शक्तिस्तरं प्राप्नोतुं तान् प्रकाशेन मिलितः अतिरिक्त शक्तिं त्यजते।
797	science/technology	यदि लैपटॉप एवं तैब्लेतस्य सह यात्रां कृते इदं मेमोरी एवं डिस्क (इंटरवेटस्य बिना सुलभं) एक प्रति संगृहीतं करतु ।
211	health	कोऽपि तीक्ष्ण आघाताः निवेदिताः, परन्तु विस्फोट समये घटनास्थले न्यूनतमं पञ्चजनाः मानसिक आघातस्य लक्षणस्य चिकित्सिताः।
815	travel	अंतराष्ट्रीय स्तरेषु, प्रायः 200 भ्रमण संगठनः कार्यकरीरतः भवति । तस्य मध्ये अधिकतः स्वतंत्ररुपेन कर्मं करोति ।
238	geography	"यत् पर्यंतं वयम् ज्ञातः, केवल एक गृहपिंडः अस्ति, यः टाइटनस्य समतुल्ये अधिक गतिशीलता प्रदर्शायति, अपि च इदानीम् नाम पृथ्वीः"" स्टोफन अवदत् ।"
1636	science/technology	पोटास्सियम् छौरेयं च एतादृशानि मूलद्रव्याणि धातवः एव मन्यन्ते। निश्चयं हि, ते रजतं सुवर्णं च इव अन्ये धातवः अपि सन्ति।
761	travel	उपलब्ध मेजबानस्य एक सूची एवं प्रिंट अपि च/एवं ऑनलाइन प्रहानं कृतः कदाचित अन्य यात्रीनां द्वारा संदर्भीः अपि च समीक्षाणां सह ।
1676	science/technology	ए ऐ इत्यस्मिन् संशोधनं बुद्धिमत्वर्तनस्य आवश्यकतां धारयन्ति कार्याणि स्वयम्प्रेरयितुं यन्त्राणां निर्माणं सन्दधाति।
848	entertainment	ऑस्ट्रेलियायाम् उपलब्ध अधिकांश बुमेरांग वास्तवतः नॉन-रिटर्निंग भवति । प्रारंभतः लोकानां प्रति इदं सर्वोत्तम भवति यत् ते शून्य क्षिपस्य प्रयासं न करतु ।
1089	science/technology	एषः सिद्धान्तः कथयति यत् बहुधा तारापु़ञ्जं परितः वर्तमानं कृष्णद्रव्यं तारापुञ़्जं परितः मण्डलरूपेण स्थितमस्ति तथा च नैकैः सूक्ष्मकणैः आकारितमस्ति।
984	health	मानव मध्ये साहस्रत: लघु घटना संमुखं आगता, परन्तु तान् मध्ये कतिपय घातकः आसीत्।
305	sports	जापानीय योडिका क्रीडालुः हितोशी सैतो, ओलिंपिके द्वौ स्वर्णपदकौ विजयी, 54 वर्षे पञ्चत्वं गतः।
697	travel	येरूशलम मध्ये अनेकाः ऐतिहासिक, पुरावशेषिक, सांस्कृतिक क्षेत्राः च सन्ति, अतिजीवेन तथा सम्मर्देन विपणिभिः, भोजनशालाभिः, उपाहारगृहैः सह।
826	travel	मूलरूपेण, ते द्वौ श्रेण्ये आगच्छतिः एवं यात्रानां समये चेष्टां करतु अपि च स्वयं व्ययं सीमितं करतु । इदं लेखः पश्चात केंट्रितं भवति ।
1672	health	सुदीर्घकालात् इदं ज्ञातमस्ति यत् मस्तिष्कक्षतेः, आघातानां, व्रणानां तथैव च शोथानां विभिन्नाः प्रकाराः वर्तनं प्रभावयन्ति तथा च केषुचित् मानसिककार्येषु परिवर्तनं जनयन्ति।
536	travel	मनोऱञ्जनम् इच्छन्तः जनाः प्रायशः तटान्, विषयाधारितानि उद्यानानि तथा च शिबिराणि गच्छन्ति।
1909	science/technology	तस्य स्थानीय टेलीफोन सेवा प्रदाता एतत् सेवायां संयुक्तं विषये अधिक प्रख्यापनम् दत्तम् सक्षम् इति भवं इति अवश्यकम् ।
611	science/technology	अत्याधुनिकं सञ्जीवनं सङ्गणकेषु निर्मातुं शक्यते। ईदृशं सञ्जीवनं उत्कलितरूपेण दूरचित्रवाण्यां चित्रपटेषु च योजयमानं अस्ति।
157	sports	स्पर्धायाः पश्चात् केसेलोवस्कीमहोदयः 2250 गुणाङ्कैः सह चालकविजेतृपदस्य अग्रणिः तिष्ठति।
1294	politics	मार्टेली ह्यः नव सदस्यानां नवीन सामायिक मतदान-परिषदि (CEP) शपथं अकरोत्।
1803	travel	अन्यत्र, अनेक देशेषु तुषार अपि च तुषार अवस्थाः सामान्य: अस्ति । अपि च सम्पुर्ण वर्षे यातायात प्रायः निबन्धित रुपेण चलन्ति।
359	science/technology	"वैज्ञानिकाः एतत् प्रक्रियां ""स्टिम्यूलटेड एमिशन आॅफ रेडिएशन"" इति उच्यते यतः परमाणवः उज्ज्वलेन प्रकाशेन दीप्तः भवति यत् फोटोन प्रकाशः ददाति, एवं प्रकाशः एकस्य प्रकारस्य रश्मिविकरणः अस्ति।"
302	politics	फ्रेंच विधिः परिवर्तित जातः। तस्य चर्या 15 वर्षाः पूर्वः आसीत् यदा सः द्वितीय-विश्वयुद्धे फ्रेंच प्रतिकृत्या सह युक्तः अभवत्।
455	science/technology	यतः काचोत्पादकाः काचोत्पादने उच्चमापदण्डान् प्रापयन्तः सन्ति अतः एषा समस्या न विद्यते अधुना।
25	sports	तस्यां रात्रौ ओवेच्किनमहाभागस्य प्रथमं सहाय्यं नवोदितस्य निकलासबैकस्टॉर्ममहाभागस्य क्राीडाविजयकारकाय अङ्काय कृते आसीत्।
1606	science/technology	विज्ञानम् अधुना इदं सूचयति यत् कर्बाधारिता अर्थव्यवस्था जीवावरणस्य गतद्विदशलक्षमितवर्षेभ्यः मनुजानां कृते आधारीभूताम् एका सुस्थिताम् अवस्थां दूरीकृतवती।
79	sports	2 पक्षौ महत्याम् उपान्त्यस्पर्धायां मिलितौ यत्र नूसा 11 न्यूनाङ्कैः पराजितः।
952	travel	यद्यपि त्वं चिन्तन कर्तुं शक्नोति यः यत् अमरलाइन सह त्वं सर्वं अधिक उड़ान इबि प्रारंभः, तत् अन्तर्भूक्त इति सहजः अस्ति, त्व, जायज्ञातः इति आवश्यकम् यत प्रदान कृत विशेषाधिकार प्राय: भिन्न: भवति अपि छ एक: गठबंधने एक: भिन्न अयरलाइन स्प तहत निरंतर फ़्लायर पॉइंट अधिक उदार इति भविष्यति ।
995	travel	एयरलाईंस यः इदं पेशं करोति तां एयर कॅनाडा, देलता एयरलाईंस्, U.S एवं कानाडातः प्रारम्भ उरानं प्रति तुफ़थांसा अपि च वेस्टजेत अन्तर्भुक्त अस्ति।
266	science/technology	रूसी जर्मनी नियंत्रणः विमानं सक्रियं कृतः, अपि च स्टेशनस्य सामान्य श्वैया पुनः प्राप्तवन्तः ।
