index_id	category	text
1542	politics	With two years of the end of the war, the former allies were now enemies and the Cold War began.
1724	travel	Hong Kong Island gives the territory of Hong Kong its name and is the place that many tourists regard as the main focus.
445	business	An important industry for Venezuelans is oil, where the country is a net exporter, even though only one percent work in the oil industry.
1270	sports	Beyond Wednesday's event, Carpanedo competed in two individual races at the Championships.
434	politics	Luxembourg has always tried to remain a neutral country but it was occupied in both World War I and World War II by Germany.
1138	disasters	No tsunami warning has been issued, and according to the Jakarta geophysics agency, no tsunami warning will be issued because the quake did not meet the magnitude 6.5 requirement.
371	science	A Triceratops could have used its strong beak to strip off the leaves before eating the trunk.
1281	health	He was initially hospitalised in the James Paget Hospital in Great Yarmouth.
1251	crime	Three more bombs exploded near government buildings in a period of two hours.
188	disasters	As of the night of August 9, the eye of Morakot was about seventy kilometres away from the Chinese province of Fujian.
1104	crime	A doctor who worked at Children's Hospital of Pittsburgh, Pennsylvania will be charged with aggravated murder after her mother was found dead in the trunk of her car Wednesday, authorities in Ohio say.
1927	business	On some routes, the larger companies have their own planes, but for other routes and smaller firms there was a problem.
1592	science	As knowledge of Greek declined, the West found itself cut off from its Greek philosophical and scientific roots.
22	politics	Despite these accusations, Ma won handily on a platform advocating closer ties with the Chinese mainland.
553	sports	Middle distance running is a relatively inexpensive sport; however, there are many misconceptions regarding the few pieces of equipment required to participate.
730	travel	This authentic community is located in Howe Sound just off Vancouver, and is easily accessed via scheduled water taxis departing Granville Island in downtown Vancouver.
1880	travel	Voyagers planning sex reassignment surgery abroad must ensure they're carrying valid documents for the return trip.
116	science	Scientists have suspected Enceladus as geologically active and a possible source of Saturn's icy E ring.
144	science	"That means everything has to be put back,"" said researcher at the Rift Valley Research Service in Ethiopia and a co-author of the study, Berhane Asfaw."
797	technology	If traveling with a laptop or tablet, store a copy in its memory or disc (accessible without the internet).
150	business	Sir Richard Branson's Virgin Group had a bid for the bank rejected prior to the bank’s nationalisation.
357	science	To return to their previous energy level, they must get rid of the extra energy they got from the light.
1294	politics	Martelly swore in a new Provisional Electoral Council (CEP) of nine members yesterday.
1976	education	Therefore, reading this grammar primer would help you learn much about Persian grammar and understand phrases better.
920	technology	If you don't have a data connection for your phone, or when it is out of range, their performance can be limited or unavailable.
485	religion	Sikhism is a religion from the Indian sub-continent. It originated in the Punjab region during the 15th century from a sectarian split within the Hindu tradition.
1865	travel	If the country you will be visiting becomes subject to a travel advisory, your travel health insurance or your trip cancellation insurance may be affected.
167	politics	The attack put a huge strain on relations between India and Pakistan.
637	science	Four years later a patent was granted, which was the world's first patent issued in the field of MRI.
147	business	The number of users of the Yahoo! and Microsoft services combined will rival the number of AOL's customers.
1165	business	But the consumer market on laptop computer will be radically varied and changed after ASUS was awarded in the 2007 Taiwan Sustainable Award by Executive Yuan of the Republic of China.
592	science	Animals are made of many cells. They eat things and digest them inside. Most animals can move.
42	disasters	The storm, situated about 645 miles (1040 km) west of the Cape Verde islands, is likely to dissipate before threatening any land areas, forecasters say.
81	nature	Hesperonychus elizabethae is a species of the family Dromaeosauridae and is a cousin of Velociraptor .
1677	technology	Examples include control, planning and scheduling, the ability to answer customer diagnoses and questions, as well as handwriting recognition, voice and face.
374	science	A person who weighs 200 pounds (90kg) on Earth would weigh about 36 pounds (16kg) on Io. So the gravity, of course, pulls less on you.
481	religion	Mysticism is the pursuit of communion with, identity with, or conscious awareness of an ultimate reality, divinity, spiritual truth, or God.
1852	sports	Think of the skiing route as of a similar hiking route.
505	technology	There are positive aspects to these websites, which include, being able to easily setup a class page which can include blogs, videos, photos, and other features.
729	travel	Bowen Island is a popular day trip or weekend excursion offering kayaking, hiking, shops, restaurants, and more.
175	education	She gained critical acclaim during her time in Atlanta and was recognized for innovative urban education.
378	science	About three thousand years later, in 1610, Italian astronomer Galileo Galilei used a telescope to observe that Venus has phases, just as the moon does.
497	health	They became proficient at amputation to save patients from gangrene as well as tourniquets and arterial clamps to stem blood flow.
1623	geography	The Amazon is also the widest river on Earth, at times six miles wide.
844	crime	While it's far from a modern phenomenon, most people probably associate it with youth vandalizing public and private property using spray paint.
1127	health	Fluke wrote that the efforts by some to drown out women from speaking out about women’s health were unsuccessful.
88	crime	Authorities said little officially beyond confirming today's arrest.
477	religion	Alexander, as king, offered to pay to rebuild the temple, but his offer was denied. Later, after Alexander died, the temple was rebuilt in 323 BCE.
267	technology	The case was prosecuted in Virginia because it is the home to the leading internet service provider AOL, the company who instigated the charges.
316	crime	He has also been accused previously of copyright infringement, but was not charged.
887	travel	Tourist visits are costly, demand physical fitness, can only take place in summer Nov-Feb, and are largely limited to the Peninsula, Islands and Ross Sea.
866	travel	If traveling in a developing country for the first time – or in a new part of the world – don't underestimate the potential culture shock.
1422	politics	In 1683, Qing dynasty (1644-1912) forces take control of Taiwan’s western and northern coastal areas and declared Taiwan as a province of the Qing Empire in 1885.
1689	geography	Ottawa is Canada's charming, bilingual capital and features an array of art galleries and museums that showcase Canada's past and present.
393	politics	Germany code-named the attack “Operation Sealion”. Most of the British Army's heavy weapons and supplies had been lost when it evacuated from Dunkirk, so the army was fairly weak.
599	science	They looked like rooms. He was the first person to observe dead cells
1780	travel	Many trips to the reef are made all year around, and injuries due to any of these causes on the reef are rare.
1882	politics	Willingness of foreign governments to honour these documents is just as widely variable.
143	science	"""Based on this fossil, that means the split is much earlier than has been anticipated by the molecular evidence."
1520	health	Oliver Sacks, in his paper The President's Speech, indicated how people who are unable to understand speech because of brain damage are nevertheless able to assess sincerity accurately.
1028	science	The feathers' structure suggests that they were not used in flight but rather for temperature regulation or display. The researchers suggested that, even though this is the tail of a young dinosaur, the sample shows adult plumage and not a chick's down.
742	travel	Though smaller, it reminds some elderly visitors of Hawaii before statehood without all the large tourist hotels and other development.
403	technology	In the beginning of the war they mostly travelled on top of the sea, but as radar began developing and becoming more accurate the submarines were forced to go under water to avoid being seen.
1722	travel	As with all South African National Parks, there are daily conservation and entry fees for the park.
537	travel	If the objective of one’s visit to a particular place is to get to know its history and culture then this type of tourism is known as cultural tourism.
1040	technology	The speeds of 802.11n are substantially faster than that of its predecessors with a maximum theoretical throughput of 600Mbit/s.
1789	travel	Any amendments or requests though should be coursed through the travel agent first and not directly with the hotel.
1182	health	France is the seventh country in the European Union to suffer this virus; following Austria, Germany, Slovenia, Bulgaria, Greece and Italy.
560	health	To Check the victim, you must first survey the scene to ensure your safety.
1416	sports	Popular sports include football, basketball, volleyball, water-polo, fencing, rugby, cycling, ice hockey, roller hockey and F1 motor racing.
1174	sports	The final score was a one-point victory, 21 to 20, ending the All Blacks' 15 game winning streak.
426	education	Charles was the first member of the British Royal Family to be awarded a degree.
1672	health	It has been known for a long time that different types of brain damage, traumas, lesions, and tumours affect behaviour and cause changes in some mental functions.
921	technology	Every corner store is filled with a confusing array of pre-paid phone cards that can be used from pay phones or ordinary telephones.
665	travel	"The ""typical"" visit involves flying into Orlando International Airport, busing to an on-site Disney hotel, spending about a week without leaving Disney property, and returning home."
1892	travel	When returning home after living abroad, you've adapted to the new culture and lost some of your habits from your home culture.
1519	technology	In particular, it is claimed that one can detect whether a person is lying by interpreting micro-expressions correctly.
1671	science	The correlation between brain pathology and behaviour supports scientists in their research.
1707	travel	Casablanca is one of the least interesting places to shop in all of Morocco.
904	disasters	"They begin as funnels descending from storm clouds, and become ""tornadoes"" when they touch the ground."
1774	entertainment	These are sometimes-crowded family beaches with a good range of shops lining the shore. Swimming is safe.
827	travel	For those willing to sacrifice comfort, time and predictability to push expenses down close to zero, see minimum budget travel.
1821	science	Pests can spoil food, cause irritation, or in a worse case cause allergic reactions, spread venom, or transmit infections.
5	sports	28-year-old Vidal had joined Barça three seasons ago, from Sevilla.
34	disasters	At exactly 8:46 a.m. a hush fell across the city, marking the exact moment the first jet struck its target.
650	technology	Your hotel or hosts (if staying in a guesthouse or private home) will likely have wifi or an internet connected PC, and all settlements have an internet cafe or some location with public wifi.
318	business	During the last three decades, despite officially remaining a communist state, China has developed a market economy.
401	technology	Submarines are ships designed to travel underwater, and remain there for an extended amount of time.
1354	technology	The wheel has changed the world in incredible ways. The biggest thing that the wheel has done for us is given us much easier and faster transportation.
1916	entertainment	Although the coastal archipelagos and the biggest lakes are indeed big enough for any yacht, smaller boats or even a kayak offer a different experience.
979	travel	These can be dangerous if the traveler pursue the mirage, wasting precious energy and remaining water.
1081	disasters	Water is spilling over the levee in a section 100 feet wide.
1327	science	Comets may possibly have been a source of water delivery to the earth along with organic matter that can form proteins and support life.
177	education	At the time of the award, Atlanta schools had seen a large improvement on test scores.
1845	travel	Summits include breath-taking views from peaks. Climbers from all parts of the world are continually establishing new routes amongst its endless potential of walls.
962	politics	With Armenian backing, a new republic was created. However, no established nation - not even Armenia - officially recognizes it.
799	nature	Moose (also known as elk) aren't inherently aggressive, but will defend themselves if they perceive a threat.
1795	travel	Saint Petersburg cruises include time in town. Cruise passengers are exempted from visa requirements (check the terms).
1844	nature	Cochamó Valley - Chile's premier climbing destination, known as the Yosemite of South America, with a variety of granite big walls and crags.
460	entertainment	Most televisions are made in a way to please the general public.
1135	nature	This sediment was necessary for creating sandbars and beaches, which served as wildlife habitats.
1290	politics	Israel demands an ongoing military presence in the valley for ten years once an agreement is signed while the PA agrees to leave such presence only for five years.
368	science	A triceratops' teeth would have been able to crush not only leaves but even very tough branches and roots.
490	politics	Although in the end, Krushchev sent in tanks to restore order, he did give way to some economic demands and agreed to appoint the popular Wladyslaw Gomulka as the new prime minister.
719	geography	The Dominican Republic (Spanish: República Dominicana) is a Caribbean country that occupies the eastern half of the island of Hispaniola, which it shares with Haiti
530	sports	Golf is a game in which players use clubs to hit balls into holes.
1679	technology	The AI ​​system is now often used in the fields of economics, medicine, engineering and the military, as has been built in several home computer and video game software applications.
1163	politics	Candidates can send representatives to witness every part of the process. In the evening, votes are counted by volunteers under heavy supervision, following specific procedures.
84	disasters	In addition to the crushing ice, extreme weather conditions have been hampering rescue efforts.
528	sports	The modern sport of fencing is played at many levels, from students learning at a university to professional and Olympic competition.
46	business	250 years later, Guinness has grown to a global business that turns over 10 billion euros (US$14.7 billion) every year.
1906	technology	In remote locations, without cell phone coverage, a satellite phone may be your only option.
270	sports	Since then, the Brazilian has featured in 53 matches for the club in all competitions and has scored 24 goals.
912	technology	There is also no requirement that you obtain a local number from the community in which you live; you can obtain a satellite Internet connection in the wilds of Chicken, Alaska and select a number which claims you're in sunny Arizona.
1538	religion	In principle the Tibetan Buddhism is very simple. It consists of Kundalini Yoga, meditation and the path of all-embracing love.
241	science	The unmanned lunar orbiter Chandrayaan-1 ejected its Moon Impact Probe (MIP), which hurtled across the surface of the Moon at 1.5 kilometres per second (3000 miles per hour), and successfully crash landed near the Moon's south pole.
1198	sports	Australia's Mitchell Gourley finished eleventh in the men's standing Super-G. Czech competitor Oldrich Jelinek finished sixteenth in the men's sitting Super-G.
702	travel	Your passport must be valid for at least 6 months beyond your travel dates. A round/onward trip ticket is needed to prove the length of your stay.
1769	politics	During the struggle for independence organised by the Mau movement, a peaceful gathering in the town resulted in the killing of the paramount chief Tupua Tamasese Lealofi III.
151	business	In 2010, while nationalised, the current high street bank Northern Rock plc was split from the ‘bad bank’, Northern Rock (Asset Management).
1720	geography	The park covers 19,500 km² and is divided in 14 different ecozones, each supporting different wildlife.
1784	nature	Saltwater Crocodiles do not actively live in the ocean, their primary habitat is in river estuaries north from Rockhampton.
529	sports	The sport is primarily played in a duel format, one fencer dueling another.
342	business	"We have a year-long financial crisis, which has had its most acute moment in the past two months, and I think now the financial markets are beginning to recover."""
990	nature	The walls and roofs of ice caves can collapse and cracks can get closed.
595	science	A cell is the smallest structural and functional unit of a living (things) organism.
1098	health	However, the percentage of XDR-TB in the entire group of people with tuberculosis still seems to be low; 6,000 of the total 330,000 people infected at any particular moment in South Africa.
1977	education	Needless to say, if you know a Romance language, it will be easier for you to learn Portuguese.
913	education	Often, you have to buy a global number separately that allows PSTN phones to call you. Where the number is from makes a difference for people calling you.
535	entertainment	This is when people go to a place that is very different from their regular day-to-day life to relax and have fun.
876	health	For those unfamiliar with medical jargon, the words infectious and contagious have distinct meanings.
1959	nature	The Plitvice Lakes national park is heavily forested, mainly with beech, spruce, and fir trees, and features a mixture of Alpine and Mediterranean vegetation.
1899	entertainment	The scenes are displayed on the pyramids and the different pyramids are lit up.
198	health	"""Apart from the fever and a sore throat, I feel well and in good shape to carry out my work by telecommuting."
1355	technology	It has brought us the train, the car, and many other transportation devices.
58	politics	Police said Lo Piccolo had the upper hand because he had been Provenzano's right-hand man in Palermo and his greater experience won him the respect of the older generation of bosses as they pursued Provenzano's policy of keeping as low as possible while strengthening their power network.
1749	sports	Smaller tournaments and matches can also be seen here at other times of the year.
43	disasters	Fred currently has winds of 105 miles per hour (165 km/h) and is moving towards the northwest.
20	politics	Hsieh implied during the election that Ma might flee the country during a time of crisis.
1609	travel	Why do transportation systems engender such complaints, why do they fail on a daily basis? Are transportation engineers just incompetent? Or is something more fundamental going on?
76	politics	"He did, however, reiterate his earlier statement that Roe v. Wade was the ""settled law of the land"", emphasizing the importance of consistent Supreme Court rulings."
635	science	In this resonance, magnetic field and radio waves cause atoms to give off tiny radio signals.
1361	science	The females are usually closely related to each other, being a large family of sisters and daughters.
993	entertainment	However, they have a different kind of beauty and charm during winter, with many hill stations receiving healthy amounts of snow and offering activities such as skiing and snowboarding.
1512	education	Our foster care system is supposed to provide safe homes, loving caregivers, stable education, and reliable health care.
643	education	Students can also submit questions to instructors at any time of day and expect reasonably quick responses, rather than waiting until the next face-to-face meeting.
1427	technology	For example, the most common still image photography format in the world is 35mm, which was the dominant film size at the close of the analog film era.
1435	religion	For over a thousand years the Christian religion had bound European states together despite differences in language and customs. I
1736	travel	Most districts are served by small Japanese Coaster Buses, which are comfortable and sturdy.
1113	health	Plans for vaccines to be delivered to the historically most affected areas this year were delayed due to lack of funds and low prioritisation relative to other diseases.
556	science	The atom can be considered to be one of the fundamental building blocks of all matter.
519	nature	Fossil hand bones two million to three million years old reveal this shift in specialization of the hand from locomotion to manipulation.
1429	technology	The 35mm format is actually, somewhat confusingly, 36mm in width by 24mm in height.
830	travel	In some cross-border trains inspections are done on the running train and you should have valid ID with you when boarding one of those trains.
1029	science	The researchers suggested that, even though this is the tail of a young dinosaur, the sample shows adult plumage and not a chick's down.
774	entertainment	International Horticultural Expositions are specialised events which showcase floral displays, botanical gardens and anything else to do with plants.
1771	geography	North Shore beaches (in North Harbour district) are on the Pacific Ocean and stretch from Long Bay in the north to Devonport in the south.
811	sports	Hiking is an outdoor activity which consists of walking in natural environments, often on hiking trails.
1268	health	Uka's weapon failed whilst pointed at a fifth man's head. Schneider has ongoing pain, blindness in one eye, a missing section of skull and a face rebuilt from titanium.
565	health	Those participating in regular activity required more support in terms of negative perception of pain distinguishing the differences of chronic pain and discomfort feel from normal physical movement.
1848	sports	The idea of skiing is very old — cave paintings depicting skiers date back as far as 5000 BC!
103	politics	The comments, live on television, were the first time that senior Iranian sources have admitted that the sanctions are having any effect.
930	travel	While you may not need a visa for short visits to certain countries as a tourist or for business, going there as an international student generally requires a longer stay than going there just as a casual tourist.
271	health	Dr. Lee also expressed his concern about reports that children in Turkey have now become infected with the A(H5N1) avian influenza virus without becoming ill.
251	disasters	The death toll is at least 15, a figure which is expected to rise.
123	crime	"The U.S. says it has received information from an undisclosed source that specifically mentions the use of suicide bombers to will blow up ""prominent landmarks"" in Ethiopia and Kenya."
190	travel	Passengers were given water as they waited in 90(F)-degree heat.
2002	education	If you visit the Arctic or Antarctic areas in the winter you will experience the polar night, which means that the sun doesn't rise above the horizon.
7	politics	The protest started around 11:00 local time (UTC+1) on Whitehall opposite the police-guarded entrance to Downing Street, the Prime Minister's official residence.
1103	science	The result of plotting analysis will be posted to a public website.
1061	crime	Congress began funding the obscenity initiative in fiscal 2005 and specified that the FBI must devote 10 agents to adult pornography.
697	travel	Jerusalem has many historic, archeological and cultural sites, along with vibrant and crowded shopping centers, cafés, and restaurants.
1645	science	Sort of like rolling a heavy cart up a hill. Splitting the nucleus up again then releases some of that energy.
1802	travel	Visibility may also be restricted by falling or blowing snow or by condensation or ice on vehicle windows.
372	science	Other scientists argue that these plants are very poisonous so it is unlikely that any dinosaur ate them, even though today the sloth and other animals like the parrot (a descendant of the dinosaurs) can eat poisonous leaves or fruit.
111	technology	“It will move over the west coast of northern California and will light the sky from California through central Oregon and on through Nevada and Idaho and into Utah,” Tom Duxbury, Stardust's project manager said.
1034	science	The luminosity and rotation are used together to determine a star's Rossby number, which is related to plasma flow.
279	politics	As a winner-takes-all state, Florida awarded all fifty of its delegates to Romney, pushing him ahead as the front-runner for the Republican Party nomination.
335	entertainment	Turkish diva Sezen Aksu performed with the Italian tenor Alessandro Safina and Greek singer Haris Alexiou.
37	entertainment	The PBS show has more than two-dozen Emmy awards, and its run is shorter only than Sesame Street and Mister Rogers' Neighborhood.
959	travel	However, Star Alliance covers everything except the eastern South Pacific from Santiago de Chile to Tahiti, which is a LATAM Oneworld flight.
12	sports	He recently lost against Raonic in the Brisbane Open.
