index_id	category	text
611	technology	Sophisticated animations can be constructed on computers, and this kind of animation is increasingly being used in television and films.
795	business	They need to show the insurer's e-mail address and international phone numbers for advice/authorizations and making claims.
1066	politics	He was greeted by Singapore's Deputy Prime Minister Wong Kan Seng and discussed trade and terrorism issues with the Singapore Prime Minister Lee Hsien Loong.
1325	science	Curtis Cooper, a mathematician and computer science professor at the University of Central Missouri, has discovered the largest known prime number to date on January 25.
743	geography	The Cook Islands do not have any cities but are composed of 15 different islands. The main ones are Rarotonga and Aitutaki.
448	nature	Every year around October nearly 1.5 million herbivores travel towards the southern plains, crossing the Mara River, from the northern hills for the rains.
59	crime	"These bosses had been reined in by Provenzano when he put an end to the Riina-driven war against the state that claimed the lives of Mafia crusaders Giovanni Falcone and Paolo Borsellino in 1992."""
658	health	During the summer, also watch out for the Nordic mosquitoes. Although they do not transmit any diseases, they can be irritating.
60	technology	Apple CEO Steve Jobs unveiled the device by walking onto the stage and taking the iPhone out of his jeans pocket.
1232	entertainment	Lakkha Singh presented the chhappan bhog bhajan as well. Singer, Raju Khandelwal was accompanying him.
1911	education	This is especially popular with school leavers, allowing them to take a year out before university, without compromising their education.
655	nature	Cold weather is perhaps the only real danger the unprepared will face.
1218	disasters	Earlier this week, a police helicopter crash killed three people and wounded three more.
1551	nature	Goats seem to have been first domesticated roughly 10,000 years ago in the Zagros Mountains of Iran.
324	geography	The storm, located approximately 3,000 miles from Miami, Florida, has maximum sustained winds of 40 mph (64 kph).
1763	travel	Each year, dozens of visitors are injured because they didn't keep a proper distance. These animals are large, wild, and potentially dangerous, so give them their space.
929	business	Sometimes the same flight can have vastly differing prices at various agregators and it pays to compare search results and to also look at the website of the airline itself before booking.
649	technology	Thanks to undersea fiber optic cable links to Europe and broadband satellite, Greenland is well connected with 93% of the population having internet access.
1809	sports	The Paralympics will take place from 24 August to 5 September 2021. Some events will be held in other locations throughout Japan.
1022	politics	The announcement was made after Trump had a phone conversation with Turkish President Recep Tayyip Erdoğan.
1007	health	While one experimental vaccine appears able to reduce Ebola mortality, up until now, no drugs have been clearly demonstrated suitable for treating existing infection.
220	sports	Despite his comments he said he will be supporting the British competitors at the 2012 Olympics being held in London.
1131	crime	Between 10:00-11:00 pm MDT, a fire was started by the inmates in the yard.
73	crime	"A few weeks ago, after the information published by the journalist Makis Triantafylopoulos in his popular Television show ""Zoungla"" in Alpha TV, the member of Parliament and lawyer, Petros Mantouvalos was abdicated as members of his office had been involved in illegal graft and corruption."
1265	crime	Huhne and Pryce are scheduled to appear at the Westminster Magistrates Court on February 16.
1824	travel	Travellers bound for countries with heavy taxation can sometimes save a considerable amount of money, especially on products such as alcoholic beverages and tobacco.
18	politics	There were protests worldwide, several criminal prosecutions, and the leaders of the governments of Iceland and Pakistan both resigned.
1035	science	The smaller the Rossby number, the less active the star with respect to magnetic reversals.
1487	business	Its status declined during the twelfth century mainly due to the fact that Crusaders had returned bearing gifts such as silks and spices that were valued more than what Byzantine markets offered.
217	sports	The vote must still be ratified by the full IOC at it's October meeting in Copenhagen.
1580	nature	This term derives from ancient familiarity with Bed-bugs, which are insects highly adapted to parasitize humans.
1596	science	The Hershey and Chase experiment was one of the leading suggestions that DNA was a genetic material.
1579	nature	The term bug is used by entomologists in a formal sense for this group of insects.
801	health	Drink alcoholic drinks with moderation. Alcohol affects everyone differently, and knowing your limit is very important.
901	nature	Sometimes the original trigging event is the sun warming the snow, sometimes some more snowfall, sometimes other natural events, often a human.
647	entertainment	So many of us find ourselves watching a television show that informs us of a process or experience in which we will never participate or apply that knowledge.
1263	politics	The Director of Public Prosecutions, Kier Starmer QC, gave a statement this morning announcing the prosecution of both Huhne and Pryce.
182	politics	"""It is now important from both a public health and criminal justice perspective that the legislation be enacted as soon as possible"", said a government spokesperson."
772	entertainment	A World's Fair (commonly called World Exposition, or simply Expo) is large international festival of arts and sciences.
516	nature	Unlike other primates, hominids no longer use their hands in locomotion or bearing weight or swinging through the trees.
1751	business	The official Falklands currency is the Falkland pound (FKP) whose value is set equivalent to that of one British pound (GBP).
214	sports	Both golf and rugby are set to return to the Olympic Games.
515	education	In essence, the Renaissance made a significant change in the approach to learning and the dissemination of knowledge.
365	technology	This is because electricity flowing into the socket where the metallic part of bulb sits can give you a severe electric shock if you touch the inside of the socket or the metal base of the bulb while it is still partly in the socket.
1049	politics	The Report opens with plea for open debate and the formation of a consensus in the United States about the policy towards the Middle East.
1583	health	MS is a disease that affects the central nervous system, which is made up of the brain, the spinal cord and the optic nerve.
358	science	"They do this by emitting a tiny particle of light called a ""photon""."
1650	geography	There may be more maria on the near side because the crust is thinner. It was easier for lava to rise up to the surface.
1993	travel	They also define routes for popular hiking and cycling trails.
98	disasters	800 miles of the Trans-Alaska Pipeline System were closed down following a spill of thousands of barrels of crude oil south of Fairbanks, Alaska.
517	nature	The chimpanzee's hand and foot are similar in size and length, reflecting the hand's use for bearing weight in knuckle walking.
879	health	Many governments require visitors entering, or residents leaving, their countries to be vaccinated for a range of diseases.
315	education	Modern Education accused him of printing large advertisements on buses without authorisation and lying by saying that he was the chief English tutor.
1930	travel	The obvious way of flying in first or business class is to fork out a thick wad of money for the privilege (or, better yet, get your company to do it for you).
835	travel	In other cases, only those staying outside of tourist accommodations need to register.  However, this makes the law much more obscure, so find out beforehand.
1589	science	It isn’t alone though, experimentation, and an experiment is a test that is used to eliminate one or more of the possible hypotheses, asking questions, and making observations also guide scientific research.
1811	travel	If you booked your flights and accommodation for 2020 before the postponement was announced, you may have a tricky situation.
999	health	Like some other experts, he is skeptical about whether diabetes can be cured, noting that these findings have no relevance to people who already have Type 1 diabetes.
861	health	At home, due to this constant exposure to the local germs, odds are very high that you're already immune to them.
227	geography	Scientists have discovered landforms littered across the moon's surface called lobate scarps that have apparently resulted from the moon's shrinking very slowly.
856	travel	Carrying for others - Never let your bags out of your sight, especially when you are crossing international borders.
1228	entertainment	Famous singers across the country presented bhajans, or devotional songs, to Shri Shyam's feet.
44	disasters	Fred is the strongest tropical cyclone ever recorded so far south and east in the Atlantic since the advent of satellite imagery, and only the third major hurricane on record east of 35°W.
508	health	"Attention Deficit Disorder ""is a neurological syndrome whose classic defining triad of symptoms including impulsivity, distractibility, and hyperactivity or excess energy""."
1167	entertainment	In its early days, the show was featured solely at the long-running internet radio site TogiNet Radio, a site focused on talk radio.
1237	sports	His teammate Fernando Alonso was in the lead for most of the race, but ended it right after his pit-stop, probably because a badly tucked right front wheel.
877	health	An infectious disease is one that is caused by a pathogen, such as a virus, bacterium, fungus or other parasites.
871	entertainment	Fill your home with a rich coffee in the morning and some relaxing chamomile tea at night.
1522	science	Twentieth century research has shown that there are two pools of genetic variation: hidden and expressed.
1276	crime	The accused are named as Baba Kanjar, Bhutha Kanjar, Rampro Kanjar, Gaza Kanjar and Vishnu Kanjar.
536	travel	Beaches, theme parks and camp grounds are often the most common places frequented by recreational tourists.
1709	travel	Goma is a tourist city of the Democratic Republic of Congo in the extreme east near Rwanda.
1571	nature	Many people don't think about them as dinosaurs because they have feathers and can fly.
1568	politics	One was sent to George Washington on July 6, who had it read to his troops in New York on July 9. A copy reached London on August 10.
802	health	Possible long term health events from excessive drinking can include liver damage and even blindness and death. The potential danger is increased when consuming illegally produced alcohol.
1261	crime	California Governor Arnold Schwarzenegger signed into law a bill that bans the sale or rental of violent video games to minors.
1800	travel	On icy and snowy roadways, friction is low and you cannot drive as if you were on bare asphalt.
1210	entertainment	During the 1980s he worked on shows such as Taxi, Cheers, and The Tracy Ullman Show.
1112	health	Several million vials of encephalitis vaccine have also been promised by the government, which will help prepare health agencies for next year.
488	religion	The religion was founded in the 15th century by Guru Nanak (1469–1539). There followed in succession a further nine gurus.
749	travel	Getting into your own car and heading off on a long road trip has an intrinsic appeal in its simplicity.
983	health	Bird flu, or more formally avian influenza, can infect both birds and mammals.
1828	travel	Curiously, though, mobile phone service is much stronger here than along many other stretches of the route, e.g. the Pennsylvania Wilds.
1101	disasters	They are still trying to determine just how large the crash was and how the Earth will be affected.
1151	sports	Looking decidedly rusty in the game against their southern sisters, South Africa however steadily improved as the tournament progressed.
1431	technology	Many common formats (APS family of formats, for example) are equal to or closely approximate this aspect ratio.
1616	nature	Most insects have the advantage of being able to fold their wings back along the body.
1203	health	Prior to the arrival of troops, Haiti had not encountered problems related to the disease since the 1800s.
908	technology	"The media companies routinely lie about the purpose of this, claiming that it is to ""prevent piracy""."
110	technology	Stardust will set a new all-time record for being the fastest spacecraft to return to Earth, breaking the previous record set in May of 1969 during the return of the Apollo X command module.
1318	sports	"Dustin ""Goldust"" Runnels commented that ""Luna was as freaky as me...maybe even more...love her and will miss her...hopefully she's in a better place."""
459	technology	One of the most common problems when trying to convert a movie to DVD format is the overscan.
1258	business	Yet eighty percent of our goods were taxed through tariffs in Central American countries. we treat you.
1009	health	In the PALM trial, ZMapp served as a control, meaning scientists used it as a baseline and compared the three other treatments to it.
935	business	Unless you are a diplomat, working overseas generally means that you will have to file income tax in the country you are based in.
698	travel	Ecuador requires that Cuban citizens receive an invitation letter prior to entering Ecuador through international airports or frontier admission points.
703	travel	Tours are cheaper for larger groups, so if you're by yourself or with just one friend, try to meet other people and form a group of four to six for a better per-person rate.
1931	business	However, this does not come cheap: as rough rules of thumb, you can expect to pay up to four times the normal economy fare for business, and eleven times for first class!
572	nature	Army ant colonies march and nest in different phases as well.
1134	disasters	After the dam was built in 1963, the seasonal floods that would spread sediment throughout the river were halted.
1593	nature	Many observed rhythms in physiology and behavior often crucially depend on the presence of endogenous cycles and their production through biological clocks.
778	technology	It can usually be replenished fairly easily if you run out, and gives resolution roughly comparable to a current DSLR.
392	politics	With the battle for France over, Germany began to get ready to invade the island of Britain.
473	religion	This marked an important change, as European powers would no longer have the pretext of being religious wars. Thus, the Thirty Years' War would be the last war to be labeled a religious war.
566	health	Vision, or the ability to see depends on visual system sensory organs or eyes.
425	education	However, Charles went to university at Trinity College, Cambridge where he studied Anthropology and Archaeology, and later History, earning a 2:2 (a lower second class degree).
113	business	Australia's former conservative government refused to ratify Kyoto, saying it would damage the economy with its heavy reliance on coal exports, while countries like India and China were not bound by emissions targets.
865	health	As with respiratory problems in colder climates, intestinal problems in hot climates are fairly common and in most cases are distinctly annoying but not really dangerous.
1996	education	There's a tradition to pass the Easter night awake at some exposed point to see the sunrise.
119	entertainment	The game is based on the Second Battle of Fallujah, a vicious battle between American and Iraqi forces.
696	religion	Due to the religious significance of the city, and in particular the many sites of the Old City area, Jerusalem is one of the main tourist destinations in Israel.
1264	politics	Huhne has resigned and he will be replaced in the Cabinet by Ed Davey MP. Norman Lamb MP is expected to take the Business Minister job Davey is vacating.
1891	travel	Travellers who had an easy time adjusting to the new culture sometimes have a particularly hard time readjusting to their native culture.
600	science	Elements and compounds can move from one state to another and not change.
598	science	Robert Hooke, a biologist from England, saw small squares in cork with a microscope.
225	science	Dark energy is a completely invisible force that is constantly acting upon the universe.
657	health	The very long days in the summer can lead to problems getting sufficient sleep and associated health issues.
226	science	Its existence is known only because of its effects on the expansion of the universe.
1622	geography	The Amazon River is the second longest and the biggest river on Earth. It carries more than 8 times as much water as the second biggest river.
1065	politics	U.S. President George W. Bush arrived in Singapore the morning of November 16, beginning a week-long tour of Asia.
1598	science	They did two experiments marking either the DNA in the phage with a radioactive phosphorus or the protein of the phage with radioactive sulfur.
601	science	Nitrogen as a gas still has the same properties as liquid nitrogen. The liquid state is denser but the molecules are still the same.
902	disasters	A tornado is a spinning column of very low-pressure air, which sucks the surrounding air inward and upward.
474	crime	The temple of Artemis at Ephesus was destroyed on July 21, 356 BCE in an act of arson committed by Herostratus.
1421	business	In 1624,Dutch East India Company establishes a base in southwestern Taiwan, initiating a transformation in aboriginal grain production practices and employing Chinese laborers to work on its rice and sugar plantations.
256	crime	"She said, ""There is no intelligence to suggest that an attack is expected imminently."
815	travel	Internationally, there are nearly 200 running tour organizations. Most of them operate independently.
1364	science	The tiger is in the same group (Genus Panthera) as lions, leopards, and jaguars. These four cats are the only ones who can roar.
1316	sports	Fellow wrestlers also paid tribute to Luna.
1074	disasters	Fourteen schools in Hawaii located on or near coastlines were closed all of Wednesday despite the warnings being lifted.
1415	sports	Italy's national football, along with German national football team is the second most successful team in the world and were the FIFA World Cup champions in 2006.
487	religion	"Sikhs call their religion Gurmat, which is Punjabi for ""way of the guru"". The guru is a fundamental aspect of all Indian religions but in Sikhism has taken on an importance that forms the core of Sikh beliefs."
496	health	Surgeons had knowledge of various sedatives including morphine from extracts of poppy seeds and scopolamine from herbane seeds.
945	travel	Vikings used the Russian waterways to get to the Black Sea and Caspian Sea. Parts of these routes can still be used. Check possible need for special permits, which may be difficult to get.
892	travel	It's compacted snow with crevasses filled in and marked by flags. It can only be traveled by specialized tractors, hauling sleds with fuel and supplies.
1391	geography	In the warm climate of the Middle East, the house was not so important.
833	travel	This might require filling out a form with the local police or a visit to the immigration offices.
954	travel	Turkish Airlines flies to 39 destinations in 30 African countries as of 2014.
958	travel	No airline alliance covers all three ocean crossings in the Southern Hemisphere (and SkyTeam covers none of the crossings).
1683	education	For example, each year students from Bennet School in North Carolina design a website about their trip to the State Capital, each year the website gets remodeled, but old versions are kept online to serve as a scrapbook.
1374	nature	We call this process speciation, which just means the formation of new species. Speciation is an unavoidable consequence and a very important part of evolution.
569	science	A population is the collection of organisms of a particular species within a given geographic area.
377	science	"The outer-part we see when we look at the Sun is called the photosphere, which means ""ball of light""."
297	politics	The proposed amendment already passed both houses in 2011.
278	politics	Former U.S. Speaker of the House Newt Gingrich came in second with 32 percent.
1481	business	However, a nationwide road network is not economically viable for just a handful of cars, so new methods of production are developed to reduce the cost of car ownership.
33	sports	Piquet Jr. was sacked after the 2009 Hungarian Grand Prix.
1887	disasters	Most deaths happen as result of fatigue trying to swim back against the current, which may be impossible.
380	science	Then, a few years later in 1639, an English astronomer named Jeremiah Horrocks observed a transit of Venus.
1695	geography	Madagascar is by far the biggest, and a continent on its own when it comes to wildlife.
1523	science	Mutation adds new genetic variation, and selection removes it from the pool of expressed variation.
1508	education	Virtual Scaffolds are internalized in the software and are meant to question, prompt, and explain procedures that may have been to challenging for the student to handle alone.
415	science	Another famous Greek is a mathematician Pythagoras, mostly known for his famous theorem about relations of the sides of right triangles.
341	business	"Regarding the global financial situation, Zapatero continued by saying that ""the financial system is a part of the economy, a crucial part."
1670	science	Neurobiological data provide physical evidence for a theoretical approach to the investigation of cognition. Therefore it narrows the research area and makes it much more exact.
798	travel	Also give policy/contact copies to traveling companions and relatives or friends back home willing to help.
1761	nature	According to park authorities, stay at least 100 yards/meters away from bears and wolves and 25 yards/meters from all other wild animals!
1723	nature	It may also be beneficial for one to buy a Wild Card, which provides entry to either selections of parks in South Africa or all of the South African National Parks.
1514	technology	The Internet combines elements of both mass and interpersonal communication.
195	sports	Massa is due to be out for at least the rest of the 2009 season.
1158	geography	"Their thermal behavior is not as steady as large caves on Earth that often maintain a fairly constant temperature, but it is consistent with these being deep holes in the ground,"" said Glen Cushing of the United States Geological Survey (USGS) Astrogeology Team and of Northern Arizona University located in Flagstaff, Arizona."
574	nature	The colony begins a nomadic phase when available food has decreased. During this phase, the colony makes temporary nests that are changed everyday.
1008	health	One antibody cocktail, ZMapp, initially showed promise in the field, but formal studies indicated it had less benefit than sought in preventing death.
129	entertainment	The city will be the first in southeastern Europe to host CowParade, the world's largest public art event, between June and August this year.
353	science	The water molecules make an invisible skin on the water’s surface that allows things like the needle to float on top of the water.
1030	crime	A car bomb detonated at police headquarters in Gaziantep, Turkey yesterday morning killed two police officers and injured more than twenty other people.
1529	nature	"All things considered, we should not be surprised if our own ancestors solved their ""protein problem"" in somewhat the same way that chimps on the savanna do today."
1646	science	Some atoms have unstable nuclei which means that they tend to break apart with little or no nudging.
1069	politics	"Layton had asked for changes to the conservatives' environmental bill during the meeting with the PM, asking for a ""thorough and complete rewriting"" of the Conservative party's environmental bill."
1601	travel	Nature-based tourism attracts people interested in visiting natural areas for the purpose of enjoying the scenery, including plant and animal wildlife.
783	technology	Wildlife photography often requires a long telephoto lens, though things like a flock of birds or a tiny creature need other lenses.
654	crime	"Crime, and ill-will toward foreigners in general, is virtually unknown in Greenland. Even in the towns, there are no ""rough areas."""
755	entertainment	These hotels were where the rich and the famous of the day would stay, and often had fine dining and nightlife.
67	crime	When the tenants started sharing what had occurred to them, most of the families involved suddenly realized that Carolyn Wilson of the OHA had stolen their security deposits, and skipped out of town.
771	entertainment	Kerala's temple festivals are very interesting to see, with regular procession of decorated elephants, temple orchestra and other festivities.
1667	business	As a result, the process of an organization working together to overcome an obstacle can lead to a new innovative process to serve the customer's need.
68	crime	Tenants at Lockwood Gardens believe that there may be another 40 families or more to face eviction, since they learned that OHA police are also investigating other public housing properties in Oakland that may be caught up in the housing scam.
1241	technology	Around 3 minutes into the launch, an on-board camera showed numerous pieces of insulation foam break away from the fuel tank.
203	geography	Some of the rainfall was accompanied by thunderstorms and frequent lightning.
642	technology	The use of the Internet and the World Wide Web allows learners to have access to information at all times.
