index_id	category	text
370	nature	These plants look like a small palm tree with a crown of sharp, spiky leaves.
1367	science	Scientists think that ocelots follow and find animals to eat (prey) by smell, sniffing for where they've been on the ground.
580	science	These nerve impulses can be sent so quickly throughout the body which helps keep the body safe from any potential threat.
1292	sports	In a partnership of NPWS and the Sporting Shooters Association of Australia (NSW) Inc, qualified volunteers were recruited, under the Sporting Shooters Association's hunting program.
826	travel	Basically, they fall into two categories: Either work while you travel or try and limit your expenses. This article is focused on the latter.
1548	politics	One of the most noteworthy recent examples of this was the North Atlantic campaign of WWII. The Americans were trying to move men and materials across the Atlantic Ocean to help Britain.
432	politics	Luxembourg has a long history but its independence dates from 1839.
584	technology	Humans have been making and using lenses for magnification for thousands and thousands of years.
1024	science	This not only confirms that at least some dinosaurs had feathers, a theory already widespread, but provides details fossils generally cannot, such as color and three-dimensional arrangement.
1176	sports	It was the final match for the All Blacks, who had already won the trophy two weeks ago.
71	crime	The famous Greek lawyers, Sakis Kechagioglou and George Nikolakopoulos have been imprisoned in the Athens' jail of Korydallus, as they were found guilty of graft and corruption.
1859	geography	The definition has geographic variations, where the age limit might be shorter in places such as North America than in Europe.
1308	crime	Several hostages have been rescued and least six have been confirmed dead so far.
1155	geography	"All of the cave entrances, which were named ""The Seven Sisters"", are at least 100 to 250 meters (328 to 820 feet) in diameter."
1132	crime	Soon, officers equipped with riot gear entered the yard and cornered the inmates with tear gas.
761	travel	A listing of available hosts is then provided either in print and/or online, sometimes with references and reviews by other travelers.
573	nature	In the nomadic phase, army ants march at night and stop to camp during the day.
25	sports	Ovechkin's first assist of the night was on the game-winning goal by rookie Nicklas Backstrom;
115	business	The company hopes to diversify its profit sources and gain popularity in areas where Skype holds a strong position, such as China, Eastern Europe, and Brazil.
436	religion	The Drukgyal Dzong is a ruined fortress and Buddhist monastery in the upper part of the Paro District (in Phondey Village).
947	geography	Lake Onega is also connected to Volga, so coming from the Caspian Sea through Russia is still possible.
180	crime	Evidence thereafter indicated test papers were tampered with Hall, along with 34 other education officials, was indicted in 2013.
1423	politics	In 1895, after defeat in the First Sino-Japanese War (1894-1895), the Qing government signs the Treaty of Shimonoseki, by which it cedes sovereignty over Taiwan to Japan, which rules the island until 1945.
140	nature	By early today, winds were around 83 km/h, and it was expect to keep weakening.
231	crime	The man suspected of detonating the bomb was detained, after sustaining injuries from the blast.
325	geography	Scientists at the National Hurricane Center predict that Danielle will strengthen to a hurricane by Wednesday.
1964	religion	Most of the monasteries do provide wraps for women who come unprepared, but if you bring your own, especially one with bright colors, you'll get a smile from the monk or nun at the entrance.
52	crime	The commissioner sets bail, if granted, and formalizes the charges filed by the arresting officer. The charges are then entered into the state's computer system where the case is tracked.
1363	nature	A well rounded athlete, the tiger can climb (though not well), swim, leap great distances and pull with five times the force of a strong human.
1077	disasters	The tenth named storm of the Atlantic Hurricane season, Subtropical Storm Jerry, formed in the Atlantic Ocean today.
893	geography	These aren't very nimble so the trail has to take a long swerve around the Transantarctic Mountains to come onto the plateau.
329	sports	During his time with the team, he scored 403 goals in 468 appearances.
1631	religion	All citizens of Vatican City are Roman Catholic.
306	health	The cause of death was announced as intrahepatic bile duct cancer.
360	science	The next picture shows the atoms emitting photons. Of course, in reality photons are a lot smaller than those in the picture.
314	education	In his notes he used words which some parents considered coarse, and he reportedly used profanity in class.
1643	technology	One can only wonder what the keyboard will become when something newer comes along.
911	technology	Because calls are routed over the Internet, you do not need to use a phone company located where you live or where you travel.
1804	travel	Safaris are perhaps the greatest tourism draw in Africa and the highlight for many visitors.
663	entertainment	San Francisco is also one of the best places in the nation for other Asian cuisine: Korean, Thai, Indian, and Japanese.
10	politics	Around 11:29, the protest moved up Whitehall, past Trafalgar Square, along the Strand, passing by Aldwych and up Kingsway towards Holborn where the Conservative Party were holding their Spring Forum in the Grand Connaught Rooms hotel.
213	disasters	At the time, nearly 100 residents were evacuated from the area.
1782	nature	Box jellyfish occur near beaches and near river estuaries from October to April north of 1770. They can occasionally be found outside these times.
311	entertainment	The couple had married in Texas one year ago and came to Buffalo to celebrate with friends and relatives.
216	sports	Squash, karate and roller sports tried to get onto the Olympic program as well as baseball and softball, which were voted out of the Olympic Games in 2005.
1387	religion	People would bring sacrifices to the gods and the priests would try to attend to the needs of the gods through ceremonies and festivals.
1072	disasters	According to the latest bulletin, sea level readings indicated a tsunami was generated. There was some definite tsunami activity recorded near Pago Pago and Niue.
112	politics	Mr. Rudd's decision to sign the Kyoto climate accord isolates the United States, which will now be the only developed nation not to ratify the agreement.
937	business	In some federal countries, such as the United States and Canada, income tax is levied both at the federal level and at the local level, so the rates and brackets can vary from region to region.
127	entertainment	Many of their writers have gone on to wield great influence on Jon Stewart and Stephen Colbert's news parody shows.
1255	science	The researchers observed crystals formed in cat urine by the addition of melamine and cyanuric acid.
1373	nature	Eventually, after thousands or even millions of years, the two populations will look so different that they can't be called the same species.
1173	sports	South Africa have defeated the All Blacks (New Zealand) in a rugby union Tri Nations match at the Royal Bafokeng Stadium in Rustenburg, South Africa.
122	crime	"The United States embassy located in Nairobi, Kenya has issued a warning that ""extremists from Somalia"" are planning to launch suicide bomb attacks in Kenya and Ethiopia."
1140	entertainment	Although Winfrey was tearful in her farewell, she made it clear to her fans she will be back.
817	sports	With roots in Barcelona's Running Tours Barcelona and Copenhagen's Running Copenhagen, it was quickly joined by Running Tours Prague based in Prague and others.
1328	science	Scientists hope to understand how planets form, especially how the Earth formed, since comets collided with the Earth long ago.
291	geography	The significant earthquake activity resulting in the phase change had took place on March 10 on the northeast side of the volcano's summit caldera.
781	nature	Wildlife is among the most challenging motifs for a photographer, and needs a combination of good luck, patience, experience and good equipment.
1572	nature	But there are a lot of things about birds that still look like a dinosaur.
628	science	People with this type of thinking have logical thinking, are able to memorize patterns, solve problems and work on scientific tests.
26	sports	his second goal of the night was his 60th of the season, becoming the first player to score 60 or more goals in a season since 1995-96, when Jaromir Jagr and Mario Lemieux each reached that milestone.
813	sports	For a day hike along an easy trail little preparations are needed, and any moderately fit person can enjoy them.
1143	politics	The ruling party, South West Africa People's Organisation (SWAPO), also retained a majority in the parliamentary elections.
506	education	This page can easily be accessed by providing just one web address, which makes it easy to remember and easy to type in for students who may have trouble using the keyboard or with spelling.
125	business	Since its inception, The Onion has become a veritable news parody empire, with a print edition, a website that drew 5,000,000 unique visitors in the month of October, personal ads, a 24 hour news network, podcasts, and a recently launched world atlas called Our Dumb World.
1234	technology	Resembling a television remote, the controller uses two sensors placed near the user's television to triangulate its position in three-dimensional space.
1851	sports	It is related to but usually not involving alpine style ski touring or mountaineering, the latter ones done in steep terrain and requiring much stiffer skis and boots.
1120	health	The truck driver, who is aged 64, was not injured in the crash.
323	nature	Tropical Storm Danielle, fourth named storm of the 2010 Atlantic hurricane season, has formed in the eastern Atlantic Ocean.
1184	religion	"Chambers had sued God for ""widespread death, destruction and terrorization of millions upon millions of the Earth's inhabitants."""
1309	crime	Six hostages, including the children and elderly, were released early, as were the Filipino photographers.
1060	crime	Historians have criticized past FBI policies for focusing resources on cases which are easy to solve, especially stolen car cases, with the intent of boosting the agency's success rate.
980	nature	Even the hottest of deserts can become extremely cold at night. Hypothermia is a real risk without warm clothing.
1253	disasters	Both cyanuric acid and melamine were found in urine samples from pets that died after consuming contaminated pet food.
148	business	The Northern Rock bank had been nationalised in 2008 following the revelation that the company had received emergency support from the UK Government.
1528	nature	In contrast, animal foods (ants, termites, eggs) not only are easily digestible, but they provide high-quantity proteins that contain all the essential amino acids.
338	disasters	While on his warm-up lap, Lenz fell off his bike, and was then struck by fellow racer Xavier Zayat.
272	health	Some studies suggest that the disease must become less lethal before it can cause a global epidemic, he noted.
1682	education	Sharing a field trip virtually is also a great way to reflect a on a trip and share experiences with future classes.
1719	nature	The Kruger National Park (KNP) lies in the north-east of South Africa and runs along the border of Mozambique in the east, Zimbabwe in the north, and the southern border is the Crocodile River.
1474	business	Of course, the superprofits derived from the protracted exploitation of the Filipino people would constitute the basic gains of U.S. imperialism.
1708	travel	Around the old Medina it's easy to find places selling traditional Moroccan goods, such as tagines, pottery, leather goods, hookahs, and a whole spectrum of geegaws, but it's all for the tourists.
352	science	Surface tension happens because the water molecules at the surface of the water are strongly attracted to each other more than they are to the air molecules above them.
40	entertainment	"John Grant, from WNED Buffalo (Reading Rainbow's home station) said ""Reading Rainbow taught kids why to read,... the love of reading — [the show] encouraged kids to pick up a book and to read."""
1441	politics	Britain mined international waters to prevent any ships from entering entire sections of ocean, causing danger to even neutral ships.
512	health	ADD affects relationships with other peers because other children can not understand why they act the way that they do or why they spell they way they do or that their maturity level is different.
1948	travel	Please remember that you are essentially visiting a mass grave site, as well as a site that has an almost incalculable meaning to a significant portion of the world's population.
1109	health	The first cases of the disease this season were reported in late July.
1442	politics	Since there was limited response to this tactic, Germany expected a similar response to its unrestricted submarine warfare.
1239	entertainment	She’s very cute and sings quite well, too, he said according to a transcript of the news conference.
87	crime	News spread in the Red Lake community today as funerals for Jeff Weise and three of the nine victims were held that another student was arrested in connection with the school shootings of March 21.
1305	disasters	Also the Pacific Tsunami Warning Center said that there was no Tsunami indication.
1247	disasters	Hokuriku Electric Power Co. reported no effects from the earthquake and that the Number 1 and 2 reactors at its Shika nuclear power plant were shut down.
934	education	Check with the institution, as well as the immigration department for the country you wish to study in for detailed requirements.
1696	geography	Most of the smaller islands are independent nations, or associated with France, and known as luxury beach resorts.
1785	travel	Booking in advance gives the traveller peace of mind that they will have somewhere to sleep once they arrive at their destination.
498	health	Over multiple centuries, the Roman empire led to great gains in the field of medicine and formed much of the knowledge we know today.
1342	science	The cabbage juice changes color depending on how acidic or basic (alkaline) the chemical is.
987	geography	"These plateaus are often referred to as ""vidde"" meaning a wide, open treeless space, a boundless expanse."
1205	health	Danielle Lantagne, a UN expert on the disease, stated the outbreak was likely caused by the peacekeepers.
1792	entertainment	Remember that even though music on the main stages may have finished, there may be sections of the festival that will keep playing music until late into the night.
906	technology	They are superior to web proxies for several reasons: They re-route all Internet traffic, not only http.
1256	health	The composition of these crystals matches those found in the urine of affected pets when compared by infrared spectroscopy (FTIR).
1873	disasters	Regional and seasonal severe weather phenomena include blizzards, snowstorms, ice storms, and dust storms.
1160	politics	After officials verify the voter's identity, the voter drops the envelope into the ballot box and signs the voting roll.
1197	sports	They include the Netherlands, with Anna Jochemsen finishing ninth in the women's standing class in the Super-G yesterday, and Finland with Katja Saarinen finishing tenth in the same event.
105	business	In its most recent monthly report, OPEC said exports of crude had fallen to their lowest level for two decades at 2.8 million barrels per day.
1175	sports	For the Springboks, it ended a five-match losing streak.
1419	geography	"Due to the cluster/group of islands Japan has, Japan is often referred to, on a geographical stance, as an ""archipelago"""
1178	disasters	A moderate earthquake shook western Montana at 10:08 p.m. on Monday.
1070	politics	Ever since the Federal Government stepped in to take over funding of the Mersey hospital in Devonport, Tasmania, the state government and some federal MPs have criticised this act as a stunt in the prelude to the federal election to be called by November.
1806	travel	Some animals, such as elephants and giraffes, tend to approach closely to cars and standard equipment will allow good viewing.
1939	geography	İzmir is the third largest city in Turkey with a population of around 3.7 million, the second biggest port after Istanbul, and a very good transport hub.
1595	nature	Biological clocks are self sustaining oscillators which will continue a period of free-running cycling even in the absence of external cues.
223	crime	Blake was also convicted of attempting to pervert the course of justice.
1961	nature	The area is also home to an extremely wide variety of animal and bird species.
155	geography	Fifteen of these rocks are attributed to the meteorite shower last July.
1119	health	After the accident occurred, Gibson was transported to a hospital but died shortly afterwards.
238	geography	"As far as we know, there is only one planetary body that displays more dynamism than Titan, and its name is Earth,"" added Stofan."
70	entertainment	The band's management company, HK Management Inc., gave no initial reason when they canceled on September 20, but blamed logistical reasons by the next day.
955	travel	If you have additional travel time, check to see how your total fare quote to Africa compares with a round-the-world fare.
1212	business	Despite leaving the show in 1993 he kept the title of executive producer, and continued to receive tens of millions of dollars every season in royalties.
740	geography	It is an archipelago with 15 islands spread out over 2.2 million km2 of ocean.
878	health	A contagious disease is a disease which is easily transmitted by being in the vicinity of an infected person.
141	sports	On Wednesday, the United States' National Basketball Association (NBA) suspended its professional basketball season due to concerns regarding COVID-19.
197	health	The president's condition is stable, though he will be isolated at home for several days.
994	travel	Only a few airlines still offer bereavement fares, which slightly discount the cost of last-minute funeral travel.
1700	travel	Women: It is recommended that any women travellers say that they are married, regardless of actual marital status.
321	business	For the first time, last year China exported more cars than Germany and surpassed the United States as the biggest market for this industry.
1220	disasters	The same month saw another airliner overrun a runway at Mashhad and strike a wall, killing seventeen.
1142	politics	Final results from Namibian presidential and parliamentary elections have indicated that the incumbent president, Hifikepunye Pohamba, has been reelected by a large margin.
186	travel	The bus was headed to Six Flags St. Louis in Missouri for the band to play to a sold-out crowd.
1826	travel	If you're not used to driving on country roads, keep your wits about you: steep grades, narrow lanes, and sharp curves predominate.
894	disasters	The most common cause for accidents in winter is slippery roads, pavements (sidewalks) and especially steps.
1331	politics	He is speculated to make a run for president in 2016.
264	technology	The station maintained its attitude, despite the loss of a gyroscope earlier in the space station mission, until the end of the spacewalk.
450	geography	The Serengeti region contains the Serengeti National Park, the Ngorongoro Conservation Area and Maswa Game Reserve in Tanzania and the Maasai Mara National Reserve in Kenya.
193	sports	Schumacher who retired in 2006 after winning the Formula 1 championship seven times, was due to replace the injured Felipe Massa.
568	science	The different constructions have different capabilities, are sensitive to different wave-lengths and have differing degrees of acuity, also they require different processing to make sense of the input and different numbers to work optimally.
810	sports	Canyoning combines elements from swimming, climbing and jumping--but requires relatively little training or physical shape to get started (compared to rock climbing, scuba diving or alpine skiing, for example).
726	entertainment	There are a number of restaurants surrounding the garden, and in the afternoons and evening there free concerts are often given from the central gazebo.
269	sports	21-year-old Jesus joined Manchester City last year in January 2017 from Brazilian club Palmeiras for a reported fee of £27 million.
2000	nature	Due to the long distance from the continent mammals were unable to make the journey making the giant tortoise the primary grazing animal in the Galapagos.
927	technology	Flying a drone near an airport or over a crowd is almost always a bad idea, even if it's not illegal in your area.
394	politics	But the Royal Navy was still much stronger than the German Navy (“Kriegsmarine”) and could have destroyed any invasion fleet sent across the English Channel.
735	travel	Sirena is the only ranger station that offers dormitory lodging and hot meals in addition to camping. La Leona, San Pedrillo, and Los Patos offer only camping with no food service.
907	technology	They normally offer higher bandwidth and better quality of service. They are encrypted and thus harder to spy on.
1615	nature	Insects were the first animals to take to the air. Their ability to fly helped them evade enemies more easily and find food and mates more efficiently.
1841	travel	If a rider is thrown from a horse but has a foot caught in the stirrup, they could be dragged if the horse runs away. To minimize this risk, a number of safety precautions can be taken.
484	religion	Mysticism can be distinguished from other forms of religious belief and worship by its emphasis on the direct personal experience of a unique state of consciousness, particularly those of a peaceful, insightful, blissful, or even ecstatic character.
339	health	He was immediately attended to by the on-track medical staff and transported to a local hospital where he later died.
206	disasters	The crash site was located today and is so inaccessable that two policemen were dropped into the jungle in order to hike to the scene and seek survivors.
972	education	Nevertheless, all French-speaking Belgians and Swiss would have learned standard French in school, so they would be able to understand you even if you used the standard French numbering system.
951	travel	You should choose your Frequent Flyer airline in an alliance carefully.
885	business	There is a surcharge for having more than 2 passengers, so this option might be more expensive than necessary.
1215	travel	The early reports say the plane was diverted back to Afghanistan after being denied an emergency landing in Ürümqi.
280	politics	Organisers of the protest said about 100,000 people turned up in German cities such as Berlin, Cologne, Hamburg, and Hanover.
1737	travel	Shared taxis are a quick and comfortable means to travel to nearby places, such as Paro (Nu 150) and Punakha (Nu 200).
1494	technology	Subsistence agriculture is a simple, often organic, system using saved seed native to the ecoregion combined with crop rotation or other relatively simple techniques to maximize yield.
1013	sports	USA Gymnastics and the USOC have the same goal — making the sport of gymnastics, and others, as safe as possible for athletes to follow their dreams in a safe, positive and empowered environment.
247	politics	These agents are responsible for providing government and judicial services under Article 247 of the Pakistani Constitution.
889	geography	Inland Antarctica is a desolate plateau covered by 2-3 km of ice.
298	politics	A change was made this legislative session when the second sentence was deleted first by the House of Representatives and then was passed in a similar form by the Senate Monday.
1301	business	"Last week, METI announced that Apple had informed it of 34 additional overheating incidents, which the company called ""non-serious."""
832	travel	Registration is an additional requirement for the visa process. In some countries, you must register your presence and address where you are staying with the local authorities.
209	disasters	An official with the gas company was reporting to the scene after a neighbor called about a gas leak.
531	sports	Eighteen holes are played during a regular round, with players usually starting on the first hole on the course and finishing on the eighteenth.
202	geography	"The precipitation, reaching 6.34 inches at a gauge on Oahu, was described as ""beneficial""."
720	geography	Besides white sand beaches and mountain landscapes, the country is home to the oldest European city in the Americas, now part of Santo Domingo.
154	geography	Out of the approximately 24,000 known meteorites to have fallen to Earth, only about 34 have been verified to be martian in origin.
1254	science	The two compounds react with one another to form crystals that may block kidney function, researchers at the university said.
120	entertainment	The ACMA also found that despite the video being streamed on the Internet, Big Brother had not breached online content censorship laws as the media had not been stored on Big Brother's website.
578	science	"Cells are so basic and critical to the study of life, in fact, that they are often referred to as ""the building blocks of life""."
1418	geography	Japans holds nearly 7,000 islands (the biggest being Honshu), making Japan the 7th largest island in the world!
173	technology	Following seabed mapping the wreck was found using an ROV.
362	technology	After hundreds of hours of operation the filament in the bulb eventually burns out and the light bulb no longer works.
