index_id	category	text
431	geography	တူရကီကို အနောက်ဘက်တွင် Aegean ပင်လယ်၊ မြောက်ဘက်တွင် ပင်လယ်နက်နှင့် တောင်ဘက်တွင် မက်ဒီတာရေးနီးယန်းပင်လယ်တို့ဖြင့် နေရာသုံးဖက်တွင် ပင်လယ်များဖြင့် ဝန်းရံထားပါသည်။
403	science/technology	စစ်ပွဲအစပိုင်းတွင် ရေငုပ်သင်္ဘောများသည် ပင်လယ်ရေပြင်အထက်ပိုင်းတွင် အများဆုံး သွားလာခဲ့ကြသော်လည်း ရေဒါစနစ်သည် ဖွံ့ဖြိုးလာပြီး ပိုမိုတိကျလာသည့်အတွက် ၎င်းတို့အား မမြင်တွေ့နိုင်စေရန်အတွက် ရေအောက်၌ သွားလာရန် တိုက်တွန်းခဲ့သည်။
1592	science/technology	ဂရိတို့၏ အသိပညာကျဆင်းလာသောကြောင့် အနောက်အုပ်စုသည် ဂရိတို့၏ ဒဿနိကဗေဒနှင့် သိပ္ပံရေသောက်မြစ်များမှ လမ်းခွဲသွားခဲ့ကြောင်း တွေ့ရသည်။
993	entertainment	သို့ရာတွင်၊ ၎င်းတို့၌ ဆောင်းရာသီအတောအတွင်း မတူညီသော အလှအပနှင့် ဆွဲဆောင်မှုများရှိကြပြီး၊ တောင်ကုန်းများပေါ်တွင် နှင်းများထူထပ်စွာကျရောက်ခြင်းကြောင့် နှင်းလျောစီးခြင်းနှင့် နှင်းလျောစီးဘုတ်စီးခြင်းတို့ကို ပြုလုပ်နိုင်သည်။
755	entertainment	"""""""ယင်းဟိုတယ်များသည် ယနေ့ခေတ် ချမ်းသာသူများနှင့် နာမည်ကြီးသူများ တည်းခိုကြမည့်နေရာများဖြစ်ပြီး အကောင်းစား စားသောက်ပွဲများနှင့် ညပိုင်းဖျော်ဖြေမှုကို မကြာမကြာ ရရှိနိုင်သည်။"""""""
1936	politics	၁၉၉၄ ခုနှစ်တွင်၊  ၎င်း၏ ကိုယ်ပိုင်အစိုးရနှင့် ငွေကြေးရှိသော်လည်း UN အဖွဲ့ဝင်နိုင်ငံများ၏ အသိအမှတ်ပြုခြင်းကိုမခံရသော အရှေ့ပိုင်း မော်လ်ဒိုဗာတွင် ၎င်းပဋိပက္ခသည် မိမိဘာသာကြေငြာ၍ပြဌာန်းတောင်းဆိုသည့် ထရန်နီးရှားပြည့်သူ့နိုင်ငံ ဖြစ်ပေါ်လာစေရန်အတွက် ဦးတည်ခဲ့သည်။
1205	health	UN ကျွမ်းကျင်ရောဂါဗေဒပညာရှင် ဒန်နီလာလန်းတေ့နီး မှ ကူးစက်ပျံ့ပွားမှုသည် ငြိမ်းချမ်းရေးထိန်းသိမ်းသူများကြောင့် ဖြစ်ပွားခြင်းဖြစ်နိုင်သည်ဟု ပြောဆိုခဲ့ပါသည်။
1692	geography	မြောက်ပိုင်းဘက် ကြီးမားသော ဧရိယာများသည် နေထိုင်သူများ ပြန့်ကျဲနေပြီး အချို့မှာ အသုံးမပြုသော အရိုင်းမြေသက်သက်ဖြစ်သည်။
280	politics	ဆန္ဒပြပွဲ၏ စည်းရုံးရေးမှူးများက လူဦးရေ ၁၀၀,၀၀၀ သည် ဘာလင်၊ ကိုလုံး၊ ဟမ်းဘာ့ဂ်နှင့် ဟန်နိုဗာကဲ့သို့ ဂျာမန်မြို့ကြီးများအတွင်း ထွက်ပေါ်လာခဲ့ကြောင်း ပြောဆိုခဲ့သည်။
247	politics	ထိုကိုယ်စားလှယ်များသည် အစိုးရနှင့် တရားရေးဝန်ဆောင်မှုများကို ပါကစ္စတန်အခြေခံဥပ‌ဒေ အပိုဒ်ခွဲ ၂၄၇ အရ ပေးအပ်ရန် တာဝန်ရှိသည်။
1439	politics	စစ်မက်ပြုမှုများ ဖြစ်ပြီးမကြာမီ ဗြိတိသျှတို့က ဂျာမဏီကို ရေကြောင်းပိတ်ဆို့မှုများ စတင်ခဲ့သည်။
1239	entertainment	"""""""သူမသည် အလွန်ချစ်စရာကောင်းပြီး ကောင်းကောင်းလည်း သီချင်းဆိုတတ်သည်"""" ဟု သတင်းစာရှင်းလင်းပွဲ၏ အသံမှတ်တမ်းစာသားအရ သူက ပြောဆိုသည်။"""
743	geography	ကွတ်ကျွန်းများသည် မည်သည့်မြို့မှမရှိပ ကျွန်း ၁၅ကျွန်းဖြင့် ဖွဲ့စည်းထားသည်။ အဓိကတစ်ခုမှာ ရာရိုတွန်ဂါနှင့် အီတူတာကီဖြစ်သည်။
18	politics	ကမ္ဘာအနှံ့တွင် ဆန္ဒပြမှုများ၊ ရာဇဝတ်မှု တရားစွဲဆိုခြင်းများစွာ ရှိခဲ့ပြီး အိုက်စ်လန်နှင့် ပါကစ္စတန်တို့၏ အစိုးရခေါင်းဆောင်များ နှုတ်ထွက်သွားကြသည်။
1344	science/technology	ဟိုဒရိုဂျင် အိုင်ယွန်းများမှာ ၎င်းတို့၏ အီလက်ထရွန်များ ကွာကျသွားသည့် ပရိုတွန်များ ဖြစ်သည် (ဟိုက်ဒရိုဂျင် အက်တမ်များတွင် ပရိုတွန်တစ်ခုနှင့် အီလက်ထရွန်တစ်ခု ပါဝင်သောကြောင့်)။
688	travel	အချိန် အကန့်အသတ်ရှိသော ဧည့်သည်များသည် ၎င်းတို့၏အချိန်ကို အခြားနေရာတွင် ကုန်ဆုံးရန် အကောင်းဆုံးဖြစ်ပါလိမ့်မည်။
556	science/technology	အက်တမ်ကို အစိုင်အခဲအားလုံး၏ အခြေခံကျသောဖွဲ့စည်းရေးအရာများအနက်မှတစ်ခုအဖြစ် စဉ်းစားနိုင်ပါသည်။
1645	science/technology	လှည်းကြီးကို တောင်ကုန်းပေါ် လှိမ့်တင်လိုက်သကဲ့သို့ ဖြစ်သည်။ နျူကလိယကို အပေါ်သို့ ထပ်မံ၍ ခွဲထုတ်လိုက်ခြင်းက ယင်းစွမ်းအင်အချို့ကို ထုတ်ပေးပါသည်။
907	science/technology	ပုံမှန်အားဖြင့်၊ ၎င်းတို့သည် မြင့်မားသော ဘန်းဒ်ဝဒ်နှင့် အရည်အသွေးပိုမိုကောင်းမွန်သောဝန်ဆောင်မှုကို ပေးစွမ်းပါသည်။ ၎င်းတို့ကို ဝှက်စာအဖြစ်ပြောင်းထားသောကြောင့် ထောက်လှမ်းရန် ပိုမိုခက်ခဲစေပါသည်။
1071	politics	ဝန်ကြီးချုပ် ဂျွန်ဟိုးဝါ့တ် က အက်ဥပဒေအရ တက်စ်မေးနီးယားအစိုးရက အဆင့်လျှော့ချထားသောဆေးရုံများ၏ အသုံးအဆောင်များကို အကာအကွယ်ပေးရန်အတွက် AUD$၄၅ အပိုထပ်ပေးခြင်းကိုသာ လုပ်ဆောင်နိုင်သည်ဟု ပြောကြားခဲ့ပါသည်။
555	sports	ကုန်ပစ္စည်းတစ်ခုသည် အမှန်တကယ် အကျိုးမပြုသည့်တိုင် အားကစားသမားများက ကြိုက်နှစ်သက်မိသည်ဟု ခံစားရနိုင်သည်။
1203	health	စစ်သားများ မရောက်မီ ဟေတီက ၁၈၀၀ ခုနှစ်မှစ၍ ရောဂါနှင့်ဆိုင်သော ပြဿနာများကို ရင်ဆိုင်ကြုံတွေ့ခဲ့ရသည်။
58	politics	၎င်းတို့၏အုပ်ချုပ်သောကွန်ရက်ကိုပို၍ခိုင်မာအောင်လုပ်ဆောင်ရာတွင် တတ်နိုင်သမျှ ထင်ထင်ပေါ်ပေါ်မနေရန်ဆိုသည့် ပရိုဗင်ဇာနို၏မူဝါဒအတိုင်းလုပ်ဆောင်ခြင်းကြောင့် လိုပစ်ကိုလို၏ကြီးကျယ်သောအတွေ့အကြုံသည် သူဌေးအဆက်ဆက်၏လေးစားမှုကို ရရှိနိုင်ခဲ့ကာ သူသည် ပါလာမိုတွင် ပရိုဗင်ဇာနို၏ညာလက်ရုံးဖြစ်လာခဲ့သောကြောင့် သူသည် လွှမ်းမိုးနိုင်မှုရှိလာခဲ့သည်ဟု ရဲများက ပြောကြားခဲ့ပါသည်။
1764	travel	ထို့အပြင် ဝက်ဝံများနှင့် အခြားသားရိုင်းများကို ဆွဲဆောင်သည့် ရနံ့များကို သတိပြုရန်ရှိသဖြင့် ရနံ့ပြင်းထန်သော အစားအစာများကို သယ်ယူခြင်း သို့မဟုတ် ချက်ပြုတ်ခြင်းကို ရှောင်ကြဉ်၍ စခန်းကို အမြဲသန့်ရှင်းထားပါ။
195	sports	မက်စ်စ သည် အနည်းဆုံး ကျန်ရှိနေသော ၂၀၀၉ ရာသီအတွက်အပိုင်းများတွင် ပါဝင်မည်မဟုတ်ပါ။
1785	travel	ခရီးသွားသူများသည် ကြို၍ဘွတ်ကင်လုပ်ထားခြင်းဖြင့် ၎င်းတို့သွားလိုသည့်နေရာသို့ရောက်သည်နှင့် အနားယူအိပ်စက်နိုင်သောနေရာတစ်နေရာရှိမည်ဆိုသော အချက်ဖြင့် စိတ်အေးလက်အေးနေနိုင်ပါသည်။
600	science/technology	ဒြပ်စင်များနှင့် ကွန်ပေါင်းများသည် အခြေအနေတစ်ခုမှတစ်ခုသို့ ပြောင်းရွှေ့နိုင်ပြီး ပြောင်းလဲမှုမရှိပါ။
553	sports	တာလတ်ပြေးခြင်းသည် အကုန်အကျမများသည့်အားကစားဖြစ်သော်လည်း၊ ပါဝင်ရန်အတွက် လိုအပ်သောပစ္စည်းအနည်းငယ်နှင့်ပတ်သက်၍ မှားယွင်းသည့်အတွေးအခေါ်များစွာ ရှိပါသည်။
1720	geography	ပန်းခြံသည် ၁၉၅၀၀ စတုရန်းကီလိုမီတာရှိပြီး အီကိုဇုန်များ ၁၄ ခု ပိုင်းခြားထားကာ တစ်ခုချင်းစီတွင် ကွဲပြားသော တောရိုင်းတိရစ္ဆာန်များကို ထားထားသည်။
1622	geography	အမေဇုန်မြစ်သည် ကမ္ဘာပေါ်တွင် ဒုတိယမြောက်အရှည်ဆုံးနှင့် အကြီးဆုံးမြစ်ဖြစ်ပါသည်။ ၎င်းသည် ဒုတိယမြောက်အကြီးဆုံးမြစ်ဟုဆိုသည့်အတိုင်း ၈ ဆပိုများသောရေများကို သယ်ယူပေးပါသည်။
1441	politics	ဗြိတိသျှသည် ကြားနေသင်္ဘောများကိုပင် အန္တရာယ်ဖြစ်သွားစေခဲ့သော မည်သည့်သင်္ဘောမဆို သမုဒ္ဒရာအတွင်းသို့ဝင်ရောက်ခြင်းမပြုစေရန် နိုင်ငံတကာရေပိုင်နက်များတွင် မိုင်းများထောင်ထားခဲ့ပါသည်။
566	health	ရှုထောင့် သို့မဟုတ် တွေ့မြင်နိုင်စွမ်း ဆိုသည်မှာ အမြင်အာရုံစနစ်ပိုင်းဆိုင်ရာ ကိုယ်အင်္ဂါအစိတ်အပိုင်းများ သို့မဟုတ် မျက်လုံးများအပေါ်တွင်  မူတည်သည်။
1515	science/technology	အင်တာနက်၏ ထူးခြားသော ဝိသေသလက္ခဏာများက သုံးစွဲသူအခြေပြုချဉ်းကပ်နည်းလမ်းဖြင့် ထပ်ဆောင်းအတိုင်းအတာ သတ်မှတ်ချက်များကို ဦးတည်စေသည်။
585	science/technology	သို့ရာတွင်၊ ပထမဆုံးသော စစ်မှန်သည့်တယ်လီစကုပ်ကို ဥရောပတွင် ၁၆ ရာစုနှောင်းပိုင်းက ပြုလုပ်ခဲ့ပါသည်။
1689	geography	ဥတ္တဝါသည် ကနေဒါ၏ ချစ်စရာ ဘာသာစကား နှစ်မျိုးသုံးမြို့တော်ဖြစ်ပြီး ကနေဒါ၏ ယခင်နှင့် ယခုအခြေအနေများကို ပြသထားသည့် အနုပညာပြခန်းများနှင့် ပြတိုက်များစွာဖြင့် ထုံမွန်းထားသည်။
1256	health	အနီအောက်ရောင်ခြည်ဆိုင်ရာရောင်စဉ်တိုင်းပညာ (FTIR) ဖြင့် နှိုင်းယှဉ်ကြည့်သည့်အခါ ထိုသလင်းကျောက်များ၏ပေါင်းစပ်ဖွဲ့စည်းမှုသည် အကျိုးသက်ရောက်မှုခံထားရသောတိရစ္ဆာန်များ၏ဆီးထဲရှိအရာများနှင့် တူညီနေပါသည်။
60	science/technology	Apple ၏ စီအီးအို ဖြစ်သူ စတိဗ်ဂျော့က စင်ပေါ်၌ လမ်းလျှောက်ကာ သူ၏ ဂျင်းဘောင်းဘီအိတ်ကပ်ထဲမှ အိုင်ဖုန်း ကို ထုတ်ယူ၍ ကိရိယာကို ထုတ်ဖော်ပြသခဲ့သည်။
32	sports	အလွန်ဆို ၏ရှေ့မှကားများသည် လုံခြုံရေးကားအောက်တွင် ဆီထည့်ရန်သွားခဲ့ကြသောကြောင့်၊ သူသည် ၎င်းတို့ကိုကျော်တက်ကာ အနိုင်ရခဲ့ပါသည်။
1411	politics	တော်လှန်ရေးစစ်ပွဲအတွင်း ပြည်နယ်ဆယ့်သုံးက ပထမဦးစွာ အင်အားနည်းသည့် ဗဟိုအစိုးရကို ကွန်ဖက်ဒရေးရှင်း ပိုဒ်ခွဲများအရ တည်ထောင်ခဲ့ပြီး ၎င်းတွင် ကွန်ဂရက်တစ်ခုတည်းသာ အစိတ်အပိုင်းအဖြစ် ပါဝင်ခဲ့သည်။
13	sports	နေဒယ်သည် ပထမဆုံး ဆာ့ဗ်ပေးမှုတွင် ၇၆ မှတ်ရရှိကာ ပြိုင်ပွဲတွင် အသားတင်အမှတ် ၈၈% ဖြင့် အောင်မြင်ခဲ့ပါသည်။
1941	travel	တစ်ဖက်တစ်ချက်စီတွင် သစ်ပင်များပေါက်နေသော လမ်းကျယ်ကြီးများ၊ အရှေ့ဖက်တွင်မှန်များဖြင့် ကာထားသော အဆောက်အအုံများနှင့် ခေတ်မီစျေးဝယ်စင်တာများကို ဓလေ့အတိုင်းလုပ်ထားသော အနီရောင်အမိုးစောင်းများနှင့် မိုးကာထားပြီး ၁၈ ရာစုစျေးနှင့် ဗလီနှင့် ချာ့ချ်ကျောင်းအဟောင်းကြီးများ ရှိနေသော်လည်း မြို့သည် တူရကီ ရိုးရာပုံစံထက် မြေထဲပင်လယ် ဥရောပဒေသနှင့် ပို၍အလားသဏ္ဍာန်တူနေပါသည်။
732	sports	ဝစ်ဆဲလာ (ဗန်ကူးဗားမှ ၁.၅ နာရီ မောင်းရသည်) သည် စျေးကြီးသော်လည်း ၂၀၁၀ ဆောင်းရာသီ အိုလံပစ်ကြောင့် လူသိများပါသည်။
871	entertainment	သင့်အိမ်ကို နံနက်ပိုင်းတွင် အနံ့အရသာ ပြည့်စုံသည့် ကော်ဖီဖြင့်လည်းကောင်း ညအချိန်တွင် အပန်းပြေစေသည့် ချာမိုမိုင်းလ် လဘက်ရည်အချို့ဖြည့်ထားပါ။
886	geography	အန္တာတိကသည် ကမ္ဘာပေါ်တွင် အအေးဆုံးဖြစ်ပြီး ဘေးပတ်ပတ်လည်တွင် တောင်ဝင်ရိုးစွန်း ရှိသည်။
362	science/technology	အသုံးပြုချိန် နာရီရာပေါင်းများစွာ ကြာမြင့်ပြီးသည့်နောက် မီးသီးထဲရှိ မီးစာမျှင်သည် နောက်ဆုံးတွင် လောင်ကျွမ်းသွားသဖြင့် မီးလုံးသည် အလုပ်မလုပ်နိုင်တော့ပဲ ကျွမ်းသွားခြင်းဖြစ်သည်။
1578	health	အဆိပ်ဖြေဆေးအတွက် သတ်မှတ်ထားသည့် ဖြေဆေးအား အရေးပေါ်ဆေးပေါ်ရှိ အညွှန်းများအား ကြည့်၍သိနိုင်ပါသည်။
996	travel	အခြေအနေအားလုံးတွင် လေကြောင်းလိုင်းကို ဖုန်းဖြင့် တိုက်ရိုက် ကြိုတင်စာရင်းသွင်းရမည်။
197	health	သမ္မတသည် နေအိမ်မှ ရက်အတန်ကြာ သီးခြားခွဲ၍နေထိုင်မည်ဖြစ်သော်လည်းအခြေအနေမှာ တည်ငြိမ်နေသည်။
460	entertainment	အများပြည်သူများအား ကျေနှပ်နှစ်သိမ့်စေရန်အလို့ဌာ တီဗီလိုင်းများအား ပြုလုပ်ထားခြင်း ဖြစ်သည်။
154	geography	ကမ္ဘာသို့ကျလာသော ဥက္ကာခဲများ မှန်းခြေ ၂၄၀၀၀ တွင် ၃၄ခုသာ မားစ်ဂြိုဟ်မှဖြစ်သည်ကို တွေ့ရှိခဲ့ရသည်။
1160	politics	အာဏာပိုင်များက မဲပေးသူသည် မည်သူမည်ဝါဖြစ်ကြောင်း အတည်ပြုပြီးနောက် မဲပေးသူက မဲအိတ်ကို မဲပုံးအတွင်းသို့ ထည့်ပြီး မဲပေးသည့် မှတ်တမ်းစာရင်းတွင် လက်မှတ်ရေးထိုးပါသည်။
1223	entertainment	ခေါင်းဆောင်အဆိုတော် စတီဗင် တိုင်လာသည် ဩဂုတ် ၅ရက်တွင် သီဆိုနေရင်း စတိတ်ပေါ်မှ ပြုတ်ကျကာ ဒဏ်ရာရသွားသောကြောင့် နယ်လှည့်ဖျော်ဖြေရေး ခရီးစဉ်ကို ဖျက်သိမ်းခဲ့လိုက်ရသည်။
54	politics	သြစတြေးလျလူမျိုး ရတနာသိုက်ရှာဖွေသူဖြစ်ပြီး ဝန်ကြီးချုပ် ဂျွန်ဟောင်းဝက်ကို အမွေဆက်ခံနိုင်ခြေရှိသူ ပီတာ ကော့စတယ်လိုသည် လစ်ဗရယ်ပါတီခေါင်းဆောင်ဖြစ်ကာ သြစတြေးလျတွင် နျူကလီးယား စွမ်းအင် စက်ရုံနောက်ကွယ်၌ ၎င်း၏ ပံ့ပိုးမှုကို ရပ်တန့်ခဲ့သည်။
7	politics	ဝန်ကြီးချုပ်၏တရားဝင်နေထိုင်ရာနေရာဖြစ်သော ဒေါင်းနင်းလမ်းသို့ဝင်ပေါက်တွင် ရဲများစောင့်ကြပ်နေသောနေရာနှင့် ဆန့်ကျင်ဘက်ရှိ Whitehall ၌ ဒေသတွင်းအချိန် ၁၁:၀၀ ဝန်းကျင် (UTC+၁) ခန့်က ဆန္ဒပြပွဲ စတင်ဖြစ်ပွားခဲ့ပါသည်။
1010	sports	USA ကိုယ်ကာယဆိုင်ရာ လေ့ကျင့်မှုများသည် အမေရိကန်ပြည်ထောင်စု အိုလစ်ပစ်ကော်မတီ၏စာလွှာကို အားပေးထောက်ခံခြင်းဖြစ်ပြီး အားကစားသမားအားလုံးအတွက် ဘေးကင်းသောပတ်ဝန်းကျင်ကို မြှင့်တင်ပေးရန် အိုလံပစ်မိသားစု၏ လိုအပ်ချက်များအား အကြွင်းမဲ့လက်ခံခြင်းဖြစ်သည်။
1174	sports	နောက်ဆုံးရမှတ်မှာ ၂၁မှတ် နှင့် ၂၀မှတ် ဖြစ်ကာ တစ်မှတ်ဖြင့အနိုင်ရခဲ့ပြီး All Blacks ၏ ကစားပွဲ ၁၅ ပွဲကို အဆုံးသတ်အနိုင်ရခဲ့သည်။
