index_id	category	text
528	sports	ခေတ်မှီ ဓားရေးပြကစားနည်းကို တက္ကသိုလ်တွင် ပညာသင်ကြားနေသည့် ကျောင်းသားများမှသည် ပရော်ဖက်ရှင်နယ်အဆင့်နှင့် အိုလံပစ်ပြိုင်ပွဲများအထိ အဆင့်အများအပြားတွင် ကစားကြသည်။
532	sports	ရိုက်ချက် သို့မဟုတ် လွှဲချက် အနည်းဆုံးဖြင့် ရိုက်သည့် ကစားသမားက ဂေါက်ရိုက်ပွဲကို အဆုံးသတ်သူက အနိုင်ရရှိမည်ဖြစ်သည်။
1643	science/technology	အသစ်တစ်ခုခု ပေါ်လာသည့်အခါ ကီးဘုတ်သည် အဘယ်သို့ဖြစ်လာမည်ကိုတစ်ယောက်သာ တွေးတောနိုင်ပါလိမ့်မည်။
868	travel	အထူးသဖြင့် သင်၏အစပိုင်းနေ့ရက်များတွင်၊ နေသားတကျဖြစ်ရန် အနောက်တိုင်းစတိုင်နှင့် အနောက်တိုင်းအရည်အသွေးရှိသည့် ဟိုတယ်များ၊ စားစရာများ၊ နှင့် ဝန်ဆောင်မှုများအတွက် ငွေသုံးစွဲရန်စဉ်းစားကြည့်ပါ။
124	entertainment	The Daily Show နှင့် The Colbert Report မပေါ်မီတွင် ဟက်နှင့် ဂျွန်ဆန်သည် သတင်းနှင့် သတင်းအစီရင်ခံမှုကို သရော်မည့် စာနယ်ဇင်းကို ဖန်တီးခဲ့ပြီး ဖန်တီးချိန်တွင် သူတို့သည် UW ၏ ၁၉၈၈ ကျောင်းသားများသာ ဖြစ်ပါသေးသည်။
1159	politics	ပြင်သစ်တွင် မဲပေးခြင်းသည် ယခင်နည်းအတိုင်း နည်းပညာနိမ့်ပါးသည်၊ မဲပေးသူများသည် အခန်းငယ်တွင် သီးခြားဝင်ပြီး ၎င်းတို့ရွေးချယ်သော မဲရှင်၏ နာမည်ရေးပြီးသာ စာရွက်ကို စာအိတ်ထဲထည့်ရသည်။
701	travel	အမေရိကန်ပြည်ထောင်စု၏ အမြဲတမ်းနေထိုင်ခွင့် လက်မှတ်ကိုင်ဆောင်ထားသည့် ကျူးဘား နိုင်ငံသားများသည် ဤလိုအပ်ချက်ကို ကင်းလွတ်ခွင့်ရရှိရန်အတွက် အီကွေဒေါနိုင်ငံ၏ ကောင်စစ်ဝန်ရုံးသို့ သွားရောက်သင့်သည်။
560	health	ခံရသူကို စစ်ဆေးရန် သင်၏ဘေးကင်းမှုကိုသေချာစေရန် မူခင်းတည်နေရာကို ဦးစွာခြုံငုံလေ့လာထားရပါမည်။
167	politics	တိုက်ခိုက်မှုသည် အိန္ဒိယနှင့် ပါကစ္စတန်အကြား ကြီးမားသောဆက်ဆံရေး တင်းမာမှုဖြစ်သွားစေခဲ့သည်။
301	politics	ရုပ်ရှင်ရိုက်ခြင်းအပြင် ဗောတီရာ ၏အောင်မြင်မှုများတွင် ၁၉၇၃ ခုနှစ်က နိုင်ငံရေးနှင့်ပတ်သက်၍ဆင်ဆာဖြတ်ခြင်းကိုဆန့်ကျင်သော အစာငတ်ခံဆန္ဒပြမှုလည်းပါဝင်ပါသည်။
40	entertainment	"""WNED Buffalo (Reading Rainbow ၏ မိခင်ဌာန) မှ ဂျွန်ဂရန့် က """"Reading Rainbow သည် ကလေးများကို စာဖတ်ရသည့်အကြောင်းရင်း၊...စာဖတ်ခြင်းကိုနှစ်သက်ခြင်းတို့အကြောင်း သင်ကြားပေးကာ — [၎င်းဖျော်ဖြေပွဲ] သည် ကလေးများကို စာအုပ်ယူကာစာဖတ်ရန် တိုက်တွန်းအားပေးပါသည်"""" ဟု ပြောကြားခဲ့ပါသည်။"""
1414	politics	ပြင်ဆင်မှု မပြုလုပ်မီ ပိုဒ်ခွဲများက ပြည်နယ်အားလုံးမှ တစ်ညီတစ်ညွတ်တည်း သဘောတူညီမှုကို လိုအပ်ပြီး ပြည်နည်များက ၎င်းတို့၏ ကိုယ်စားလှယ်များမှာ မကြာခဏ ပျက်ကွက်ခဲ့သောကြောင့် ဗဟိုအစိုးရကို အနည်းငယ်သာ ခွင့်ပြုခဲ့သည်။
1789	travel	ပြင်ဆင်ချက်များ သို့မဟုတ် တောင်းဆိုချက်များကို ခရီးသွားအေးဂျင့်ထံ အရင်ဆုံး အသိပေးရမည်ဖြစ်ပြီး ဟိုတယ်ထံသို့ တိုက်ရိုက်အသိပေးခြင်း မပြုရပါ။
754	travel	အချို့သောဟိုတယ်များတွင် ရေနွေးငွေ့သုံ းမီးရထားများ၏ ရထားလမ်းများနှင့် ပင်လယ်ကူးသင်္ဘောများ၏ ရွှေရောင်လွှမ်းသော ခေတ်ဖြစ်သည့် ၁၉th ရာစု သို့မဟုတ် ၂၀th ရာစုအစောပိုင်းရှိ ဒုတိယကမ္ဘာစစ်မတိုင်မီအချိန်မှ အမွေအနှစ်များရှိသည်။
1142	politics	နမီးဘီးယား သမ္မတဆိုင်ရာနှင့် ပါလီမန် ရွေးကောက်ပွဲများမှ နောက်ဆုံးရလဒ်များက လက်ရှိ တာဝန်ထမ်းဆောင်ဆဲ သမ္မတ ဟီဖီကီပွန်ရေး ပိုဟမ်ဘာအား မဲအပြတ်အသတ်ဖြင့် ပြန်လည်အရွေးခံခဲ့ရသည်ဟု ဖော်ပြခဲ့သည်။
1022	politics	ထရန့်နှင့် တူရကီသမ္မတ ရီကပ်တေရစ်ပ်အာဒိုဂန် တို့ ဖုန်းဖြင့်စကားပြောပြီးနောက်တွင် ကြေညာချက်ထုတ်ခဲ့ပါသည်။
538	travel	ကမ္ဘာလှည့်ခရီးသွားများသည် သီးခြားနိုင်ငံတစ်နိုင်ငံ၏ မတူညီသော ထင်ရှားသည့်နေရာများသို့ သွားရောက်လည်ပတ်ကြပါသည် သို့မဟုတ် ၎င်းတို့သည် နေရာ တစ် ခုတည်းကိုသာအာရုံစိုက်ကာ သွားရောက်ကြပါသည်။
155	geography	ဤကျောက်တုံးများ၏ ဆယ့်ငါးခုမြောက် ကျောက်တုံးမှာ လွန်ခဲ့သော ဇူလိုင်လ၏ ဥက္ကာခဲကျဆင်းမှု ပါဝင်ခဲ့သည်။
1278	health	ကားဝင်တိုက်ချိန်တွင် လူသုံးဦး အိမ်ထဲမှာ ရှိနေသော်လည်း တစ်ဦးမှ ဒဏ်ရာမရခဲ့ပါ။
1197	sports	၎င်းတို့သည် နယ်သာလန် တွင်ပါဝင်ကာ၊ အန်နဂျိုချမ်စန် သည် မနေ့က Super-G ရှိ မတ်တပ်ရပ်နှင်းလျှောစီးခြင်းအတန်းတွင် နံပါတ်ကိုးနေရာ၌ အဆုံးသတ်ခဲ့ပြီး၊ ထိုပြိုင်ပွဲတွင်ပင် ဖင်လန် မှ ကတ်ဂျစရီနန် သည် နံပါတ်တစ်ဆယ်နေရာ၌ အဆုံးသတ်ခဲ့ပါသည်။
1541	politics	ဂျာမနီသည် ဒုတိယ ကမ္ဘာစစ်တွင် ဘုံရန်သူဖြစ်ပြီး USSR နှင့် USA တို့ကြားတွင် ပူးပေါင်းဆောင်ရွက်မှုပြုရန်အတွက် ဦးတည်စေခဲ့ပါသည်။ စစ်ပွဲအပြီးတွင်၊ စနစ်၊ လုပ်ငန်းစဉ်နှင့် ယဉ်ကျေးမှုများနှင့်ပတ်သက်၍ ပဋိပက္ခဖြစ်မှုသည် နိုင်ငံများကို ပြိုလဲသွားစေခဲ့သည်။
1111	health	ဖြစ်ပွားမှုသည် ပြင်းထန်စွာ ထိခိုက်ခံစားနေရသည့် နေရာများတွင် ဝက်ဖမ်းသည့်တုတ်တံများကို လက်တွေ့အသုံးချခြင်း၊ ခြင်ဇကာနှင့် ပိုးသတ်ဆေး ထောင်ပေါင်းများစွာကို ဖြန့်ဝေခြင်းကဲ့သို့သော လုပ်ဆောင်မှုများကို လက်ခံဆောင်ရွက်ရန် အိန္ဒိယအစိုးရကို တိုက်တွန်းနှိုးဆော်လိုက်ပါသည်။
889	geography	အန္တာတိကကုန်းတွင်းပိုင်းသည် ရေခဲ ၂-၃ km ဖုံးလွှမ်းနေသော လူသူကင်းမဲ့သည့်ကုန်းပြင်မြင့်ဖြစ်ပါသည်။
324	geography	မိုင်ယာမီမြို့၊ ဖလော်ရီဒါပြည်နယ်မှ မိုင် ၃၀၀၀ ခန့်နီးပါးတွင်ရှိသော မုန်တိုင်းသည် တစ်နာရီလျှင် အများဆုံးမိုင် ၄၀ နှုန်း (၆၄ကီလိုမီတာ) ရှိသည့် လေတိုက်ခတ်နှုန်းဖြင့် ဆက်လက်တည်ရှိနေသည်။
118	entertainment	Six Days in Fallujah ဂိမ်းကို ထုတ်မည်မဟုတ်ကြောင်း ဂိမ်းတည်ထွင်သူ ကိုနာမီမှ ဂျပန်သတင်းစာတွင် ပြောထားသည်။
1018	entertainment	ဂိုစလင်းနှင့် စတုန်းတို့သည် အကောင်းဆုံး အမျိုးသားနှင့် အမျိုးသမီး ဇာတ်ဆောင်ဆုများအတွက် ဆန်ခါတင် စာရင်းတင်သွင်းခြင်းကို အသီးသီးရရှိခဲ့ကြသည်။
523	health	ဤသည်မှာ မိနစ် ၂၀ သို့မဟုတ် မိနစ် ၃၀ ပြည့်တိုင်း အိပ်ရာမှ နှိုးရမည်ဖြစ်ပြီးတီဗီကြည့်ရသကဲ့သို့ မောဟိုက်စရာကောင်းသည်။
1637	science/technology	သင်သည် ကာဗွန်ကဲ့သို့သော သတ္တုမဟုတ်သည့်အရာ ပမာဏအနည်းငယ်ပါဝင်သောအလွိုင်းများကိုလည်း ရယူနိုင်ပါသည်။
749	travel	ကိုယ့်ကားပေါ်ကိုယ်တက်ကာ ခရီးရှည်တစ်ခုကို မောင်းနှင်ထွက်ခွာခြင်းကလည်း ရိုးရှင်းတဲ့ စိတ်ကျေနပ်စရာ တစ်ခုဘဲ ဖြစ်ပါတယ်။
1575	science/technology	ဒွိစုံကိန်းတစ်ခုတွင် ၀ သို့မဟုတ် ၁ တို့ကဲ့သို့သော တန်ဖိုးတစ်ခု သို့မဟုတ် နှစ်ခုသာ ရှိနိုင်ပြီး ထိုနံပါတ်များသည် ကွန်ပြူတာ ဂျာဂွန်ကိုအသုံးပြုရန်အတွက် ဒွိစုံကိန်းစနစ်တွင် သုံးသည့်ဂဏန်းများ - သို့မဟုတ် ဘစ်များကို ရည်ညွှန်းခြင်းဖြစ်ပါသည်။
524	health	သင့်ဦးနှောက်က တစ်ညလျှင် ရှင်းလင်းပြတ်သားစွာ အိပ်မက်မက်ရန် ကြိုးပမ်းသည့် အကြိမ်ရေအတွက် အပေါ် အာနိသင်က မူတည်ပါသည်။
358	science/technology	"""သူတို့သည် """"ဖိုတွန်""""ဟုခေါ်သည့် အလင်းမှုန်မွှားလေးတစ်ခုကို ထုတ်လွှတ်ခြင်းဖြင့် ပြုလုပ်သည်။"""
999	health	သူသည် အခြားကျွမ်းကျင်သူများ ကဲ့သို့ပင် ဆီးချိုမှာ ကုသနိုင်ခြင်း ရှိမရှိနှင့် ပတ်သက်၍ သံသယရှိနေပြီး ဤတွေ့ရှိချက်များသည် အဆင့် ၁ ဆီးချိုရှိသူများနှင့် မသက်ဆိုင်ကြောင်းကို သတိပြုမိသည်။
1359	science/technology	ခြင်္သေ့များသည် ခြင်္သေ့အုပ်များဟုခေါ်ဆိုသည့် အုပ်စုကြီးများနှင့် နေထိုင်သည့် စုဝေးနေထိုင်မှုအများဆုံးသော ကြောင်မျိုးနွယ်ဝင်များဖြစ်ပေသည်။
311	entertainment	၎င်းတို့လင်မယားသည် လွန်ခဲ့သောတစ်နှစ်က Texas တွင် လက်ထပ်ခဲ့ကြပြီး မိတ်ဆွေများ၊ ဆွေမျိုးများနှင့်အတူ အခမ်းအနားကျင်းပရန် Buffalo သို့ရောက်လာခဲ့ပါသည်။
1917	entertainment	ဖင်လန်တွင် လူ ခုနစ်ဦး သို့မဟုတ် ရှစ်ဦးပါသောလှေဖြင့် လှေစီးခြင်းမှာ ဝါသနာကြောင့်လုပ်ကိုင်သောအလုပ်တစ်ခုဖြစ်ပါသည်။
1771	geography	(မြောက်ပိုင်းဆိပ်ကမ်းခရိုင်ရှိ) မြောက်ပိုင်းကမ်းခြေမှ ပင်လယ်ကမ်းခြေများသည် ပစိဖိတ်သမုဒ္ဒရာတွင်တည်ရှိကာ မြောက်ပိုင်းရှိ Long Bay မှသည် တောင်ပိုင်းရှိ Devonport အထိ ဖြန့်ကျက်တည်ရှိပါသည်။
361	science/technology	ဖိုတွန်များသည် အက်တမ်များဖြင့် ပြုလုပ်ထားသော အရာထက် ပိုမိုသေးငယ်သည်။
196	health	အရီယက်က အပျော့စားဗိုင်းရပ်စ်ကူးစက်မှုရှိနေကြောင်း စစ်ဆေးတွေ့ရှိခဲ့သည်ဟု သမ္မတရုံးဝန်ကြီး ရိုဂရီဂို အရီယက်က ပြောဆိုခဲ့သည်။
951	travel	သင်သည် သင်ပုံမှန်စီးနင်းသောလေကြောင်းလိုင်းကိုသာ စီးနှင်ရန် ဂရုတစိုက်ဖြင့် ရွေးချယ်သင့်ပါသည်။
878	health	ရောဂါကူးစက်ထားသူ၏ အနီးဝန်းကျင်တွင် နေရုံဖြင့် အလွယ်တကူ ကူးစက်သည့် ရောဂါကို ကူးစက်တတ်သော ရောဂါဟု ခေါ်ပါသည်။
214	sports	ဂေါက်ရိုက်ခြင်းနှင့် ရက်ဘီဘောလုံး ကစားခြင်းတို့ကို အိုလံပစ်အားကစားပွဲများတွင် ပြန်လည်ထည့်သွင်းရန် သတ်မှတ်ထားပါသည်။
509	health	"""၎င်းသည် သင်ယူလေ့လာခြင်းဆိုင်ရာ မသန်စွမ်းမှုမဟုတ်ဘဲ သင်ယူလေ့လာခြင်းဆိုင်ရာ ကစဉ့်ကလျားဖြစ်မှု ဖြစ်ပါသည်။ """"အမေရိကန် ကလေးအားလုံး၏ ၃ ရာခိုင်နှုန်းမှ ၅ ရာခိုင်နှုန်းအထိ၊ ကလေးငယ်ပေါင်း ၂ မီလျံ လောက်များများ ထိခိုက်စေနိုင်ပါသည်""""။"""
332	entertainment	အခမ်းအနားများကို ကမ္ဘာ့နာမည်ကြီးအုပ်စု Cirque du Soleil ၏ အထူးဖျော်ဖြေတင်ဆက်မှုနှင့် စတင်ခဲ့သည်။
835	travel	အခြားအခြေအနေများတွင် ခရီးသွားများအတွက်နေရာထိုင်ခင်းများ၏ ပြင်ပ၌ တည်းခိုနေထိုင်သူများကသာ မှတ်ပုံတင်ရန် လိုအပ်ပါသည်။ သို့ရာတွင် ဤသို့ပြုလုပ်ခြင်းက တရားဥပဒေကို ပို၍ ရေရာသေချာမှုမရှိဖြစ်စေသဖြင့် ကြိုတင်၍ ရှာဖွေရမည်ဖြစ်သည်။
298	politics	ဒုတိယမြောက် စာကြောင်းကို အိမ်ဖြူတော် ကိုယ်စားလှယ်များက အရင်ဆုံး ဖျက်လိုက်ပြီး အထက်လွှတ်တော်က တနင်္လာနေ့တွင် အလားတူပုံစံကို ခွင့်ပြု ပေးခဲ့ပြီးချိန်တွင် ဤဥပဒေပြဠာန်းရေး၌ ပြောင်းလဲမှုဖြစ်ပေါ်ခဲ့သည်။
392	politics	ပြင်သစ်တို့နှင့် တိုက်သည့် တိုက်ပွဲအား အောင်နိုင်ပြီးနောက်၊ ဂျာမနီသည် ဗြိတိန်၏ကျွန်းစုကို စီးနင်းဝင်ရောက်ရန် အသင့်ပြင်လာခဲ့ပါသည်။
1211	entertainment	၁၉၈၉ တွင် ဘရွတ်နှင့် ဂရိုးနင်းတို့နှင့်အတူ The Simpsons ကို ဖန်တီးခဲ့ပြီး အစီအစဉ်၏ ပထမဆုံး စာရေးသူအဖွဲ့ကို ငှားရမ်းခြင်းအတွက် တာဝန်ယူခဲ့သည်။
204	travel	Twin Otter သည် PNG လေကြောင်းခရီးစဉ် CG၄၆၈၄ ကဲ့သို့ပင် ယမန်နေ့က Kokoda ၌ဆင်းသက်ရန် ကြိုးစားခဲ့သော်လည်း၊ ၎င်းကို ဖျက်သိမ်းလိုက်ပါသည်။
916	science/technology	ဘာသာပြန်ဆိုရေးအင်ဂျင်များသည် တဖြည်းဖြည်းတိုးတက်လာပြီး၊ ယခုအခါတွင် ပို၍မှန်ကန်သော သို့မဟုတ် သိပ်မမှန်သော ဘာသာပြန်ဆိုမှုများပေးစွမ်းသော်လည်း (ဗလုံးဗထွေးဘာသာပြန်ဆိုမှုများကို သိပ်မတွေ့ရတော့သော်လည်း)၊ မှားယွင်းဘာသာပြန်ဆိုမှုများဖြစ်သွားနေနိုင်ဆဲဖြစ်သောကြောင့် ဂရုစိုက်မှုအချို့ကို လုပ်ဆောင်ရမည်ဖြစ်ပါသည်။
535	entertainment	ဤသည်မှာ လူများအနေဖြင့် ၎င်းတို့၏ပုံမှန်နေ့စဉ်ဘဝနှင့်မတူကွဲပြားသောနေရာသို့သွားကာ အပန်းဖြေအနားယူ၍ ပျော်စရာရှာကြသောအချိန်ဖြစ်ပါသည်။
658	health	နွေရာသီအတွင်းတွင် နောဒစ်ခြင်များကို သတိထားပါ။ ရောဂါကူးစက်စေခြင်း မရှိသော်လည်း ၎င်းတို့က ယားယံစေနိုင်ပါသည်။
353	science/technology	ရေမော်လီကျူးများက ရေမျက်နှာပြင်ပေါ်တွင် မျက်စိဖြင့် မမြင်တွေ့နိုင်သော အလွှာကိုဖြစ်ပေါ်စေပြီး အပ်ကဲ့သို့အရာများကို ပေါလောပေါ်စေသည်။
1520	health	အိုလီဗာစက်စ်က သူ၏ သမ္မတမိန့်ခွန်းကို ဦးနှောက်ပျက်စီးမှုကြောင့် မိန့်ခွန်းကို နားလည်သဘောမပေါက်သည့် ပြည်သူများရှိသော်လည်း အမှန်တရားကိုမူ အကဲဖြတ်နိုင်သည်ကို ဖော်ပြခဲ့သည်။
1331	politics	သူသည် ၂၀၁၆ ခုနှစ်တွင် သမ္မတအဖြစ် ရွေးချယ်ခံရရန် အတွက် ထင်ကြေးပေးခြင်း ခံရပါသည်။
295	health	ရဟတ်ယာဉ်များသည် လိုက်ပါလာသူအဖွဲ့ဝင် ဆယ့်နှစ်ဦးကို ကယ်ဆယ်နိုင်ခဲ့ပြီး ဒဏ်ရာမှာ နှာခေါင်းကျိုးခြင်း တစ်ခုသာဖြစ်သည်။
569	science/technology	လူဦးရေဆိုသည်မှာမှာ သက်ဆိုင်ရာ ပထဝီဝင် ဧရိယာအတွင်းရှိ သက်ရှိ မျိုးစိတ်များကို စုပေါင်းခြင်း ဖြစ်သည်။
926	science/technology	ဒရုန်းအသုံးပြုပါက သင်ရိုက်ကူးခွင့်ရှိသည့် အရာများနှင့် ထပ်ဆောင်း ခွင့်ပြုချက် လိုအပ်ချက်များကို ကြိုတင်စစ်ဆေးပါ။
854	travel	မက်တရိုပလက်စ် သည် ပိုမို သက်တောင့်သက်သာရှိပြီး လူပိုနည်းကာအနည်းငယ် စျေးများသော်လည်း ဥရောပရှိ ပုံမှန်မက်ထရိုလက်မှတ်များထက် စျေးချိုနေဆဲဖြစ်ပါသည်။
225	science/technology	အမှောင်စွမ်းအားသည် စကြာဝဠာကြီးပေါ်သို့ အဆက်မပြတ်သက်ရောက်နေသော လုံးဝမမြင်နိုင်သည့်အင်အားဖြစ်ပါသည်။
