index_id	category	text
1297	politics	ကော်မရှင်သည် အောက်တိုဘာလတွင်စတင်ခဲ့သော အုပ်ချုပ်မှုကိုဆန့်ကျင်သည့် ဆန္ဒပြပွဲများပျံ့နှံ့လာမှုအပေါ် မာတယ်လီ၏ တုန့်ပြန်ချက်ဖြစ်သည်။
1048	politics	အီရတ်ရှိ ဂိုဏ်းဂဏဆိုင်ရာ ပဋိပက္ခ၊ ကြီးထွားလာသော အကြမ်းဖက်မှု သို့မဟုတ် ပရမ်းပတာဖြစ်မှုသို့ ဦးတည်သည့်အခြေအနေများကို ရပ်တန်ရန် ယခုအချိန်တွင် မည်သည့်လုပ်ဆောင်ချက်ကမျှ ဆောင်ရွက်ပေးနိုင်မည်မဟုတ်ကြောင်းကို ၎င်းက သတိပေးပါသည်။
547	politics	လူပေါင်း ၂၄၀၀ ခန့်ပါသည့် ပင်မတိုက်ခိုက်ရေးအဖွဲ့သည် ထရီတွန်မှ မြောက်ဘက် ၉ မိုင်ခန့်အကွာမှ မြစ်ကိုဖြတ်၍၊ အာရုဏ်မတက်မီ တိုက်ခိုက်မှုပြုလုပ်ရန် အဖွဲ့ ၂ ဖွဲ့အဖြစ်  တစ် ဖွဲ့သည် ဂရင်းနှီး နှင့် တစ် ဖွဲ့သည် ဆူလီဗန် ဟူ၍ ခွဲလိုက်သည်။
1127	health	အမျိုးသမီးများအား ၎င်းတို့၏ ကျန်းမာရေးနှင့် ပတ်သက်၍ ကျယ်ကျယ်လောင်လောင်ပြောဆိုခြင်းဖြင့် အမျိုးသမီးများအား လွှမ်းမိုးရန် အချို့သူများ၏ ကြိုးစားမှုများက မအောင်မြင်ခဲ့ကြောင်း Fluke က ရေးသားခဲ့သည်။
120	entertainment	ACMA သည် အင်တာနက်တွင်ထုတ်လွှင့်နေသောဗီဒီယိုမှလွဲ၍ Big Brother ၏ဝဘ်ဆိုက်ပေါ်တွင် မီဒီယာကို သိမ်းဆည်းမထားသောကြောင့် Big Brother သည် အွန်လိုင်းအကြောင်းအရာဆင်ဆာဖြတ်ခြင်းဥပဒေကို ချိုးဖောက်ခြင်းမပြုခဲ့ကြောင်းကိုလည်း တွေ့ရှိခဲ့ပါသည်။
1113	health	မှတ်တမ်းအရ သက်ရောက်မှု အများဆုံးခံရသည့်နေရာများသို့ ပို့ဆောင်ရန်ရှိသည့် ကာကွယ်ဆေးများအတွက် အစီအစဉ်များကို ရန်ပုံငွေနည်းပါးခြင်းနှင့် အခြားရောဂါများကြောင့် ဦးစားပေးလုပ်ဆောင်မှု နည်းပါးခြင်းကြောင့် အချိန်ဆိုင်းထားခဲ့သည်။
1442	politics	ဤဗျူဟာအတွက် တုန့်ပြန်မှုမှာ အကန့်အသတ်ရှိသဖြင့် ဂျာမဏီသည် ၎င်း၏ ကန့်သတ်ချက်မဲ့သော ရေငုပ်သင်္ဘောစစ်ဆင်ရေးမှ အလားတူတုန့်ပြန်မှုကို မျှော်လင့်ခဲ့သည်။
830	travel	နယ်စပ်ဖြတ်ကျော်ဂိတ်အချို့တွင် ရထား စစ်ဆေးမှုများကို မောင်းနှင်နေရင်းပင် စစ်ဆေးသောကြောင်း ယင်းရထားများ စီးနင်းနေချိန်တွင် စီးနင်းခွင့်ကတ်ကို သင့် ID နှင့်အတူ ကိုင်ထားရမည်။
1824	travel	အခွန်အများအပြား ထမ်းဆောင်ရသော နိုင်ငံများသို့ ခရီးသွားရောက်လိုကြသော ခရီးသွားများသည် အထူးသဖြင့် အရက်ပါဝင်သော အဖျော်ယမကာများနှင့် ဆေးရွက်ကြီးကဲ့သို့ ထုတ်ကုန်ပစ္စည်းများအတွက် တစ်ခါတစ်ရံတွင် အတော်အတန်များပြားသော ငွေပမာဏကို ချွေတာနိုင်ကြသည်။
1533	health	အခြား စိတ်ခံစားမှု အတက်အကျအလိုက် ရွေးချယ်မှုများတွင် မအိပ်မီ အရည်များစွာ (အထူးသဖြင့် ရေ သို့မဟုတ် လက်ဖက်ရည်၊ ဆီးရွှင်စေသည်ဟု သိကြသည့်) သောက်ခြင်း ပါဝင်ပြီး ယင်းက ဆီးသွားရန် အိပ်ယာထဖို့ လိုလာစေပါသည်။
1982	entertainment	ဟနာမီ ဟုသိရှိကြသော ချယ်ရီပန်းများကို ကြည့်ခြင်းသည် ၈ ရာစုကတည်းက ဂျပန်လူမျိုးတို့၏ယဉ်ကျေးမှုအစဉ်အလာ၏ တစ်စိတ်တစ်ပိုင်းဖြစ်လာခဲ့ပါသည်။
657	health	နွေရာသီ၏ အလွန်ရှည်လျားသောနေ့ရက်များသည် လုံလောက်သောအိပ်စက်မှုရရှိခြင်းပြဿနာများနှင့် ဆက်စပ်နေသည့်ကျန်းမာရေးပြဿနာများထံ ဦးတည်စေနိုင်ပါသည်။
948	travel	လှေဆိပ်သို့ရောက်ရှိသည်နှင့် အရာအားလုံးမှာ သိသာလာလိမ့်မည်ဖြစ်ကြောင်း သေချာပါစေ။ သင်သည် အခြားသော လှေလမ်းကြုံလိုက်သူများနှင့် တွေ့ဆုံကာ ၎င်းတို့က ၎င်းတို့၏အချက်အလက်များကို သင်နှင့်အတူမျှဝေပါလိမ့်မည်။
1892	travel	ပြည်ပတွင် နေထိုင်ပြီး၍ မိခင်နိုင်ငံသို့ ပြန်သည့်အခါ သင်သည် ယဉ်ကျေးမှုအသစ်ကို လက်ခံကျင့်သုံးပြီးဖြစ်၍ သင့်မိခင်နိုင်ငံ၏ ယဉ်ကျေးမှုမှ သင့်အလေ့အထများအနက် အချို့အဝက်ကို ဆုံးရှုံးသွားခဲ့ပြီဖြစ်သည်။
1707	travel	ကက်စစ်စာဘဲလန့်စ် သည် မော်ရိုကိုနိုင်ငံတွင် စျေးဝယ်ထွက်ရန် စိတ်ဝင်စားမှု အနည်းဆုံးနေရာများအနက်မှ တစ်နေရာဖြစ်ပါသည်။
1729	geography	ဆန်ဒါဘန်းများသည် ကမ္ဘာပေါ်တွင် အကြီးမားဆုံးသော ပင်လယ်ကမ်းခြေအနီး လမုပင်ကြိုးဝိုင်းဖြစ်ပြီး ကမ်းရိုးတန်းမှ ဘင်္လားဒေ့ရှ်နှင့် အိန္ဒိယသို့ ၈၀ ကီလိုမီတာ (၅၀ မိုင်) အထိ ရှည်လားပါသည်။
1574	science/technology	ယနေ့အသုံးပြုလျက်ရှိသည့် ကွန်ပျူတာအားလုံးနီးပါးသည် ဘိုင်နရီစနစ်ကိန်းများပုံစံဖြင့် ကုဒ်ပြုလုပ်ထားသည့် အချက်အလက်များအား ကျွမ်းကျင်ပိုင်နိုင်စွာ ခြယ်လှယ်လုပ်ဆောင်မှုကို အခြေခံထားသည်။
692	travel	ဘုရားကျောင်းကို ဝင်ရောက်ရန်အတွက် အန်ကာ ဖြတ်သန်းခွင့်ကို လိုအပ်သဖြင့် တုန်လေဆပ်အရပ်သို့ ဦးတည်သည့်အခါ သင့်နိုင်ငံကူးလက်မှတ် ယူဆောင်လာရန် မမေ့ပါနှင့်။
1155	geography	"""""""ညီအစ်မခုနှစ်ဖော်"""" ဟု အမည်ရသည့် ဂူဝင်ပေါက်အားလုံးမှာ အချင်းအားဖြင့် မီတာ ၁၀၀ မှ ၂၅၀ အထိ (ပေ ၃၂၈ မှ ၈၂၀ အထိ) ရှည်လျားသည်။"""
1810	sports	ပြိုင်ပွဲများကို ၁၉၆၄ ခုနှစ် တွင် ကျင်းပခဲ့၍ တိုကျိုသည် နွေရာသီအိုလံပစ် နှစ် ကြိမ်ကျင်းပခဲ့သည့် တစ်ခုတည်းသော အာရှမြို့ဖြစ်သည်။
64	politics	မူလ ငွေတောင်းခံလွှာကို ဆော်ပေါ်လို၏ မြို့တော်ဝန် မာတာစပ်လီစီ က ရေးဆွဲခဲ့သည်။ အဆိုပြု ဥပဒေပြဋ္ဌာန်းမှုမှာ ပြင်ဆင်ပြီးနောက် ယခုအခါ ရောဘတ်တရိုဂျက်ဖာစန် ၏ လက်ထဲတွင် ရှိနေပါသည်။
1330	politics	"""သူသည် ကောလဟာလများကို """"နိုင်ငံရေးလေပန်းမှုနှင့် မိုက်မဲမှုများ"""" အဖြစ် ရည်ညွှန်းခဲ့ပါသည်။"""
1448	politics	မင်းဆက်တစ်ဆက်နှင့် တစ်ဆက်ကြား ခွဲခြားထားသော စီရင်စုများနှင့် ခေတ်မတည်ငြိမ်ခဲ့ပါ။ ဤကာလများအတွင် လူသိအများဆုံးမှာ ဟန်နှင့် ဂျင် မင်းဆက်ကြား နှစ် ၆၀ အထိ နေရာယူခဲ့သည့် ဘုရင်အုပ်ချုပ်သော တိုင်းပြည် ခေတ်သုံးဆက် ဖြစ်သည်။
636	science/technology	၁၉၇၀ ခုနှစ်တွင် ဆရာဝန်တဖြစ်လဲ စူးစမ်းလေ့လာရေးသိပ္ပံပညာရှင်ဖြစ်သူ ရေမွန် ဒါမာဒီးယန်း သည် သံလိုက်စက်ကွင်း ပဲ့တင်သံ ပုံရိပ်ဖော်သည့် စက်ကို ဆေးဘက်ဆိုင်ရာ ရောဂါခွဲခြားစစ်ဆေးခြင်းအတွက် ကိရိယာတစ်ခုအဖြစ် အသုံးပြုခြင်းအတွက် အခြေခံကျသည့်အရာကို စူးစမ်းတွေ့ရှိခဲ့ပါသည်။
1677	science/technology	နမူနာများတွင် ထိန်းချုပ်မှု၊ အစီအစဉ်ရေးဆွဲခြင်းနှင့် အချိန်ဇယားချမှတ်ခြင်း၊ စားသုံးသူ ချွတ်ယွင်းချက်ရှာဖွေမှုများနှင့် မေးခွန်းများကို ဖြေကြားနိုင်စွမ်းရှိခြင်းတို့သာမက လက်ရေးလက်သား၊ အသံနှင့် မျက်နှာအား မှတ်မိသိရှိနိုင်ခြင်းတို့ ပါဝင်သည်။
1398	entertainment	သင်သည် နိုင်ငံတော် ရတနာ ဟူသောဇာတ်ကားကို ကြည့်ဖူးပါက လွတ်လပ်ရေး ကြေညာစာ၏ ကျောဘက်တွင် ရတနာသိုက်မြေပုံကို ရေးဆွဲထားသည်ဟု ထင်မိနိုင်ပါသည်။
1605	travel	ယနေ့ခတ် ပြောင်းလဲနေသော ပို့ဆောင်ရေး ယာဉ်တွင် လူတိုင်းက တစ်နည်းတစ်ဖုံဖြင့် ချိတ်ဆက်နေပြီး ကိုယ်ပိုင်ကားအပေါ် အခြေခံသည့် ပို့ဆောင်ရေးစနစ်ကို ပံ့ပိုးပေးလျက်ရှိပါသည်။
982	travel	သင်သည် အပူလျော့ပိုင်းဒေသရှိ မိုးသစ်တောကို ဖြတ်၍ ယာဉ်မောင်းနှင်နေလျှင်တောင်မှ သင်၏ယာဉ်အတွင်းသို့ ဝင်ရောက်စဉ် တံခါးဖွင့်လိုက်သည့် စက္ကန့်အနည်းငယ်အတွင်း သင်၏ယာဉ်အတွင်းသို့ ခြင်များဝင်ရောက်ရန် လုံလောက်အချိန် ဖြစ်ပါသည်။
366	science/technology	သွေးလှည့်ပတ်မှုစနစ်၏ အဓိက အကျဆုံးသော အင်္ဂါအစိတ်အပိုင်းမှာ နှလုံးဖြစ်ပြီး သွေးများကို ပန်းထုတ်ပေးသည်။
1651	science/technology	အကြောင်းအရာ သီအိုရီများသည် လူများကို ယုံကြည်စေသည့်အရာ သို့မဟုတ် ၎င်းတို့ကို စိတ်ဝင်စားစေသည့် အရာကို ရှာဖွေခြင်းအပေါ် ဗဟိုပြုထားပါသည်။
941	science/technology	ဝဘ်ပေါ်တွင် ပုံစံချခြင်း၊ စာပြင်ခြင်းကို အဆင်ပြေလာပြီးနောက်တွင် သင်သည် ကိုယ်ပိုင် ဝက်ဘ်ဆိုက်ကို ဖန်တီးလာနိုင်မည်ဖြစ်သည်။
876	health	ဆေးကုသမှုဆိုင်ရာ ဗန်းစကားနှင့် ရင်းနှီးအကျွမ်းတဝင်မရှိသောသူများအတွက် ကူးစက်တတ်သော နှင့် ထိတွေ့ကူးစက်နိုင်သော စကားလုံးများတွင် ထူးခြားသည့် အနက်အဓိပ္ပာယ်များရှိသည်။
661	entertainment	ဂီတ၊ ရုပ်ရှင်၊ စာပေနှင့် ကျော်ကြားသောယဉ်ကျေးမှုတို့၌ ၎င်း၏ ပုံမှန်ပြသမှုသည် မြို့နှင့် မြို့၏နာမည်ကျော်နေရာများကို ကမ္ဘာတစ်ဝှမ်းတွင်သိရှိသွားအောင်လုပ်ရာတွင် အကူအညီဖြစ်စေခဲ့ပါသည်။
1112	health	ဦးနှောက်ရောင်ရောဂါ ကာကွယ်ဆေးဘူး သန်းပေါင်းများစွာကို အစိုးရက ထုတ်ပေးသွားဖြစ်မည်၍ လာမည့်နှစ်အတွက် ကျန်းမာရေးအေဂျင်စီများစွာကို အကူအညီဖြစ်စေပါမည်။
1329	politics	ကူအိုမို၊ ၅၃၊ သည် ယခုနှစ်အစောပိုင်းတွင် ၎င်း၏ ပြည်နယ်အုပ်ချုပ်ရေးမှူးအလုပ်ကိုစတင်ခဲ့ကာ လိင်တူလက်ထပ်ခြင်းကိုတရားဝင်ဖြစ်စေသည့်စာတမ်းအား လွန်ခဲ့သည့်လက လက်မှတ်ရေးထိုးပေးခဲ့ပါသည်။
1053	politics	မစ္စစ်ကစ်ချ်နာသည် အာဂျင်တီးန်ပြဇာတ်ရုံတွင် ၎င်း၏ သမ္မတအရွေးခံရန် ရည်ရွယ်ချက်ကို ပြသခဲ့ပြီး ဆီးနိတ်အတွက် ဗျူနိုအိုင်းစ်ခရိုင်တာဝန်အဖွဲ့ဝင်အဖြစ် ၂၀၀၅ ကမ်းပိန်းတွင် ပြောဆိုခဲ့သော နေရာပင်ဖြစ်သည်။
1948	travel	သင်သည် လူအများအပြားမြှုပ်နှံရာနေရာသို့သာမက ကမ္ဘာလူဦးရေ၏ သိသာထင်ရှားသောပမာဏဟုဆိုနိုင်သည့် တွက်ချက်၍မရနိုင်လောက်သောပမာဏရှိသည့်နေရာထံသို့လည်း သွားရောက်နေလျှက်ရှိသည်ကို သိထားပေးပါ။
923	science/technology	ဝန်ဆောင်ခပေးရန် မလိုအပ်ဘဲ ဖုန်းအများစုမှ ခေါ်ဆိုနိုင်သည့် ခေါ်ဆိုသူအခမဲ့ ဖုန်းနံပါတ်မှတဆင့် ဤဝန်ဆောင်မှုများကို ရယူနိုင်ပါသည်။
173	science/technology	ပင်လယ်ကြမ်းခင်း မြေပုံဆွဲပြီးနောက် အပျက်အစီးကို ROV သုံး၍ ရှာတွေ့ခဲ့သည်။
1087	science/technology	လမှကမ္ဘာကို ဆွဲငင်သည့်အခါ ဒီရေများဖြစ်ပေါ်သကဲ့သို့ နဂါးငွေ့တန်းသည် ဆာဂျီတေးရီးယပ်စ် ဂလက်ဆီကို အားတစ်ခုသက်ရောက်သည်။
1328	science/technology	လွန်ခဲ့သောနှစ်များစွာအကြာ ကမ္ဘာကြီးနှင့် ကြယ်တံခွန်များတိုက်မိခဲ့စဉ်အချိန်ကတည်းက သိပ္ပံပညာရှင်များသည် ဂြိုလ်များဖြစ်ပေါ်လာပုံ၊ အထူးသဖြင့် ကမ္ဘာကြီးဖြစ်ပေါ်လာပုံကို နားလည်လိုကြပါသည်။
914	science/technology	အချိန်မှန်စာသားဘာသာပြန်ဆိုသူအက်ပ် - စာကြောင်းတစ်ကြောင်းလုံးကို ဘာသာစကားတစ်ခုမှ အခြားဘာသာစကားတစ်ခုသို့ အလိုအလျောက်ဘာသာပြန်ပေးနိုင်သောအက်ပလီကေးရှင်းများ။
1341	science/technology	၎င်းကို ဓာတု၏ pH ဟု ခေါ်သည်။ အနီရောင် ဂေါ်ဖီရည်ကို သုံး၍ အချက်ပြမှု ဖန်တီးနိုင်သည်။
336	entertainment	"""အဆုံးသတ်ရန်အနေဖြင့်  တူရကီအကအုပ်စု Fire of Anatolia က """"ထရိုင်"""" ဖျော်ဖြေမှုကို တင်ဆက်ကပြခဲ့သည်။"""
1005	entertainment	၂၀၁၇ ခုနှစ်နှောင်းပိုင်းတွင် စီမင်နော့ဖ်က စျေးဝယ် ရုပ်မြင်သံကြားလိုင်း QVC တွင် ပေါ်လာပါသည်။
1671	science/technology	ဦးနှောက် ရောဂါဗေဒနှင့် အမူအကျင့်ကြား ပြန်လှန်ချိတ်စက်မှုက သိပ္ပံပညာရှင်များကို ၎င်းတို့၏ သုတေသနတွင် ကူညီပံ့ပိုးပေးပါသည်။
1597	science/technology	ဟာရှေး နှင့် ချေ့ တို့သည် ၎င်းတို့၏ DNA ကို ဗက်တီးရီးယားပိုးအတွင်းသို့ ထည့်သွင်းရန် ဖေ့ဂျ်များ သို့မဟုတ် ဗိုင်းရပ်စ်များကို အသုံးပြုခဲ့ပါသည်။
1008	health	ပဋိဇီဝကောက်တေးလ် ZMapp သည် အစပိုင်းတွင် ကောင်းမွန်သလိုပြသခဲ့ပြီး နောက်ပိုင်းလေ့လာချက်များအရ  သေခြင်းတရားကိုကာကွယ်ရန် ရှာဖွေခြင်းထက်ပင် အကျိုးရှိမှုမှာပိုမိုနည်ပါးနေသည်ကို ပြသနေသည်။
1313	health	လစ်ဂင်ဆေးရုံတွင် အလုပ်လုပ်နေစဉ် သူသည် အချိန်အားတွင် လမစေ့ပဲမွေးဖွားမှုအကြောင်း စတင်စုံစမ်းခဲ့သည်။
665	travel	"""""""ပုံမှန်"""" လာရောက်မှုတွင် Orlando အပြည်ပြည်ဆိုင်ရာလေဆိပ်သို့ လေယာဉ်စီးလာကာ နေထိုင်နိုင်သော Disney ဟိုတယ်သို့ ဘတ်စ်ကားစီးသွားပြီး Disney ပိုင် နယ်မြေမှ ထွက်ခွာခြင်းမရှိဘဲ တစ်ပတ်ခန့်ကြာအောင်အချိန်ဖြုန်းကာ အိမ်သို့ပြန်ခြင်းတို့ ပါဝင်ပါသည်။"""
242	geography	အရေးကြီးသော သိပ္ပံကိရိယာ သုံးခုကို သယ်ယူခြင်းအပြင် လသို့သွားသော ယာဉ်သည် ဘက်ပေါင်းစုံတွင် ရိုက်နှိပ်ထားသော အိန္ဒိယနိုင်ငံတော်အလံပုံရိပ်ကို သယ်ဆောင်သွားခဲ့သည်။
383	politics	ဤရေတပ်သင်္ဘောအစုကိုဦးဆောင်သူမှာ  နော်ဝေနိုင်ငံသား အိုလက် ထရီဗက်ဆင် ဖြစ်ပြီး ဒိန်းမတ်နိုင်ငံ၏ အုပ်စိုးမှုမှ သူ၏နိုင်ငံအား ပြန်လည်ရယူနိုင်ရန် ရည်မှန်းချက်ရှိသူဖြစ်သည်။
954	travel	Turkishလေကြောင်းလိုင်းအနေဖြင့် အာဖရိကနိုင်ငံ ၃၀ ရှိ လေယာဉ်ခရီးစဉ် ၃၉ ခုကို ၂၀၁၄ ခုနှစ်မှစ၍ ပျံသန်းခဲ့သည်။
979	travel	ခရီးသွားသူက တံလျှပ်ကို အားကိုးသဖြင့် အဖိုးမဖြတ်နိုင်သည့် ခွန်အားနှင့် လက်ကျန်သောက်ရေများကို ဖြုန်းတီးမိပါက  အန္တရာယ်ရှိသည်။
217	sports	အောက်တိုဘာလ၌ Copenhagen တွင်ကျင်းပမည့်၎င်း၏အစည်းအဝေးတွင် မဲပေးခြင်းကို IOC တစ်ခုလုံးက အတည်ပြုလက်မှတ်ရေးထိုးရပါမည်။
1036	travel	သူ၏ခရီးစဉ်အတောအတွင်း၊ အိုင်ဝစာကီ သည် ပြဿနာများနှင့် မကြာခဏတွေ့ကြုံခဲ့ပါသည်။
