index_id	category	text
367	science/technology	သွေးများသည် သွေးလွှတ်ကြောများဟု ခေါ်သည့် သွေးကြောများဖြင့် နှလုံးမှ အဝေးသို့ စီးဆင်းပြီး သွေးပြန်ကြောဟု ခေါ်သည့် သွေးကြောများဖြင့် နှလုံးဆီသို့ ပြန်ဝင်လာသည်။ အသေးငယ်ဆုံးသောသွေးကြောကို ဆံချည်မျှင်သွေးကြောလေးများဟု ခေါ်သည်။
770	entertainment	ဘုရားကျောင်းပွဲတော်အများစုသည် ဘုရားကျောင်း နှစ်ပတ်လည်သို့မဟုတ် နတ်များမွေးနေ့ သို့မဟုတ် အခြားဘုရားကျောင်းနှင့်ပတ်သက်သော အဓိက ပွဲတော်များအဖြစ်ကျင်းပလေ့ရှိသည်။
279	politics	အနိုင်ရသူကအားလုံးရရှိမည်ဆိုသောဖော်ပြချက်ဖြင့်၊ ဖလော်ရီဒါသည် ရီပက်ဘလီကန်ပါတီ ဆန်ခါတင်ရွေးချယ်မှုအတွက် တစ်ပြေးနေသူ၏ရှေ့သို့ ရွမ်နေကို တွန်းပို့ပေးလိုက်သော ၎င်း၏ကိုယ်စားလှယ်အယောက်ငါးဆယ်လုံးကို ဆုချီးမြှင့်ခဲ့ပါသည်။
357	science/technology	၎င်းတို့၏ ယခင်စွမ်းအင်အဆင့်သို့ပြန်သွားရန်၊ ၎င်းတို့သည် အလင်းထံမှရရှိခဲ့သော ထပ်ဆောင်းစွမ်းအင်ကို ရှင်းပစ်ရပါမည်။
797	science/technology	လပ်တော့ပ် သို့မဟုတ် တက်ဘလက်ဖြင့် ခရီးသွားပါက မိတ္တူတစ်ခုကို ၎င်း၏ မမ်မိုရီ သို့မဟုတ် ဒစ်စ်အတွင်း သိမ်းဆည်းထားပါ (အင်တာနက်မရှိဘဲ အသုံးပြုနိုင်)။
211	health	ပြင်းထန်သော ဒဏ်ရာများ မရှိခဲ့သော်လည်း ပေါက်ကွဲချိန်တွင် အခင်းဖြစ်ပွားသည့်နေရာရှိ လူငါးဦးမှာ ထိတ်လန့်ခြင်းကြောင့် ကုသမှု ခံယူခဲ့ရပါသည်။
815	travel	နိုင်ငံတကာတွင်၊ အလုပ်လုပ်ဆောင်လျှက်ရှိသော ခရီးသွားအဖွဲ့အစည်းပေါင်း ၂၀၀ နီးပါးရှိပါသည်။ ၎င်းတို့အနက်အများစုမှာ လွတ်လပ်စွာဖြင့်သီးခြားလုပ်ကိုင်ကြပါသည်။
238	geography	"""ယခုအထိသိရှိထားသမျှမှာ၊ တိုင်တမ်ထက် ပို၍စွမ်းအားရှိသော ခန္ဓာကိုယ်ထုထည်ကြီးမားသည့်အရာမှာ တစ်ခုတည်းရှိပြီး ၎င်းမှာ ကမ္ဘာမြေကြီးဖြစ်သည်၊"""" ဟု စတိုဖန် က ပြောခဲ့ပါသည်။"""
1636	science/technology	ကယ်လ်စီယမ်နှင့် ပိုတက်စီယမ်တို့ကဲ့သို့သောအရာများကို သတ္တူများအဖြစ် ယူဆပါသည်။ ယူဆ၍ ရနိုင်ပါသည်။ အဘယ်ကြောင့်ဆိုသော် ၎င်းတို့သည် ငွေနှင့်ရွှေတို့ကဲ့သို့သောသတ္တုများလည်း ရှိသောကြောင့်ဖြစ်သည်။
761	travel	တစ်ခါတစ်ရံတွင် တခြား ခရီးသွားများ၏ ကိုးကားချက်များနှင့် သုံးသပ်မှုများနှင့်အတူ ပုံနှိပ်မိတ္တူ နှင့်/သို့မဟုတ် အွန်လိုင်းတွင် လက်ခံကျင်းပသူများ၏ စာရင်းကို ဖော်ပြပါသည်။
1676	science/technology	AI စူးစမ်လေ့လာမှုတွင် အသိဉာဏ်ရှိသောအပြုအမူကိုလိုအပ်သည့် လူအစားထိုး စက်အလုပ်လုပ်ဆောင်များအတွက် စက်များကိုတီးထွင်ခြင်း ပါရှိပါသည်။
848	entertainment	သြစတြေးလျတွင် ရနိုင်သည့် ထိကပြန်များသည် တကယ် ပြန်လာခြင်း မရှိပါ။ ၎င်းကစားနည်းအား ယခုမှ စတင်၍ ကစားသူများသည် လေတိုက်သောနေရာသို့ မပစ်ရန်မှာ အသင့်တော်ဆုံး ဖြစ်သည်
1089	science/technology	ဤသီအိုရီအရ ဂလက်ဆီတစ်ခု၏ အမှောင်ဆုံးအရာသည် ဂလက်ဆီတွင် အိမ်အနေဖြင့် တည်ရှိပြီး သေးငယ်သော အမှုန်များဖြင့် ဖွဲ့စည်းထားသည်။
984	health	လူတစ်ထောင်ခန့် ဖြစ်ပွားကြောင်း အစီရင်ခံထားသော်လည်း ၎င်းတို့အနက်အချို့မှာ သေစေနိုင်ပါသည်။
305	sports	အိုလံပစ် ရွှေတံဆိပ်နှစ်ဆုပိုင်ဆိုင်သူ ဂျပန်အမျိုးသား ဂျုဒိုကဟီတိုရှီစိုင်တို သည် အသက် ၅၄ နှစ်တွင် သေဆုံးခဲ့ပြီဖြစ်ပါသည်။
697	travel	ဂျေရုဆလင်တွင် သမိုင်းဝင် ရှေးဟောင်း ယဉ်ကျေးမှုဆိုင်ရာနေရာများ၊ တောက်ပထင်ရှားပြီး လူများပြားသော စျေးဝယ်စင်တာများ၊ ကော်ဖီဆိုင်များ၊ နှင့် စားသောက်ဆိုင်များ များပြားစွာရှိပါသည်။
826	travel	ယေဘုယျအားဖြင့် ၎င်းတို့သည် အမျိုးအစားနှစ်ခုအတွင်း ကျရောက်သည်- သင်ခရီးသွားစဉ်တွင် အလုပ်လုပ်ရမည် သို့မဟုတ် သင့်ကုန်ကျစရိတ်များကို လျှော့ချကန့်သတ်ရန် ကြိုးစားပါ။ ဤဆောင်းပါးကို နောက်ပိုင်းတွင် အသေးစိတ် ရေးသားထားသည်။
1672	health	ရှေးယခင်အချိန်များထဲက သိရှိခဲ့သည်မှာ ဦးနှောက်ပျက်စီးမှုအမျိုးအစားများဖြစ်သည့် ပြင်းထန်သောထိခိုက်မှု၊ ဒဏ်ရာနှင့် အကျိတ်များသည် အမူအကျင့်ကို သက်ရောက်မှုရှိပြီး စိတ်ပိုင်းဆိုင်ရာလုပ်ဆောင်ချက်များကိုပြောင်းလဲစေနိုင်သည်။
536	travel	ကမ်းခြေများ၊ ကစားကွင်းများနှင့် စခန်းချနေရာများသည် အပန်းဖြေတိုးရစ်များ အများဆုံးလည်ပတ်သော နေရာများဖြစ်သည်။
1909	science/technology	သင်၏ ဒေသန္တရ တယ်လီဖုန်း ဝန်ဆောင်မှုပေးသူသည် ဤဆက်သွယ်ရေးနှင့်ပတ်သက်၍ ပို၍ပြည့်စုံသည့်သတင်းအချက်အလက်အား ပေးနိုင်သင့်သည်။
611	science/technology	ရှုပ်ထွေးသော အန်နီမေးရှင်းများသည် ကွန်ပြူတာများတွင် တည်ဆောက်နိုင်ပြီး ထိုအန်နီမေးရှင်းအမျိုးအစားများသည် ရုပ်သံနှင့် ရုပ်ရှင်များတွင် ပိုမိုအသုံးပြုလာနေကြသည်။
157	sports	ပွဲပြီးသည့်အခါ ကီဆဲလောစကီသည် ၂၂၅၀ ပွိုင့်ဖြင့် ယာဉ်မောင်း ချန်ပီယံရှစ် အမှတ်အများဆုံး ဆက်ဖြစ်နေပါသည်။
1294	politics	မာအယ်လီ သည် မနေ့က အဖွဲ့ဝင် ကိုး ဦးပါသော ယာယီရွေးကောက်ပွဲကောက်စီ (CEP) အသစ်တွင် ကျမ်းကျိန်ခဲ့ပါသည်။
1803	travel	အခြားတစ်ဖက်တွင်လည်း ရေခဲပြီး နှင်းထူသော အခြေအနေများသည် နိုင်ငံအများစုတွင် ပုံမှန်ဖြစ်ပြီး ယာဉ်ကြောကြပ်တည်းမှုများမရှိဘဲ တစ်နှစ်ပတ်လုံး သွားလာနိုင်သည်။
359	science/technology	"""အက်တမ်များကို တောက်ပသော အလင်းရောင်က လှုံ့ဆော်သဖြင့် အလင်း၏ ဖိုတွန်ထုတ်လွှတ်မှုကို ဖြစ်စေသည့်အတွက် သိပ္ပံပညာရှင်များက ဤဖြစ်စဉ်ကို """"လှုံ့ဆော်သော ရေဒီယိုသတ္တိကြွမှုကို ထုတ်လွှတ်ခြင်း"""" ဟု ခေါ်ဆိုကြပြီး အလင်းသည်လည်း ရေဒီယိုသတ္တိကြွမှုတစ်မျိုးဖြစ်သည်။"""
302	politics	ပြင်သစ်ဥပဒေကို ပြောင်းလဲခဲ့သည်။ သူ၏ တက်ကြွလှုပ်ရှားမှုသည် ဒုတိယကမ္ဘာစစ်အတွင်း ပြင်သစ်ခုခံရေးလှုပ်ရှားမှုတွင် ပါဝင်ခဲ့သည့် အသက် ၁၅ နှစ်အရွယ်သို့ ပြန်လည်ရောက်ရှိသွားခဲ့သည်။
455	science/technology	မှန်ဘီလူး ထုတ်လုပ်မှုတွင် မှန်ဘီလူး ထုတ်လုပ်သူများက ပိုမြင့်မားသော စံနှုန်းများ ရရှိသောကြောင့် ထုတ်လုပ်မှုပြသနာပိုမိုနည်းပါးလာခြင်းဖြစ်သည်။
25	sports	အိုဗက်ကင်၏ ပထမဆုံး ပံ့ပိုးပေးမှုကြောင့် လူသစ် နီကိုလက် ဘက်စတုန်းသည် နိုင်ပွဲရဂိုးကို ယင်းညတွင် ရရှိခဲ့သည်။
1606	science/technology	ဤကြီးမားသော ကာဗွန်စီးပွားရေးလုပ်ငန်းက ဇီဝရိပ်မြုံကို လွန်ခဲ့သော နှစ်ပေါင်း နှစ်သန်းကြာမျှ လူသားဆင့်ကဲဖြစ်ထွန်းမှု  အခြေအနေများမှ ခွဲထုတ်လိုက်ကြောင်း ယခုအခါ သိပ္ပံပညာက ညွှန်ပြသည်။
79	sports	နိုဆာက အနိုင်ရသူများကို ၁၁ မှတ်ဖြင့် ချန်ခဲ့သည့် အဓိက ဆီးမီးဖိုင်နယ်တွင် နှစ် ဖက် တွေ့ဆုံရပါမည်။
952	travel	သင်အများဆုံးစီးနင်းလေ့ရှိသည့် လေကြောင်းလိုင်းကို ဆက်သွယ်ခြင်းသည် မသိစိတ်ဖြင့် အလိုလိုလုပ်ဆောင်သည့်အရာဖြစ်ကြောင်း သင်ထင်နေနိုင်သော်လည်း ပေးထားသည့် အထူးအခွင့်အရေးများသည် မကြာမကြာဆိုသလို ကွဲပြားလေ့ရှိကြောင်းနှင့် မတူညီသောလေကြောင်းလိုင်းတစ်ခုအောက်ရှိ တူညီသည့်မဟာမိတ်အဖွဲ့ရှိအခြားလေကြောင်းလိုင်းတစ်ခုတွင် ပို၍ ရက်ရောမှုရှိနိုင်သည်ကိုသတိပြုသင့်သည်။
995	travel	၎င်းတို့ကို ကမ်းလှမ်းမှုပြုလုပ်သည့် လေကြောင်းလိုင်းများတွင် အမေရိကန်ပြည်ထောင်စု သို့မဟုတ် ကနေဒါနိုင်ငံတွင် စတင်အခြေစိုက်သည့်  Air Canada၊ Delta Air Lines၊ Lufthansa နှင့် WestJet  လေကြောင်းလိုင်း တို့ပါဝင်သည်။
266	science/technology	ရုရှားမြေပြင်ထိန်းချုပ်ရေးသည် ဂျက်တိုက်လေယာဉ်များကို စေလွတ်ခဲ့ပြီး၊ ဘူတာရုံ၏ ပုံမှန်အနေအထားသို့ ပြန်ရောက်ရန် ထိန်းချုပ်နိုင်ခဲ့သည်။
112	politics	ကျိုတို ရာသီဥတုသဘောတူညီချက်တွင် လက်မှတ်ရေးထိုးမည့်မစ္စတာရုတ်ဒ် ၏ဆုံးဖြတ်ချက်သည် ယခုအခါတွင် သဘောတူညီချက်ကို လက်မှတ်ရေးထိုးခြင်းမပြုသော ဖွံ့ဖြိုးပြီးနိုင်ငံဖြစ်သည့် အမေရိကန်နိုင်ငံကို သီးခြားဖြစ်သွားစေပါသည်။
1050	politics	အစီရင်ခံစာက အမှုဆောင်အဖွဲ့၏ အီရတ်နိုင်ငံအပေါ်ထားရှိသည့် လက်ရှိမူဝါဒ၏ ရှုထောင့်ဟူသမျှနီးပါးကို ပြင်းပြင်းထန်ထန် ရှုတ်ချထားသည်။
1609	travel	သယ်ယူပို့ဆောင်ရေးစနစ်များသည် မည်သည့်အတွက်ကြောင့် ထိုသို့တိုင်ကြားခံနေပါသနည်း၊ နေ့စဉ်လုပ်ဆောင်ရမည့်လုပ်ငန်းများအား အဘယ်ကြောင့်မလုပ်ဆောင်နိုင်ပါသနည်။။ သယ်ယူပို့ဆောင်ရေးအင်ဂျင်နီယာများ၏ မကျွင်းကျင်မှုကြောင့် ဖြစ်ပါသလား။ သို့မဟုတ် အခြေခံကျသည့်အကြောင်းတရားတစ်ခုခု ရှိနေပါသလား။
1316	sports	ကျန် နပန်းသမားများကလည်း လျူနာ အတွက် ချီးကျူးဂုဏ်ပြုစကားများ ဆိုခဲ့ကြသည်။
291	geography	အဆင့်ဆင့် ပြောင်းလဲမှု ဖြစ်စေသည့် ကြီးမားသော ငလျင် လှုပ်မှုမှာ မီးတောင်ထိပ် ကယ်လ်ဒီယာ၏ အရှေ့မြောက်ဘက်ခြမ်းတွင် မတ်လ ၁၀ ရက်နေ့၌ ဖြစ်ပွားခဲ့သည်။
1215	travel	Ürümqi တွင် အရေးပေါ်ဆင်းသက်ရန် ငြင်းဆိုခံရပြီးနောက် လေယာဉ်သည် အာဖဂန်နစ္စတန်သို့ လမ်းကြောင်း ပြောင်းလာခဲ့သည်ဟု အစောပိုင်းအစီရင်ခံမှုများက ပြောကြားပါသည်။
1270	sports	ဗုဒ္ဓဟူးနေ့၏ ဖြစ်စဉ်ကို ကျော်လွန်၍ ကာပါမဲဒိုးသည် ချန်ပီယံရှစ်ပြိုင်ပွဲများတွင် သီးခြားပြိုင်ပွဲနှစ်ခုတွင် ယှဉ်ပြိုင်ခဲ့သည်။
663	entertainment	ဆန်ဖရန်စစ္စကိုသည် အခြားသော အာရှဟင်းလျာများဖြစ်သည့်- ကိုရီးယား၊ ထိုင်း၊ အိန္ဒိယ၊ နှင့် ဂျပန်တို့အတွက် တစ်နိုင်ငံလုံးရှိ အကောင်းဆုံးနေရာများအနက် တစ်နေရာဖြစ်ပါသည်။
91	politics	အာဖဂန်နစ္စတန်၏ ကုန်ကျစရိတ် သက်သာစေရန်နှင့်လုံခြုံရေး အန္တရာယ် မဖြစ်စေရန်အတွက် ရွေးကောက်ပွဲကို ပယ်ဖျက်ရန် အရာရှိများက ဆုံးဖြတ်ထားသည်ဟု လိုဒင်က ပြောကြားခဲ့သည်။
371	science/technology	သစ်တောက်ဌက်သည် သစ်ပင်ပင်စည်အား မစားသုံးမီ သစ်ရွက်များကို နူတ်သီးဖြင့်အရင်  ခြွေတတ်ကြသည်။
1806	travel	ဆင်များနှင့် သစ်ကုလားအုတ်များကဲ့သို့ အချို့တိရိစ္ဆာန်များက ကားများနှင့်အဆင့်မီကိရိယာပစ္စည်း အနားသို့ နီးကပ်စွာ ချဉ်းကပ်ခြင်းကြောင့်  ကောင်းကောင်း ကြည့်ရှုနိုင်သည်။
930	travel	သင်သည် အချို့နိုင်ငံများသို့ တိုးရစ်အနေဖြင့် သို့မဟုတ် လုပ်ငန်းအတွက် ဖြစ်စေ ခေတ္တသွားရောက်ပါက ဗီဇာမလိုအပ်သော်လည်း နိုင်ငံတကာကျောင်းသားအနေဖြင့် သွားရောက်မည်ဆိုပါက ကြာရှည်နေရန်အတွက် လိုအပ်ပေသည်။
33	sports	ပီကွက်ဂျူနီယာကို ၂၀၀၉ ခုနှစ် ဂရင်းပရင့်ခ် ပြိုင်ပွဲနောက်ပိုင်းတွင် အလုပ်ထုတ်ပစ်ခဲ့သည်။
0	health	တနင်္လာနေ့တွင် စတန်းဖို့ဒ်တက္ကသိုလ် ဆေးကျောင်းမှ သိပ္ပံပညာရှင်များသည် ဆဲလ်များကို အမျိုးအစားအလိုက် စီစဉ်နိုင်သော ရောဂါခွဲခြားစစ်ဆေးမှု ကိရိယာအသစ် တီထွင်မှုအကြောင်းကို ကြေညာခဲ့သည်- ၎င်းသည် စံနှုန်းမီ မင်စက်ကလေးများဖြင့် ပုံဖော်သည့် ပရင်တာများကို သုံးကာ ထုတ်လုပ်နိုင်သော အလွန်သေးငယ်သည့် တစ်ခုလျှင် U.S. ဆင့်တစ်ပြားသာသာရှိသော ပရင့်လုပ်၍ရသော အပြားလေးဖြစ်ပါသည်။
200	geography	စပ်ဖာ-စန့်ပ်စွန် ဟာရီကိန်းအဆင့်သတ်မှတ်ချက်မှ အဆင့် ၄ မုန်တိုင်းတစ်ခုဖြစ်သည့် ဖလီစီးရား သည် အပူပိုင်း လေဖိအားနည်းရပ်ဝန်းအဖြစ် အားနည်းသွားခဲ့ပြီး အင်္ဂါနေ့မတိုင်မီ အားပျော့ပျောက်ကွယ်သွားခဲ့သည်။
873	entertainment	ပိုမို ခက်ခဲစေချင်ပါက သစ်သီးဖျော်ရန် သို့မဟုတ် အသီးဖတ်ဖျော်ရည်ဖျော်ရန် အခွင့်အရေး ရယူပါ-
774	entertainment	နိုင်ငံတကာ သစ်သီးဝလံပန်းမန်ပြပွဲများသည် ပန်းခင်းများ၊ ရုက္ခဗေဒဥယျာဉ်များနှင့် အပင်နှင့်ပတ်သက်သော အရာများကို ခင်းကျင်းပြသပေးသည့် အထူးပွဲများ ဖြစ်ပါသည်။
1377	science/technology	ကျွန်ုပ်တို့သည် ကျွန်ုပ်တို့၏အိမ်များကို သစ်ပင်များဖြင့်ဆောက်လုပ်ကာ အဝတ်အထည်များကို အပင်များမှ ရယူပြုလုပ်ပါသည်။ ကျွန်ုပ်တို့စားသုံးသော အစားအစာအများစုမှာ အပင်များဖြစ်ပါသည်။ အပင်များမရှိလျှင်၊ တိရစ္ဆာန်များ အနေဖြင့် ရှင်သန်နိုင်မည်မဟုတ်ပါ။
203	geography	အချို့သော မိုးရွာသွန်းမှုများတွင် မိုးကြိုးမုန်တိုင်းများနှင့် မကြာခဏ လျှပ်စီးလက်ခြင်းတို့ ဖြစ်ပေါ်တတ်ပါသည်။
1365	science/technology	ကျားဟိန်းသံသည် ခြင်္သေ့၏ အပြည့်အဝ ဟိန်းသံနှင့် မတူညီသော်လည်း မာန်ဖီငေါက်ငမ်းသည့် စကားလုံးများပါသော ဝါကျနှင့် ပို၍တူသည်။
1176	sports	အောဘလက်ခ်အဖွဲ့အတွက် လွန်ခဲ့သော နှစ်ပတ်က ဖလားရရှိခဲ့သောပွဲမှာ နောက်ဆုံးပွဲစဉ်ဖြစ်သည်။
879	health	အစိုးရများသည် ဧည့်သည်များဝင်ရောက်ခြင်း၊ သို့မဟုတ် နိုင်ငံသားများထွက်ခွာသည့်အခါတို့တွင်၎င်းတို့၏နိုင်ငံများတွင် ရောဂါများအတွက် ကာကွယ်ဆေးထိုးရန်လိုအပ်ပါသည်။
