index_id	category	text
1892	travel	When returning home after living abroad, you've adapted to the new culture and lost some of your habits from your home culture.
1707	travel	Casablanca is one of the least interesting places to shop in all of Morocco.
1729	geography	The Sundarbans are the largest littoral mangrove belt in the world, stretching 80 km (50 mi) into the Bangladeshi and Indian hinterland from the coast.
1574	science/technology	Virtually all computers in use today are based on the manipulation of information which is coded in the form of binary numbers.
692	travel	The Angkor Pass is needed to enter the temple so do not forget to bring your passport along when heading to Tonle Sap.
1155	geography	"All of the cave entrances, which were named ""The Seven Sisters"", are at least 100 to 250 meters (328 to 820 feet) in diameter."
1810	sports	Tokyo will be the only Asian city to have hosted two summer Olympics, having hosted the games in 1964.
64	politics	The original bill was drafted by former mayor of São Paulo, Marta Suplicy. The proposed legislation, after being amended, is now in the hands of Roberto Jefferson.
1330	politics	"He referred to the rumors as ""political chatter and silliness""."
1448	politics	Also between each dynasty was an unstable age of divided provinces. The best-known of these periods was the Three Kingdoms epoch taking place for 60 years between the Han and the Jin Dynasty.
636	science/technology	In the year 1970, Raymond Damadian, a medical doctor and research scientist, discovered the basis for using magnetic resonance imaging as a tool for medical diagnosis.
1677	science/technology	Examples include control, planning and scheduling, the ability to answer customer diagnoses and questions, as well as handwriting recognition, voice and face.
1398	entertainment	If you have watched the movie National Treasure, you may think a treasure map was written on the back of the Declaration of Independence.
1605	travel	In this dynamic transport shuttle everyone is somehow connected with, and supporting, a transport system based on private cars.
982	travel	Even if you're driving through the subtropical rainforest, a few seconds with the doors open while you get inside the vehicle is enough time for mosquitoes to get in the vehicle with you.
366	science/technology	The major organ of the circulatory system is the heart, which pumps the blood.
1651	science/technology	Content theories are centered on finding what makes people tick or appeals to them.
941	science/technology	After you become comfortable with formatting and editing on the web, then later, you might create your own website.
876	health	For those unfamiliar with medical jargon, the words infectious and contagious have distinct meanings.
661	entertainment	Its frequent portrayal in music, films, literature and popular culture has helped make the city and its landmarks known throughout the world.
1112	health	Several million vials of encephalitis vaccine have also been promised by the government, which will help prepare health agencies for next year.
1329	politics	Cuomo, 53, began his governorship earlier this year and signed a bill last month legalizing same-sex marriage.
1053	politics	Mrs. Kirchner announced her intention to run for president at the Argentine Theatre, the same location she used to start her 2005 campaign for the Senate as member of the Buenos Aires province delegation.
1948	travel	Please remember that you are essentially visiting a mass grave site, as well as a site that has an almost incalculable meaning to a significant portion of the world's population.
923	science/technology	Access to these services is often through a toll-free telephone number that can be called from most phones without charge.
173	science/technology	Following seabed mapping the wreck was found using an ROV.
1087	science/technology	Just like the moon exerts a pull on the earth, causing tides, so does the Milky Way exert a force on the Sagittarius galaxy.
1328	science/technology	Scientists hope to understand how planets form, especially how the Earth formed, since comets collided with the Earth long ago.
914	science/technology	Real-time text translator apps – applications that are capable of automatically translating whole segments of text from one language into another.
1341	science/technology	This is called a chemical's pH. You can make an indicator using red cabbage juice.
336	entertainment	"To finish, Turkish dance group Fire of Anatolia performed the show ""Troy""."
1005	entertainment	In late 2017, Siminoff appeared on shopping television channel QVC.
1671	science/technology	The correlation between brain pathology and behaviour supports scientists in their research.
1597	science/technology	Hershey and Chase used phages, or viruses, to implant their own DNA into a bacterium.
1008	health	One antibody cocktail, ZMapp, initially showed promise in the field, but formal studies indicated it had less benefit than sought in preventing death.
1313	health	While he was working at the hospital Liggins began to investigate premature labor during his spare time.
665	travel	"The ""typical"" visit involves flying into Orlando International Airport, busing to an on-site Disney hotel, spending about a week without leaving Disney property, and returning home."
242	geography	Besides carrying three important scientific instruments, the lunar probe also carried the image of the Indian national flag, painted on all sides.
383	politics	This fleet was led by Olaf Trygvasson, a Norwegian with ambitions to reclaim his country from Danish domination.
954	travel	Turkish Airlines flies to 39 destinations in 30 African countries as of 2014.
979	travel	These can be dangerous if the traveler pursue the mirage, wasting precious energy and remaining water.
217	sports	The vote must still be ratified by the full IOC at it's October meeting in Copenhagen.
1036	travel	During his trip, Iwasaki ran into trouble on many occasions.
1583	health	MS is a disease that affects the central nervous system, which is made up of the brain, the spinal cord and the optic nerve.
1063	sports	Middle order batsmen, Sachin Tendulkar and Rahul Dravid, performed well and made a hundred-run partnership.
458	science/technology	This makes inexpensive zoom lenses hard to use in low-light conditions without a flash.
831	travel	On night sleeper trains, passports may be collected by the conductor so that you do not have your sleep interrupted.
220	sports	Despite his comments he said he will be supporting the British competitors at the 2012 Olympics being held in London.
1119	health	After the accident occurred, Gibson was transported to a hospital but died shortly afterwards.
1650	geography	There may be more maria on the near side because the crust is thinner. It was easier for lava to rise up to the surface.
813	sports	For a day hike along an easy trail little preparations are needed, and any moderately fit person can enjoy them.
1353	science/technology	It takes a giant rocket over a 100 feet high to put a satellite or telescope in space.
925	science/technology	If just taking a photo of something isn't allowed, then you shouldn't even think of recording a video of it.
1164	science/technology	ASUS Eee PC, earlier launched world-wide for cost-saving and functionality factors, became a hot topic in 2007 Taipei IT Month.
273	health	There is concern that patients may continue to infect more people by going through their daily routines if the flu symptoms remain mild.
947	geography	Lake Onega is also connected to Volga, so coming from the Caspian Sea through Russia is still possible.
1191	politics	Bachmann, who won the Ames Straw Poll in August, decided to end her campaign.
1070	politics	Ever since the Federal Government stepped in to take over funding of the Mersey hospital in Devonport, Tasmania, the state government and some federal MPs have criticised this act as a stunt in the prelude to the federal election to be called by November.
497	health	They became proficient at amputation to save patients from gangrene as well as tourniquets and arterial clamps to stem blood flow.
1914	travel	"Finland is a great boating destination. The ""Land of a thousand lakes"" has thousands of islands too, in the lakes and in the coastal archipelagos."
360	science/technology	The next picture shows the atoms emitting photons. Of course, in reality photons are a lot smaller than those in the picture.
1549	politics	At the same time, the German navy, using mainly U-boats, was trying to stop this traffic.
186	travel	The bus was headed to Six Flags St. Louis in Missouri for the band to play to a sold-out crowd.
598	science/technology	Robert Hooke, a biologist from England, saw small squares in cork with a microscope.
163	travel	An Avenger class mine countermeasures ship, the ship was on its way to Puerto Princesa in Palawan.
537	travel	If the objective of one’s visit to a particular place is to get to know its history and culture then this type of tourism is known as cultural tourism.
365	science/technology	This is because electricity flowing into the socket where the metallic part of bulb sits can give you a severe electric shock if you touch the inside of the socket or the metal base of the bulb while it is still partly in the socket.
918	science/technology	Using GPS navigation apps on your smartphone can be the easiest and most convenient way to navigate when out of your home country.
944	travel	It can also be a good way to stretch a budget to allow a longer stay somewhere since many volunteer jobs provide room and board and a few pay a small salary.
1856	travel	As long as you stay in this zone, you can generally cross borders without going through passport control checkpoints again.
10	politics	Around 11:29, the protest moved up Whitehall, past Trafalgar Square, along the Strand, passing by Aldwych and up Kingsway towards Holborn where the Conservative Party were holding their Spring Forum in the Grand Connaught Rooms hotel.
893	geography	These aren't very nimble so the trail has to take a long swerve around the Transantarctic Mountains to come onto the plateau.
282	politics	Protests also took place in Paris, Sofia in Bulgaria, Vilnius in Lithuania, Valetta in Malta, Tallinn in Estonia, and Edinburgh and Glasgow in Scotland.
1362	science/technology	Lion prides act much like packs of wolves or dogs, animals surprisingly similar to lions (but not other big cats) in behavior, and also very deadly to their prey.
530	sports	Golf is a game in which players use clubs to hit balls into holes.
730	travel	This authentic community is located in Howe Sound just off Vancouver, and is easily accessed via scheduled water taxis departing Granville Island in downtown Vancouver.
840	entertainment	However, nearly all of the casinos listed above serve drinks, and several of them bring in name-brand entertainment (primarily the large ones immediately surrounding Albuquerque and Santa Fe).
698	travel	Ecuador requires that Cuban citizens receive an invitation letter prior to entering Ecuador through international airports or frontier admission points.
1826	travel	If you're not used to driving on country roads, keep your wits about you: steep grades, narrow lanes, and sharp curves predominate.
339	health	He was immediately attended to by the on-track medical staff and transported to a local hospital where he later died.
226	science/technology	Its existence is known only because of its effects on the expansion of the universe.
24	sports	He had 2 goals and 2 assists in Washington's 5-3 win over the Atlanta Thrashers.
1117	entertainment	"His 1,000th stamp was the magnificent ""Great Deeds by Swedish Kings"" by David Klöcker Ehrenstrahl in 2000, which is listed in the Guinness Book of World Records."
1792	entertainment	Remember that even though music on the main stages may have finished, there may be sections of the festival that will keep playing music until late into the night.
674	travel	Entering Southern Africa by car is an amazing way to see all the region's beauty as well as to get to places off the normal tourist routes.
1098	health	However, the percentage of XDR-TB in the entire group of people with tuberculosis still seems to be low; 6,000 of the total 330,000 people infected at any particular moment in South Africa.
892	travel	It's compacted snow with crevasses filled in and marked by flags. It can only be traveled by specialized tractors, hauling sleds with fuel and supplies.
380	science/technology	Then, a few years later in 1639, an English astronomer named Jeremiah Horrocks observed a transit of Venus.
921	science/technology	Every corner store is filled with a confusing array of pre-paid phone cards that can be used from pay phones or ordinary telephones.
65	politics	Protesters hope to collect a petition of 1.2 million signatures to present to the National Congress in November.
912	science/technology	There is also no requirement that you obtain a local number from the community in which you live; you can obtain a satellite Internet connection in the wilds of Chicken, Alaska and select a number which claims you're in sunny Arizona.
987	geography	"These plateaus are often referred to as ""vidde"" meaning a wide, open treeless space, a boundless expanse."
819	travel	"When you travel, expect things not to be like they are ""back home"". Manners, laws, food, traffic, lodging, standards, language and so on will to some extent differ from where you live."
798	travel	Also give policy/contact copies to traveling companions and relatives or friends back home willing to help.
1035	science/technology	The smaller the Rossby number, the less active the star with respect to magnetic reversals.
1228	entertainment	Famous singers across the country presented bhajans, or devotional songs, to Shri Shyam's feet.
1039	science/technology	This will allow it to be backwards compatible with 802.11a, 802.11b and 802.11g, provided that the base station has dual radios.
1375	science/technology	Plants make oxygen which humans breathe, and they take in carbon-dioxide which humans exhale (that is, breathe out).
772	entertainment	A World's Fair (commonly called World Exposition, or simply Expo) is large international festival of arts and sciences.
735	travel	Sirena is the only ranger station that offers dormitory lodging and hot meals in addition to camping. La Leona, San Pedrillo, and Los Patos offer only camping with no food service.
1350	science/technology	When you call someone who is thousands of miles away, you are using a satellite.
1419	geography	"Due to the cluster/group of islands Japan has, Japan is often referred to, on a geographical stance, as an ""archipelago"""
1601	travel	Nature-based tourism attracts people interested in visiting natural areas for the purpose of enjoying the scenery, including plant and animal wildlife.
1812	sports	Cancellation policies vary, but as of late March most coronavirus-based cancellation policies don't extend to July 2020, when the Olympics had been scheduled.
270	sports	Since then, the Brazilian has featured in 53 matches for the club in all competitions and has scored 24 goals.
1920	travel	This means you can visit the historic city for a couple of full days while returning and sleeping on the ship at night.
1431	science/technology	Many common formats (APS family of formats, for example) are equal to or closely approximate this aspect ratio.
832	travel	Registration is an additional requirement for the visa process. In some countries, you must register your presence and address where you are staying with the local authorities.
1769	politics	During the struggle for independence organised by the Mau movement, a peaceful gathering in the town resulted in the killing of the paramount chief Tupua Tamasese Lealofi III.
130	politics	Today's announcement also extended the government's commitment made in March of this year to fund extra carriages.
955	travel	If you have additional travel time, check to see how your total fare quote to Africa compares with a round-the-world fare.
47	sports	Jonny Reid, co-driver for the A1GP New Zealand team, today made history by driving the fastest over the 48-year-old Auckland Harbour Bridge, New Zealand, legally.
1038	science/technology	The 802.11n standard operates on both the 2.4Ghz and 5.0Ghz frequencies.
1268	health	Uka's weapon failed whilst pointed at a fifth man's head. Schneider has ongoing pain, blindness in one eye, a missing section of skull and a face rebuilt from titanium.
1418	geography	Japans holds nearly 7,000 islands (the biggest being Honshu), making Japan the 7th largest island in the world!
1899	entertainment	The scenes are displayed on the pyramids and the different pyramids are lit up.
272	health	Some studies suggest that the disease must become less lethal before it can cause a global epidemic, he noted.
943	travel	Living and volunteering in a foreign country is a great way to get to know a different culture, meet new people, learn about yourself, get a sense of perspective and even gain new skills.
1201	health	UN peacekeepers, whom arrived in Haiti after the 2010 earthquake, are being blamed for the spread of the disease which started near the troop's encampment.
267	science/technology	The case was prosecuted in Virginia because it is the home to the leading internet service provider AOL, the company who instigated the charges.
1708	travel	Around the old Medina it's easy to find places selling traditional Moroccan goods, such as tagines, pottery, leather goods, hookahs, and a whole spectrum of geegaws, but it's all for the tourists.
928	travel	Nowadays air travel is only rarely booked directly through the airline without first searching and comparing prices.
1391	geography	In the warm climate of the Middle East, the house was not so important.
1229	entertainment	Singer Sanju Sharma started the evening, followed by Jai Shankar Choudhary. esented the chhappan bhog bhajan as well. Singer, Raju Khandelwal was accompanying him.
586	science/technology	These telescopes used a combination of two lenses to make distant objects appear both nearer and larger.
1695	geography	Madagascar is by far the biggest, and a continent on its own when it comes to wildlife.
802	health	Possible long term health events from excessive drinking can include liver damage and even blindness and death. The potential danger is increased when consuming illegally produced alcohol.
1881	politics	The willingness of governments to issue passports with gender not stated (X) or documents updated to match a desired name and gender varies.
1379	science/technology	Its long jaws were studded with more than 70 razor-sharp teeth, along with an extra set in the roof of its mouth, meaning that there was no escape for anything that crossed its path.
1550	politics	Had the Allies failed, Germany probably would have been able to conquer Britain as it had the rest of Europe.
333	entertainment	It was followed by the Istanbul State Symphony Orchestra, a Janissary band, and the singers Fatih Erkoç and Müslüm Gürses.
719	geography	The Dominican Republic (Spanish: República Dominicana) is a Caribbean country that occupies the eastern half of the island of Hispaniola, which it shares with Haiti
1780	travel	Many trips to the reef are made all year around, and injuries due to any of these causes on the reef are rare.
1841	travel	If a rider is thrown from a horse but has a foot caught in the stirrup, they could be dragged if the horse runs away. To minimize this risk, a number of safety precautions can be taken.
471	politics	The concept was that all European nations had to seek to prevent one nation from becoming powerful, and thus national governments often changed their alliances in order to maintain the balance.
1634	science/technology	This was more like the four states of matter (in the same order): solid, liquid, gas, and plasma, though he also theorised that they change into new substances to form what we see.
1255	science/technology	The researchers observed crystals formed in cat urine by the addition of melamine and cyanuric acid.
845	entertainment	"However, nowadays there are established graffiti artists, graffiti events and ""legal"" walls. Graffiti paintings in this context often resemble artworks rather than illegible tags."
1776	entertainment	There are many French wines to be had, but the New Zealand and Australian wines might travel better.
1845	travel	Summits include breath-taking views from peaks. Climbers from all parts of the world are continually establishing new routes amongst its endless potential of walls.
1151	sports	Looking decidedly rusty in the game against their southern sisters, South Africa however steadily improved as the tournament progressed.
1054	politics	"The debate was sparked by controversy over spending on relief and reconstruction in the wake Hurricane Katrina; which some fiscal conservatives have humorously labeled ""Bush's New Orleans Deal."""
1859	geography	The definition has geographic variations, where the age limit might be shorter in places such as North America than in Europe.
1007	health	While one experimental vaccine appears able to reduce Ebola mortality, up until now, no drugs have been clearly demonstrated suitable for treating existing infection.
1076	politics	"Bush spokesman Gordon Johndroe called North Korea's pledge ""a major step towards the goal of achieving the verifiable denuclearization of the Korean peninsula."""
1099	geography	The satellites, both of which weighed in excess of 1,000 pounds, and traveling at approximately 17,500 miles per hour, collided 491 miles above the Earth.
1100	science/technology	Scientists say the explosion caused by the collision was massive.
367	science/technology	Blood goes away from the heart in tubes called arteries and comes back to the heart in tubes called veins. The smallest tubes are called capillaries.
770	entertainment	Most of the temple festivals is celebrated as part of temple's anniversary or presiding deity's birthday or any other major event associated with the temple.
279	politics	As a winner-takes-all state, Florida awarded all fifty of its delegates to Romney, pushing him ahead as the front-runner for the Republican Party nomination.
357	science/technology	To return to their previous energy level, they must get rid of the extra energy they got from the light.
797	science/technology	If traveling with a laptop or tablet, store a copy in its memory or disc (accessible without the internet).
211	health	No major injuries were reported, but at least five people on scene at the time of the explosion were treated for symptoms of shock.
815	travel	Internationally, there are nearly 200 running tour organizations. Most of them operate independently.
238	geography	"As far as we know, there is only one planetary body that displays more dynamism than Titan, and its name is Earth,"" added Stofan."
1636	science/technology	Elements like calcium and potassium are considered metals. Of course, there are also metals like silver and gold.
761	travel	A listing of available hosts is then provided either in print and/or online, sometimes with references and reviews by other travelers.
1676	science/technology	Research in AI involves making machines to automate tasks that require intelligent behavior.
848	entertainment	Most boomerangs available in Australia are in fact non-returning. It is best for beginners to not try throwing in windy
1089	science/technology	This theory says that most dark matter around a galaxy is located around a galaxy in a kind of halo, and is made of lots of small particles.
984	health	Fewer than a thousand cases have ever been reported in humans, but some of them have been fatal.
305	sports	Japanese judoka Hitoshi Saito, winner of two Olympic gold medals, has died at the age of 54.
697	travel	Jerusalem has many historic, archeological and cultural sites, along with vibrant and crowded shopping centers, cafés, and restaurants.
826	travel	Basically, they fall into two categories: Either work while you travel or try and limit your expenses. This article is focused on the latter.
1672	health	It has been known for a long time that different types of brain damage, traumas, lesions, and tumours affect behaviour and cause changes in some mental functions.
536	travel	Beaches, theme parks and camp grounds are often the most common places frequented by recreational tourists.
1909	science/technology	Your local telephone service provider should be able to give more information about connecting to this service.
611	science/technology	Sophisticated animations can be constructed on computers, and this kind of animation is increasingly being used in television and films.
157	sports	Following the race, Keselowski remains the Drivers' Championship leader with 2,250 points.
1294	politics	Martelly swore in a new Provisional Electoral Council (CEP) of nine members yesterday.
1803	travel	On the other hand, icy and snowy conditions are normal in many countries, and traffic goes on mostly uninterrupted all year round.
359	science/technology	"Scientists call this process ""stimulated emission of radiation"" because the atoms are stimulated by the bright light, causing the emission of a photon of light, and light is a type of radiation."
302	politics	French law was changed. His activism went back to age 15 when he joined the French Resistance during World War II.
455	science/technology	This is becoming less of an issue as lens manufacturers achieve higher standards in lens production.
25	sports	Ovechkin's first assist of the night was on the game-winning goal by rookie Nicklas Backstrom;
1606	science/technology	Science now indicates that this massive carbon economy has dislodged the biosphere from one of its stable states that has supported human evolution for the past two million years.
79	sports	The two sides would meet in the major semi final where Noosa ran out winners by 11 points.
