index_id	category	text
431	geography	Turkey is encircled by seas on three sides: the Aegean Sea to the west, the Black Sea to the north and the Mediterranean Sea to the south.
403	science/technology	In the beginning of the war they mostly travelled on top of the sea, but as radar began developing and becoming more accurate the submarines were forced to go under water to avoid being seen.
1592	science/technology	As knowledge of Greek declined, the West found itself cut off from its Greek philosophical and scientific roots.
993	entertainment	However, they have a different kind of beauty and charm during winter, with many hill stations receiving healthy amounts of snow and offering activities such as skiing and snowboarding.
755	entertainment	These hotels were where the rich and the famous of the day would stay, and often had fine dining and nightlife.
1936	politics	In 1994, this conflict led to the creation of the self-proclaimed Transnistria Republic in eastern Moldova, which has its own government and currency but is not recognised by any UN member country.
1205	health	Danielle Lantagne, a UN expert on the disease, stated the outbreak was likely caused by the peacekeepers.
1692	geography	Large areas further north are quite sparsely populated and some is nearly uninhabited wilderness.
280	politics	Organisers of the protest said about 100,000 people turned up in German cities such as Berlin, Cologne, Hamburg, and Hanover.
247	politics	These agents are responsible for providing government and judicial services under Article 247 of the Pakistani Constitution.
1439	politics	Soon after the outbreak of hostilities, Britain initiated a naval blockade of Germany.
1239	entertainment	She’s very cute and sings quite well, too, he said according to a transcript of the news conference.
743	geography	The Cook Islands do not have any cities but are composed of 15 different islands. The main ones are Rarotonga and Aitutaki.
18	politics	There were protests worldwide, several criminal prosecutions, and the leaders of the governments of Iceland and Pakistan both resigned.
1344	science/technology	Hydrogen ions are protons that had their electrons stripped off them (since Hydrogen atoms consist of one proton and one electron).
688	travel	Visitors with limited time would be best to spend their time elsewhere.
556	science/technology	The atom can be considered to be one of the fundamental building blocks of all matter.
1645	science/technology	Sort of like rolling a heavy cart up a hill. Splitting the nucleus up again then releases some of that energy.
907	science/technology	They normally offer higher bandwidth and better quality of service. They are encrypted and thus harder to spy on.
1071	politics	But Prime Minister John Howard has said the act was only to safeguard the facilities of the hospital from being downgraded by the Tasmanian government, in giving an extra AUD$45 million.
555	sports	Athletes may feel that they prefer a product even when it provides no real benefits.
1203	health	Prior to the arrival of troops, Haiti had not encountered problems related to the disease since the 1800s.
58	politics	Police said Lo Piccolo had the upper hand because he had been Provenzano's right-hand man in Palermo and his greater experience won him the respect of the older generation of bosses as they pursued Provenzano's policy of keeping as low as possible while strengthening their power network.
1764	travel	In addition, be aware that odors attract bears and other wildlife, so avoid carrying or cooking odorous foods and keep a clean camp.
195	sports	Massa is due to be out for at least the rest of the 2009 season.
1785	travel	Booking in advance gives the traveller peace of mind that they will have somewhere to sleep once they arrive at their destination.
600	science/technology	Elements and compounds can move from one state to another and not change.
553	sports	Middle distance running is a relatively inexpensive sport; however, there are many misconceptions regarding the few pieces of equipment required to participate.
1720	geography	The park covers 19,500 km² and is divided in 14 different ecozones, each supporting different wildlife.
1622	geography	The Amazon River is the second longest and the biggest river on Earth. It carries more than 8 times as much water as the second biggest river.
1441	politics	Britain mined international waters to prevent any ships from entering entire sections of ocean, causing danger to even neutral ships.
566	health	Vision, or the ability to see depends on visual system sensory organs or eyes.
1515	science/technology	The distinct characteristics of the Internet lead to additional dimensions in terms of the uses and gratifications approach.
585	science/technology	However, the first true telescopes were made in Europe in the late 16th century.
1689	geography	Ottawa is Canada's charming, bilingual capital and features an array of art galleries and museums that showcase Canada's past and present.
1256	health	The composition of these crystals matches those found in the urine of affected pets when compared by infrared spectroscopy (FTIR).
60	science/technology	Apple CEO Steve Jobs unveiled the device by walking onto the stage and taking the iPhone out of his jeans pocket.
32	sports	As the cars ahead of Alonso went in for fuel under the safety car, he moved up the pack to take victory.
1411	politics	During the Revolutionary War, the thirteen states first formed a weak central government—with the Congress being its only component—under the Articles of Confederation.
13	sports	Nadal bagged 88% net points in the match winning 76 points in the first serve.
1941	travel	The broad boulevards, glass-fronted buildings and modern shopping centers are dotted with traditional red-tiled roofs, the 18th century market, and old mosques and churches, although the city has an atmosphere more of Mediterranean Europe than traditional Turkey.
732	sports	Whistler (1.5 hour drive from Vancouver) is expensive but well-known because of the 2010 Winter Olympics.
871	entertainment	Fill your home with a rich coffee in the morning and some relaxing chamomile tea at night.
886	geography	Antarctica is the coldest place on Earth, and surrounds the South Pole.
362	science/technology	After hundreds of hours of operation the filament in the bulb eventually burns out and the light bulb no longer works.
1578	health	Check the label for specific first aid instructions for that specific poison.
996	travel	In all cases, you must book by phone directly with the airline.
197	health	The president's condition is stable, though he will be isolated at home for several days.
460	entertainment	Most televisions are made in a way to please the general public.
154	geography	Out of the approximately 24,000 known meteorites to have fallen to Earth, only about 34 have been verified to be martian in origin.
1160	politics	After officials verify the voter's identity, the voter drops the envelope into the ballot box and signs the voting roll.
1223	entertainment	They have cancelled the tour after lead singer Steven Tyler was injured after he fell off stage while performing on August 5.
54	politics	Peter Costello, Australian treasurer and the man most likely to succeed Prime Minister John Howard as Liberal party leader has thrown his support behind a nuclear power industry in Australia.
7	politics	The protest started around 11:00 local time (UTC+1) on Whitehall opposite the police-guarded entrance to Downing Street, the Prime Minister's official residence.
1010	sports	USA Gymnastics supports the United States Olympic Committee's letter and accepts the absolute need of the Olympic family to promote a safe environment for all of our athletes.
1174	sports	The final score was a one-point victory, 21 to 20, ending the All Blacks' 15 game winning streak.
1202	health	According to the lawsuit, waste from the UN camp was not properly sanitized, causing bacteria to enter the tributary of the Artibonite River, one of Haiti's largest.
958	travel	No airline alliance covers all three ocean crossings in the Southern Hemisphere (and SkyTeam covers none of the crossings).
354	science/technology	The blade on a modern ice skate has a double edge with a concave hollow between them. The two edges allow for a better grasp of the ice, even when tilted.
505	science/technology	There are positive aspects to these websites, which include, being able to easily setup a class page which can include blogs, videos, photos, and other features.
1333	science/technology	It uses satellite-based technology as opposed to older ground-radar-based technology to allow air traffic controllers to pinpoint aircraft with greater precision and give pilots more accurate information.
1173	sports	South Africa have defeated the All Blacks (New Zealand) in a rugby union Tri Nations match at the Royal Bafokeng Stadium in Rustenburg, South Africa.
945	travel	Vikings used the Russian waterways to get to the Black Sea and Caspian Sea. Parts of these routes can still be used. Check possible need for special permits, which may be difficult to get.
1012	sports	USA Gymnastics supports an independent investigation that may shine light on how abuse of the proportion described so courageously by the survivors of Larry Nassar could have gone undetected for so long and embraces any necessary and appropriate changes.
712	travel	Over 60 cruise ships ply the Galapagos waters - ranging in size from 8 to 100 passengers.
1654	science/technology	Two popular content theories are Maslow's Hierarchy of Needs Theory and Hertzberg's Two Factor Theory.
76	politics	"He did, however, reiterate his earlier statement that Roe v. Wade was the ""settled law of the land"", emphasizing the importance of consistent Supreme Court rulings."
637	science/technology	Four years later a patent was granted, which was the world's first patent issued in the field of MRI.
1694	geography	The East African Islands are in the Indian Ocean off the eastern coast of Africa.
1559	travel	The first known transportation was walking, humans began walking upright two million years ago with the emergence of Homo Erectus (meaning upright man).
679	geography	Victoria Falls is a town in the western portion of Zimbabwe, across the border from Livingstone, Zambia, and near Botswana.
1049	politics	The Report opens with plea for open debate and the formation of a consensus in the United States about the policy towards the Middle East.
557	science/technology	Its a very complex entity which consists, according to a simplified Bohr model, of a central nucleus orbited by electrons, somewhat similar to planets orbiting the sun - see Figure 1.1.
194	sports	The Brazilian suffered a serious head injury after a crash during the 2009 Hungarian Grand Prix.
1103	science/technology	The result of plotting analysis will be posted to a public website.
1009	health	In the PALM trial, ZMapp served as a control, meaning scientists used it as a baseline and compared the three other treatments to it.
20	politics	Hsieh implied during the election that Ma might flee the country during a time of crisis.
1700	travel	Women: It is recommended that any women travellers say that they are married, regardless of actual marital status.
1673	science/technology	The rise of new technologies allows us to see and investigate brain structures and processes never seen before.
911	science/technology	Because calls are routed over the Internet, you do not need to use a phone company located where you live or where you travel.
1813	travel	It's expected that most event tickets will cost between ¥2,500 and ¥130,000, with typical tickets costing around ¥7,000.
1052	politics	Current senator and Argentine First Lady Cristina Fernandez de Kirchner announced her presidential candidacy yesterday evening in La Plata, a city 50 kilometers (31 miles) away from Buenos Aires.
1699	geography	In the north the region is bounded by the Sahel, and in the south and west by the Atlantic Ocean.
290	geography	The Icelandic Meteorological Office also reported no earthquake activity in the Hekla area in the past 48 hours.
1567	politics	The first public reading of the document was by John Nixon in the yard of Independence Hall on July 8.
1638	science/technology	Everything in the Universe is made of matter. All matter is made of tiny particles called atoms.
590	science/technology	"But, if this ever does happen probably won't happen for a very long time. The stars are so spread out that there are trillions of miles between stars that are ""neighbors""."
1610	travel	Traffic Flow is the study of the movement of individual drivers and vehicles between two points and the interactions they make with one another.
691	travel	A visit to the site can be conveniently combined with a boat trip to the lake.
1120	health	The truck driver, who is aged 64, was not injured in the crash.
1619	science/technology	Thousands of years ago, a man called Aristarchus said that the Solar System moved around the Sun.
839	entertainment	Given how remote many of the pueblos are, you won't be able to find a significant amount of nightlife without traveling to Albuquerque or Santa Fe.
829	travel	An immigration checkpoint is usually the first stop when disembarking from a plane, a ship, or another vehicle.
1591	science/technology	Accepted were Aristotle's views on all matters of science, including psychology.
1821	science/technology	Pests can spoil food, cause irritation, or in a worse case cause allergic reactions, spread venom, or transmit infections.
1271	sports	Her first was the Slalom, where she earned a Did Not Finish in her first run. 36 of the 116 competitors had the same result in that race.
1355	science/technology	It has brought us the train, the car, and many other transportation devices.
376	science/technology	The gas becomes thinner as you go farther from the center of the Sun.
1040	science/technology	The speeds of 802.11n are substantially faster than that of its predecessors with a maximum theoretical throughput of 600Mbit/s.
580	science/technology	These nerve impulses can be sent so quickly throughout the body which helps keep the body safe from any potential threat.
1028	science/technology	The feathers' structure suggests that they were not used in flight but rather for temperature regulation or display. The researchers suggested that, even though this is the tail of a young dinosaur, the sample shows adult plumage and not a chick's down.
1109	health	The first cases of the disease this season were reported in late July.
401	science/technology	Submarines are ships designed to travel underwater, and remain there for an extended amount of time.
70	entertainment	The band's management company, HK Management Inc., gave no initial reason when they canceled on September 20, but blamed logistical reasons by the next day.
576	science/technology	"What is a cell? The word cell comes from the Latin word ""cella"", meaning ""small room"", and it was first coined by a microscopist observing the structure of cork."
1787	travel	Travel agents usually offer packages that include breakfast, transportation arrangements to/from the airport or even combined flight and hotel packages.
1788	travel	They can also hold the reservation for you if you need time to think about the offer or procure other documents for your destination (e.g. visa).
887	travel	Tourist visits are costly, demand physical fitness, can only take place in summer Nov-Feb, and are largely limited to the Peninsula, Islands and Ross Sea.
1065	politics	U.S. President George W. Bush arrived in Singapore the morning of November 16, beginning a week-long tour of Asia.
386	politics	King Sejong was the fourth king of the Joseon Dynasty and is one of the most highly regarded.
1749	sports	Smaller tournaments and matches can also be seen here at other times of the year.
1857	travel	Similarly, by having a Schengen visa, you do not need to apply for visas to each of the Schengen member countries separately, hence saving time, money and paperwork.
680	travel	The town lies immediately next to the falls, and they are the major attraction, but this popular tourist destination offers both adventure seekers and sightseers plenty of opportunities for a longer stay.
93	politics	This contradicts earlier reports, which said that cancelling the runoff would have been against the constitution.
1906	science/technology	In remote locations, without cell phone coverage, a satellite phone may be your only option.
1423	politics	In 1895, after defeat in the First Sino-Japanese War (1894-1895), the Qing government signs the Treaty of Shimonoseki, by which it cedes sovereignty over Taiwan to Japan, which rules the island until 1945.
1361	science/technology	The females are usually closely related to each other, being a large family of sisters and daughters.
1230	entertainment	Then, Lakkha Singh took the lead in singing the bhajans.
1085	science/technology	The work done was mostly theoretical, but the program was written to simulate observations made of the Sagittarius galaxy.
1376	science/technology	Plants make their food from the sun by photosynthesis. They also provide shade.
141	sports	On Wednesday, the United States' National Basketball Association (NBA) suspended its professional basketball season due to concerns regarding COVID-19.
1930	travel	The obvious way of flying in first or business class is to fork out a thick wad of money for the privilege (or, better yet, get your company to do it for you).
1514	science/technology	The Internet combines elements of both mass and interpersonal communication.
783	science/technology	Wildlife photography often requires a long telephoto lens, though things like a flock of birds or a tiny creature need other lenses.
394	politics	But the Royal Navy was still much stronger than the German Navy (“Kriegsmarine”) and could have destroyed any invasion fleet sent across the English Channel.
752	travel	"In short, using your car is a great way to take a road trip but seldom in itself a way to ""camp""."
867	travel	Many a stable, capable traveler has been overcome by the newness of developing world travel, where many little cultural adjustments can add up quickly.
1647	geography	The surface of the Moon is made of rocks and dust. The outer layer of the Moon is called the crust.
1166	entertainment	"The station's web site describes the show as ""old school radio theater with a new and outrageous geeky spin!"""
1882	politics	Willingness of foreign governments to honour these documents is just as widely variable.
299	politics	The failure of the second sentence, which proposes to ban same-sex civil unions, could possibly open the door for civil unions in the future.
1582	health	Across the United States of America, there are approximately 400,000 known cases of Multiple Sclerosis (MS), leaving it as the leading neurological disease in younger and middle aged adults.
1568	politics	One was sent to George Washington on July 6, who had it read to his troops in New York on July 9. A copy reached London on August 10.
1027	science/technology	Because the dinosaur feathers do not have a well-developed shaft, called a rachis, but do have other features of feathers — barbs and barbules — the researchers inferred the rachis was likely a later evolutionary development that these other features.
377	science/technology	"The outer-part we see when we look at the Sun is called the photosphere, which means ""ball of light""."
759	travel	A hospitality exchange network is the organization that connects travelers with locals in the cities they are going to visit.
1088	science/technology	The scientists were able to conclude that the dark matter affect other dark matter in the same way regular matter does.
959	travel	However, Star Alliance covers everything except the eastern South Pacific from Santiago de Chile to Tahiti, which is a LATAM Oneworld flight.
1128	health	She came to this conclusion due to the multitude of positive comments and encouragement sent to her by both female and male individuals urging that contraception medication be considered a medical necessity.
368	science/technology	A triceratops' teeth would have been able to crush not only leaves but even very tough branches and roots.
1612	travel	Fortunately, drivers tend to behave within a reasonably consistent range; thus, traffic streams tend to have some reasonable consistency and can be roughly represented mathematically.
635	science/technology	In this resonance, magnetic field and radio waves cause atoms to give off tiny radio signals.
861	health	At home, due to this constant exposure to the local germs, odds are very high that you're already immune to them.
700	travel	These requirements are designed to provide an organized migratory flow between both countries.
278	politics	Former U.S. Speaker of the House Newt Gingrich came in second with 32 percent.
1326	science/technology	Several people verified the discovery using different hardware and software by the beginning of February and it was announced on Tuesday.
116	science/technology	Scientists have suspected Enceladus as geologically active and a possible source of Saturn's icy E ring.
1034	science/technology	The luminosity and rotation are used together to determine a star's Rossby number, which is related to plasma flow.
450	geography	The Serengeti region contains the Serengeti National Park, the Ngorongoro Conservation Area and Maswa Game Reserve in Tanzania and the Maasai Mara National Reserve in Kenya.
1019	entertainment	The other nominations include Best Picture, Director, Cinematography, Costume Design, Film-editing, Original Score, Production Design, Sound Editing, Sound Mixing and Original Screenplay.
26	sports	his second goal of the night was his 60th of the season, becoming the first player to score 60 or more goals in a season since 1995-96, when Jaromir Jagr and Mario Lemieux each reached that milestone.
1292	sports	In a partnership of NPWS and the Sporting Shooters Association of Australia (NSW) Inc, qualified volunteers were recruited, under the Sporting Shooters Association's hunting program.
1795	travel	Saint Petersburg cruises include time in town. Cruise passengers are exempted from visa requirements (check the terms).
939	travel	Make sure you know what you can and cannot bring in and declare anything over the legal limits.
693	geography	Jerusalem is the capital and largest city of Israel, though most other countries and the United Nations do not recognize it as Israel's capital.
778	science/technology	It can usually be replenished fairly easily if you run out, and gives resolution roughly comparable to a current DSLR.
1147	health	The medical charity Mangola, Medecines Sans Frontieres and the World Health Organisation say it is the worst outbreak recorded in the country.
1263	politics	The Director of Public Prosecutions, Kier Starmer QC, gave a statement this morning announcing the prosecution of both Huhne and Pryce.
1847	sports	"Skiing is a major travelling activity with many enthusiasts, occasionally known as ""ski bums,"" planning entire vacations around skiing at a particular location."
994	travel	Only a few airlines still offer bereavement fares, which slightly discount the cost of last-minute funeral travel.
927	science/technology	Flying a drone near an airport or over a crowd is almost always a bad idea, even if it's not illegal in your area.
811	sports	Hiking is an outdoor activity which consists of walking in natural environments, often on hiking trails.
285	politics	Latvia and Slovakia have both delayed the process of joining ACTA.
1342	science/technology	The cabbage juice changes color depending on how acidic or basic (alkaline) the chemical is.
1800	travel	On icy and snowy roadways, friction is low and you cannot drive as if you were on bare asphalt.
1297	politics	The commission was Martelly's response to widespread anti-regime protests that started in October.
1048	politics	It warns No one can guarantee that any course of action in Iraq at this point will stop sectarian warfare, growing violence, or a slide toward chaos.
547	politics	The main assault force of 2,400 men would cross the river nine miles north of Trenton, and then split into two groups, one under Greene and one under Sullivan, in order to launch a pre-dawn attack.
1127	health	Fluke wrote that the efforts by some to drown out women from speaking out about women’s health were unsuccessful.
120	entertainment	The ACMA also found that despite the video being streamed on the Internet, Big Brother had not breached online content censorship laws as the media had not been stored on Big Brother's website.
1113	health	Plans for vaccines to be delivered to the historically most affected areas this year were delayed due to lack of funds and low prioritisation relative to other diseases.
1442	politics	Since there was limited response to this tactic, Germany expected a similar response to its unrestricted submarine warfare.
830	travel	In some cross-border trains inspections are done on the running train and you should have valid ID with you when boarding one of those trains.
1824	travel	Travellers bound for countries with heavy taxation can sometimes save a considerable amount of money, especially on products such as alcoholic beverages and tobacco.
1533	health	Other biorhythm-based options involve drinking lots of fluid (particularly water or tea, a known diuretic) prior to sleep, forcing one to get up to urinate.
1982	entertainment	Cherry blossom viewing, known as hanami, has been a part of Japanese culture since the 8th century.
657	health	The very long days in the summer can lead to problems getting sufficient sleep and associated health issues.
948	travel	Be assured that once you hit the marinas everything will be pretty obvious. You will meet other boat hitchhikers and they will share their information with you.
