index_id	category	text
1330	politics	Նա բամբասանքները ներկայացրեց որպես «քաղաքական շատախոսություն և հիմարություն»:
1448	politics	Նաև յուրաքանչյուր դինաստիաների միջև բաժանված նահանգների անկայուն ժամանակաշրջան էր: Այդ ժամանակաշրջաններից ամենահայտնին «Երեք թագավորությունների» դարաշրջանն էր, որը Հան և Ջին դինաստիաների միջև տևեց 60 տարի:
636	science/technology	1970 թվականին բժշկական դոկտոր և հետազոտող գիտնական Ռայմոնդ Դամադյանը բացահայտեց մագնիսառեզոնանսային շերտագրման կիրառման հիմքերը` որպես բժշկական ախտորոշման գործիք:
1677	science/technology	Օրինակներն ընդգրկում են վերահսկում, ծրագրում և օրակարգում, հաճախորդների ախտորոշումներին և հարցերին պատասխանելու ունակություն, ինչպես նաև ձեռագրերի, ձայնի և դեմքի ճանաչում:
1398	entertainment	Եթե դիտել եք «Ազգի գանձերը» ֆիլմը, ապա կարող եք կարծել, որ գանձերի քարտեզ էր պատկերված Անկախության հռչակագրի հետնամասում:
1605	travel	Այս արագաշարժ մերձքաղաքային գնացքում յուրաքանչյուրն ինչ-որ կերպ կապված է մասնավոր ավտոմեքենաների վրա հիմնված տրանսպորտային համակարգի հետ և աջակցում է վերջինիս:
982	travel	Նույնիսկ եթե վարում եք մերձարևադարձային անտառների միջով, փոխադրամիջոց նստելիս ընդամենը մի քանի վայրկյան դռները բացելը բավական ժամանակ է մոծակների համար, որ ձեզ հետ մտնեն փոխադրամիջոց։
366	science/technology	Սրտանոթային համակարգի ամենակարևոր օրգանը սիրտն է, որը դուրս է մղում արյունը:
1651	science/technology	Բովանդակային թեորիաները կենտրոնացած են այն բանի վրա, որ գտնեն, թե ինչն է մարդկանց ստիպում ընտրության նիշ դնել կամ նրանց համար գրավիչ թվում:
941	science/technology	Ինտերնետում ֆորմատավորումը և խմբագրումը յուրացնելուց հետո, դուք կարող եք ստեղծել ձեր սեփական կայքէջը:
876	health	Բժշկական բառապաշարին անծանոթ մարդկանց համար, վարակիչ և վարակող բառերը հստակ նշանակություններ ունեն։
661	entertainment	Երաժշտության, ֆիլմերի, գրականության և ժողովրդական մշակույթի մեջ նրա հաճախակի ներկայացումը օգնել է ճանաչելի դարձնել քաղաքը և նրա տեսարժան վայրերն ամբողջ աշխարհում:
1112	health	Կառավարությունը խոստացել է մի քանի միլիոն էնցեֆալիտի պատվաստանյութի սրվակ տրամադրել, որը կօգնի առողջապահական գործակալություններին պատրաստվել հաջորդ տարվա համար։
1329	politics	Կուոմոն, 53, իր կառավարումն սկսել է այս տարվա սկզբին և անցյալ ամիս ստորագրել նույնասեռ ամուսնություններն օրինականացնող մի օրինագիծ:
1053	politics	Տիկին Կիռչներն արգենտինական թատրոնում իր մտադրությունը հայտնեց առաջադրելու իր թեկնածությունը նախագահի պաշտոնում, 2005 թվականի Սենատի իր քարոզարշավի մեկնարկի ժամանակ նա նույն վայրն էր օգտագործել՝ որպես Բուենոս Այրեսի նահանգի պատվիրակության անդամ։
1948	travel	Խնդրում ենք հիշել, որ դուք, ըստ էության, այցելում եք հսկայածավալ գերեզմանոց, ինչպես նաև մի վայր, որ աշխարհի բնակչության նշանակալի մասի համար գրեթե անհաշվելի արժեք ունի:
923	science/technology	Մուտքը դեպի այս ծառայություններ հաճախ անվճար հեռախոսահամարի միջոցով է, որին կարող են անվճար զանգահարել շատ հեռախոսներից:
173	science/technology	Խորտակված նավը ծովի հատակի քարտեզագրման շնորհիվ հայտնաբերվեց հեռակառավարվող ստորջրյա սարքի միջոցով:
1087	science/technology	Ճիշտ ինչպես լուսինն է ձգողության ուժով ազդում երկրի վրա՝ առաջացնելով մակընթացություններ, այնպես էլ Ծիր Կաթինն է ուժ գործադրում Աղեղնավորի գալակտիկայի վրա:
1328	science/technology	Գիտնականները հույս ունեն հասկանալու, թե ինչպես են ձևավորվում մոլորակները, հատկապես, թե ինչպես է ձևավորվել Երկիր մոլորակը, քանի որ գիսաստղերը Երկրի հետ բախվել են երկար տարիներ առաջ:
914	science/technology	Իրական ժամանակում տեքստ թարգմանող հավելվածներ՝ հավելվածներ, որոնք կարող են ինքնաբերաբար մի լեզվից մյուսը թարգմանել տեքստի ամբողջ հատվածներ:
1341	science/technology	Սա կոչվում է քիմիական pH: Դուք կարող եք որպես ցուցիչ օգտագործել կարմիր կաղամբի հյութը:
336	entertainment	Որպես վերջաբան՝ թուրքական Անատոլիայի կրակ պարային խումբը կատարեց «Տրոյա» ներկայացումը:
1005	entertainment	2017 թվականի վերջին Սիմինոֆը հայտնվեց QVC-ի հեռուստաշուկայի ալիքի եթերում:
1671	science/technology	Ուղեղի պաթոլոգիայի և վարքագծի միջև փոխադարձ կապն աջակցում է գիտնականներին իրենց հետազոտության հարցում։
1597	science/technology	Հերշին և Չեյզին օգտագործել են ֆաժեր և վարակներ՝ իրենց սեփական ԴՆԹ-ն մանրէի մեջ փոխպատվաստելու համար:
1008	health	Հակամարմնի մեկ կոկտեյլը՝ Զմապ, ի սկզբանե խոստումնալից էր թվում ոլորտում, բայց պաշտոնական ուսումնասիրությունները ցույց տվեցին, որ այն ավելի քիչ օգուտ ունի, քան մահը կանխելու փորձը:
1313	health	Մինչ նա աշխատում էր հիվանդանոցում, Լիգինսն իր ազատ ժամանակի ընթացքում սկսեց ուսումնասիրել վաղաժամ ծննդաբերությունները։
665	travel	«Բնորոշ» այցելությունը ներառում է թռիչք դեպի Օռլանդո միջազգային օդանավակայան, ավտոբուսով ժամանում այնտեղ գտնվող Դիսնեյ հյուրանոց, Դիսնեյի տարածքն առանց լքելու մոտ մեկ շաբաթ անցկացում այնտեղ և տուն վերադարձ։
242	geography	Բացի երեք կարևոր գիտական գործիքներից՝ լուսնային զոնդը կրում էր նաև իր բոլոր կողմերին նկարված՝ Հնդկաստանի ազգային դրոշի պատկերը:
383	politics	Այս նավատորմի ղեկավարն էր հավակնոտ նորվեգացի Օլաֆ Թրիգվասսոնը, ով նպատակ ուներ հետ նվաճելու իր երկիրը դանիական տիրապետությունից:
954	travel	Թուրքական ավիաընկերությունը 2014 թվականի դրությամբ 39 ուղղություններով թռիչքներ է իրականացնում 30 աֆրիկյան երկրներում:
979	travel	Սրանք կարող են վտանգավոր լինել, եթե ճանապարհորդը հետևում է պատրանքին՝ վատնելով թանկարժեք էներգիան և մնացած ջուրը:
217	sports	Քվեարկությունը դեռևս պետք է վավերացվի ողջ Միջազգային օլիմպիական կոմիտեի կողմից հոկտեմբերին Կոպենհագենում սպասվող հանդիպման ժամանակ:
1036	travel	Իր ճանապարհորդության ընթացքում Իվասակին անախորժությունների հանդիպեց բազում իրավիճակներում:
1583	health	ՑՍ-ն այնպիսի հիվանդություն է, որ բացասական է անդրադառնում նյարդային համակարգի վրա, որը կազմված է ուղեղից, ողնուղեղից և տեսողական նյարդից:
1063	sports	Միջին օղակում զարկիչով պայքարողներ Սաչին Տենդուլկարը և Ռահուլ Դրեյվիդը լավ արդյունք ցուցադրեցին և գործընկերական համաձայնության եկան։
458	science/technology	Սա դժվարացնում է ոչ թանկարժեք խոշորացնող ոսպնյակների՝ առանց լուսարձակման օգտագործումը ցածր լուսավորության պայմաններում։
831	travel	Գիշերային գնացքներում անձնագրերը կարող է հավաքել ուղեկցորդը, որպեսզի ստիպված չլինեք ձեր քունն ընդհատել:
220	sports	Չնայած իր մեկնաբանություններին՝ նա ասաց, որ 2012 թվականին Լոնդոնում կայանալիք Օլիմպիական խաղերին աջակցելու է բրիտանացի մրցակիցներին:
1119	health	Պատահարից հետո Գիբսոնին տեղափոխեցին հիվանդանոց, սակայն կարճ ժամանակ անց մահացավ:
1650	geography	Այս կողմում կարող են ավելի շատ լինել ժայթքումներ, որովհետև արտաքին կեղևն ավելի բարակ է։ Լավայի համար ավելի հեշտ էր դուրս ցայտել մակերևույթի վրա։
813	sports	Քիչ պատրաստություններ են հարկավոր դյուրին արահետով մեկ օրվա արշավի համար, և ցանկացած չափավոր ֆիզիկական պատրաստվածություն ունեցող անձ, կարող է վայելել դա:
1353	science/technology	Տեզերքում արբանյակ կամ աստղադիտակ տեղադրելու համար անհրաժեշտ է 100 ոտնաչափ երկարությամբ հսկայական հրթիռ:
925	science/technology	Եթե ինչ-որ բան պարզապես արգելվում է լուսանկարել, այդ պարագայում դուք չպետք է անգամ մտածեք դրա տեսանկարման մասին:
1164	science/technology	ASUS Eee համակարգիչը, որն ավելի վաղ թողարկվել է ամբողջ աշխարհում մատչելիության և գործառական գործոնների համար, դարձել է 2007 թ. Թայպեյի IT ամսվա ամենաքննարկվող թեման:
273	health	Կա մտահոգություն, որ հիվանդներն իրենց առօրյայում կարող են շարունակել վարակել ավելի շատ մարդկանց, եթե գրիպի ախտանշանները թեթև մնան:
947	geography	Օնեգա լիճը նաև միացած է Վոլգային, ուստի Կասպից ծովից Ռուսաստանի միջով գալը նախկինի պես հնարավոր է:
1191	politics	Բախմաննը, ով հաղթեց Ամեսի նախնական ընտրություններն օգոստոսին, որոշեց ավարտել իր քարոզարշավը։
1070	politics	Այն պահից ի վեր, երբ դաշնային կառավարությունը քայլեր ձեռնարկեց Թասմանիայի Դեվոնպորտում Մերսի հիվանդանոցի ֆինանսավորման ուղղությամբ, նահանգային կառավարությունը և դաշնային որոշ պատգամավորներ քննադատեցին այս արարքը՝ այն որակելով որպես նոյեմբերին կայանալիք դաշնային ընտրությունների նախաբան:
497	health	Նրանք հմտացան անդամահատման գործում՝ հիվանդներին ոսկրախտից, ինչպես նաև արյան հոսքը դադարեցնելու նպատակով կիրառվող լարաններից և զարկերակային սեղմակներից փրկելու համար:
1914	travel	Ֆինլանդիան մեծ նավային վերջնակայան է:» Հազար լճերի երկիրը» նաև հազարավոր կղզիներ ունի լճերում և մերձափնյա կղզիախմբերում:
360	science/technology	Հաջորդ նկարը ցույց է տալիս, թե ինչպես են ատոմներն արտանետում ֆոտոնները: Անշուշտ, իրականում ֆոտոնները շատ ավելի փոքր են, քան պատկերված են նկարում:
1549	politics	Միևնույն ժամանակ գերմանական նավատորմը, որ գլխավորապես իր սուզանավերն էր օգտագործում, փորձում էր փակել այս ուղին:
186	travel	Ավտոբուսն ուղևորվեց դեպի Միսսուրի նահանգի Սիքս Ֆլեգս Սեինթ Լուիս զվարճանքների պուրակ, որպեսզի խումբը նվագեր բոլոր տոմսերը գնած ամբոխի համար։
598	science/technology	Անգլիացի կենսաբան Ռոբերտ Հուկը խցանի մեջ մանրադիտակով նկատել է փոքրիկ քառակուսիներ:
163	travel	«Ավենջեր» դասի հակաականային նավն ուղևորվում էր Փալավանի Պուերտո Պրինցեսա:
537	travel	Եթե ինչ-որ մեկի որոշակի վայր այցելելու նպատակը այնտեղի պատմությանն ու մշակույթին ծանոթանալն է, ապա զբոսաշրջության այս տեսակը հայտնի է որպես մշակութային զբոսաշրջություն:
365	science/technology	Դա տեղի է ունենում այն պատճառով, որ վարդակ մուտք գործող էլեկտրականությունը, որտեղ լամպի մետաղական մասն է ամրանում, կարող է ուժեղ էլեկտրական ցնցման պատճառ դառնալ, եթե դիպչեք վարդակի ներսի մասին կամ լամպի մետաղական հիմքին, քանի դեռ այն մասամբ վարդակի մեջ է:
918	science/technology	Սմարթֆոնների GPS նավիգացիայի ծրագրերը ամենահեշտ և ամենահարմար տարբերակը կարող է լինել ճանապարհորդելու համար, երբ ձեր հայրենիքից դուրս եք:
944	travel	Այն նաև լավ եղանակ է բյուջեն բավականացնելու համար` թույլ տալով ավելի երկար այց որևէ վայրում, քանի որ բազմաթիվ կամավորական աշխատանքների համար տրամադրվում են սենյակ և սնունդ, իսկ մի քանիսն էլ մի փոքր աշխատավարձ են վճարում:
1856	travel	Քանի դեռ այս գոտում եք մնալու, որպես կանոն կարող եք հատել սահմանները՝ առանց կրկին անգամ անձնագրային ստուգման կետերն անցնելու:
10	politics	Բողոքի ակցիան ժամը 11:29-ի կողմերը շարժվեց Ուայթհոլի ուղղությամբ, Սթրենդի երկայնքով անցավ Թրաֆալգարյան հրապարակը՝ կտրելով Ալդուիչը և բարձրանալով Քինգսուեյով դեպի Հոլբորն, որտեղ Պահպանողականների կուսակցությունը անց էր կացնում իր գարնանային ֆորումը Grand Connaught Rooms հյուրանոցում:
893	geography	Դրանք այնքան էլ թեթևաշարժ չեն, ուստի այնպես որ սարահարթին հասնելու համար արահետը պետք է որ երկար շրջադարձ կատարի տրանսանտարկտիկական լեռների շուրջ։
282	politics	Ցույցեր են տեղի ունեցել նաև Փարիզում, Սոֆիայում՝ Բուլղարիա, Վիլնյուսում՝ Լիտվա, Վալետայում՝ Մալթա, Թալինում՝ Էստոնիա և Էդինբուրգում ու Գլազգոյում՝ Շոտլանդիա:
1362	science/technology	Առյուծների պրայդներն ավելի շատ հանդես են գալիս որպես գայլերի կամ շների խմբեր, կենդանիները պահվածքով զարմանալիորեն նման են առյուծներին (բայց ոչ այլ մեծ կատվազգիներին) և նաև շատ մահացու իրենց որսի համար։
530	sports	Գոլֆը խաղ է, որտեղ խաղացողներն օգտագործում են մահակներ գնդակներն անցքերը գցելու համար:
730	travel	Ճշմարիտ համայնքը տեղակայված է Հոու Սաունդում՝ Վանկուվերից մի փոքր հեռու և հեշտ հասանելի է ջրային տաքսիների միջոցով, որոնք մեկնում են Գրանվիլ կղզուց՝ Վանկուվերի ստորին հատվածից:
840	entertainment	Այնուամենայնիվ, գրեթե վերոնշյալ բոլոր խաղատները մատուցում են խմիչքներ, և նրանցից ոմանք ունեն անուն ապրանքանշային զվարճանքներ (հիմնականում մեծերը, որոնք անմիջապես շրջապատում են Ալբուկերկեն և Սանտա Ֆեն):
698	travel	Էկվադորը պահանջում է, որ կուբացի քաղաքացիները հրավեր-նամակ ստանան նախքան միջազգային օդանավակայանների կամ սահմանային անցակետերի միջոցով երկիր մուտք գործելը:
1826	travel	Եթե դուք սովոր չեք երթևեկելու գյուղական ճանապարհներին, ապա պահեք ձեր զգացողությունները ձեր մեջ. գերակշիռ են զառիթափները, նեղ արահետները և կտրուկ շրջապտույտները։
339	health	Նրան անմիջապես այցելեց ճանապարհին գտնվող բժշկական անձնակազմը և նրան տեղափոխեցին տեղի հիվանդանոց, որտեղ նա ավելի ուշ մահացավ:
226	science/technology	Իր գոյությունը միայն հայտնի է տիեզերքի ընդարձակման վրա ունեցած իր ազդեցությունների պատճառով:
24	sports	Վաշինգտոնի ընդդեմ Ատլանտա Տրեշերզի 5-3 հաշվով հաղթանակի ժամանակ նա 2 գոլ էր խփել և 2 գոլային փոխանցում կատարել:
1117	entertainment	Նրա 1 000-րդ նամականիշը 2000 թվականին վեհաշուք «շվեդ թագավորների մեծագույն սխրանքներ»-ն էր Դեյվիդ Քլյոքեր Էհրենսթրահլի կողմից, որն ընդգրկվել է Գինեսի ռեկորդների գրքում:
1792	entertainment	Հիշեք, նույնիսկ եթե հիմնական բեմերում երաժշտությունն ավարտվել է, կարող են փառատոնի որոշ հատվածներ լինել, որոնք երաժշտությունը կշարունակեն մինչև ուշ գիշեր:
674	travel	Հարավային Աֆրիկան ավտոմեքենայով բացահայտելը հիանալի միջոց է շրջանի ամբողջ գեղեցկությունը տեսնելու համար, ինչպես նաև հայտնվելու զբոսաշրջիկների սովորական երթուղիներից դուրս գտնվող վայրերում։
1098	health	Այդուհանդերձ, տուբերկուլյոզով հիվանդների ամբողջ խմբում բազմաթիվ դեղերի հանդեպ տվյալ հիվանդների կայունության տոկոսը դեռևս մնում է ցածր՝ Հարավային Աֆրիկայում ընդհանուր 330,000 վարակվածից 6000 հոգի որևէ կոնկրետ պահի:
892	travel	Այն ճեղքվածքներով լցված և դրոշներով մակնշված ձյուն է։ Այն կարող է ճանապարհորդել միայն մասնագիտացված տրակտորների, ձգվող սահնակների միջոցով վառելիքի և պաշարների առկայության պայմաններում:
380	science/technology	Հետո՝ մի քանի տարի անց, 1639 թվականին, Ջերեմիա Հորոքս անունով մի անգլիացի աստղագետ նկատեց Վեներայի տարանցումը:
921	science/technology	Ամեն անկյունային խանութ լցված է կանխավճարային քարտերի շփոթեցնող բազմազանությամբ, որոնք կարող են օգտագործվել վճարային ապարատներից կամ սովորական հեռախոսներից։
65	politics	Ցուցարարները հույս ունեն, որ կհավաքագրեն 1,2 միլիոն ստորագրության խնդրագիր, որպեսզի նոյեմբեր ամսին ներկայացնեն Ազգային կոնգրեսում:
912	science/technology	Չկա որևէ պահանջ, որ դուք ստանաք տեղական համար այն համայնքից, որտեղ ապրում եք․ կարող եք ունենալ արբանյակային ինտերնետ կապ Ալյասկայի Չիքընի վայրի անտառներում և ընտրել համարը, որը պնդում է, որ արևոտ Արիզոնայում եք:
987	geography	Այս բարձրավանդակները հաճախ անվանում էին «վիդի»՝ նշանակելով լայն, բաց ծառազուրկ տարածք, անծայրածիր տարածություն։
819	travel	Երբ ճանապարհորդում եք, ակնկալեք, որ ոչ ամեն ինչ է նույնը լինելու, ինչ «տանը»: Վարվելաձևը, օրենքները, սնունդը, երթևեկությունը, կացարանը, չափանիշները, լեզուն և այլ բաներ ինչ-որ չափով կտարբերվեն ձեր բնակավայրից:
798	travel	Նաև տվե՛ք քաղաքականության/կոնտակների պատճենները հայրենիքում գտնվող այն տուրիստական ընկերություններին և հարազատներին կամ ընկերներին, ովքեր պատրաստակամ են օգնել:
1035	science/technology	Որքան փոքր է Ռոսբիի թիվը, այնքան աստղը մագնիսական հակադարձության առումով ավելի քիչ գործուն է:
1228	entertainment	Երկրով մեկ հայտնի երգիչները Շրի Շյամի ոտքերի առջև ներկայացրեցին բհաջաներ կամ կրոնական երգեր:
1039	science/technology	Սա թույլ կտա հետադարձ համատեղելիություն ունենալ 802․11ա, 802.11բ և 802.11է կետերի հետ, պայմանով, որ բազային կայանն ունենա երկակի ռադիոներ:
1375	science/technology	Բույսերն ստեղծում են թթվածին, որը շնչում են մարդիկ, և դրանք ներշնչում են ածխաթթու գազ, որը մարդիկ արտաշնչում են (այն է` օդը դուրս բերում):
772	entertainment	Միջազգային տոնավաճառը (սովորաբար անվանում են Միջազգային տոնավաճառ կամ ուղղակի Էքսպո) գիտության և արվեստի մեծ միջազգային փառատոն է:
735	travel	Սիրենան միակ անտառապահ-կայանն է, որը քեմփինգից բացի` առաջարկում է քնելու հարմարություններ և տաք ճաշատեսակներ: Լա Լեոնան, Սան Պեդրիլլոն և Լոս Պատոսն առաջարկում են միայն քեմփինգի հնարավորություն` առանց սննդի ծառայության:
