index_id	category	text
866	travel	Եթե առաջին անգամ եք ճամփորդում զարգացող երկիր կամ աշխարհի նոր մաս, մի թերագնահատեք մշակութային հնարավոր ցնցումը:
1809	sports	Պարաօլիմպիկ խաղերը տեղի կունենան 2021 թ. օգոստոսի 24-ից սեպտեմբերի 5-ը: Ճապոնիայի այլ վայրերում իրականացվելու են մի քանի միջոցառումներ:
119	entertainment	Խաղը հիմնված է Ֆալլուջահի Երկրորդ ճակատամարտի վրա՝ կատաղի մարտ ամերիկացի ու իրաքյան զորքերի միջև։
1175	sports	Սփրինգբոքսների համար դա ավարտվեց հինգ խաղ անընդմեջ պարտությամբ։
198	health	«Բացի ջերմությունից և կոկորդի ցավից, ես լավ եմ զգում և լավ մարզավիճակում եմ, որպեսզի հեռահաղորդակցման միջոցով կատարեմ իմ աշխատանքը:
144	science/technology	Դա նշանակում է, որ ամեն ինչ պետք է հետ վերադարձվի»,- նշեց Բերհեյն Ասֆոուն, որը Տեկտոնական Հովտի ուսումնասիրությունների ծառայության հետազոտողը և ուսումնասիրության համահեղինակն է:
1167	entertainment	Իր սկզբնական օրերին, շոուն ցուցադրվում էր միայն երկար ժամանակ գործող համացանցային ռադիո կայքով՝ ԹոջիՆեթ ռադիո, որը կենտրոնացած էր զրույցներ ապահովող ծրագրերի վրա:
908	science/technology	Լրատվական ընկերությունները պարբերաբար ստում են այդ մասին՝ պնդելով որ դա պետք է «կանխի ծովահենությունը»։
1196	sports	Օրն ընդամենը տասնութ մեդալի առկայության պայմաններում մի շարք երկրներ չկարողացան մեդալների շնորհման հարթակ բարձրանալ:
111	science/technology	«Այն կշարժվի հյուսիսային Կալիֆորնիայի արևմտյան ափի երկայնքով և կփայլատակի երկնքում Կալիֆորնիայից մինչև կենտրոնական Օրեգոն, Նեվադայով և Այդահոյով և կհասնի Յուտա»,- նշեց Սթարդասթ ծրագրի ղեկավար Թոմ Դաքսբրին:
1722	travel	Ինչպես Հարավային Աֆրիկայի ազգային բոլոր զբոսայգիների պարագայում, գործում են պահպանության և մուտքի օրական վճարներ:
1989	travel	Նաև մի քանի ավտոբուս կա, որոնք գնում են հյուսիս՝ Հեբրոն, որն աստվածաշնչային նախահայրերի Աբրահամի, Իսահակի, Հակոբի և նրանց կանանց ավանդական թաղման վայրն է:
512	health	ՈՒԴԽ ազդում է հասակակիցների հետ հարաբերությունների վրա, որովհետև այլ երեխաներ չեն կարողանում հասկանալ, թե ինչու են իրենք հենց այդպես վարվում, կամ ինչու են իրենք հենց այդպես բառերն արտաբերում, կամ որ իրենց հասունության մակարդակը տարբեր է:
1182	health	Ֆրանսիան այս վիրուսով տառապող՝ Եվրոպական Միության յոթերորդ երկիրն է՝ Ավստրիայից, Գերմանիայից, Սլովենիայից, Բուլղարիայից, Հունաստանից և Իտալիայից հետո:
393	politics	Գերմանիան հարձակման ծածկագիրը դրեց «Օպերացիա ծովային առյուծ»: Բրիտանական զորքը ծանր զենքերի և պահուստի մեծամասնությունը կորցրել էր, երբ այն էվակուացվեց Դանքըրքից, հետևաբար, բանակը չափազանց թույլ էր:
1908	science/technology	Ծառայությունը հաճախ օգտագործվում է բեռնափոխադրման, այդ թվում զբոսանավի, ինչպես նաև արշավախմբերի կողմից, որոնց տվյալները հեռավար են ստացվում և ունեն ձայնային կարիքներ:
592	science/technology	Կենդանիները ստեղված են բազմաթիվ բջիջներից: Նրանք ուտում են տարբեր բաներ և դրանք մարսում իրենց ներսում: Կենդանիներից շատերը կարող են տեղաշարժվել:
550	sports	Ձմռանը որոշ արգելարշավներ՝ համակցված մարմնի վերին մասի մարմնամարզությամբ, վազքի մրցաշրջանի լավագույն պատրաստումն են համարվում։
1210	entertainment	1980-ականներին նա աշխատում էր այնպիսի շոուներում, ինչպես, օրինակ, Տաքսին, Չիըրզը և Թրեյսի Ուլմենի շոուն:
1232	entertainment	Լաքքա Սինգը ներկայացրեց Չապպան Բհոգ Բհաջանին նույնպես։ Երգիչ Ռաջու Խանդելվալը նրան ուղեկցում էր։
1891	travel	Ճանապարհորդները, ովքեր հեշտ են հարմարվում նոր մշակույթին, երբեմն առանձնապես դժվար են նորից հետ հարմարվում իրենց հայրենի մշակույթին։
1798	entertainment	Որոշ տեղերում հենց տան մեջ առաջարկում են ալկոհոլային խմիչքներ: Սակայն հարբեցողությունը մշուշում է դատողությունը, և բոլոր լավ խաղամոլները գիտեն սթափ մնալու կարևորությունը:
738	travel	CafeNet El So-ն ամրագրման ծառայություն է առաջարկում 30 ԱՄՆ դոլարի դիմաց կամ միանգամյա անցաթղթեր 10 ԱՄՆ դոլարի դիմաց, մանրամասներն իրենց Կորկովադո էջում են:
1298	politics	Երբեմն կատաղի ցույցերի համար շարժառիթ էր դառնում ընտրություններն անցկացնելու ձախողումը, որոշները՝ սկսած 2011 թվականից:
577	science/technology	Բջիջը բոլոր կենդանի օրգանիզմների հիմնական միավորն է, իսկ բոլոր օրգանիզմները բաղկացած են մեկ կամ մի քանի բջջից:
733	sports	Ձմռանը Հյուսիսային Ամերիկայում վայելեք ամենալավ դահուկավազքերից մի քանիսը, իսկ ամռանը զբաղվեք իրական լեռնային հեծանվասպորտով։
1624	geography	Մոլորակի գետերի՝ օվկիանոս լցվող ջրի լիարժեք 20 տոկոսը հոսում է Ամազոնից:
185	sports	Բոլոնիայիա դեմ կիրակի օրը նախատեսված խաղից առաջ նա մնում էր թիմի հյուրանոցում:
1158	geography	Դրանց ջերմային վարքագիծն այնքան հաստատուն չէ, որքան Երկիր մոլորակի մեծ քարանձավներինը, որոնք հաճախ պահպանում են բավականին կայուն ջերմաստիճան, սակայն այն համապատասխանում է գետնի խոր անցքերի հետ», - ասաց Միացյալ Նահանգների երկրաբանական հետազոտության (ՄՆԵՀ) աստղաերկրաբանության թիմի և Արիզոնայի Ֆլեգստաֆում տեղակայված Հյուսիսային Արիզոնա համալսարանի ներկայացուցիչ Գլեն Քուշինգը:
190	travel	Ուղևորներին ջուր տրվեց, քանի դեռ նրանք սպասում էին 90(Ֆ) աստիճան շոգին։
1233	entertainment	Հինգշաբթի օրը՝ Տոկիոյի խաղերի շոուի հիմնական ներկայացման ժամանակ, Նինթենդոյի նախագահ՝ Սատորու Իվատան հրապարակայնորեն ներկայացրեց ընկերության նոր Նինթենդո Րեվըլյուշն բարձակի կառավարման վահանակի ձևավորումը:
1548	politics	Սրա հետ կապված վերջին ուշագրավ օրինակներից մեկը Երկրորդ Համաշխարհային պատերազմի ժամանակ հյուսիսատլանտյան ռազմական գործողությունն էր։ Ամերիկացիները Բրիտանիային օգնելու նպատակով՝ փորձում էին Ատլանտյան օվկիանոսի միջով մարդկանց և նյութեր տեղափոխել։
647	entertainment	Մեզանից շատերը գտնում են, որ դիտում են հեռուստատեսային շոուներ, որոնք մեզ տեղեկացնում են որևէ գործընթացի կամ փորձի մասին, որին մենք երբեք մասնակցություն չենք ունենա կամ այդ գիտելիքը չենք կիրառի:
1522	science/technology	Քսաներորդ դարի ուսումնասիրությունները ցույց են տվել, որ գոյություն ունի գենետիկ տատանումների երկու տարատեսակ՝ թաքնված և արտահայտված:
601	science/technology	Որպես գազ` ազոտն ունի այն նույն առանձնահատկությունները, ինչ հեղուկ ազոտը: Հեղուկ վիճակն ավելի խիտ է, սակայն մոլեկուլները միևնույն է՝ նույնն են:
1747	sports	Արգենտինան հայտնի է որպես աշխարհի լավագույն պոլոյի թիմ և խաղացողներ ունեցող երկրներից մեկը:
142	sports	Բասկետբոլի ազգային ասոցիացիայի (NBA) որոշմանը հետևեց յուտացի ջազ նվագողի մոտ կորոնավիրուսի (COVID-19) վարակի թեստի դրական արդյունքը:
1802	travel	Տեսանելիությունը կարող է նաև սահմանափակվել մեքենայի պատուհաններին տեղացող կամ փչող ձյան կամ դրանց թանձրանալու կամ դրանց վրա եղող սառույցի պատճառով:
825	travel	Եթե ցանկանում եք տեսնել աշխարհը մատչելի տարբերակով անհրաժեշտությունից, ապրելակերպից կամ մարտահրավերից դրդված, դա անելու մի շարք ուղիներ կան:
1144	politics	Տեղանքն ապահովելու համար խմբավորումը և աֆղանական զորքերը տեղափոխվեցին տվյալ տարածք, և մեկ այլ խմբավորման ինքնաթիռներ ուղարկվել են օգնության նպատակով:
1850	sports	Դահուկներով բեքփեքինգ. այս զբաղմունքը նաև կոչվում է հեռավոր ուղիներով անցնող դահուկավազք, դահուկներով ուղևորություն կամ դահուկարշավ:
1033	science/technology	Նրանք բացահայտել են, որ արևը գործել է այն նույն հիմնական սկզբունքներով, ինչ մյուս աստղերը. պարզվել է, որ համակարգի բոլոր աստղերի գործունեությունը խթանվել է իրենց լուսավորության, իրենց պտույտի միջոցով և ուրիշ ոչնչի:
1848	sports	Դահուկասահքի գաղափարը շատ հին է. քարանձավային նկարները պատկերում են դահուկորդներին Քրիստոսի ծնունդից դեռ 5 000 տարի առաջ:
228	geography	Այս բեկորները գտնվել էին ամբողջ լուսնի վրա և, ըստ ամենայնի, նվազագույն չափով են հողմահարվել՝ մատնանշելով, որ դրանք ստեղծող երկրաբանական իրադարձությունները բավականին վերջերս էին տեղի ունեցել։
292	geography	Արձանագրվել էր, որ լեռան ստորոտին հայտնվել էին մուգ ամպեր, որոնք չէին առնչվում որևէ հրաբխային գործողության:
1225	sports	Դել Պոտրոն փոքր առավելություն ուներ երկրորդ խաղափուլում, բայց հաղթողին որոշելու համար 6-6 հաշվից հետո անհրաժեշտ էր ևս մեկ թայ-բրեյք:
1416	sports	Հայտնի սպորտաձևերի թվում են ֆուտբոլը, բասկետբոլը, վոլեյբոլը, ջրի գնդակը, սուսերամարտը, ռեգբին, հեծանվավազքը, սառույցի հոկեյը, անվաչմուշկներով հոկեյը և F1 ավտոմրցարշավը:
129	entertainment	Քաղաքն առաջինը կլինի հարավարևելյան Եվրոպայում, որտեղ այս տարվա հունիսից օգոստոս ընկած ժամանակահատվածում կանցկացվի հանրային արվեստի աշխարհի ամենամեծ միջոցառումը՝ «CowParade»-ը:
1003	science/technology	Նա դռան WiFi զանգ կառուցեց, ասաց նա։
271	health	Պարոն Լին նաև արտահայտեց իր մտահոգությունն այն զեկույցների վերաբերյալ, որ Թուրքիայում երեխաներն առանց հիվանդանալու այժմ վարակվում են A (H5N1) թռչնագրիպի հարուցիչով։
103	politics	Հեռուստատեսության ուղիղ եթերով հեռարձակվող մեկնաբանություններն առաջինն էին, որոնցով իրանական բարձրաստիճան աղբյուրներն ընդունեցին, որ պատժամիջոցներն ինչ-որ ազդեցություն ունենում են։
14	sports	Խաղից հետո Կավի արքան ասաց․«Ես պարզապես հուզված եմ, որ հնարավորություն եմ ունեցել վերադառնալ ամենակարևոր իրադարձությունների վերջին խաղափուլերին։ Ես այստեղ եմ՝ փորձելու հաղթել սա»։
1412	politics	Կոնգրեսը չուներ լիազորություններ հարկեր հարկադրելու, և քանի որ չկար որևէ գործադիր կամ դատական ազգային մարմին, այն հույսը դնում էր նահանգային իշխանությունների վրա, որոնք հաճախ հրաժարվում էին համագործակցել՝ իր բոլոր օրենքները կիրառելու նպատակով։
1811	travel	Եթե դուք ամրագրել եք ձեր տոմսերը և կեցությունը 2020 թվականի համար մինչև հետաձգման մասին հայտարարվելը, ապա կարող եք առերեսվել բարդ իրավիճակի հետ:
1681	science/technology	Տեխնոլոգիան առաջարկում է լուծում վիրտուալ դաշտի ուղևորություններով: Ուսանողները կարող են նայել թանգարանի մշակութային հնությունները, այցելել ակվարիումներ կամ հիանալ սքանչելի արվեստով՝ նստած լինելով իրենց դասարանում:
335	entertainment	Թուրքական դիվա Սեզեն Ակսուն ելույթ ունեցավ իտալացի տենոր Ալեսսանդրո Սաֆինայի և հույն երգիչ Հարիս Ալեքսիուի հետ։
378	science/technology	Մոտավորապես երեք հազար տարի անց՝ 1610 թ., Իտալացի աստղագետ Գալիլեո Գալիլեյը օգտագործեց աստղադիտակ ու տեսավ, որ Վեներան լուսնի նման ունի փուլեր:
1367	science/technology	Գիտնականները կարծում են, որ օցելոտները հետևում և գտնում են իրենց կեր հանդիսացող կենդանիներին (որս) հոտով՝ գետնի վրա հոտոտելով նրանց եղած բոլոր վայրերը։
703	travel	Շրջագայություններն ավելի մատչելի են մեծ խմբերի համար, ուստի, եթե դու միայնակ ես կամ միայն մեկ ընկերոջ հետ, փորձի՛ր հանդիպել այլ մարդկանց և կազմել չորսից վեց անձից բաղկացած խումբ՝ մեկ անձի համար ավելի մատչելի տարբերակ գտնելու համար:
297	politics	2011 թվականին առաջարկվող շտկումն արդեն ընդունվեց երկու պալատներում էլ:
80	sports	Մարուչիդորն այնուհետև պարտության մատնեց Քաբուլտուրին նախնական եզրափակիչում:
1823	travel	Մաքսատուրքից ազատված գնումները հնարավորություն են տալիս գնել հարկերից և ակցիզային վճարներից ազատված ապրանքներ որոշակի վայրերում։
836	travel	Ճարտարապետությունը վերաբերում է շինությունների նախագծմանն ու կառուցմանը: Որևէ վայրի ճարտարապետությունը հաճախ ինքնին ուղենիշ է:
880	travel	Հաճախ այս պահանջները կարող են կախված լինել այն երկրներից, որոնք ճանապարհորդն այցելել է կամ մտադիր է այցելել:
1143	politics	Ղեկավարող կուսակցությունը` Հարավարևմտյան Աֆրիկայի ժողովրդի կազմակերպությունը (ՀԱԱԺԿ), խորհրդարանական ընտրություններում նույնպես ձայների մեծամասնություն էր ացել էր:
650	science/technology	Ձեր հյուրանոցը կամ հյուրընկալողները (հյուրատանը կամ սեփական տանը մնալու պարագայում) ունեն wifi կամ համացանցին միացված համակարգիչ և բոլոր բնակավայրերում առկա են համացանցով սրճարաններ կամ էլ վայրեր, որտեղ հանրային wifi կա:
702	travel	Ձեր անձնագիրը պետք է վավեր լինի ձեր ճանապարհորդության օրվանից սկսած առնվազն 6 ամիս: Երկկողմանի/դեպի մուտքի երկիր տոմսն անհրաժեշտ կլինի ձեր այցի տևողությունը ցույց տալու համար:
1604	travel	Ամեն առավոտ մարդիկ մեքենաներով ծայրամասային փոքր քաղաքներից գնում են իրենց աշխատավայրեր՝ ճանապարհին հանդիպելով ուրիշների, ում աշխատավայրերը հենց այն քաղաքներն են, որտեղից իրենք հենց նոր մեկնել են:
817	sports	Արմատներ ունենալով Բարսելոնայի «Running Tours Barcelona»-ում և Կոպենհագենի «Running Copenhagen»-ում ` դրան շատ արագ միացավ «Running Tours Prague:-ը, որը գտնվում է Պրահայում և այլք:
1763	travel	Յուրաքանչյուր տարի տասնյակ այցելուներ վիրավորվում են, որովհետև չեն պահպանել բավարար հեռավորությունը: Այս կենդանիները մեծ են, վայրի և հնարավոր վտանգ են ներկայացնում, այնպես որ տվեք նրանց իրենց տարածքը:
1290	politics	Իսրայելը պահանջում է շարունակական ռազմական ներկայություն հովտում տասը տարվա ընթացքում պայմանագիրը կնքելուց հետո, մինչդեռ Պաղեստինի իրավասու մարմինները համաձայնվում են թողնել այդպիսի ներկայությանը միայն հինգ տարով:
1775	entertainment	Գլխավոր տեղական գարեջուրը «Number One»-ն է, այն պարզ գարեջուր է, բայց հաճելի ու թարմացնող բնույթ ունի: Տեղական մյուս գարեջուրը կոչվում է «Manta»։
642	science/technology	Համացանցից և համաշխարհային ցանցից օգտվելը հնարավորություն է ընձեռում օգտատերերին միշտ տեղեկություն ստանալ:
1544	politics	1939 թ. սեպտեմբերին 17-ին լեհական պաշտպանությունն արդեն փլուզված էր և միակ հույսը նահանջելն ու ռումինական պլացդարմի երկայնքով վերակազմակերպվելն էր:
1148	health	«Բժիշկներ առանց սահմանների» կազմակերպության մամուլի խոսնակ Ռիչարդ Վիրմանն ասաց. «Անգոլան անցնում է իր երբևէ ունեցած ամենավատ բռնկումը, և իրավիճակն Անգոլայում մնում է շատ վատ»,- ասաց նա:
801	health	Ոգելից խմիչքը չափավոր օգտագործեք: Ոգելից խմիչքը յուրաքանչյուրի վրա տարբեր կերպ է ազդում, և ձեր սահմանաչափն իմանալը շատ կարևոր է:
1741	travel	Նախատեսվում է, որ կամուրջը լիարժեք կգործի 2017 թ. սեպտեմբերին, երբ, ինչպես ակնկալվում է, Բրազիլիայի մաքսակետերի աշխատանքները ավարտին կհասնեն:
1140	entertainment	Չնայած Ուինֆրին իր հրաժեշտի պահին արցունքներն աչքերին էր՝ իր երկրպագուներին հստակ նշան արեց, որ կվերադառնա։
1267	health	Էդգար Վեգիլլան բազկի և ծնոտի վերքեր ստացավ, մինչդեռ Քրիստոֆեր Շնեյդերին թողեցին հիվանդանոցում, քանի որ դեմքի վերականգնողական վիրահատության կարիք ուներ։
1774	entertainment	Սրանք երբեմն լեփ-լեցուն ընտանեկան լողափներ են՝ ծովափով ձգվող բազմաթիվ տարատեսակ խանութներով: Լողալն ապահով է:
862	health	Սակայն աշխարհի այլ հատվածներում, որտեղ մանրէաբանական կենդանական աշխարհը նոր է քեզ համար, դու ավելի հավանական է, որ խնդիրներ կունենաս:
1069	politics	Լայթոնը վարչապետի հետ տեղի ունեցած հանդիպման ընթացքում խնդրել էր փոփոխություններ կատարել պահպանողականների՝ շրջակա միջավայրին առնչվող օրինագծում` խնդրելով Պահպանողականների կուսակցության շրջակա միջավայրի օրինագծի «ամբողջական և մանրակրկիտ վերաշարադրում»:
325	geography	Փոթորիկների ազգային կենտրոնի գիտնականները կանխատեսում են, որ մինչև չորեքշաբթի Դանիելլեն կուժգնանա` վերածվելով փոթորկի:
1314	health	Նրա հետազոտության համաձայն պտղի սաղմնային թոքերի հասունացումը կարելի է արագացնել մեկ հորմոնի կառավարման օգնությամբ:
704	travel	Այնուամենայնիվ, սա չպետք է անհանգստություն պատճառի ձեզ, որովհետև զբոսաշրջիկները հաճախ վխտում են շուրջբոլորը՝ մեքենաները լցվելու համար:
528	sports	Սուսերամարտի ժամանակակից սպորտաձևը խաղում են բազմաթիվ մակարդակներում` սկսած համալսարանում սովորող ուսանողներից մինչև արհեստավարժություն և Օլիմպիական մրցումներ:
532	sports	Հաղթում է այն խաղացողը, ով դասընթացն ավարտելու համար ամենաքիչն է հարվածում կամ ցնցում ակումբը:
1643	science/technology	Մարդ կարող է միայն գուշակել, թե ինչի նման կլինի ստեղնաշարը, երբ մի ավելի նոր բան ի հայտ գա:
868	travel	Հատկապես ձեր առաջին օրերին ծախսեք արևմտյան ոճի ու բարձրակարգ հյուրանոցների, սննդի և ծառայությունների վրա, որոնք կօգնեն հարմարվելու կլիմային:
