index_id	category	text
431	geography	Թուրքիան երեք կողմից շրջապատված է ծովերով. Էգեյան ծովը` արևմուտքում, Սև ծովը` հյուսիսում և Միջերկրական ծովը` հարավում:
403	science/technology	Պատերազմի սկզբում նրանք մեծամասամբ ընթանում էին ծովի վրայով, սակայն ռադարի զարգացման և ավելի ճշգրիտ դառնալու հետ մեկտեղ, սուզանավերը ստիպված էին ջրի տակով գնալ նկատվելուց խուսափելու համար։
1592	science/technology	Հունարենի իմացության անկման հետևանքով Արևմուտքը կտրվեց իր հունական փիլիսոփայական և գիտական արմատներից:
993	entertainment	Այնուամենայնիվ դրանք ձմռան ընթացքում ունենում են այլ տեսակի գեղեցկություն և հմայք, ու բազմաթիվ լեռնային կայաններ,յան առատությամբ պայմանավորված, առաջարկում են զբաղվել դահուկասահքով և սնոուբորդով:
755	entertainment	Այս հյուրանոցներում էին կանգ առնում օրվա հարուստներն ու հայտնիները, և հաճախ բաձրակարգ սնունդ և գիշերային կյանք էին ապահովում։
1936	politics	1994-ին այս բախման արդյունքում արևելյան Մոլդովայում ստեղծվեց ինքնահռչակ Տրանսնիստրիա Հանրապետությունը, որն ունի իր իսկ կառավարությունը և դրամը, բայց ՄԱԿ-ի անդամ ոչ մի երկրի այն չի ճանաչել:
1205	health	Հիվանդության գծով ՄԱԿ-ի փորձագետ Դանիել Լանտեյնը նշեց, որ հավանաբար խաղաղապահների պատճառով է տեղի ունեցել բռնկումը:
1692	geography	Ավելի հյուսիս ընկած մեծ տարածքները նոսր են բնակեցված, իսկ որոշները գրեթե անբնակ անապատներ են:
280	politics	Բողոքի ցույցի կազմակերպիչներն ասացին, որ մոտավորապես 100 000 մարդ է մասնակցել ցույցերին գերմանական այնպիսի քաղաքներում, ինչպիսիք են Բեռլինը, Քյոլնը, Համբուրգը և Հանովերը:
247	politics	Այս գործակալները պատասխանատվություն են կրում ապահովելու կառավարական և դատական ծառայություններ՝ ըստ Պակիստանի Սահմանադրության N247 հոդվածի:
1439	politics	Վայրագությունների սկսելուց անմիջապես հետո, Բրիտանիան սկսեց Գերմանիայի ծովային շրջափակումը:
1239	entertainment	«Նա շատ լավիկն է, նաև բավականին լավ երգում է, նա ասաց` լուրերի համաժողովի մի գրության համաձայն:
743	geography	Կուկի կղզիները չունեն քաղաքներ, սակայն բաղկացած են 15 տարբեր կղզիներից: Գլխավոր կղզիները Ռարոտոնգան և Աիտուտակին են:
18	politics	Ողջ աշխարհով մեկ տեղի էին ունենում բողոքի ցույցեր, մի քանի քրեական հետապնդումներ, և թե՛ Իսլանդիայի, թե՛ Պակիստանի կառավարությունների ղեկավարները հրաժարական տվեցին:
1344	science/technology	Ջրածնի իոնները պրոտոններ են, որոնց էլեկտրոններն անջատված են իրենցից (քանի որ ջրածնի ատոմները բաղկացած են մեկ պրոտոնից և մեկ էլեկտրոնից):
688	travel	Սահմանափակ ժամանակ ունեցող այցելուներն ավելի լավ կլինի իրենց ժամանակը ծախսեն մեկ այլ վայրում:
556	science/technology	Ատոմը կարող է համարվել ողջ մատերիայի կառուցման հիմնարար տարրերից մեկը:
1645	science/technology	Ծանր սայլը բլուրն ի վեր պտտելու նման մի բան է: Միջուկը կրկին պառակտելով՝ այնուհետև արձակում է այդ էներգիայի մի մասը:
907	science/technology	Դրանք սովորաբար առաջարկում են ավելի բարձր թողունակություն և սպասարկման ավելի լավ որակ: Դրանք գաղտնագրված են, և հետևաբար ավելի բարդ է լրտեսել դրանց:
1071	politics	Բայց վարչապետ Ջոն Հովարդն ասել է, որ ակտով նախատեսված էր հավելյալ 45 միլիոն ավստրալիական դոլարի լրացուցիչ օժանդակություն տրամադրել՝ միայն հիվանդանոցի հարմարությունները Թասմանյան կառավարության կողմից քայքայվելուց պահպանելու համար:
555	sports	Մարզիկները կարող են զգալ, որ նրանք նախընտրում են որևէ ապրանքատեսակ, նույնիսկ երբ այն ոչ մի իրական օգուտ իրենց չի տալիս:
1203	health	Նախքան զորքերի ժամանումը Հայիթին 1800 թ.-ից ի վեր երբեք չի առնչվել հիվանդության հետ կապված խնդիրների հետ:
58	politics	Ոստիկանությունը հայտնեց, որ Լո Պիկոլոն ուներ արտոնյալ կարգավիճակ, քանի որ նա Պրովենցանոյի աջ ձեռքն էր Պալերմոյում, և իր հարուստ փորձը նրան տվել էր ավագ սերնդի ղեկավարների հարգանքը, քանի որ նրանք հետևում էին Պրովենցանոյի քաղաքականությանը՝ հնարավորինս քիչ աղմուկ բարձրացնելով՝ ուժեղացնել իրենց ուժային ցանցը:
1764	travel	Բացի դրանից՝ իմացեք, որ արջերին և այլ վայրի կենդանիների գրավում են հոտերը, ուստի խուսափեք հոտավետ ուտելիքներ ունենալուց կամ պատրաստելուց և մաքուր պահեք ճամբարը:
195	sports	Մասսան նախատեսվում է թողարկել գոնե 2009 մնացած խաղաշրջանի համար:
1785	travel	Նախապես ամրագրումը ճանապարհորդին տալիս է մտքի հանգստություն, որ նպատակակետ հասնելուն պես կունենան քնելու տեղ:
600	science/technology	Տարրերը և միացությունները կարող են մի վիճակից մեկ այլ վիճակի վերածվել և չփոփոխվել:
553	sports	Միջին հեռավորության վազքը հարաբերականորեն ոչ թանկարժեք սպորտաձև է, ինչևէ, մասնակցության համար անհրաժեշտ սարքավորումների մի քանի մասերի առնչությամբ կան շատ թյուրըմբռնումներ։
1720	geography	Այգին ընդգրկում է 19,500 քառակուսի կիլոմետր տարածք և բաժանված է 14 տարբեր էկոգոտիների, որոնցից յուրաքանչյուրն աջակցում է վայրի բնության տարբեր ճյուղերի:
1622	geography	Ամազոն գետն իր երկարությամբ երկրորդ, իսկ մեծությամբ առաջին գետն է Երկրի վրա: Դրանով 8-ից ավել անգամ շատ ջուր է հոսում, քան Երկրի` իր մեծությամբ երկրորդ գետով:
1441	politics	Բրիտանիան պեղում էր միջազգային ջրերը՝ կանխելու որևէ նավի մուտքն օվկիանոսի ամբողջ հատվածները՝ վտանգ պատճառելով նույնիսկ չեզոք նավերին։
566	health	Տեսողությունը կամ տեսնելու կարողությունը կախված է տեսողական համակարգի զգայական օրգաններից կամ աչքերից:
1515	science/technology	Համացանցի զատորոշից բնութագիրը հանգեցնում է հավելյալ չափորոշիչների՝ օգտագործման և բավարարվածության տեսանկյունից:
585	science/technology	Այնուամենայնիվ, առաջին իրական հեռադիտակներն ստեղծվել են Եվրոպայում 16-րդ դարի վերջերին:
1689	geography	Օտտավան Կանադայի հմայիչ, երկլեզու մայրաքաղաքն է և զարդարված է արվեստի պատկերասրահներով ու թանգարաններով, որոնք ի ցույց են դնում Կանադայի անցյալն ու ներկան:
1256	health	Այս բյուրեղների կազմությունը համապատասխանում է ներգործված տնային կենդանիների մեզի մեջ հայտնաբերված բյուրեղներին, երբ ինֆրակարմիր լուսապատկերացույցի միջոցով համեմատում են:
60	science/technology	Apple-ի գլխավոր գործադիր տնօրեն Սթիվ Ջոբսը ներկայացրեց սարքը՝ զբոսնելով բեմի վրա և իր ջինսի գրպանից հանելով iPhone-ը։
32	sports	Քանի որ Ալոնսոյից առաջ ընթացող ավտոմեքենաները բենզինը լիցքավորեցին անվտանգության ավտոմեքենայի տակ, նա վեր բարձրացրեց պարանը հաղթանակը ստանձնելու համար։
1411	politics	Հեղափոխական պատերազմի ընթացքում տասներեք նահանգները նախ ստեղծեցին կենտրոնական թույլ կառավարություն, ուր Կոնֆեդերացիայի համաձայնագրի շրջանակներում Կոնգրեսն իր միակ բաղադրիչն էր։
13	sports	Հանդիպման ժամանակ Նադալը զուտ 88% միավոր հավաքեց՝ առաջին մատուցման ժամանակ հաղթելով 76 միավոր։
1941	travel	Լայն պողոտաները, ապակե առաջամասերով շինությունները և ժամանակակից առևտրի կենտրոններն աչքի են ընկնում կղմինդրե կարմիր ավանդական տանիքներով, 18-րդ դարի շուկայով և հին մզկիթներով ու եկեղեցիներով, չնայած քաղաքում ավելի շատ Միջերկրական Եվրոպայի շունչն է, քան ավանդական Թուրքիայի:
732	sports	Ուիսթլերը ( Վանկուվերից 1,5 ժամ հեռավորության վրա) թանկ վայր է, սակայն 2010 թ. Օլիմպիական ձմեռային խաղերի պատճառով՝ շատ հայտնի:
871	entertainment	Լցրեք ձեր տունը առավոտյան հարուստ սուրճով, իսկ գիշերը՝ հանգստացնող երիցուկի մի փոքր թեյով:
886	geography	Անտարկտիկան Երկիր մոլորակի ամենացուրտ վայրն է և շրջապատում է Հարավային բևեռը:
362	science/technology	Հարյուրավոր ժամեր գործելուց հետո, լամպի թելը վերջիվերջո վառվում է և լամպն այևս չի աշխատում:
1578	health	Ստուգե՛ք պիտակը տվյալ թույնի առաջին օգնության հրահանգները տեսնելու համար:
996	travel	Ամեն դեպքում, դուք պետք է ամրագրեք հեռախոսով անմիջապես ավիաընկերության միջոցով:
197	health	Նախագահի վիճակը կայուն է, չնայած նա դեռևս մի քանի օր մեկուսացած կմնա տանը:
460	entertainment	Հեռուստատեսության մեծ մասը ծառայում է հասարակության մեծամասնությանը գոհացնելու նպատակին:
154	geography	Երկիր մոլորակի վրա ընկած մոտավորապես 24 000 հայտնի երկնաքարերից միայն մոտ 34-ն են հաստատվել, որ ունեն մարսյան ծագում:
1160	politics	Երբ պաշտոնյան վավերացնում է ընտրողի ինքնությունը, ընտրողը գցում է ծրարը քվեատուփի մեջ և ստորագրում ընտրացուցակը:
1223	entertainment	Այն բանից հետո, երբ գլխավոր երգիչ Սթիվեն Թայլերն օգոստոսի 5-ի ելույթի ժամանակ բեմից ընկնելու արդյունքում վնասվածք ստացավ, նրանք չեղարկեցին շրջագայությունը:
54	politics	Ավստրալիայի գանձապահ Պիտեր Կոստելլոն, որը, ամենայն հավանականությամբ, կարող է հաջորդել Վարչապետ Ջոն Հովարդին՝ որպես Լիբերալ կուսակցության առաջնորդ, աջակցել է Ավստրալիայի միջուկային էներգիայի արդյունաբերությանը:
7	politics	Բողոքի ցույցը սկսվեց տեղական ժամանակով մոտավորապես 11։00-ին (UTC+1) Ուայթհոլում՝ ոստիկանների կողմից հսկվող Դաունինգ փողոցի՝ վարչապետի պաշտոնական նստավայրի, մուտքի դիմացից:
1010	sports	ԱՄՆ-ի Մարմնամարզական կառույցն աջակցում է Միացյալ Նահանգների Օլիմպիական հանձնաժողովի նամակը և ընդունում, որ Օլիմպիական ընտանիքը միանշանակ կարիք ունի խթանելու մեր բոլոր մարզիկների անվտանգ միջավայրը։
1174	sports	Վերջնական արդյունքը մեկ միավորանոց հաղթանակն էր՝ 21-ը 20 հաշվով՝ ավարտելով Օլ Բլեքսի 15 խաղերի հաղթաշրջանը։
1202	health	Ըստ դատավարության՝ ՄԱԿ-ի ճամբարի թափոնները հարկ եղած կերպով չեն մանրէազերծվել՝ այդպիսով թույլ տալով մանրէների մուտքը Արթիբոնիտ գետի վտակ, որը Հայիթիի ամենամեծերից է:
958	travel	Ոչ մի ավիաընկերության դաշինք չի ընդգրկում բոլոր երեք օվկիանոսների խաչմերուկները հարավային կիսագնդում (և Սքայ թիմը չի ծածկում խաչմերուկներից և ոչ մեկը):
354	science/technology	Սառույցի համար նախատեսված ժամանակակից չմուշկների սայրերը կրկնակի ծայր ունեն, որոնց միջև առկա է գոգավոր փոսիկ: Երկու ծայրերը թույլ են տալիս ավելի լավ կառչել սառույցից, նույնիսկ թեքվելու ժամանակ:
505	science/technology	Այս կայքէջերը դրական կողմեր ունեն, որոնք ներառում են դասական էջի հեշտությամբ կարգավորումը, որը կարող է ընդգրկել բլոգներ, տեսանյութեր, լուսանկարներ և այլ առանձնահատկություններ։
1333	science/technology	Այն օգտագործում է արբանյակի վրա հիմնված տեխնոլոգիա՝ ի տարբերություն հին ցամաքային ռադարի վրա հիմնված տեխնոլոգիայի՝ թույլ տալու օդային երթևեկության վերահսկիչներին նշմարելու ինքնաթիռն ավելի մեծ ճշգրտությամբ և տալ օդաչուներին ավելի ճշգրիտ տեղեկատվություն:
1173	sports	Հարավային Աֆրիկայի Ռուստենբուրգ քաղաքում գտնվող Ռոյալ Բաֆոքենգ մարզադաշտում Տրի Նեյշնս ռեգբիի մրցությունում Հարավային Աֆրիկան հաղթեց Նոր Զելանդիայի Օլ Բլեքսին:
945	travel	Սև ծով և Կասպից ծով հասնելու համար վիկինգներն օգտագործում էին ռուսական ջրուղիները։Այս երթուղիներից որոշ մասեր դեռ կարելի է օգտագործել։ Ստուգեք հատուկ թույլտվությունների հնարավոր կարիքը, որը կարող է դժվար լինի ստանալը։
1012	sports	ԱՄՆ-ի մարմնամարզական կառույցն աջակցում է անկախ հետաքննությանը, որը կարող է լույս սփռել Լարրի Նասսարի վերապրածների կողմից խիզախորեն նկարագրված համամասնությունների չարաշահման վրա, որոնք այսքան երկար ժամանակ աննկատ են մնացել և ներառում է որևէ անհրաժեշտ և համապատասխան փոփոխություն։
712	travel	Շուրջ 60 զբոսանավ է ընթանում Գալապագոսյան կղզիների ուղղությամբ, որոնք փոխադրում են 8-ից 100 ուղևոր։
1654	science/technology	Բովանդակության հայտնի երկու տեսություններն են Մասլոուի Կարիքների հիերարխիա տեսությունը և Հերցբերգի Երկգործոն տեսությունը։
76	politics	Սակայն նա կրկնեց իր ավելի վաղ արած հայտարարությունը, որ Ռո վ. Ուեյդը «երկրի սահմանված օրենքն» էր, շեշտադրելով Գերագույն դատարանի հետևողական վճիռների կարևորությունը:
637	science/technology	Չորս տարի անց արտոնագիր շնորհվեց, որը մագնիսառեզոնանսային շերտագրման ոլորտում աշխարհի առաջին տրամադրված արտոնագիրն էր։
1694	geography	Արևելաաֆրիկյան կղզիները Հնդկական օվկիանոսում են՝ Աֆրիկայի արևելյան ափից հեռու:
1559	travel	Առաջին հայտնի փոխադրամիջոցը քայլելն էր, մարդկային էակներն ուղղաձիգ քայլել սկսեցին երկու միլիոն տարի առաջ Հոմո Էրեկտուսի առաջացմամբ (նշանակելով ուղղաձիգ մարդ)։
679	geography	Վիկտորիա ջրվեժները Զիմբաբվեի արևմտյան մասում գտնվող քաղաքում են՝ Զամբիայի, Լիվինգսթոնի սահմանից այն կողմ, Բոտսվանայից ոչ հեռու:
1049	politics	Զեկույցը սկսվում է Միացյալ Նահանգներում բաց քննարկումների և փոխհամաձայնության կայացման կոչով՝ կապված Մերձավոր Արևելքում տարվող քաղաքականության հետ:
557	science/technology	Դա շատ բարդ կառույց է, որն ըստ պարզեցված Բոհրի մոդելի՝ բաղկացած է կենտրոնական միջուկից, որը պտտվում է էլեկտրոններով, և ինչ որ ձև նման է արևի շուրջ պտտվող մոլորակների: Տե՛ս գծապատկեր 1.1:
194	sports	Բրազիլացին ստացել է լուրջ գլխի վնասվածք վթարից հետո 2009 թվականի հունգարական Գրանդ պրիի ժամանակ:
1103	science/technology	Գրաֆիկական վերլուծության արդյունքը կտեղադրվի հանրային կայքէջում:
1009	health	Պաթոլոգիայի և լաբորատորիայի դեղի փորձարկման ժամանակ ԶՄապը ծառայեց որպես վերահսկողական միջոց՝ նկատի ունենալով, որ գիտնականներն այն որպես հիմք օգտագործեցին և համեմատեցին երեք մյուս բուժումները դրա հետ։
20	politics	Ընտրությունների ընթացքում Հսիեն ընթադրում էր, որ Ման ճգնաժամի ընթացքում կարող է երկրից փախչել:
1700	travel	Կանայք՝ խորհուրդ է տրվում, որ ցանկացած ճամփորդող կին ասի, որ ամուսնացած է՝ անկախ փաստացի ընտանեկան կարգավիճակից:
1673	science/technology	Նոր տեխնոլոգիաների աճը մեզ թույլ է տալիս տեսնել և հետաքննել ուղեղի կառուցվածքը և գործընթացները, որոնք նախկինում երբեք չենք տեսել։
911	science/technology	Քանի որ զանգերն ուղղվում են համացանցի միջոցով, Ձեզ կարող է հարկավոր չլինել օգտագործել այն հեռախոսային ընկերությունը, որը տեղակայված է Ձեր բնակության վայրում կամ ուր ճանապարհորդում եք:
1813	travel	Ակնկալվում է, որ միջոցառումներից շատերի տոմսերը կարժենան 2 500-130 000 իեն, մինչդեռ սովորական տոմսերը՝ 7 000 իեն:
1052	politics	Ներկայիս սենատոր և Արգենտինայի առաջին տիկին Քրիստինա Ֆերնանդես դե Կիրչները երեկ երեկոյան հայտարարեց իր նախագահական թեկնածության առաջադրման մասին Լա Պլատայում` մի քաղաքում, որը Բուենոս Այրեսից 50 կիլոմետր (31 մղոն) հեռավորության վրա է:
1699	geography	Հյուսիսում տարածաշրջանը սահմանակցում է Սահելին, իսկ հարավում և արևմուտքում՝ Ատլանտյան օվկիանոսին:
290	geography	Իսլանդական օդերևութաբանության գրասենյակը նաև տեղեկացրել է, որ վերջին 48 ժամերի ընթացքում Հեքլայի տարածքում ոչ մի երկրաշարժ չի գրանցվել:
1567	politics	Հուլիսի 8-ին փաստաթուղթն առաջին անգամ հրապարակավ ընթերցեց Ջոն Նիքսոնն Անկախության սրահի բակում:
1638	science/technology	Տիեզերքում ամեն բան կազմված է նյութից: Ամբողջ նյութը կազմված է ատոմներ կոչվող փոքր մասնիկներից:
590	science/technology	Սակայն, եթե սա երբևէ պատահի, ապա հավանաբար շատ երկար ժամանակ տեղի չի ունենա: Աստղերն այնքան սփռված են, որ տրիլիոնավոր մղոնների հեռավորություն է առկա «հարևան» աստղերի միջև:
1610	travel	Երթևեկության հոսքն ուսումնասիրում է անհատական վարորդների և փոխադրամիջոցների երկու կետերի միջև տեղաշարժը և միմյանց նկատմամբ ունեցած փոխազդեցությունը:
691	travel	Տեղանքի այցելությունը կարելի է հարմարավետ ձևով համատեղել դեպի լիճ կատարվող նավի ուղևորությամբ:
1120	health	Բեռնատար մեքենայի 64-ամյա վարորդը չի վիրավորվել վթարի ժամանակ:
1619	science/technology	Հազարավոր տարիներ առաջ Արիստարքոս անունով մի մարդ ասել է, որ Արեգակնային համակարգը պտտվում է արևի շուրջ:
839	entertainment	Հաշվի առնելով, թե պուեբլոները որքան հեռու են բնակվում, դուք չեք կարողանա նշանակալից գիշերային կյանք գտնել այնտեղ՝ առանց ճամփորդելու Ալբուկերկե կամ Սանտա Ֆե։
829	travel	Ներգաղթի անցակետը սովորաբար առաջին կանգառն է լինում, երբ ինքնաթիռով, նավով կամ որևէ այլ փոխադրամիջոցով որևէ տեղ եք ժամանում:
1591	science/technology	Արիստոտելի կարծիքները գիտության՝ ներառյալ հոգեբանության, բոլոր հարցերում ընդունվել են:
1821	science/technology	Մակաբույծները կարող են փչացնել սնունդը, գրգռվածություն առաջացնել կամ ավելի վատ դեպքում՝ ալերգիկ ռեակցիաներ առաջացնել, թույն տարածել կամ վարակներ փոխանցել:
1271	sports	Նրա առաջինը դահուկամրցությունն էր, որտեղ նրա առաջին վազքը գնահատվեց որպես «Չավարտված»: 116 մրցակիցներից 36-ը նույն արդյունքն ունեցան այդ մրցավազքում:
