index_id	category	text
91	politics	Լոդինը նաև ասաց, որ պաշտոնյաները որոշել են չեղարկել ընտրությունների երկրորդ փուլը, որպեսզի աֆղանացիներն ազատվեն ևս մեկ ընտրության ծախսից և անվտանգության ռիսկից:
371	science/technology	Եռաեղջյուր դինոզավրը կարող էր օգտագործել իր ուժեղ կտուցը՝ բունն ուտելուց առաջ տերևները հեռացնելու նպատակով։
1806	travel	Որոշ կենդանիներ, ինչպիսիք են փղերն ու ընձուղտները, սովորաբար մոտենում են մեքենաներին, և ստանդարտ սարքավորումները դրանց մոտիկից լավ տեսնելու հնարավորություն կընձեռեն:
930	travel	Որպես զբոսաշրջիկ կամ գործնական նպատակով ճամփորդող՝ որոշակի երկրներ կարճատև այցելությունների համար դուք գուցե վիզայի կարիք չունենաք, այնտեղ այցելելը՝ որպես միջազգային ուսանող, ընդհանուր առմամբ, ավելի երկար այց է պահանջում, քան ուղղակի պատահական զբոսաշրջիկի դեպքում։
33	sports	2009 թվականի հունգարական «Գրանդ Պրի»-ից հետո Պիկե Կրտսերն աշխատանքից հեռացվեց:
0	health	Երկուշաբթի օրը Բժշկության Ստենֆորդի համալսարանի դպրոցի գիտնականները հայտարարեց նոր ախտորոշման գործիքի ստեղծման մասին, որը կարող է տեսակավորել բջիջներն ըստ տեսակի՝ փոքրիկ տպման հնարավորությամբ չիպ, որը կարող է արտադրվել՝ օգտագործելով ստանդարտ թանաքային տպիչներ յուրաքանչյուրը հավանաբար մոտ մեկ ԱՄՆ ցենտով։
200	geography	Ֆելիցիա փոթորիկը, որ իր ժամանակին Սաֆիր-Սիմփսոն մրրկային սանդղակի համաձայն 4-րդ կատեգորիային էր պատկանում, նախքան երեքշաբթի օրը ցրվելը թուլացավ, դարձավ արևադարձային անկում:
873	entertainment	Եթե ձեզ արկածախնդիր եք համարում, օգտվեք հնարավորությունից՝ քամելու կամ խառնելու որոշ մրգային խմիչքներ։
774	entertainment	Միջազգային այգեգործական ցուցահանդեսները մասնագիտացված միջոցառումներ են, որոնք ներկայացնում են ծաղկային ցուցադրություններ, բուսաբանական այգիներ և ցանկացած այլ բան, որն առնչվում է բույսերի հետ:
1377	science/technology	Մենք մեր տները կառուցում ենք բույսերից, և հագուստն ենք բույսերից պատրաստում: Մեր կերած ուտելիքի մեծ մասը բույսեր են: Առանց բույսերի կենդանիները չէին կարողանա գոյատևել:
203	geography	Որոշ անձրևներ ուղեկցվում էին ամպրոպներով ու հաճախադեպ կայծակներով:
1365	science/technology	Վագրի մռնչյունը նման չէ առյուծի՝ ամբողջ ձայնով արձակած մռնչյունին, բայց ավելի շատ նման է մռթմռթացող, աղաղակող բառերի մի նախադասության։
1176	sports	Սա Օլ Բլեքսի վերջին խաղն էր, որն արդեն հաղթել էր գավաթը երկու շաբաթ առաջ:
879	health	Շատ կառավարություններ պահանջում են իրենց երկրներից, որ երկիր մուտք գործող այցելուներին և այն լքող բնակիչներին պատվաստեն մի շարք հիվանդությունների համար:
110	science/technology	Սթարդասթը նոր ռեկորդ կսահմանի, որպես ամենաարագ տիեզերանավը, որը վերադարձել է Երկիր, գերազանցելով 1969 թ. մայիսին Ապոլո X խցիկի վերադարձի ժամանակ սահմանած ռեկորդը:
1494	science/technology	Բնատնտեսությունը պարզ, հաճախ օրգանական համակարգ է, որն օգտագործում է էկոլոգիական տարածաշրջանին հատուկ պահպանված սերմերը` համակցված ցանքաշրջանառության կամ այլ համեմատաբար պարզ մեթոդների հետ՝ բերքն առավելագույնի հասցնելու համար:
1086	science/technology	Ազդեցությունը, որ թիմը որոնում էր կառաջանար գալակտիկայի մուգ նյութի և Ծիր Կաթնի մուգ նյութի միջև մակընթացության ուժերից:
1623	geography	Ամազոնը նաև Երկրի ամենալայն գետն է, որոշ հատվածներում դրա լայնությունը հասնում է վեց մղոնի:
1222	entertainment	Մինչև սեպտեմբերի 16-ը ռոք խումբը պետք է Միացյալ Նահանգներ և Կանադա մեկներ շրջագայության:
1357	science/technology	Եվ վերջապես կան շատ փոքրիկ կատուներ (ներառյալ ազատ տնային կատուները), որոնք սնվում են շատ ավելի բազմաթիվ փոքրիկ զոհերով, ինչպիսիք են միջատները, կրծողները, մողեսներն ու թռչունները:
216	sports	Սքվոշը, կարատեն և անվաչմուշկային սպորտաձևերը փորձեցին ընդգրկել Օլիմպիական ծրագրում, ինչպես նաև բեյսբոլը և սոֆթբոլը, որոնք 2005 թվականին քվեարկության արդյունքում դուրս էին մնացել Օլիմպիական խաղերից։
327	sports	Բոբեկը, ծնված լինելով Խորվաթիայի մայրաքաղաք Զագրեբում, համբավ ձեռք բերեց Բելգրադի «Պարտիզան»-ում խաղալիս:
277	politics	Մասաչուսեթսի նախկին նահանգապետ Միթ Ռոմնին երեքշաբթի օրը 46 տոկոս ձայնով հաղթեց Ֆլորիդայի Հանրապետական կուսակցության նախագահական նախնական ընտրությունները:
428	geography	Թուրքիայի տարածքն ավելի քան 1,600 կիլոմետր է (1,000 մղոն) և մոտավորապես ուղղանկյուն ձևով ունի 800 կմ (500 մղոն) լայնություն:
1709	travel	Գոման զբոսաշրջային քաղաք է Կոնգոյի Դեմոկրատական Հանրապետության ամենաարևելյան հատվածում՝ Ռուանդայի հարևանությամբ։
565	health	Կանոնավոր գործողություններին մասնակցողներից պահանջվում է ավելի շատ աջակցություն ցավի մասին բացասական ընկալման տեսանկյունից՝ տարբերակելով քրոնիկ ցավի և անհարմարության զգացողության տարբերությունները սովորական ֆիզիկական շարժումներից:
742	travel	Չնայած այն ավելի փոքր է, բայց Հավայան կղզիների տարեց այցելուներից ոմանց այն հիշեցնում է նահանգի կարգավիճակ, որը չունի բոլոր զբոսաշրջային հյուրանոցները և այլ զարգացած բաներ:
531	sports	Կանոնավոր խաղափուլի ընթացքում ընդգրկված է տասնութ փոս, և սովորաբար խաղացողներն սկսում են առաջին փոսից և վերջացնում տասնութերորդում:
729	travel	Բոուեն կղզին հայտնի է իր մեկօրյա և հանգստյան օրերին առաջարկվող ուղևորություններով, որն ընդգրկում է քայակներով ուղևորություն, արշավներ, խանութներ, ռեստորաններ և շատ ավելին:
1427	science/technology	Օրինակ, լուսանկարչական անշարժ պատկերի ամենատարածված ձևաչափն աշխարհում 35 մմ է, որը գերակշռող ֆիլմային չափն էր անալոգային ֆիլմի դարաշրջանի ավարտին մոտ։
865	health	Ինչպես շնչառական խնդիրներն են տարածված ցուրտ կլիմայական պայմաններին, այնպես էլ աղիքային խնդիրները բնորոշ են շոգ կլիմայական պայմաններին և մեծամասամբ շատ նյարդայնացնող են, բայց ոչ վտանգավոր:
205	travel	Իր երկրորդ մոտեցումից վայրէջք կատարելուց մոտավորապես տասը րոպե առաջ այն անհետացավ:
374	science/technology	Մարդն, ով Երկրի վրա կշռում է 200 ֆունտ (90 կգ), կկշռի մոտավորապես 36 ֆունտ (16 կգ) Իոյի վրա։ Ուստի՝ ձգողականությունը, անշուշտ, ավելի քիչ է քաշում ձեզ։
275	politics	Կոմենի քաղաքականությունը անավարտ հետաքննության շնորհիվ իրավազրկեց Պլանավորված ծնողավարությունը, այն է՝ թե ինչպես է պլանավորված ծնողը ծախսում և ներկայացնում հաշվետվություն իր գումարների վերաբերյալ, որը կառավարվում է ներկայացուցիչ Քլիֆ Սթերնսի կողմից:
1991	travel	Ներերկրյա ջրուղիները կարող են արձակուրդի համար լավ թեմա լինել։
349	science/technology	Գիտնականներն աշխատում են ստեղծել մի ռեակտոր, որը կկարողանա էներգիա ստանալ նույն ճանապարհով:
1325	science/technology	Կենտրոնական Միսսուրիի համալսարանի մաթեմատիկոս և համակարգչային գիտության պրոֆեսոր Կուրտիս Կուպերը հունվարի 25-ին հայտնաբերել է հայտնի ամենամեծ պարզ թիվը:
1854	travel	Եվրոպան համեմատաբար փոքր մայրցամաք է, սակայն բազմաթիվ անկախ երկրներ ունի: Սովորական հանգամանքներում բազմաթիվ երկրներով ճանապարհորդել կնշանակեր մի քանի անգամ ներկայացնել մուտքի արտոնագիր ստանալու դիմումներ և անցնել անձնագրային ստուգման ընթացակարգով:
946	geography	Սպիտակ ծով-Բալթիկ ծով ջրանցքը միացնում է Հյուսիսային սառուցյալ օվկիանոսը Բալթիկ ծովի հետ Օնեգա լճի միջոցով, Լադոգա լիճը և Սանկտ Պետերբուրգը` մեծ մասամբ գետերի և լճերի միջոցով:
182	politics	«Դա այժմ կարևոր է թե՛ հանրային առողջության, թե՛ քրեական արդարադատության տեսանկյունից, որպեսզի օրենսդրությունը որքան հնարավոր է շուտ հաստատվի,- ասաց կառավարության խոսնակը:»
1288	politics	Համաձայն արտահոսքի՝ փաստաթուղթը վերաբերելու է սահմաններին առնչվող վեճին. Պաղեստինը ցանկանում է, որպեսզի սահմանները հիմնված լինեն 1967 թ. Մերձավոր արևելքի պատերազմից առաջ եղած սահմանների վրա:
1639	science/technology	Ատոմներն անհավատալիորեն այնքան փոքր են, որ դրանցից տրիլիոնավորը կտեղավորվեն միայն այս նախադասության վերջակետի մեջ:
69	entertainment	Նվագախումբը չեղարկեց Մաուրիի Պատերազմի հիշատակի ստադիոնում կայանալիք շոուն, որին նախատեսվում էր, որ 9,000 մարդ պետք է այցելեր, և ներողություն խնդրեց երկրպագուներից։
12	sports	Վերջերս նա պարտվեց Ռաոնիկին Բրիսբեյնի բաց առաջնությունում։
508	health	Ուշադրության կենտրոնացման խանգարումը «նյարդաբանական համախտանիշ է, որի դասական սահմանումը ախտանշանների եռյակ է՝ ներառելով իմպուլսիվություն, շեղում և հիպերակտիվություն կամ էներգիայի ավելցուկ»։
1794	travel	Եթե ձմռանը որոշել եք հատել Հյուսիսային Բալթիկը, ստուգեք նավախցիկի տեղադրությունը, քանի որ սառույցի միջով անցնելը բավականին սարսափելի աղմուկ է պատճառում ամենաշատ տուժածներին։
667	entertainment	Շատ տոմսեր, որոնք վաճառվել են համացանցով աճուրդային կայքերի միջոցով, ինչպես օրինակ Իբեյը կամ Կրեյգլիստը մասնակիորեն օգտագործվում են՝ որպես տարբեր զբոսայգիների այցելության բազմակի օգտագործման տոմսեր:
127	entertainment	Նրանց գրողներից շատերը մեծապես ներգործվել են Ջոն Ստյուարտի և Ստեֆան Կոլբերտի նորությունների նմանակման շոուներով:
1236	sports	Ջանկառլո Ֆիսիչելլան կորցրեց իր մեքենայի կառավարումը և մեկնարկից հետո շատ կարճ ժամանակ անց ավարտեց մրցավազքը:
160	sports	Ստյուարտը, Գորդոնը, Քենսեթը և Հարվիկը եզրափակում են Արշավորդների առաջնության լավագույն տասնյակը՝ խաղաշրջանում ունենալով դեռ չորս մրցարշավ։
1732	geography	Սունդարբանների տարածքն ընդգրկում է 3 850 քառ. կմ, որից մոտ մեկ երրորդը ծածկված է ջրային/ճահճային հատվածներով:
1940	geography	Մի ժամանակ լինելով հին Զմյուռնիա քաղաքը՝ այն այժմ ժամանակակից զարգացած և գործունյա առևտրային կենտրոն է՝ տեղակայված մի հսկայական ծոցի շուրջը և շրջապատված լեռներով։
37	entertainment	Փի-Բի-Էս շոուն ունի Էմմիի երկու տասնյակից ավել մրցանակ, և նրա հեռավորությունն ավելի կարճ է քան Սեզամ փողոցի և Միսթր Ռոջերսի հարևանությունը:
726	entertainment	Պարտեզը շրջապատված է շատ ռեստորաններով, իսկ կեսօրին և երեկոյան կենտրոնի բելվեդերները հաճախ ձրի համերգներ են տալիս:
1507	science/technology	Փայտամածները կարող են լինել ինչպես վիրտուալ, այնպես էլ իրական, այլ կերպ ասած՝ ուսուցիչը փայտամածի մի ձև է, բայց այդպիսին է նաև փոքրիկ թղթապանակով մարդը Microsoft-ի գրասենյակում։
1318	sports	Դասթին «Գոլդասթ» Ռաննելսը նշեց, որ «Լունան իմ նման խենթ էր... գուցե նույնիսկ ավելին... որ սիրում է նրան և կկարոտի... հուսով, որ նա ավելի լավ վայրում է»:
379	science/technology	Փուլերն իրար հաջորդում են, քանի որ Վեներայի (կամ Լուսնի) արևին նայող միայն մի կողմն է լուսավորվում: Վեներայի փուլերը աջակցում են Կոպեռնիկոսի տեսությանը, առ այն, որ մոլորակները շարժվում են արևի շուրջ:
1237	sports	Իր թիմակից Ֆերնանդո Ալոնսոն առաջնորդում էր մրցաշավի մեծ մասը, բայց այն ավարտեց իր տեխնիկական դադարից հետո, հավանաբար առջևի աջ անվի վատ կարգավորման պատճառով:
375	science/technology	Արևը Երկրի նման չունի արտաքին կեղև, որի վրա կարելի է կանգնել։ Ամբողջ արևը կազմված է գազերից, կրակներից և պլազմայից։
1736	travel	Շատ տեղանքներ սպասարկվում են փոքր ճապոնական մերձափնյա ավտոբուսներով, որոնք հարմարավետ են ու դիմացկուն:
534	travel	Գուցե զբոսաշրջության ամենատարածված տեսակն այն է, ինչը մարդկանցից շատերը կապում են ճամփորդության` վերականգնողական բնույթ կրող զբոսաշրջության հետ:
48	sports	Պարոն Ռեյդին հաջողվեց վարել Նոր Զելանդիայի A1GP ավտոմեքենան՝ Սև գեղեցկուհուն՝ կամրջի վրայով անցնելով յոթ անգամ՝ ավելի քան 160 կմ/ժ արագությամբ։
246	politics	Բրիտանական իշխանությունից Պակիստանի 1947 թվականի անկախացումից ի վեր, Պակիստանի նախագահը նշանակել է «քաղաքական գործակալների» Ցեղային տարածքների դաշնային կառավարությունը ղեկավարելու համար, ովքեր ունեցել են գրեթե բացարձակ ինքնավար իշխանություն այդ տարածքներում:
1217	politics	Միջազգային պատժամիջոցները նշանակում են, որ նոր օդանավի գնումը չի կարող իրականացվել:
1916	entertainment	Թեև մերձափնյա կղզիախմբերն ու ամենամեծ լճերն իսկապես բավականին մեծ են ամեն զբոսանավի համար, բայց ավելի փոքր նավակները կամ նույնիսկ կայակները բոլորովին այլ փորձառություն են տրամադրում:
1192	health	Լուսանկարչին տեղափոխեցին Լոս Անջելեսի Կալիֆորնիայի համալսարանի Ռոնալդ Ռեյգանի անվան բժշկական կենտրոն, որտեղ նա հետագայում մահացավ:
559	science/technology	Պրոտոններն ունեն դրական էլեկտրական լիցք, մինչդեռ նեյտրոնները չունեն որևէ լիցք: Էլեկտրոններն ունեն բացասական էլեկտրական լիցք:
107	geography	Երբ կապսուլան հասնի Երկիր մոլորակ, այն մթնոլորտ կմտնի մոտավորապես առավոտյան ժամը 5-ին (արևելյան ժամանակ) և ակնկալվում է, որ այն բավական պայծառ շոու կապահովի Հյուսիսային Կալիֆոռնիայի, Օրեգոնի, Նևադայի և Յուտայի բնակիչների համար:
549	sports	Իհարկե առաջնակարգ կես մղոն վազորդը՝ մի մարդ, ով կարող է գերազանցել երկու րոպեն, պետք է իրոք շատ մեծ արագություն ապահովի, սակայն դիմացկունությունը ամեն գնով պետք է մշակվի:
1923	travel	Ինքնաթիռով ճանապարհորդելը կարող է սարսափազդու ապրում լինել բոլոր տարիքի և կենսագրություն ունեցող մարդկանց համար, մասնավորապես եթե նրանք նախկինում չեն թռել կամ վնասվածքային վթարի ապրում են ունեցել:
126	entertainment	Ալ Գորն ու գեներալ Թոմի Ֆրենքսը հապճեպ արտաբերում են իրենց սիրելի վերնագրերը (Գորինն այն էր, երբ «Դի Օնիոն»-ը հայտնեց, որ նա և Թիփերն ունեցել էին իրենց կյանքի լավագույն սեռական ակտն իր՝ 2000 թ.-ի Ընտրողների կոլեգիայում կրած պարտությունից հետո):
983	health	Թռչնի գրիպը կամ, ավելի պաշտոնական ձևակերպմամբ, թռչնագրիպը կարող է վարակել թե՛ թռչուններին, թե՛ կաթնասուններին:
915	science/technology	Այս կատեգորիայի որոշ հավելվածներ կարող են անգամ օտար լեզուներ թարգմանել նշանները և իրական աշխարհում գտնվող այլ առարկաները, երբ օգտատերը սմարթֆոնը պահում է այդ առարկաների վրա:
330	sports	Ակումբի համար ոչ ոք երբևէ Բոբեկից ավելի շատ չէր խաղացել կամ ավելի շատ գոլի հեղինակ դարձել:
563	health	Ուսումնասիրությունը պարզել է, որ դեպրեսիան, վախը և մոտալուտ աղետի զգացումը խոչընդոտում են ցավի և հաշմանդամության միջև առկա կապը մեջքի ներքևի հատվածում ցավ ունեցողների մոտ:
496	health	Վիրաբույժները գիտելիքներ ունեին տարբեր հանգստացուցիչ դեղամիջոցների մասին, ներառյալ՝ կակաչի սերմերի քաղվածքից մորֆինի և հերբանի սերմերից սկոպոլամինի մասին:
919	science/technology	Դա կարող է թույլ տալ գումար խնայել գլոբալ տեղորոշման համակարգի համար նոր քարտեզներ կամ առանձին ԳՏՀ սարք գնելու կամ ավտոմեքենաների վարձույթով զբաղվող ընկերությունից այն վարձակալելու հաշվին:
1504	science/technology	Երբ վայրենացած երեխային մեծացնում են ոչ տնային կենդանինեը, նա ցուցադրում է այնպիսի վարքագիծ (ֆիզիկական առումով), որը գրեթե ամբողջությամբ նման է մասնավորապես զգուշավոր կենդանիների վարքագծին, ինչպես, օրինակ, մարդկանց հանդեպ նրա վախը կամ անտարբերությունը:
1422	politics	1683 թվականին Քինգ դինաստիայի (1644-1912) զորքերն իրենց վերահսկողության տակ վերցրին Թայվանի արևմտյան և հյուսիսային ափամերձ տարածքները և 1885 թվականին Թայվանը հռչակեցին որպես Քինգ կայսրության գավառ:
202	geography	Տեղումները, Օահոյի մի չափիչի համաձայն հասնելով 6,34 դյույմի, նկարագրվել էին որպես «օգտակար»։
109	science/technology	Կապսուլան վայրկյանում կճամփորդի մոտ 12,8 կմ կամ 8 մղոն արագությամբ՝ բավականաչափ արագ մեկ րոպեում Սան Ֆրանցիսկոյից Լոս Անջելես հասնելու համար։
1521	science/technology	Նա անգամ նշում էր, որ մարդկային վարքը մեկնաբանելու նման կարողություններ կարող են ունենալ նաև կենդանիները, ինչպես օրինակ ընտանի շները:
1479	science/technology	Տեխնոլոգիական դետերմինիզմի մեկնաբանությունների մեծամասնությունը կիսում են երկու հիմնական գաղափար. որ տեխնոլոգիաների զարգացումը ինքնին հետևում է մշակութային կամ քաղաքական ազդեցությունից մեծապես դուրս եղող մի ուղու, և տեխնոլոգիան իր հերթին «ազդեցություններ» ունի ներհատուկ հասարակությունների վրա և ոչ թե հասարակությամբ պայմանավորված:
1163	politics	Թեկնածուները կարող են ուղարկել ներկայացուցիչներ, որպեսզի անձամբ ներկա լինեն գործընթացի ամեն փուլին: Երեկոյան քվեները հաշվում են կամավորները խիստ վերահսկողության պայմաններում` հետևելով հատուկ ընթացակարգերի:
1696	geography	Ավելի փոքր կղզիների մեծ մասն անկախ պետություններ են կամ կցված են Ֆրանսիային և հայտնի են որպես շքեղ հանգստյան լողափեր:
