index_id	category	text
116	science/technology	शास्त्रज्ञांनी एन्सेलेडस भौगोलिकदृष्ट्या सक्रिय आणि शनीच्या बर्फाळ ई रिंगचा संभाव्य स्रोत असल्याचा संशय व्यक्त केला आहे.
1034	science/technology	ताऱ्याचा रॉसबी क्रमांक निश्चित करण्यासाठी तेजोमयता आणि परिभ्रमण एकत्र वापरले जाते, जे प्लाझ्मा प्रवाहाशी संबंधित असते.
450	geography	सेरेनगेटी प्रदेशात सेरेनगेटी नॅशनल पार्क, टांझानियामधील नॅगोरोन्गोरो कन्झर्वेशन एरिया आणि मस्वा गेम रिझर्व तसेच केनियामधील मसाई मारा नॅशनल रिझर्व आहे.
1019	entertainment	इतर नामांकनामध्ये उत्कृष्ट चित्रपट, दिग्दर्शक, चित्रांकन, वेशभूषा, संपादन, मूळ संगीत, निर्मिती रचना, ध्वनी संकलन, ध्वनी मिश्रण आणि मूळ पटकथा यांचा समावेश होतो.
26	sports	त्या रात्रीचा त्याचा दुसरा गोल हंगामातला ६० वा होता. त्यामुळे तो एका हंगामात ६० किंवा त्यापेक्षा अधिक गोल करणारा पहिला खेळाडू ठरला, याआधी १९९५-९६ मध्ये जरोमिर जागर आणि मारिओ लेमिन्स या दोघांनी हा विक्रम केला होता.
1292	sports	NPWS आणि स्पोर्टिंग शूटर असोसिएशन ऑफ ऑस्ट्रेलिया (NSW) Inc यांच्या भागीदारीत, स्पोर्टिंग शूटर असोसिएशनच्या शिकार कार्यक्रमाअंतर्गत पात्र स्वयंसेवक नियुक्त करण्यात आले.
1795	travel	सेंट पीटर्सबर्ग क्रुझमध्ये शहरात वेळ घालवण्यास परवानगी आहे. क्रुझच्या प्रवाशांना व्हिसा आवश्यक असण्यामधून वगळण्यात आले आहे (अटी वाचा).
939	travel	आपण काय आणू शकतो आणि काय आणू शकत नाही हे तुम्हाला माहित असल्याची आधी खात्री करून घ्या आणि जे काही कायदेशीर मर्यादेच्याबाहेर आहे ते सांगा.
693	geography	जरी इतर अनेक देश आणि संयुक्त राष्ट्रसंघ याला इस्रायेलची राजधानी मनात नसले तरी, जेरुसलेम ही इस्रायेलची राजधानी आणि तेथील सर्वात मोठे शहर आहे.
778	science/technology	तुम्ही बाहेर पळायला गेल्यास, आणि सध्याच्या DSLR/डीएसएलआर सोबत तुलनात्मक रिझोल्यूशन दिल्यास याची सहसा चांगल्याप्रकारे भरपाई केली जाऊ शकेल.
1147	health	वैद्यकीय सेवाभावी संस्था मांगोला, मेडिसिन सॅन्स फ्रॉन्टायर आणि जागतिक आरोग्य संघटनेने हा देशातील नोंदवलेला सर्वात वाईट संसर्ग असल्याचे सांगितले.
1263	politics	सार्वजनिक फिर्यादी पक्षाचे संचालक, कीर स्टारमर क्यूसी, यांनी आज सकाळी एका परिपत्रकानुसार हुह्ने आणि प्रीस दोघांच्यावरही खटला चालेल हे घोषित केले.
1847	sports	"""स्कीइंग हा अनेक उत्साही लोकांसह करावयाचा मुख्य प्रवास विषयक उपक्रम आहे, ज्यास कधीकधी """"स्की बम्स,"""" म्हणून ओळखले जाते.एखाद्या विशिष्ट ठिकाणी स्कीइंगच्या आसपास संपूर्ण सुट्ट्यांचे नियोजन केले जाऊ शकते."""
994	travel	केवळ काही मोजक्या एयरलाईन्स बेरेवमेंट तिकीट दर देत, ज्यात अंतिम क्षणीच्या अंत्यसंस्कारसंबंधी प्रवासाच्या खर्चात माफक सवलत देतात.
927	science/technology	एखाद्या विमानतळावर किंवा गर्दीच्या वर ड्रोन उडवणे ही नेहमीच वाईट कल्पना आहे, जरी ते तुमच्या भागात बेकायदेशीर नसले तरी.
811	sports	हायकिंग ही घराबाहेर करण्याची एक अॅक्टिव्हिटी आहे, ज्यामध्ये बरेचदा हायकिंगच्या मार्गांवर नैसर्गिक वातावरणात चालणे समाविष्ट असते.
285	politics	लात्विया आणि स्लोवाकिया दोघांनी ACTA मध्ये सहभागी होण्याची प्रक्रिया लांबणीवर टाकली आहे.
1342	science/technology	कोबीचा रस रसायन किती आम्लिय किंवा मूलभूत (अल्कधर्मी) आहे यानुसार रंग बदलतो.
1800	travel	बर्फाळ आणि हिमाच्छादित रस्त्यांवर घर्षण कमी असते तसेच येथे तुम्ही डांबरी रस्त्याप्रमाणे गाडी चालवू शकत नाही.
1297	politics	ऑक्टोबरमध्ये सुरू झालेल्या शासन-विरोधी व्यापक निषेधांना आयोग हा मार्टलीचा प्रतिसाद होता.
1048	politics	हा इशारा देत आहे की इराकमध्ये या टप्प्यावर होणार्‍या कोणत्याही कृतीमुळे सांप्रदायिक युद्ध, वाढता हिंसाचार किंवा अनागोंदीकडील दिशेने जाणारा त्रास थांबेल याची हमी कोणीही 1 हमी देऊ शकत नाही.
547	politics	पहाटे पूर्व हल्ला सुरू करण्यासाठी, 1 ग्रीन अंतर्गत आणि 1 सुलिव्हान अंतर्गत 2,400 पुरुषांची मुख्य प्राणघातक शक्ती ट्रेंटनच्या उत्तरेला 9 मैलांवर नदी पार करेल आणि नंतर 2 गटात विभाजित होईल.
1127	health	फ्लूकने लिहिले की स्त्रीयांच्या आरोग्याविषयी बोलण्यापासून महिलांना बोलण्यापासून थांबवण्याचे काहींचे प्रयत्न अयशस्वी ठरले.
120	entertainment	ACMA ला असेही आढळले की व्हिडीओ इंटरनेटवर प्रसारित होऊनही, बिग ब्रदरच्या वेबसाइटवर मीडिया संग्रहित न केल्यामुळे बिग ब्रदरने ऑनलाइन आशय सेन्सॉरशिप कायद्याचे उल्लंघन केलेले नाही.
1113	health	यावर्षी ऐतिहासिकदृष्ट्या सर्वाधिक प्रभावित भागात लसी पोहोचवण्याच्या योजना निधीअभावी व इतर आजारांच्या तुलनेत कमी प्राधान्य प्राप्तीमुळे लांबणीवर टाकल्या.
1442	politics	या युक्तीला मर्यादीत प्रतिसाद मिळाल्यामुळे, जर्मनीने त्याच्या अप्रतिबंधित पाणबुडी युद्धाला तसाच प्रतिसाद मिळेल अशी अपेक्षा केली होती.
830	travel	काही सीमापार ट्रेन मध्ये तपासणी धावत्या ट्रेन मध्ये केली जाते आणि तुम्ही जर अशा 1 ट्रेन मध्ये स्वार असाल तर तुमच्या कडे वैध ओळखपत्र हवे.
1824	travel	भारी कर आकारणी असणाऱ्या देशांकरिता प्रवासी कधीकधी विशेषत: मद्य आणि तंबाखूसारख्या उत्पादनांवर मोठ्या प्रमाणात पैशांची बचत करू शकतात.
1533	health	बायोरिदमवर आधारित इतर पर्यायांमध्ये झोपण्याआधी भरपूर द्रवपदार्थ (मुख्यत्वे पाणी किंवा चहा, हे माहित असलेले लघवीचे प्रमाण वाढवणारे पदार्थ) घेणे अंतर्भूत आहे, ज्यामुळे एखाद्या व्यक्तीला लघवीसाठी उठावे लागते.
1982	entertainment	चेरी ब्लॉसम पाहणे हे हनामी म्हणून ओळखले जाते, जे 8 व्या शतकापासून जपानी संस्कृतीचा एक भाग आहे.
657	health	उन्हाळ्यातील खूप मोठे दिवस हे पुरेशी झोप आणि त्यासंबंधी आरोग्य समस्या याकडे नेऊ शकतात.
948	travel	एकदा मरीनाला तुम्ही पोहोचला की खात्री झाली असे समजा. तुम्ही बोट वरुन रमतगमत प्रवास करणाऱ्या इतरांना भेटाल  आणि ते आपली माहिती तुमच्याशी सामायिक करतील.
1892	travel	परदेशात राहून घरी परतताना, तुम्ही नवीन संस्कृतीशी जुळवून घेतलेले असते आणि तुमच्या घरच्या संस्कृतीतील काही सवयी विसरलेल्या असतात.
1707	travel	कॅसाब्लांका ही संपूर्ण मोरोक्कोमधील खरेदी करण्याच्या सर्वात कमी मनोरंजक जागांपैकी 1 आहे.
1729	geography	सुंदरबन्स हा जगातील सर्वात मोठा समुद्रालगतचा कांदळवनाचा पट्टा आहे, तो बांगलादेश आणि भारतीय सुदूर अंतर्भागातील किनाऱ्यापासून 80 किमी (50 मैल) आत पसरलेला आहे.
1574	science/technology	सध्या वापरात असलेले सर्व काँप्युटर्स बायनरी संख्येच्या स्वरुपात संकेतबद्ध केलेल्या माहितीचा वापर करण्यावर आधारित आहेत.
692	travel	मंदिरात प्रवेश करण्यासाठी अंगकोर पासची आवश्यकता आहे जेणेकरून टोन्ली सॅपकडे जात असताना आपला पासपोर्ट सोबत आणण्यास विसरू नका.
1155	geography	"""""""द सेव्हन सिस्टर्स"""" असे नाव असलेल्या सगळ्या गुहांच्या प्रवेशद्वारांचा व्यास किमान १०० ते २५० मीटर (३२८ ते ८२० फूट) इतका आहे."""
1810	sports	टोकियो हे 2 ग्रीष्मकालीन ऑलिम्पिक खेळांचे आयोजन करणारे एकमेव आशियाई शहर असेल, 1964 मध्ये खेळांचे आयोजन केले होते.
64	politics	मूळ विधेयकाचा मसुदा साओ पावलोच्या महापौर मार्टा सप्लिसी यांनी तयार केला होता. प्रस्तावित कायदे दुरुस्ती केल्यानंतर आता रॉबर्टो जेफरसनच्या हातात आहेत.
1330	politics	त्यांनी या अफवा ''वायफळ राजकीय बडबड आणि मुर्खपणा'' असल्याचे म्हटले.
1448	politics	तसेच प्रत्येक राजवंशाच्या दरम्यान विभक्त प्रांताचा एक अस्थिर काळ होता. यापैकी सर्वोत्तम ज्ञात कालावधी 3 राजसत्तांचा होता जो हान आणि जिन राजसत्त्यांच्या दरम्यान 60 वर्षांचा होता.
636	science/technology	सन १९७० मध्ये, वैद्यकीय डॉक्टर आणि संशोधन वैज्ञानिक, रेमंड डमेडियन यांनी वैद्यकीय निदानाचे साधन म्हणून चुंबकीय प्रतिध्वनी इमेजिंग वापरण्याच्या आधाराचा शोध लावला.
1677	science/technology	उदाहरणांमध्ये नियंत्रण, नियोजन आणि वेळापत्रक, ग्राहक निदान आणि प्रश्नांची उत्तरे देण्याची क्षमता तसेच हस्तलेखन ओळख, आवाज आणि चेहरा समाविष्ट आहे.
1398	entertainment	तुम्ही नॅशनल ट्रेजर हा चित्रपट पाहिला असेल तर, डिक्लेरेशनऑफ इंडिपेन्डन्सच्या मागच्या बाजूला खजिन्याचा नकाशा लिहिला आहे असे तुम्हाला वाटू शकते.
1605	travel	या गतिशील वाहतुकीच्या शटलमध्ये प्रत्येकजण कशा न कशा प्रकारे वैयक्तिक कारवर आधारित वाहतुकीच्या सिस्टमशी जोडलेले आणि त्यास सपोर्ट करत आहे.
982	travel	जरी तुम्ही एखाद्या उष्ट कटिबंधातील पर्जन्य वनातून ड्राईव्ह करीत असाल, तुम्ही वाहनात बसेस्तोवर काही क्षण जरी दरवाजा उघडा राहिला तरी डासांना वाहनातून तुमच्या बरोबर येण्यासाठी तितका कालावधी पुरेसा आहे.
366	science/technology	रक्ताभिसरण संस्थेमधील सर्वात महत्वाचा अवयव हा हृदय आहे, जे रक्त अभिसारीत करते.
1651	science/technology	आशय सिद्धांत, लोक निवड का करतात किंवा त्यांना काय आकर्षित करते हे शोधण्यावर केंद्रित असतात.
941	science/technology	एकदा तुम्ही वेबवर फॉरमॅट करणे आणि संपादित करणे यांना सरावलात की त्यानंतर तुम्ही कदाचित तुमची स्वतःची वेबसाइट तयार करू शकता.
876	health	वैद्यकीय परिभाषांशी संबंध नसलेल्यांसाठी, संसर्गजन्य आणि साथीचे रोग या शब्दांचे अर्थ वेगळे आहेत.
661	entertainment	संगीत, चित्रपट, साहित्य आणि लोकप्रिय संस्कृती मध्ये वारंवार चित्रण यामुळे या शहरातील आणि इथल्या सौंदर्य स्थळांना संपूर्ण जगात ज्ञात करण्यास मदत केली आहे.
1112	health	सरकारने एन्सेफलायटिसलसीच्या काही दशलक्ष कुप्या देण्याचेदेखील आश्वासन दिले, ज्या पुढीलवर्षासाठी आरोग्य संस्थांना तयारी करण्यास मदत करतील.
1329	politics	क्युमो, ५३, यांनी या वर्षाच्या सुरुवातीला राज्यपाल म्हणून काम सुरू केले आणि गेल्या महिन्यात समलिंगी लग्नाला कायदेशीर करणाऱ्या विधेयकावर स्वाक्षरी केली.
1053	politics	सौ. किर्चनर यांनी अर्जेंटाईन नाट्यगृह येथे आपल्या अध्यक्षपदाची निवडणूक लढविण्याचा हेतू घोषित केला, हेच ठिकाण त्यांनी ब्यूनोस एअर्स प्रभाग प्रतिनिधी मंडळाचे एक सदस्य म्हणून 2005 साली सिनेट साठी मोहीम सुरु करण्याकरिता वापरले होते.
1948	travel	तुम्ही मुळात एका सामूहिक समाधीस्थळाला भेट देत आहात तसेच, या स्थळाचे जगातील मोठ्या लोकसंख्येसाठी अतुलनिय महत्त्व आहे, हे कृपया लक्षात ठेवा.
923	science/technology	अनेकदा या सर्विसेस करिता ऍक्सेस टोल-फ्री टेलिफोन नंबरद्वारे केला जातो ज्यास बहुतांश फोनवरून विना-शुल्क कॉल केला जाऊ शकतो.
173	science/technology	एक ROV वापरून, समुद्री मॅपिंगचे अनुसरण केल्याने मलबा सापडला आहे.
1087	science/technology	ज्याप्रमाणे चंद्र आणि पृथ्वीमधील गुरुत्वाकर्षणामुळे समुद्राला भरती येते त्याचप्रमाणे आकाशगंगा आणि धनु आकाशगंगा यादरम्यान गुरुत्वाकर्षण असते.
1328	science/technology	शास्त्रज्ञाना ग्रह कसे तयार होतात हे समजण्याची आशा आहे, विशेषत: पृथ्वी कशी तयार झाली, जेव्हा धूमकेतू फार पूर्वी पृथ्वीवर आदळले होते.
914	science/technology	प्रत्यक्ष वेळ मजकूर अनुवादक अॅप - एका भाषेतून दुसऱ्या भाषेत मजकूराचा संपूर्ण विभाग अनुवादीत करण्याची क्षमता असलेले अॅप्लिकेशन.
1341	science/technology	याला केमिकलचा pH म्हणतात. तुम्ही लाल कोबीचा रस वापरुन इंडिकेटर तयार करू शकता.
336	entertainment	"""पूर्ण करण्यासाठी, तुर्की डान्स ग्रुप फायर ऑफ अ‍ॅनाटोलियाने """"ट्रॉय"""" शो सादर केला."""
1005	entertainment	2017 च्या उत्तरार्धात, शॉपिंग टेलिव्हिजन चॅनेल QVC वर सिमिनॉफ दिसले होते.
1671	science/technology	मेंदूची पॅथॉलॉजी आणि त्याची वर्तणूक यांमधील परस्परसंबंध शास्त्रज्ञांना त्यांच्या शोधामध्ये सहाय्य करते.
1597	science/technology	हर्षी आणि चेस यांनी जीवाणूंमध्ये त्यांच्या स्वतःच्या डीएनएचे रोपण करण्यासाठी फेज किंवा विषाणूचा वापर केला.
1008	health	ZMapp या नावाच्या 1 का अँटीबॉडी कॉकटेलने प्रारंभी क्षेत्रात आश्वासन दिले, परंतु औपचारिक अभ्यासानुसार हे मृत्यूपासून बचाव करण्यापेक्षा कमी फायदेशीर असल्याचे निदर्शनास आले.
1313	health	रुग्णालयात काम करत असताना लिगिन्सने अकाली होणाऱ्या प्रसूतीचे मोकळ्या वेळात संशोधन करण्यास सुरुवात केली.
665	travel	"""""""प्रातिनिधिक"""" भेटीमध्ये ऑरलॅन्डो अंतरराष्ट्रीय विमानतळावर उतरणे, बसने साइटवरील डिस्ने हॉटेलवर जाणे, जवळपास एक आठवडा कुठेही बाहेर न पडता डिस्नेच्या जागेमध्ये घालवणे आणि घरी परत येणे यांचा समावेश आहे."""
