index_id	category	text
1606	science/technology	विज्ञान आता दर्शविते की या प्रचंड कार्बन अर्थव्यवस्थेने गेल्या 2 दशलक्ष वर्षांपासून मानवी उत्क्रांतीला पाठिंबा देणाऱ्या जीवावरणाच्या 1 स्थिर स्थितीत बदल घडवून आणला आहे.
79	sports	2 संघांचा प्रमुख उपांत्य सामन्यात सामना होणार असून नुसा 11 गुणांनी बाद झाला आहे.
952	travel	तुम्ही सर्वाधिक ज्या विमान कंपनीने प्रवास करता तिलाच पुन्हा जाण्याचे तुमचे मन म्हणत असले तरी, तुम्हाला हे माहित असायला हवे की दिल्या जाणाऱ्या सवलती अनेकदा भिन्न असतात आणि वारंवार उड्डाण बिंदू हे एकाच विमान कंपनीच्या ऐवजी इतर विमानकंपन्यात अधिक उदार असू शकतात.
995	travel	ही सुविधा प्रदान करणार्‍या एअरलाईन्समध्ये यू.एस. किंवा कॅनडा आणि वेस्टजेटमधून निघालेल्या फ्लाईट्ससाठी एअर कॅनडा, डेल्टा एअर लाईन्स, लुफ्थांसा यांचा समावेश आहे.
266	science/technology	रशियन मैदान नियंत्रणाने जेट्स सक्रिय केले आणि स्टेशनचा सामान्य दृष्टीकोन पुन्हा मिळवला.
112	politics	श्रीमान. रुड यांच्या क्योटो हवामान करारावर स्वाक्षरी करण्याच्या निर्णयाने युनायटेड स्टेट्सला वेगळे केले, आणि आता हे कराराला मान्यता न देणारे एकमेव विकसित राष्ट्र असेल.
1050	politics	या अहवालात इराकच्या बाबतीत एक्झिक्युटीवच्या वर्तमान धोरणाच्या जवळपास प्रत्येक पैलूवर प्रखर टीका करण्यात आली आहे आणि दिशा तत्काळ बदलण्याचं आवाहन केलं आहे.
1609	travel	वाहतूक प्रणाली अशा तक्रारींना उत्तेजन का देते, ते दररोज अयशस्वी का होतात? फक्त परिवहन इंजिनिअर्सच अकार्यक्षम आहेत का? की आखणी काहीतरी अधिक पायभूत सुरू आहे?
1316	sports	सह कुस्तीगिरांनी देखील लुना यांना श्रद्धांजली वाहिली.
291	geography	भूकंपाच्या महत्त्वपूर्ण हालचालीचा परिणाम म्हणून १० मार्च रोजी ज्वालामुखीच्या शिखराच्या ईशान्य बाजूला स्थितीमध्ये बदल झाला होता.
1215	travel	प्राथमिक अहवाल असे सांगतात की हे विमान उरुम्की मध्ये आपत्कालीन परिस्थितीत खाली उतरवण्यास नकार दिल्यानंतर अफगाणिस्तानकडे पुन्हा वळवण्यात आले.
1270	sports	बुधवारच्या कार्यक्रमाच्या पलीकडे, कार्पेनेडोने चॅम्पियनशिपमध्ये 2 वैयक्तिक शर्यतीत भाग घेतला.
663	entertainment	सॅन फ्रान्सिस्को हे कोरियन, थाई, भारतीय आणि जपानी अशा इतर आशियाई पाककृतींसाठी देखील देशातील 1 सर्वोत्कृष्ट ठिकाण आहे.
91	politics	लेडिनने असेही सांगितले की, अधिकाऱ्यांनी अफगाणचा खर्च आणि सुरक्षेची जोखीम टाळण्यासाठी रनऑफ रद्द करण्याचा निर्णय घेतला.
371	science/technology	ट्रायसेरॉटॉप्स खोड खाण्यापूर्वी पाने काढून टाकण्यासाठी जोरदार चोचीचा वापर करू शकले असते.
1806	travel	हत्ती आणि जिराफ यासारखे काही प्राणी कारच्या जवळ जाऊ शकतात तसेच मानक उपकरणाच्या मदतीने तुम्ही त्यांना चांगल्याप्रकारे पाहू शकता.
930	travel	तुम्हाला काही देशांच्या कमी कालावधीच्या भेटींकरिता पर्यटक म्हणून किंवा व्यवसायासाठी व्हिसाची आवश्यकता नसली तरी आंतरराष्ट्रीय स्तरावर तेथे विद्यार्थी म्हणून जाण्यासाठी सहसा प्रासंगिक पर्यटकापेक्षा जास्त काळ मुक्काम करावा लागतो.
33	sports	पीकेट जूनियरला 2009 हंगेरियन ग्रँड प्रिक्स नंतर काढून टाकण्यात आले होते.
0	health	स्टॅनफोर्ड युनिव्हर्सिटी स्कूल ऑफ मेडिसीनमधील शास्त्रज्ञांनी पेशींचे प्रकारानुसार विभाजन करणाऱ्या निदान साधनाचा शोध लावल्याचे सोमवारी जाहीर केलेः सामान्य इंकजेट प्रिंटरचा वापर करून एका लहान प्रिंट करता येणाऱ्या चीपचे उत्पादन अंदाजे एक U.S. प्रति सेंट खर्चून केले जाऊ शकते.
200	geography	फेलिसिया, सफिर-सिम्पसन चक्रीवादळाच्या श्रेणी 4 मधील वादळ मंगळवारी रौद्ररूप घेण्यापूर्वी उष्णकटिबंधीय प्रदेशात कमकुवत झाले.
873	entertainment	तुम्हाला अधिक रोमांचक वाटत असल्यास, ज्यूस किंवा स्मूदी तयार करण्याची संधी सोडू नका:
774	entertainment	जागतिक फलोत्पादन प्रदर्शने म्हणजे, फुलांचे प्रदर्शन, वनस्पतींची बाग आणि वनस्पतींशी संबंधित इतर गोष्टी यांचा विशेष कार्यक्रम होय.
1377	science/technology	आपण आपली घरे आणि कपडे तयार करण्यासाठी वनस्पतींचा उपयोग करतो. आपण खात असलेले बहुतांश खाद्यपदार्थ हे वनस्पती पासूनच प्राप्त होत असतात. प्राणी वनस्पतींशिवाय जगू शकत नाहीत.
203	geography	यापैकी थोडा पाऊस ढगांचा गडगडाट आणि वारंवार वीजांसोबत पडला होता.
1365	science/technology	वाघाची डरकाळी एखाद्या सिंहाच्या पूर्ण आवाजातील डरकाळीसारखी नसते, परंतु फेंदारून, ओरडून उच्चारलेल्या शब्दांच्या वाक्यासारखी अधिक असते.
1176	sports	सर्व कृष्णवर्णियांसाठी तो शेवटचा सामना होता, ज्यांनी दोन आठवड्यांपूर्वी करंडक यापूर्वीच जिंकला होता.
879	health	अनेक सरकारांना आगंतुकांनी प्रवेश करणे किंवा रहिवासींनी राहणे, त्यांच्या देशांना वेगवेगळ्या रोगांचे लसीकरण केले जाणे आवश्यक आहे.
110	science/technology	स्टारडस्ट, १९६९ च्या मेदरम्यान अपोलो एक्स कमांड मॉड्यूलने रचलेला विक्रम मोडून, पृथ्वीवर सर्वाधिक वेगाने परत येणारे अवकाशयान या नवीन विक्रमाची नोंद करले.
1494	science/technology	गरजेपुरती शेती हे साधी, बरेचदा सेंद्रिय, व्यवस्था आहे ज्यामध्ये परिस्थितीतीत मूळ जतन केलेले बीज वापरले जाते सोबत फेर पिके घेतली जातात किंवा अधिक उत्पादनासाठी तुलनेने अन्य सोपी तंत्रे वापरली जातात.
1086	science/technology	आकाश गंगेतील गडद पदार्थ आणि दीर्घिका यांच्यातील गडद पदार्थ यांच्यामधील भरतीच्या बलांनी केलेल्या परिणामांचा अभ्यासाकडे समूह लक्ष ठेवून होता
1623	geography	अ‍ॅमेझॉन ही पृथ्वीवरील विस्तीर्ण नदी देखील आहे जी काही ठिकाणी 6 मैल रूंद आहे.
1222	entertainment	तो रॉक बँड 16 सप्टेंबरपर्यंत अमेरिका आणि कॅनडाचा दौरा करणार होता.
1357	science/technology	अखेरीस, अनेक लहान मांजरी आहेत (स्वैर पाळीव मांजरींसह) ज्या कीटक, उंदीर, सरडे आणि पक्षी यासारखे अनेक लहान भक्ष्य खातात.
216	sports	२००५ साली ऑलिम्पिक खेळांतून वगळलेल्या बेसबॉल आणि सॉफ्टबॉल या खेळांसह स्क्वॅश, कराटे आणि रोलर या खेळांनीही ऑलिम्पिक प्रोग्रॅममध्ये सहभागी होण्याचा प्रयत्न केला.
327	sports	क्रोएशियाची राजधानी झगरेबमध्ये जन्मलेल्या बॉबेकने पार्टीझन बेलग्रेडसाठी खेळताना प्रसिद्धी मिळवली.
277	politics	मॅसेच्युसेट्सचे माजी राज्यपाल मिट रॉम्नी यांनी मंगळवारी ४६ टक्क्यांपेक्षा अधिक मतांनी फोरिडा रिपब्लिकन पक्षाच्या अध्यक्षपदाची प्राथमिक निवडणूक जिंकली.
428	geography	तुर्कीचा भूप्रदेश 1,600 किलोमीटर्सहून (1,000 मैल) लांब आणि 800 किमी (500 मैल) रुंद, साधारण चौकोनी आकाराचा आहे.
1709	travel	गोमा हे काँगो लोकशाही प्रजासत्ताकमधील पर्यटन शहर आहे, जे पूर्वेच्या टोकाला रवांडाजवळ आहे.
565	health	साधारण क्रियांमध्ये सहभागी होणाऱ्या लोकांना सामान्य क्रियांमुळे अनुभवास येणारी अस्वस्थता आणि दीर्घकालीन दुखणे यांमध्ये फरक करणाऱ्या नकारात्मक दृष्बाटीकोनाबाबत जास्त आधाराची आवश्यकता लागली.
742	travel	जरी लहान असले तरी, सर्व मोठे पर्यटक हॉटेल्स आणि इतर विकासाशिवाय असलेले राज्य हे हवाईच्या काही वृद्ध पर्यटकांना भेट देतात
531	sports	सामान्य फेरी खेळताना त्यात अठरा छिद्रांचा समावेश असतो, ज्यामध्ये खेळाडू मैदानावरील पहिल्या छिद्रापासून सुरुवात करून अठराव्या छिद्रावर खेळ संपवतात.
729	travel	बोवन आयलंड ही, कयाकिंग, हायकिंग, दुकाने, उपहारगृहे आणि आणखी बरेच काही देऊ करणारी, एक दिवसीय किंवा वीकेंडसाठी प्रसिद्ध सहल आहे.
1427	science/technology	उदाहरणार्थ, जगातील सर्वात सामान्य स्टील इमेज फोटोग्राफीचे स्वरूप 35 मिमी आहे, जो अ‍ॅनालॉग फिल्म युगाच्या शेवटच्या चित्रपटाचा प्रमुख आकार होता.
865	health	थंड हवामानात श्वसनाच्या समस्या, उष्ण हवामानात आतड्यांसंबंधी समस्या बर्‍यापैकी सामान्य असतात तसेच अनेक बाबतीत स्पष्टपणे त्रासदायक असतात परंतु वास्तविक धोकादायक नसतात.
205	travel	सुमारे 10 मिनिटांपूर्वी दुसऱ्या प्रयत्नात ते जमिनीवर उतरण्यापूर्वी ते गायब झाले.
374	science/technology	पृथ्वीवर २०० पाउंड (९० किलो) वजन असलेल्या व्यक्तीचे वजन आयओवर सुमारे ३६ पाउंड (१६ किलो) असेल. म्हणजे, गुरुत्वाकर्षणाचा जोर, अर्थातच, तुमच्यावर कमी असतो.
275	politics	प्रतिनिधी क्लिफ स्टार्न्स द्वारा आयोजित केलेल्या पैशांचा पालक कसा खर्च करतो आणि त्याचा पैसा कसा नोंदवतो याबद्दलच्या प्रलंबित चौकशीमुळे कोमेन्सच्या धोरणाने नियोजित पालकत्व अपात्र ठरविले आहे.
1991	travel	एखाद्या संकल्पनेवर आधारित जर सुती घालवायची असेल तर अंतर्गत जल वाहतूक ही उतम आहे.
349	science/technology	शास्त्रज्ञ अणुभट्टी तयार करण्यासाठी कार्यरत आहेत ज्यामुळे त्याच प्रकारे ऊर्जा निर्माण होऊ शकते.
1325	science/technology	कर्टिस कूपर, मध्य मिसूरी येथील विद्यापीठातील गणितज्ज्ञ आणि विज्ञानाचे प्राध्यापक यांनी २५ जानेवारी रोजी माहीत असलेल्या सगळ्यात मोठ्या मूळसंख्येचा शोध लावला.
1854	travel	युरोप हा खंड तुलनेने लहान आहे परंतु त्यात अनेक स्वतंत्र देश आहेत. सामान्य परिस्थितीत, अनेक देशांतून प्रवास करणे म्हणजे अनेक वेळा व्हिसा अनुप्रयोग आणि पासपोर्ट नियंत्रणाद्वारे जाणे होय.
946	geography	पांढरा समुद्र - बाल्टिक कालवा आर्क्टिक महासागरास बाल्टिक समुद्राशी ओनेगातलाव, लाडोगा तलाव आणि सेंट पीटर्सबर्ग  बहुतांश नद्या आणि तलावाद्वारे जोडला गेलेला आहे.
182	politics	"""""""आता हे सार्वजनिक आरोग्य आणि गुन्हे संबधी न्यायाच्या दृष्टीकोनातून महत्वाचे आहे की तो कायदा आता लवकरात लवकर लागू करण्यात यायला हवा,"""" एक सरकारी प्रतिनिधी म्हणाला."""
1288	politics	गळतीनुसार दस्तऐवज सीमा विवादास संदर्भित करेल, जे पॅलेस्टाईनला 1967 च्या मध्ययुद्धापूर्वीच्या सीमांवर आधारित हवे आहे.
1639	science/technology	अणू अत्यंत लहान असतात इतके की ते एका लहान आकारमानात कोट्यवधीच्या संख्येत बसू शकतात.
69	entertainment	बँडने माऊइचे युद्ध स्मारक असलेल्या स्टेडिअमवरील ९,००० लोक उपस्थित राहणार असलेला शो रद्द केला आणि चाहत्यांची माफी मागितली.
12	sports	ब्रिस्बेन खुल्या स्पर्धेत तो अलिकडे राओनिककडून पराभूत झाला होता.
508	health	अवधान त्रुटी विकृती हे एक चेतासंस्था संलक्षण आहे ज्यामध्ये  आवेग, विकर्षणशीलता आणि अतिक्रिया शीलता किंवा अतिरिक्त उर्जा यांचा अभिजात त्रिवेणी संगम आहे.
1794	travel	जर हिवाळ्यात उत्तर बाल्टिक ओलांडत असाल, तर केबिनचे स्थान तपासा, कारण बर्फातून प्रवास करताना जे अत्यंत प्रभावित आहेत त्यांच्यासाठी भयानक गोंधळ करू शकते.
667	entertainment	ईबे किंवा क्रेगलिस्टसारख्या लिलाव वेबसाईटद्वारे ऑनलाइन विक्री केलेली अनेक तिकिटे अंशत: मल्टी-डे पार्क-हॉपर तिकिटे वापरली जातात.
127	entertainment	जॉन स्टीवर्ट आणि स्टीफन कोलबर्टच्या न्यूज पॅरोडी शोवर त्यांच्या अनेक लेखकांचा मोठा प्रभाव पडला आहे.
1236	sports	जानकार्लो फिसिकेलाचा गाडीवरील ताबा सुटला आणि शर्यत सुरू झाल्यावर लगेचच संपली
160	sports	स्टिवर्ट, गॉर्डन, केन्सथ आणि हार्विक यांनी सिझनमध्ये चार रेस शिल्ल्क असताना ड्रायव्हर स्पर्धेसाठी सर्वोच्च दहा जागांमध्ये स्थान मिळवले आहे.
1732	geography	सुंदरवनचे क्षेत्रफळ 3,850 किमी² आहे, त्यातील सुमारे 1 तृतीयांश भाग पाणी/दलदलीने व्यापलेला आहे.
1940	geography	स्मयर्ना हे कधी काळी प्राचीन शहर होते, आता ते एका मोठ्या उपसमुद्राशेजारी स्थित आणि डोंगरांनी वेढलेले आधुनिक विकसित आणि व्यस्त असे व्यापारी केंद्र आहे.
37	entertainment	PBS शो कडे 2 डझनाहून अधिक एमी पारितोषिके आहेत आणि त्याची धाव फक्त सेसमी स्ट्रीट आणि मिस्टर रॉजर्स नेबरहूड पेक्षाच कमी आहे.
726	entertainment	या उद्यानासभोवती अनेक उपाहार गुहे आहेत आणि दुपारी आणि संध्याकाळी इथे बर्‍याचदा मध्यवर्ती व्यासपीठावरून  मोफत मैफिलींचे आयोजन केले जाते.
1507	science/technology	मार्गदर्शक आभासी किंवा वास्तविक दोन्ही असू शकतात, वेगळ्या शब्दांत सांगायचे तर, शिक्षकाप्रमाणे मायक्रोसॉफ्ट ऑफिसमधील छोटा पेपरक्लिप मॅनही मार्गदर्शकच असतो.
1318	sports	"""डस्टिन """"गोल्डस्ट"""" रनल्सने अशी टिप्पणी दिली की """"लुना माझ्या इतकीच विचित्र होती...कदाचित त्याहूनही अधिक...मी तिच्यावर प्रेम करतो आणि मला तिची आठवण येईल...आशा आहे की ती आणखी चांगल्या ठिकाणी आहे."""""""
379	science/technology	चरणे घडतात कारण केवळ शुक्राच्या (किंवा चंद्राच्या) सूर्याच्या दिशेने असलेल्या एका बाजूलाच प्रकाश आहे. शुक्राच्या चरणांनी सूर्याभोवती फिरणार्‍या ग्रहांच्या कोपर्निकस या सिद्धांताचे समर्थन केले.
