index_id	category	text
324	geography	हे वादळ जे मियामी, फ्लोरिडापासून अंदाजे 3,000 मैल अंतरावर स्थित आहे त्यामध्ये 40 मैल प्रती तास (64 किमी प्रती तास) कमाल सतत वारा आहे.
118	entertainment	खेळाचे निर्माते कोनामी यांनी आज एका जपानी वृत्तपत्राला सांगितले की ते सिक्स डेज इन फाल्लुजाह प्रदर्शित करणार नाहीत.
1018	entertainment	गोस्लिंग आणि स्टोन यांना अनुक्रमे सर्वोत्तम नट आणि नटी यासाठी नामनिर्देशन मिळाले.
523	health	तुम्ही दर वीस किंवा तीस मिनिटांनी जागे होत असाल आणि टीव्ही पाहत असाल तर यामुळे थकवा येऊ शकतो
1637	science/technology	तुमच्याकडे मिश्र धातु देखील असू शकतात ज्यामध्ये कार्बन सारख्या धातू विरहित मूलद्रव्यांचा कमी प्रमाणात समावेश असतो.
749	travel	तुमच्या स्वत:च्या कारमध्ये बसणे आणि दूरच्या प्रवासासाठी जायला निघणे यास साधेपणाचे एक अंतर्निहित आवाहन असते.
1575	science/technology	बायनरी नंबर मध्ये 2 किमतीमधील केवळ 1 मूल्य असू शकते, उदा. 0 किंवा 1 आणि या क्रमांकांना बायनरी अंक असे संबोधले जाते - किंवा बिट्स, संगणक शब्द्जालामध्ये  वापरण्यासाठी.
524	health	प्रभाव हा तुमचा मेंदू दररोज रात्री किती वेळा स्वप्न पाहण्याचा प्रयत्न करतो यावर अवलंबून असतो.
358	science/technology	"""""""फोटॉन"""" नावाच्या प्रकाशाचा एक सूक्ष्म कण प्रकाशित करण्याद्वारे ते हे करतात. """
999	health	इतर काही तज्ञांप्रमाणेच , मधुमेह बरा होतो की नाही याविषयी तो साशंक आहे, या शोधाचा आधीच प्रकार १ मधुमेह असणाऱ्या लोकांशी काही संबध नाही.
1359	science/technology	सिंह सर्वाधिक सामाजिक मांजरी आहेत, ज्या प्राइड्स नावाच्या मोठ्या समूहात राहतात.
311	entertainment	दाम्पत्याचे लग्न एक वर्षापूर्वी टेक्सासमध्ये झाले होते आणि ते बफेलोमध्ये मित्र व नातेवाईकांबरोबर आनंद साजरा करण्यासाठी आले होते.
1917	entertainment	नौकाविहार ही फिनलँडमध्ये राष्ट्रीय करमणूक आहे, ज्यात प्रत्येकी ७ ते ८ लोक एका बोटीमध्ये सैर करतात.
1771	geography	उत्तरीय तटावरील किनारे (उत्तर हार्बर जिल्ह्यातील) प्रशांत महासागराचे आहेत आणि ते उत्तरेतील लॉंग बे पासून दक्षिणेत डेव्हनपोर्टपर्यंत पसरलेले आहेत.
361	science/technology	फोटॉन्स हे अनेक अणु ज्या पदार्थापासून बनलेले असतात त्यापेक्षा देखील लहान असतात!
196	health	या विषाणूच्या सौम्य प्रकारासाठी अरियासची चाचणी पॉझिटिव्ह आली, असं अध्यक्षीय मंत्री रोड्रीगो अरियास यांनी सांगितलं.
951	travel	आपण एखाद्या अलायन्समधून आपली फ्रिक्वेंट फ्लायर एयरलाईन काळजीपूर्वक निवडली पाहिजे.
878	health	संसर्ग झालेल्या व्यक्तीच्या सान्निध्यात आल्यामुळे साथीच्या रोगांचा प्रसार सहज होऊ शकतो.
214	sports	गोल्फ आणि रग्बी दोन्ही ऑलिम्पिक गेम्समध्ये पुनरागमन करण्यासाठी तयार आहेत.
509	health	"""ही शिकण्याची दुर्बलता नसून शिकण्याची समस्या आहे; तिचा परिणाम """"३ ते ५ टक्के मुलांवर होतो, कदाचित जवळ जवळ २० लाख अमेरिकन मुलांवर होतो""""."""
332	entertainment	जागतिक कीर्तीचा समूह सर्क्यु ड्यू सोलेल यांच्या विशेष कार्यक्रमाने सोहळ्याची सुरवात झाली.
835	travel	अन्य प्रकरणी, केवळ प्रवासी निवासांच्या बाहेर राहणाऱ्यांनी नोंदणी करणे गरजेचे आहे. परंतु, यामुळे हा कायदा अधिकच धूसर बनतो, म्हणून आधीच माहिती करुन घ्यावी.
298	politics	प्रतिनिधी सभागृहाने पहिल्यांदा दुसरे वाक्य हटवले तेव्हा या विधान सत्राने बदल केले आणि त्यानंतर सिनेटने सोमवारी तत्सम स्वरुपात हे पारित केले.
392	politics	फ्रान्सची लढाई संपल्यानंतर, जर्मनी ब्रिटनच्या बेटावर आक्रमण करण्यासाठी सज्ज होऊ लागले.
1211	entertainment	१९८९ मध्ये त्याने ब्रूक आणि ग्रोअनिंगसह सिम्पसन्स तयार करण्यात मदत केली आणि कार्यक्रमाच्या पहिल्या लेखक गटाला नोकरीसाठी निवडण्याची जबाबदारीही त्याची होती.
204	travel	द ट्विन ऑटर विमान पीनजी उड्डाण सीजी4684 म्हणून काल कोकोडा इथे उतरण्याचा प्रयत्न करीत होते, एकदा आधीच ते रद्द करण्यात आले  होते..
916	science/technology	ट्रान्सलेशन इंजिन्स नाटकीयरित्या सुधारले आहेत, तसेच ते आता अनेकदा अधिक किंवा कमी अचूक अनुवाद (आणि अधिक क्वचितच गिब्बरीश) प्रदान करतात परंतु काही काळजी योग्य आहे कारण त्यांना अद्याप हे सर्व चुकीचे वाटले असेल.
535	entertainment	हे तेव्हा असते जेव्हा लोक एका ठिकाणाहून दुसरीकडे जातात, हे दैनंदिन क्रियांपेक्षा खूप वेगळे असते आराम करण्याकरिता आणि आनंद घेण्यासाठी.
658	health	उन्हाळ्यात नॉर्डिक डासांकडे देखील लक्ष द्या. जरी ते कोणत्याही रोगांचाप्रसार करीत नाहीत, तरीही ते त्रासदायक ठरू शकतात.
353	science/technology	पाण्याचे रेणू पाण्याच्या पृष्ठभागावर एक अदृश्य स्तर बनवतात ज्यामुळे सुईसारख्या गोष्टी पाण्यावर तरंगू शकतात.
1520	health	ऑलिव्हर सॅक्स यांनी त्यांच्या पेपर 'द प्रेसिडेंट स्पीच' मध्ये असे म्हटले आहे की जे लोकं मेंदूच्या क्षितीमुळे भाषण समजण्यास असमर्थ आहेत परंतु तरीही ते प्रामाणिकपणाचे अचूक मूल्यांकन करू शकतात.
1331	politics	ते 2016 मध्ये राष्ट्रपतीपदासाठी प्रयत्न करतील याचा अंदाज होता.
295	health	हेलिकॉप्टर्सनी त्या बारा कर्मचारी सदस्यांना वाचवलं आणि केवळ एकाच्या नाकाला दुखापत झाली.
569	science/technology	दिलेल्या भौगोलिक क्षेत्रामध्ये आढळणाऱ्या विशिष्ट प्रजातींच्या जीवांचा संग्रह म्हणजे लोकसंख्या.
926	science/technology	जर ड्रोन वापरत असाल तर, तुम्हाला काय चित्रित करण्याची परवानगी आहे आणि कोणत्या परवानग्या किंवा अतिरिक्त परवान्याची आवश्यकता आहे हे आधीच तपासून ठेवा.
854	travel	मेट्रोप्लस अधिक आरामदायक आणि कमी गर्दीचे आहे परंतु थोडे अधिक खर्चिक आहे, तथापि युरोपमधील सामान्य मेट्रो तिकीटांपेक्षा अद्याप थोडेसे स्वस्त आहे.
225	science/technology	गडद उर्जा हे पूर्णतः अदृश्य असे बल आहे जे सातत्याने विश्वामध्ये कार्य करीत असते.
1598	science/technology	त्यांनी दोन प्रयोग केले त्यामध्ये एकतर फेजमधील डीएनए चे एका किरणोत्सारी फॉस्फरससोबत किंवा फेजचा प्रोटीन किरणोत्सारी सल्फरसोबत मार्किंग केले.
771	entertainment	सजवलेल्या हत्तींसह काढलेल्या मिरवणुका, मंदिरातील वाद्यवृंद आणि इतर उत्सव यांसह केरळचा मंदिरांचा उत्सव पाहण्यासारखा असतो.
856	travel	इतरांसाठी वाहून नेणे - तुम्ही तुमच्या बॅग्स कधीही नजरेआड होऊ देऊ नका, विशेषतः जेव्हा तुम्ही आंतरराष्ट्रीय सीमा पार करत असता.
23	sports	आजचा 'प्लेअर ऑफ द डे' हा वॉशिंग्टन कॅपिटल्सचा अ‍ॅलेक्स ओवेचकिन आहे.
432	politics	लक्झेमबर्गचा इतिहास प्रदीर्घ आहे परंतु त्याचे स्वातंत्र्य 1839 पासूनचे आहे.
1804	travel	सफारी या आफ्रिकेतील पर्यटनाला कदाचित सर्वात जास्त चालना देतात आणि त्या अनेक पाहुण्यांसाठी मुख्य आकर्षण असतात.
533	sports	हा खेळ गवतावर खेळला जातो आणि छिद्राभोवतीचे गवत आणखी बारीक कापले जाते आणि त्याला ग्रीन म्हणतात.
434	politics	लक्झेंबर्ग हा नेहमी तटस्थ राहण्याचा प्रयत्न करणारा देश आहे परंतु पहिल्या आणि दुसऱ्या दोन्ही महायुद्धात तो जर्मनीने व्यापला होता.
128	entertainment	कलात्मक कार्यक्रम हा देखील रोमानियन राजधानीची प्रतिमा पुन्हा सर्जनशील आणि असंख्य रंगांनी नटलेले शहर अशी करू इच्छिणाऱ्या बुखारेस्ट सिटी हॉलच्या मोहिमेचा एक भाग आहे.
810	sports	कॅन्यनिंगमध्ये पोहणे, चढणे आणि उड्या मारणे यांचा समावेश आहे -- पण यासाठी (उदाहरणार्थ रॉक क्लायंबिंग, स्कूबा डायव्हिंग किंवा आलपाईन स्किंग यांच्या तुलनेने) प्रशिक्षण किंवा शारीरिक घडणीची गरज कमी आहे.
1327	science/technology	धूमकेतू शक्यतो सेंद्रिय पदार्थांसह पृथ्वीवर पाण्याचे वितरण करण्यारे स्रोत असतील जे प्रथिने तयार करू शकतात आणि जीवनाला आधार देतात.
638	science/technology	1977 मध्ये, डॉ. दमाडियन यांनी प्रथम “संपूर्ण शरीरासाठी” एमआरआय स्कॅनर तयार केला, ज्याला त्यांनी “इंडोमिटेबल” म्हटले.
269	sports	21 वर्षाचा जीजस गेल्या वर्षी 2017 मॅंचेस्टर सिटीला ब्राजीलच्या पाल्मेरास क्लबकडून 27 मिलियन पाउंड मध्ये जॉइन झाला
1364	science/technology	वाघ हा सिंह, बिबट्या आणि जग्वार यांच्याच प्रजातीचा (प्रजाती पंथेरा) आहे. फक्त या 4 मांजर वर्गातील प्राणी डरकाळी फोडू शकतात.
989	geography	हिमनद्या स्थिर नसतात, त्या डोंगरावरून खाली वाहतात. यामुळे भेगा, तडे निर्माण होतील जे बर्फाच्छादित पुलांद्वारे अस्पष्ट होऊ शकतात.
864	health	अशाप्रकारे दिल्ली बेलीचे शाप, फारोआचा शाप, मोन्तेझुमाचा बदला, आणि त्यांचे अनेक मित्र.
595	science/technology	पेशी हे सजीवांचे (जिवंत वस्तू) सर्वात लहान रचनात्मक आणि कार्यात्मक एकक आहे.
571	science/technology	व्यक्ती जेव्हा एखाद्या विशिष्ट स्वभाववैशिष्ट्याच्या छटा दाखवतात तेव्हा ते पॉलिमॉर्फिक असतात.
924	science/technology	सामान्य छायाचित्रणासाठी आवश्यक असणारे नियम हे व्हिडिओ रेकॉर्डिंगसाठी देखील लागू पडतात, कदाचित अधिकच म्हणावे लागेल.
570	science/technology	जेव्हा एखाद्या लोकसंख्येतील सर्व व्यक्ती त्यांच्या विशिष्ट फेनोटायपिक गुणधर्माच्या बाबतीत एकसमान असतात तेव्हा त्यांना मोनोमॉर्फिक म्हणतात.
1273	sports	महिलांच्या बैठ्या गटात चार स्की खेळाडूंना त्यांची शर्यत पूर्ण करता आली नाही आणि जायंट स्लॅलॉममधील ११७ स्की खेळाडूंपैकी ४५ जणांना शर्यतीत क्रमांक पटकावता आला नाही.
1400	politics	"""स्वातंत्र्याच्या जाहीरनाम्याच्या मागील बाजूस हे शब्द लिहिले होते """"4 जुलै 1776 चा मूळ स्वातंत्र्य जाहीरनामा"""". हा मजकूर या दस्तऐवजाच्या तळाशी, विरुद्ध दिशेने दिसतो. """
664	travel	वॉल्ट डिस्ने वर्ल्ड ला जाणे म्हणजे अनेक अमेरिकन कुटुंबाच्या दृष्टीने तीर्थक्षेत्राला जाण्यासारखेच असते.
1737	travel	पारो (नू १५०) आणि पुनाखा (नू २००) सारख्या जवळपासच्या ठिकाणांना भेट देण्यासाठी शेअर केलेल्या टॅक्सी हा जलद आणि आरामदायी पर्याय आहे.
457	science/technology	झूम लेन्सचा आणखी एक तोटा म्हणजे लेन्सचे कमाल एपर्चर (वेग) सहसा कमी असते.
1051	politics	त्याच्या 78 शिफारशींपैकी प्रथम म्हणजे विरोधी हस्तक्षेपांविरूद्ध इराकच्या सीमा सुरक्षित करण्यासाठी आणि त्याच्या शेजारील राष्ट्रांसोबत राजनैतिक संबंध पुन्हा स्थापित करण्यासाठी या वर्षाच्या अखेरीस एक नवीन परराष्ट्रसंबंधाविषयक कुशलतापूर्वक पुढाकार घ्यावा.
870	travel	तुम्ही शिबिरासाठी बाहेर जात असाल तर साप, विंचू वगैरेंना दूर ठेवण्यासाठी कॅम्प कॉट किंवा झोपाळा सोबत घ्या.
1735	travel	आंतर-जिल्हा बसेस बर्‍याचदा पूर्ण भरलेल्या असतात, त्यामुळे काही दिवस आधीच तिकीट खरेदी करणे योग्य राहील.
1852	sports	एखाद्या हायकिंग मार्गाप्रमाणे स्कीइंग मार्गाचा विचार करा.
816	sports	ग्लोबल रनिंग टूर्स चे उत्तराधिकारी, गो रनिंग टूर्स हे 4 खंडामध्ये डझनाच्या वर साईटरनिंग देऊ करणाऱ्यांचे जाळे करीत आहे.
986	geography	नॉर्वे मधील विशेष म्हणजे तीव्र फर्गन आणि दऱ्या जे एकदम उंच, मोठ्या लहान अशा पठारांना मार्ग देतात.
1786	travel	ट्रॅव्हल एजंटद्वारे अनेकदा ठराविक हॉटेल्ससोबत डिल्स केल्या जातात, तरी देखील तुम्हाला ट्रॅव्हल एजंटच्या माध्यमातून कॅम्पिंग ग्राउंड्स सारखे निवासाचे इतर प्रकार बुक करणे शक्य आहे.
833	travel	यासाठी कदाचित स्थानिक पोलिसांच्या मदतीने फॉर्म भरण्याची किंवा इमीग्रेशन कार्यालयांना भेट देण्याची आवश्यकता असू शकते.
597	science/technology	आपण सूक्ष्मदर्शकाखाली सजीव पाहिले तर, ते लहान चौकोन किंवा चेंडूंपासून बनलेले असल्याचे तुम्हाला दिसेल.
1281	health	त्याला सुरुवातील ग्रेट यारमाउथ येथील जेम्स पॅगेट रुग्णालयात दाखल केले होते.
1472	politics	युएसच्या फिलिपिन्सवरील साम्राज्यवादी विजयाच्या युद्धाचा खर्च फिलिपिन्सच्या लोकांनीच दिला.
1011	sports	आमच्या अ‍ॅथलेट्स आणि क्लबचे हितसंबंध असलेल्या  USOC च्या विधानासह आम्ही सहमत आहोत आणि आणि त्याऐवजी निर्धारण करण्यापेक्षा, आमच्या संस्थेमध्ये अर्थपूर्ण बदलासह पुढे जाऊन त्यांचा खेळ, उत्तम प्रकारे खेळला जाऊ शकतो.
1674	science/technology	हे आपल्याला आपल्या मनातील प्रक्रिया जाणून घेण्यासाठी मदत करणारे सिम्युलेशन मॉडेल तयार करण्यासाठी खूप माहिती आणि साहित्य देते.
805	health	घरी असताना डोळे तपासून घेणे, विशेषत: जेव्हा ते विमा संरक्षणामध्ये येते आणि प्रिस्क्रिप्शन फाइल करण्यासाठी सोबत दुसरीकडे घेऊन जाणे याचा विचार करा.
1542	politics	युद्ध संपून 2 वर्षे झाल्यानंतर आधीचे सहकारी आता शत्रू बनले होते आणि शीत युद्धाची सुरुवात झाली.
134	science/technology	एका नैसर्गिकरीत्या सापडणाऱ्या एक पेशीय करेनिया ब्रेव्हीस या सजीवाच्या सामान्य पेक्षा अधिक प्रमाणामुळे लाल भरती होते.
