index_id	category	text
431	geography	तुर्कस्थान ला 3 बाजूनी समुद्रांनी वेढले आहे: पश्चिमेस एजियन समुद्र, उत्तरेस काळा समुद्र आणि भूमध्य सागर समुद्र दक्षिणेला.
403	science/technology	युद्धाच्या आरंभी त्यांनी बहुतांशी समुद्रावरुनच प्रवास केला, परंतु रडारचा विकास झाला आणि ते अधिक अचूक झाल्यानंतर नजरेस पडणे टाळण्याकरिता पाणबुड्यांना पाण्याखाली जाणे भाग पडले.
1592	science/technology	जसे ग्रीकांचे ज्ञान ओसरले, तेव्हा पश्चिमेला हे लक्षात आले की ते ग्रीक तत्वज्ञान आणि शास्त्र यांच्या मूळापासून तोडले गेले आहेत.
993	entertainment	परंतु, हिवाळ्यात त्यांच्याकडे एक भिन्न सौंदर्य आणि आकर्षकपणा असतो, अनेक गिरीस्थानांवर भरपूर प्रमाणात बर्फ पडतो आणि स्किईंग आणि स्नोबोर्डींगसारखे खेळ खेळायला मिळतात.
755	entertainment	ही हॉटेल्स अशी होती जिथे दिवसा श्रीमंत आणि प्रसिध्द लोक राहत असत आणि अनेकदा उत्तम जेवण आणि नाईटलाइफ देखील उपलब्ध असत.
1936	politics	1994 मध्ये हा विवाद मोल्दोवा मध्ये स्वयंघोषित ट्रान्सनिस्त्रीया प्रजासत्ताक निर्माण करण्यास कारणीभूत झाला, ज्याकडे आपले स्वत:चे शासन आणि चलन आहे परंतु कोणत्याही यूएन सदस्य देशाने यास मान्यता दिलेली नाही.
1205	health	संयुक्त राष्ट्रांचे या रोगाचे तज्ज्ञ, डॅनिअल लॅन्टॅग्ने म्हणाले की उद्रेक शांततादुतांद्वारे झालेला असू शकतो.
1692	geography	उत्तरेकडे आणखी पुढे लोकसंख्या अतिशय विरळ आहे आणि त्यातील काही भाग निर्जन जंगलाचा भाग आहे.
280	politics	निषेधाच्या आयोजकांनी सांगितले की बर्लिन, कोलोन, हॅम्बर्ग आणि हॅनोवर अशा जर्मन शहरांमध्ये सुमारे 100,000 लोकं आले होते.
247	politics	पाकिस्तान संविधानाच्या कलम 247 नुसार हे प्रतिनिधी शासकीय आणि न्यायालयीन सेवा देण्यास जबाबदार आहेत.
1439	politics	शत्रुत्वाच्या उद्रेकानंतर ब्रिटनने लगेचच जर्मनीच्या नौदलाची नाकेबंदी सुरू केली.
1239	entertainment	"""""""ती फार क्यूट आहे गाते देखील खूप छान"""" त्याने एका  छापलेल्या कागदात पाहून एका पत्रकार परिषदेमध्ये सांगितले."""
743	geography	कूक आयलंडवर कोणतीही शहरे नाहीत पण ती १५ वेगवेगळ्या आयलंडने बनलेली आहेत. त्यातील रारोतोंगा आणि ऐतुताकी ही मुख्य होत.
18	politics	जगभरात निदर्शने झाली, अनेक गुन्हेगारांना शिक्षा झाली आणि आईसलँड आणि पाकिस्तान सरकारांच्या दोन्ही प्रमुखांनी राजीनामे दिले.
1344	science/technology	हायड्रोजन आयन हे प्रोटॉन आहेत त्यांचे इलेक्ट्रॉन त्यांनी काढून टाकले होते (जसे की हायड्रोजन अणूंमध्ये एक प्रोटॉन आणि एक इलेक्ट्रॉन असतो)
688	travel	मर्यादित वेळ असणारे भेट देणारे हे त्यांचा वेळ कुठेतरी घालवण्यासाठी सर्वोत्तम
556	science/technology	अणूला सर्व वस्तूंच्या मूलभूत रचनात्मक घटकांपैकी 1 घटक मानला जाऊ शकतो.
1645	science/technology	एखादी अवजड गाडी टेकडीवर ढकलत नेण्यासारखे आहे. केंद्रक वर पुन्हा विभाजित केल्यानंतर त्यापैकी काही ऊर्जा मुक्त होते.
907	science/technology	ते सामान्यतः उच्चतम बँडविड्थ आणि उत्तम दर्जाची सेवा देतात. ते एनक्रिप्टेड असतात आणि म्हणून त्यांच्यावर टेहळणी करणे अवघड असते.
1071	politics	परंतु पंतप्रधान जॉन हॉवर्ड हे म्हणाले आहेत की हा कायदा केवळ टास्मानिय सरकारकडून या दवाखान्याच्या सोयी सुविधा कमी प्रतीच्या करू नयेत याची सुरक्षा करण्यासाठी आहे, अतिरिक्त AUD$45 मिलियन देऊन.
555	sports	खेळाडूंना असे वाटू शकते की ते एखाद्या अशा उत्पादनास प्राधान्य देतात ज्यामुळे कोणतेही वास्तविक फायदे मिळत नाहीत.
1203	health	सैनिक येण्यापूर्वी, हैतीला 1800 पासून या रोगाशी संबंधित समस्या उद्भवल्या नव्हत्या.
58	politics	पोलिसांनी सांगितलं की लो पिकोलो वरचढ होता कारण तो प्रोवेनझानोचा पालेर्मोमधला उजवा हात होता आणि त्याच्या व्यापक अनुभवामुळे त्याला ज्येष्ठांच्या वृद्ध पिढीचा आदर जिंकता आला कारण त्यांनी आपले ताकदीचे नेटवर्क बळकट करताना शक्य तितके कमी प्रसिद्धीत राहण्याचे प्रोवेनझानोचे धोरण पुढे चालवले होते.
1764	travel	याव्यतिरिक्त, अस्वले आणि इतर वन्य प्राण्यांना आकर्षित करणाऱ्या वासापासून सावध रहा, म्हणून शिजवलेले सुवासिक अन्न नेणे टाळा आणि कॅम्प स्वच्छ ठेवा.
195	sports	2009 सिझनच्या उर्वरित भागांमध्ये मस्सा बाहेर पडणार आहे.
1785	travel	आधीच नोंदणी करणे प्रवाशास मनाची शांती देते की त्यांच्या गंतव्य स्थानी गेल्यानंतर त्यांना झोपण्यासाठी कुठेतरी जागा मिळेल.
600	science/technology	मूलद्रव्ये आणि संयुगे 1 अवस्थेतून दुसऱ्या अवस्थेत जाऊ शकतात आणि बदलत नाहीत.
553	sports	मध्यम अंतर धावणे हा तुलनेने स्वस्त खेळ आहे; तथापि, भाग घेण्यासाठी आवश्यक असलेल्या काही उपकरणांबाबत अनेक गैरसमज आहेत.
1720	geography	उद्यानाने 19,500 km² क्षेत्र व्यापलेले आहे आणि 14 वेगवेगळ्या इकोझोनमध्ये विभागले गेले आहे, जे प्रत्येक विविध वन्यजीवाला समर्थन करते.
1622	geography	अॅमेझॉन नदी ही पृथ्वीवरील दुसरी सर्वात लांब आणि सर्वात मोठी नदी आहे. ती दुसरी सर्वात मोठी नदी म्हणून ८ पटापेक्षाही अधिक पाणी वाहून नेते.
1441	politics	ब्रिटनने महासागराच्या एका संपूर्ण भागामध्ये जहाजांच्या प्रवेशाला बंदी घालण्यासाठी आंतरराष्ट्रीय पाण्यामध्ये (कोणत्याही देशाचा अधिकार नसलेला महासागराचा भाग) सुरुंग लावला.
566	health	दृष्टी किंवा पाहण्याची क्षमता हे दृष्टी प्रणाली चेता अवयव किंवा डोळ्यांवर अवलंबून असते.
1515	science/technology	इंटरनेटचे वेगळे गुणधर्म, वापर आणि समाधानासंबंधीचा दृष्टीकोण यांसारख्या आणखी दिशांकडे घेऊन जातात.
585	science/technology	तथापि, 16 व्या शतकाच्या उत्तरार्धात युरोपमध्ये प्रथम वास्तविक दुर्बिणी बनविल्या गेल्या.
1689	geography	ओटावा ही कॅनडाची अतिशय आकर्षक, द्विभाषिक राजधानी आहे तसेच कॅनडाचा भूतकाळ आणि वर्तमान सांगणारी अनेक वैशिष्ट्यपूर्ण कला प्रदर्शने आणि संग्रहालये येथे आहेत.
1256	health	या स्फटिकांची रचना ही इन्फ्रारेड स्पेक्ट्रोस्कोपी (FTIR) द्वारे तुलना केलेल्या प्रभावित पाळीव प्राण्यांच्या मूत्रात आढळलेल्याशी स्फटिकांशी जुळते.
60	science/technology	अॅपल सीईओ स्टीव जॉब्ज मंचावर चालत आले आणि आपल्या जिन्सच्या खिशातून आयफोन काढून त्याचे अनावरण केले.
32	sports	अलोन्सोच्या पुढे असणाऱ्या कार इंधन भरण्यासाठी सेफ्टी कारच्या खाली जाताच, त्याने विजय मिळवण्यासाठी वेग घेतला.
1411	politics	क्रांतिकारी युद्ध चालू असताना, तेरा राज्यांनी एक कमकुवत मध्यवर्ती सरकार बनवले - फक्त कॉंग्रेस हाच त्याचा महत्वाचा भाग होता - संघराज्यातील कलमानुसार.
13	sports	नदालने सामन्यात 88% नेट पॉइंट्स मिळवत पहिल्या सर्व्हिस मध्येच 76 पॉइंट्स मिळवले.
1941	travel	जरी या शहराचे तापमान पारंपारिक तुर्की पेक्षा अधिक मध्यपूर्व युरोप सारखे असले तरी विस्तीर्ण दुतर्फा वृक्ष असलेले रस्ते आणि पारंपारिक लाल छपरे असलेली आधुनिक विक्री केंद्रे, 18 व्या शतकातील बाजार आणि जुन्या मशिदी आणि चर्च.
732	sports	व्हिसलर ( व्हँकूव्हर पासून 1.5 तासाच्या अंतरावर) हे महाग आहे परंतु 2010ऑलिम्पिक मुळे प्रसिद्ध आहे.
871	entertainment	तुमच्या घरी सकाळची सुरुवात समृद्ध कॉफीने करा आणि रात्री आल्हाददायक कॅमोमाइल चहाने तृप्त व्हा.
886	geography	अंटार्क्टिका हे पृथ्वीवरील सर्वात थंड ठिकाण आहे आणि दक्षिण ध्रुव देखील याने वेढलेला आहे.
362	science/technology	शेकडो तासांच्या कार्यानंतर त्या बल्बचा फिलामेंट अखेर जळून जातो आणि तो लाईट बल्ब पुढे निकामी होतो.
1578	health	त्या विशिष्ट विषा साठी विशिष्ट प्रथमोपचाराच्या सूचनांचे लेबल तपासून पहावे.
996	travel	या सर्व प्रकरणांमध्ये, तुम्ही फोनद्वारे थेट विमान कंपनीकडे बुक करायला हवे.
197	health	राष्ट्रपतीची प्रकृती स्थिर आहे, परंतु कित्येक दिवस त्याला घरात एकांतात ठेवले जाणार आहे.
460	entertainment	बहुतेक टेलिव्हिजन हे सामान्य जनतेला खुश करण्यासाठी तयार केले जातात.
154	geography	पृथ्वीवर पडलेल्या अंदाजे 24,000 उल्कांपैकी, केवळ 34 मंगळावरून आल्याचे पडताळणीत सिद्ध झाले आहे.
1160	politics	अधिकाऱ्यांनी मतदाराची ओळख सत्यापित केल्यानंतर, मतदार लिफाफा बॅलेट बॉक्समध्ये टाकतो आणि मतदान रोलवर सही करतो.
1223	entertainment	लिड सिंगर स्टीवन टायलर 5 ऑगस्ट रोजी परफॉर्म करताना स्टेजवरुन पडून जखमी झाल्यानंतर त्यांनी हा टूर रद्द केला आहे.
54	politics	पीटर कॉस्टेलो , ऑस्ट्रेलियन खजानीस आणि पंतप्रधान जॉन हॉवर्ड यांच्या नंतर उदारमतवादी पक्षाचे नेते mhanun जागा घेण्याची सर्वाधिक शक्यता असणारे, यांनी आपला पाठींबा ऑस्ट्रेलियातील अणुउर्जा उद्योगाला देऊ केलेला आहे.
7	politics	पोलिसांचा पाहारा असलेल्या डाउनिंग स्ट्रिटच्या प्रवेशद्वारासमोर व्हाइटहॉल या पंतप्रधानांच्या शासकिय निवासस्थानावर स्थानिक वेळेनुसार (UTC+१) सुमारे ११ः०० वाजता आंदोलनाला सुरुवात झाली.
1010	sports	युएसए जिम्नॅस्टिक्सने युनायटेड स्टेट ऑलिम्पिक कमिटीच्या पत्राला पाठिंबा दर्शवला आहे आणि आपल्या सर्व अॅथलेटसाठी सुरक्षित वातावरणाचा प्रचार करण्याची ऑलिम्पिक कुटुंबाची आवश्यकता मान्य केली आहे.
1174	sports	अखेरच्या धावांनी 21 ते 20 असा एक गुण राखून विजय मिळविला, ज्याने ऑल ब्लॅकचा 15 गेम जिंकणारा वेग समाप्त केला.
1202	health	खटल्यानुसार, संयुक्त राष्ट्रांच्या छावणीतील कचऱ्याचे योग्य निर्जंतुकीकरण न झाल्याने, हैतीमधील सर्वात मोठ्या नद्यांपैकी एक असलेल्या आर्टिबोनाइट नदीच्या उपनद्यांमध्ये जिवाणूचा शिरकाव झाला आहे.
958	travel	कोणतीही विमान कंपनी दक्षिण गोलार्धातील सर्व तीन महासागरांना ओलांडत नाही (आणि स्काय टीम कोणतेही क्षेत्र ओलांडत नाही).
354	science/technology	आधुनिक आईस स्केटवरील ब्लेडला पोकळ जागा असलेली दुहेरी किनार असते. दोन्ही कडा झुकलेल्या असतानाही बर्फाला अधिक चांगल्याप्रकारे पकडण्यास परवानगी देतात.
505	science/technology	या वेबसाइट्सचे सकारात्मक पैलू आहेत, ज्यामध्ये ब्लॉग्ज, व्हिडिओ, फोटो आणि इतर वैशिष्ट्यांच्या सहित क्लास पेज सहजपणे सेट करण्यात सक्षम होणे समाविष्ट आहे.
1333	science/technology	हवाई वाहतूक नियंत्रकांना, विमानांना अधिक तंतोतंत निर्देश देता यावेत आणि वैमानिकांना अधिक अचूक माहिती मिळावी यासाठी हे पूर्वीच्या जमिनीवरील रडार आधारीत तंत्रज्ञानाच्या पूर्णपणे विरुद्ध असे उपग्रहावर आधारीत तंत्रज्ञान वापरते.
1173	sports	दक्षिण आफ्रिकेतील रस्टेनबर्ग येथील रॉयल बाफोकेंग स्टेडियमवर रग्बी युनियन ट्राय नेशन्स सामन्यात दक्षिण आफ्रिकेने ऑल ब्लॅक (न्यूझीलंड) ला पराभूत केले आहे.
945	travel	काळा समुद्र आणि कॅप्सियन समुद्र जिंकण्यासाठी वायकिंग्जनी रशियन जलमार्गांचा वापर केला. यापैकी काही मार्ग अद्याप वापरता येतात. विशेष परवान्यांसाठी संभाव्य गरज तपासून पाहा, जी मिळणे अवघड असते.
1012	sports	USA जिम्नॅस्टिक्स स्वतंत्र तपासणीचे समर्थन करते ज्यामुळे लॅरी नासरच्या वाचलेल्या लोकांद्वारे इतक्या धैर्याने वर्णन केलेल्या प्रमाणात गैरवर्तन इतक्या काळापर्यंत कसे केले जाऊ शकते तसेच आवश्यक आणि योग्य बदल स्वीकारले असते यावर प्रकाश टाकू शकते.
712	travel	गॅलापागोस वॉटर्ससाठी 60 पेक्षा जास्त क्रूझ जहाजे चालतात - जी आकाराने 8 ते 100 प्रवासी घेऊन जाणारी असतात.
1654	science/technology	2 लोकप्रिय आशय सिद्धांत हे मास्लोंची गरजांच्या चढत्या श्रेणीचा सिद्धांत आणि हर्ट्झबर्गचा 2 घटक सिद्धांत
76	politics	"""तथापि, त्यांनी त्यांच्या आधीच्या वक्तव्याचा पुनरुच्चार केला की  रो वि. वेड हा सुप्रीम कोर्टाच्या सातत्याने निकालाच्या निर्णयाचे महत्त्व सांगून """"जमीनचा तोडगा निघालेला कायदा"""" होता."""
637	science/technology	चार वर्षांनंतर पेटंट मंजूर करण्यात आले, जे MRI च्या क्षेत्रामध्ये जारी केलेले जगातील पहिले पेटंट ठरले.
1694	geography	ही पूर्व आफ्रिकी बेटे आफ्रिकेच्या पूर्वेकडील किनाऱ्याच्या हिंद महासागरात आहेत.
1559	travel	पायी चालणे ही पहिली ज्ञात वाहतूक होती, मानव दोन लाख वर्षांपूर्वी होमो इरेक्टस (म्हणजे सरळ स्थितीतील माणूस) च्या उदयाबरोबर सरळ उभा राहून चालू लागला.
679	geography	व्हिक्टोरिया फॉल हे झिम्बाब्वेच्या पश्चिम भागातील शहर आहे, ते लिव्हिंगस्टोन, झाम्बिया आणि बोट्स्वानाजवळ सीमेवर वसलेले आहे.
1049	politics	या अहवालात आरंभी मुक्त चर्चेची आणि मध्य पूर्वेच्या बाबतीत धोरणावर अमेरिकेत मतैक्य निर्मिती विनंती करण्यात आली आहे.
