index_id	category	text
1151	sports	Amaoneka otopa kwambiri pamasewero omwe anasewera ndi alongo awo akumwera, South Africa idayamba kuchita bwino mwadongosolo pamene mpikisano unali kupitilira.
1054	politics	Mtsutsowu udayamba kamba ka mkangano pakhani yogwiritsa ntchito ndalama zothandizira komaso kumangira zokhuza mphepo yamkuntho ya Katrina; pamene ena odziwa zoteteza zachuma azipatsa dzina zimenezi kuti “Bush's New Orleans Deal.”
1859	geography	Kutanthauzira kumasiyana kutengela dera, malire a zaka zobadwa amafupika ku mpoto kwa America kuposa ku Ulaya.
1007	health	Pamene katemera wina oyeselera akuwoneka kuti akuchepetsa anthu omwalira ndi Ebola, mpakana pano, palibe mankhwala amene awonetsa kuti ndiwoyenera kuchiza nthenda ilipoyi.
1076	politics	Mneneri wa a Bush a Gordon Johndroe analonjeza North Korea “Njira yofunika ndi yodalilika kukwanilitsa cholinga chothetsa zida za Nuclear ku chisumbu cha Korea”.
1099	geography	Ma satellite wonse awiri amalemera ma kupitilira paundi wokwana 1000, ndipo amayenda pafupifupi mamayilosi 17,500 pa ola, adaombana pa mamayilosi 491 pamwamba pa dziko.
1100	science/technology	Akatswiri azasayansi anena kuti kuphulika komwe kudachitika kamba kogundanako kudali kwakukulu kwambiri.
367	science/technology	Magazi amayenda mutimathyubu totchedwa ma arteries ndipo amabwelera kupita ku mtima podzera mtimathyubu totchedwa ma veins. Timathyubu tochepa kwambiri timatchedwa ma capillaries.
770	entertainment	Zikondwelero zokhudza mu kachisi zimakhala gawo lokondwelera chaka kapena kubadwa kwa timilungu kapena zikondwelero zina zokhudza tchalitchi.
279	politics	Monga boma lomwe limapeleka mphanvu zonse kwa wotsogola, Florida inapeleka nthumwi zake zonse makumi asanu kwa Romney, kumpangitsa iye kutsogola pachisankho cha mtsogoleri wa chipani chama Republican.
357	science/technology	Kuti abwerere ku mphamvu zawo zakale, iwo akuyenera kuchotsa mphamvu yowonjezera yomwe anayipeza kuchokera ku kuwala.
797	science/technology	Mukamayenda ndi laputopu kapena kompuyuta yam'manja yotchedwa tablet, muzisunga zina mu memory card kapena disc (zokuti mutha kuzipeza wopanda intaneti).
211	health	Palibe amene wavulala kwambiri, koma pafupifupi anthu asanu omwe analipo pomwe kunaphulika anawathandiza chifukwa anali wozizimutsidwa.
815	travel	Pali ma bungwe oposa ma zana awiri pa dziko lonse amene amakonza za maulendo. Ambiri mwa iwo ndi oima paokha.
238	geography	“Malingana ndi momwe tikudziwira, pali planet imodzi yokha imene inawonetsa mphamvu kuposa Titan, ndipo dzina lake ndi Dziko,” anawonjezera Stofan.
1636	science/technology	Zinthu ngati calcium ndi potaziyamu zimatengedwa ngati zitsulo.Motero, palinso zitsulo zina ngati siliva ndi golide.
761	travel	Mndandanda wa eni malo omwe alipo udaperekedwa podzera pakutsindikizidwa ndi/ kapena pa intaneti, nthawi zina ndi umboni ndi kuwunikira kwa apaulendo ena.
1676	science/technology	Kafukufuku ku Al amakhuzana kupanga makina kuti azigwira ntchito zimene zimafunika kaganizidwe ka nzeru.
848	entertainment	Ma boomerang ambiri omwe alipo ku Australia kwenikweni ndi osabwerera m'mbuyo. Ndikwabwino kwa omwe ayamba kumene asazitengere kwambiri.
1089	science/technology	Chiphunzitsochi chimati zinthu zamdima kwambiri kuzungulira mlalang'amba zili mozungulira ngati chi yelo, ndipo zimapangidwa nditizidutswa tating'onoting'ono tambiri.
984	health	Izi zanenedwa kosachepera chikwi zokhuza anthu, koma zina mwayizo zinali zobweretsa imfa.
305	sports	Nzika yaku Japan yosewera masewero a judo a Hitoshi Saito, wopambana mendulo ziwiri za golide ku Olympic, wamwalira ali ndi zaka zakubadwa 54.
697	travel	Yerusalemu ili ndi malo odziwika ndi ofunika ambiri, azinthu zakale komanso malo achikhalidwe, pamodzi ndi malo okongola ndi owunjikana anthu ogulitsirako, khofi komanso malo odyerako.
826	travel	Kwenikweni zimakhala m'magawo awiri: Kugwira ntchito pamene uli koyendako kapena muyese kuchepesa zogulagula. Nkhaniyi ikukamba kwambiri njira yochepetsa zogulagula.
1672	health	Zidakhala zitadziwika kuchokera kale kuti zinthu zosiyanasiyana zomwe zimaononga ubongo , kudzidzimutsa mtima, ndi zotupa zimatheka kusintha khalidwe ndi maganizidwe amunthu.
536	travel	Magombe, malo osewelera ana ndi malo amisasa ya alendo ndi malo omwe amakondedwa ndi alendo okonda kusangalala.
1909	science/technology	Kampani yanu ya foni yomwe mumagwilitsa ntchito, akuyenera kukuuzani zamomwe mungalumikizilane ndi ena.
611	science/technology	Luso lapamwamba lopanga zinthu zosayenda kuoneka ngati zikuyenda mumakanema zimatha kuchitikira pamakina akompuyuta, ndipo mtundu wa ntchito ngati imeneyi ikuchulukira kugwiritsidwa ntchito mumakanema apawayilesi komaso makanema ena.
157	sports	Kutsatira mpikisanowu, Keselowski wapitilira kukhala wopambana woyendetsa magalimoto ndi ma point 2,250.
1294	politics	A Martely analumbira mu Electoral Council (CEP) yogwilizila m'mene muli mamembala asanu ndi anai dzulo.
1803	travel	Mbali inayi , madzi wouma ndi madzi wouma ofewa ndizinthu zosasowa maiko ambiri. Ndipo magalimoto amayenda mosasokonezedwa chaka chonse.
359	science/technology	Akatswiri Asayansi amatchula njira imeneyi kuti “kulimbikitsa kutulutsa radiation” kamba kakuti ma atom amalimbikitsidwa ndi kuwala kochuluka, zimene zimachititsa kutulutsa ma photon owala, komanso kuwala ndi mtundu wa radiation.
302	politics	Lamulo la ku France lidasinthidwa. Zochitika zachilimbikitsozi adayamba ali ndizaka 15 pamene adalowa mu French Resistance nthawi ya Nkhondo ya Dziko Lapansi Yachiwiri.
455	science/technology	Vuto ili likunka lichepa popeza opanga ma lens amafikira mulingo wovomerezeka wapamwaba popanga ma lens.
25	sports	Kuthandiza koyamba kwa Ovechkin usikuwu kunali kwa chigoli chimene chinawapambanitsa masewera chomwe adachinya ndi watsopano a Nicklas Backstrom;
1606	science/technology	Kafukufuku wasonyeza kuti ntchito za chuma zodalira kaboni zaononga chilengedwe chokhazikika chimene chakhala chikusamala umoyo wa anthu kwa zaka mamiliyoni awiri apitao.
79	sports	Mbali zonse ziwiri zimakumana mu mumasewero a semifinal pamene Noosa adapambana ndi ma point khumi ndi imodzi.
952	travel	Pamene mungaganize kuti nkoyenera kupita ku kampani ya ndege yomwe mumakwera kwambiri, mudziwe kuti mwayi woperekedwa ndi wosiyana ndipo ma point amaperekedwa kwa okwera ndege kawirikawiri akhoza kukhala ambiri pansi pa kamapani ina ya ndege mu mgwirizano omwewo.
995	travel	Ndege zimene zimapeleka izi zikuphatikizapo za ku Canada, Delta, Lufthansa maka ndege zake zochokera ku U.S. kapena Canada, ndi WestJet.
266	science/technology	Kuwongolera kwapansi ku Russia kunayendetsa ma jet ndipo maonekedwe abwinobwino amasiteshoni anabweleranso.
112	politics	Chiganizo cha a Rudd kusayina za nyengo a Kyoto Accord zikuchotsa America, lomwe ndi dziko lokhalo lotukuka osayikidwamo mugwilizanuwu.
1050	politics	Lipotilo likutsutsa kwambiri pafupifupi chilichonse pamalingaliro apano a Executive kulowera ndipo ikulimbikitsa kusintha kwakanthawi.
1609	travel	Kodi ndi chifukwa chiyani zogwiritsa ntchito pamayendedwe zimakhala ndi madandaulo ochuluka, chifukwa chiyani zimalephera tsiku ndi tsiku? Kapena akatswiri opanga zimenezi sadziwa? Kapena china chake chachikulu chofunikira kwambiri chikuchitika?
1316	sports	Anthu ochita masewero a wrestling nawonso anapereka ulemu kwa Luna.
291	geography	Chivomerezi chachikulu chomwe chachititsa kusintha mchigawo chidachitika pa 10 Marichi kumpoto cham'mawa pamwamba pamalo pamachitika volcano.
1215	travel	Zomwe zanenedwa poyambilira zikuti ndegeyo idatembenuka kubwelera ku Afghanistan itakanizidwa kuti itere mwadzidzi ku Ürümqi.
1270	sports	Kupyola zochitika zapa Chitatu, a Carpanedo anapikisana nao mumpikisano ina iwiri paokha ku maseweloko.
663	entertainment	San Francisco ndi malo amodzi amalo omwe ali abwino mdziko pa nkhani ya zakudya zina zaku Asia: zaku Korea, zaku Thailand, zaku India komaso zaku Japan.
91	politics	A Lodin adanenanso kuti akuluakulu a boma adasankha kusiya chisankho chachibwereza ndicholinga chopulumutsa ndalama komaso chiopsezo chachitetezo chomwe chingabwere kamba ka chisankho china.
371	science/technology	Nyama ya maonekedwe a nyanga zitatu ikanatha kugwiritsa ntchito mulomo wake wamphamvu kugwetsa masamba asanadye mtengo wonse.
1806	travel	Nyama zina monga njovu ndi akadyansonga zimakonda kuyandikira ku magalimoto ndipo zida zabwino zili ndikuthekera kuwona bwino kwambiri.
930	travel	Mwina mutha kusafuna Visa pamaulendo okhala masiku ochepa kumayiko ena pamene mwalowa ngati alendo kapena ochita bizinezi, koma kupita ngati wophunzira wochokera kunja pamafunika kuti mukakhale nthawi yaitali kusiyana ndikupita ngati okacheza.
33	sports	A Piquet Jr. ntchito yawo idathetsedwa pamene mpikisano wa 2009 Hungarian Grand Prix utatha.
0	health	Tsiku Lolemba, asayansi ochokera ku Stanford University School of Medicine analengeza zakupangidwa kwa chida chatsopano chomwe chitha kusiyanitsa ma cell ndi mtundu: kachipangizo kakang'ono kosindikizidwaka kakhoza kupangidwa pogwiritsa ntchito ma inkjet osindikizika apamwamba pafupifupi cent imodzi ya U.S iliyonse.
200	geography	Felicia, nthawi ina adali mkuntho wa gulu la chinayi pa mulingo wa Saffir-Simpson Hurricane, adafooka ndi mphepo ina yotentha lisanafike lachiwiri idatheratu.
873	entertainment	Ngati mukumva kuti mufuna kudziwa zambiri, mwayi ndiwomwewu wopanga juwisi kapena pangani juwisi pogwiritsa ntchito makina otchedwa blender.
774	entertainment	International Horticultural Expositions ndi zochitika zapadera zomwe zimawonetsa maluwa, minda yamaluwa ndi china chilichonse chokhudzana ndi zomera.
1377	science/technology	Timagwiritsa ntchito zomera kumangira manyumba komanso zovala. Zakudya zambiri timadya ndi zomela.Popanda zomela, nyama sizingasangalale ndi moyo.
203	geography	Mvula ina idali ndi mabingu komaso ziphaliwali pafupipafupi.
1365	science/technology	Kubangula kwa nyalugwe sikuli ngati ku bangula mwamphanvu kwa nkango koma kuli ngati kulankhula mokalipa.
1176	sports	Anali masewero omaliza a timu ya All Blacks, amene anali atapambana kale chikho masabata awiri apitawo.
879	health	Maboma ambiri amafuna alendo olowa, kapena eni nthaka ochoka, maiko awo kulandira katemera wamatenda osiyanasiyana.
110	science/technology	Stardust apanga mbiri yatsopano ngati ndege yothamanga kwambiri kubwerera ku dziko, kuphwanya mbiri imene anapanga mu May wa 1969 nthawi ya kubwera kwa malamulo a Apollo X.
1494	science/technology	Ulimi ongothandizira moyo wa mlimi, wa njira yachilengedwe pogwiritsa ntchito mbewu zopulumutsidwa ku ecoregion pophatikiza ndi ulimi wa kasinthasintha wa mbewu komanso njira zina zosavuta zochulukitsa zokolola.
1086	science/technology	Zotsatira zimene gulu limayang'ana zimayambitsidwa ndi mphamvu ya mafunde pakati pa zinthu zamdima zimene zimapezeka pamene pali gulu la nyenyezi ndi Milky Way.
1623	geography	Mtsinje wa Amazon wotambalala kwambiri pa dziko lonse lapansi, nthawi zina umatambalala ndi ma mayilosi asanu ndi imodzi.
1222	entertainment	Gulu la nyimbo za rock limayenera kupita ku United States ndi Canada mpaka pa 16 Seputembala.
1357	science/technology	Pamapeto, pali amphaka ambiri ang'ono (kuphatikiza amphaka ongoziyendera m'makomo) amene amadya nyama zazing'ono ngati tizilombo, makoswe, abuluzi, ndi mbalame.
216	sports	Masewera a squash, karate, ndi maroller adati awaike nawo pa mndandanda wa masewera a Olympic kuonjezerapo baseball ndi softball pomwe muchaka cha 2005 adawachotsa.
327	sports	Bobek yemwe adabadwira kulikulu la dziko la Croatia, Zagreb adatchuka pamene amasewera timu ya Partizan Belgrade.
277	politics	Kazembe wakale waku Massachusetts a Mitt Romney anawina masankho oyambilira awu puresident wa Florida Republican Party Lachiwiri ndi mavoti opitilira 46 % amavoti onse.
428	geography	Dera la Turkey ndilokula ndi makilomita 1600 mulitali (mamayilosi 1,000) ndipo makilomita 800 mulifupi (mamayilosi 500), ngati mokhala mwa ngodya zinayi ndithu.
1709	travel	Goma ndi mzinda wokopa alendo ku dziko la Democratic Republic of Congo chakum'mawa kwenikweni pafupi ndi dziko la Rwanda.
565	health	Omwe amatenga nawo mbali nzochitika zamasiku onse ayenera kuthandizidwa moyenera makamaka pa nkhani yamaganizilidwe olakwika pa ululu posiyanisa kumva ululu kwamasiku onse ndi kusapeza bwino kamba koyenda.
742	travel	Ngakhale ndizocheperako, zimakumbutsa alendo ena okalamba omwe adafika ku Hawaii lisadakhazikitsidwe boma opanda malo ogonamo akulu onse akulu ndi zitukuko zina.
531	sports	Ma bowo khumi ndi asanu ndi atatu amaseweledwa nthawi zambiri, osewela amayamba bowo loyamba nkumalizila bowo la khumi ndi asanu ndi atatu.
729	travel	Chilumba cha Bowen ndi chodziwika ndi ulendo wapatsiku kapena mathelo asabata, kumene kumapezeka kayaking, kuyenda, masitolo, malo odyera, ndi zina.
1427	science/technology	Mwachitsanzo, mtundu wotchuka kwambiri wa zithunzi zosayenda padziko lapansi ndiwa 35mm, umene udali mulingo wotchuka wamakanema kumathero kwa nyengo yamakanema a analog.
865	health	Ndi m'mene zimachitikiraso ndi mavuto akapumidwe kumalo wozizira, kumalo wotentha mavuto am'mimba amachulukirapo choncho nthawi zambiri amasautsa ngakhale siwowopsa.
205	travel	Itangotsala mphindi khumi kuti yitere yidanyamukanso.
374	science/technology	Munthu amene akulemera mapaundi 200 (90kg) pa Dziko akhonza kulemera pafupifupi ma paundi 36 (16kg) pa lo.Moti mphamvu yokoka, ndiye kuti, imakoka pang'ono pa iwe.
275	politics	Ndondomeko ya a Komeni idaletsa Planned Parenthood chifukwa panali kafukufuku amene amafufuza mmene a Planned Parenthood amagwiritsa ntchito ndikupanga report ya ndalama imene a Representative Cliff Stearns amapanga.
1991	travel	Njira zam'madzi za kuntunda zitha kukhala mutu wabwino kupangila tchuthi.
349	science/technology	A katswiri a sayansi ali kalikiliki kupanga reactor imene itha kupanga mphanvu munjira yomweyo.
1325	science/technology	Curtis Cooper, munthu wodziwa masamu komanso pulofesa wasayansi ya kompuyuta pa sukulu ya zaukachenjede ya Central Missouri, adapeza number yayikulu ya prime pa 25 Januwale.
1854	travel	Ulaya ndi dziko laling'ono koma muli maiko ambiri oima paokha. Izi zikutanthauza kuti kudutsa maiko amenewa kunakafuna mavisa ambiri ndi kuomboka mzipata zambiri.
946	geography	Nyanja ya Arctic ku Baltic Sea, inalumikizana ndi White Sea- Baltic Canal, podzera pa Nyanja ya Onega, Nyanja ya Ladoga komanso Saint Petersburg, makamaka pa mitsinje ndi nyanja.
182	politics	“Tsopano nkofunika kutengela pa umoyo wabwino komanso chilungamo kuti malamulo akhazikidwe posakhalitsa”, anatelo m;neneri wa boma.
1288	politics	Malingana ndi chikalata chomwe chavumbulutsidwa mopanda chilolezo chikukamba zamkangano wamalire a mayiko, chomwe dziko la Palestine likufuna kuti chitengere malire omwe analipo pasanachitike nkhondo ya kwa Aluya mu chaka cha 1967.
1639	science/technology	Ma atom ndi ang'ono kwambiri modabwitsa kotero kuti mathirilioni awo atha kulowa mumpumuliro kumapeto kwa chiganizochi.
69	entertainment	Gulu loyimbali lidasintha chikonzero choimba ku Maui's War Memorial Stadium kumene kumayembekezeleka kubwela anthu okwana 9,000, ndipo iwo anapepesa kwa anthu okonda gululi.
12	sports	Posachedwa adagonja kwa a Raonic ku masewera aku Brisbane.
508	health	Matenda a attention deficit disorder “ndi matenda amitsempha odziwika kuti ali ndi zizindikiro zophatikiza kusowa chidwi, kusachita bwino, kapena kukhala ndi mphamvu zochulukirapo”
1794	travel	Ngati muwoloka kumpoto kwa Baltic m'nyengo yozizira, yang'anani komwe kuli kanyumba, chifukwa kudutsa mu madzi owuma kumabweretsa phokoso lowopsa kwa iwo omwe akhudzidwa kwambiri.
667	entertainment	Matikiti ambiri omwe amagulitsidwa pa matsamba a intaneti monga eBay kapena Craigslist amakhala kuti ndi matikiti oti mutha kugwiritsa ntchito kumalo ambiri komaso amakhala agwirapo ntchito kale pang'ono.
127	entertainment	Olemba awo ambiri adapitiliza kupereka mangolomera kwa Jon Stewart ndi pulogalamu ya zazifanifani zankhani yomwe amapanga a Stephen Colbert.
1236	sports	Giancarlo Fisichella analephera kuwongolera galimoto yake ndipo anamaliza mpikisano utandoyamba kumene.
160	sports	Stewart, Gordon, Kenseth, ndi Harvick adamalizira m'malo khumi apamwamba pa Mpikisano wa Woyendetsa magalimoto pamene kwatsala masewero anayi munyengo imeneyi.
1732	geography	Sundarbans ikutenga mtunda okwana 3,850 km², ndipo gawo limodzi mwamagawo atatu ndi madzi kapena madambo.
1940	geography	Womwe udali mzinda wakale wa Smurna , pano ndi malo otsogola, otukuka, ndiponso okhala jijilijijili ndi nkhani za bizinezi, ozungulira ndomo yayikulu komanso idazingidwa ndi mapiri.
37	entertainment	Chiwonetsero cha PBS chili ndi mphoto zoposa makumi awiri ndi zinayi za Emmy, ndipo kuthamanga kwake ndikochepera chabe kuposa nsewu wa Sesame ndi kumene amakhala bambo Rodgers.
726	entertainment	Pali malo ambiri odyera ozungulira mundawo, madzulo komaso usiku pamakhala zoyimbayimba zaulere zomwe zimachitikira pakati pa gazebo.
1507	science/technology	Mathandizo amphunzitsi kwa wophunzira atha kukhala posakomana maso ndi maso komaso pokomana maso ndi maso, munjira ina, mphunzitsi ali ngati mthandizi komaso kamunthu komwe kamaoneka ngati pepala mu Microsoft Office.
1318	sports	Dustin “Goldust” Runnels adati “Luna adali wodabwitsa m'mene ndilili ine... mwinaso kopitilira muyezo... ndimamukonda komanso ndizamusowa... ndikukhulupilira kuti ali kumalo abwino.”
379	science/technology	Zigawo zimachitika kamba ka mbali imodzi imene ndiya Venus (komanso ya Mwezi) yoyang'anizana ndi Dzuwa ndi imene imawala. Zigawo za Venus zidathandiza maganizo a Copernicus akuti ma pulaneti amazungulira Dzuwa.
1237	sports	Anzake osewera naye Fernando Alonso anali patsogolo pa nthawi yambiri pampikisanowo koma zinatha bwino atayima pa malo osinthila zinthu chifukwa cha teyala lakutsogolo limene silinayikidwe bwino.
375	science/technology	Dzuwa lilibe kutumphuka ngati Dziko lapansi lomwe mutha kuyimapo. Dzuwa lonse limapangidwa ndi mpweya, moto, ndi plasma.
1736	travel	Mabasi ambiri ku Japan amayenda mumaboma, mabasiwa ndi abwino komanso olimba.
534	travel	Mwina mwake mtundu wodziwika kwambiri wazokopa alendo ndi womwe anthu ambiri amawuganizira kuti umakhuza kuyenda: Maulendo wopuma.
48	sports	Bambo Reid anakwanilitsa kuyendetsa galimoto ya mtundu wa A1GP ku New Zealand, Black Beauty pa liwiro loposa 160km/h kasanu ndi kawiri pa mulatho.
246	politics	Kuchokela pamene dziko la PakistanI linapeza ufulu kuchokela ku dziko la Britain mu chaka cha 1947, atsogoleri a Pakistani akhala akusankha “oimilira a ndale” kuti azilamulira FATA, amene amakhala ndi mphanvu zambiri polamulira ma dera wa.
1217	politics	Ziletso zochokera kumayiko ena akunja zikupangitsa kuti kusagulidweso ndege yatsopano.
1916	entertainment	Ngakhale zilumba zina za mphepete mwanyanja ndi nyanja zikuluzikulu ndizazikulu kuti ma boti atha kuyendapo, ma boti wocherako ngakhalenso kayak amathanso kupangitsa kuti muyende mosangalala.
1192	health	Katswiri wojambula adatumizidwa ku chipatala cha Ronald Reagan UCLA medical Center, komwe adakamwalirako.
559	science/technology	Maproton ali ndi mphamvu ya magetsi ambiri pomwe ma neutron alibe mphamvu ya magetsi. Ma electron ali ndi vuto la magetsi.
107	geography	Pamene kapisozi walowa mdziko ndikulowa mumlengalenga, pa nthawi ya 5 koloko m'mawa (nthawi yakum'mawa), pali chiyembekezero choti pazakhala chionetsero chochepa kwa anthu aku Mpoto kwa California, Oregon, Nevada komaso Utah.
549	sports	Ndichoncho wothamanga wa gawo loyamba wothamanga theka la mayilosi, munthu yemwe amakwanitsa osapitilira mphindi ziwiri, ayenera kukhala ndi liwiro labwino, koma akhale wopilira kunyengo zonse.
1923	travel	Kuyenda pa ndege kukhoza kukhala chinthu chowopsa kukumana nacho kwa anthu amisinkhu yonse ndiponso azikhalidwe zosiyana, makamaka ngati sanayendepo pa ndege kale kapena adakumana ndi nyengo yovuta.
126	entertainment	Al Gore ndi General Tommy Franks amatchula mobwerezabwereza mwachibwana mitu yomwe amakonda (A Gore ndi pamene Onion adanena kuti iye ndi Tipper amagonana bwino kwambiri m'moyo mwawo atagonjetsedwa pa 2000 Electoral College).
983	health	Chimfine cha mbalame, kapena kuti avian influenza, chimatha kukhudza mbalame ndi nyama zomwe.
915	science/technology	Mwazina zomwe zili mugulu ili zitha kutanthauzira zolembedwa muzilankhulo zakunja malingana ndi zizindikiro kapena zinthu zenizeni zina zomwe zaonetsedwa pamene ogwiritsa ntchito akuloza foni yake yam'manja ku zinthuzi.
330	sports	 Palibe winanso amene adasewera masewero ambiri kapena adagoletsa zigoli zambiri za kilabu kuposa Bobek.
563	health	Kafukufukuyu anapeza kuti kukhumudwa, mantha komanso kuganizila mavuto kumathandizila ubale pakati pa ululu ndi ulumali kwa anthu amakhala ndi vuto la ululu kumusi kwa nsana.
496	health	Madotolo ochita opaleshoni anali ndi chidziwitso cha mankhwala kuphatikiza morphine kuchokera ku mbewu ya poppy ndi scopolamine kuchokera ku mbewu ya herbane.
919	science/technology	Zitha kupangisa kuti musaononge ndalama pamene mwagula ma mapu amakono a GPS, mwina chida cha GPS ngakhale kubwereka kumene imodzi ku kampani ya malonda wobwereketsa magalimoto.
1504	science/technology	Pamene waleredwa ndikukula ndi nyama osati anthu, mwana wopulumutsidwa ku nyama amaonetsa khalidwe (kusowekera kuthupi) ngati lomwe la nyama zomwe zimamusamala, monga kuopa kapena kusalabadira anthu.
1422	politics	Mu chaka cha 1863, otsogolera nkhondo amfumu Qing (1644-1912) adatenga ulamuliro m'madera aku madzulo ndi kumpoto kwa m'mbali mwa nyanja ndipo adakhazikitsa Taiwan ngati gawo la maiko onse omwe amalamulidwa ndi Qing mu 1885.
202	geography	Mvula yofika mlingo wa mainchesi 6.34 ku Oahu, inanenedwa kuti inali “yopindulitsa”.
109	science/technology	Kapasulu aziyenda pa ntunda wa makilomita khumi ndi awiri kapena mamilosi asanu ndi atatu pa mphindi iliyonse, kutanthauza kuti atha kuchoka ku San Fansisco kupita ku Los Angeles mu mphindi makumi asanu ndi imodzi.
1521	science/technology	Adanenapo kuti zinthu ngati izi zomaona maganizidwe a anthu zingathenso kumachitika pakati panyama monga agalu.
1479	science/technology	Matanthauzidwe ambiri amalingaliro azamaukadaulo amagawana malingaliro awiri: kuti chitukuko chaukadaulo chizitsatira njira yopitilira chikhalidwe kapena ndale, ukadaulo umenewo umakhala ndi “zotulukapo” m'magulu abwinobwino, komano ophunzitsika bwino pagulu.
1163	politics	Opikisana nawo atha kutumiza nthumwi zawo kuti zikachitire umboni pachina chili chonse chikuchitika. Usiku, mavoti amawerengedwa ndi anthu ozipereka koma pamakhala wowayang'anira ambiri, ndipo amatsata njira zomwe zidayikidwa.
1696	geography	Zilumba zambiri zing'onozing'ono ndimayiko woyima pawokha, kulumikizana ndi dziko la France, ndipo amatchulidwa kuti malo amagombe azisangalaro zapamwamba.
866	travel	Ngati mupita ku dziko lotukuka kumene koyamba - kapena malo ena a chilendo - musanyalanyaza kuti patha kukhala kusanvetsesana chifukwa chosiyana chikhalidwe.
1809	sports	Masewero a Olimpiki ya anthu aulumali izachitika kuyambira 24 Ogasiti mpaka 5 Seputembala 2021. Zina mwazochitika zizakhala m'madera ena mdziko la Japan lonse.
119	entertainment	Masewera ankhondo akanema opangidwa malingana ndi nkhondo yachiwiri yaku Fallujar, nkhondo yowopsa kwambiri yapakati pa asilikali aku America ndi Iraq.
1175	sports	Kwa ma Springbok, kupambanaku kudali mathero akulephera m'masewero awo asanu owilikiza.
198	health	Kupatula kutentha kwa thupi komanso zilonda za pakhosi, ndikumva bwino ndipo ndingakwanitse kugwira ntchito yanga pogwiritsa ntchito makina a intanet.
144	science/technology	“Zimenezi zikusonyeza kuti zonse zifunika kubwezedwa,” Adatero katswiri wazakafukufuku ku Rift Valley Research Service ku Ethiopia pamodzi ndi wothandizana naye kulemba zakafukufukuyu a Berhane Asfaw.
1167	entertainment	Masiku oyambilira a chionetsero, inkayikidwa pa wailesi yakalekale ya tsamba la intaneti yotchedwa TogiNet Radio, tsamba la intaneti lomwe limakhuza kwambiri zolankhulana pa wailesi.
908	science/technology	Makampani wofalitsa nkhani ndichizolowezi chawo kunama pa cholinga chake, ponena kuti “akuteteza chinsinsi”.
1196	sports	Pakuti pali mendulo khumi ndi zisanu ndi zitatu pa tsiku, maiko ena sanakwanitse kulandila.
111	science/technology	“Idzachoka kupita kumadzulo kwa kumpoto kwa Califonia ndipo idzawala mumlengalenga kuchokera ku California kudzera pakati pa Oregon ndikudzera ku Navada ndi Idaho, ndikulowa ku Utah; a Tom Duxbury, mkulu woyang'anira ntchito ya Stardust adatero.
1722	travel	Monga m'mene ziriri Nkhalango zonse zotetezedwa ku South africa, pali ndalama zolipilidwa tsiku lililonse polowa kumaloku komanso kutetezela chilengedwe.
1989	travel	Palinso mabasi ochepa omwe amapita kumpoto ku Hebron, malo achikhalidwe komwe kudayikidwa makolo akale am'Baibulo achina Abrahamu, Isake, Yakobo, pamodzi ndi azikazi awo.
512	health	Vuto la ADD limakhuza maubale ndi anzake chifukwa ana ena sadziwa chifukwa chimene chimapangitsa khalidwe lawina kapena chifukwa chimene amapangila ma sipelo kapena kuti kukhwima kwake munzeru nkosiyana.
1182	health	France ndi dziko lachisanu ndi chiwiri ku Mgwirizano wa Mayiko aku Ulaya kupezeka kachirombo ka Virus kameneka; kulondola Austria, Germany, Slovenia, Bulgaria, Greece komanso Italy.
393	politics	Mchilankhulo chachinsisi chachi German lidatcha chiwembucho “operation sealion”. Zambiri mwa zida za nkhondo zolemera za Britain komanso katundu wofunikira adasowa pamene adachoka ku Dunkirk, ndipo asilikali ankhondo adaliko ofooka.
1908	science/technology	Njira iyi imagwilitsidwa ntchito potumiza, kuonjezera zosangalatsa zina, kuonjezera ma ulendo ena amene ali ndi chidziwitso kale ndi zosowa mawu.
592	science/technology	Nyama zimapangidwa ndima cell ambiri. Zimadya zinthu ndikuzinyenya nkati ndipo nyama zambiri zimayenda.
550	sports	Masewera othamanga mitunda italiitali kasanu kuphatikizilapo masewero olimbitsa thupi amalimbitsa kuntunda kwathupi ndipo amakonzekeletsa bwino munthu nthawi yothamanga.
