index_id	category	text
1210	entertainment	M'zaka zama 1980 iye anagwira muziwonetsero monga ngati Taxi, Cheers, ndiponso The Tracy Ullman Show.
1232	entertainment	Lakkha Singh adaimiliranso chhappan bhog bhajan.Woyimba , Raju Khandelwal anamuperekezanso.
1891	travel	Anthu amene sizimawavuta kusintha chikhalidwe amakhalanso kuti nawo avutikaponso ndi chikhalidwe chawo.
1798	entertainment	Malo angapo amapereka zakumwa zoledzeletsa kopanda kulipira. Pachifukwa chimenechi, kuledzera kumalepheretsa kuganiza bwino, ndipo anthu onse odziwa juga amazindikira ubwino okhala osaledzera.
738	travel	CafeNet El Sol imapanga zosungitsa malo pamtengo wa $30, komanso $10 kwa tsiku limodzi; zambiri zili pa tsamba la Corcovado.
1298	politics	Nthawi zina - ziwonetsero zopanda mtendere zimayamba kamba kolephera kukhala ndi zisankho, zina kuyambira chaka cha 2011.
577	science/technology	Cell ndicho chinthu chomwe chilichonse chamoyo chili nacho, ndipo zamoyo zonse zimapangidwa kuchokera ku cell kapena ma cell ambiri.
733	sports	Munyengo yozizila pitani mukasangalale ndi masewela a skiing kumpoto kwa America mu chilimwe pitani mukakwele njinga m'mapiri.
1624	geography	20% yonse yamadzi omwe amachoka m'mitsinje ya dziko lonse lapansi mkulowa munyanja zamchere amachokera ku Amazon.
185	sports	Ankakhala mumalo wogona a timu yawo pamene amayembekezera kusewera masewero awo la Sabata ndi timu ya Bolonia.
1158	geography	“Matenthedwe a malo akunja ndi mkati siofanana ndi mapanga akulu padziko lapansi zomwe nthawi zambiri zimakhala zotentha mosasiyana, koma zimakhala zofanana potengera mabowo akuluakulu amene ali pansi,” anatero Glen Cushing waku United States Geological Survey (USGS) Astrogeology Team ndi Northern Arizona University imene ili ku Flagstaff, Arizona.
190	travel	Apaulendo anapatsidwa madzi pamene amadikira kunali kutentha madigiri 90 (F).
1233	entertainment	Lachinayi poyankhula pa msonkhano waziwonetsero zaku Tokyo Game Show, pulezidenti wa Nintendo Satoru Iwata adawonetsa kapangidwe ka zoyang'anira Nintendo Revolution console yatsopano yakampaniyi.
1548	politics	Chimodzi mwazitsanzo zolozeka zatsopano inali kampeni ya WWII ku North Atlantic. Anthu aku Amerika anali kuyesesa kudutsitsa anthu ndi akatundu kudutsa nyanja ya mchere ya Atlantic kuti akathandize dziko la Britain.
647	entertainment	Ambiri a ife timapezeka tikuwonera wayilesi ya kanema imene imatidziwitsa njira zina koma zomwe sititenga nawo mbali kapena kugwiritsa ntchito zomwe tadziwazo.
1522	science/technology	Kafukufuku wazaka zamazana makumi awiri akuwonetsa kuti pali magawo awiri akasinthidwe kochokera ku makolo: kuzibisa ndi kuziwonetsa.
601	science/technology	Mpweya wa Nitrogen uli ndi zizindikiro ngati za Nitrogen wamadzi. Wamadzi ndi olimba koma ma molecule ndi ofanana.
1747	sports	Argentina ndiyodziwika bwino ndi pokhala ndimatimu abwino a polo ndi osewera ake pa dziko lonse lapansi.
142	sports	Ganizo la NBA lidabwera kamba ka osewera wa Utah Jazz yemwe adapezeka ndi ka chirombo ka COVID-19.
1802	travel	Maonedwe amatha kukhala ovutirapo kamba kakugwa kapena kuwomba ka madzi ofewa wowundana kapena kukhala madzi kapena madzi wowuma pamazenera a galimoto.
825	travel	Ngati mungafune kuona dziko losadula, zofunikira, makhalidwe ndi zoletsa, pali njira zina zomwe mungapange.
1144	politics	 A mgwirizano ndi asilikali aku Afghanstan adapita muderaro kuti akateteze malo ndi ndege zina za mgwirizano zomwe zidatumizidwa kukathandiza.
1850	sports	Kubelekera chikwama kumsana chifukwa cha ski: Zimenezi zimatchedwaso kuti backcountry ski, ski touring kapena ski yoyenda.
1033	science/technology	Adapeza kuti Dzuwa limayenda mofanana ndi nyenyezi zina: zochitika za nyenyezi zina zimadalira kuwunika kwawo, kuzungulira kwawo, osati china chilichonse.
1848	sports	Maganizo amawesera a skii ndi akale kwambiri- zomwe zidajambulidwa muphanga zowonetsa anthu osewera masewerowa ndizowonetsa kuyambira zaka m'ma 5000 BC!
228	geography	Ma scarps amenewa anapezeka malo ambiri pa mwezipo ndipo anaoneka kuti sanakhuzidwe kwambiri ndi nyengo kutanthauza kuti anali atsopano.
292	geography	Mitambo yakuda imene siyimagwilizana ndi volcano iliyonse inalengezedwa m'musi mwa phiri.
1225	sports	Del Potro kumayambiliro agawo lachiwiri adali ndi mwayi, koma zimenezi zinafunabe kupeza wopambana chifukwa adafanana 6-6.
1416	sports	Masewera otchuka ndi mpira, basketball, volleyball, polo-water, kutchinga, rugby, kupalasa njinga, ice hockey, roller hockey ndi mpikisano wothamangisa magalimoto wa F1.
129	entertainment	Mzinda umenewu ndi oyamba kum'mwera chakum'mawa ku Ulaya kuchititsa CowParade, chimodzi mwa ziwonetsero zaluso zazikulu padziko lonse, pakati pa mwezi wa Juni ndi ndi mwezi wa Ogasiti chaka chino.
1003	science/technology	Anapanga belu la WiFi, anatelo.
271	health	Dr. Lee anafotokozanso kudandaula kwawo pankhani zomwe zinamveka kuti ana ku dziko la Turkey tsopano ali ndi A (H5N1) virus ya fuluwenza koma osadwala.
103	politics	Ndemanga zomwe zinali pa wailesi yakanema za nthawi yomweyo, ndizoyamba kuti akuluakulu aku Iran adavomereza kuti ziletso zomwe alinazo zikubweretsa zovuta.
14	sports	Masewera atatha, King of Clay adati, “Ndili wokondwa kuti ndafikaso ndime zomaliza zazochitika zofunikira zimenezi. Ndili pano kuyesa kupambana zimenezi.”
1412	politics	Kongeresi idasowekera mphamvu iliyonse yokakamizira misonkho, ndipo chifukwa kunalibe oyang'anira kapena amalamulo, idadalira pa ulamuliro wa boma, omwe nthawi zambiri adali osafuna kuthandiza, kuti akakamize zochita zake zonse.
1811	travel	Ngati munapeza ndege ndi malo amu 2020 asadalengeze zakusintha, zingathe kukuvutani.
1681	science/technology	Ukadaulo umapereka yankho poyenda maulendo wamba kumunda. Ophunzira amatha kuyang'ana pazosungidwa zakale, kupita ku aquarium, kapena kusilira maluso atakahala pansi ophunzira awo.
335	entertainment	Woyimba otchuka waku Turkey a Sezen Aksu adayimba ndi woyimba wa ku Italy a Alessandro Safina ndi woyimba waku Greece a Haris Alexiou.
378	science/technology	Pafupifupi zaka zikwi zitatu zitadutsa, muchaka cha 1610, katswiri waku Italy wowona zakuthambo, a Galileo Galilei adagwiritsa ntchito makina a telescope kuti awone ngati Venus ali ndi magawo ngati m'mene mwezi ulili.
1367	science/technology	Asayansi akuganiza kuti ma ocelots amatsata ndikupeza nyama kuti adye (nyama) ponunkhiza, pamalo pomwe akhala pansi.
703	travel	Maulendo ndiotsika mtengo m'magulu akulu, chifukwa chake ngati muli nokha kapena ndi nzanu m'modzi, yesani kukumana ndi anthu ena ndikupanga gulu la anayi mpaka asanu kuti mulandire mtengo wabwino.
297	politics	Kusintha kumeneku kunadutsa kale mnyumba zonse ziwiri mu 2011.
80	sports	Maroochydore nthawi imeneyo adagonjetsa Caboolture pamapeto amasewero oyamba.
1823	travel	Kugula katundu osalipira msonkho ndi mwayi othandizira kugula katundu wopanda misonkho komanso msonkho wa excise m'malo ena.
836	travel	Ukadaulo ojambula nyumba umagona pakajambulidwe ndi kamangidwe ka nyumba. Kajambulidwe ka nyumba pamalo pakokha kumakhala kochititsa chidwi kwa alendo.
880	travel	Malamulo amatengera kawirikawiri mayiko omwe muNthu wapita kapena komwe akufuna apite.
1143	politics	Chipani chomwe chikulamula cha South West Africa People's Organisation (SWAPO), chidatengaso mipando yochuluka pa chisankho chaku nyumba ya malamulo.
650	science/technology	Malo ogona omwe muli kapena eni malo mukugona (ngati mukukhala mnyumba ya alendo kapena nyumba yaeni) atha kukhala ndi wifi kapena intaneti yolumikizidwa ku PC, ndipo midzi yonse ili malo amalonda wopangirako intaneti kapena malo ena a wifi ya aliyense.
702	travel	Chiphaso chanu cha ulendo chikuyenera kukhala chovomerezeka kwa miyezi isanu ndi umodzi kupitilira masiku anu aulendo. Tiketi yanu kaya yobwelera/ yopitilira imafunika kutsikimizira kutalika kwa nthawi yomwe mukhale.
1604	travel	 M'mawa uliwonse anthu amachoka mmatawuni ang'ono kupita malo wogwira ntchito ndipo amadutsana ndi wena womwe amakagwira ntchito malo awo.
817	sports	Poti pali ubale ku Barcelona ndi Running Tours Barcelona komanso ku Copenhagen ndi Running Copenhagen, inapanga ubale ndi Runing Tours Prague yaku Prague.
1763	travel	Alendo ambiri amavulala chaka chilichonse chifukwa chosatalikirana kwenikweni. Nyamazi ndi zazikulu, zaukali, ndiponso zowopsa, choncho musaziyandikire kwambiri.
1290	politics	Dziko la Israel likufuna asilikali ake akhale mchigwachi kwa zaka khumi pamene mgwirizanowu usayinidwe pamene a PA akufuna kuti izi zichitika zaka zisanu zokha.
1775	entertainment	Mowa weniweni wa kumeneko ndi ‘Nambala Yoyamba’ si mowa wovuta, koma wosangalatsa ndinso kutsitsimutsa. Mowa wina kumeneko umatchulidwa kuti ‘manta’.
642	science/technology	Kugwilitsa ntchito intaneti ndi matsamba a intaneti zimathandiza awo akupanga sukulu kuti azikhala ndimwayi wodziwa zambiri nthawi iliyonse.
1544	politics	Pofika 17 Seputembala chaka cha 1939, asilikali oteteza Poland anali atagonjetsedwa ndipo chikhulupiliro chinatsala chinali chobwelera nkukayambiraso ku malire ndi dziko la Romania.
1148	health	M'neneri wa Medecines Sans Frontiere a Richard Veerman adati: “Angola ikulunjika koyipa kwambiri pa kufalikila ndipo zinthu zikanali zoyipa ku Angola,” iye adatero.
801	health	Kumamwa zakumwa zoledzeletsa moyenelera. Mowa umakhudza anthu mosiyana ndipo kudziwa mulingo wanu ndikofunikira kwambiri.
1741	travel	Mlatho umeneyu ukuyembekezera kuyamba kugwira ntchito mu Seputembara chaka cha 2017, pamene malo aku Brazil owona zakatundu olowa mdziko akuyembekezeka kumaliza.
1140	entertainment	Ngakhale kuti Winfrey analira potsanzika, ananenetsa kwa omutsatila kuti iye adzabwelanso.
1267	health	A Edgar Veguilll avulazidwa m'manja ndi nsagwada pamene a Kristoffer Schneider anali kufunika opeleshoni yokonza nkhope.
1774	entertainment	Nthawi zina awa amakhala magombe amabanja ochuluka kwambiri magombe omwe ali ndi masitolo abwino wokhala mumzere. Mutha kusambira ndithu chifukwa ndikotetezedwa.
862	health	Madera ena adziko lapansi, kumene nyama za bacteria zili zatsopano kwa inu, mutha kukhala pamavuto wochuluka.
1069	politics	A Layton adapempha kuti malamulo okhuza zachilengedwe asinthidwe pamene adakomana ndi a PM, ndipo adafunsa kuti “alembedwenso bwinobwino komanso kwathunthu” monga mwa lamulo la zachilengedwe la chipani cha Conservative.
325	geography	A sayansi a ku National Hurricane Central alosera kuti Danielle alimbikitsa mphepo yamkuntho pofika Lachinayi.
1314	health	 Malingana ndi kafukufuku wake adawonetsa kuti ngati ma hormone atagwiritsidwa ntchito zikhoza kufulumizitsa mapapo amwana osabadwayo kukhwima.
704	travel	Choncho, zimenezi siziyenera kukupatsani nkhawa, chifukwa kawirikawiri alendo amapachiridwa ndicholinga choti adzaze m'magalimoto.
528	sports	Masewero amakono a fencing amaseweledwa m'magulu osiyanasiyana kuyambila ana a sukulu kumasukulu aukachenjede kufukila anthu ogwira ntchito ya masewelo komanso mipikisano ku Olympic.
532	sports	Wosewera amene wakankha mpira mochepa kwambiri, kapena kusuntha kwa chibonga, kuti amalize ndi amene amapambana.
1643	science/technology	Wina atha kudabwa kuti kibodi ingakhale chani patabwera zina zatsopono.
868	travel	Makamaka m'masiku anu oyamba, lingalirani za kukhala malo ogona azikhalidwe zaku maiko akumadzulo komanso malo abwino, chakudya, ndi ntchito zina kuti muzolowere.
124	entertainment	Kalekale kulibe Daily Show ndi Colbert Report a Heck ndi a Johnstone anali ndi masomphenya olemba monyogodola nyuzi pamene anali ophunzila ku UW mchaka cha 1988.
1159	politics	Ku France kuvota masiku ano sikwamakononso : wovota amakakhala mkanyumba kachinsinsi, ndikuika papela lomwe anasindikizapo anthu womwe iwo akuwafuna, ndikusankha omwe akumufuna ndikuyika mu enivelopu.
701	travel	Nzika zaku Cuba zomwe zili ndi makadi a green card aku US ayenera kufika ku ofesi ya oyimilira kazembe waku Ecuador kuti akatenge chilolezo choti zimenezi iwo zisawakhuze.
560	health	Kuti muone wovulala mukuyenera kuona kaye pamalopo.
167	politics	Zantopola zimapangitsa mpungwepungwe ndikusokonekera kwa ubale pakati pa Pakistani ndi India.
301	politics	Zimene Vautier adakwanilitsa kunja kotsogolera zikuphatikiza kukana kudya mu chaka cha 1973 kutsutsana ndi m'mene amawonela ngati kuwunika ndale.
40	entertainment	John Grant, ochokera ku WNED Buffalo (Malo owerenga utawaleza) anati “kuwerenga utawaleza zimamphunzitsa ana chifukwa chakuti aziwerenga, ...kukonda kuwerenga-[chiwonetsero] kuwalimbikitsa ana kuti atenge buku ndi kuwerenga.”
1414	politics	Malamulowa amafunikira kuvomerezedwa ndi maboma wonse pamene asanasinthidwe ndipo maboma adalitenga boma lalikulu mwachibwana moti aphungu awo amangojomba nthawi zambiri.
1789	travel	Zosintha kapena zofunsa zilizonse mufunse kudzela kwa ntumiki wokonza maulendo poyamba musanafunse kwa amalo ogona alendo.
754	travel	Malo ena ogona alendo ali ndi mbiri yochokera kunthawi ya golden age yamasitima apamtunda woyendera nthuzi komanso masitima am'madzi akuluakulu otenga anthu; nkhondo yachiwiri isadayambe, mzaka za m'mazana khumi ndi zisanu mchinayi kapena kumayambiliro azaka zam'mazana makumi awiri.
1142	politics	Zotsatira zomaliza za chisankho cha purezidenti ndi aphungu anyumba yamalamulo mdziko la Namibia zikusonyeza kuti Purezidenti amene alipoyo, Hifikepunye Pohamba, amusankhanso kukhala Purezidenti ndi mavoti ambiri.
1022	politics	Zidalengezedwa pamene a Trump adalankhulana ndi Purezidenti waku Turkey a Recep Tayyip Erdoğan.
538	travel	Alendo angathe kupita malo angapo osiyanasiyana otchuka kapena atha kusankhapo kuona dera limodzi lokha.
155	geography	Miyala khumi ndi isanu mwayina idagwa kuchokera kumwamba mu Julayi chaka chatha.
1278	health	Munali anthu atatu mkati mwa nyumbayo pomwe galimoto idagunda nyumbayo, koma panalibe anavulala.
1197	sports	Palinso Netherlands, ndi Anna Jochemsen kumalizitsa kasanu ndi kanayi mu kalasi yoyimilira mu Super-G dzulo, ndipo Finland wawo adali Katja Saarinen kumalizitsa khumi pa masewera omwewa.
1541	politics	Germany anali mdani wamayiko ambiri mu Nkhondo Yachiwiri Yapadziko lonse, zomwe zidayambitsa mgwirizano pakati pa USSR ndi USA.Pamene nkhondo inantha mikangano ya machitidwe, zochitika ndi chikhalidwe zinapangitsa mayikowo kukangana.
1111	health	Kuphulika kwa matenda kumeneku kwapangitsa boma la India kuti lichite zimenezi monga kuyika misampha m'malo omwe ali okhuzidwa kwambiri, kugawa zikwi zikwi za makatani amasikito audzudzu komaso kupopera mankhwala.
889	geography	Nkatikati mwa Antartica muli phiri lokutidwa ndi madzi owuma kwa ntunda wautali ngati makilomita 2 mpaka 3.
324	geography	Mphepo ya mkuntho, yomwe ili pamtunda wa mamayilosi 3,000 kuchokera ku Miami, Frorida, ili ndi kuthekera kobweretsa mphepo yamphamvu ya 40 mph (64 kph).
118	entertainment	Ofalitsa nkhani za masewera a Konami analankhula ku nyuzipapala ya ku Japan kuti atulutsa game yotchedwa Six Days ku Falluja..
1018	entertainment	Gosling ndi Stone analandira zinsankho za mwamuna wochita bwino zitsuzo komanso mkazi ochita bwino zitsuzo motsatana.
523	health	Izi ndizotopetsa ngati uzidzuka kuwonera TV mphindi makumi awiri kapena mphindi makumi atatu aliwonse.
1637	science/technology	Mutha kukhala ndi ma alloy amene ali ndizidutswa za zinthu zoti simiyala monga kaboni.
749	travel	Kukwera mugalimoto yako ndikuyenda ulendo wautali ndizinthu zina zake zosangalatsa.
1575	science/technology	Nambala yotchedwa Binary imakhala ndi chinthu chimodzi mwazinthu ziwiri basi, mwachitsanzo imakhala ndi 0 kapena 1, ndipo manambala amenewa amatchedwa kuti binary digits - kapena kuti ma bit, pamene tikugwilitsa ntchito mawu apakompuyuta.
524	health	Zotsatira zake zikutengera ndi m'mene ubongo wanu ukuyeselere kulota mwanzeru usiku uliwonse.
358	science/technology	Amachita izi potulutsa tizinthu tochepa totchedwa “Photon”.
999	health	M'mene alili akatswiri ena, amakayikira ngati matenda a shuga angachiritsidwe, poona kuti zotsatila izi zilibe phindu kwa anthu ali kale ndi mtundu woyamba wa matenda ashuga.
1359	science/technology	Mikango ndi amphaka odziwa kucheza bwino kwambiri, imakhala m'magulu akulu ngati banja.
311	entertainment	Anthuwa adamanga banja lawo ku Texas chaka chatha choncho adabwera ku Buffalo kukasangalala pamodzi ndi abwenzi komanso abale.
1917	entertainment	Kuyenda pa ngalawa ndi chochita chokondedwa ku Finland pamene ngalawa imodzi imapezeka pa anthu asanu ndi awiri kapena asanu ndi anai.
1771	geography	Magombe aku North Shore (m'boma la North Harbour) amu nyanja ya Mchere ya Pacific kuchokela ku Long Bay mpaka ku Devonport.
361	science/technology	Ma photon ndi ocheperapo kuposa zinthu zomwe zimapanga ma atom.
196	health	Nduna ya President a Rodrigo Arias adanena kuti Pulezidenti Arias adampeza ndi kachilombo ka virus koma kosadetsa nkhawa.
951	travel	Mukuyenera kusankha ndege ngati Frequent Flyer mumgwirizano wanu mosamala.
878	health	Matenda opatsilana ndi matenda amene amapatsilana mosavuta pamene mwayandikana ndi odwalayo.
214	sports	Masewero onse a Golf ndi rugby akonzeka kubwerera ku masewera a Olimpiki.
509	health	Siulumali wa kusaphunzira koma vuto la kuphunzira; “imakhudza ma pelesenti atatu mpakana asanu a ana onse, mwina ochuluka kukwanila mamiliyoni awiri a ana aku America”.
332	entertainment	Zisangalalo zidayamba ndi chiwonetsero chapadera ndi gulu la Cirquel du SoleiL.
835	travel	Mu nthawi zambiri zina, omwe amene amakhala kunja kwa malo omwe kuli alendo ayenera kulembetsa. Choncho , izi zimapangitsa kuti lamuloli lisaoneke bwino kwambiri, choncho fufuziranitu.
298	politics	Nthawi iyi yamsonkhano wazamalamulo kusintha kunapangidwa pamene poyamba chiganizo chachiwiri chidachotsedwa ndi Nyumba Yawoyimilira anthu ndipo chidavomerezedwa munjira yake yomweyo ndi Senate patsiku Lolemba.
392	politics	Itatha nkhondo yolimbana ndi dziko la France, dziko la German lidayamba kukonzekera kuti likalande chilumba cha Britain.
1211	entertainment	Mu chaka cha 1989 adathandiza kupanga nawo The Simpsons pamodzi Brooks ndi Groening , ndipo dali ndi udindo olemba ntchito anthu oyambilira olemba masewero.
204	travel	Twin Otter imayesera kuti itere ku Kokoda dzulo ngati Ndege PNG Flight CG4684, koma idalephera mkamodzi komwe.
916	science/technology	Makina omasulira asintha bwino kwambiri, ndipo panopa kawirkawiri amapereka zambiri zomasulira molondola (osati zopanda pake kwenikweni), koma kumafunika kusamala ndithu, chifukwa akhoza kukhala kuti adalakwisa zonse.
535	entertainment	Apa ndi pamene anthu amapita kumalo omwe ndiwosiyana kwambiri ndi malo omwe amapita nthawi zonse kukapuma komaso kukasangalala.
658	health	Munyengo yotentha khalani tcheru ndi udzudzu waku Nordic. Ngakhale suyambitsa matenda, koma umasowetsa mtendere.
353	science/technology	Ma molecule amadzi amapanga khungu losawoneka pamwamba pamadzi zomwe zimapangisa zinthu zina kuyandama monga zingano.
1520	health	A Oliver Sacks, mu pepala lake The President's Speech, anawonetsa m'mene anthu amene sangathe kumvetsetsa zolankhula chifukwa cha mavuto aubongo angatheleso kuwunika bwino mowona mtima.
1331	politics	Akuganiziridwa kuti azayima nawo pa chisankho cha purezidenti mucha chaka cha 2016.
295	health	Ma helokopitala anapulumutsa anthu onse khumi ndi awiri ogwira ntchito ndipo bala limene linalipo ndi kuthyoka mphuno.
569	science/technology	Chiwerengero cha zinthu ndiye kuti kutolela zamoyo zamtundu umodzi kudera linalake lomwe mwapatsidwa.
926	science/technology	Ngati mukugwilitsa ntchito chowulutsa chotchedwa drone, mukuyenera muoneretu zomwe mukuyenera kujambula kapena chilolezo chapadera ngati chikufunikira.
854	travel	MetroPlus ndiyotakasuka komanso simudzadza kwambiri koma mitengo yao ndiyokwelelapo ngakhale ndiyotsika kuposa mametro tikiti ambiri ku Ulaya.
225	science/technology	Mphamvu zosadziwika bwino zolimbana ndi chilengedwe komanso zosaoneka ndimaso zomwe zimagwira ntchito mlengalenga nthawi zonse.
1598	science/technology	Anachita kafukufuku muwiri owonetsa DNA mu phage ndi phosphorus wa radioactive kapena protein wa phage ndi sulfur wa radioactive.
771	entertainment	Maphwando amu kachisi wa Kerala ndiwopatsa chidwi kuonera, ndi mayendedwe anthawi zonse a njovu zokongoletsedwa, mayimbidwe amukachisi ndi zikondwelero zina.
856	travel	Kunyamulira katundu ena- Musayese dala kusiya chikwama chanu pomwe simukutha kuchiona, makamaka pamene mukudutsa malire adziko lina.
23	sports	Katswiri wathu wosewera walero ndi Alex Ovechkin wa timu ya Washington Capitals.
432	politics	Dziko la Luxembourg lili ndi mbiri yakale kwambiri koma linadzipezela ufulu mchaka cha 1839.
1804	travel	Ma Safari mwina mkutheka kukhala zomwe zimakopa alendo ambiri ku Africa ndiponso zokamba zambiri za alendo.
533	sports	Masewelawa amaseweledwa pa kapinga ndipo kapinga wozungulira dzenje amaumweta kuti afupike ndipo amatchulidwa kuti wobiriwira.
434	politics	Luxembourg lakhala likuyesera kukhala dziko losalowelera zaeniake ngakhale lidatengedwapo ndi dziko la German munthawi zankhondo zonse ziwiri zadziko lapansi, Nkhondo Yoyamba komaso Nkhondo Yachiwiri.
128	entertainment	Mwambo wa anthu a zaluso m'magawo osiyanasiyana ndi gawo limodzi la kampeni ya Bucharest City Hall imene imafuna kukonzanso chithunzithunzi cha likulu la Romania ngati mzinda wopanga zinthu zaluso komanso wokongola.
810	sports	Kuyenda malo otsika zedi zimaphatikiza zinthu kuchokera kusamba, kukwera ndi kudumpha-- koma zimafunikira maphunziro ocheperako kapena munthu wazitho kuti muyambepo (poyelekeza ndi kukwera miyala, kusambira m'madzi kapena kutsetseleka m'mapiri, mwachitsanzo).
1327	science/technology	Ma Comet mwina idali njira yoperekera madzi ku dziko lapansi komaso ndi zinthu zina zomwe zimapanga ma protein komanso kuthandizira moyo.
638	science/technology	Mu chaka 1997, Dr. Damadian anamaliza kumanga chomwe amati ndi “thupi lonse” pa MRI scanner, imene adayitchula “Indomitable”.
269	sports	Yesu wazaka 21 adapita ku Manchester City mu Januwale 2017 chaka chatha kuchokera ku timu yaku Brazil yotchedwa Palmeiras pamtengo wa 27 miliyoni paundi.
1364	science/technology	Nyalugwe ali mugulu lofanana (Genus Panthera) ndi mikango, akambuku, ndi nyama zina. Amphaka anayiwa ndi okhawo amene amatha kubangula.
989	geography	Madzi wogwirana sadakhazikike koma kutsetseleka mu phiri. Izi zimapangitsa kusweka komwe kumaphimbika ndi mitsinje yamadzi wouma wofewa.
864	health	Ndiye mlili wa Dehli Belly , tembelero la Farao, kubwenzela kwa Montezum ndi anzao ena.
595	science/technology	Cell ndi gawo lochepetsetsa loima ndi kugwira ntchito pa chinthu cha moyo.
571	science/technology	Pamene anthu asonyeza mitundu ingapo ya makhalidwe ndiye kuti ali polymorphic.
924	science/technology	Malamulo okhudzana ndi zojambula nthawi zonse amagwiritsidwa ntchitonso pojambula kanema, mwinanso kuposera pamenepo.
570	science/technology	Pamene zinthu zonse pagulu mzofanana malingana ndi mtundu wake zimadziwika ndi dzina loti monomorphic.
1273	sports	Ena mwa azimayi adalephera kumaliza nawo kuthamangako ndipo 45 mwa 117 a Giant slalom adakanika mu mpikisanuwo.
1400	politics	Kumbuyo kwa Kulengeza kwa Ufulu kunali mawu awa “Original Declaration of Independence tsiku la 4 Julayi 1776”. Zolembazo zimapezeka pa musi pa chikalata, mozondoka.
664	travel	Kupita ku Walt Disney World zimaonetsa kuti ulendo wofunikira kwambiri kwa mabanja ambiri ku America.
1737	travel	Ma taxi ogawana amafulumila komanso amakhala bwino kupita malo apafupi monga ku Naro (NU150) ndi Punakha (Nu 200).
457	science/technology	Kuyipa kwina kwa ma lens ndikokuti nthawi imene kuwala kukufika (kuthamanga) pa lens kumakhala kochepa.
1051	politics	Choyamba pa malangizo 78 ndi mfundo yoyambitsa ubale wa ukazembe chaka chisanathe kuti malire a dziko la Iraq akhale otetezedwa kwa magulu aupandu komanso kubwenzeletsa ma ubale a ukazembe ndi maiko ozungulira nao.
870	travel	Pamene mukufuna kokamanga msasa, tengani kama komanso machira kuti musakalumidwe ndi njoka, zinkhanira ndiponso zina zotero.
1735	travel	Popeza mabasi oyenda m'maboma amakhala odzaza ndibwino kuguliratu matikiti masiku angapo ulendo usadafike.
1852	sports	Mudziganizira njira ya skiiing ngati njira yoyendera wapansi.
816	sports	Mlowa malo wa Global Running Tours, Go Running Tours amalumikizana ndi magulu okonza ma ulendo m'ma Kontinenti anayi.
986	geography	Makamaka ku Norway kulizikweza ndi zigwa zimene zimangopezeka zafika pachidikha.
1786	travel	Makampani omwe amathandiza anthu apaulendo amakhala ndi mgwirizano ndi malo ogona ena, ngakhale mungakwanitse kudzipezera malo ena monga, monga misasa, kudzera mwa makampani awa.
833	travel	Izi zikhoza kufuna kulemba pa fomu yapolisi yakudera komweko kapena kupita ku ma ofesi owona anthu olowa ndi kutuluka mdziko.
597	science/technology	Ngati mukuyang'ana zinthu zamoyo kudzera pamakina otchedwa mayikurosikopu, muzaona kuti zinthuzi zapangidwa ndi tinthu ting'onoting'ono towoneka ngati timabokosi kapena mipira.
1281	health	Poyamba iwo anagonekedwa muchipatala cha James Paget kumzinda wa Great Yarmouth.
1472	politics	Zonse zomwe America idagwilitsa ntchito ku nkhondo yogonjetsa anthu aku Phillipines zidalipilidwa ndi a Filipino omwewo.
1011	sports	Tikugwilizana ndi zomwe ananena USOC kuti chidwi chathu chili pa wosewera ndi makalabu, ndi masewera awo, zitha kupangidwa bwino popita chitsogolo ndi thandizo lomveka mu bungwe lathu, kusiyana ndikulanda masatifiketi.
1674	science/technology	Izi zimatipatsa ife mauthenga ambiri komanso zida zopangira zoyeserera zomatithandizira kumvetsetsa zimene zimachitika m'malingaliro athu.
805	health	pangani ganizo loti akakuyezeni maso anu muli kunyumba, makamaka pamene ngati insuransi ikukhuzaso zamaso, ndikubweretsa mankhwala omwe anakulemberani ndikuti zikasungidwe bwino lomwe penapake.
1542	politics	Zaka ziwiri zakumapeto ankhondo, amene anali pa mgwirizano tsopano anakhala adani ndipo Cold War idayambika.
134	science/technology	Mafunde wofiyira amayambitsidwa ndi kukwera kwa Karenia brevis, zinthu zamoyo zomwe zimakhala ndi cell imodzi zokhala m'madzi.
740	geography	Ndi gulu la zilumba zokwana 15 zofalikira mtunda wautali okwana mamaliyoni 2.2 km2 pa nyanja.
