index_id	category	text
761	travel	Afei wɔtintim wɔn a wobenya hokwan agye ahɔho wɔ krataa so ne/anaasɛ wɔ intanɛt so, na ɛtɔ da a, wɔde wɔn a wobetumi abisa wɔn ase wɔ wɔn hɔ ka ho ne nea akwantufo afoforo aka afa ho no ka ho.
1676	science/technology	Wɔ AI mu nhwehwɛm mu no mfidie a ɛma adwuma yɛ merɛw na ehia nimdieɛ hu suban ka ho bi.
848	entertainment	Dua a akoa a wɔtow no mu dodow a ɛwɔ Australia yɛ nea ɛnsan mma n’akyi.
1089	science/technology	Saa theory yi ka sɛ dark mata dodoɛ no ara ɛwɔ galaxy no ho no wɔ galaxy a ɛte sɛ halo no, na ɛyɛ ɛwowɔ particles nketewa.
984	health	Saa yare a yi akye nnipa binom a wonnuru apem, nanso ebinom nam so wuwui.
305	sports	Japani a ɔbɔ judoka, Hitoshi Saito dii nkunim wɔ Olympic no mu nyaa sikakɔɔ mɛdaas abien awu na ɔdii mfe 54.
697	travel	Jerusalem wɔ abakɔsɛm, atetesɛm ne amammerɛ mmeae pii, ne aguadi meae a ɛyɛ ahokeka na nnipa abɔ apee so wɔ, anonnebeae, ne adidibeae.
826	travel	Ne tiatwa mu no, ɛwɔ afa mmienu:Sɛ wobɛyɛ adwuma bere a woretu kwan no anaa wobɛbɔ mmɔden ate nea wobɛtɔ so.
1672	health	Efiri bere tenten na wɔn ahu sɛ adwene sɛei, trauma, leisions ne tumors nya suban so nkɛntɛnso na ɛma nsakrae ba sɛnea adwene no yɛ adwuma ho.
536	travel	Mpoano, turo ne nsraban mmeae yɛ mmeae a agyi din a nkurɔfo a wɔ kɔ nsrahwɛ no tae kɔ hwɛ hɔ.
1909	science/technology	Ɛsɛ sɛ onipa a odi ahamatorofo ho dwuma no bɔ mmɔden ma wuhu biribiara a ɛfa saa abɛɛfo kwantempɔn yi ho.
611	science/technology	Sinitwa a ɛyɛ kuntann no wobetumi ayɛ wɔ kɔmputa so, na sinitwa a ɛte saa no wɔde yɛ adwuma wɔ TV ne sini mu.
157	sports	Keselowski na adrɔbafo akansie no mu ɔdii nkunim na ɔnyaa mma 2,250.
1294	politics	Nnipa baakron baguaku Provisional Electoral Council (CEP) kɔ suae kyerɛɛ Martelly.
1803	travel	Wɔ ɔkwan foforo so no, nsukyene ne sukyerɛma taa tɔ wɔ aman pii so, na kaa di akɔneaba bere dodow no ara a hwee ntwintwan akwan mu afe mu no nyinaa.
359	science/technology	"Nyansahunufo frɛ saa kwan yi ""stimulated emission of radiation"" ɛfiri sɛ atoms no kanea a ahyerɛn no na ɛstimulati no, na ɛkɔ photon of light emission no ba, na kane ano yɛ radion ku no bi."
302	politics	Wɔsesaa French mmara no mu. Ne activism no firii ase mfe 15 bere a ɔkɔdɔmm French Resistance no wɔ Wiase ko II
455	science/technology	Wei nyɛ biribi a ɛha adwenr esiane sɛ wɔn a wɔyɛ lɛns no aduru akyi paa wɔ lɛnse yɛ mu.
25	sports	Ovechkin mmoa a edi kan anadwo no akansie - a wɔdii nkunim yɛ atena rookie Nicklas Backstrom toe mu;
1606	science/technology	Abɔde mu nyansapɛ kyerɛ sɛ carbon economy a ɛyɛ peme no atu afiri biosphere no mu afiri ne tebeae a ɛboaa nnipa evolution bɛyɛ mfe apepem mmienu a atwam no.
79	sports	Afa abien behyiam wɔ semi final atitire baabi Noosa de mma 11 di nkan.
952	travel	Ewom sɛ wobɛpɛ sɛ wode wimhyɛn koro no ara betu kwan de, nanso ɛsɛ sɛ wuhu sɛ akwannya a wunya wɔ hɔ no betumi asesa ama wimhyɛn foforo ho nhyehyɛe no mmom bɛyɛ ama wo.
995	travel	Wimhyɛn nnwumakuw a wɔyɛ saa nhyehyɛe yi ne Air Canada, Delta Air Lines, Lufthansa a efi U.S anaa Canada, ne WestJet.
266	science/technology	Russia tumi a ɔwɔ wɔ fam hyɛɛ jets no kena na biribiara kɔ so wɔ siteehyen hɔ sɛnea na ɛte no.
112	politics	Owura Rudd gyina a wasi sɛ ɔde ne nsa bɛhyɛ Kyoto climate aban no ase no yi United States si nkyɛn, a ɛno na ɛbyɛ ɔman atupɔn a ɔnnyɛ saa apam yi ntom.
1050	politics	Amannebɔ no hia paa ɛma mprenpren nhyehyɛe a ɛfa Iraq ho na ɛkamfo kyerɛ sɛ wɔnyɛ nsesae wɔ kwan a wɔnam so no.
1609	travel	Adɛn nti na nnosoatwe akwanso adeyɛ ma anwini a ɛtete saa ba, adɛn nti na wɔdi mfomso dabiara da? So nnosoatwe ho mfiriyɛfo adwumayɛ nnimu anaa? Anaa biribi a ɛho hia rekɔ so?
1316	sports	Wrestlers a wɔne di agoru nso daa wɔn yaakɔ nsɛm adi faa Luna ho.
291	geography	Asasewosow a ɛyɛ hu na ɛde nsakrae soronko bae no sii March 10 wↄ tokuro kɛseɛ a ɛda bepↄw no atifi,ne fa a ɛkyerɛ atifi-apueeɛ no.
1215	travel	Amannebɔ a edi kan bɛtɔɔ gua no kyerɛ sɛ wimhyɛn sane ne n’ani kyerɛɛ mu wɔ Afghanistan bere a anka ɛregyina putupuru mu wɔ Ürümqi nanso wɔamma no kwan wɔ hɔ.
1270	sports	Carpanedo sii akan wɔ ankorɛankorɛ Championships akansi abienmu s Wukuada de no da nkyɛn a.
663	entertainment	San Francisco nso yɛ mmea papapaa no mu biako wɔ ɔman no mu ma Asiafo nnuane ahorow: Koreafo, Thaifo,Indiafo, ne Japanfo.
91	politics	Lodin nso kaa sɛ mpaninfo sii gyinae sɛ wɔbɛtwa runoff no mu sɛnea wɔbɛbɔ Afghans ho ban wɔ ɔhaw ɛwɔ ɛka ne banbɔ ho wɔ abato no mu.
371	science/technology	Anka Triceratops betumi de n’ano a ɛyɛ den no ate nhaban no ansa na wawe dua no.
1806	travel	Mmoa ahorow bi te sɛ asono ne kɔntenten, taa bɛn kaa pɛɛ na mfidie a ɛyɛ, bɛboa ma woahu wɔn yiye.
930	travel	Enhia sɛ wubegye akwantu krataa atu kwan akɔ aman binom so sɛ nsrahwɛni anaa sɛ oguadini de, nanso sɛ wobɛkɔ hɔ sɛ osuani a wufi ɔman foforo so no bɛma woakyɛ sen sɛ worekɔ nsrahwɛ bi kɛkɛ.
33	sports	Wɔpamo Piquet Jr. wɔ 2009Hungarian Grand Prix akyi.
0	health	Dwoada, nyansahufo a ɔfi Stranford Suapɔn Aduru Sukuu mu no de too gua sɛ wɔayɛ nhwehwɛmu nnwinade foforɔ bi a etumi yiyi sɛɛ ‘cell’ akuo no mu: ɛyɛ kyiipo ketekete bi a wɔtumi yɛ denam standard inkjet a ɔde bɛdi dwuma no so emu biara ano si bɛyɛ U.S. cent
200	geography	Felicia, a na ɔyɛ Category 4 storm wɔ Saffir-Simpson Hurricane Scale, ayɛ mmerɛ wɔ tropical depression ansa na ɛresɛe Benada no.
873	entertainment	Sɛ wo pɛ biribi a wonyɛɛ bi da a, fa hokwan no yɛ nnuaba mu nsu anaa yam nnuaba ahorow bi.
774	entertainment	International Horticultural Exposition yɛ dwumadi soronko a wɔde da nhwiren adi, turo ahorow ne biribiara a ɛfa mfifide ho.
1377	science/technology	Afide ma yɛtum si yɛn afie na yɛnya ntaadeɛ firi afifide mu. Nnuane dodo no ara a ɛyde no yɛ afifide. Sɛ afifi nni hɔ anka mmoa ntumi ntena nkwa mu.
203	geography	Deɛ edii nsutɔ ne so ne afradaa ne ayerɛmoo a ɛtete.
1365	science/technology	 Sebɔ su nteateamu nte sɛ gyata a rebɔ mu, ɛte sɛ obi a ne bo afu na ɔreteatea mu.
1176	sports	Na ɛyɛ akansi a etwa to ma All Blacks na wɔadi kan adi nkunim nnawɔtwe abien a na atwam no.
879	health	Aban pii hwehwɛ sɛ nsrahwɛfo a wɔreba hɔ, anaa wɔn man mufo a wɔrefi hɔ ɔman no mu no wɔ nnuru a ɛbɔ ban fi nyarewa ahorow bi ho no.
110	science/technology	Stardust bɛyɛ biribi a obiara nyyɛ bi da sɛ ɛno na ɛyɛ spacecraft a atumi asane aba asase so, na atwa deɛ na ɛwɔ hɔ dada a wɔyɛɛ no Kotonimaa 1969 bere na Appolo X command module resan n’akyi no.
1494	science/technology	Subsistence kuayɛ nyɛ den, mpɛn pii no ɛyɛ organic, sistɛm a wɔde di dwuma no boa aba no wɔ ecoregion a wɔaka ɛne crop rotation abom anaasɛ tɛkniks a ɛnyɛ den ma nnɔbae no baa bebree.
1086	science/technology	Nsunsuanso a na kuo rehwɛ kwan na tidal forces no na na ɛbɛkɔ akɔfa aba na ɛbɛda galaxy's dark mata no ne Milky Way's dark mata no ntam.
1623	geography	Amazon no san nso yɛ aubɔntene a emu terɛw paa wɔ asase so, ɛtɔ da bi a ne tɛtrɛtɛ no yɛ akwansin asia.
1222	entertainment	Na roack band no bere aso sɛ ɛkɔ kyinkyin wɔ Unites States ne Canada kɔsi Ɛbɔ da a ɛtɔ so 16.
1357	science/technology	Nkra nkuma wowɔ hɔ (a ayɛnmmoa a wɔato wɔn agyeegyee mu ka ho) a wɔn nso edi mmoa nkenkkete te sɛ mmoa mmoa,rodɛnts, nkotrɛ ne nnomaa.
216	sports	Anka squash, karate ne roller sopɔts rebɛka Olympic dwumadi ho ɛnna baseball ne softball, na wɔtoo aba yifirii Olympic Agodi no mu wɔ 2005.
327	sports	Wɔwoo Bobek wɔ Crotia ahenkuro Zagreb mu na ɔgyee din bere na ɔsi akan ma Partizan Belgrade no.
277	politics	Massachusetts gɔvna dada Mitt Romney adi nkunim wɔ Republican amnnyɔku no aba wɔtoo wɔ Florida Benada no mu na ɔnyaa aba a wɔtooe no mu ɔha nkyekyɛmu 46.
428	geography	Turkey no nsaase no tenten boro kilomita 1,600 (1,000 mi) ne trɛ yɛ 800 km(500 mi), na ayɛ ne ho ahinanan hyeepu.
1709	travel	Goma yɛ nsrahwɛbea a ɛwↄ Democratic republic of Congo epue fam a ɛbɛn Rwanda kuro no.
565	health	Wɔn a wɔyɛ daadaa dwumedie no hiaa mmoa pii wɔ adwene bɔne a na wɔwɔ fa nsonsonoe a ɛwɔ ɔyaw a ɛwɔ atenka koanokoro mu ne ateetee a ɛwɔ honam mu ahokeka mu no.
742	travel	Ɛmfa ho sɛ esua no, Hawaii nsrahwɛfo a wɔn mfe akɔ anim no kae bere a etwam a na enni nsrahwɛ ahɔhogyebea akɛse ne nkɔanim ahorow.
531	sports	Wɔ bɔ ntokuro dunwɔtwe sɛ ɛyɛ ɔfa a ɛnam ne kwan so a, na wɔn a wɔbɔ no tae fi ase bɔ wɔ tokuro a edi kan no mu akansi no mu na wɔ wie wɔ tokuro a ɛto so dunwɔtwe no mu.
729	travel	Bowen supɔw no yɛ da mu akwantu anaa nnawɔtwe awiei nsrahwɛ a wɔka kayak wɔ nsu so, wɔtwa kwan tenten, sotɔɔ ahorow wɔ hɔ, adidibea ahorow ne bebree a ɛka ho.
1427	science/technology	Sɛ nhwɛso no, mfoni fɔɔmat a ɛho nyɛ na wɔ wiase ne 35 mm, a na ɛyɛ na ɛyɛ dɔminant film size bere analog film reba awiee.
865	health	Sɛnea yenya home mu nyarewa wɔ mmeae a ɛhɔ yɛ awɔw no, nsono mu nyarewa nyɛ nna wɔ mmeae a ɔhyew wɔ no na mpɛn pii no ɛyɛ ahi ankasa nanso ɛnyɛ hu saa.
205	travel	Aka sima du ama aduru baabi a anka ɛsɛ sɛ ɛkɔ gyina no na ɛyerae.
374	science/technology	Nnipa ne mu duru yɛ 200 pounds (90kg) wɔ Asase so no mu duru bɛyɛ 36 pounds (16kg) wɔ lo so. Gravity no ntwee wo pii.
275	politics	Komen nhyehyɛe no mma Planned Parenthood mfata esiane sɛ Cliff Stearns ananmusifo reyɛ nhwehwɛmu afa Planned Parenthood ho wɔ kwan ɛfa de sika di dwuma ɛbɔ ne sikasɛm ho amanne.
1991	travel	Nsase a ɛwɔ nsu ho no nso yɛ mmeae a wobetumi akɔ hɔ akwamma.
349	science/technology	Nyansahunufo reyɛ reactor a ɛbɛtumi amema energy saa kwan korɔ no arar so.
1325	science/technology	Ɛbɛduruu Ɔpɛpɔn 25 no,Curtis Coope ɔyɛ prɔfeɛsa wɔ nkotabu ne kɔmpta sɔience mu wɔ Central Missouri Suapɔn mu na ɛde prime nɔma a ɛs o paa yɛnim aba.
1854	travel	Europa yɛ asasetam a esua de nanso ɛwɔ aman bebree a ade wɔn ho.Sɛnea wɔyɛ no no, woretu kwan akɔ aman pii so no bɛkyerɛ sɛ wobɛfa visa abisade ahorow mu ne baabi a wɔhwɛ paspɔt nsɛmsɛm mu no.
946	geography	“White Sea-Baltic Canal” nam “Lake Onega”, “Lake Ladoga” ne “Saint Petersburg” nsu ne ɔtare so na ɛka “Arctic Ocean” ne “Baltic Sea” bom.
182	politics	Aban kasamafo kaa sɛ, “Ɛho hia paa wɔ ɔmanfo apomuden ne nsɛmmɔnedi kwan sɛ wɔnye mmara no ntom animanim yi ara sɛnea ɛsɛ.”
1288	politics	Nkrataa abɔtɔ gua no kyerɛ sɛ, ɛbɛkyerɛ hye so mantwe, a na Palestine pɛ a egyina ahye soansa na Mideseast ako no resi wɔ 1967 mu.
1639	science/technology	Atɔm yɛ nketewa paa ma emu ɔpepepepem bɛtumi akɔ osiwie a ɛwɔ asɛmfua yi awie no mu.
69	entertainment	Band no twaa agoru a na ɛrekɔ so wɔ Maui's Ako Nkae Agoprama so no mu, na wɔrehwɛ nnipa 9,000 kwan sɛ wɔbɛba, wɔtwaam no wɔpaa akyitaafo no akyɛw.
12	sports	Nansa yi ara na ɔdii Raonic anim dii nkuguwɔ Brisben Open.
508	health	Attention Deficit Disorder “neurological syndrome a ne klasek a ɛyɛ nsunsuanso a aka abom a impulsivity, distractibility ne hyperactivity anaasɛ ahoɔden mmoroso”.
1794	travel	Sɛ woretwa Northern Baltic no wɔ awɔw bere mu a, hwɛ baabi a ɛdan no si, efisɛ nsukyene no a wɔfa so no yɛ dede haw ebinom.
667	entertainment	Akwannya nkrataa bebree a wɔtɔn wɔ abɛɛfo ntontan so denam badwam adetɔn wɛbsyte te sɛ eBay anaa Craigslist yɛ multi-day park-hopper akwannya nkrataa a wɔde di dwuma wɔ nyiyimu kwan so.
127	entertainment	Na wɔn akyerɛwfo no akɔ so anya nkɛntɛnso kɛse wɔ Jon Stewart ne Stephen Colbert's news parody shows so.
1236	sports	Giancarlo Fisichella antumi ankora ne kaa ne so na ɔde akansi no baa awiee bere na ɔfirii ase nkyɛee no.
160	sports	Stewart, Gordon, Kenseth, ne Harvick nka nnia a du a wɔdi kan no ho wɔ adrɔbfo akansie no mu na aka akansi no nnan wɔ akansi bere yi mu.
1732	geography	Sundarbans no kata beae a ɛyɛ 3,850 km², a bɛyɛ abiesa mu nkyɛmu biako yɛ nsu/atɛkyɛ mantam.
1940	geography	Esiane sɛ na ɛyɛ “Smyma” tete kurow no nti, abɛyɛ beae a egyina ne nan so ma aguadi, na wɔasi wɔ ɛpo faka ho na mmepɔw atwa ho ahyia.
37	entertainment	PBS abesɛm agye Emmy abasobɔ ahorow aduonu-anan na wɔyi kyerɛ bere tia bi wɔ Sesame abɔnten so ne Owura Roger mantam hɔ.
726	entertainment	Adidibea ahorow etwa turo no ho ahyia , wɔyɛ kɔnsɛte a wonnye hwee awiabere ne anwummere biara fi central gazebo.
1507	science/technology	Scaffolds betumi ayɛ biribi a anni hɔ anaa biribi a εwɔ hↄ, kwan foforo so no, tikyani yɛ scaffold bi nanso ɛyɛ paperclip man ketewa wɔ Microsoft Ɔfese.
1318	sports	"Dustin ""Goldust"" Runnels kaa sɛ “Na freakyte sɛ me... ebia na ɔkyɛn me koraa... medɔ no na mɛfe no... megye di sɛ ɔwɔ baabi a somdwoe ɛwɔ."
379	science/technology	Afaafa no kɔ so wɔ Venus no fa nko ara (anaasɛ wɔ Ɔsram no) a ɛhwɛ Awia no sɔ. Venus no afaafa no foa tiɔri ɛne Copernicus a okyinsrom ano de twa Awia no ho.
1237	sports	Deɛ a ɔne no wɔ ku no mu Fernando Alonso na ɔdi kan mprɛ pii wɔ akansi no mu na egyaae wɔ pit-stop akyi bere tiwa bi akyi, a ɛbɛyɛ badly tucked wɔ wheel a anim nifa so nti.
375	science/technology	Awia nni crust te sɛ Asase no so a wobɛtumi agyina so. Awia no yɛ gyaframa, gya ne plasma.
1736	travel	Japanfo Coaster ahyɛn som ɔmansin no dodow pii , na ahotɔ wom na ɛyɛ esi pi.
534	travel	Ebia nsrahwɛ ho nhwɛso a agye din paa no yɛ nea nkurɔfo de toto akwantu ho no: Ɔhome ho nsrahwɛ.
48	sports	Owura Reid tumi twii New Zealand's A1GP no, Tuntum Fɛɛfɛ wɔ mmirika a ɛboro 160km/h a ɛkyɛn bridge no mprɛ nson.
246	politics	Efiri bere a Pakistan firii British nhyɛso ase 1947 no, Pakistan Manpanin ayi “ Amanyɔ Agente” sɛ wɔnhwɛ FATA , a wɔbɛnya mmeae tumi no so tumi.
1217	politics	Ɛso a International de wɔn so no kyerɛ sɛ wɔntumi nkɔtɔ wimhyɛn foforo.
1916	entertainment	Ɛwom sɛ archipelago mpaono ne atare akɛse no kɛse yɛ ma yacht biara de, hyɛmma nketewa anaa mpo kayak ɛma suahunu soronko koraa.
1192	health	Wɔde deɛ ɔtwa mfoni no kɔɔ Ronald Reagan UCLA Medical Center, na ɛhɔ na ɔkɔ gyae mu.
559	science/technology	Proton pii wɔ electric charge a ɛyɛ kotope abere a neutron pii nni charge biara. Electron pii no wɔ electric charge a ɛnyɛ kotope.
107	geography	Sɛ capsule duru asase no so na eduru wim anɔpa nnɔn 5 (apue bere), wɔhwɛ kwan sɛ wɔd light show bɛma nnamfo a wɔwɔ Northern California, Oregon, Nevada, ne Utah.
549	sports	Ɛwom s ɛ obi a ɔdi kan wɔ akwansini fa mu mmirikatu mu no betumi de simma mmienu awia a, ɛsɛ sɛ ɔyɛ obi a ne ho yɛ hare paa, nanso ɛsɛ ɔnya amanehunumu boasetɔ wɔ asiane nyinaa mu.
1923	travel	Wimhyɛn akwantu yɛ ade a onipa biara suro, titiriw sɛ nnipa no mfaa winhyɛn ntuu kwan anaa wɔapira da a.
126	entertainment	Al Gore ne General Tommy Franks rattle off wɔ headlines a wɔpɛ paa no ( The Onion ka Gore ho asɛm sɛ ɔno ne Tipper reda wɔ kwan wɔn wɔn agye ho sene biara bere a ɔdii nkugu wɔ Electoral College)
983	health	Nnomaa ɔpakum yare anaa ɔpakum a ɛkye ntakramoa binom a wɔte sɛ nnomaa no tumi kye nnomaa ne mmoadoma.
915	science/technology	Saa “aplikahyens” no mu bi mpo tumi kyerɛ nkyerɛwde ahorow ase kɔ kasa foforo mu anaa wotumi kyerɛ anituade nneɛma ase kɔ kasa foforo mu wɔ bere a wode ahamatorofo no akyerɛ dekode no so.
330	sports	Obiara nni hɔ a wagyina mu anaasasɛ wato ntena ama ku no asene Bobek.
563	health	Nhwehwɛmu no huu sɛ adwenemhaw, ehu ne atoyerɛnkyɛm dii ayɔnkofa a ɛda ɔyaw ne dɛmdi a ɛwɔ sisi akyi mu yaw a wɔn a wɔyare saa yare no wɔ no ntam asɛm.
496	health	Nnuyɛfo ‘Surgeons’ wɔ nimde wɔ nnuro ahorow a ɛma adwene no mmerɛ pii na ɛnyɛ adwuma pii ho a morphine a ɛfiri poppy aba mu scopolamine a ɛfi herbane aba mu.
919	science/technology	Ɛmma wonsɛe sika wɔ bere a woretɔ maapo ama “GPS” no, anaa woretɔ “GPS” akade anaa worefɛm bi afi adwumakuw a wɔde lɔre fɛm mu.
1504	science/technology	Ɛnyɛ nnipa na wɔtetee wɔn, abofra a onim nnipa no da su bi adi, (ɛwɔ baabi a ɛpem) a ɛte sɛ aboa a wɔtetee no, a esuro nnipa.
1422	politics	1683 mu no,Qing dynasty (1644-1912) akofo gyee Taiwan atɔe ne mpoano atifi fam nsase bɔɔ so na na wɔkaa sɛ Taiwan ɛyɛ Qing Ahemana mantam wɔ 1885.
202	geography	Precipitation no aduru nkyisi no 6.34 wɔ gauge ɛwɔ Oahu, na wɔakyerɛkyerɛ mu sɛ ɛyɛ “mfaso wɔ so”.
109	science/technology	Capsule no bɛtu kwan bɛyɛ kilomita 12.8 anaasɛ anibuo biara maale no 8, na ɛyɛ deɛ ne ho yɛ den sɛ ɛtumi firi San Francisco kɔ Los Angeles wɔ sima biako mu.
1521	science/technology	Ɔsusuu mpo sɛ hunu a wɔtumi sɛnea nnipa yɛ n’ade no mmoa te nkraman nso te saa.
1479	science/technology	Deɛ mfiridwuma bɛkyerɛ no taa gyina adwenepɔ abien bi so: tɛknɔlɔgyi no ankasa nkɔanim gyina amammere anaa amanyɔsɛm nkɛntɛnso, na tɛknɔlɔgyi no “aka” aman a ɛwɔ mu no, sene sɛ ɛbɛka no abom no.
1163	politics	Wɔan a wɔgyina maa wɔtoo wɔn so aba no bɛtumi ama ananmusifo abɛhwɛ deɛ ɛrekɔ so no nyinaa. Anwummere no, atuhoamafo kenken abato no bere a wɔhwɛ deɛ ɛrekɔ so no yiye bere a wɔredi akwankyerɛ pɔtee bi so.
1696	geography	Nsupɔ nketewa no dodow no ara yɛ aman a wɔn ade wɔn ho, anaasɛ ɛne France abom, na wonim no sɛ adetrasodi mpoano beae.
866	travel	Sɛ ɛyɛ bere a edi kan a woretu kwan akɔ ɔman a ɛrenya nkoanim mu ̶ anaa wɔ wiase ne fa foforo biara no ̶ emmu ehu a ɛka obi bere a ɔkɔ amammerɛ foforo mu no abomfiaa.
1809	sports	Paralympics no befi ase efi Ɔsanaa da ɛtɔ so 24 kosi Ɛbɔ da a ɛtɔ so 5 ,2021. Wɔbɛyɛ dwumadi no bi wɔ mmeae ahorow wɔ Japan.
119	entertainment	Agoru no gyina Fallujah Ako a ɛtɔso abien, ntɔkwa huhuu a ɛkɔ so wɔ Amerikafoɔ ne Iraq asraafoɔ ntam.
1175	sports	Ɛdema Springboks, ɛkɔ wiee match-nnum a wɔdi streak totoaa so.
198	health	Sɛ papu ne menem kuro da nkyɛn a, me ho yɛ paa na metu di me dwuma denam tɛlefon so nkitahodi so.
144	science/technology	“ Wei kyerɛ sɛ ɛsɛ wɔde biribiara hyɛ deɛ ɛhyɛ, nhwehwɛmuyɛfo a ɔwɔ Rift Valley Research Service wɔ Ethiopia ne ɔtwerɛfo a ɔka nhwehwɛmu no ho, Berhane Asfaw.
1167	entertainment	Wɔ ne nna edi nkan mu no, dwumadi no kɔɔ so wɔ ntanɛte radio so bere tenten wɔ radio no site a ɛyɛ TogiNet Radio, site wɔn ani ku radio so kasa ho.
908	science/technology	Nsɛnkyerɛwfo taa twa atoro fa nea nti a wɔyɛ no saa, wɔ bere a wɔka se “ɛyɛ ade a wɔyɛ de bɔ korɔno”.
1196	sports	Bere aka mɛdaas du nnwɔtwe na ɛhɔ hɔ da mu no nyinaa no, aman pii nsa nkaa mɛdaa podium biara.
111	science/technology	Tom Duxbury a ɔyɛ dwumadi no kwakyerɛfo no kaa sɛ; “ Mɛkɔ Califonia ati wɔ mpoano atɔe na mama wim ayɛ hann afiri California akɔsi Oregon mfimfin ne Nevada ɛna Idaho akɔsi Utah. ”
1722	travel	Sɛnea South Africa Man no Turo nyinaa te no, wɔwɔ da biara akorae ne emu ba akatua ma turo no.
1989	travel	Lɔre binom nso a kɔ Hebron atifi fam a ɛyɛ asiei ma Kyerɛw Kronkron mu nnipa binom te sɛ Abraham, Isaac, Jacob, ne wɔn yerenom.
512	health	ADD ɛka wɔne wɔn mfɛfo ntam nkitahodi esiane sɛ mmɔfra afoforo nte sɛ nti a wɔyɛ wɔn ade wɔ saa kwan no so anaasɛ sɛ nti wɔsopɛɛle saa kwan no anaasɛ wɔn nyini no da soronko.
1182	health	France ne kuro a ɛtɔ so nson wɔ European Union a yaremmoawa no kaa wɔn; a edi Austria, Germany, Slovenia, Bulgaria, Greece ne Italy so.
393	politics	Germany frɛɛ ntohyɛso no “ “Operation Sealion”. Britain Asraafo no akode akɛse akɛse ne supplies dodow no ara na ayerayera bere a wɔtu fii Dunkirk, enti na asraafo no no ayɛ mmerɛ.
1908	science/technology	Wɔde eyi di dwuma mpɛn pii no ara wɔ nneɛma nneɛmafa a wɔde fa nsu so mu, a nsu so hyɛntwi a wɔde gyigye wɔn ani ka ho, na nsrahwɛfo a wɔwɔ deeta a ɛwɔ akyi no ka ho bi.
592	science/technology	Nkwanmoa pii na ɛwɔ mmoa mu. Wɔ di neama na wɔ yam wɔ wɔn nipadua no mu. Mmoa pii tumi keka wɔn ho.
550	sports	Mmirika a wɔtu fa aman mu wɔ awɔbere mo, ne apomuteɛteɛ ho dwumedie a wɔyɛ ma nipadua no fa a ɛwɔ suro no a wɔka bɔmu no, yɛ ɔkwan pa a wɔ de yɛ ahoboa ma mmirikatu bere no.
1210	entertainment	1980 mfe no mu no ɔyɛɛ adwuma wɔ shows te sɛ Taxi, Cheers, ne The Tracy Ullman Show no so.
1232	entertainment	Lakkha Singh de chhappan bhog bhajan mae. Na nnwomtoni Raju Khandelwal ka ne ho.
1891	travel	Akwantufo a anyɛ den amma wↄn sɛ wobesua afoforo amammrɛ no, ɛtↄ da a,ɛbɛyɛ den sɛ wobɛsan akↄfa wↄn de no bio.
1798	entertainment	Mmeae binom kyɛ wɔn a wɔaba hɔ no nsa. Nanso, asabo ma worentumi nsi gyinae pa, ɛno nti wɔn a wɔto kyakya no nyinaa nim hia ehia sɛ wɔrenbo pii.
738	travel	CafeNet El Sol gye US$30 na woama wo hokwan sɛ wobetumi akora akwammisa krataa so, anaa $10 sɛ wopɛ sɛ wohwɛ hɔ da mu no a; ɛho nsɛm pii wɔ wɔn Corcovado afa hɔ.
1298	politics	Ɔyɛkyerɛ a ɛtɔ da a na basabasayɛ si wom no nyinaa firi aba a wɔanto no nti, a ebi bere so firi 2011 tonn.
577	science/technology	Nkwanmmoa no yɛ ade biako a ɛwɔ neama a nkwa wɔm mu, na nkwanmmoa biako anaa mmienu na ɛka bom yɛ neama a nkwa wɔmu nyinaa.
733	sports	Wɔ awɔw bere mu no, nya ski a wɔde hyɛ nan ase sane fa bepɔw a sukyerɛma wɔ so wɔ North America mu mfaso, na wɔ ɔhyew bere mu no sɔ bepɔw so sakre twi a ɛda mu fua no hwɛ.
1624	geography	Nsu a ahwie firi nsoroma no mu nsubɔntene mu kɔ po no mu no ɛmu ɔha mu nkyekyɛmu 20 firi Amazon no mu.
185	sports	Na ɔwɔ kuo no hootɛɛ sɛ akan a na wɔne Bolona rebɛsi no kwasiada no bɛduru so.
1158	geography	Glen Cushing a ɔwɔ United States Geological Survey (USGS) Astrogeology Kuo na ɛwɔ Northern Arizona Suapɔn mu wɔ l Flagstaff, Arizona kaa sɛ; “Wɔn thermal no su nsesa te abodan akɛse wɔ asase so a daa ne tɛmperekya no gyina faako, nanso ɛne no hyia wɔ ntokuro akɛse a ɛwɔ fam no” .
190	travel	Wɔmma apasengyafo no nsu bere a na wɔatwɛn ɔhyew a anoden no yɛ digirii- 90(F)
1233	entertainment	Nintendo baanodani Satoru Iwata anodisɛm a ɔde too gua wɔ Yawoada wɔ Tokyo Agodi Dwumadi ase no, ɔdaa controller design ɛma adwumaku no Nintendo Revolution console a ɛyɛ foforo no adi.
1548	politics	Wei mu biako a ɛhia yɛhyɛ no nso paa ne nansa yi North Atlantic campaign ɛwɔ WWII. Na Amerikafo rebɔ mmɔden sɛ wɔde nnipa ne nneɛma bɛtwa Atlantic Po no de aboa Britain.
647	entertainment	Yɛn mu pii hwɛ TV so dwumedi a ɛma yɛhu sɛnea neama kɔ so anaa yɛnya osuahunu a yɛremfa yɛn ho nhyɛ mu anaa yɛremfa saa nimdeɛe no nyɛ adwuma.
1522	science/technology	Afeha a ɛtɔ so aduonu nhwehwɛmu akyerɛ genetic variatio pool ahorow abien a ɛwɔ hɔ:
601	science/technology	Nitrogen a ɛyɛ mframagya no daso wɔ su tesɛ nitrogen a ɛsen. Wɔ tebeae a ɛsen mu no ɛyɛ duru nanso molecules da so te sɛnea ɛte.
1747	sports	Argentina agye din sɛ ɔwɔ polo kuw ne wͻn a wͻbɔ polo a edi mu no mu baako wɔ wiase nyinaa.
142	sports	NBA sii gyinae yi bere Utah Jazz kansifo baako nyaa COVID-19 yaremmoawa no bi.
1802	travel	Ebetumi aba sɛ worenhu ade yiye esaine sukyerɛma a ɛretɔ anaa mframa rebɔ no anaa nsu aboaboa ano anaa nsukyene no akata kaa no ahwehwɛ no so.
825	travel	Sɛ wopɛ sɛ wohu wiase no a wonsɛe sika pii a, sɛ ɛyɛ ahiade, sɛnea wo te anaa nkyia to no, akwan ahorow wɔ hɔ a wobetumi afa ayɛ saa.
1144	politics	Coalition ne Afghan asraafo kɔ beae hɔ kɔgyee hɔ bɔɔ so na ɔsomaa coalition afoforo wimhyɛn sɛ ɛnkɔ hɔ nkɔ boa.
1850	sports	Baage a wɔde bɔ akyi de ski sane fa sukyerɛma so: Wɔsan frɛ saa agodi yi ski a wɔyɛ wɔ nkuraase, ski nsrahwɛ anaa ski a wɔde nantew kɔ akyi.
1033	science/technology	Wɔhunuu sɛ Awia yɛ adwuma wɔ tebea ko ara mu te sɛ nsroma nkae no: Nsroma dwumadi nyinaa wɔhunuu sɛ deɛ ɛhyɛ ne kutupa yɛ n wɔn luminosity, wɔn ntwaho na ɛnyɛ biribiara.
1848	sports	Ski a wɔde hyɛ wɔn nan ase sane fa sukyerɛma so no yɛ biribi a akyɛ yiye paa ̶ abotan mu nkyerɛwee da no adi sɛ efii ase wɔ 5000 BC!
228	geography	Wɔhunuu saa scarps yi wɔ ɔsram no ho nyinaa akɔyɛ minimally weathered a ɛkyerɛ geologic events a ɛkɔfa baae a ɛnkyɛe.
292	geography	Amaneɛbↄ kyerɛ sɛ bepↄw no ase yɛɛ kusuu a na ɛnyɛ sɛ ogya bi fi bepↄw no mu ba.
1225	sports	Del Potro dii nkan wɔ set a ɛtɔ mmienu, nanso wei hia tie break bere a eduruu 6-6.
1416	sports	Agodie a agye din bi te sε bɔɔlbɔ, baskɛtbɔɔlo, vɔlibɔɔlo, nsuom bɔɔlbɔ, bangye agorɔ, rugby, sakretwe, asukyenee hockey, roller hockey ne F1 moto akansi.
129	entertainment	Kuro no na ɛbɛyɛ kuro a ɛwɔ Europe anafoapue a wɔbɛgye CowParade asi wɔn serɛ so, na ɛbɛyɛ wiase nyinaa guabɔ a ɛso yiye paa, efiti Ayɛwohummumɔ ne Ɔsanaa wɔ afe yi mu.
1003	science/technology	Ɔkae sɛ, ɔyɛɛ WiFi pono dɔn,
271	health	Ɛha Dr.Lee wɔ amannebɔ a ɛkyerɛ sɛ mmɔfra a wɔwɔ Turkey no anya yare a ɛyɛ A(H5N1) avian influenza yaremmoa no bi a wɔnyare.
103	politics	Saa anodisɛm a ɛkɔɔ so wɔ lɛlɛvihyina obiara ni tua no ne deɛ edi kan Iran mpaninfo gye toom mu sɛ anohyeto no so wɔ nsunsuansoɔ bi.
14	sports	 Akansi no akyi no, Clay in kaa sɛ ” Ɛyɛ me ani gye sɛ mesan gyinaa me ho so wɔ ɔfa etwa to no mu wɔ afa ahorow atitire no mu. Mewɔ ha sɛ mɛbɔ mmɔden adi nkunim“.
1412	politics	Na Congress no nni tumi biara wɔde totua bɛto ɔmanfo so, na esiane sɛ na national executive anaasɛ atemmu biara nni hɔ nti,na ɛdan siteeti no mpanimfo, na wɔn nso wɔmmoa sɛ wɔde acts no nyinaa bɛyɛ adwuma.
