index_id	category	text
1811	travel	Sɛ wokoraa wimhyɛn beae so ne baabi a wobɛda ma 2020 ansa na wɔkaa sɛ w’atu ahyɛ da no a, ɛnde wo tebea no bɛyɛ biribi a ɛwɔ hɔ.
1681	science/technology	Technology de nsɔano ma ɛnam virtual field trips so. Adesuafo no betumi ahwɛ tete neama akorae mu neama, akɔ hwɛ aquarium, anaa ahwɛ mfonini a ɛyɛ fɛ bere a wɔte wɔn adesuadan mu.
335	entertainment	Turkeyni diva Sezen Aksu ne Itanin tenor Alessandro Safina ne Greek singer Haris Alexiou goro boom.
378	science/technology	Mfe mpem abiɛsa akyi no, wɔ 1610, Italini a ɔhwɛ nsoroma Galileo Galilei de telescope di dwuma hunu sɛ Venus wɔ afaafa sɛnea ɔsram te no.
1367	science/technology	Nyansahunufo susu ocelots yi mmoa wɔkye wɔn no ho mpanpan, hwiahwia baabi wɔafa wɔ asase so.
703	travel	Nnipakuw nsrahwԑ bo yԑ fo, enti sԑ ԑyԑ wo pԑ anaasԑ wo ne adamfo baako pԑ no, bͻ mmͻden sԑ mobehyia nnipa afoforo na moayԑ kuw a nnipa anan kosi nsia wom ama ͻbaakofo bo aba fam.
297	politics	Nsesae a wɔasusu no wɔagye ne mmienu atom wɔ fie hɔ ɛwɔ 2011 mu.
80	sports	Maroochydore dii Caboolture so nkunim wɔ Preliminary Awiee.
1823	travel	Duty free shopping yɛ hokwan a wode bɛtɔ nneɛma a ɛtoɔ nna so wɔ mmeae ahorow bi.
836	travel	Adanwinni no yɛ sɛnea wɔnwinni dan na wosi no no. Sɛnea wosi fa nwinni dan na wosi no no mpo yɛ nea ɛtwe nkurɔfo ma wɔbɛhwɛ hɔ.
880	travel	Saa ahwehwɛde yi begyina ɔman ko a ɔkwantufo no akɔsra anaa ɔpɛ sɛ ɔkɔ hɔ so.
1143	politics	Amannyɔku a ɛredi tumi a ɛyɛ South West Africa People's Organisation (SWAPO), tumi nyaa mmarahyɛbagua nkongua dodow no ara wɔ abato no mu.
650	science/technology	Wo ahɔhodan (sɛ wɔte ahɔhodan nketewa mu anaa wɔn ankasa wɔn fie) mu no wɔbetumi anya wifi anaa kɔmputa a ɛwɔ wiase ntontan kɛse no so, na ɛhɔ fo nyinaa wɔ wiase ntontan kɛse adan anaa mmeae bi a wɔwɔ amansan wifi.
702	travel	Ԑsԑ sԑ wo paspͻt no di mu na ԑboro nna a akwantu no bedi no so abosome 6.Wohia tekiti a etumi de wo kͻ na ԑsan de wo ba anaa tekiti a ebedi nna a wobedi no ho adanse.
1604	travel	Anɔpa biara, nkurɔfo firi nkuro nketewa a ɛwɔ ɔman bi mu wɔ wɔn ahyɛn mu kɔ wɔn adwumayɛ beae na afoforo a wɔn a adwumayɛ beae wɔ baabi a wɔfirii no nso twa wɔn ho kɔ.
817	sports	Ɛhyɛɛ ase fii Barcelona Ammirikatu Nsrahwɛ a ɛwɔ Barcelona ne Copenhagen Ammirikatu a ɛwɔ Copenhagen, na ankyɛ na Prague Ammirikatu Nsrahwɛ a ɛwɔ Prague ne afoforo bɛdomee.
1763	travel	Afe biara no, nnipa pii pira esaine sɛ wɔantwe wɔn ho yiye amfi wɔn ho nti.Saa mmoa yi soso, wɔn ani so yɛ hye, na wobetumi apira nkurɔfo, enti ma kwan nna mo ntam.
1290	politics	Israel hwehwɛ sɛ, wɔde nsa hyɛ apam no ase ɛsɛ sɛ asraafo di mfe du wɔ valley no mu nanso PA no aka sɛ mfe nnum na wɔbɛte ase.
1775	entertainment	Nsa a wɔyɛ wɔ hɔ a agye din ne “Number One”. Ɛnyɛ nsa bi a ɛyɛ nwonworann saa, nanso ɛyɛ dɛ na ɛma akomatɔyam.Nsa a ɛka ho a wɔyɛ wɔ hɔ ne “Manta”.
642	science/technology	Intanεt no ne wiase ntontan kɛse a yɛde yɛ adwuma no ma adesuafo kwan ma wɔnsa tumi ka nsɛm bere biara.
1544	politics	Eduu Ɛbɔ da a ɛtɔ so 17,1939 no, na Polish banbɔfo no agu, na anidaso no ara ne sɛ ɔnko bio na wɔasane akeka Romanian bridgehead no asi ani.
1148	health	Kasamafo ma Medecines Sans Frontiere Richard Veerman kaa sɛ: “ Angola rekɔ baabi a ɛyɛ hu a na asɛm da so ara nnyɛ wɔ Angola,ɔno na ɔkae.
801	health	Nom nsa a ano yɛ den kakraa bi. Ɛsono sɛnea obiara yɛ n’ade bere a woanom nsa no, ɛno nti hu a wobehu nea wobetumi anom no ho hia ankasa.
1741	travel	Wͻahyehyԑ sԑ wobebue msamsoͻ no ano wͻ Ԑbͻ 2017, bere a Brazilfo awie baabi a wͻhwԑ nneԑma a ewura na anaa epue firi hͻ no.
1140	entertainment	Ɛwom sɛ na Winfrey werɛ aho wɔ ne nkradi a etwa to no mu, ɔmaa n’akyitaa fo tee ase sɛ ɔbɛsan aba.
1267	health	Edgar Veguilla [iraa wɔ ne nsa ho ne n’abɔdwe na Kristoffer Schneider hia sɛ wɔyɛ reconstructive surgery wɔ n’anim.
1774	entertainment	Ɛyɛ mmeae a mmusua kyere so wɔ hɔ na hyɔɔpo ahorow pii na ɛwɔ mpoano hɔ. Asiane biara nni asuguare mu.
862	health	Nanso wɔ wiase afa ahorow bi a mmoawammoawa no yɛ foforo ma wo nnipadua no, ɛnyɛ den koraa sɛ wobehyia ɔhaw ahorow.
1069	politics	Layton asrɛ sɛ wɔnyɛ nsakrae wɔ conservatives no bill a ɛfa atenae ho wɔ nhyiam a wɔne PM no yɛeɛ no ase no, na ɔsrɛ sɛ Conservative amannyɔku no bill a ɛfa atenae ho no“ wɔntwerɛ no yiye na wɔnwie” .
325	geography	Nyansahunufo a ɔwɔ Ɔman no Hurricane Asoe aka sɛ ennuru Wukada no na Danielle abɛyɛ hurricane .
1314	health	Ne nhwehwɛmu no daa no adi sɛ wɔma hormone a ɛbɛma abɔfra no aharawa no abantɛm.
704	travel	Nanso, ԑnsԑ sԑ wei ha wo, esaine sԑ mpԑn pii no wͻka nsrahwԑfo no bom sԑnea kaa ahorow no bԑyԑ ma.
528	sports	Fencing agurɔ a aba so no wɔdi wɔ gyinapɛn biara, fi asuafo a wɔ sua ade wɔ suapɔn mu kosi animdefo so ne Olympic akansi mu.
532	sports	Onipa a ɔbɔ dodow kakraa bi, anaa ɔhim aporibaa no kakraa bi de wie akansi no na ɔbedi nkonim.
1643	science/technology	Nea obi betumi ayɛ ne sɛ ɔbɛ dwen nea ɛbɛto keyboard no sɛ ade foforo san ba abere a mmere rekɔ so no a.
868	travel	Ne titiriw no wɔ wo nna edi kan mu no, susuw ho sɛ wobɛsɛe sika wɔ aburokyire ahosiesie ne ahɔhogyebea ahorow a ɛyɛ papa, aduane, ne nneɛma a ɛbɛboa ma ɛhɔ ne wo agye.
124	entertainment	Ansa na The Daily Show ne The Colbert Report, Heck ne Johnson hunu no sɛ biribi ɛte sɛ new —ne news amannebɔ— bere a na wɔyɛ asuafo wɔ UW wɔ 1988.
1159	politics	Wɔ France, aba a wɔto wɔ tech-kwan so no wɔ fam: wɔn a wɔto aba no te wɔn ho wɔ booth no mu, de krataa wɔaprente a ɛkyerɛ deɛ wɔpɛ no de hyɛ envelope mu.
701	travel	Cuban manfo a wɔyɛ nkurɔfo a wɔwɔ US green kaade no ɛsɛ sɛ wɔ kɔ Ecuadorfo Consulate hɔ sɛnea ɛbɛyɛ a wɔbɛyi saa ahwehwɛde yi efiri mu ama wo.
560	health	Ansa na wobɛhwɛ onipa a wapira no, ɛsɛ sɛ wodi kan hwehwɛ beae hɔ yie de hwɛ sɛ asiane biara nni hɔ.
167	politics	Ntohyɛsoɔ yi de wantwiwantwi kɛse abɛto India ne Pakistan ntam.
301	politics	Nneɛma a Vautie atumi ayɛ a akwankyerɛ ma ɛda nkyɛn a, deɛ ɛko ne aduane a ɔde kamee ne ho sɛ ɔnni wɔ afe 1973 a na ɔhunu sɛ ɛyɛ amannyɔsɛm mu nsɛm a wɔde sie ɔmanfo
40	entertainment	John Grant a ofi WNED Buffalo (Reading Rainbow’s home station) kae se, “Reading Rainbow kyerɛɛ mmofra nea nti a ɛsɛ sɛ wɔkenkan nhoma, ...ɔpɛ pa a ɛsɛ sɛ wɔnya ma akenkan –[the show] hyɛɛ mmofra no nkuran ma wɔfaa nhoma kenkan.”
1414	politics	Articles no hia sɛ siteeti no nyinaa pene so a obiara ntia ansa na wɔatumi asesa mu na siteeti no amfa central govmɛnt no aniberesɛm na mpɛn pii na wɔn ananmusifo noa na wɔnni hɔ.
1789	travel	Ɛsɛ sɛ wode nsakrae ahorow anaa adesrɛde biara fa wo akwantu nanmusifo no so kane na mmom ɛnsɛ sɛ wone ahɔhogyebea no kasa tee.
754	travel	Ahɔhogyebea binom nyaa wɔn nhyiase fii bere a na wɔde keteke a ɛde ntutu yɛ adwuma ne po so hyɛn akɛse di dwuma no;ansa na Wiase Ko a ɛtɔ so Mmienu reba no, wɔ afeha a ɛtɔ so 19 ne 20 mu no.
1142	politics	Nsunsuanso a etwa to a efiri Namibia ɔmanpanin ne mmarahyɛbagua abato no kyerɛ sɛ ɔmanpanin a ɔte agua so no Hifikepunye Pohamba adi nkunim na mma ɔde dii nkunim no dɔɔso paa yiye.
1022	politics	Saa nkaebɔ yi kɔɔ so bere a Trump ne Turkey manpanin Recep Tayyip Erdoğan ka saa wɔ foon so.
538	travel	Nsrahwɛfo no betumi akɔsera mmeae titiriw ahorow wɔ ɔman pɔteebi so anaa wɔbetumi apaw sɛ wɔbɛ ma wɔn ani akɔ beae biako pɛ so.
155	geography	Abotan yi mu du nnum na ɛwɔ meteorite shower Kitawonsa a etwaam no mu.
1278	health	Ɛwom na nnipa baasa na wɔwɔ fie hɔ bere a kaa no bɛbɔɔ mu no, nanso obiara ampira.
1197	sports	Wɔn a wɔka ho ne Netherlands,a Anna Jochemsen tɔɔ so nkron wɔ mmaa standing clas ɛwɔ Super-G nnora ɛne Finland ɛnna Katja Saarinen tɔɔ so du wɔ dwumadi korɔ no ara mu.
1541	politics	Na Germany yɛ ɔtamfo wɔ wiase Ko 2 no mu,na ɛmaa USSR ne USA kaa wɔn ho boom. Ako no baa awiee no, na klashes sistɛm no, akwan ne amammere ama aman yi ahwehwe ase.
1111	health	Yare a etuu atese no maa India aban no tu anammɔn pɛɛ wɔn a wɔbɛkyere mprako no wɔ mmeae a yare no atu ate se no, wɔakyeyɛ ntontom nnan mpempem ne nnuro a wɔde supree wɔn.
889	geography	Antarctica yɛ asasetamaa beae bi obiara nte hɔ a ne kɛse bɛyɛ kilomita 2-3 na asukɔtwea agye hɔ afa.
324	geography	Mfram no a ɛyɛ bɛyɛ maale no 3,000 firi Miami,Florida wɔ mframa a ɛyɛ 40 mph (64 kph).
118	entertainment	Deɛ ɔyɛɛkonami agoru kaa no nnɛ wɔ Japan nsɛmmannwoma sɛ wɔnna agoru no adi nna nsia wɔ Fallujah.
1018	entertainment	Wɔbɔɔ Gosling ne Stone din sɛ agofomma a wɔbɔ wɔn ho mmɔden yiye.
523	health	Wei yɛ berɛ te sɛnea ɛsɛ sɛ sima aduonu anaasɛ aduasa biara no wo sɔre hwɛ TV.
1637	science/technology	Wobetumi anya nnadeɛ afrafra a neama nketewa a ɛnyɛ nnade wɔmu tesɛ carbon.
749	travel	Wobɛtena wo kaa mu na woasim akɔ kwan tenten akwantu yɛ ade a ɛyɛ anika kɛkɛ na ɛnyɛ kyɛnkyerɛkyɛnn biara.
1575	science/technology	Binary akontahyɛde betumi afa tiade mmienu pɛ, ɛno ne 0 anaa 1, na wɔferɛ saa nkontahyɛde yi sɛ binary digits - anaa bits, sɛ wode kɔmputa kasa reyɛ adwuma a.
524	health	Nsunsuanso no gyina sɛnea w’adwene no bɔ mmɔden dwene nneɛma ho anadwo ho da biara no.
358	science/technology	Wɔyɛ wei bere a eyi nneɛma nketewa bi a yɛfrɛ no “photon” no.
999	health	Te sɛ animdefo nkae no, ɔnhunu sɛ sɛ asikyireyare yɛ biribi a wɔtumi sa, hyɛ no nso sɛ saa adida yi mfa nnipa a wɔnya asikyire yare Kuo 1 no ho.
1359	science/technology	Sebɔ ne sohyia nkra paa, a wɔwɔ akuo a wɔfrɛ wɔn prides mu.
311	entertainment	Na awarefo yi aware wɔ Texas afe a etwaam no na wɔne wɔn nnamfo ne wɔn abusuafo aba Buffalo sɛ wɔrebɛgye wɔn ani.
1917	entertainment	Hyɛmma mu tena yɛ anigyedeɛ a atwam wɔ Findland, na hyɛmma biara wɔ nnipa nson anaa nwɔtwe.
1771	geography	Mpoano a ɛwɔ Atifi fam (ɛwɔ Habɔ a ɛwɔ Atifi mansini mu) ɛwɔ Pasefeke Sukɛseɛ na ɛfi Bay Tenten a ɛwɔ atifi no kɔsi Devonport a ɛwɔ anafo.
361	science/technology	Photons no sua sene nneɛma ɛbɛyɛ atoms no!
196	health	Manpanin soafo Rodrig kaa sɛ,na Arias wɔ yaremmoawa no bi bere a wɔyɛɛ nhwehwɛmu no.
951	travel	Wo woredan kuw bi ayi wimhyɛn a wopɛ sɛ wode tu kwan no a, yɛ ahwɛyie.
878	health	Yɛwɔ nsaneyare nso a wonya bere a wokɔ mpɔtam a obi a woanya yare no bi wɔ no.
214	sports	Wɔbɛsan asi golf ne rugby ho akan wɔ Olympic Adoru no mu.
509	health	Ɛnyɛ adesua mu dɛmdi, ɛyɛ adesua mu biribi a ɛnkɔ yiye; ɛka mmɔfra mu ɔha nkyekyɛmu 3 kɔsi 5, bɛyɛ Ameika mmɔfra bɛboro ɔpepem 2.
332	entertainment	Anigye no hyɛɛ ase firii Cirque du Soleil kuo a agye din wɔ wiase afanan nyinaa so.
835	travel	Wɔ tebea foforo mu no, wɔn a wɔte baabi a ɛnyɛ nsrahwɛ dabere no hia sɛ wɔkyerɛw wɔn din.Nanso wei ma wonhu mmara no ani so yiye, enti di kan hwehwɛmu ansa.
298	politics	Wɔyɛɛ nsesae wɔ saa mmara yi mu bere a House of Representatives no popaa kasamu a ɛtɔ so abien no na Senate no gye fɔɔm a ɛte saa toom wɔ Dwoada no.
392	politics	Berea france ako no baa awiee no, Germany yɛɛ ahoboa sɛ wɔbɛkɔ Britain island no so.
1211	entertainment	1989 mu ɔboae ma wɔyɛɛ The Simpsons with Brooks ne Groening na ɛyɛ ɔno na ɛhyɛ ne nsa sɛ ɔnkɔpɛ atwerɛfo kuo a wɔdi kan no.
204	travel	Twin Otter no rebɔ mmɔden sɛ ɛbɛgyina Kokoda nnora te sɛ Airlines PNG Flight CG4684, nanso na ɛkɔ dada.
916	science/technology	Mfidi a edi kasa nkyerɛase ho dwuma no akɔ n’anim yiye, ɛnna seesei nso ɛtaa ma nkyerɛase a nkekaawa biara nni ho (ɛnna ɛmma nsɛnhunu bebree), nanso ehia ahwɛyiye, efisɛ ebetumi akɔba no sɛ ankyerɛ nsɛm no ase yiye.
535	entertainment	Wei yɛ bere a nkurɔfo kɔ beae bi a ɛda nsow wɔ wɔn daa-daa abrabɔ ho kɔ gye wɔn ahome na wogye wɔn ani.
658	health	Sɛ ɔhyew mmere ba a, hwɛ wo ho yie wɔ Nordic ntontom ho. Ɛmfa ho sɛ wɔmmma yare biara no, wotumi ha adwen paa.
353	science/technology	Nsuo no molecules no yɛ nvisible skin wɔ nsu no ano na ɛma nneɛma te sɛ paneɛ tɛ nsu no ani.
1520	health	Oliver Sacks, wɔ ne krataa a ɛyɛ Ɔpan panin no kasaT’he President's Speech’ mu no, ɔkyerɛɛ sɛnea nnipa nte kasa ase esiane adwene a asɛe na wɔntumi nnya biribiara sɛnea anka ɛsɛ sɛ ɛyɛ no.
1331	politics	Ayɛ huhu sɛ ɔbɛgyina apre ɔman panin 2016.
295	health	Helicipters kɔ twitwa gyee crewmembers du abien na pira a ɛwom yɛ ɛhwene na ɛho atɔ kyema.
569	science/technology	Ɔman bi mu fo yɛ nkwanmmoa titiriw bi kuw a wɔwɔ beae titiriw bi mu no.
926	science/technology	Sɛ wode afiri a ɛfa wim twa mfoni anaa sini na ɛredi dwuma a, di kan gye akwannya wɔ nea ɛsɛ sɛ wutwa ho na hwɛ hu nea ɛma wo ho kwan saa anaa hwɛ sɛ tumi krataa bi ka ho ana.
854	travel	MetroPlus no mu wɔ ahotɔ paa na nnipa no nnɔɔso nanso ne bo yɛ den kakra, ɛwom sɛ ne bo yɛ fo sen tekiti a wotwa ma metro no wɔ Europa no.
225	science/technology	Ahoɔdenne tuntum yɛ force bi a wonutmi mfa w’ani nhunu koraa na ɛkɔ so ara yɛ adwuma wɔ amansan yi mu.
1598	science/technology	Wɔ yɛɛ nsɔhwɛ mmienu a ɛne sɛ wɔde radioactive phosphorus hyɛɛ DNA no agyirae wɔ mmoawammowa mu anaa wɔde radioactive sulfur hyɛɛ mmoawammoawa no protien nnuanennuru agyirae.
771	entertainment	Kerala asɔredan afahyɛ no yɛ anika paa sɛ worehwɛ a, bere a asono a wɔasiesie wɔn to santen fa kurom, asɔre no adwontofo ne dwumadi ahorow.
856	travel	Nneɛma a wɔsoa ma afoforo - Nyi w’ani mfi wo nneɛma so, titiriw no bere a woretwa amanaman hye mu no.
23	sports	Nnɛ agodini a ↄbɔↄ ne ho mmɔden paa ne Alex Ovechkin a ofi Washington Kuropɔn.
432	politics	Luxembourg wɔ abakɔsɛm tenten anso wɔn faahodien no firi 1839.
1804	travel	Safari betumi ayɛ nea ɛtwe nsrahwɛ ba Afrika paa na ɛno nti na nsrahwɛfo pii ba hɔ.
533	sports	Wɔ bɔ wɔ sare so, na wɔ twa sare a ɛwɔ tokuro no ano no so ma no yɛ tia na wɔferɛ no ahabanmuno.
434	politics	Luxembourg abɔ mmɔden sɛ ɛbɛyɛ ɔman a ennyina ɔfa biara nanso Wiaso KO I ne Wiase Ko II mu Germanyfo kɔ gyee hɔ kɛntɛnn so.
128	entertainment	The artistic dwumadi nso ka Bucharest City Hall ntoabɔ sɛ ɔbɛsane ada Romania ahenkuro mfoni no adi sɛ ɛyɛ creative ne metropolis a ɛyɛ fɛ paa.
810	sports	Canyoning ka nsu mu aguare, adeforo ne adehuru mu nneɛma bi bom--nanso ehia ntetee kakraa bi pɛ anaa apɔmuden na woatumi ahyɛase (sɛ yɛde toto abotan a wɔforo,nsu ase a wodware anaa ski a wɔde hyɛ nan ase sane fa sukyerɛma so, sɛ mfatoho no).
1327	science/technology	Comets bɛtumi ayɛ baabi nsu firi ɛba asase yi so ne organic matter ɛbɛtumi ayɛ protens na aboa nkwa.
638	science/technology	Wɔ 1977 mu no, Dr. Damadian wie “nipadua-nyinaa” MRI nhwehwɛmu anwinade a edi kan no ho adwumayɛ, na ɔferɛɛ no ”Indomitable”.
269	sports	Jesus a wadi mfe 21 firi Brazil kuo Palmeiras kɔdɔmm Manchester City aferaasɛɛ Ɔpɛpɔn 2017 na wɔtuaa sika ɔpepem £27.
1364	science/technology	Gyata wɔ ku korɔ no ara mu (Genus Panthera) te sɛ sebɔ, leopards ne jaguars. Saa nkra anan yi na wɔbwtumi su teateamu kyɛ.
989	geography	Nsukyenee nhyɛ da nnyinam da biara, nanso etwiw fa bepɔw no so. Eyi tumi ma pae bepɔw no mu ɛnna etumi nso bɔ mu tokuru, a asukɔtwea twene betumi ahata so.
864	health	Ɛno na ɛde Delhi Belly, Pharoah’s Curse no, Montezuma’s Revenge, ne wɔn nnamfonom bebree haw no bae.
595	science/technology	Nkwanmoa yɛ abɔde (neama) a nkwa wɔmu no fa ketekete bi.
571	science/technology	Sɛ ankorankoro no da su a ɛnnsɛ adi a wɔferɛ wɔn polymorphic.
924	science/technology	Nhyehyɛe a ɛwɔ daadaa mfonitwa ho no bi ara na ɛwɔ sinitwa nso ho, a ebi mpo wɔ soro sen saa.
570	science/technology	Sɛ ankorankoro a wɔwɔ ɔman bi mu no di nsɛ wɔ su titiriw bi mu a wɔferɛ wɔn monomorphic.
1273	sports	Skiers nnan a wɔwɔ mmea aku no mu na wɔatumi anwie wɔn mmirakatu no naa skierfo 117 na wɔwɔ Giant Slalom no mu 45 na wɔnnya baabi anni wɔ akansi no mu.
1400	politics	Wɔatwerɛ “Faahodie Mpaemuka Anaksa” wɔ Faahodi Mpaemuka a wɔabɔ deei a ɛyɛ Kitawonsa da ɛtɔ so 4 1776. Ntwerɛe wɔ dɔkomɛnt no ase, ne ti asi ase no.
664	travel	Kwan a wɔtu kɔ Walt Disney Wiase no gyina hɔ ma akwantu titiriw ma Americafo mmusua beberee.
1737	travel	Ahyɛn a wɔkyɛ yɛ ɔkwan a ɛyɛ ntɛm na ahotɔ wɔ mu a wɔfa so tu kwan lɔ mmeae a ɛbɛn, te sɛ Paro (Nu 150) ne Punakha (Nu 200).
457	science/technology	Ade biako aɛnyɛ wɔ zoom lɛnses ho ne sɛnea aperture (mmirika no) ma lɛnse no taa yɛ nyaa no.
1051	politics	Deɛ edi nkamfo 78 mu no ne ɛsɛ sɛ wɔtu diplomatic initiative ho anamɔn ansa na afe yi akɔ awiei na wɔde abɔ Iraq ahyeɛ ho ban de atia amanmmɔefo na wɔsan ne wɔn a wɔbɛn no no hyɛ diplomatic nkitahodi mu kena.
870	travel	Sɛ wo soeɛ wɔ abɔten a, fa mpa a wɔda so wɔ abɔnten anaasɛ mpa a wɔde sɛn dua ho sɛnea ɛbɛbɔ ho ho ban afi awɔ, nyanyankyerɛ ne nea ɛtete saa ho.
1735	travel	Sɛnea ɔmansin-ntam ahyɛn tae yɛ ma no, nyansa wom sɛ wobɛtɔ akwannya nkrataa nna kakra ansa na bere aso.
1852	sports	Fa no sɛ ɔkwan a wɔde ski sane fa sukyerɛma so no ne ɔkwan a wɔn a wɔnantew kɔ kwan tenten fa so no yɛ pɛ.
816	sports	Wiase nyinaa Ammirikatu Nsrahwɛ nanmusini, Go Running Tours ka wɔn a wɔhwɛ wɔn a wotu mmirika de hwɛ kurom no bebree bom wɔ asasetam anan so.
986	geography	Nea edi akoten wɔ Norway ne akwan a esian a ɛdeda abotan ne obon a ɛma asase yantam ho kwan.
1786	travel	Akwantu ananmusifo ahorow no taa ne ahɔhogyebea ahorow pɔtee bi yɛ nhyehyɛe, ɛmfa ho sɛ wonam akwantu nanmusifo bi so betumi akora beae afoforo a wobɛda so te sɛ beae wobetumi asoɛ wɔ abɔnten.
833	travel	Wei bɛhwehwɛ sɛ wobɛhyehyɛ nhoma bi wɔ wɔn polisifo asoeɛ anaa wokɔsra atubrafo ɔfese ahorow.
597	science/technology	Sɛ wohwe abɔde a nkwa wɔmu wɔ anwinade a wɔdehwɛ neama nketenkete ase a, wobɛhu sɛ ahinanan anaa bɔɔlo na ayɛ no ma.
1281	health	Mfiase wɔgyee no too James Paget ayaresabea wɔ Great Yarmouth.
1472	politics	Filipinofo no ankasa na wɔtuaa U.S ako a na ɛyɛ U.S. mpililisim no ho ka.
1011	sports	Yɛne USOC's asɛm a wɔkae no yɛ adwene sɛ ɛsɛ deɛ agodifo no ne akuo, wɔn sopɔɔto, no pɛ no wɔdi ho dwuma yiye denam kɔ a wɔbɛkɔ anim na nsesae ntease wom akɔ so wɔ yɛn kuo no mu, sene adodin krataa a wɔtwe sensɛn.
1674	science/technology	Eyi ma yɛnya nsɛm ne neama a yɛde besi biribi a akanya atenka a ɛboa yɛn ma yɛte sɛdeɛ adwene no yɛ adwuma ase ho nhwɛsode.
805	health	Susuw ho sɛ wobɛyɛ w’ani no mfeefeemu wɔ baabi a wofi, ne titiriw no sɛ nsiakyibaa no betua a, na fa krataa a wɔakyerɛw nnuru no wɔ so no kɔ baabi foforo ma wɔmfa nto hɔ.
1542	politics	Ako no akyi mfe abien no, aman a wↄyε nnamfo bedan atamfo na eno na efii Apuei fam ne Atɔe fam Ntam Ntawntawdi ase
134	science/technology	Deɛ ɛkɔfa tide kɔkɔɔ yɛ nɔɔmaa concentration ɛma Karenia brevis a ɛwɔ soro, a ɛno ara sie -single-celled marine organism.
740	geography	Ɛyɛ supɔwkuw a supɔw 15 a apete afa ɛpo no so bɛboro ɔpepem 2.2 km² na ɛwɔ mu.
1183	health	wɔate sɛ H5N1 yare no abɛpue mu wɔ Croatia ne Denmark a wɔnsii pi.
1352	science/technology	Rocket na wɔsomaa no maa ɛde satelite no kɔɔ wim. Nyanshunufo de telescope di dwuma wɔ wim esiane sɛ Asase atmophere no bi si yɛn kane ne adehwɛ kwan.
1880	travel	Ɛsɛ sɛ akwantufo a wɔreyɛ nhyehɛe sɛ wɔbɛkɔ akɔyɛ bɔbeasu nsesae opirehɛn wɔ amanɔne kura nkrataa a ɛfata a wɔbɛ san de aba.
1588	science/technology	Abɔde mu nyansapɛ atirimpɔ titiriw ne sɛ wɔbɛho ɔkwan a wiase no yɛ adwuma denam abɔde mu nyansapɛ kwan so. Saa kwan yi kyerɛ abɔde mu nyansapɛ mu nhwehwɛ mu ho kwan.
877	health	Mmoawmmoawa bi a wɔfrɛ wɔn pathogen, te sɛ virus, bacterium, apotobibire anaa aboawa a odidi mmoawa foforo ho tumi ma yare sane.
1851	sports	Ɛsɛ no nanso ɛnte sɛ ski a wɔde hyɛ nan ase sane fa sukyerɛma anaa bepɔw so no, Nea edi akyire yi hia baabi a esiane na ɛsɛ sɛ ski ne mpaboa no kyekyere wo nan.
1152	sports	Ɔkwan a bɔɔlobɔfo fa so danedane bɔɔlo no, bɔ wɔn bea ho ban wɔ agoprama no so, sɛnea wɔn nnyinaa bɔɔmu yɛ adwuma wɔ agoprama no so no, na ɛyɛ sononko koraa ɛma no da adi sɛ wɔn na wɔbɛdi nkonim wɔ akansi no awie.
1082	politics	Commons Administreta Adam Cuerden daa n’ayawdi adi de fa nnyifirim no ho no bere a ɔne Wikinews kasae bosome a etwaam mu no.
1241	science/technology	Wɔdaa no adi sima 3 mu no, kamera daa insulation ahorow sɛ afiri fango tank no ho.
1190	politics	Perry kaa sɛ ɔbɛsane “ akɔ Texas abɛhwɛ mmuae anadwo yi caucus, we hinaam so sɛ mɛtumi akɔ m’anim wɔ saa akansie yi mu”, nanso ɔka sɛ ɔbɛtoa so agyinam asi akan wɔ Ɔpɛpɔn 21 wɔ South Carolina primary no mu.
498	health	Mfe ha ha bi akyi no,Roman aheman no nyaa nkɔanim wɔ aduyu mu na ɛbɛyɛɛ nimde a ɛwɔ hɔ nnɛ no nnyinaso.
276	politics	Stearns reyɛ nhwehwɛmu ahwɛ sɛ Planned Parenthood de toɔ sika na etuatuaa nyinsɛtugo ho aka bere na ɔredi dwuma sɛ obi na ɔda nhwehwɛmu kuo no ano a ɛhyɛ House Energy ne Commerce Committee ase no.
1865	travel	Sɛ ɛkɔba sɛ wɔde kɔkɔbɔ ma wɔ ɔman a worekɔ mu no ho a, w’akwantu apɔmuden nsiakyibaa anaa w’akwantu ntwamu nsiakyibaa no ho betumi aba asɛm.
1337	science/technology	Nhwehwɛmuyɛfo a wɔwɔ Princeton Suapɔn mu wɔ United States ne Uppsala Suapɔn mu wɔ Sweden bɔ amanne sɛ no yɛ generation abien pɛ, na wɔsusu saa kwan yi adi akyɛ paa de, esiane breedindg a ɛkɔɔ so wɔ endemic Darwin finch, Geospiza fortes ne immigrant cactus finch, Geospiza conirostris.
1264	politics	Huhne n’adwuma ato hɔ na wɔde Ed Davey MP bɛhyɛ n’anan mu wɔ cabinet no mu. Yɛhwɛ kwan sɛ Norman Lamb MP bɛyɛ Business Soafo adwuma Davey de reto hɔ no.
1790	entertainment	Wɔ afahyɛ bi mu no, wɔn a wɔba dwonto afahyɛ no ase no mu dodow no ara si gyinae sɛ wɔbɛsoeɛ wɔ beae hɔ ara, na wɔn a wɔaba hɔ no hu no sɛ ɛyɛ afahyɛ no fa titiriw.
490	politics	Awiee no, Krushchev de dorobɛn kↄe ma ɛhɔ daa dinn, ɔmaa nneɛma na wɔrepɛ no bi kwan na ɔtee ase paw Wladyslaw Gomulka a na wagye din paa no sɛ ɔmansoafo foforo.
827	travel	Wɔn a wɔpɛ sɛ wɔde wɔn ahotɔ, wɔn bere ne nea ebesi daakye bɔ afɔre sɛnea ɛbɛyɛ a wɔn ka bɛkɔ fam koraa no, hwɛ akwantu a ɛho ka nnɔɔso.
1433	science/technology	Ɛka sɛ baabi a ɛyɛ paa ma sɔbjɛts no ankasa ɛyɛ lines no ntasɛhyins a ɛkyɛ mfoni no mu abiɛsa mmeamu ne ntentenso (hwɛ nhwɛso no).
1939	geography	“Izmir” yɛ Turkey nkurow akɛse no mu biako a ɛto so abiɛsa na ekura nnipa ɔpepe 3.7, na ekura hyɛn gyinabea a ɛto so abien di “Istanbul” akyi, na akwantu ho nsɛm gyina ne nan so yiye.
720	geography	Sɛ yɛde ne mpoano a anwea fitaa ayɛ so ma ne mmepↄw a atwa ho ahyia no to nkyɛn a,ɛhↄ na wubehu Europe kuro kɛse a akyɛ yie wↄ Americas hↄ, a seesei ɛka San Domingo ho no.
1198	sports	Australia Mitchell Gourleytɔɔ so du biako wɔ mmarimma standing Super-G no mu. Czech kansifo Oldrich Jelinek tɔɔ so du nsia wɔ mmarimma sitting Super-G no mu.
153	geography	Wei yɛ deɛ wɔgye di sɛ wei ne deɛ ɛtɔ so mprɛ nnum wɔ nnipa abkɔsɛm mu a chemically martian material abɛtɔ asase.
1206	health	Hamilton sii so dua sɛ Howard Suapɔn Ayaresabea gye ɔyarefo no too hɔ a ne tebea no yɛ.
1828	travel	Nea ɛyɛ nwonwa mmom ne sɛ, ahomatrofo no ahoɔden no ano yɛ den wɔ ha sen ɔkwan ne fa ahorow pii, e.g. wɔ Pennsylania Wild no mu.
1207	health	Ɔyarefo no akɔ Nigeria, ɛyɛ beae a Ebola yare no bi apuepue hɔ.
522	health	REMs kakraa bi a ɛwɔ hɔ anadwo no, ne tebea a wɔwom a ɛma woda ankasa yiye no ne wo honam ɛrekɔva no ntaa mma wonnya ɔhaw.
821	travel	Akwantu asoeɛ awɔ hɔ fi afeha a ɛtɔ so 19 no mu. Obi a ɔhwɛ akwantu so no taa yɛ ɔkwan pa a wobetumi afa so sɛ woretu kwan a ɛsen nea etwaam a wotui wɔ abɔde mu, amammerɛ, kasa anaa aman a wɔn sikasɛm ba fam mu a.
1064	sports	Nanso bere a wɔhweree kapitin wicket no India tumi yɛɛ runs 36, hweree wickets no 7 de mmɔden bɔ no baa awiee.
306	health	Wɔkyerɛ mu sɛ yare a ekumm no ne intrahepatic bile duct kokoram yare no.
1478	science/technology	Tɛknɔlɔgyikaa ditɛminasim yɛ asɛmfua bi a adwenepɔ pii na ɛwɔ mu, ɛfiri tɛknɔlɔgyi-pia anaa tɛknɔlɔgyi mparatifu a ɛma ɛyɛ sɛ nnipa hyɛberɛ yɛ biribi a ɛne nyansahunu mu mmara wɔ twaka bi ne kwan a ɛfa so da adi wɔ tɛknɔlɔgyi mu.
529	sports	Nnipa abien abien na edi agurɔ no, ɔkofo biako ko tia ne yɔnko.
340	health	Zayat ho anksa wɔ akwanhyia yi mu.
1993	travel	Wotumi nso kyerɛ akwan a nnipa pii no ara nim sɛ wɔnante so ne nea wotwiw dade pɔnkɔ wɔ so.
350	science/technology	nanso wei yɛ biribi ayɛ den sɛ ɛbɛtumi asi ani na ɛbɛdi mfe pii na yɛhunu useful fusin reactors noa ayeyɛ.
1724	travel	Hong Kong nsupɔ ma Hong Kong asasesin no din na ɛyɛ beae a nsrahwɛfo bebree bu no sɛ ade titiriw a wɔn ani si so.
1013	sports	USA Gymnastics ne USOC no wɔ botae ko — na ama banbɔ aba agodi te sɛ gymnastics ne nkae no mu sɛnea ɛsɛ na ama agodifo atumi adi wɔn adaeso no akyi wɔ banbɔ kwan so,kwan ɛyɛ pa ne beae a biribiara kɔ kama.
1380	science/technology	Yɛnnim ankasa de, nanso ɛbɛtumi ɛwɔ tɛkyerɛma a emu apae abien sɛ adinam. Ne nnuane ne akyekyede,nsumnam akɛse, mosasaurs nkae, na ɛbɛtumi ayɛ sɛ na ɔwe mmoa a wɔfi abusua koro mu.
94	travel	Wimhyɛn de n’ani akyerɛ Irkutsk na asraafo a wɔbɛn wɔn a wɔredi ho dwuma.
