index_id	category	text
431	geography	Ɛpo atwitwa Turkey afa abiɛsa ho ahyia: Aegean po no kɔ atɔe, Ɛpo Tuntum no kɔ atifi ɛna Mediterranean Po no kɔ anaafo.
403	science/technology	Ako no mfiase no na na ɛtaa tɛ nsu no ani, na bere a bere radar fii ase bae no ɛbɔɔ adwuma pɛpɛɛpɛ na eyi hyɛɛ submarine s no maa ɛkɔɔ nsu no ase tonn na obiara ahunu no.
1592	science/technology	Abere a Greek ho nimdeɛ kɔɔ fam no, Atɔefam fo no huu sɛ wɔn atew wɔn ho efiri wɔn Greek nyansapɛ ne abɔde mu nyansapɛ ntini ho koraa.
993	entertainment	Mmom, saa mmeae a ɛwɔ bepɔw so yi ahoɔfɛ ne nnipa a wɔkye wɔn no da nso wɔ awɔw bere mu, wɔ bere a asukɔtwea a ano yɛ den reba mmeae no bi na ama nnipa binom kwan ama wɔakɔtwi asukɔtwea hyɛn wɔ so.
755	entertainment	Saa ahɔhogyebea yi ne baabi a na asikafo ne wɔn a wɔagye din tena, na mpɛn pii no na wodi nnuane pa na wɔgye wɔn ani anadwo no nso.
1936	politics	Afe 1994 mu no, saa ntɔkwaw yi maa wɔtee ankonam man a wɔfrɛ no “Transnistria Republic” a ɛwɔ Moldova apuei fam, a wɔwɔ wɔn ankasa aban ne wɔn sika a wodi, nan so “UN” nnyee wɔn ntoo mu sɛ ɔman.
1205	health	Danielle Langtagne, a ɔyɛ UN yare no mu ɔbenfo kae se, ɛda adi sɛ, banbɔfo no na ɛde yare no bae.
1692	geography	Mmeae akɛse a ɛwɔ atififam anim nohoa no ɔmanfo kakraa bi na wɔte hɔ na ebi nso adan asase pradadadaa a obiara ɛnte so.
280	politics	Wɔn wɔyɛɛ ɔyɛkyerɛ no ho ntotoe no kyerɛ sɛ nnipa a wɔde wɔn ho hyɛɛ ɔyɛkyerɛ no mu no wɔ German nkuro te sɛ Berlin, Cologne, Hamburg ne Hanover ano si 100,000.
247	politics	Saa agentefo yi asɛde ne sɛ wɔdi nsɛm a ɛfa asenni ho dwuma wɔ Pakistan amanmmara Article 247 mu.
1439	politics	Bere a ntɔkwa no pae guiɛ no Britain yɛɛ naval akwansi ɛwɔ Germanyfo so.
1239	entertainment	Ɔkaa sɛ ɛnne a ɛfri new conference no ase no kyerɛ sɛ “ Ɔyɛ kama na ɔto nnwom yiye nso”.
743	geography	Cook Island nni nkuro ahorow mmom no ɛyɛ supɔw ahorow 15 a aka abom.Nea edi mu akoten ne Rarotonga ne Aittutaki.
18	politics	Ɔyɛkyerɛ pii na ɛkɔɔ so wɔ wiase afanan baabiara, nnipa pii na wɔde wɔn gyinaa mmara anobɔɔ wɔn kwaadu, aban mpanimfo a wɔwɔ Iseland ne pakistan de wɔn adwuma too hɔ.
1344	science/technology	Hydrogen ions no yɛ protons na wɔyi electron n o afiri mu (ɛfiri sɛ Hydrogen atoms wɔ proto biako ne electron baako).
688	travel	Ahɔho a wɔn bere sua no ɛbɛyɛ papa sɛ wɔbɛsɛe wɔn bere wɔ baabi foforo.
556	science/technology	Wɔbu atɔm sɛ ɛyɛ ade a ɛho hia wɔ ade biara mu no mu biako.
1645	science/technology	Ɛte sɛ nea worepia adaka bi a amu yɛ duru de aforo bepɔ bi. Ɛpete nucleus no bio na egyae ahoɔden no bi mu.
907	science/technology	Wɔn na wɔma “bandwidth” a egyina so na wɔsom ɔmanfo nso yiye. Wɔabɔ ho ban a ɛyɛ den sɛ obi behu nea ewom.
1071	politics	Nanso Masnsofo panin John Howard aka sɛ na boatae no ne sɛ wɔreyɛ saa na Tasmanian aban no amma no ante amma fam, ɛno nti wɔmaa no ɔpepem AUD$45.
555	sports	Akansifo betumi ate nka sɛ wɔ hia ade bi abere mpo a ɛmfa mfaso biara ɛmma wɔn.
1203	health	Firi afe apem ahannwɔtwe mmere no mu, na Haiti man nhyiaa saa yare no bi da kɔsi sɛ asrafo no bae.
58	politics	Polisifo kaa sɛLo Piccol wɔ tumi esiane sɛ na ɔyɛ Provenzano ho nipa wɔ Palermo ne suahunu maa wɔbu no esiane sɛ na ɔde Provenzano nhehyɛe na ɛyɛ adwuma na ɔyɛ deɛ ɔbɛtumi biara sɛ ɔbɛhyɛ wɔn pawa nɛtwɛɛke a na emu ago no mu kena.
1764	travel	Nea ɛka ho no, hyɛ no nsow sɛ biribi hua tumi twetwe Osisi ne wuram mmoa a aka no, enti ɛnsɛ sɛ wofa anaa wonoa aduane a eyi hua na ma beae hɔ ntew.
195	sports	Massa ntumi nsi akan wɔ 2009 bere a aka mu.
1785	travel	Di a wobedi kan akora beae no so ansa na woakɔ hɔ no ma ɔkwantufo no asom dwo no esaine sɛ onim sɛ obenya baabi pa ada bere a wɔadu baabi a ɔrekɔ no.
600	science/technology	Nnoɔma ne neama afrafra betumi afiri tebeae biako mu akɔ foforo mu a ɛrensesa sɛnea ɛte.
553	sports	Kwansini ntam mmirikatu yɛ agudie a ne bo nyɛ den; nanso, nnsɛm a ɛnnyɛ nokware pii wɔ hɔ a ɛfa adwinnade a ɛho hia sɛ wonya na ama wo atumi de wo ho ahyɛ saa agudie yi mu.
1720	geography	Turo no kata 19,500 Km² na wɔn akyɛ mu wɔ ecozones ahorow 14 mu, emu biako biara boa mmoa a wɔn ho yɛ hu ahorow.
1622	geography	Amazon nsubɔntene no yɛ nsubɔntene a ɛyɛ akɛse na ɛwa no mu nea ɛto so mmienu wɔ Asase so. Sɛ nsubɔntene kɛsɛ a ɛtɔ so mmienu no nsu a ɛwɔ mu no bɛyɛ mmɔho 8.
1441	politics	Britain de ade a etumi to di awu hyehyɛ nsu ase sɛnea ɛbɛyɛ ɛbɛsi a hyɛmm biara kwan na ama ocean no fa biara na ɛmaa ɛyɛɛ hu maa hyɛmma a ennyina ɔfa biara no mpo.
566	health	Ade hu, anaa sɛ wobetumi ahu ade no gyina aniso adeyɛ ho akwanso atenka akwaa no so anaa ani no.
1515	science/technology	Dwuma soronko a ntanɛte di nso kɔfaa ade foforo koraa nso bae ɛde fa sɛdeɛ yɛde grafikeehyin bɛdi dwuma ne ɛho akwan ho no.
585	science/technology	Nanso, adwinnade a wɔde hwɛ neama wɔ akyirikyiri no na wɔyɛ wɔ Europe wɔ 16th century akyiri.
1689	geography	Ottawa yɛ Canada man no ahenkuro a ɛyɛ fɛ yie, na wɔka kasa mmienu na wɔwɔ mfonini hwɛbeae a ɛyɛ fɛ yie ne tete neama akorae a Canada man no tete neam ne wɔn neam a ɛwɔ so wɔ hɔ.
1256	health	Wɔde too infrared spectroscopy (FTIR) ho na nneɛma a ɛwɔ crystals no mu ne deɛ ɛwɔ ayɛmmoa aka wɔn dwonsɔ no mu no hyia.
60	science/technology	Apple adwumaku wura Steve Jobs daa adwinade no adi denam bɔ a ɔbɔɔ anan kɔɔ asεnkagua noo so bere a oyii iPhone no firii ne jeans bɔtɔ mu no.
32	sports	Bere a kaa na edi Alonso anim no kɔpuu fango wɔn banbɔ kaa no ase no, ɔkɔɔ sorokɔdii nkunim.
1411	politics	Bere ɔmananidani ‘Revolutioanr’y ako no rekɔ so no, siteeti du abiɛsa no dii kan kaa wɔn boom yɛ aban a wɔyɛ mmerɛ na wɔnyɛ den—a na Congress no nko ara na ɛyɛ wɔn koponɛnte— wɔ Articles of Confideration no ase.
13	sports	Nadal nyaa mma no 88% wɔ akansi no mu na ɔdii nkunim nyaa mma 76 wɔ ɔfa edi kan no mu.
1941	travel	Wɔde nkyɛnsee a wɔde bɔ dan so kɔkɔɔ, mfe ɔha a ɛto so 18 gua, ne tete nkramodan ne asɔredan na ayɛ kwantempɔn akɛse a nnua wɔ nkyɛnkyɛn, adan a wɔde nhwehwɛ na ayɛ anim ne ɛnne mmere yi aguadibea ahorow no de, nanso saa kurowpɔn yi kura “Mediterranean Europe” atenka no bi sen tete “Turkey” no.
732	sports	Whistler (wode kaa fi Vancouver rekɔ hɔ yɛ nnɔnhwerew 1.5) bo yɛ den yiye nanso agye din paa esaine 2010 Olympics a wɔyɛ no awɔw bere mu no nti.
871	entertainment	Fa kɔfe a ɛyɛ papa hyɛ wo fi ma anɔpa no ne chamomile tii a ɛdwodwo no anadwo no.
886	geography	Antarctica ne baabi a ɛhɔ yɛ nnwunu pa ara wɔ asase so, na atwa Anafo fam poolu no ho ahyia.
362	science/technology	Filamenta a ɛwɔ bulb no mu hyeeɛ na kanea bulb no antumi anyɛ adwuma bio wɔ nnɔnhwere pii a wɔde yɛɛ adwuma bebree no akyi.
1578	health	Hwɛ toa no ho sɛɛ wobehu ɔkerɛkyerɛ a ɛfa ɔhwɛ a edi kan a wɔde ma obi a ɔnom saa awuduru pɔtee no.
996	travel	Ͻkwan biara so no, ɛsɛ sɛ wo ne wimhyɛn adwumakuw no ankasa di saa nhyehyɛe yi ho nkɔmmɔ wɔ ahamatorofo so.
197	health	Ɔman panin no tebea ɛyɛ, na ɔbɛte no atena baabi foforo wɔ fie nnafua pii.
460	entertainment	Wɔayɛ tɛlɛvihyin dodoɔ no ara sɛ ɔmanfo no ani nnye ho.
154	geography	Wɔsusu sɛ meteorites 24,000 a wɔnim na abɛtɔ asase so, na emu 34 pɛ na wɔatumi asi no ɛfiri martian mu.
1160	politics	Sɛ mpaninfo no hunu atofo no nipa ko a, atofo de envelope no hyɛ abato adaka no na ɔde wɔn nsa hyɛ abato roll no ase.
1223	entertainment	Bere a nnwomtoni a ɔda wɔn ano Steven Tyler te hweei pirae na ɔtwaa ntoabɔ no mu wɔ Ɔsanaa da ɛtɔ so 5.
54	politics	Peter Costello, a ɔyɛ Australia trɛhya ne obi a ɔbɛtumi asi Ɔmansaoafo John Howard ananmu sɛ Liberal Amanyɔku no Kannifo apene nulear a nnwumaku no reyɛ wɔ Australia no so.
7	politics	Ɔyɛkyerɛ no hyɛɛ aseɛ bɛyɛ 11:00 mpatam hɔ bere (UTC+1) wɔ Whiteball a ɛne baabi a polisi abɔ ho ban hwɛ anim ɛde rekɔ Downing Street, baabi a Ɔmansoafo no te.
1010	sports	USA Gymnastics foa United States Olympic badwakuo no lɛtɛ no so na wɔgye tom sɛ ɛho hia sɛ Olympic abusua no hwɛ sɛ wɔn agodifo no nyinaa bɛnya beae papa banbɔ wɔ.
1174	sports	Sokɔɔ a etwa to yɛ pɔint-biako, 21 kɔ si 20, na ɛmaa All Black nkunim a wɔdi toatoaa so 15 ba awiee.
1202	health	ℇde fa asɛm a wɔde kɔɔ asɛnnibea ne sɛ, efi a ɛfi UN nsraban a w’ankora so yiye nti na ɛmaa efi wura asubɔnten Artibonite a ɛyɛ Haiti asubɔnten akɛse no mu biako.
958	travel	Nnwumakuw a wodi wimhyɛnfa ho dwuma no mu biara nni tumi wɔ popɔn so fa no nyinaa so wɔ “Southern Hemisphere” (ɛnna “Sky Team” nso nni tumi wɔ popɔn so fa yi mu biara so).
354	science/technology	Blade a ɛwɔ nnɛ mmerɛ yi mu ice skate so no wɔ ano abien na ɛwɔ concave hollow ne ntam. Ano abien yi ma kwan ma grasp of ice no tumi kɔ mu, sɛ mpo etumi keka no ho ‘ayɛ tilted’ a.
505	science/technology	Nnoɔma pa bi wɔ wɛbsaet yi ho, deɛ ɛko bi ne, sɛ woreyɛ klass peegyi a wommerɛ a deɛ ɛbɛka ho bi ne blogs, vidio ahodoɔ, mfoni ne nnoɔma nkaeɛ.
1333	science/technology	Ɛde satellite-based technology na edi dwuma na ɛnte sɛ ground-radar-based technology dada no na ɛma air traffic controllers no kwanma wɔkyerɛ wimhyɛn kwan yiye na wɔatumi ne pilot no adi nkitaho yiye.
1173	sports	South Africa ahyɛ All Black (New Zealand) wɔ rugby union Tri Nations match wɔ Royal Bafokeng Stadium ɛwɔ Rustenburg, South Africa.
945	travel	Vikings nam Russia nsu so na wokoduruu “Black Sea” ne “Caspian Sea” no so.
1012	sports	USA Gymnastics foa so sɛ nhwehwɛmuyɛfo a ɔgyina brane a ɔbɛma yɛahunu sɛnea ɔtitia ɔfa biara ɔnya so sɛnea wɔakyerem wɔ akokoɔduru so wɔ wɔn a wɔagyina Larry Nassa ano a na anka ɔbɛtumi afa ne ho adi a anka ɛnna adi bere tenten na wɔagye nsesae biara ɛho behia atom.
712	travel	Po so ahyɛn bɛboro 60 na ɛfa Galapagos nsu no so - a wotumi fa nnipa dodow fi 8 kosi 100.
1654	science/technology	Neama mu nsɛm mmienu a agye din paa no yɛ Maslow Hierarchy of Needs Theory ne Hertzberg Two Factor Theory no.
76	politics	"Ɔsane sii n’asɛm a ɔkae kan no so dua sɛ Roe v. Wade na ɔyɛ ""settled law of the land"", a wɔsii so dua sɛ ɛho hia atɛn a Asɛnnibea kunini no bɛbua no esisi so."
637	science/technology	Mfe anan akyi no wɔde ɛho tumi mae, ɛno na na ɛyɛ wiase nyinaa tumi a edi kan a wɔde mae wɔ MRI adwumayɛ ho.
1694	geography	Africafo Apuefam Nsupɔ no wɔ Indiafo pokɛse a ɛwɔ Africa apuefam mpoano no.
1559	travel	Ɔkwan a edi kan a na wɔfa so twe nnosoa yɛ nante, nnipa fii ase nante kyerebenn so mfe ɔpepem abien a atwam no wɔ Homo Erectus ( ɛkyerɛ nipa a ɔgyina kyerebenn so).
679	geography	Victoria Falls yɛ kuro a ɛwɔ Zimbabwe atɔefam, ɛtwa ɔhye no firi Livingstone, Zambia, ne ɛbɛn Bostwana.
1049	politics	Amannebɔ no de adesrɛ na efi ase sɛ ɔma dibeeti ho kwan na wɔnya nteaseɛ wɔ Uinited States a ɛfa Middle East nhyehyɛe ho.
557	science/technology	Bohr nhwɛso a asete nyɛ den no kyerɛ sɛ, ɛyɛ ade a ne ntease yɛ den, a ɛwɔ nucleus mfinfini a elentron pii twa ho hyia, biribi te sɛ sɛnea akyinsroma no twa owia no ho no - hwɛ mfonini 1.1.
194	sports	Brazilni yi piraa wɔ ne tiri ho bere a ɔkɔ pemm wɔ 2009 Hungarian Grand Prix no mu.
1103	science/technology	Sɛ wɔto hama hu sɛnea tupae no sɛe nneɛma wiei a, wɔde bɛgu abɛɛfo ahoma ntentan so.
1009	health	Wɔ PALM sɔhwɛ mu no, ZMapp tumi bɔ ban, kyerɛ sɛ abɔdemu nyansapɛfo de dii dwuma sɛ nnyinasode na wɔde ayaresa abiɛsa nkae no totoo ho.
20	politics	Hsieh kyerɛ sɛ abato no mu no Ma guan ɔman no bere a ɔhaw no bae no.
1700	travel	Mmea: wɔhyɛ nkuran sɛ ɔbea biara a ɔretu kwan no bɛka sɛ w’aware, ɛmfa ho sɛ w'aware anaa ɔnware yɛ no.
1673	science/technology	Abɛefo neama a anya nkɔanim no ma yɛn kwan ma yɛtumi hu na yɛtumi hwehwɛ adwene no yɛbea ne ɔkwan a ɛfaso yɛ adwuma mu wɔ ɔkwan a yɛnhuu bi da so.
911	science/technology	Esiane sɛ wotumi kasa wɔ abɛɛfo kwantempɔn no so nti, ɛho mpo nhia sɛ wobɛkɔ akɔkasa wɔ ahamatorofo adwumakuw bi mu a ɛwɔ baabi a wote anaa baabi a wubetu kwan akɔ.
1813	travel	Wɔhwɛ kwan sɛ dwumadi no mu dodow no ara tekiti bo bɛyɛ ¥2,500 ne ¥130,000, nanso mpɛn pii no tekiti wobenya no bɛyɛ ¥7,000.
1052	politics	Mprempren mmarahyɛbaguani ne Argentine Ɔbaa a ɔdi kan Cristina Fernandez de Kirchner de gyina a ɔregyina sɛ ɔman panin too gua nnora anwummere wɔ La Plata, kuro a ɛyɛ kilomita 50 (maale 31) ɛde firi Buenos Aires.
1699	geography	Wɔ atififam no Sahel atwa ɔmantam no ho ahyia, ne anaafofam na atɔ am no Atlantic Ocean no.
290	geography	Ↄfese a ɛhwɛ Iceland kurow no wim nsakrae so no abↄ amanneɛ sɛ asasewosow biara ensii wↄ Hekla mpↄtam hↄ nnↄnhere 48 a atwam yi.
1567	politics	John Nixon na ɔkenkan nhoma no bere a adi kan maa amansan no wɔ Independence Hall no adio hɔ wɔ Kitawonsa 8.
1638	science/technology	Biribiara a ɛwɔ Wiae no mu no neama na ɛka bɔ mu yɛ ade no. Ade biara mu no neama nketenkete bi a wɔferɛ wɔn atɔm na ɛwɔ mu.
590	science/technology	Nanso, sɛ eyi besi mpo a ɛnde ɛbɛkyɛ paa ansa na esi. Nsroma no ntam atete wɔ soro hɔ ma akwansin apepepepem na ɛwɔ nsoroma a wɔyɛ ‘afipamfo’ ntam.
1610	travel	Sɛnea Trafik Sen yɛ ankorankoro ahyɛnkafo ahokeka ne ahyɛn a ɛwɔ sibeae mmienu mfinfini ne nkutahodi a wɔne wɔn ho wɔn ho nya ho adesua.
691	travel	Nsrahwɛ kɔ bea hɔ no wobetumi de ɔkoro so akwantu aka ho a ɔhaw biara mma.
1120	health	Truck drɔba a na wadi mfe 64, ne ho anka wɔ akwanhyia no mu.
1619	science/technology	Mfe apem a atwam no, papa bi wɔferɛ no Aristarchus kae se Okyinsoroma no twa owia no ho hyia.
839	entertainment	Esaine sɛnea nkuro no wowɔ akyi nti, gye sɛ wo tu kwan kɔ Albuquerque anaa Santa Fe sɛ wopɛ sɛ wonya anigyede a etumi tua mu kosi anɔpa bi a.
829	travel	Abammɔfo gyinabea ahorow taa yɛ beae a wobedi kan agyina bere a woasi afi wimhyɛn, po so hyɛn, anaa kaa foforo mu no.
1591	science/technology	Wɔgyee Aristotle adwenkyerɛ wɔ abɔde mu nyansapɛ ho no too mu, na nnipa adwene ho adesua ka ho.
1821	science/technology	Mmoa no betumi asɛe aduane, ama wo ho akeka wo, anaa nea ɛsen nyinaa no ebetumi abɔ wo yare, ɛma ɛbrɔ trɛ, anaasɛ ɛma yare sane.
1271	sports	Deɛ edi kan ne Slalom a Wɔantumi anwie ne mmikatu a edi kan no . Akansifo 116 no mu 36 na wɔnyaa ade korɔ wɔ akansi no mu.
1355	science/technology	Ama yɛanya keteke, kaa ne akwantu ho nnwinade afoforo pii.
376	science/technology	Gyaframa no bɛyɛ hahaaha bere a wofi Awia no mfimfin kɔ akyikyi.
1040	science/technology	Ne mmirika a ɛyɛ 802.11n yɛ deɛ ɛho yɛ hare sene deɛ edii anim no a ne maximum theoretical throughput ɛyɛ 600Mbit/s.
580	science/technology	Saa nkate a apia fa nipadua mu no betumi de ntɛmpɛ aterɛw afa nipadua no mu na ɛboa bɔ nipadua no ho ban firi mpo bi a ebetumi aba mu no ho.
1028	science/technology	Sɛnea ntakra no si teɛ no kyerɛ sɛ wɔamfa anni dwuma wɔ hyɛn mu na mmom ne hyɛe anaa nwunu nhyehyɛe mu anaa ne kyerɛ mu. Nhwehwɛmufoɔ yi susuu sɛ, ɛwom sɛ wei yɛ dinasour a ɔsua no tua de, ɛkyerɛ n’atabu na ɛnyɛ chick's down.
1109	health	Wɔbɔɔ yare no amannebɔ sa bere yi mu wɔ Kitawonsa awiee.
401	science/technology	Submarines yɛ hyɛm a wɔahyɛ da ayɛ sɛ entu kwan wɔ nsu ase na ɛkɔ so tena bere tenten bi mu.
70	entertainment	Adwumakuo a wɔn na wɔhwɛ band no ntotoe soɔ no, HK Management Inc., amfa sɛ nti a wɔtwaa mu no anto gua wɔ Ɛbɔ 20, na mmom wɔde nnwinade da edi hɔ no.
576	science/technology	"Dɛn ade ne nkwanmmoa? Asɛmfua nkwanmmoa firi Latin asɛmfua ""cella"" mu, a ɛkyerɛ ""dan ketewa"" na wɔdii kan nya firii nsati a wɔde hyɛɛ afiri a wɔde hwɛ neama nketewa paa no ase no."
1787	travel	Akwantu ananmusifo no wɔ nhyehyɛe ahorow bi a anɔpa aduane, kaa a wode bedi akɔneaba wɔ wimhyɛn gyinabea hɔ ka ho anaa mpo wimhyɛn a wobɛfa ne ahɔhogyebea ho nhyehyɛe a ahorow nyinaa a w’aka abom ka ho.
1788	travel	Wɔbetumi akora beae no so ama wo sɛ wohia bere a wode bɛdwen nhyehyɛe a wɔde rema wo no ho anaasɛ wonsa bɛka beae a worekɔ no ho nkrataa ahorow bi a. (e.g. visa).
887	travel	Ɛhɔ nsrahwɛ kɔ boɔ yɛ den, ɛhia ahoɔden, na wɔbɛtumi akɔ hɔ wɔ ahohuru bere no mu ɛfiri Obubuo-Ogyefuo, na deɛ ɛtaa yɛ Peninsula, Asaasetam ne Ross Po.
1065	politics	U.S. manpanin George W. Bush bɛpuee mu wɔ Singapore wɔ Obudu 16, na ɛyɛ nnawɔtwe a na ɔrebɛdi wɔ Asia no ahyɛase.
386	politics	Na Ɔhene Sejong ne ɔhen a ɔtɔ so wɔ Joseon Dynasty na ɔyɛ obi na wɔbu no paa.
1749	sports	Ɛtɔ da a, wobehu akansie nketewa a wosi wɔ afe no mu.
1857	travel	Saa pɛpɛɛpɛ nso na, sɛ wowɔ Schengen visa no a, ɛho renhia sɛ woyɛ visa ho nhyehyeɛ ahorow ma kurow biara a ɛwɔ Schengen mpɔtam no mu no, na ɛno boa ma wonya bere, sie sika, ne nkrataasɛm nso.
680	travel	Kuro no da nsu a ɛworow no nkyɛn pɛɛ, na wɔyɛ ade a ɛtwe adwene titiriw, nanso nsrahwɛbeae yi ma wɔn wɔhwɛ ade kwan ne adehwɛfo nyinaa na ɛma wɔn hokwan bebree sɛ wɔbɛtena hɔ akyɛ.
93	politics	Wei ne amannebɔ a edi kan no nhyia, a ɛka sɛ twa a wɔbɛtwa runoff no tia ɔman no mmara.
1906	science/technology	Mmea a ɛwɔ akyiri no de, sɛ wunni ahamatorofo a, ɛnde ahamatorofo a yɛasi abɛɛfo kwantempɔn dua ama no na wubetumi de adi dwuma.
1423	politics	1895 mu no, ɛwɔ Sino-Japanese a edi kan no akyi (1894-1895), Qing aban no de ne nsa hyɛɛ Shimonoseki apam ase, na ɛma tumi no bɛkyɛn Taiwan wɔ Japan so a edii island kɔsii 1945.
1361	science/technology	Mmea no ne wɔn ho wɔn ho bɔ abusua., wɔtumi yɛ abusua biako mu fo a wɔyɛ anuanom mmea ne mma mmea.
1230	entertainment	Afei, Lakkha Singh dii nkan wɔ bhajans a ɔde ne nsa hyɛɛ ase.
1085	science/technology	Adwuma no mprɛ pii na ɛyɛ theoretical, nanso wɔkyerɛw dwumadi sɛnea ɛbɛsimulate observation a wɔde Sagittarius galaxy na ayɛ.
1376	science/technology	Afifide yɛ wɔn aduane firi owia denam photosynthesis so. Afei wɔma nwunu.
141	sports	Wukuada United States National Basketball Association (NBA) no twee akansie no sesɛnn esiane COVID-19 nti.
1930	travel	Sɛ wobenya adefo afa anaa aguadifo afa atena wↄ wiemhyɛn mu a, gye sɛ wotua sika pii, (anaasɛ, wo ma w'adwumakuo tua ma wo).
1514	science/technology	Intanɛte no ka amansan ne ankorankora nkitahodi ho nnoɔma bobom.
783	science/technology	Wohia kamɛra soronko bi a wɔde twa wuram mmoa ne afifide mfonin, ɛwom sɛ biribi te sɛ nnomaa a ɛretu abom anaa aboa ketewaa bi hia kamɛra foforo de.
394	politics	Nanso na Royal Navy no ho yɛ den sene German navy no (“Kriegsmarine”) na anka wɔbɛtumi asɛe invasion fleet a akɔ Borɔfo Channel no.
752	travel	Ne tiatwa mu no, sɛ wode w’ankasa wo kaa no yɛ ɔkwan pa a wobetumi afa so de atu saa kwan yi nanso ɛtɔ mmere bi a eno ara nso yɛ ɔkwan a wɔfa so “soeɛ wɔ abɔnten”.
867	travel	Akwantufo a wogyina pintinn na wɔn ho yɛ den mpo ama akwantu wɔ wiase a ɛrenya nkoanim yi mu anya so tumi, bere a amammerɛ mu nsakrae kakraa bi na ehia.
1647	geography	Abotan ne mfutuma na ɛwɔ ɔsram no ani. Wɔferɛ ɔsram no ho sɛ crust.
1166	entertainment	Siteehyin no wɛbsaet kyerɛkyerɛ dwumadi no mu sɛ “ sɛ old sukuu radio theater a geeky spin foforo a na ɛyɛ nwonwa.
1882	politics	Ɔpɛ a amanɔne aban ahorow no wɔ sɛ wobedi saa nkrataa yi so no nso gu ahorow saa ara.
299	politics	Kasamu a ɛtɔ so abien a annyina, a ɛkasa tia bra wɔbra bɔbeasu-korɔ nna civil unio, ho nsɛm bɛsɔre daakye bi.
1582	health	Wɔ United States of America nyinaa no, Multiple Sclerosis (MS) ho nsɛm a wɔnim wɔ hɔ no bɛyɛ 400,000, ɛno ma no bɛyɛ adwenem yare a edi kan wɔ mmofra mu ne wɔn a wɔwɔ wɔn mmpanyinmfe so.
1568	politics	Wɔde kiako kɔ maa George Washington wɔ Kitawonsa 6, na ɔma wɔn kenkan kyerɛɛ ne asraafodom no wɔ New York wɔ Kitawonsa 9. Ne sɛso duu London Ɔsanaa 10.
1027	science/technology	Esiane sɛ dinosaur ntakra nni shaft a anyini awie, a yɛfrɛ no rachis, nanso enni ntakra nnoɔma nkae — barbɔ ne barbules — nhwehwɛmufo kaa sɛ rachis no baa akyire yi wɔ nnoɔma nkae no ho.
377	science/technology	"Deɛ a ɛwɔ abɔntene a yɛhunu sɛ wohwɛ Awia yɛfrɛ no fotosphere, a ԑkyerԑ ""Kanea Bɔɔl""."
759	travel	Ahɔhoyɛ nsesae kuw no yɛ kuw bi a wɔka akwantufo ne kuro a wɔrekɔ hɔ nsrahwɛ no mufo bom.
1088	science/technology	Nyansahunufo no tumi de too gua sɛ dark mata no ɛka dark mata afoforo wɔ kwan koro no ara so te sɛ nea rɛgula mata no yɛ no.
959	travel	Mmom, wuyi popɔn so fa a efi “South Pacific” a ɛwɔ “Santiago de Chile” de kosi “Tahiti” a ɛyɛ “LATAM Oneworld” wimhyɛn no to nkyɛn a, “Star Alliance” wɔ tumi wɔ nkae no nyinaa so.
1128	health	Ɔde saa asɛm yi too gua bere a ne nsa kaa amannebɔ firii mmea ne mmarima hɔ sɛ aduru a wɔde si nyinsɛn ano yɛ aduru bi a ɛho hia yiye paa.
368	science/technology	Triceratops se bɛtumi abɔ ade mu na ɛnyɛ nhaban nko mpo mman a ne nhini a emu yɛ den mpo.
1612	travel	Nea ne ka ye mu no, ahyɛnkafo da suban bi a ɛwɔ anohwete bi a esisi so adi; ne saa nti, trafik akwan sɛn wɔ ɔkwan a ntease wɔm mu na wobetumi akyerɛw ho asɛm wɔ nkontahyɛde mu.
635	science/technology	Wɔ saa resonance yi mu no,baabi a twebo wɔ ne akasafidie ho mframa ma atɔm de akasafidie ho adafitwa sɛnkyerɛne nketenkete ma.
861	health	Wɔ baabi a wofi no, esaine sɛ mmoawa a wɔma yare wɔ hɔ no akɔ wo nnipaduam nti, ɛbɛyɛ den sɛ wobenya.
700	travel	Wɔn asiesie saa ahwehwɛde yi sɛnea ɛbɛyɛ a ɛbɛ ma wɔn asraafo akɔ ne aba a nhyehyɛe da ho wɔ aman abien no ntam.
278	politics	U.S. Kasamafo dada a na ɔwɔ Newt Gingrich tɔɔ so abien na ɔnyaa ɔha nkyekyɛmu 32.
1326	science/technology	Nnipa pii na wɔnam hardware ne software ahorow so asɔ wei ahwɛ wɔ Ogyefuo mfiase na wɔde too gua Benada no,
116	science/technology	Nyansahunufoɔ asusu sɛ Enceladus ɛyɛ geologically active na ɛyɛ baabi a Saturn's icy E ring firi.
1034	science/technology	Wɔde luminosity no ne ntwaho no di dwuma de kyere nsroma Rossby nɔma, a ɛfa sɛnea plasma no ɛtene no ho.
450	geography	Serengeti mantam no wɔ Serengeti Ɔman mu Paake, Ngorongoro Bea a Wɔakora so ne Maswa Wurammmoa Atenae a Wɔagya ɛwɔ Tanzania ne Maasai Mara Ɔman mu Beae bi a Wɔagya ato hɔ a ɛwɔ Kenya
1019	entertainment	Nkae a wɔbɔɔ wɔn din no bi yɛ Mfonin a ɛyɛ pa ara, Kwankyerɛfo, Sinimatografi, Afade yɛ, Sini-asiesie, Ɔregyenaa Sokɔɔ, Proahyen Design, Nnyegyeeɛ Asiesie, Sɛnea ɔde Nnyegyeeɛ no Frafra ne ɔregyinaa Sikireeplee.
26	sports	n’atena ɛtɔ so abien wɔ anadwo no mu yɛ ne deɛ a ɛtɔ so 60 saa bere no mu, na ɔbɛyɛɛ pleya a ɔdi kan koraa wahyɛ mprɛ 60 anaa atena a ɛdɔɔ so wɔ bere no mu firi afe 1995-96, bere a Jaromir Jagr ne Mario Lemieux a wɔ mu biara tumi yɛɛ saa ade yi bie.
1292	sports	NPSWS ne Sporting Nkabomku a ɛwɔ Australia (NSW) Inc kaa wɔn ho boom na wɔfaa atuhomafo, wɔ Sporting Shooters Association's hunting dwumadi mu.
1795	travel	Saint Petersburg po so hyɛn no ma nkurɔfo tumi di mmere wɔ kuro no mu.Wɔnhwehwɛ visa ahwehwɛde ahorow biara mfi wɔn a wɔfa po so hyɛn no hɔ (hwɛ ɛho nhyehyɛe ahorow).
939	travel	Hwɛ sɛ wowɔ nneɛma a wopɛ sɛ wode ba anaa nea wompɛ sɛ wode ba no ho nimdeɛ, na fa nea ɛboro nea ɛsɛ sɛ wofa no so no kyerɛ.
693	geography	Jerusalem yɛ Isreal ahenkuro ne kuro kɛse, ɛmfa ho sɛ aman afoforo ne Aman Nkabom no mmu no sɛ ɛyɛ Isreal ahenkuro.
778	science/technology	Wobetumi de foforo ahyɛ mu sɛ ɛsa a, na wode ato senea ɛsɛ sɛ ɛda a wobetumi de atoto nnɛyi DSLR ho.
1147	health	Medical charity Mangola no, Medecines Sans Frontieres ne Wiase Apomuden Ahyehyɛde no ka sɛ ɛyɛ biribi esen biara a asi wɔ ɔman no mu.
1263	politics	Kwankyerɛfo a ɔda Kwaadubɔ ano, Kier Starmer QC, de asɛm bi too gua a na ɛfa kwaadu a wɔrebɔ Huhne ne Pryce ho.
1847	sports	Ski a wɔde hyɛ nan ase sane fa sukyerɛma so no yɛ dwumadi a nnipa bebree ani gye ho nawotu kwan kodi, etɔ da wɔfrɛ no “ski bums”, wɔn akwantu no nyinaa gyina baabi pɔtee a wɔbedi saa agodi no.
994	travel	Wimhyɛn nnwumakuw kakraa bi na wogu so ma owu ho sikatua ho kwan a ɛyɛ ntewso ma sika a ɛsɛ sɛ wutua no ɔkwan a wubetu akɔyɛ ayi a etwa to no.
927	science/technology	Sɛ wode afiri a ɛfa wim twa sini wɔ wimhyɛn gyinabea anaa wɔ amanfo ti so no nyɛ ade pa, mpo sɛ ɛyɛ ade pa wɔ wo mpɔtam a.
811	sports	Hiking yɛ dwumadi a wɔyɛ wɔ abɔnten a wɔnantew fa nwuram, mpɛn pii no wɔ akwan a wɔapaepae ato hɔ sɛ wɔnantew so no.
285	politics	Latvia ne Slovakia atwetwɛn nhyehye a wɔde dɔm ACTA.
1342	science/technology	Cabbage juice ahosuo no sesa na egyina sɛnea sɛde ɛ acidicanaasɛ basic (alkaline) kɛmikaa no siteɛ so.
1800	travel	Wɔ nsukyene ne sukyerɛma kwan ahorow so no, ɛso tumi yɛ torotoro na worentumi nka kaa te sɛ nea wonam asphalt kwan so.
1297	politics	Nabaguaku no yɛ Martelly anoyi ɛma wɔn a wɔretiaa no a ɛfirii ase Ahinem mu no.
1048	politics	Ɛbɔɔ kɔkɔ sɛ obiara ntumi nsi sectarian ako a ɛrekɔ so wɔ Iraq saa bere wei mu no, basabasayɛ a ɛrenya nkɔanim anaasɛ ɛkɔ basabasayɛ so.
547	politics	Asraafokuw no mu titiriw a mmerima 2,400 wɔ mu no betwa asubɔntene no akɔ akwansin akrɔn wɔ Trenton atififam, na afei wɔbɛkyɛ wɔn mu mmienu na kuw biako bɛwɔ Greene ase na biako nso awɔ Sullivan ase, sɛnea ɛbɛyɛ a wɔbɛ tow ahyɛ wɔn so ahemadakye.
1127	health	Fluke kyerɛɛw sɛ mmɔden a ebinom bɔe sɛ wɔbɛma mmea akasa a ɛfa mmea apomudenno anyɛ yiye.
