index_id	category	text
120	entertainment	ACMA no nso ahunu sɛ ɛmfa ho sɛ vidio no nenam ntanɛte so no, Big Brother mmuu nneɛma ɔde guu ɔnlaan wɔ censorship mmara esiane sɛ wɔmfa nguu Big Brother wɛbsaet no so.
1113	health	Nhyehyɛe a wɔyɛɛ sɛ wɔde nnuro bɛkɔ mmeae atu atese no twetwɛnn kakra esiane sikasɛm nti ne yare no a wɔamma ɛho anhia wɔn paa kɛse te sɛ yare nkae no nti.
1442	politics	Nanso kwan a wɔfaa so yi pii no ammua, Germany hwɛɛ kwan koro a ɛte saa anim wɔ submarine a ɛwɔ akono a na wɔasiɛw no kwa no ho.
830	travel	Wɔyɛ keteke a efi ɔman foforo so kɔ ɔman foforo so no mu binom nhwehwɛmu bere a etu nam kwan so no na ɛsɛ sɛ wowɔ ID a edi mu wɔ wo ho bere a worekɔforo saa keteke no mu baako no.
1824	travel	Akwantufo a wɔrekɔ aman ahorow a wɔgye tow akɛse so no betumi akora wɔn sika dodow bi so, ne titiriw wɔ nneɛma bi te sɛ anonne a nsa wom ne tawa.
1533	health	Deɛ ɛka Biorhythm-based ɔphyen nkae ho ne sɛ wobɛnom fluid pii ( titire nsu anaasɛ tea, ne diuretic a wonim) ansa na woada no ma obi sɔresɔre kɔdwonsɔ.
1982	entertainment	Efi mfe ɔha a ɛto so 8 no, Hanami abɛyɛ Japan amammere no mu biako.
657	health	Kyɛ a wobɛkyɛ wɔ ɔhyew mmere mu no betumi ama wo nna ho aba asɛm na woanya apɔmuden mu haw so.
948	travel	Hu no sɛ wunya duru nsu no ano a suhyɛn nketewa no sisi no a, wubehu biribiara mu fann. Wubehyia nnipa a wɔn nso foro suhyɛn nketewa no bi ama wɔaka wɔn nsɛm akyerɛ wo.
1892	travel	Sɛ wofi aburokyire ba fie a, amammerɛ foforo a woasua no ka wo hↄ na wo werɛ fi w’ankasa de no bi.
1707	travel	Casablanca yɛ mmeae a ɛhɔ nhyɛ da nnyɛ anika sɛ wobedi dwa wɔ no mu biako wɔ Morocco.
1729	geography	Sundarbans no yɛ littoral mangrove abɔso a ɛso paa wɔ wiase, ɛtene 80 km (50 mi) kɔ Bangladeshifo ne Indiafo asase a efiri mpoano no ano.
1574	science/technology	Ɛbɛyɛ sɛ kɔmputa a yɛde yɛ adwuma wɔ nnɛ bere yi mu no nyinaa gyina nsɛm a wɔdanedane mu a wɔn ayɛ no tesɛ binary akontahyɛde so.
692	travel	Angnkor Pass no hia sɛ wobetumi awura asɔredan no mu a ɛno nti mma wowerɛ mfi sɛ wode wo akwantu ho nkrataa bɛka wo ho sɛ worekɔ Tonle Sap a.
1155	geography	"Abodan no ano nyinaa, wɔtoo din "" Nuammaanom Nson No"", kɛseɛ yɛ mita 100 kɔsi 250 (fiit 328 kɔsi 820) wɔ trɛ mu."
1810	sports	Tokyo bɛyɛ Asia kuro baako pɛ a wɔayɛ ɔhyew bere mu Olympics mmienu, bere a ɔyɛɛ agodi yi wɔ 1964 mu no.
64	politics	Bill a edi kan no ɔsoafo a ɛwɔ São Paulo, Marta Suplicy na ɔyɛe. Saa mmara a wɔayɛ mu nsakrae no, seesei ɛwɔ Roberto Jefferson. nsam.
1330	politics	"Ɔka faa huhunu no sɛ ɛyɛ ""ɛyɛ amammansɛm mu nsɛm a ɛsɛ wɔbɔ to gu baabi na ntease nnim”."
1448	politics	Afei nso wɔ dynasty ntam biara no yɛ amantam ahorow a wɔkyekyɛm a ennyina faako. Mmere a agye din a wɔnim yɛ Aheman Abiɛsa epock kɔɔ so mfe 60 wɔ Han ne Jin Dynasty ntam.
636	science/technology	Wɔ afe 1970 mu no, Raymond Damadian, a ɔyɛ oduruyɛfo ne nhwehwɛmu ho nyansapɛfo, huu nea enti a wɔde twebo ho dede ho mfonini yɛ adwinade a wɔde yɛ nyarewa mu nhwehwɛmu.
1677	science/technology	Ɛho nhwɛso no bi yɛ ɛso di, ɛho atrimubɔ ne ɛho nhyehyɛe, sɛ wobetumi ayi adetɔfoɔ nhwhwɛmu ne wɔn nsɛmbisa ano, ne sɛ wobɛhyɛ wɔn nsa ano akyerɛw, wɔn nne ne wɔn anim nso.
1398	entertainment	Sɛ woahwɛ sini a ɛne National Treasure a, wobɛdwne sɛ wɔtwerɛɛ treasure maapo no wɔ Faahodie Mpaemuka no akyi.
1605	travel	Wɔ ahyɛn a edi akɔ ne aba mu no ɔkwan bi so no obiara ne nnosotwe adwuayɛbeae bi wɔ nkitahodi, na wɔboa wɔn agyina ahyɛn a ɛnyɛ ɔman no de so.
982	travel	Mpo sɛ wonam nhimahobea pɔw mu a, anitɛtɛ bere kumaa bi a wubebue wo hyɛn awura mu no tumi ma ntontom ho kwan ma wowura hyɛn no mu.
366	science/technology	Akwaa titire a ɛwɔ circuatory sistɛm mu ne akoma no, a ɛno ɛpɔpe mmogya no.
1651	science/technology	Wɔyɛ neama mu nsɛm de hwehwɛ neama a ɛkanyan anaa ɛsɔ nkurɔfo ani.
941	science/technology	Sɛ wunya nimdeɛ fa ɔkwan a wɔfa so di dwuma ahorow wɔ ntentanfiri no so wie a, w’ankasa betumi abue wo ntentanfiri.
876	health	Wɔn a wonnim nsɛmfua a wɔde di dwuma wɔ ayarehwɛ adwuma no mu no, asɛmfua nsaneyare no gu mu ahorow.
661	entertainment	Sɛnea ɛda ne ho adi wɔ nnwom mu, sini mu, kasadwini ne amammerɛ a agye din no aboa ma wɔm ahu kuro no ne n’asase so ahyɛnsode wɔ wiase nyinaa.
1112	health	Aban no ahyɛ encephalitis a ɛwowɔ ntoa nkumaa bi mu ho bɔ , a ɛbɛboa ama wɔaboaboa apomuden asoe no ano ama afeda.
1329	politics	Cuomo, 53 firii n’amammuo ase afe yi mfiase na ɔde ne nsa hyɛɛ mmara ɛma nnipa wɔn bɔbease yɛ pɛ tumi ware ase.
1053	politics	Owurayere Kirchner de n’adwene a wayɛ sɛ ɔbɛgyina sɛ ɔmanpanin no too gua wɔ Argentine Theatre, baabi korɔ no ara ɔfirii ne mmarahyɛ bagua ntoabɔ no ase afe 2005 sɛ obi ɔka Buenos Aires mansin delegation no ho.
1948	travel	Yɛsrɛ wo, hyɛ no nso sɛ worekɔ beae a wosie nnipa pii no ara, na san nso hu no sɛ saa beae yi yɛ beae a wiase afanan nnipa mu fa kɛse a yentumi nkan wɔn na yɛasie wɔn wɔ hɔ.
923	science/technology	Sɛ wubenya kwan de eyinom biara adi dwuma no gyina ahamatorofo a wode di dwuma a wuntua sika na obiara betumi afrɛ afa so no so.
173	science/technology	Edenam seabed mapping so no wɔhunuu deɛ asɛe no denam ROV a wɔde dii dwuma so.
1087	science/technology	Te sɛ nea bosome de ahoɔden ba asase so, na ɛkɔ tides ba, saa ara na Milky way de ahoɔden ba Sagittarius galaxy no so.
1328	science/technology	Nyasahunufo pɛsɛ wɔde sɛdeɛ okyinsromma a fɔɔme, ne titire sɛnea Asase ɛfɔɔme, esiane sɛ comets ne Asase di ahyia bere ten atwam.
914	science/technology	“Real-Time apps” yɛ kɔmputa anaa ahamatorofo mu akade no mu bi a ɛkyerɛ nsɛm ase fi kasa bi mu kɔ kasa foforo mu.
1341	science/technology	Wei na yɛfrɛ no chemical's pH no. Wobɛtumi ayɛ ndiketa bere a wode cabbage juice kɔkɔɔ reyɛ adwuma.
336	entertainment	Awiee no,Turkey asa ku Fire of Anatolia bɛdii agoru a ɛno ne “Troy”.
1005	entertainment	2017 afe no awiee no, Siminoff kɔpuee adwadie kasamfonin QVC so.
1671	science/technology	Ayɔnkofa a ɛda adwene ho yare ho adesua ne suban mu no boa abɔde mu nyansapɛfo wɔ wɔn nhwehwɛm mu.
1597	science/technology	Hershey ne Chase de phages, anaa mmoawammoawa, tɛu wɔn ankasa DNA mu ma no bɛyɛɛ aboawa ketewa a ɛde yare ba.
1008	health	Aduru biako a ɛkotia kɔktee,ZMapp, mfiase no ɛmaa wɔnyaa anidaso, nanso nhwehwɛmu ada no adi sɛ ɛntumi nsi owuo ano.
1313	health	Bere a ɔgu yɛ adwuma wɔ ayaresabe ahɔ no, ɔde bere a ɔregye n’ahome no yɛ mmaa wɔn awo bere nso na awo aka wɔn mu nhwehwɛmu.
665	travel	"Ewiemuhyɛn mu tena d ewura Orlando Amanaman Wimhyɛn gyinabeae mu, Disney ahɔhodan a enni adagye, wo bedi bɛyɛ nnawɔtwe a woremmfi Disney agyapade, ne sɛ wosan w'akyi kɔ fie no ka nsrahwɛ ""ankasa"" ho."
242	geography	Sɛ kura a lunar probe kura nyansahunu nwinade atitire abiɛsa no da nkyɛn a, lunar probe no kura India Ɔmanmu no frankaa a wɔapeeiti n’afa ahorow no nyinaa.
383	politics	Olaf Trygvasson na ɔdii dɔm yi anim, na ɔyɛ Norweni a na wawe ahinam so sɛ ɔbɛgye ne man a Danishfoɔ agye abɔ so no afiri wɔn nsam.
954	travel	Afe 2014 mu no, na “Turkish Airlines” no yɛ adwuma kɔ mmeae 39 wɔ Abibiman nkurow 30 so.
979	travel	Saa nneɛma yi betumi ayɛ ɔhaw ama ɔkwantuni bi a obehu no sɛ kumaforote, efisɛ obetumi asɛe n’ahoɔden ne nsu a aka no wɔ ho.
217	sports	Ɛsɛ sɛ IOC no kɔ so ara gye abato tum wɔ wɔn Ahineme nhyiam wɔ Copenhagen mu no ase.
1036	travel	Akwantu no bi mu no, Iwasaki nyaa asɛm mpɛn pii.
1583	health	MS yɛ yare a ɛka nkate a ɛwɔ nipadua mu a ɛkanyan no ma ɛyɛ adwuma pɛpɛɛpɛ no, a adwene no, akyire dompe no ne aniwa no ntini na ɛbom yɛ.
1063	sports	Middle order batsmen, Sachin Tendulkar ne Rahul Dravid, dii agoru yiye na wɔdii nkonim bɔɔ mu.
458	science/technology	Wei ma ɛye den sɛ zoom lɛnses a ne bo nyɛ den a wode bɛdi dwuma wɔ baabi nkanea nni a flash nni no yɛ den.
831	travel	Wɔ keteke a wɔda wɔ so no, onii a ɔgyegye sika wɔ so no betumi agye mo paspɔt sɛnea ɛbɛyɛ a ɔnsɛe mo nna no.
220	sports	Ɛmfa ne nsɛm a ɔkae sɛ ɔbɛboa Bristish akansifo wɔ 2012 olympics a ɛbɛkɔ so wɔ London.
1119	health	Akwanhyia no akyi no,wɔde Gibson kɔɔ ayaresabea nanso ɛno akyi ankyɛ koraa na ɔwui.
1650	geography	Ebia meae a ɛyɛ tum pii bɛwɔ beaɛ a ɛbɛn no esiane sɛ asase a ani yɛ abotan no yɛ tea nti. Na ɛyɛ merɛw ma ogyabepɔ mu ade a atu go no sɛ ɛbɛba atifi.
813	sports	Da mu nantew a wɔfa kwan a ɛso nyɛ den no nhia ahosiesie pii, na obi a ɔwɔ ahoɔden kakra biara mpo betumi ayɛ.
1353	science/technology	Ɛgye rocket a ɛso paa bɛboro fiit 100 na satelite anaasɛ telescope akɔsɛn wim.
925	science/technology	Sɛ wɔmma ho kwan sɛ wubetwa biribi mfoni a, ɛnde to w’adwene mu wɔ sɛ wubetwa dekode no sini.
1164	science/technology	Ɛnkyɛɛe na ASUS Eee PC, daa world-wide ɛma cost-saving ne functionality faktɛs, bɛyɛɛ asɛmti kɛse paa wɔ 2007 Tapei IT Bosome.
273	health	Ɛha adwene wɔn a wɔnya bi no bɛtrɛ yare no mu sɛ ɛda yare no nsusuanso no anna adi ntɛm a.
947	geography	“Lake Onega” nso ne “Volga” ka bom, enti sɛ ebefi “Caspian Sea” wɔ bere a ɔnam “Russia” no nso tumi yɛ ye.
1191	politics	Bachmann a ɔdii nkunim wɔ Ames Straw Abato no mu wɔ Ɔsana asi gyinae sɛ ɔde ntoabɔ no bɛba awiee.
1070	politics	Ɛfiti bere a Aban no baa mu sɛ ɔrefa Mersey ayaresabea a ɛwɔ Devonport, Tasmania,siteeti aban no ne ɔman no mu MPfoɔ binom akasa atia saa ade yi ɛrekɔ ɔman no abato bere no mu a wɔbɛto no Obubuo mu no.
497	health	Wɔbɛyɛɛ akunini wɔ twa wɔtwa obi akwaa bi fi hɔ no ho na abɔ nnipa no ho ban afi honam abɔre ho ne afiri wɔdde di dwuma ɛmma mogya nni afurusane ne ade wɔde di dwuma a ɛmma mogya na nkɔ mu.
1914	travel	Finland yɛ beae soronko bi a, hyɛmma kɔ edi pa ara. Beae a “ Atadeɛ pii wowɔ” na ɛwowɔ anweatam pii nso, ɛwɔ atadeɛ no mu ɛwɔ archipelago mpoano.
360	science/technology	Mfoni a edi so no kyerɛ atoms aemitting photons. Ɛyɛ nokware sɛ photons susua sene deɛ ɛwowɔ mfoni yi mu no.
1549	politics	Wɔ saa bere no ara mu no, na German nsu su asraafo no, de U-boats titiriw, rebɔ moden sɛ wɔbɛma trafik no ayae.
186	travel	Bɔs no de n’ani kyerɛɛ Six Flags St. Louis wɔ Missouri sɛ ɛrekɔ fa band ama ɛbɛgoru ama nnipaku no.
598	science/technology	Robert Hooke, a ɔsua abɔde ho ade a ɔfiri England, no huu ahinanan nketewa wɔ ntuaano mu wɔ anwinade a wɔdehwɛ neama nketenkete ase.
163	travel	Avenger class mine countermeasures hyɛn, na hyɛn no nam kwan so rekɔ Puerto Princesa wɔ Palawan.
537	travel	Sɛ atrimpɔw a obi de kɔ sera beae bi ne sɛ ɔpɛ sɛ ohu beae no abakɔsɛm ne n’amammerɛ a ɛnde nsrahwɛ a ɛte saa no wɔferɛ no amammerɛ ho nsrahwɛ.
365	science/technology	Deɛ nti a ɛte saa ne sɛ anyinam ahoɔden wɔ sɔkɛt no mu baabi ɛyɛ dade no a bulb no wɔ no na ɛbɛtumi ahyɔɔko wo sɛ wo nsa kɔ wura sɔkɛte no mu anaasɛ dade no ase wɔ bulb no mu bere a kakra ɛhyɛ sɔkɛte no mu no.
918	science/technology	Sɛ wode “GPS” akade ahorow no mu biara wɔ w’ahamatorofo so no ma dwuma a woredi no yɛ mmerɛw ɛnna ɛsan nso ma wo ahotɔso wɔ bere a wunni wo man mu.
944	travel	Ɛsan nso yɛ ɔkwan pa a wubetumi afa so ayɛ wo sika ho ntotoe ama woatena hɔ akyɛ, efisɛ atuhoakyɛ nnwuma pii no ara ma wo ɔdan ne akatua kakra.
1856	travel	Bere dodow a wote mpɔtam hɔ no, wobetumi atwa ɛhye no a womfa beae a wɔyɛ paspɔt nhwehwɛmu ahorow no bio.
10	politics	Ɛbɛduruu 11:29, ɔyɛkyerɛ no kɔɔ soro kɔduruu Whiethall, twamm wɔ Trafalgar Square, ɛde rekɔ Strand, kɔfaa Aldwych ne Kingsway ɛde rekɔ Holborn baabi a na Conservative Kuo no reyɛ wɔn Spring Nhyiam no wɔ Grand Connaught ahɔhogyebea.
893	geography	Eyinom nkɔ ntɛm, ɛno nti ɛsɛ sɛ wofi kwan a wɔatwa ato hɔ no so kɔfa “Transantarctic Mountains” no ho de koduru asase no so.
282	politics	Asɔretia nso akɔ so wɔ Paris, Sofia a ɛwɔ Bulgaria, Vilnius a ɛwɔ Lithuania, Valetta a ɛwɔ Malta, Tallinn a ɛwɔ Estonia ne Edinburgh ne Glosgow a ɛwɔ Scotland.
1362	science/technology	Prides sebɔ yɛ wɔn ho sɛ mpataku anaasɛ nkraman, mmoa wɔsɛ sebɔ (nanso ɛnyɛ nkram nkae) wɔ suban na wɔn ho yɛ hu paa ma mmoa wɔkye wɔn we no.
530	sports	Golf yɛ agorɔ bi a wɔn a wɔbɔ no de aporibaa bɔ bɔɔlo kɔ hyɛ tokuro mu.
730	travel	Saa mpɔtam ɛda mu fua wɔ Howe Sound a ɛne Vancouver ntam nware na ɛnyɛ den sɛ wode kodoɔ a efi Granville supɔw no so wɔ Vancouver kuro no mu.
840	entertainment	Nanso, casino a wɔabobɔ din wɔ soro hɔ no mu dodow no ara ma nsa, na wɔn mu binom de anigyede a wɔn a wɔagye din ayɛ ( akɛse a na ɛwom a na etwa Albuquerque ne Santa Fe ho).
698	travel	Ecuador hwehwɛ sɛ Cuban manfo benya nsato krataa ansa na wɔn aba Ecuador denam amanaman ewimhyɛn gyinabea anaa kurotia akwannya beae.
1826	travel	Sɛ wontaa nka kaa wɔ kwan a wɔnyɛɛ so yiye so a, yɛ krado sɛ wobehyia :mmeae a esiane, akwan a esua ne beae a akoakoa a wobu no ntɛm pii.
339	health	Ntɛmpa no ara na nnuruyɛfo a wɔwɔ hɔ hwɛɛ no na wɔde no kɔɔ ayaresabea a ɛwɔ mpatam hɔ na akyi na ɔwuiɛ.
226	science/technology	Nim a wɔnim sɛ ɛwɔ hɔ no yɛ nkɛtɛnso a enya wɔ amansan yi trɛ mu nk ara.
24	sports	Ɔtoo ntena 2 na ɔboaa mprɛ 2 wɔ Washington nkunim a wɔdii wɔ Atlanta Thrashersso so no.
1117	entertainment	David Klöcker Ehrenstrahl wɔ 2000 ka sɛ ne setampo a ɛtɔ so 1,000 no yɛ fɛ “Adwuma sronn a ɛfiri Sweden Hene” na ɛwɔ Guinness Book of rɛkɔd a wɔyɛ Wiase nyinaa twerɛtohɔ wom no.
1792	entertainment	Kae sɛ ɛmfa ho sɛ nnwom a wɔbɔ wɔ agua no so no aba awiei no, afahyɛ ne fa ahorow no bɛkɔ so abɔ nnwom kosi anadwo dasuom.
674	travel	Hyɛn a wɔde wura Africa Anafofam yɛ anwanwa kwan a wode behu ɔmantam no ahoɔfɛ nyinaa ne afei nso sɛ wobɛkɔ mmeae a atwe ne ho afiri nsrahwɛ kwan a wɔnim no daa no so.
1098	health	XDR-TB ɔha nkyekyɛmu a ɛwɔ kuo no nyinaa mu no a wɔwɔ nsamanwa da so ara wɔ fam; nnipa 330,000 mu 6,000 na yare no aka wɔn bere bi mu wɔ South Africa.
892	travel	Ɛyɛ asukɔtwea a wɔahyehyɛ no akuwakuw a wɔde frankaa ahyehyɛ no nso. Gye sɛ lɔre akɛse yi bi a wɔahyɛ da atu asi hɔ na ɛtwe lɔre nkumaa a wɔde asukɔtwea akuwakuw yi agu mu yi.
380	science/technology	Afei, wɔ mfe bi akyi wɔ 1639, nsromamuhwɛni bi a ɔyɛ Englishni a yɛfrɛ no Jeremiah Horrocks hwɛɛ Venus transit no.
921	science/technology	Ahamatorofo kaade a wotua sika ansa na wɔanya kwan de adi dwuma a wobetumi nso de adi dwuma wɔ ahamatorofo a wotua sika tɔ no amonom anaa ahamatorofo biara so no abu so wɔ sotɔɔ a ɛhyehyɛ ntokuru mu.
65	politics	Wɔn a wɔreyuɛ ɔyɛkyerɛ pɛ sɛ wɔma nnipa bɛboro ɔpepem 1.2 dewɔn ns ahyɛ ase na wɔde kɔma National Kɔngrɛse wɔ Obubuo mu.
912	science/technology	Nhyehyɛe pɔtee biara nso nni hɔ a ɛsɛ sɛ wugyina so kotwa nɔma wɔ kurow a wote so no mu; wubetumi apɛ abɛɛfo kwantempɔn biara a ɛwɔ “Chicken”, “Alaska”, na woagyina so ayi nɔma a ɛkyerɛ sɛ wowɔ “Arizona”.
987	geography	Saa nsase yantam ahorow yi no, wɔfrɛ no “vidde” a nea ɛkyerɛ ne sɛ ɛyɛ asase a ɛyɛ tɛtrɛɛ, nnua nni so ɛnna biribiara nso ntwaa ho nhyiae.
819	travel	Sɛ wotu kwan a, nhwɛ kwan sɛ nneɛma bɛyɛ te sɛ “wo kurom” de. Ntetee, mmara, aduane, kaa ahorow, dabere, gyinapɛn ahorow, kasa ne nea ɛkeka ho no bɛyɛ soronko wɔ baabi a wote no.
798	travel	Fa wo nsiakyibaa ho nhyehyɛe/wɔn ho nsɛm a ɛbɛma wo nsa aka wɔn no ma nnamfo a wone wɔn retu kwan, abusuafo anaa nnamfo a wɔwɔ fie a wɔbɛpɛ sɛ wɔboa.
1035	science/technology	Sɛna Rossby no sua no, saa na nsroma no magnɛtek no a ɛsane kɔ ne nkyi no dwumadi wɔ fam.
1228	entertainment	Annwomtofo a wɔagye din a wɔwɔ ɔman no de bhajans anaasɛ nnwom a ɛyɛ nkuran ba maa Shri Shyam's feet.
1039	science/technology	Wei bɛma kwan ama asane akɔ akyi a ɛne 802.11a, hyia802.11b ne 802.11g,sɛ ɛkɔ ba sɛ base siteehyin no wɔ radio abien.
1375	science/technology	Afifide ma nnipa oxygen home, wɔn nso fa carbon-dioxide nnipa home gu no ( kyerɛ home a ɛba abɔnten).
772	entertainment	Wiase Aguabɔ (a wɔtaa frɛ no World Exposition, anaa Expo) yɛ afahyɛ kɛse a ɛfa nneɛma a yetumi de yɛn nsa yɛ ne abɔde mu nyansapɛ.
735	travel	Sirena nko ara ahomegyebea abammɔfo atenae a ɛma adan a wobɛda mu ne aduane a ɛyɛ hye ka beae a wobetumi asoeɛ wɔ abɔnten no ho. La Leona, San Pedrillo, ne Los Patos ma beae a wobetumi asoeɛ wɔ abɔnten a aduane nka ho.
1350	science/technology	Sɛ wofrɛ obi a ɔwɔ maale a ɛwɔ akyikyi baabi no, na wode satelite na ɛredi dwuma.
1419	geography	"Esiane island nkyekyɛmu/aku a Japan ɛwɔ nti, wɔtaa frɛ Japan a ɛwɔ geographical stance sɛ ""archipelago"""
1601	travel	Nsrahwɛ a agyina abɔde so no twetwe nnipa a wɔn ani gye ho sɛ wɔbɛ sera abɔde ho mmeae sɛnea ɛbɛyɛ a wobenya beae hɔ ho anigye, a nnua ne mmoa a wɔn ho yɛ hu ka ho.
1812	sports	Mmara a ɛwɔ twa a wotwa biribi mu no nyɛ pɛ, nanso wɔ Ɔbɛnem awiei no na ntwamu mmara a egyina coronavirus no ntrɛw nkosii Kitawonsa 2020, bere a na wɔahyehyɛ sɛ wɔbɛyɛ Olympics no.
270	sports	Ɛfiri saabere no Brazilni yi asi akan 53 na wato atena 24 wɔ akansi nyinaa a wasi no mu.
1920	travel	Eyi kyerɛ sɛ wubetumi atu nna binom asi hɔ akɔ saa tete nkurow yi so wɔ bere a woreba wo nkyi na woreda suhyɛn no mu anadwo.
1431	science/technology	Fɔɔmats ɛho nyɛ nna (APS abusua fɔmats, sɛ nhwɛso no) ne ratio yi yɛ pɛ anaa ɛbɛn ho.
832	travel	Din kyerɛw yɛ ahwehwɛde a ɛka ho bere a worekɔyɛ visa no.Wɔ aman ahorow bi so no, ɛsɛ sɛ wokɔ kyerɛw sɛ wowɔ hɔ ne beae a wote wɔ wɔn mpaninfo no hɔ.
1769	politics	Bere a Mau kuw no yɛɛ nhyehyeɛ a na wɔde repre fawohodi no, asomdwoe nhyiam bi a wɔyɛɛ wɔ kuro no mu kowiei sɛ wɔkum wɔn Hene Tupua Tamasese Lealofi III.
130	politics	Nnɛ nkaebɔ nso kyerɛɛ bɔ a aban hyɛɛ wɔ Ɔbɛnem afe a ɛfa sɛnea wɔfa carruages ho ka no.
955	travel	Sɛ wowɔ mmere wɔ hɔ a wode betu kwan a, fa akwantu sika a wubetua de akɔ Abibiman mu no toto kwan a wubetu akɔ wiase afanan ahorow no ho.
47	sports	Jonny Reid, a ɔyɛ drɔma ɛma A1GP New Zealand kuo no, yɛɛ biribi a obi nyɛɛ bi da mfe 48 a atwam nie sɛ obi ɔtwi kaa ntɛntɛm so wɔ Auckland Harbour Bridge, New Zealand, mmarakwanso
1038	science/technology	802.11n nostandaad yɛ adwuma wɔfirkwɛnsi a ɛyɛ 2.4Ghz ne 5.0Ghz so.
1268	health	Uka tuo no anto bere a ɔde kyere barima bi tiri ho no. Schneider refa yeaw mu, n\ani baako afira, ne konkora no fa bi ayera ɛsɛ sɛ ɔyɛ n’anim nsiesie bio denam titanium so.
1418	geography	Japan kuta island bɛyɛ 7,000 (deɛ ɛyɛ kɛse paa ne Honshu), na ɛma Japan bɛyɛ island kɛse paa a ɛtɔ so 7 ɛwɔ wiase!
1899	entertainment	Wɔda ahwɛe ahorow adi wɔ ahinawotwe ahorow no so nam so sosɔ ahinawotwe no.
272	health	Ɔka sɛ nhwehwɛmu bi ada no adi sɛ ɛsɛ sɛ yare no nnyɛ ade etumi kunkum ansa na abɛy deɛ edumi trɛ kɔ wiase afan baabiara.
943	travel	Sɛ wobɛtena ɔman foforo so asan aboa ɔman no yɛ ɔkwan soronko a wubetumi afa so ahu amammere foforo, ahyia nnipa afoforo, anya nhunumu soronko asan anya nimdeɛ wɔ nneɛma binom yɛ ho.
1201	health	UN banbɔfo a wɔbɛduu Haiti afe mpɛm abien ne du asasewoso no akyi, Ɔmanfo susuw sɛ wɔn na wɔde ɔyaredɔm no bae esiane sɛ ɛbɛn wɔn nsraban no nti.
267	science/technology	Wɔkaa asɛm no wɔ Virgina esiane sɛ ɛhɔ na ɛyɛ AOL adwumaku wɔhyɛɛ kwaadu no mu kena no asoe,
1708	travel	Wɔ Medina dedaw no ho no ɛyɛ mmerɛw sɛ wobehu bea a wɔtɔn Maroccofo amammerɛ ho neama, te sɛ tagines kyɛnsen, kutu, oguanhoma nneama, hookah, ne geegaws ahorow pii, nanso ne nyinaa yɛ nsrahwɛfo no de.
928	travel	Seesei nnipa betu kwan afa wim a, wodi ho dwuma wɔ wimhyɛn adwumakuw no hɔ ankasa wɔ bere a wɔnyɛ nhwehwɛmu mfa bow no ntoto ho.
1391	geography	Wɔ Middle East wim tebea a ɛyɛ hye kakra no, na afie no ho nhia saa.
1229	entertainment	Nnwomtoni Sanju Sharma firii ase anwummere, Jai Shankar Choudhary tɔɔ so esented no chhappan bhog bhajan as well. Nnwomtofo Raju Khandelwal ka ne ho.
586	science/technology	Saa adwinnade a wɔde hwɛ neama wɔ akyirikyiri yi kaa nhwehwɛ mmienu boomu na ɛtwee neama bɛne na ɛyɛɛ akɛse nso.
1695	geography	Madagascar wɔ ɔkwan biara so no yɛ kɛse sen biara, na ɛyɛ asasetam a ade ne ho sɛ ɛba mmoa a wɔn ho yɛ hu ho a .
802	health	Akwahosan nsɛmsɛm a ebetumi asɔre esaine nsa a wɔnom boro so no bi ne brɛbo a ɛbɛsɛe ne mpo anifurae ne owu. Ɔhaw a yebetumi anya wo mu no yɛ kɛse bere a nsa a wɔyɛ a womfa mmara kwan so no.
1881	politics	Ɔpɛ a aban ahorow no wɔ sɛ wɔbɛyɛ paspɔt a wonsi onii no bɔbeasu so dua (X) anaa nkrataa a wɔasakra mu ma ɛne obi din a ɔpɛ ne ne bɔbeasu ahyia no gu ahorow.
1379	science/technology	N’apantan atenten ɛse a ɛyɛ nam a ɛyɛ reza bɛboro 70 apuepue ho,deɛ ko ne deɛ ɛwɔ ano no soro, kyerɛ sɛ biribiara ɛbɛtware ne kwan mu biara mfa ne ho nni da.
1550	politics	Sɛ anka Amanaman nkabom no dii ntwo a, ebia anaka Germany bedi Britain so nkunim sɛnea edii Europe aman a aka no so no.
333	entertainment	Deɛ edi so baa ɛno akyi ne Istanbul State Symphony sankɔbɔ a ɛyɛ Janissary band na anwontofo no ne Fatih Erkoç and Müslüm Gürses.
719	geography	Dominican Republic (Spainfo kasa: Republica Dominicana) yɛ Caribbeanfo kurow a ɛda hispaniola apuei mantam, na ɛne Haiti na ɛbↄ hye.
1780	travel	Nkurɔfo tu kwan kɔ beae a ɔbotan ayi ne ti wɔ nsu no ani mpɛn pii afe mu no nyinaa, na ɛyɛ den sɛ wobehu sɛ weinom apira obi.
1841	travel	Sɛ wɔtow nea ɔreka ɔpɔnkɔ no fi ɔpɔnkɔ no so na ne nan ka ade a ne nan hyɛ mu no mu a, obetumi atwe wɔn wɔ fam sɛ ɔpɔnkɔ no dwane a. Nea ɛbɛboa ma saa ɔhaw yi aba fam no, wɔde nhyehyɛe ahorow bi ato akwan mu.
471	politics	Na adwene no nyinaa ne sɛ ɛmma Europe aman no bi mmɛ nya tumi nkyɛn nkae no, na national governments taa sesa deɛ wɔne bɔ no ‘alliences’ na ama biriribiara ayɛ pɛpɛɛpɛ.
1634	science/technology	Na eyi tesɛ tebea anan a ade wɔmu no (wɔ nnidiso mu): ade a ɛyɛ den, ade a ɛsen, mframagya, ne plasma, ɔde kaa ho nso sɛ wɔtumi sesa kɔ ade foforo mu na ɛbɛyɛ ade a yɛhu.
1255	science/technology	Nhwehwɛmuyɛfo kyerɛ sɛ crytal a ɛwɔ ɔkra dwonsɔ mu no yɛ melamine ne cyanuric acid na ɛbɛfra.
845	entertainment	Nanso, nnansa yi mu no yɛwɔ wɔn a wɔdrɔm nneɛma wɔ afasu ho a wɔagye wɔn atom, graffiti dwumadi ahorow ne “mmara kwan so” afasu.Nneɛma a wɔka ho wɔ saa dwumadi yi mu sɛ ade a wɔahyɛda adrɔm no yiye sen biribi a wɔayɛ a wonhu so.
1776	entertainment	Francefo nsa bebree wɔ hɔ a wo nsa betumi aka, nanso New Zealand ne Australiafo nsa no betumi adu akyi.
1845	travel	Wɔn a wɔforo abotan a wofi wiase afanan nyinaa no gu so renya akwan foforo ahorow wɔ afasu bebree a wobetumi aforo no ho,
1151	sports	Akansi no mu yɛ den wɔ South Africafo fam ne wɔ nuammanom a wɔwɔ anafo fam no bɔ wɔ ho mmɔden tu mpɔn bere a na akansi no kɔ anim no.
1054	politics	"Deɛ akɔ fa nkyinwahyew a ɛfa ka wɔbɔe de siesiee nneɛma wɔ mframa gyampadurudu Katrina ho; a fiscal conservatives binom aka sɛ ɛyɛ ""Bush's New Orleans Deal."""
1859	geography	Nkyerɛase yi gyina beae biara so, a mfe a wɔde ato so no betumi aba fam wɔ mmeae bi te sɛ North Amerika sen Europa no.
1007	health	Bere a aduru biako a wɔsɔ hwɛe daa no adi sɛ etumi de te Ebolo wuo so no, besi sesɛɛ no, aduru biara nni hɔ atumi ada no adi paa sɛ ɛma ɛfiri hɔ korakora.
1076	politics	"Bush kasamafo Gordon Johndroe North Korea pledge “ kwan paa a ɔnam so duru botae na ama wɔn nsa aka verifiable denuclearization ɛwɔ Korean peninsula."""
1099	geography	"Ahunmu mfiri abien a emu duru bɛboro ""pound"" apem biako (1,000 pounds) na ɛtwa ne ho bɛyɛ akwansin mpem du-ason ne ahanum (17,500) dɔnhwere biara pem wɔn ho hyia pem akwansin ahannan aduokron-biako wɔ asase so wɔ wim."
1100	science/technology	Nyansahufo kae se, atopae a ɛhyia to bɔm no ano yɛ peme.
367	science/technology	Mogya nofiri akoma no mu pue wɔ nnubɛn bi a yɛfrɛ no arteries na ɛsane nam nnurubɛn bi a yɛfrɛ no veins mu sane ba akoma no mu. Nnurubɛn a esusua paa no de capillaries.
770	entertainment	Asɔredan no afahyɛ no mu dodow no ara kɔ so bere a wɔredi asɔredan no afeda anaasɛ onyame a ɔda so no awoda anaa dwumadi titiriw bi a ɛfa asɔredan no ho.
279	politics	Sɛ siteeti deɛ ɔdi nkunim na ɔfa biribiara bɔ so no, Florida de delegates aduonum no nyinaa maa Romney na ɛmaa ɔbɛdii nkan sɛ obi a Republican amannyɔkuo no ayi no.
357	science/technology	Sɛ ɛbsane akɔ energyɛ lɛɛvo dada no a, ɛsɛ eyi energy a ɛka ho a wɔnya firii kanea no mu no.
797	science/technology	Sɛ wode wo laptɔp anaa tablɛt retu kwan no a, wobetumi akora bi wɔ n’adwene no mu anaa nea wɔkyere nsɛm gu so no (wo nsa betumi aka bere a intanɛt nni hɔ no).
211	health	Amannebɔ kyerɛ sɛ obiara ampira, anyɛ hwee koraa no nnipa nnum na wɔwɔ beae hɔ na wɔhwɛɛ wɔn esiane deɛ esii no nti.
815	travel	Wɔ wiase nyinaa no, wobenya ahyehyɛde a wɔhwɛ ammirika nsrahwɛ ahorow bɛyɛ 200. Wɔn mu dodow no ara yɛ adwuma a wɔnhyɛ abiara ase./wɔn ankasa adwuma.
238	geography	Stofan de ka ho sɛ, deɛ yɛnim ara ne sɛ, planetary body biako pɛ na ɛwɔ hɔ a ɛda dynamism pii a ɛkyɛn Titan adie na ne din de Asase”.
1636	science/technology	Wɔbu neama tesɛ calcium ne potassium sɛ nnade. Nokwarem no, nnade wɔ dwetɛbona ne sika kɔkɔɔ mu.
