index_id	category	text
111	science/technology	“A ‘l sa moverà de sora de la costa ocidentalla de la Callifornia dol nord e la sberluxerà ind ol cel de la Callifornia e pœ a travers ‘l Oregon centrall, ol Nevada, ‘l Idaho e lo Utah” ‘l g’ha diit Tom Duxbury, ol project manager de Stardust.
1722	travel	Cuma cun tücc i Pàrch Naziunài Südafrican, i ghèn di cüst per entrà nel pàrch e per la sò cunservaziùn giurnaliéra.
1989	travel	Ghè anca un quai autobus che va a nòrd vérs Hebron, el tradiziunàl lög de sepoltüra di patriarch biblich cuma Abràmo, Isàcco, Giacòbe e i lùr dònn.
512	health	El DDA influìss sui relaziùn cun i olter cumpàgn perchè i olter fiolitt i pòden mia capì el motìf di lùr aziùn, cuma i scrivén i paròll e che el lùr livèl de madüridà l’è mia istèss.
1182	health	La França ‘l é ‘l setim pais ind ella Union Euròpea a patir par qest virus, despò de l’Austria, la Jermania, la Slovenia, la Bulgaria, la Greça e l’Itaia.
393	politics	La Germània ghera dà a l’atàch el nomm in codès “Operation Sealion”. La grànd part di armi pesaant e reforniment de l’armäda Britanega i eren andà perduu quand l’era scapada de Dunkirk, donca l’armäda l’era pütost fiàca.
1908	science/technology	El servìzzi despèss l’è doperaa di spediziùn, anca di imbarcaziùn da dipòrt, e di missiùn chi i ghan necessità de vuus e dati remòt.
592	science/technology	I animài ienn fà de parécc cèluli. I mangén ròpp e i digerissén dadént. La grànd pàrt di animài la pò möves.
550	sports	‘Na quai cursa in campàgna d’invern cumbinada a esercizi in palèstra per la pàrt superiùr del còrp l’è la preparaziùn meiùr per la stagiùn di curs.
1210	entertainment	Ind ei agn ‘80 ‘l heva lavorad a show televisiv come Taxi, Cheers e The Tray Ullman Show.
1232	entertainment	Lakkha Singh a’l g’ha pò anc presentad ol chhappan bhog bhajan. Ol cantor Raju Khandelwal a’l cantava insema a lu.
1891	travel	I viagiatùr qe i gà mìa üt de problemi en adatàss a üna növa coltùra, despèss i fan fatìga a turnà ala sò coltùra.
1798	entertainment	In un quai lòcal i alcolèc ienn ufért da la cà. Tutavia, la ciöca la cumprumét el giudìzzi, e tücc i giugaduu d’azzàrd i sàn quant l’è impurtànt vès sòbri.
738	travel	CafeNet El Sol ‘l ofrìss un servìzi de prenutaziùn per un prèzi de US$30 o $10 per un permèss giurnaliér; majùr infurmaziùn sü la lùr pagìna de Corcovado.
1298	politics	I proteste, de tant par tant violente, a i henn sortide da la mancaza de ellezion, vergune atendude dol 2011.
577	science/technology	La cèlula l’è la unitaa de bas de tücc i esàr vivént, e tücc i organìsm ienn fà de üna o püssé cèluli.
733	sports	D’invèrn, godèt quai di mejùr pisti de scì del Nòrd America, e d’estaa prùua a fà la mountain bike vèra.
1624	geography	El 20 percént de l’aqua che dai fiüm del planéta la và in di ucean la végn dal Rio di Amazzoni.
185	sports	A’l ira lojad ind ol hotel dol team prima dol match pianificad par sabòt contra ‘l Bollògna.
1158	geography	“Ol comportanent termic a ‘l é minga stabill coma ind ei grands andròts su la Tera qe a i mantegnen despess una temperadura assé constanta, ma ‘l é coerent cond ol fait qe a i henn dei buç parfonds ind ol tren”, ‘l g’ha diit Glen Cushing dol team de astrojeollojia dol Servizi jeollogic dei Stats Units (USGS) de la Northern Arizona University qe ‘l situada Flagstaff, in Aziona.
190	travel	A i passejer a g’é staita daita dol aiva intant qe i speciaven ind un cold de 90 gradi(F).
1233	entertainment	A la presentazion de jœbia dol Tokyo Game Show, ol president de Nintendo, Satoru Iwata, ‘l g’ha desvellad ol design dol controller par la nœva consolle de la azienda Nintendo Revolution.
1548	politics	Vün di quei püssé impurtànt esempi recent l’era la campagna del Nòrt Atlàntic de la Segunda Guèra Mundial. I americàn i tentavén de spustà òmen e materiai in tel Ucean Atlàntic per iutà la Grànd Bretàgna.
647	entertainment	Parècc de nualtri i se trüva a vardà prugràm televisìv chi i infùrmen del procèss o de l’esperienza a la qual parteciparem mai o dopererem mai quela conossénsa.
1522	science/technology	La ricerca del Vintesìm secùl l’ha mustràà che ghè dù 'nsiemi de variaziùn genetich: scondùda e esprèssa.
601	science/technology	El nitrogén cuma gas al gha ancamò i stèss proprietà del nitrogén liquìd. El stàt liquìd l’è püssé spèss ma i mulécoli ienn amò istess.
1747	sports	L’Argentina l’è ben cognossuda per vèch vun di mejùr squadri de polo e giugaduu al mùnd.
142	sports	La decision dol NBA l’ é naita dre a ‘l fait qe un jocador dei Utah Jazz ‘l sie stait trovad positiv a ‘l COVID-19.
1802	travel	La vedüda la pò vès limitàda da la név che la végn giö o che l’è bufada via, o da la cundénsa e dal giàzz süi finestrìn del veicul.
825	travel	Si te vöret vedè el mùnd a bun mercaa, per bisùgn, stìl de vìda o sfìda, i ghénn manéri per fàl.
1144	politics	La coallizian e i armade afgane a i henn spostade ind ella area par meter in sugureza ol sit e pœ olter reoplan de la coallizion a i henn staits mandads a aidar.
1850	sports	Backpacking cunt i scì: chésta atività l’è anca ciamada föra pìsta, sci türistich o sci alpinìsmo.
1033	science/technology	A i g’han descovert qe ‘l Sol a ‘l opera segond a i stess princip de bas dei oltre stee: ‘l s’é descovert qe l’ativitaa de tute i stee ind ol sistema a ‘l é menad dol lor luxor, de la lor rotazion e de nigot de olter.
1848	sports	L’idéa de scià l’è parécc végia - di pitür rupèster chi mustrén sciaduu i risalén al 5000 a.C.!
228	geography	Qests scarpadure a i henn staite trovade despartut in su la luna e çò ‘l vœ dir qe i events geollojic qe a i g’han cread la luna a i henn plutòst recents.
292	geography	A vàl gh’eran nìvol scür qe però ieren mia legà al müimènt tel vulcàn.
1225	sports	Del Potro ‘l g’ha vud un vantaj iniziall ind ol segond set, mò pò anc qest ‘l g’ha reqiedud un tie break despò qe s’ira ruvads a 6-6.
1416	sports	Spòrt pupulàr includevén fùball, balacanèster, balavùl, nöd con la bala, sqérma, rugby, ciclìsm, hockey sul giazz, hockey cun ti patèn e cürs di machin F1.
129	entertainment	La citaa la sarà la prima ind ol Euròpa sudorientalla a ospitar la CowParade, ‘l plu grand event de art publica ind ol mond, intra jugn e avost de qell ann qi.
1003	science/technology	A’l g’ha fait su un campanell WiFi, a’l g’ha diit.
271	health	Ol Dotor Lee ‘l g’ha anc esprimud preocupazion par i notizie dixen i bagai in Turqia a i henn staits infetads dol virus de la inflenza aviaria A(H5N1) sensa malar-s.
103	politics	A i coments, in diretta tellevisiva, a i henn staits la prima vœlta qe sortive iraniane de volt nivell ‘l é g’hann ametud qe i sanzion a i henn dre a vir-ga dei efets.
14	sports	 Dòp la partida ol Re de la Tèra ‘l g’ha diqiarad: “A son nomà content de vesser tornad ind ei ultem round dei events plu importants. A son qi par provar a vencer qest qi”.
1412	politics	El Cungrèss l g’aveva mia de podè de impùrr i tass, e, perchè gh’era mia de esecütif o de magistradura naziunàl, el se afidàva ai autorità statai, chi despéss i cuperavén mia, per fà rispetà i sò att.
1811	travel	Se t’eret prenutà i vòi e l’alògi per el 2020 prìma che el füdess sta anunciaa la posticipaziùn, te podesset truàss in üna situazion scomuda.
1681	science/technology	La tecnulugia la ufrìss üna soluziùn cunt i giti sul càmp virtuài. I stüdént i pòden vardà i manufàtt de un museo, visità un aquari, o amirà superbi òperi d’art intant che ienn sentàà cunt la lùr clàss.
335	entertainment	La diva turca Sezen Aksu la s’é esibida cond ol tenor itaian Allessander Safina e ol cantor grec Haris Alexiou.
378	science/technology	Dopu trimila ann, in tel 1610, l’astrònom italiàn Galileo Galilei l’ha duperò un telescòpi per usarvär che Véner g’aveva di fàas propi cuma la lüna.
1367	science/technology	A i sienziats a i pensen qe i ocellots a i vage dre e a i troven animai de maiar cond ella osma, a i nasen indoba i animai qe a i maien a henn stait in su l tren.
703	travel	I tour ienn püssé economèg per i grüp püssé grànd, donca si te se depertii o cunt dumò un amis, pruua a incuntrà oltra gént e fà sü un grüp da quater a sés per üna tarìfa mejùra a persùna.
297	politics	A’l emendament proponud ‘l é jemò stait aprovad de tute e do i Camere ind ol 2011.
80	sports	Maroochydore ‘l g’ha pœ sconfijud Caboolture ind ella finalla prelliminara.
1823	travel	El shopping duty free l’è la pussibilità de cumprà mercanzii senza tàs e accìse in pòst specifegh.
836	travel	L’architetüra la se ocùpa de progetaziùn e construziùn de edifizzi. L’architetüra de un sìt l’è despèss ün’attraziùn türistega deperlee.
880	travel	Chèsti dumàndi i pòden cambià a segùnda del paés che un viagiadu l’ha visitaa o el vör visità.
1143	politics	Pò anc ol partit a ‘l govern, ol South West Africa People's Organisation (SWAPO), ‘l g’ha mantegnud la plu banda dei ellezion parlamentare.
650	science/technology	L’è posìbil che el tò hotel o padrùn de cà (se te stee in üna pensiùn o cà privàda) i ghavràn wifi o un PC culegaa a internèt, e tücc i paés i ghàn un internèt café o un quai pòst cunt wifi püblich.
702	travel	El tò passaport al ghà de vès valìd per almen 6 mès oltra i daat del tò viàgg. L’è necessari un bigliètt d’andada e ritòrno per pruaà la lunghèza del tò sogiorn.
1604	travel	Ogni matìna, i persùnn i lasén picui cità de campagna in machìna per andà al pòst indua i laùren e incruscian chi el và a laurà a la destinaziùn che l’è el pòst che ienn apéna lasà.
817	sports	Cunt i sò radìs in del Running Tours Barcelona de Barcelona e in del Running Copenhagen de Copenhagen, l’è vegnü a drè in prèsa dal Running Tours Prague cun bàs a Praga e òltri.
1763	travel	Ogni ann, desène de visitaduu i vegnen ferii perchè i stan mia a la giüsta distanza. Chésti animài ienn grànd, selvàdeg e i pòden vès periculùs, donca dacch el lùr spàzi.
1290	politics	Israel domanda una presenza millitara costanta ind ella vall par dex agn quand qe ‘l sarà firmad un acòrd, impé la PA ‘l é d’acòrd su qella presenza millitara qi par un period de nomà cinqu agn.
1775	entertainment	La bìra locàl principàl l’è la “Number One”, l’è mia üna bìra cumplèsa ma l’è bùna e la te rinfrésca. L’oltra bìra locàl la se ciàma “Manta”.
642	science/technology	El doperà Internet e ‘l World Wide Web el permèt ai stüdént de vèch semper acèss a l’infurmaziùn.
1544	politics	In tel 17 setember del 1939, la difesa polàca l’era giumò in ruina e l’ünica sperànza l’era de ritiràss e reurganizass lung la Testa del pùnt roméno.
1148	health	Ol portavox de Medixine sensa Frontiere Richard Veerman ‘l g’ha diit “l’Angola ‘l é dre qe la va invers ol pejor focollare de semper e la situazion in Angola ‘l é delbon greva” ‘l g’ha diqiarad.
801	health	Béf bevàndi alcolech cun moderaziùn. L’alcol el culpìss tücc in manéra divèrsa, e cugnuss i tò limit l’è parécc impurtànt.
1741	travel	El pùnt doarèss vès del tütt operatif in setémbri 2017, quand i pòst de blòcch duganài brasiliàni i duaresen vès finii.
1140	entertainment	Anc’isseben Winfrey la fœdes in lagreme ind ol sò conjed, la g’ha ciarid a i sò fan qe la tornerà.
1267	health	Edgar Veguilla ‘l g’ha ricevud feride a ‘l braç e a i ganaçe e Kristoffer Schneider ‘l g’ha duzud domandar un intervent chirurgic ricostrutiv par a‘l sò vis.
1774	entertainment	Qeste i henn trè spiaje sovenz plene de famie con tants negozi vun dré a olter aprœv de la costa. El sa pœ nodar sensa pigre.
862	health	Ma in oltri pàrt del mùnd, indùa l’inséma di bateri l’è növ per tì, l’è tànt püssé prubabil de vèch problémi.
1069	politics	Layton ‘l g’heva querid dei modifiqe a la propòsta de lex ambientalla dei conservador durant ‘l incontr cond ol Prim Minister e ‘l domanda qe vegne faita una “rescritura completa” de la propòsta de lex ambientalla dol Partit Conservador.
325	geography	A i sienziats a ‘l National Hurricane Center a i preveden qe Danielle ‘l se raforzerà fina a divegnir un uragan par mercordì.
1314	health	La sò ricerca la g’ha demostrad qe la soministrazion de un ormon ‘l pœderia vellocizar la marudazion dol polmon fetall dol ninin.
704	travel	Tutavia, chéstu el doares propi mia vès el tò prublema, perché despèss i türist ienn tirà de scià e de là per impienì i machìn.
528	sports	El spòrt mudèrn de la schèrma l’è giügaa a parécc livei, da stüdent universitari a cumpetiziùn prufessiunai e olimpich.
532	sports	I giügaduu chi i cumpleten el càmp cunt el minùr numèr de cùlp o de müimènt de la màzza, i vénc.
1643	science/technology	An gha dumò de dumandàss cusa la diventerà la tastera quand el riverà vargòt de nöf.
868	travel	Specialmént in di priim dì, cunsidera de godè de hotel, mangià e servizzi de stìl e qualità ocidentài cuma aiütt per abitüass.
124	entertainment	Inanz comè de The Daily Show e The Colbert Report, Heck e Johnson a i g’hann imajinad una publicazion qe la g’haria fait una parodia dei nœve, e dei nœtisiari, quand qe a i eren students a la UW ind ol 1988.
1159	politics	In França, votar ‘l é staita tradizionalment un mister a bassa utillizazion de tecnollojia: a i elletor a se islen ind una cabina, meten un fòi de carta prestampad qe ‘l indicia ‘l lor candidad preferid in una busta.
701	travel	I citadìn cubàni chi i ghàn üna green card di Staa Üni i doaresen visità un Consulaa de l’Ecuador per otegnì ün’esenziùn à chésta regùla.
560	health	Per cuntrulà la vitima, te ghe prima de ispeziunà la scéna per garantì la tò sicüreza.
167	politics	A ‘l atac ‘l g’ha metud a grand prœva i rellazion intra India e Pakistan.
301	politics	I suces de Vautier a ‘l de fœra de la regia includen un dejun ind ol 1973 contra qella qe ‘l considerava coma censura pollitica.
40	entertainment	John Grant, de WNED Buffalo (stazion de Reading Rainbow) a’l g’ha dicc: “Reading Rainbow a‘l g’ha ensegnad a i bagai a lexer,… la mor per la lejora – [el ispetacol] a’l g’ha encorajad a i bagai a ciapar in man un liber e a lexer”.
1414	politics	I Articui i richiedevan cunsensu ünanim de tücc i staat prima de pudè vés cambiaa e i staat i ciapaven el guverno centràl inscì a la ligèra che i lür rapresentànt despèss i eren via.
1789	travel	Eventuài cambiamént o richiesti i ghan de vès presentaa prìma a l’agenzia de viàgg e mia diretamént a l’hotel.
754	travel	Un quai hotel el ghà üna redità de l’età d’òr di feruvì a a vapur e di transatlantìch; prima de la Segùnda Guèra Mundiàl, in tel 19esim e inìzi del 20esim secùl.
1142	politics	Ai resultats finai dei ellezion presidenzialle e parlamentare de la Nambia a i g’hann indiciad qe ‘l president atuall, Hifikepunye Pohamba, a ‘l é stait torna ellejud cond un grand vantaj.
1022	politics	L’anunziazion ‘l é staita dita dòp qe Trump a’l g’ha vud una conversazion tellefonica cond ol president turc Recep Tayyip Erdogan.
538	travel	I türist i pòden visità i sìt püssé impurtànt de üna naziun particulàr o i pòden decidì de concentràs domà en de n’area.
155	geography	Quindes de qei crap i henn staits atribuids a la plœvia de meteorits dol löi pasat.
1278	health	Anc’isseben trè persone fodessen dedent quand qe la maqina la g’ha ciapad dent la cà, nigun ‘l s’é fait mal.
1197	sports	A g’henn dent in qest ellenc ‘l Olanda, con Anna Jochemsen qe jer ‘l é ruvada noan ind ella class feminilla dol Super-G, e la Finlandia con Katja Saarinen qe ‘l é ruvada dexima ind ol medem event.
1541	politics	La Germania l’era el nemìch comün in te la Segunda Guèra Mundial, e l’era purtaa a la coperaziùn tra USSR e USA. Cun la fin de la guèra, i scònter del sistéma, di procéss e di coltür i eren purtaa a la divisiùn di paés.
1111	health	L'epidemia la g’ha obligad ol govern a ciapar dei mesure coma la utillizazion de caçador de porcei ind ei aree colpide in manera grèva e la distribuzion de mier de tende anti-zanzare e spruzar grande quantitaa de pesticids.
889	geography	El enteren de l’Antartid a’l é una region desolada e quarciada jò de 2-3 km de giaç.
324	geography	La tompesta, qe la sa trova a circa 3.000 miia de Miami, in Florida, la g’ha una vellocitaa de vents massim sostenud de 40 miglia a l’ora(64 qillomenter a l’ora).
118	entertainment	La cà editora de jœg Konami ‘l g’ha diit incœ ind un jornall japones qe ‘l rillasserà minga ‘l jœg Six Days in Fallujah.
1018	entertainment	Gosling e Stone a i g’han recevud i nomination coma Meior ator e atrice.
523	health	Chestu qui el te stanca cuma sveglias ogni vint o trenta minut e vardà la televisiùn.
1637	science/technology	Te pòdet anca véch lìg cunt quantità picùi de elemènt che ienn mia metàlic cuma el carbòni.
749	travel	Salì ne la tò machìna e partì per un viàgg lung el ghà üna pròpia belèza in de la sò semplicità.
1575	science/technology	Un numèr binàri el pò vècch dumò un o dù valur, var a dì 0 o 1, e chésti numèr ienn ciamaa cifri binàri - o bits, per duperà el gèrg informadegh.
524	health	L’efet che te fa el cambia a segunda di volt che il to scervel el pröva a sugnà de nòcc.
358	science/technology	A i lo fan mandand fœra una particella picinina de lux ciamada “foton”.
999	health	Coma olter esperts, a’l g’ha cres minga tant qe ‘l diabet ‘l pœ vesser curad, parqè qeste descoverte i g’han nuguna rellevanza par le persone qe i g’han jemò ‘l diabet de Tip 1.
1359	science/technology	A i lion a i henn i fellin plu soçevòi, qe a i viven in grands grup ciamads ròs.
311	entertainment	La copia la s’ira sposada in Texas un an indre e l’ira vegnuda a Buffalo par festejar cond ei sò amiç e parents.
1917	entertainment	Nar en barca ‘l é ol pasatép nasional en Finlandia e g’é una barca ògne set persone.
1771	geography	Le spaje de la Costa del Nord (ind el distret de Nord Harbour) le sa trovenn in sœ ‘l Ocean Pacific e le sa slogann de Long Bay ind el nord fina a Devonport ind el sud.
361	science/technology	A i foton a i henn infina plussé picegn dei ròb qe i fann su a i atom!
196	health	Arias a’l é resultad positiv par un linjer cas de virus, ‘l g’ha diit a ‘l Minister Presidenziall Rodrigo Arias.
951	travel	Te ghavesset de scernì cunt atenziùn la tòa cumpagnia aerea dent ün’aleanza per el prugràm Frequent Flyer.
878	health	Üna malatia cuntagiùsa l’è üna malatia che l’è facilment trasmisìbil cunt aprööf üna persùna malàda.
214	sports	Ol golf e ‘l rugby a i torneran a i Jœg Ollimpic.
509	health	L’è mia ün handicap de aprendimént, l’è ün destùrb de aprendimént; el “culpiss da 3 a 5 percént di tücc i fiolitt, fursi fin a 2 miliùn de fiolitt americàn”.
332	entertainment	A i cellebrazion a i henn comenzade cond un spetacòll speçall dol grup de nomnanza mondialla Cirque du Soleil.
835	travel	In olter càs, dumò chi el sugiurna fö di strütür türistég al ghà de registrass. Tutavia, chèst al rénd la lege ancamò püssé confüsa, donca descuvrissel per témp.
298	politics	Una modifica ‘l é staita faita in qesta sessione legislativa quand qe la segonda sentenza ‘l é staita scancellada inanz de la Camera dei representants e pœ ‘l é passada in una forma similla lunesdì dol Senat.
392	politics	Cun la fin de la batàia per la Frància, la Germània l’era tacà a preparàss per invàt l’isùla de Bretàgna.
1211	entertainment	Ind ol 1989 a’l g’ha aidad a la crezion dei Simpsons con Brooks e Groening e ‘l é stait ol responsabill par ‘l assonzion de la prima squadra de scritura dol program.
204	travel	Ol Twin Otter ‘l g’ha circad plu fiade de terar jó a Kokoda ‘l olterdì coma goll Airlines PNG CG4684, mò ‘l g’ha doxud trigar la manovra anc’mò una vœlta.
916	science/technology	I mutùr de traduziùn ienn mejoraa tantìsim, e despèss i ufrissen traduziùn plü o manc giüst (e de ràr incumprensìbil), ma l’è necessari sta aténti, perchè i pudarissen vèg sbajaa tüt.
535	entertainment	Chèstu l’è quand la gent la va in den pòst che l’è parécc divers dal solet tram tram de tücc i ì per pusà e divertiss.
658	health	In estaa, stà atènti anca ai zanzàr del nòrd. Anca se i trasmèten mia de malatii, i pòden vès fastidiùs.
353	science/technology	I mollecolle d’aiva a i fann su una pell invisibla in su la superfis de l’avia qe permet a ròb coma una gucia de star su de sura de l’aiva.
1520	health	Oliver Sacks in tel sò scrìt El Discòrs del Presìdént l’ha sügerii che i persònn che i pòden mia capì el parlaa a causa den dàgn al scervèl ienn tutavia bùn de mesurà cun precisiùn la sìncerità.
1331	politics	A’l s’é ipotizza qe ‘l sa candiderà a la presidenza ind ol 2016.
295	health	I ellicoter a i han aidad i dodes member dol eqipaj e la solla ferita ‘l é stait un nas sqies.
569	science/technology	Üna populaziùn l’è l’inséma di urganìsm de üna spéce particulàr dent a üna specìfega area geugrafica.
926	science/technology	Se te doperet un dròne, cuntròla per témp quel che te pòdet filmà e quai permèss o licénzi in più ienn necessàri.
854	travel	MetroPlus l’è püssé comòd e menu trafegaa ma un pitìn püssé caar, anca se amò püssé ecunomìch di bigliètt nurmài de la metro in Euròpa.
225	science/technology	L’enerjia nigra a ‘l é una forza dol tut invisibla qe la agis in manera costanta ind ol univers.
1598	science/technology	Ieren fà dù esperimént e segnà el DNA in tel fàgo cunt fòsfor radioatìf o segnà la pruteina del fàgo cunt zuulf radioatìf.
771	entertainment	I festivàl di templi de Kerala ienn parécc interessànt da vedè, cunt üna processiùn üsual de elefànt decuraa, l’urchèstra del templì e oltri festegiamént.
856	travel	Purtà per i òlter - pèrd mia de sutöcc i tò valìs, specialmént quant te traversét i cunfìn internaziunài.
23	sports	Ol jugador dol dì a ‘l é Alex Ovechkin de i Washington Capitals.
432	politics	El Lüssemburg el g’ha ‘na longa stòria ma la sò indipendènza l’è datada 1839.
1804	travel	I safari ienn forsi la püssé grànd attraziùn türistèga in Africa e ‘l punt cülminant per tànt visitaduu.
533	sports	El giög el se giüga sun de l’erba, e l’erba inturna al büs l’è taiada curta e la se ciama green.
434	politics	El Lüssemburg l’ha semper pruvà a restà ün paès neutràl ma l’era staa ocüpaa de la Germània lung la Prìma e la Segònda Guéra Mundiàl.
128	entertainment	A ‘l event artist a ‘l fa pò anc part de una campagna dol Comun de Bucarest qe ‘l circa de rillançar l’imajin de la capitalla romena coma metròpoll creativa e collorada.
810	sports	El canyoning al mèt insèma element del nöd, rampàda e sòlt - ma per cumincià el necessita de assé pòòch alenamént o fùrma fiséga (par esempi rispèt a fa scalàdi süi cràp, imersiùn sübaquii o scì alpìn).
1327	science/technology	I comete a i pœderian vesser staite una manera par portar aiva a la terra insema a materia organica qe la pœ fa su proteine e sostegner la vita.
638	science/technology	In tel 1977, el dutuu Damadian l’era cumpletaa la costruziùn del prìm scaner de RM per còrp intrèch, che l’era ciamaa “Indumabìl”.
269	sports	A ‘l an passad ind ol jener dol 2017 Jesus, 21 agn, ‘l é passad dol club brazilian Palmeiras a’l Manchester City par un totall de diner diqiarads de 27 miion de sterline.
1364	science/technology	La tigre la fa part dol medem grup (ol jener Panthera) dei lion, lioparts e dei jaguar. Qests quater fellin qe a i henn i soi qe a i henn bon de rujir.
989	geography	I vedrèti ienn mia stabìl ma i scula giö de la muntàgna. Chéstu el pòrta a speccatür e crepasc, che i pudarissen vès scondù di pónt de néf.
864	health	Inscì i flagéi di Delhi Belly, la Malediziùn del Faraùn, la vendèta de Montezuma, e i sò parécc amìs.
595	science/technology	Üna celùla l’è l’ünità strütüral e funziunàl püssé picùla de un organìsim (esàr) vivènt.
571	science/technology	Quànd i esemplar i mustrén parécc variànti de un particulàr tràt ienn polimorfic.
924	science/technology	I réguli chi enteresàn la fotografìa nurmàla i se aplicàn anca a la registraziùn de video, forse anca püssé de inscì.
570	science/technology	Quand tücc i esemplar de üna populaziùn ienn uguài per chèl che riguàrda un tràt fenutipic particulàr ienn cognossuu cuma monomorfìc.
1273	sports	Quater sciatore dol grupp femminile in seduta a i henn minga ruvade a fornir i lor dissese e 45 dei 117 sciatore dol Slalom jigant a i henn minga ruvade a classificar-s in gara.
1400	politics	Dedree a la Dichiaraziùn de Indipendenza g’eren scrivuu i paròli “Dichiaraziùn de Indipendenza uriginàla datada 4 lüi 1776”. La scrìta l’è sun tel fùnd de ‘l documént, à l’incontrari.
664	travel	Andà al Walt Disney World el rapresénta un pelegrinagg impurtànt per parécc famej americàn.
1737	travel	I taxi condividüü ienn ün mèzz rapìd e còmod per rivà in di pòst visìn, cuma Paro (Nu 150) o Punakha (Nu 200).
