index_id	category	text
1841	travel	Se un cavalerìzz al végn lanciaa dal cavàl ma el ghà un pè incastraa in de la stafa el pudarès vegnì tirà dré del cavàl se el scàpa. Per decréss chestu ris’c, i se pòden ciapà un numèr de precauziùn de sicurèza.
471	politics	El concét l’era che tücc i naziùn européi i gheren de cercà de impedì che üna naziùn la vegnìva poténta, e donca i guvèrn naziunài despéss i cambiavén i lür aleaa per pudè mantegnì l’equilibèr.
1634	science/technology	Chést l’era püssé cuma i quatér stàti de la matéria (in di stèss ordén): solèd, liquid, gas e plasma, anche se el pensàva che i cambien in növi sustànz per furmà quel che nùn vedùm.
1255	science/technology	I recercador a i g’han oservad qe dei cristai a i henn faits su ind ella urina dei gats par la jonta de mellanima e acid cianuric
845	entertainment	Tutavia, al dì d’incö i ghénn artìst de grafiit afirmaa, evént de grafiit e mür “cunsentii”. In chestu ambiént, i grafiit despèss i someian a òperi d’art pütòst che a scrìtt che se ghe rìva mia a léng.
1776	entertainment	I ghén parécc vìni francés da vèch, ma i vìni neozelandés e australiàn i pudaréssen viagià méi.
1845	travel	I scìm ghàn vedüdi de mancà el fiaa di pìz. I scaladuu de ogni pàrt del mùnd i dèrvissen de continuo nöf vie tra i sò paréti dal putenziàl senza fin.
1151	sports	Anc’isseben qe la someé un pit fœra de forma impé dei sœ sorelle del Sud, la nazion del Sud Africa ‘l é parecc meiorada menemà qe ‘l tornée ‘l nava inanz.
1054	politics	Ol dibatit ‘l é stait tecad dei controversie in su la spesa par i aide e la ricostrozion despò dol uragan Kartrina, qe vergun conservator fiscai a i g’han par gregnar etiqetad come ol “New Deal de Bush de New Orleans.”
1859	geography	La definiziùn la ghà variaziùn geugrafich, indùa el lìmit d’età el podarès vès püssé bàs in pòst cuma el Nòrd Amerìca rispèt a l’Euròpa.
1007	health	Anc’isseben un vacin sperimentall a’l somea qe ‘l pœ reduxir la mortallitaa dol Ebolla, fina a essa nissuna medixina l’é staita demostrada de vesser eficaça ind ol tratament dol infezion quand la g’é jemò.
1076	politics	Ol portavox di Bush, Gordon Johndroe, ‘l g’ha definid la promessa de la Corea dol Nord “un grand pas invers ‘l obietiv de ruvar a la denuclearizazion verificabilla de la penisolla coreana”.
1099	geography	I satellit, qe i pisen tuts du 1000 libre en soverplu e i golaven a 17.500 km a l’ora, a i s’hen picads dent vunn cond el olter a 491 miia dessora de la Tera.
1100	science/technology	I sienziats a i g’hann dicc qe l’esplosion de la collision a ‘l é staita de grónds dimesion.
367	science/technology	Ol sangu ‘l va vià dol cœr ind ei tub ciamads arterie e ‘l torna indré ind ei tub ciamads vene. A i tubixin plu picegn a i henn ciamads capillar
770	entertainment	La grànd pàrt di festivàl di templi ienn celebraa cuma pàrt de l’aniversàri del templi o del cumpleànn de la divinità che la presiéd o oltri evènt impurtànti ligaa al templi.
279	politics	Siend qe ‘l é un stat indove ‘l vencidor a’l ciapa tut, la Florida la g’ha daits tuts i so cinquanta representants a Romney e çò ‘l a sponciad a’l cò a la nomination dol Partito Republican.
357	science/technology	Par tornar a ‘l nivell de enerjia de inanz, a i g’han de livrar-s dol enerjia extra qe a i g’han otegnud de la lux.
797	science/technology	Si te viagét cunt un computer purtatìl o tablet, tégn üna copia in de la memoria o in del dìsc (acessibìl senza internet).
211	health	A i henn stats segnallads nissun ferid grèv, mò olmanc cinqu persone in sul pòst a 'l moment dol esplosion a i henn state tratade par sintom de shock.
815	travel	A livèl internaziunàl, i ghenn quasi 200 organizaziùn de tour de running. La grànd pàrt la laùra in manéra indipendénta.
238	geography	Par qell qe savòm, a g’é nomà vunn pianeta qe ‘l dimostra plussé dinamism de Titan, qell planeta ‘l g’ha nòm Terra,” ‘l g’ha ajunjud Stofan.
1636	science/technology	Elemént cuma el calcio e ‘l putassi ienn cunsideraa metài. L’è òvio che ghè anca di metài cuma l’argént e l’òr.
761	travel	La végn pö procürada, sü carta e/o online, üna lìsta di strütür dispunìbil, a volt cunt racumandaziùn e cumént di olter viagiaduu.
1676	science/technology	La recerca in de l’Inteligénza Artificiàla la riguàrda la costruziùn de machìn per automatizzà i atività chi i necessiten de cumpurtamént inteligént.
848	entertainment	La grànd pòrt di boomerang dispunìbil in Australia in fàtt i turnén mia indree. Per chi ‘l cumincia l’è mei pruuà a tirà in del vént
1089	science/technology	Qella teoria qe la dix qe la plu banda de la materia oscura intorn de una gallasia la ga sta intorn in vergota qe ‘l somea un alon e ‘l é faita su de tante particelle picene.
984	health	Ienn sta segnalaa menu de mìla càs in di umàn, ma quaivun l’è staa fatàl.
305	sports	A’l é mórt a l'età de 54 agn ‘l judoka japones Hitoshi Saito, vencidor de do medaie d'or ollimpiche.
697	travel	Gerusalemm la ghà parécc sìt coltürai, archeologich e istorich, inséma a centri cumerciai, cafè e resturànt trafegaa e animaa.
826	travel	De bas, i se dividàn in dù categurii: o te laùret intant che te viagét o te cerchét de limità i tò spés. Chestu articùl al se cuncéntra sü chest’ültim.
1672	health	L’è cognossù de parécc témp che i vari tipp de dàgn al scervèl, traumi, lesiùn e tumùr i influissén sun del cumpurtamént e i causén cambiamént in üna quai funziùn mentàl.
536	travel	Spiagi, parchi de divertiment e campegi spess ien i pòst püssé comün indùa i van i türist ricreaziunai.
1909	science/technology	El tò furniduu locàl de servìzzi telefòneg el doaress vès bùn de dà püssé infurmaziùn sü la conesiùn a ‘sto servìzzi.
611	science/technology	Süi compüter pòden vès fà animaziùn sufisticaa, e chést tìp de animaziùn l’è semper püssé doperàà in televisiùn e in di fìlm.
157	sports	In seguenta de la gara, Keselowski ‘l resta ol leader dol Campionad dei Pillots con 2250 punts.
1294	politics	Martelly ‘l ha jurad jer in un nœv Provisional Electoral Council (CEP) de nœv member.
1803	travel	D’oltra pàrt, cundiziùn de giàzz e néf ienn nurmài in parécc paés, e ‘l trafèg el va inanz per lo plü senza interuziùn tütt l’ann.
359	science/technology	A i sienziats ciamen qest process qi “emission stimollada de radiazion” parqè a i atom a i henn stimollats de la lux intensa, çò ‘l provoca l’emission de un foton de lux, e la lux ‘l é una tipollojia de radiazion.
302	politics	La lex francesa ‘l é staita modificda. Ol sò ativism ‘l é comenzad a l’etaa de 15 agn quand qe ‘l s’é unid a la Resistenza francesa durant la segonda guera mondialla.
455	science/technology	Chesto l’è dré a diventà menu prublematec perché i produtür de obietìf i rivén a standard püssé elevaa in de la produziùn de obietìf.
25	sports	Ol prim assist de la sira di Ovechkin ‘l é stait ind sul punt de la vitòria fait dol debutant Nicklas Backstrom;
1606	science/technology	Adès la sciènza la mòstra che sta grànd economìa del carbònio l’ha retràt la biusféra de vun di sò stàti stabìl che i han suportà l’evoluziùn umàna per i ültim dò miliùn de ann.
79	sports	I do squadre a i se sarien incontrade ind ella semifinalla plu importanta indove Noosa ‘l g’ha esaurid i vencidor de 11 punts.
952	travel	Anca se te podarèt pensà che el saréss òvvi entrà a fà pàrt de la cumpagnia de reoplan cun la qual te vùlet püssé, te ghavariet de savè che i vantàgg ufèrt despess ienn mia cumpàgn e i pónt de frequent flyer i pudarissen vès püssé generùs suta cumpagnii de reoplan differènti dént l’istessa aleanza.
995	travel	Tra i cumpagnii di reoplan che l’offrissen ghè Air Canada, Delta Air Lines, Lufthansa per i vùl che i partén di Staa Ünii o Canada, e WestJet.
266	science/technology	Ol center de controll rus ‘l g’ha ativad ol jet e ‘l asset normal de la stazion ‘l é stait restabillid.
112	politics	La decision dol sior Rudd de signar jo i acòrds climatic de Kyoto la isla i Stats Units, qe ora a i henn la solla nazion desvellupada qe la g’ha minga ratificad ‘l acord.
1050	politics	Ol Rapòrt ‘l é sosen critic ind ei riguards de tuts i aspets de la pollitica atualla dol Esecutiv par ‘l Iraq e la inziga un cambiament imediat de direzion.
1609	travel	Perchè i sistémi de traspòrt i ramà scià tàli lamentei, perchè i falìsen tücc i dì? I ingignér di traspòrt ienn mia cumpetént? O l’è drè a sucét quaicòss püssé a la bàs?
1316	sports	Pò anc i wrestler sò coléghi a i g’hann fait omaj a Luna.
291	geography	El teramòtt doerïa vès stà sü la cima de la bùca del vulcàn a nort est, el 10 de marz, inscì fort da causà üna növa faas.
1215	travel	Repòts iniziai a i dixiven qe ‘l reoplan ‘l é stait dirotad indré in Afghanistan despò qe ‘l g’é stait negad un ateraj d’emerjenza a Ürümqi.
1270	sports	In plu a ‘l event di mercoldì, Carpanedo ‘l ha garejad in do gare individuai ai Campionats.
663	entertainment	San Francisco l’è anca vun dì meiòr pòst de la naziùn per la cüsina asiatega: kureana, thai, indiana e japonesa.
91	politics	Lodin ‘l g’ha pò anc diit qe i funzionar i g’han decidud de scancellar ol ballotaj par far tegner a man a i afgan i costs e protejir-i dei res’cc par la sugureza ligads a un oltra ellezion.
371	science/technology	Pò véss che un Triceratop duperàva el sò bècch per scarpà via i föj prima de majà al tronch.
1806	travel	Quai animal, cuma i elefànt e i giraff, i tendén a vegnì visìn ai machìn e un equipagiamént standàrd el permeterà üna bùna vedüda.
930	travel	Anca se te podaret mia vèch bisògn de un vìsto per viagg cùrti in un quai paés cuma türista o per afàri, andàch cuma stüdent internaziunàl de solìt necessita de soggiurnà püssé a lung rispét che andà dumò cuma türist occasiunàl.
33	sports	Piquet Jr. a’l é stait licenziad dòp ol Gran Premi d’Ungeria dol 2009.
0	health	Lundesdì a i sienziats de la Stanford University School of Medicine a i han nonziad ‘l invenzion de un nœv strument diagnostic qe ‘l pœ tœr fœra i cellulle par tipollojia: un microcip picinin qe ‘l pœ vesser fait su cond una stampant a jet de incioster standard par de plu o de manc de un centesim de dollar american.
200	geography	Felicia, un temp una tompesta de categoria 4 segond la scala dei uragagn de Saffir-Simpson, ‘l s’é redoxud a una depression tropicalla par pœ desparir mardì.
873	entertainment	Se te se sentet püssé curagiùs, ciapà chésta pusibilità per preparà o sbatt di gius de früta:
774	entertainment	I esposiziùn orticùi internaziunài ienn evént specializaa chi i mùstren alestiment de fiuur, giardìn botànich e tüt quel che riguàrda i piànt.
1377	science/technology	Noter fòm su i nòsse ca e i nòs vestits dei piante, la plu banda dol cib qe maiem a i henn piante. Sensa i piante, i animai a i pœderian minga suraviver.
203	geography	Con vergune dei plœvie g’é staits insema tompeste de tron e sovenz sœmelleg.
1365	science/technology	Ol rijir de la tigre ‘l é minga coma ‘l rujir a piena vox de un lion, ma ‘l se insomea plussé a di parolle ringhiade e voçade.
1176	sports	A ‘l ira la partida finalla par a i All Blacks, qe a i g’heven jemò vençud ol trofé do semane indre.
879	health	Parècc gòvern i dumanden ai visitaduu in entràda, o ai residént in parténza di lùr paés de vès vacinaa per üna serie de malatii.
110	science/technology	Stardust la farà un nœv recòrd de tuts i temp par vesser la naveta spazialla plussé sperta ind ol tornar in su la Tera, inci la baterà ‘l recòrd fait ind ol maj dol 1969 durant ol ritorn dol modul de comand dol Apollo X.
1494	science/technology	L’agricultüra de susisténza l’è semplix, despèss biulogica, e la dòpra semènz originari de l’ecoregiùn cumbinaa cun la rutaziùn di cültür o olter tecneg pütost semplix per masimizzà el racòlt.
1086	science/technology	A ‘l efet qe ‘l team ‘l ira dre a circar ‘l saria fait dei forze de marea intra la materia oscura de la gallassia e la materia oscura de la Via Lattea.
1623	geography	El Rio di Amazzoni l’è anca el fiüm püssé laarg de la Tèra, cunt üna larghèza de sés miia en certe bande.
1222	entertainment	La rock band la g’heva de vesser in tour ind ei Stats Units e ol Cànada fina a ‘l 16 de setember.
1357	science/technology	Par finir, a i g’henn tants picegn fellin (a inclusion de gats domestic liver de viver fœra) qe a i maien a i plu numbros animai plu picegn coma insets, sorec, luxerte e œcei.
216	sports	Ol squash, ol karate e i spòrt su rodelle a i g’hann circad de vesser ciapads ind ei prògram Ollimpic insema a ‘l baseball e a ‘l softball, qe i eren staits esclududs dei Jœg Ollimpic ind ol 2005.
327	sports	Nassud ind ella capitalla croata, Zagabria, Bobek ‘l é divegnud famos quand qe ‘l g’ha jugad par il Partizan Belgrad.
277	politics	A’l ex governador dol Massachusetts Mitt Romney ‘l g’ha vençud mardì i ellezion primarie presidenzialle dol Partit Republican de la Florida con plussé dol 46 percent dei vòts.
428	geography	El teritòri de la Türchia l’è püssé lòng de 1600 chilòmeter (1000 mi) e püssé làrch de 800 chilòmeter (500 mi), cont üna fùrma quasi retangulàr.
1709	travel	Goma l’è üna cità türistica dent a la Republéga democràtega del Congo, la se trüva a est, aprööf el Rwanda.
565	health	Chi el fasìva atività regulàr el necesitàva de püssé iütt in tèrmen de perceziùn negatìva del duluu e ‘l distingueva i diferénzi tra duluu crònic e sensaziùn de fastìdi chi i vegnén da ün’atività fisica nurmàl.
742	travel	Anca se püssé pinìn, i me fan vegnì in mént en quai visitaduu anziàn di Hawaii, prima che i deventassén un staa, senza i grànd hotel türistèg e olter svilùpp.
531	sports	Üna partìda nurmàl l’è fàda de desdòtt büs, e i giügaduu de solìt i cumincién dal prìm büs del càmp e i finìssen cun tel desdotésim.
729	travel	L’isùla de Bowen l’è üna gità populàr de ‘n dì o ün’escursiùn per el weekend che la ofrìss kayak, caminàdi, negòzi, resturànt, e oltèr.
1427	science/technology	Ad esempi, el furmàt de futugrafìa de imagìn fìsse püssé populàr al mund l’è de 35mm, che l’era la dimensiùn de peligùla dominànta a la fin de l’era di quei peligùl analògich.
865	health	Cuma cunt i problémi respiratòri in di clìm püssé frécc, i problémi intestinai in di clìm püssé còldi ienn pütòst comün e in de la gràn pàrt di càs pròpi fastidiùs ma mia inscì periculùs.
205	travel	Circa dix minuts inanz qe ‘l g’heva de terar jó ind un second tentativ, ‘l reoplan a ‘l é disparud dei radar.
374	science/technology	Na persòna che la pésa 200 paunt (90kg) sü la Tèra, la pesarés adree 36 paunt (16kg) sü l’Io. Donca l’è ciàr che l’efèt de la gravità l’è mia inscì forte.
275	politics	La policy de Komen la g’ha desquallificad Planned Parenthood par un'indajin in sospes in su coma Planned Parenthood la spend e la signalla i diner qe i vegnen condoxuds dol representant Cliff Stearns.
1991	travel	I vii navigabìl pòden vès un bùn tema sün del qual urganizaa la vacànza.
349	science/technology	A i sienziats a i henn dre a lavorar par la creazion de un reator bon de prodoxir enerjia ind ella istessa manera.
1325	science/technology	Curtis Cooper, un matematic e professor de informatica ind l’Universitaa dol Missouri centrall, la g’ha descovrid ‘l plussé grand nomber prim cognossud fina a incœ a ‘l 25 de jener.
1854	travel	L’Euròpa l’è un continént che l’è pütòst picùl ma cunt parècc paés indipendént. In situaziùn nurmai, viagià travèrs püssé paés el vöraress dì fà dumànda de vìsto e fà i cuntròll di passapòrt parécc vòlt.
946	geography	El canal del Mar Biaanc-Baltic el conlìga l’Ucean Artich al Mar Baltic, travèrs el Laach Onega, el Laach Ladoga e San Pederburgh, per la püpart via fiüm e laach.
182	politics	“A’l é essa important par la sallud publica e par la justizia penalla qe la lejislazion la sie emanada ‘l prima possibol”, ‘l g’ha diit ‘l portavos dol govern.
1288	politics	Ol document, segond la fœbia de notizie, a ‘l parlerà de disputa su i confin qe la Palestina vœl su ol basament dei confin inanz de la Guerra dol Medio Orient dol 1967.
1639	science/technology	I atòm ienn propi inscì pinìn che triliùn de lùr pudaresén stà in del pònt a la fin de sta fràs.
69	entertainment	La band la g’ha scancellad ol spetacoll a ‘l Maui's War Memorial Stadium, indove i g’harien de partecipar 9.000 persone, e la s’é scusada cond i fan.
12	sports	De recent ‘l perdud contra Raonic a ‘l Brisbane Open.
508	health	El destürbi da deficit d’atenziùn l’è “üna sindrom neurologìca cunt üna classega triàd de sintum distintìf chi inclüdén impülsuvità, destraibilità, iperatività e energìa in ecéss”.
1794	travel	Se te travèrset el Baltic setentriunàl in invèrn, cuntròla la posiziùn de la cabìna perchè traversà el giàz el fà un rumùr terìbil per i persùnn püssé cùlpii.
667	entertainment	Parècc bigliétt vendüü online sü sìt de astì cuma eBay o Craiglist ienn bigliètt park-hopper valìd püssé dì chi ienn staa doperà in pàrt.
127	entertainment	Molts dei lor scitur a i g’hann sœtad a vir-g una granda influenza su i paròdie de notizie de Jon Stewart e de Stephen Colbert.
1236	sports	Jancarlo Fisichella ‘l g’ha perdud ol controll de la sò maqina e ‘l g’ha fornid la gara pòc temp dòp qe ‘l é comenzada.
160	sports	Stewart, Gordon, Kenseth e Harvick a i completen i prime dex posizion dol Campionato dei Pillots con quater gare qe i callen a la fin de la seson.
1732	geography	La Sundarbans la ocùpa ün’area de 3850 km², de qual circa un tèrz l’è ocupàa da aree de aqua/palü.
1940	geography	Ün témp cità antìga de Smyrna, incö l’è un center cumerciàl modern, svilüpaa e pién de vìda, che el se truua dént üna baia grandisìma circundada de muntàgn.
37	entertainment	El show de la PBS ‘l g’ha vençud plu de do donzene de Emmy awards, nomà Sesame Street e Mister Roger’s Neighborhood a i g’hann fait mei.
726	entertainment	Ghè un sac de resturànt inturn al giardìn, e dopomesdì e de sìra ghèn despess cuncert gratìs dal gloriét centràl.
1507	science/technology	El sistéma de süpport pò vès virtual o reàl, in olter paroli, l’insegnant l’è üna fòrma de süpport ma anca la grafetìna animàda in Microsoft Office.
1318	sports	Dustin “Goldust” Runnels ‘l g’ha comentad qe “Luna ‘l ira pit mata coma me….forsben anc plussé qe me….g’ha vœi ben e la ma manqerà….spere qe la sie ind un pòst meior.”
379	science/technology	I fàas i ghen dumò parchè el lato de Véner (ò de la Lüna) che ‘l ciapa ‘l suu l’è Iluminaa. I fàas de Véner i suportén la teorìa del Copernicus che i pianét i van inturno al suu.
1237	sports	Ol sò compagn de team Fernando Alonso ‘l ira prim par la plu banda de la gara, ma ‘l g’ha duzud interompir-la despò ‘l sò pit-stop, probabilment par una rœda dedré qe ‘l ira malament piegada.
375	science/technology	El suu g’ha mia de crùsta cuma la Tèra ‘ndua te pòdet stà in pè. El suu l’è per intreg fàcc de gas, fööch e plàsma.
1736	travel	La grànd pàrt di distrètt ienn servii da picùi minibùs japonés chi ienn còmod e robüst.
534	travel	L’è pussibil che la forma püssé comün de türism l’è quela che la major part de la gent la culega al viagià: el türism de ricreaziùn.
48	sports	Ol sior Reid ‘l g’é ruvad a guidar la maqina dol A1GP Nœva Zellanda, Black Beauty, a una vellocitaa sora de 160 km/h par set vœlte in su ‘l pont.
246	politics	Dol indipendenza dol Pakistan dol govern britanic ind ol 1947, ol president pakistan ‘l g’ha nominat “ajent pollitic” par governar i FATA, qe eserciten un controll autonom asquas totall in su i aree.
1217	politics	A i sanzion internazionalle i g’han impedid l’aqisizion de nœv veicòi aerei.
1916	entertainment	Ancisseben i arcipelag de la costa e i lag plussé grónds i sien grónds asee per i yacht de tote le grossese, barche plussé picene o mei anc’mò un kayak a i dann la çanza de provar una esperienza diversa.
1192	health	Ol fotograf ‘l é stait trasportad a ‘l Ronald Reagan UCLA Medical Center, indove pœ ‘l é mort.
559	science/technology	I prutùn i ghan üna caréga elètrega pusitiva, inveci i neutrùn i ghan mia de caréga. I eletrùn i ghan üna caréga elètrega negatìva.
107	geography	Quand qe la capsulla la ruva apœv a la Tera e la va dent ind ol atmosfera, invers i cinqu dol matin (ora orientalla), se cres qe la farà su un spetacoll de lux par la jent de la Callifornia dol Nord, dol Oregon, dol Nevada e dol Utah.
549	sports	Naturalment, un mèzzfundista de prima clàss, un òmm che el pò bàtt i dù minüt, al ghà de vèch üna bùna velocità, ma la resistenza ghà de vèss cultivada a tücc i cùst.
1923	travel	Viaggià in reoplan pò vès ün’esperienza spaventùsa per i persùnn de ogni età e origìn, in manéra particulàr se i han mai vulà prìma o i han sperimentaa quaicòss de traumàtic.
126	entertainment	Al Gore e ol jenral Tommy Franks ellencaven in una manera de far sugura a i lor titoi preferits (qell de Gore ‘l é stait quand qe The Onion ‘l g’ha diit qe lu e Tipper a i eren dre a vir-g ‘l ses plussé bell de la lor vita despò de la sò sconfita a ‘l Electoral College ind ol 2000).
983	health	L’inflüenza di üsèi, o in manéra püssé furmàla inflüenza aviaria, la pò impestaa tüti dò i üsèi e i mamifer.
915	science/technology	Quai aplicaziùn in chésta categuria i pòden tradür anca tèsti in léngua furèsta sü segnài o oltri ogét in del mùnd reàl quand l’utent el pònta el smartphone vèrs quei ogét.
330	sports	Nugun de olter ‘l g’ha mai fait plussé partide o fait plussé gòl par ol club qe Bobek.
563	health	El stüdi l’ha scuprìt che la depressiùn, la pagüra e ‘l catastrufizzà i fàn da intermediàri tra duluu e disabilità a chi el patìss de lumbalgìa.
496	health	I chirurg i cugnussiven vari sedatìf di quai la murfìna che la vegnìva di estràtt dei suménz di papavér e la scopolamìna che la vegnìva del Giusquiam neghér.
919	science/technology	El fa risparmià danee rispét al comprà mapp növi per el GPS, o un dispositìf GPS autonùm o töll a noll da l’agenzia di machìn a noll.
1504	science/technology	Quand l’è staa del tüt tirà sü da animai che ienn mia umàn, el fiöö selvatèg el demòstra di cumpurtamént (cun limìt fiseg) che ienn quasi tutalmént cumpàgn a quei del animàl particulàr che ghe sta inséma, cuma la pagüra o indiferènsa ai umàn.
1422	politics	In tel 1683, i forz de la dinastìa Qing (1644-1912) i eren ciapà cuntròll di zoni custàl in tel ovést e nòrd de Taiwan e in tel 1885 i ieren declarà Taiwan pruìnsa de l’impér Qing.
202	geography	I precipitazion a i g’han rajunjud i 6.34 pollis a Oahu, qe i henn staits descrivuds coma “beneficiai”.
109	science/technology	La capsulla la narà a circa 12,8 km o 8 miglie a ‘l segond, assé par nar de San Francisco a Los Angeles ind un menut.
1521	science/technology	El sügeriss parfin che chèsti abilità in te l’intepretaziùn del cumpurtament umàn i pudaresén vèghei anca animai cuma ì càn dumèsteg.
1479	science/technology	Si en parla de determinismo tecnològico en g’ha düü grand pensèè: vün qe el svilùp tecnològico và mia drèè dumò a la coltùra e a la pulitica, e l’olter qe la tecnologìa l’è mia cundiziunàda da la societàà ma la se manifèsta dènt a ésa.
1163	politics	A i candidads a i pœden mandar rapresentants par vardar sora a tute i fas dol proces. Invers la sira a i vòts a i ven contads jó dei vollontare sota sorveianza e segond procedure specifiqe.
1696	geography	La grànd pàrt di isùli püssé picùi ienn naziùn indipendénti, o ligaa a la Francìa, e cognossuu cuma località de mar de lùsso.
866	travel	Se te viagét per la prìma vòlta in un paés in via de svilùpp - o in üna pàrt növa del mùnd - sotovalüta mia el posìbil shock coltüral.
1809	sports	I Paraulimpiàdi i se tegneran dal 24 agòst al 5 setember 2021. Un quai evént el se tegnerà in olter località del Japòn.
119	entertainment	Ol jœg a ‘l é basad in su la Segonda Bataia de Fallujah, una granda bataia intra i armade americane e qelle iraqene.
1175	sports	Par a i Springboks, ‘l g’ha metud fin a i cinqu sconfite vunna dre a ‘l oltra.
198	health	Apart par la fever e ‘l mal de golla, ma se sente ben e in forma assé par sœguetar ‘l me lavorar a distanza.
144	science/technology	“Qest ‘l vœ dir qe tut ‘l g’ha de vesser remetud a ‘l sò lœg” ‘l g’ha diit ol ricercador dol Rift Valley Research Service in Etiopia e un coautor dol studi, Berhane Asfaw.
1167	entertainment	A ‘l inizi ‘l spetacoll ‘l ira presentad nomà sul vegg sit radio internet TogiNet Radio, un sit qe ‘l sa focallizava sul radio talk.
908	science/technology	I societaa di media i disén mai el vèr sü la lùr funziùn, e i sustagnissen che l’è per “prevegnii la pirateria”.
1196	sports	Con nomà dixdòt medaie disponibii ind un dì, vergun pais a i g’henn minga ruvads a nar in sul podio dei medaie.
