index_id	category	text
1147	health	L’istituzion de caritaa Mangola, Medixine sensa Frontiere e l’Organizazion Mondialla de la Sanitaa ‘l g’hann diit qe ‘l é ‘l pejor focollare rejistrad ind ol pais.
1263	politics	Ol diretor de la publica accusa, Kier Starmer QC, ‘l g’ha rilassad questa matina una diqiarazion indove nonziava l'acusa de Huhne e de Pryce.
1847	sports	El scì l’è ün’atività de viàgg impurtànta cunt parécc apassiunaa, cognussuu a vòlte cuma “ski bum”, chi i prugramén vacànz intrég inturnu al scià in un sìt particulàr.
994	travel	Dumò üna quai cumpagnia di reoplan la offrìss amò tarìffi per lütu, che el scünta ün zig el prezzi de un viagg a l’ültim per andà a un füneràl.
927	science/technology	Fà vulà un drone visìn a un aeropòrt o sùra üna fòla l’è quasi sempr üna catìva idea, anca se l’è mia ilegal in de la tò zona.
811	sports	L’escursiunism l’è ün’atività a l’avèrt indùa se camìna in ambiént natürài, despèss sü sentee apòsta.
285	politics	La Letonia e la Slovaqia le g’ha tute e do ritardàt i procedure per nar dent ind el ACTA.
1342	science/technology	Ol jus de cavoll ol mœda collor segond de quant la sie acida basica (alcalina) la sostanza qimica.
1800	travel	Sü stràdi cunt giàzz e néf, la tegnüda l’è bàsa e te pòdet mia guidà cuma se te füdesset sü l’asfalt nètt.
1297	politics	La comission ‘l é staita la resposta di Martelly a i proteste anti-rejim qe g’iren in tut ol pais comenzade a otover.
1048	politics	A’l met in guardia qe nigun ‘l pœ garantir qe niguna azion in Iraq a qest punt la fermerà i lote setarie, la viollenza qe la cres o una slipada invers ol caos.
547	politics	La püssé grànda fòrza d’assalt de 2400 omén l’era traversaa el fiüm a nöf miglia a nòrt de Trenton, e dopu la s’era dividuda in dò grupp, vün cumandaa de Greene e vün de Sullivan, per lancià un atàch prima de la levada del suu.
1127	health	Fluke ‘l g’ha scrivud qe i sforz de vergun par inibir a i dòne de parlar de la sallud dei dòne a i g’han mina vud suces.
120	entertainment	L'ACMA ‘l g’ha pò anc descovrid qe, anc’isseben ol video ‘l fœdes stait trametud su ‘l Internet, ol Grand Fredell ‘l g’heva minga viollad i lex de censura de i contenuts online parqè i media a i eren minga staits metuds vià in su ‘l sit web dol Grand Fredell.
1113	health	I program par la consegna dei vacin ind ei aree storicament plussé colpide qest ann a I henn staits ritardats parqè a i g’eren minga assé de daner e par la bassa prioritaa apœv de oltre mallatie.
1442	politics	Datu che ghera üna respòsta limitada a ‘sta tàtica, la Germània la se speciàva üna respòsta simìl a la sò guéra sutamarìna senza restriziùn.
830	travel	In un quai tréno transnaziunàl gli ispeziùn ienn faa cunt el tréno in cùrsa e te ghe de vèch un document d’identità valìd quand te salisset sü vun di quei trén.
1824	travel	I viagiaduu dirètt in paés cunt üna tassaziùn pesanta ognitant i pòden risparmia üna quantità impurtànta de danee, in manéra particulàr sü prodòtt cuma bevàndi alcolech e tabac.
1533	health	Olter opziùn basaa sül biuritmo i prevedan de béf parécc liquìd prima de durmì (particularmént aqua o tè, ün diuretic famüs), qi ùblighen a levà sü per pisà.
1982	entertainment	Vardà i fiùr de sciresa, cognossuu cuma hanami, l’è staa pàrt de la coltüra giaponés da l’VIII secùl.
657	health	I giornàd parécc longhi de l’estaa i pòden causà prublemi per durmì a suficiénza e prublemi de salùt ligaa a quel.
948	travel	Sta sicür che quànd te sarà rivaa al pòrt, tütt el sarà pütòst òvvi. Te incuntraree oltri viagiaduu chi cerchen un passagg in barca e chi te diràn quell che i sann.
1892	travel	Si te turnet a cà dopu vès stà al’estar, te s’è abitüà a qela növa coltùra e t’é perdü quaj abitüdin de la coltùra del tò paìs.
1707	travel	Casablanca l’è vùn di pòst menu interessànt per fà spésa in tütt el Maroch.
1729	geography	La Sundarbans l’è la püssé grànd strìsa de mangròvia lituranea al mùnd, lònga 80 km (50 mi) da la còsta in de l’entrotèra del Bangladesh e de l’India.
1574	science/technology	Praticamént, tücc i compüter duperaa al dì d’incö ienn basaa su la manipulaziàn de infurmaziùn che ienn cudificaa suta fòrma de numèr binàri.
692	travel	L’Angkor Pass l’è necessàri per andà dént al templi, donca desméntega mia de purtàt dree el tò pasapòrt quand te see dirètt a Tonle Sap.
1155	geography	Tuts a i entrade dol andròt, qe a i henn ciamads “I sete sorelle”, a i g’han un diameter de 100 a 250 meter (328 a 820 pè).
1810	sports	Tokyo el sarà l’ünega cità de l’Asia a vèch uspitàà dù Ulimpiàdi estìv, si come l’era uspitaa i giög in tel 1964.
64	politics	La propòsta de lex orijinalla ‘l é stait scrivud jo dol ex sindec de San Paolo, Marta Suplicy. La propòsta de lex, despò vesser staita modificada, ‘l é or ind ei man de Roberto Jefferson.
1330	politics	A’l g’ha definid i vox “falocade pollitiche e stupidade”.
1448	politics	Anca tra ogni dinastìa ghera ün mumént instàbil de pruvinci dividuu. El püssé cognossü di sti periòdi l’era l’epòca di Tri Régn che l’era dürada 60 ann tra la dinastìa Han e quéla Jin.
636	science/technology	In de l’ann 1970, Raymond Damadian, dutuu e ricercadùr, l’ha scuprìt la bàs per doperà la risunanza magnetica cuma strüment per l’anàlisi médega.
1677	science/technology	Par esempi el contròl, la pianificaziùn e la programaziùn, la capacità de respùnd ai analisi e dumànd di clièent, e anca el recugnusimènt de la grafìa, vùs e fàcia.
1398	entertainment	Se t’é vardaa el film National Treasure, te pudarés pensaa che dedree a la Dichiaraziùn de Indipendenza gh’era segnada üna màpa del tesòr.
1605	travel	In sta spuléta de traspòrt dinamich tücc ienn in üna quai manéra culegaa e i suportén un sistèma de traspòrt basaa süi machìn privaa.
982	travel	Anca se te se dree a guidà dént la furésta subtropicala, al bàsta pooch segònd cunt i purteer dervì intant che te salisset sül veicùl perchè i zanzàr i vegnan dént inséma a tì.
366	science/technology	A ‘l orgen principall dol sistema cicollatore ‘l é ‘l cœr qe ‘l pompa ‘l sangu.
1651	science/technology	I teorii di cuntenüü ienn centrà sü la recèrca de quel che el motìva e el piàs a la gént.
941	science/technology	Dopu che te ciapà sü la man cunt la formataziùn e la revisiùn del web, dopu te pudarè fà sü el tò sìt web.
876	health	Per quei che i ghàn mia dimestichèza cunt i tèrmen médegh, i paròll infetìv e cuntagiùs i vören dì ròpp divèrs.
661	entertainment	La sò frequent representaziùn in de la müsega, film, leteratüra e coltüra populàr l’ha contribuii a fà cugnùss la cità e i sò monumént in tütt el mùnd.
1112	health	Ol govern ‘l g’ha prometud pò anc tant miion de fiallete de vacin dol encefallit, qe ‘l aiderà a preparar i ajenzie sanitare par ‘l an qe vegnerà.
1329	politics	Cuomo, 53 agn, ‘l g’ha ninzad ol sò govern a ‘l inizi de qest an e ol mis passad ‘l g’ha firmad un disegn de lex qe ‘l fa divegnir legai i sposallezi intra persone dol medem sès.
1053	politics	La siora Kirchner la g’ha nonziad la sò intenzion de candidar-s coma president a ‘l Teater Arjentin, ol istess lœg indove la g’ha comenzad la sò campagna 2005 par ol senad come member de la dellegaziona provinçalla de Buenos Aires.
1948	travel	Regordéss che in pratega te se dree a visità un sìt de fòsi comün e anca un sìt che per üna gràn porziùn de la populaziùn mundiàl el ghà ün’impurtanza che la se riéss quasi mia a mesürà.
923	science/technology	L’accèss a ‘sti servìzzi l’è despess travérs un numer vért che el pò vès ciamaa de la grànd pùrt di telefùn senza pagà.
173	science/technology	Despò qe ‘l fond de la mar a ‘l é stait mapad, ol rellit a ‘l é stait trovad cond l’utillizazion de un ROV.
1087	science/technology	Coma la lüna la g'a öna attraziù sura la tèra e la fa olsà sö e maree, zé la Via Lattea la g'a öna forsa sura la galassia dol Sajitario.
1328	science/technology	A i sienziats a i speren de capir coma a i se formen a i pianets, in particollar coma la s’ é faita su la Terra, siend qe dei comete a i henn borlade in su la Tera tant temp indré.
914	science/technology	I app che i tradùsen tèst in témp reàl - aplicaziùn che ienn bùn de tradür deperlùùr segmènt intreg de tèst de üna léngua a l’oltra.
1341	science/technology	Qest a ‘l é ciamad pH de una sostanza qimica. Ta pœde far su un indicator cond ol jus de cavoll róss.
336	entertainment	A la fin, ol grupp de ball turc Fire of Anatolia ‘l g’ha ballad ol spetacòll “Troy”.
1005	entertainment	A la fin dol 2017, Siminoff a ‘l é comparud ind su ol canall tellevisiv de shoping QVC.
1671	science/technology	El ligàm tra patologìa del scervèl e cumpurtamént la sustagniss i scienzaa ne la lùr recerca.
1597	science/technology	Hershey e Chase ieren duperà i fàgi, o virùs, per impientà el lùr DNA dént un batéri.
1008	health	Un mes’ciòt de antibiotic, ZMapp, in primera ‘l someava dar dei spere, mò studi formai a i g’han demostrad qe ‘l g’ha minga l’eficaça qe ‘l se crediva ind ol inibir la m.
1313	health	Beneman qe ‘l lavorava ind ol ospedall, Liggins ‘l g’ha ninzad a indagar in sul part prematur durant ol sò temp liver.
665	travel	La visita “tìpica” l’è vulà a l’aeropòrt internaziunàl de Orlando, ciapà un bùs vèrs un hotel Disney sül sìt, passàà circa üna setimana senza mai andà via del sìt Disney e turnà a cà.
242	geography	Oltre a trasportar tré importants struments scientific, la sonda lunara portava pò anc ‘l imajin de la bandera nazionalla indiana, dipinjuda su tuts i lats.
383	politics	Sta flòtta l’era guidàda da Olaf Tryfvasson, en nurveges qe l’ghera ambiziun de riclamär el sò pais da la dominazion danes.
954	travel	Turkish Airlines la vùla vérs 39 destinaziùn in 30 paés african, dal 2014.
979	travel	I pòden vès periculùs se el viagiaduu va dree al miràgg, e al trasà energia impurtanta e aqua vanzàda.
217	sports	Ol vœt a ‘l g’ha de vesser ratificad de tut la CIO a la sò riunion anualla a Copenhagen.
1036	travel	Durant ol sò viaj, Iwasaki ‘l g’ha avud problem in tante ocazion.
1583	health	La SM l’è la malatìa che la culpìss el sistéma nervùs centràl, che l’è fà del scervél, del midùl spinàl e del nèrv òteg.
1063	sports	A i batidor de order intermediare, Sachin Tendulkar e Rahul Dravid, a i hann jugad ben a i han faits una partnership de cent run.
458	science/technology	Per 'sta reson i obietìf zoom ecunomich ienn dificìl de duperà in cundiziùn de scarza lüs senza el flash.
831	travel	Süi trén de nòcc cunt coccèta, i passapòrt pòden vès ritiraa dal controlor inscì da mia intarumpar el sònn.
220	sports	Nonostant i sò comments a’l g’ha diit qe ‘l soporterà i concorents britanic ind ei jœg ollimpic qe a i se tegneran a Londra in tel 2012.
1119	health	Despò dol incident, Gibson a ‘l é stait portad a ‘l ospedall, mò ‘l é mort poc temp dòp.
1650	geography	Ghe pudarès vècch püssé màr in del lato visin perchè la crùsta l’è püssé fìna. L’era sta püssé facìl per la lava vegnì sù in superfiss.
813	sports	Per ün’escursiùn de un dì lùng un sentee facìl ienn necessàri picùi preparatìf, e ogni persùna moderatament in fùrma la pò partecipà.
1353	science/technology	A’l ga vœ un raz jigant avolt plussé qe 100 pè par metir un satellit o un tellesòp ind ol spazi.
925	science/technology	Se l’è mia permetuu de fà ‘na fòto a vargòt, alùra te ghavaret gnaa de pensà de registràc un video.
1164	science/technology	ASUS Eee PC, lançad inanz in tut ol mond par rexon de resparmi in su i costs e in su i funzionallitaa, a ‘l é divegnud un argoment de grand importanza ind ol Mis dol IT de Taipei 2007.
273	health	A g’é pagura qe i pazient a i pœderian sœtar a infetar plu persone ind ol far i lor lavor de tuts i dì se i sintom de l’influenza a i henn linjer.
947	geography	El Laach Onega l’è anca conlìgaa cunt el Volga, donca vegnì del Mar Caspio tramìt la Rüssia l’è ancamò pusìbil.
1191	politics	Bachmann, qe la g’ha vençud ‘l Ames Straw Poll a avost, la g’ha decidud de ritirar-s.
1070	politics	De quand qe ‘l govern federall ‘l é intervedud e ‘l g’ha ciapad sota ‘l so controll ol finanziament dol Mersey Hospital a Devonport in Tasmania, ol govern statall e vergun parlamentar federall ‘l g’hann criticad qesta azion coma una strambalada ind ol prelude a i ellezion federalle qe a i sarann faite par november.
497	health	Ieren diventaa espert de amputaziùn per salvaa i paziencc de la cancrèna, e anche de làcc emustatég e pìnzi arteriùs per arginà el flüss sanguineo.
1914	travel	La Finlandia ‘l é una bella destinazion se ‘l ta piaz nar in barca. La “tera dei milla lag” la ga pœ anc plu de milla isle ind ei lag e ind ei arcipelag de la còsta.
360	science/technology	L’imajin qe la ven despò la fa veder a i atom qe a i manden fœra foton. Oviament in realtaa a i foton a i henn tant plussé picegn qe ind ella imajin.
1549	politics	Intel istess mument, la marina tòdesca che la duperava soratut U-boats, la pruvava a fermà chèsto trafeg.
186	travel	Ol bus ‘l ira dre qe ‘l nava invers a Six Flags St. Lous in Missouri, parqè la band la g’heva de sonar denanz a una platea plena.
598	science/technology	Robert Hooke, un biològ inglés, cunt un microscopi l’era veduu picùi quadraa dént al sughér.
163	travel	Un caçamine de clas Avenger, la nav ‘l ira dre a nar a Puerto Princesa in dol arcipellag de le isle Palawan.
537	travel	Si l’obietif de üna visita a ün sìt particulàr l’è de cugnùss la sò storia e coltüra, alura sto tip de türism l’è cognussuu cuma türism coltüral.
365	science/technology	Quest ‘l sa g’ha de far-l parqè l’elletricitaa qe la va dent ind ella presa indove la sa trova la parta de metall de la lampadina la pœ dar-t una possant shock elletric se ta toqe ol dedent de la presa o ol çoc metallic de la lampadina quand qe ‘l é anc’mò in part ind ella presa.
918	science/technology	Doperà i app di navigaziùn GPS sül tò smartphone el pò vès la manéra püssé economega e còmoda de navigà quand te se föra del tò paés.
944	travel	El pò vès anca una büna manéra per tirà ‘l budget e permèt un soggiorn püssé lung de üna quai pàrt, perchè parécc laurà de volontari i offrissen mangià e alògi, e quaivün anca üna paga piscinina.
1856	travel	Fin a quand te rèstet dént chésta zona, in generàl te pòdet traversà i cunfìn senza passà amò travérs el bànch del cuntròll di passapòrt.
10	politics	Invers a i 11:29 la protesta la s’é spostada su Whitehall, de illà de Trafalgar Square, arent a ‘l Strand, e l’é passada arent a Aldwych e Kingsway invers a Holborn, indove ol Partid conservador a’l tegniva ol Forum de Prumavera ind ol Grand Connaught Rooms hotel.
893	geography	Chésti ienn mia tròp svèlt, donca el percùrs ghà de fà üna lùnga deviaziùn inturn ai Muntàgn Transantartìch per pudè rivà a l’altipian.
282	politics	A g’é staite di proteste pœ anc a Paris, a Sofia in Bulgaria, a Vilnius in Lituania, a Valeta in Malta, a Tallin in Estonia, a Edinburg e a Glasgow in Scozia.
1362	science/technology	A i ròs de lion a i se comporten in manera compagna a qella dei ròs de lov, animai qe a i se insomean dolbon tant a i lion (mò a i henn minga dei grands fellin) par manera de comportar-s e pò anca pericollos fes par a i animai qe lor a i cacen.
530	sports	El gòlf l’è ün giög indùa i giügaduu i dopéren di màzz per culpì i bucìn e fali andà dènt i büs.
730	travel	Chèsta comünità genüina la se truua a Howe Sound apéna föra Vancouver, e l’è facilmént acessìbil cunt taxi d’aqua de linea chi partén de Granville Island in del center de Vancouver.
840	entertainment	Tutavia, quasi tücc i casinò qui repurtaa i servén de béf, e parécc de lùr i ghan march de intratenimént (principalmént quei grànd chi ienn sübit tutinturna Albuquerque e Santa Fe).
698	travel	L’Ecuador necessita che i citadìn cubàni i riceven üna lèttra de invìto prima de vegnì denter l’Ecuador tramìt aeropòrt internaziunai e pónt d’entrada de fruntiera.
1826	travel	Se te se mia abitüaa a guidà sün di straad de campàgna, dopéra el tò bùn senso: l’è pién de salìt ripìd, strénci, e cürvi strécc.
339	health	A’l é stait debòta tendud dol personall medic qe ‘l sta aprœv a la pista e trasportad ind un ospedall locall indova pœ ‘l é mórt.
226	science/technology	La sò esistenza ‘l é cognossuda nomà par i sò efets in su la espansion dol univers.
24	sports	A’l g’ha signad 2 gòll e 2 assist ind ella vitòria de 5-3 de Washington su i Atlanta Thrashers.
1117	entertainment	Ol sò 1000esim francoboll ‘l é stait ol magnific “I grands azion dei Re de Svezia” de David Klöcker Ehrenstrahl ind ol 2000, qe ‘l é stait metud ind ella lista dei Guinness dei recòrd”.
1792	entertainment	Regòrdess che anca se la müsica di pàlch principài la pò vès finìda, i ghe pudaresen vès seziùn del festivàl che i continueràn a fà müsica fin a tàrda nòcc.
674	travel	Andà dènt l’Afrìca Meridiunàl cunt la machìna l’è üna manéra meravigliüsa de vedé tüta la beléza de la regiùn e anca rivà ai sìt che ienn mia süi nurmài vìi türistegh.
1098	health	Tutavia, la percentualla de XDR-TB ind ol intreg grup de persone cond ella tubercollos ‘l sumea vesser anc’mò bass; 6.000 dei 330.000 totalle infetade in tut in Sud Africa.
892	travel	L’è név cumpatàda cunt cràp che ienn staa impienii e segnalaa da banderìn. El pò vès dumò percùrs cunt tratùr apòsta, slìti de traino cunt carbürant e scòrti.
380	science/technology	Pö, un quai an dopu in tel 1639, un astrònom inglés ciamàà Jeremiah Horrocks l’ha uservaa il transet de Véner.
921	science/technology	Ogni negòziett l’è pien de varietà sched telefòneg prepagaa che i pòden vès doperaa di telefùn püblich o nurmài.
65	politics	A i manifestants a i speren de vir-g una petizion de 1,2 miion de firme da presentar a ‘l Congres Nazionall a november.
912	science/technology	Ghè anca mia bisùgn de otegnì un numér locàl de la comünità indùa te vivet; te pòdet otegnì üna conessiùn internet satelitàr in di zòni selvàdeg de Chicken in Alaska, e scernì un numér che el dìs de vès de la solìva Arizona.
987	geography	‘Sti altipian ienn despèss ciamaa “vidde” che el vör dì un spàzi avèrt senza albér, üna piàna senza cunfìn.
819	travel	Quand te viagét, specés mia che i ròpp ienn cuma “a cà”. I cumpurtamént, i légi, el mangià, el trafèg, l’alògi, i standàrd, la léngua e oltri amò, i se diferenzieràn in üna certa mesüra da indùa te campét.
798	travel	Dà i copi de la pòlizza/cuntàtt anca ai tò cumpàgn de viàgg e ai parént o amìs a ca che i vören iüta.
1035	science/technology	Plussé picegn a ‘l é ol number de Rossby, demanc ativa l’é la stea aprœv dei inversion magnetiqe.
1228	entertainment	Famos cantor in tut ol pais a i g’han cantad i bhajan, o canzon devozionai, a i pé de Shri Shyam.
1039	science/technology	Çò ‘l permeterà de vesser compatibol pò anca cond i version 802.11a, 802.11b, 802.11g, a condizion qe la stazion de bas la g’habia do radio.
1375	science/technology	I piante a i fann su ‘l ossijen qe drovem par bofar e lore i ciapen l’anidride carboneca qe a i uman a i buten fœra.
772	entertainment	Üna féra mundiàl (comünement ciamàda esposiziùn universàl, o dumò Expo) l’è un grànd festìvàl di àrt e di sciènsi.
735	travel	Sirena l’è l’ünega staziùn di ranger che oltra al campégg la ofrìss alògi dént un dormitòri e pàst còldi. La Leona, San Pedrillo e Los Patos i ofressén dumò campégg e mia servìzi de ristoraziùn.
1350	science/technology	Quand qe te ciame vergun qe ‘l é miiaia de miia delonj, ta sé dre a doprar un satellit.
1419	geography	Per el grüp de isùl che el Japòn el gha, l’è despèss indicaa, geugraficamént, cuma “arcipelag”
1601	travel	El türism basaa sü la natüra el ciàma i gènt interesaa a visità aree naturài cun l’intent de godé del paesàgg, cunt plànt e animài selvadègh.
1812	sports	I politich de cancelaziùn i cambién, ma de la fin de marz la grànd part di politich de cancelaziùn causa Covid i rìven mia fina al lüi 2020, quand ienn staa prugramaa i Ulimpiàdi.
270	sports	Da allora, ol brasiian ‘l g’ha jugad 53 partide par ol club in tute i competizion e ‘l g’ha fait 24 gòll.
1920	travel	El vör dì che te pòdet visità la cità storega per un par de dì intrég intant che de nòcc te turnét a durmì sü la nàf.
1431	science/technology	Parécc furmàt populàr (ad esempi la faméja di formàt APS) ienn istèss o se vesinen tànt a sto rapòrt de aspètt.
832	travel	Anca la registraziùn la pò vès necessaria per el procèss del vìsto. In un quai paés, te ghe de registrà cunt i autorità locai la tòa presenza e l’indirizzi induà te sugiurnet.
1769	politics	Lùng la lòta per l’indipendénza organizada dal müimènt Mau, ün’adünanza paciféga in de la cità l’era resultàda in de l'ucisiùn del capp suprém Tupua Tamasese Lealofi III.
130	politics	A ‘l anunziazion de incœ ‘l g’ha pò anc estedud ‘l impegn dol govern, ciapad a marz de qell ann qi, a finanziar caroze extra.
955	travel	Se te ghè oltru témp per viaggià, cuntròla quant l’è la tòa tarìfa totàl vérs l’Africa respèt a la tarìfa per el gìr del mùnd.
47	sports	Jonny Reid, copillota dol team A1GP Nœva Zellanda, incœ ‘l g’ha fait la storia cond la sò guida plussé sperta in su ‘l pont de 48 agn dol port de Auckland in manera legalla.
1038	science/technology	Ol standard 802.11n ‘l funziona su tute e do i frequenza 2.4Ghz e 5.0Ghz.
1268	health	L'arma de Uka la g’ha fallid beneman qe puntava a’ l cò de un quint òm. Schneider ‘l g’ha semper un dœll, orbeza de un œgg, una sezion dol crani la g’é plu e una mostas ricostruida in titani.
1418	geography	El Japòn el gha quasi 7000 isùli (la püssé granda l’è Honshu) chi la rénden la sètima isùla püssé granda del mund!
1899	entertainment	I scénn ienn mustraa sun di piràmid e i vàri piràmid i vegnén ilüminaa.
272	health	A’l g’ha sotollinead qe vergun studi a i par dimostrar qe un mal ol g’ha de diventar demanc letall inanz de pœdir causar un’epidemia globalla.
943	travel	Vìf e fà volontariaa in un paés furèst l’è üna bùna manéra de cognoss üna coltüra diferénta, incutrà gént növa, cognoss te medem, vèch un séns de prospetìva e perfìn quistà nöf cumpetenzi.
1201	health	I soldats in mission per le Nazion Unide, qe ‘l é hen ruvads a Haiti despò ‘l teremòt del 2010, a i hen stait encolpads de avir spandud la mallatia. La mallatia ‘l é encomenzada pròpi deprœv del camp dei soldats.
267	science/technology	Ol proces a ’l é continuad in Virginia parqè ‘l é la sed del principall fornidor de servizi Internet AOL, la societaa qe ‘l ha inzigad i acuse.
1708	travel	Inturn a la végia Medina l’è facìl truvà pòst chi i vendén prodoti maruchìn tradiziunài, cuma i tagìn, ceramìch, ròba in pèll, narghilè e üna grànd varietà de barlafüs, ma l’è tütt per i türist.
928	travel	Al dì d’incö el viaggià in reoplan l’è de rar prenutaa sübit tramìt cumpagnia aerea senza prìma cercà e cunfruntà i prezzi.
1391	geography	In tel clima còlt del Medi Oriént, la cà l’era mia inscì impurtanta.
1229	entertainment	Ol cantor Sanju Sharma ‘l g’ha tecad a la sira e g’hé vegnud dre Shankar Choudhary. A’l g’ha pò anc esordid ol chhappan bhog bhajan. Ol cantantor, Raju Khandelwal a’l ira dre a nar-g dre.
586	science/technology	Sti telescòpi duperàven üna combinaziùn de dò lent per fà cumparì i ogèt luntàn püssé visìn e püssé grànd.
1695	geography	Quand se pàrla de animài selvàdegh, el Madagascar l’è el püssé grànd e l’è lü stèss un continént.
802	health	A lùng andà i pusìbil cunseguenzi del béf tròp i pòden vèss dàgn al fidig e anca el diventà guèrcc e ‘l crepà. El pericùl putenziàl al créss quand se consüma alcool fà de sfròs.
1881	politics	La volontà di govérn de rilascià passapòrt cunt el genàr mia specificaa (X) o documént agiurnaa per corispùnd a un nòmm e genàr desideraa el pò varià.
1379	science/technology	I sò ganass i ghen 70 dènch güz e alter dènch dent al tècc de la buca. Te podet mia scapà quand la te ciàpa.
1550	politics	Se gli aleaa i avesen falìt, l’è prubabil ch i tòdesc i saresen sta bùn de conquistà la Gràn Bretagna cuma l’aveva facc cun tel rest de l’Euròpa.
333	entertainment	A l’é staita seguida de la Istanbul State Symphony Orchestra, una band de Janiser, e dai cantor Fatih Erkoç e Müslüm Gürses.
719	geography	La Republéga duminicana (in spagnö República Dominicana) la se truva in di Caraibi, sula metà a est de l’isùla ciamàda Hispaniola qe per metà l’è anca de Haiti.
1780	travel	Tüt l’ann i fàn tànti gìr a la bariéra curalìna, e gli infortüni sü la bariéra deriàt de ‘sti mutìf ienn ràr.
