index_id	category	text
431	geography	La Türchia l’è circundada di maar sü tri lati: el Mar Egèo a ovést, el Mar Negro a nòrt e il Mar Mediterani a süd.
403	science/technology	Al princìpi de la guèra i viagiavén quasi sempar su la superfìss del mar, ma cun tel svilùp di radar chi vegniven sempar pü precìs, i sutumarìn i duvevan per forza andà suta l’aqua per evitär de fass vedè.
1592	science/technology	Cunt el declìn de la conossénsa del gréch, l’ocidént el s’era truvaa separaa di sò radìs gréch filosofég e scientìfég.
993	entertainment	Tutavia, i ghann un divérs tip de belèza e fascin d’inverno, cunt parécc staziùn colinar cunt üna bùna quantità de néf e chi offrissen atività cuma el scì o lo snowboarding.
755	entertainment	Chésti hotel ieren indùa i alugiàvén i sciùr e i persùnn famùs del témp, e despèss i ghaveven cüsina refinàda e movìda.
1936	politics	In tel 1994, ‘sto conflìtt l’ha purtaa a la formaziùn de l’auto proclamada Republega de la Transnistria in de la Moldavia orientàl, la qual la ghà el sò govern e valüta propi ma l’è mia recognossuda de nissün di staa member di Naziun Ünii.
1205	health	Daniell Lantagne, un espert de epidemie dei Nazion Undide, a’l g’ha declarad qe la malatia l’é ruvada per colpa dei soldaits del ONU.
1692	geography	Grànd aree püssé a nòrd ienn mia tròpp abitaa e an quaivüna l’è tèra selvàdega quasi mia abitada.
280	politics	I organizador de la protesta i hann diit qe circa 100.000 persone a i henn venude a protestar in cittaa todesqe coma Berlin, Collogna, Amburg e Hannover.
247	politics	Quests ajents a i henn responsabii par dar servizi governativ e judiziari segond ‘l articoll 247 de la costituzion pakistana.
1439	politics	Sübit dopu che ienn s’ciupà fö i ustilità, la Grand Bretàgna l’ha intraprés ün blocch navàl de la Germània.
1239	entertainment	“A’l é tant bella e la canta pò anc ben assé” ‘l g’ha diit segond una trascrizion de la conferenza stampa.
743	geography	I Isùli Cook i ghàn mia de cità ma ienn fà de 15 isùli divérsi. I principài ienn Rarotonga e Aitutaki.
18	politics	A g’henn staite proteste in tut ol mond, diferents procediments penai, i capi doi goèrgn de Islanda e Pakistan a i s’henn tuts e du demetuds.
1344	science/technology	A i ion idrogen a i henn proton qe a i henn stait strepads a i elletron (siend qe a i atom de ifrojen a i henn faits su de un proton e de un elletron).
688	travel	I visitaduu cunt pòch témp duaresén passà el lùr témp in oltri pòst.
556	science/technology	L’atum el pò vèss cunsideraa vun di elemènt costitutif fundamentai de tüta la matéria.
1645	science/technology	L’è cuma rüzzà un car pesaant sü per la colìna. Si se spartìss amò üna vòlta el nücli, alùra el làssa andà üna pàrt de quela energia.
907	science/technology	Normalmént i offrissen üna majùr larghèza de bànda e üna meiùr qualità de servìzzi. Ienn critografaa e donca difficìl de spià.
1071	politics	Ma ‘l Prim Minister John Howard ‘l g’ha diit qe ‘l at ‘l ira nomà par tutellar i struture dol ospedall dol vesser declassade dol govern de la Tasmania cond una donazion de 45 miion de dollar austraian plussé.
555	sports	I atléti pudaressen sentì che i preferissen üna ròba a l’oltra anca quand la furniss mia de resultaa reài.
1203	health	Inanz qe i ruvassen i soldats, ‘l ira del 1800 qe Haiti la g’heva minga dei problem cond ela mallatia.
58	politics	La pollizia la ha diit qe Lo Picccolo ‘l g’iva ‘l vantaj parqè ‘l ira stait ol aidant plussè important de Provenzano a Pallerm e la sò plu granda esperienza la g’ha fait vencer ol rispet de la jenrazion plu vegia de bòss beneman qe i circaven de nar dre a la stratejia de Provenzan de star ‘l plu qiets qe ‘l se pœdiva beneman qe i spandivan la lòr ret de poder.
1764	travel	Tègn anca a mént che i uduu i atirén i ùrs e olter animài selvàdegh, donca evita de purtà drè o cöös mangià cunt uduu fòrt e tégn nèt el càmp.
195	sports	Massa ‘l sarà fœra dei jœg par olmanc ol rest de la seson dol 2009.
1785	travel	Prenutà per témp el dà ai viagiatùr la tranquilità de vèch un pòst indùa dormì quand i rìven a destinaziùn.
600	science/technology	I elemént e i cumpòst i pòden spustass de un stat a l’olter e mia cambià.
553	sports	La cùrsa a média distànza l’è un spòrt pütòst ecunomich; tutavia, ghè di idei sbaiaa süi pòcch pèzz de equipagiamént che i ocorén per partecipà.
1720	geography	El pàrch l'è grand 19.500 km² e l’è spartì in 14 ecozòni, cunt ognüna che la difénd animài selvàdeg divèrs.
1622	geography	El Rio di Amazzoni l’è el segùnd fiüm püssé lòng e el püssé grànd de la Tèra. El traspùrta püssé de 8 vòlt l’aqua che el traspùrta el segùnd fiüm püssé grànd.
1441	politics	La Grand Bretàgna l’era minaa i aqui internaziunài per impedì a tücc i naf de entrà in seziùn intrèch de uceàn, e l’era causaa pericùl anca per i naf neutràl.
566	health	La vìsta, o el podè vedè, la dipent dai orghén sensuriai del sistèma visìv o öcc.
1515	science/technology	Le caratersitiqe distintive de l’Interntet le mena a oltre dimension de utilisazion e de gratificazion.
585	science/technology	Tutavia, i prìm vér telescòpi ieren sta fà sü in Euròpa a la fin tel 16esim secùl.
1689	geography	Ottawa l’è la capitàl meravigliùsa del Canada indùa se parlén dù lèngui e che la ghà üna serie de galerì d’art e de müsei chi i mustrén passà e presént del Canada.
1256	health	La composizion dei cristai ‘l é istessa a qei qe ‘m g’ha trovad ind ei urine dei animai mórts quand qe i henn staits comfrontats cond la spettroscopia infrarossa (FTIR).
60	science/technology	Ol CEO de Apple Steve Jobs ‘l g’ha desvellad ol dispositiv meneman qe ‘l nava su in su ‘l palcosenic e trad fœra ‘l iPhone de la sacocia dol jeans.
32	sports	Quand qe i auto devant de Alonso i g’han fait reforniment cond ella safety car, Alonso ‘l é nait su in classifica e ‘l g’ha vençud la gara.
1411	politics	Lung la Guéra Rivoluzionària, i tredèss staa i eren furmaa per la prìma vòlta un guverno centràl debùl — el Cungrèss l’era l’ünic cumpunènt — suta i Articui de la Confederaziùn.
13	sports	Nadal ‘l g’ha otegnud l’88% de punt nets ind ella partida e ‘l g’ha vençud 76 punts ind ol prim servizi.
1941	travel	I straad laarghi, i edifìzzi cun faciàdi de véder e i modern center cumerciài ienn pién di técc tradiziunài cunt i cóp ròssi, el mercaa del 18esim secùl, i antich moschee e gési, anca se la cità la ghà ün’atmosféra püssé de l’Europa mediteranea pütost che de la Türchia tradiziunàl.
732	sports	Whistler (1.5 ùr de machìna da Vancouver) l’è càra ma ben cognossuda per i Ulimpiadi Invernài del 2010.
871	entertainment	Impienìss la tò cà de cafè inténs de matìna e de camamela per quietàss de sìra.
886	geography	El Antartid al’ é ‘l sit plussé freg de la planeta, e a’l encercola ‘l Pol Sud.
362	science/technology	Despò de centiner de ore qe la va ol fillament de la lampadina a i se bruxa e la lampadina la funziona plu.
1578	health	Cuntròla l'eticheta per istruziùn specifèg de pront socors de chél specifèg velén.
996	travel	In tücc i càs, te ghè de prenutà par telefùn diretamént cunt la cumpagnia.
197	health	I condizion dol president a i henn stabii, anc’isseben ‘l serà islad a cà par divers dì.
460	entertainment	Quasi tuti i television ien fà per piasè a tücc.
154	geography	Dei circa 24.000 meteorits borlads jo in su la Tera, nomà circa 34 a i henn staits verificads vesser de orijin de Mart.
1160	politics	Dòp qe a i funzionari a i g’hann verificad ‘l identitaa dol elletor, lu ‘l buta la busta ind una urna e ‘l signa jo la sqeda elletoralla.
1223	entertainment	A i g’hann vud de scancellar ol tour despò qe ‘l cantor Steven Tyler ‘l s’é fait mal dòp vesser borlad jó beneman qe ‘l se esibiva ‘l 5 de avost.
54	politics	Peter Costello, tesorer austraian e ‘l òm qe probablement ‘l serà despò de John Howard ‘l leader dol partit liberall, ‘l g’ha dait ol sò suport a ‘l industria nucleara in Austraia.
7	politics	La protesta ‘l é ninzada circa a i 11:00 de ‘l ora localla (UTC+1) a Whitehall, deprœv a l’entrada sorveiada de la pollizia de Downing Street, la residenza ufiçalla dol Prim Minister.
1010	sports	La USA Gymnastics la sostegn la letra dol comitad ollimpic dei Stats Units e la tœ ‘l besogn asollud de la famiia ollimpica de promovir un ambient sugur par tuts i lor atlets.
1174	sports	Ol puntej finall a ‘l é stait una vitoria de un punt, 21 a 20, e çò ‘l g’ha metud fin a la serie de 15 vitorie vunna dre a l’ oltra dei All Blacks.
1202	health	Segonda la lex, le scorie del camp dei Nazion Unide a’l é minga stait sanificad in manera coreta e inçì a i bater a i hen naits dent ind el tributari del flum Artibonite, vunn dei flum pussé grónds de Haiti.
958	travel	Ghè mia ün’aleanza di cumpagnii de reoplan che la viaggià in tücc trii i ucean de l’emisfér austràl (e Skyteam la ghà nissüna traversàda).
354	science/technology	La lama de un patin de giaç modern la g’ha un dopi bòrd cond una cavitaa concava intra de lor. A i do bords a permet de sta plussé tecads al giaç, infina quand qe ‘l é inclinad.
505	science/technology	I sit ienn na bùna roba e i te lasèn urganizzàr üna pagina cun blog, videu, futugrafii e quant olter.
1333	science/technology	A’l dovra la tecnollojia satellitara impé de la vegia tecnollojia qe dovrava radar a terra par permeter a i controllor dol trafic dei reoplan de catar fœra i reoplan con plussé precision e de fornir a i pillots informazion plussé acurade.
1173	sports	Ol Sudafrica ‘l g’ha vençud a i All Blacks (Nœva Zellanda) in una partida de rubgy dol Tri Nations a ‘l Roial Bafokeng Stadium de Rustenburg in Sudafrica.
945	travel	I vichìng i doperaven i còrs d’aqua rüssi per rivà al Mar Negher e al Mar Caspio. Pàrt de sti percùrs i pòden vès ancamò doperaa. Cuntròla la pusìbil necesìta de permèss speciài, chi i pòden vès dificil de otegnì.
1012	sports	La USA Gymnastics la sostegn una investigazion indipendenta qe la pœderia far vegner a la dì coma violenze de inci grande proporzion, descrivude in manera inci corajosa dei soravissude de Larry Nassar, i pœden vesser minga staite notade par inci tant temp e la ciapa tute i necessarie e juste misure de cambiament.
712	travel	Püssé de 60 nàf da croséra i solchén l’aqua di Galapagos, cunt dimensiùn da 8 a 100 passegér.
1654	science/technology	Dù famùsi teorii di cuntenüü ienn la teorìa de la Gerarchìa di Bisùgn de Maslow e la Teòria di Dù Elemènt de Hertzberg.
76	politics	Anc’isseben, ‘l g’ha ribadid la sò precedent afermazion qe Roe v. Wade l’ira la “lex stabill ind ol pais”e sotollinead l’importanza de sentenze coerente de la Cort Suprema.
637	science/technology	Quatér ann dopu l’era sta concéss un brevet, che l’era el prìm brevet al mùnd emetü in del càmp de la risunanza magnetica.
1694	geography	Gl’isùli de l’Afrìca Orientàl ienn in del’Ucean Indian al larg de la còsta de l’Afrìca.
1559	travel	El prìm mèzz de trasport cognussuu l’è stà caminà, i uman i han cumincià a caminà drizz dù miliùn de ann fa con l’arivo dell’Homo Erectus (che il vor di l’omo drizz).
679	geography	Victoria Falls l’è üna cità in de la pàrt ocidentàl del Zimbabwe, passà el confìn da Livingstone, Zambia e visìn al Botswana.
1049	politics	Ol Rapòrt ‘l teca cond una suplica a un dibatit ciar e franc e la formazion de un consens ind ei Stats Units in su la pollitica invers ol Medio Orient.
557	science/technology	L’è ün’entitàa parécc cumplèsa che la cunsìst, segùnd el mudel semplificaa de Bohr, de un nücli centràl cun di eletrùn che i ghe orbitén inturno, in üna quai manéra simìl ai pianéti che orbitén inturno al suu - varda la Figüra 1.1.
194	sports	Ol brasiian ‘l g’ha ciapad una greva ferida a ‘l co dòp un incident durant ol Gran Premi ungeres dol 2009.
1103	science/technology	I resultats dei analis de plotaj a i serann postade ‘n sœ un sit del web.
1009	health	Ind ol test PALM, ZMapp a’l é stait drovad coma contròll, ‘l saria a dir qe a i sienziats a i ‘l han drovad coma basament e a i hann comparad a i olter tré trataments a quest qi.
20	politics	Hsieh ‘l g’ha diit qe durant i ellezion Ma la pœderia fœbiar dol pais ind un period de crisis.
1700	travel	Dònn: l’è racumandaa a tüti i dònn chi i viagén de dì che ienn maridà, senza mia considerà el stato civìl vèr.
1673	science/technology	El rivà de növi tecnulugii ghe permét de vedè e studià i strütür e i procèss del scervèl che ieren mai staa vedüü prìma.
911	science/technology	Perchè i ciamaa ienn fàcc via Internet, l’è mia necessari de doperà üna cumpagnia telefonega situada indùa te vivét o indùa te viagét.
1813	travel	Al se pénsa che la grànd pàrt di bigliètt di evént i custerà tra i ¥2500 e i ¥130000, cunt bigliètt urdinàri chi i custerà inturn a ¥7000.
1052	politics	Ol senador e first lady Arjentina Cristina Fernandez de Kirchner la g’ha nonziad la sò candidatura a la persidenza jer sira a La Plata, una citaa 50 qillometer (31 miglie) delonç de Buenos Aires.
1699	geography	A nòrd la regiùn l’è delimitada dal Sahel, e a sùd e a ovést da l’Ucean Atlantich.
290	geography	L’ufizi meteurulògic de l’Islànda l’ha mia ripurtà nissun teramòtt dent 48 ur nel sit ciamà Hekla.
1567	politics	El documènt l’era sta lengiü in püblich per la prìma vòlta da John Nixon in tel curtìl de l’Independence Hall in tel 8 de lüi.
1638	science/technology	Tütt in de l’univèrsi l’è fa de matéria. Tüta la matéria l’è fada de particei minuscùi ciamaa atòm.
590	science/technology	Ma, anca se chést duaréss mai sucéét l’è probabìl che ‘l sucederà mia per parécc témp. I stèl ienn inscì spantegaa che en gha triliùn de miia tra stèl chi ienn “visìn”.
1610	travel	El Flüss del Trafìch l’è el stüdi del müimènt de guidatuu individuài e di veicùl tra dù pònt e i interaziùn che i ghan tra de lùr.
691	travel	Üna visita al sìt la pò vès cumbinada in manéra pràtega cunt un gìr in bàrca al làgh.
1120	health	Ol guidator de cambios de 64 agn a ‘l é minga restad ferid ind ol incident.
1619	science/technology	Miaia de ann fa, un omén ciamaa Aristarco l’era dìì che el Sistéma Solàr al se muìva inturn al Suu.
839	entertainment	Cunsideraa quant ienn sperdüü i pueblos, te pudarè mia truuà un quantitatìf impurtànt de vìda de nòcc senza viagià ad Albuquerque o Santa Fe.
829	travel	De solìt el cuntròll de l’imigraziùn l’è la prìma tàpa quand te sbarchet de un reoplan, nàf, o olter mèzz.
1591	science/technology	I opiniùn de Aristotele sü ogni questiùn scientìfega, anca la psicologìa, ieren staa adutaa.
1821	science/technology	I paràsiti i pòden ruinà el mangià, causà iritaziùn, o nel pejùr di càs causà reaziùn alèrgich, spantegà velén o trasmètt infeziùn.
1271	sports	Ol sò prim ‘l é stait ol Slalom, indove la g’ha otegnud un Did Not Finish ind ella sò prima manche. 36 dei 116 concorents ai g’han otegnud ‘l istes resultad in qella gara.
1355	science/technology	A’l ma portad ol tren, l’automobill e tant olter mez de traspòrt.
376	science/technology	El gas el diventa püssè fin püssè te se luntanèt del center del suu.
1040	science/technology	I vellocitaa de 802.11n a i henn in sostanza superiore a qelle dei sò predecessor con un throughput teorico massimo de 600 Mbit/s.
580	science/technology	Chèsti impùlsi nervùsi i pòden vès inviaa inscì a manèta travérs el còrp, che el iuttà a mantegnì el còrp al sigür de ogni pusibìl minàcia.
1028	science/technology	La strutura dei piume ‘l sujeris qe i eren minga drovade par gollar, mò plutòst par la regollazion o la visuallizazion de la temperatura. A i recercador a i g’hann sujerid qe, anc’isseben qesta la sie la cova de un dinosaur joven, ol campion ‘l g’ha i piume de un adult e minga ‘l piumin de un novell.
1109	health	A i prim cas de mallatia in qella seson qe a i henn staits signallads a la fi de lui.
401	science/technology	I sutumarìn ienn naf prugetàà per viagià suta l’aqua e i restén lì per üna grànd quantitaa de temp.
70	entertainment	La societaa qe la g’ha in jestion la compagnia, HK Management Inc., la g’ha minga dait inanz una motivazion quand qe a la band la g’ha scancellad ol dì 20 de setember, mò ‘l dì qe g’é vegnud dré la g’ha dait la colpa a problematiqe lojistiqe.
576	science/technology	Còsa l’è üna cèlula? La paròla celùla la végn da la paròla latìna “cella” che la vör dì “stanzìn”, e l’è stada doperàda per la prìma vòlta da un microscupist che l’era dree a oservà la strütüra del sughér.
1787	travel	Despèss i agenzii de viàgg i ofrìssen pachét che includén colaziùn, organizaziùn del trasport da/a l’aeroport o anca pachét cumbinaa cunt vùl e hotel.
1788	travel	I pòden anca fermà la prenotaziùn se te ghe bisùgn de témp per pensà a l’ufèrta o furnì olter docüment per la tò destinaziùn (per esempe el vìsto).
887	travel	Le visite toristiqe i henn cariziose, sa g’ha de avir una preparazion atletica e sa pœ far-le nomà ind el istad e le g’henn limitade a la Penisola, l’Isla e a la mar de Ross.
1065	politics	Ol president dei Stats Units George W. Bush ‘l é ruvad a Signapor la matina dol 16 de november e ‘l g’ha ambiad inci un tour de una semana in Asia.
386	politics	El Rè Sejong l’era el quart rè de la dinastìa Joseon e l’è vün di püssé aprezaa.
1749	sports	Anca tornee e partidi minùr i pòden vès vedü chì in olter periòd de l’ann.
1857	travel	In manéra simila, cunt un vìsto Schengen te ghe mia de fà dumanda de vìsto separàda per ogni staa member Schengen, donca el fà risparmià témp, danéé e scartòfi.
680	travel	La cità la se trüva propi visìn ai cascaa chi ienn l’atraziùn principàl, ma chésta famüsa destinaziùn türistega la ofrìss a chi ‘l cèrca aventür o ai türist parécc ocasiùn de restà püssè a lungh.
93	politics	Çò ‘l va contra a i reports qe a i henn staits faits inanz, segond qe anullar ol ballotaj ‘l saria stait contra la costituzion.
1906	science/technology	In di sìt luntàn, senza segnàl telefònegh, un telefùn satelitàr el pödaria vèss la tòa ünega opziùn.
1423	politics	In tel 1895, dopu la scunfita in de la Prìma Guéra Sino-Japonés (1894-1895), el guvèrn Qing a l'ìa firmàt el Trataa de Shimonoseki, cont al qual ì dàga la sovranitaa de Taiwan al Japòn che l’era guvernaa l’isùla fina al 1945.
1361	science/technology	I femine a i henn de sollit imparentade intra de lore a la strecia, parqè a i henn una granda famiia de sorelle e fiœle.
1230	entertainment	Dòp de qell, Lakkha Singh ‘l g’ha tœd ‘l guida ind ol cantar i bhajan.
1085	science/technology	Ol lavorar fait a ‘l é stait par la plu banda teoric, mò ‘l progamma ‘l é stait scrivud jo par stimollar i osservazion faite de la gallassia dol Sajitari.
1376	science/technology	I piante a i fann su ‘l lor maiar dol sol cond la fotosintesis e i fann sombria.
141	sports	Mercoldì la National Basketball Association (NBA) dei Stats Units la g’ha trigad la seson de basket professionall par paguere in reguard dol COVID-19.
1930	travel	Si te vöret viagià in prima clàss te g’he de tirà föra i danéé (o l’è mei amò se la tò azienda sburzà i danéé per tì).
1514	science/technology	El Internet a’l jonta ensema elements de la comonicazion de massa e de qella interpersonala.
783	science/technology	La fotografìa di animài selvàdeg despèss la necèssita de un lùng teleobietìf, anca se ròp cuma un rosc de useiii o üna creatüra pinina i necessìten di oltri obietìf.
394	politics	Ma la Marina Britanega l’era amò püssee forta de la Marina todèsca (“Kriegsmarine”) e la pòdeva dastrügiar ogni flòta de invasiùn che l’era inviada via Canàl Inglés.
752	travel	In pòch paròll, doperà la machìna l’è üna bùna manéra de fà un viàgg on the road, ma de ràr l’è üna manéra per “fà campégg”.
867	travel	Tànti viagiaduu espèrti ed equilibraa ienn sta sciocaa de la nuvità del viagià in del mùnd in via de svilùpp, indùa parécc picùi cambiamént coltürai pòden tacàs là in prèsa.
1647	geography	La superfìss de la Lüna l’è fàda de còrna e de polvàr. El stràt de föra de la Lüna l’è ciamaa crùsta.
1166	entertainment	Ol sit web de la stazion ‘l descriv ‘l spetacol coma “teater radiofonic de vegia scœla cond un nœv e scandallos still de nerd!”
1882	politics	Anca la volontà di govérn furèst de rispetà chésti document l’è largamént variabìl.
299	politics	Ol falliment de la seconda sentenza, qe propon de inibir i union civii intra persone dol medem ses, poderia fòrs derver la strava a i union civii ind ol futur.
1582	health	In di Staa Ünii d'America, ghen circa 400.000 càs cognossuu de Scleròsi Multìpla (SM), e l’è dònca la principàl malatìa neurològica in di adült püssé giovin e de mèza età.
1568	politics	Vüna l’e stada inviada a George Washington in tel 6 de lüi, che l’era lengiüda ai sò trùpp a New York in tel 9 de lüi. Üna copia l’era rivàda a Lùndra in tel 10 de agust.
1027	science/technology	I piume dei dinosaur i g’heven minga ‘na asta ben desvellopada, ciamada raqide, ma i g’hann oltre carateristiqe dei piume, barbe e barbulle, a i recercador a I g’han deduxid qe ‘l raqide ‘l é stait probabilment un desvellopament evollotiv qe ‘l g’he stait dòp aprœv de qeste oltre carateristiqe.
377	science/technology	La part estèrna che vedum quand en vàrda ‘l suu l’è ciamàda fotosféra, che el vö dir “bàla de lüs”.
759	travel	Un canal de scambi de ospitalità l’è ün’organizaziùn che la mètt in comunicaziùn i viagiaduu cunt i locài in di cità che i visiteràn.
1088	science/technology	A i sienziats a i henn staits bon de concludir qe la materia oscura la influenza l’oltra materia oscura a l’istessa manera de la materia normalla.
959	travel	Tutavia, Star Alliance l’è depertütt a part el Pacific meridiunàl orientàl da Santiago del Cile a Tahiti, che l’è un vùl LATAM Oneworld.
1128	health	A l’ é ruvada a qella conclusion qi par i tants coments positiv e incorajaments qe a i henn staits mandads de persone de ses masqill e feminill qe i i g’ha dixiven qe i contracetiv a i vann considerads coma una necessitaa medica.
368	science/technology	I dénc den triceratop pòdeven schiscià mia dumò i föj ma anca ràm e radìs parécc dür.
1612	travel	L’è üna fortüna che i guidatuu i téndan a cumpurtàss dént un intervàl assé custànt; donca, i flüss del trafìch i tendén a vèch üna custànza ragiunèvola e i pòden vès rapresentaa cun la matemàtega.
635	science/technology	In chésta risunanza, el càmp magnetic e i ùndi ràdio i fàn sì che i atùm i mandén minuscùi segnai ràdio.
861	health	A cà, a causa de chésta còntinua esposiziùn ai bateri lucai, l’è parécc prubabil che te ghe se giumò imün.
700	travel	Chèsti carateristeg ienn prugetaa per furnì un flüss migratòri organizaa tra i dò paés.
278	politics	A’l ex president de la Cambra dei Stats Units Newt Gingrich ‘l é arivad segond cond ol 32 percent.
1326	science/technology	Tante persone i g’han verificad la scoperta cond ol utillizazion de diferents hardware e software a ‘l comenzament de fevrer e ‘l é staita nonziada mardì.
116	science/technology	A i sienziats a i hann sospetad qe Encelado ‘l fœdes jeollogicament ativ e una possibille sortiva dol anell E giaçent de Saturn.
1034	science/technology	Ol luxor e la rotazion a i vegnen drovade insema par determinar ‘l number de Rossby de una stea, qe ‘l é ligad insema a ’l flus dol plasma.
450	geography	La regiùn del Serengeti la gh'ha denter el Parc Naziunàl del Serengeti, l’Area de Conservaziùn del Ngorongoro, la Resèrva de Càscia Maswa in Tanzania e la Resèrva Naziunàl de Maasai Mara in Kenya.
1019	entertainment	I oltre nomination a includen Meior film, Rejista, Fotografia, Custum, Montaj, Collona sonora orijinalla, Senografie, Montaj sonor, Micsaj sonor e Senejadura orijinalla.
26	sports	ol sò segond punt de la sira ‘l é stait ol sò sesantesim de la seson, doncà ‘l é divegnud ol prim jugador a signar 60 o plussé punt ind una seson dol 1995-96, quand qe Jaromir Jagr e Mario Lemieux a i henn ruvads tuts e du qel obietiv qi.
1292	sports	In una collaborazion intra NPWS e la Sporting Shooters Association of Australia (NSW) Inc, a i henn staits reclutads vollontar quallificads, ind ol ambit dol program de caça della Sporting Shooters Association.
1795	travel	I crùcier de San Pietrobùrg i cumprénden témp in cità. I passeggér de la crùciera ienn esentaa di dumàndi del vìsto (cuntròla el regulamént).
939	travel	Sicüress de savè quel che te pò o te pò mia purtà dént e deciàra tütt quel che l’è sura i limìt legài.
693	geography	Gerusalemm l’è la capitàl e la cità püssé grànda de Israele, siben la grànd pàrt di oltèr paés e i Naziùn Ünii i la recugnussen mia cuma capitàl de Israele.
778	science/technology	Se la finìss, la pò vès rimpiazàda assè facilmént, e la ghà üna risoluziùn plü o manc cumparabìl cunt üna DSLR de incö.
