index_id	category	text
1418	geography	জাপান প্রায় 7,000 দ্বীপ (বৃহত্তম হচ্ছে হানশু) নিয়ে গঠিত যা জাপানকে বিশ্বের 7ম বৃহত্তম দ্বীপ এ পরিণত করেছে!
1899	entertainment	পিরামিডের উপরিতলে দৃশ্যগুলি ফুটে উঠলে পিরামিডগুলি উজ্জ্বল হয়ে ওঠে।
272	health	তিনি উল্লেখ করেন যে কিছু গবেষণায় দেখা গেছে বিশ্বজুড়ে মহামারী হওয়ার আগে অবশ্যই এই রোগটি কম প্রাণঘাতী আকার ধারণ করবে।
943	travel	কোনো বিদেশী রাষ্ট্রে থাকা এবং স্বেচ্ছাসেবকের কাজ করা হল এক ভিন্ন সংস্কৃতিকে জানা, নতুন মানুষের সঙ্গে পরিচয় করা, নিজেকে জানা, পরিপ্রেক্ষিত সম্পর্কে সচেতন হওয়া এমনকী নতুন দক্ষতা অর্জন করার এক অসাধারণ উপায়।
1201	health	সৈন্যদের শিবিরের কাছাকাছি শুরু হওয়া এই রোগ ছড়ানোর জন্য 2010 সালের ভূমিকম্পের পরে হাইতিতে পৌঁছানো জাতিসংঘের শান্তিরক্ষী বাহিনীকে দায়ী করা হচ্ছে।
267	science/technology	মামলাটি ভার্জিনিয়ায় চালানো হয়েছিল কারণ এটি শীর্ষস্থানীয় ইন্টারনেট পরিষেবা সরবরাহকারী সংস্থা AOL এর ভবন যা অভিযোগ প্ররোচিত করেছিল।
1708	travel	পুরানো মদিনার আশেপাশে ঐতিহ্যবাহী মরক্কোর পণ্য যেমন ট্যাজিন, মৃৎশিল্প, চামড়াজাত পণ্য, হুক্কা এবং আরও নানা জিনিস সহজেই পাওয়া যায়, তবে এগুলো সবই পর্যটকদের জন্য।
928	travel	আজকাল বিমান ভ্রমণ প্রথমে অনুসন্ধান এবং দামের তুলনা ছাড়া খুব কমই সরাসরি এয়ারলাইনের মাধ্যমে বুক করা হয়।
1391	geography	মধ্যপ্রাচ্যের উষ্ণ জলবায়ুতে, বাড়িটি বিশেষ গুরুত্বপূর্ণ ছিল না।
1229	entertainment	গায়ক সঞ্জু শর্মাকে দিয়ে সন্ধ্যার শুরু হয়েছিল, তার পরে জয় শঙ্কর চৌধুরী ছাপ্পান ভোগ ভজনও উপস্থাপন করেছিলেন। তার সঙ্গ দিয়েছিলেন সংগীতশিল্পী রাজু খানদেলওয়াল।
586	science/technology	এই টেলিস্কোপগুলি দুটি লেন্সের সংমিশ্রণ ব্যবহার করে দুরের বস্তুকে আরও নিকটে এবং বড় করে তোলে।
1695	geography	বন্যজীবনের ক্ষেত্রে মাদাগাস্কার এখন পর্যন্ত সর্ববৃহৎ একটি মহাদেশ।
802	health	অতিরিক্ত মদ্যপানের ফলে স্বাস্থ্যের সম্ভাব্য দীর্ঘমেয়াদী ক্ষতির মধ্যে লিভারের ক্ষতি এবং এমনকি অন্ধত্ব এবং মৃত্যু পর্যন্ত হতে পারে। অবৈধভাবে উৎপাদিত অ্যালকোহল সেবন করলে সম্ভাব্য বিপদ আরও বাড়ে।
1881	politics	লিঙ্গ বর্ণিত হয়নি (X) বা কোনও পছন্দসই নাম এবং লিঙ্গের সাথে মেলেমিলিয়ে নথিগুলি আপডেট কড়া হয়েছে এমন ক্ষেত্রে পাসপোর্ট ইস্যু করার বিষয়ে সরকারের সদিচ্ছা পরিবর্তিত হয়।
1379	science/technology	এর দীর্ঘ চোয়ালগুলি খচিত ছিল সত্তর-এর ( 70 ) থেকে বেশি ক্ষুর তীব্র দাঁত দিয়ে, এরই সঙ্গে ছিল মুখগহবরের উপরের দিকে একটি অতিরিক্ত সেট, মানে যা কিছু এর রাস্তায় পড়ত তার কোনো রেহাই ছিল না।
1550	politics	যদি মিত্র শক্তি ব্যর্থ হত, তবে জার্মানি সম্ভবত ইউরোপের বাকি অংশের মতো ব্রিটেনকেও জয় করতে পারত।
333	entertainment	এরপরে ইস্তানবুল প্রদেশের সিম্ফনি অর্কেস্ট্রা নামে একটি জ্যানিসারি ব্যান্ড এবং গায়ক ফাতেহ এরকো ও  মসলিম গর্সস  ছিলেন।
719	geography	ডোমিনিকান প্রজাতন্ত্র (স্পেনিয়ঃ রিপাব্লিকা ডোমিনিকানা) হল একটি ক্যারিবিয়ান দেশ যা হাইপানিওলা দ্বীপের পূর্ব অর্ধেকে পরিব্যাপ্ত , যা হাইতির সাথে শরিকানা আছে
1780	travel	প্রবালপ্রাচীরের চারপাশে সারা বছর অনেক ভ্রমণ করা হয়, এবং এইসকল কারণে আহত হওয়ার ঘটনা খুবই বিরল।
1841	travel	যদি কোনও ঘোড়া তার আরোহীকে ফেলে দেয় তবে, অথচ তার একটি পায স্ট্রাপের মধ্যে আটকে থাকে, তবে ঘোড়া পালিয়ে গেলেও তাঁদের টেনে নিয়ে যায়। এই ঝুঁকি কমাতে, বেশ কয়েকটি সুরক্ষামূলক সতর্কতা অবলম্বন করা যেতে পারে।
471	politics	ধারণাটি ছিল এমন যে, সমস্ত ইউরোপীয় দেশকে কোনও একটি দেশ শক্তিশালী হয়ে যাওয়া থেকে আটকানোর চেষ্টা করার উপায় খুঁজতে হয়েছিল, এবং তাই জাতীয় সরকারগুলো ভারসাম্য বজায় রাখার জন্য প্রায়শই তাদের জোট পরিবর্তন করেছিল।
1634	science/technology	এটি পদার্থের চারটি অবস্থার মতো (একই ক্রমে): কঠিন, তরল, বায়বীয়, এবং প্লাজমা, যদিও তার তত্ত্ব মতে আমরা যা দেখছি তা গঠনের জন্য তারা নতুন পদার্থে পরিনত হয়।
1255	science/technology	গবেষকরা পর্যবেক্ষণ করে দেখেছিলেন বিড়ালের মূত্রে গঠিত ক্রিস্ট্যাল মেলামাইন এবং সানিউরিক অ্যাসিড নিয়ে গঠিত।
845	entertainment	"""যাইহোক, আজকাল প্রতিষ্ঠিত গ্রাফিতি শিল্পী, গ্রাফিতির ইভেন্ট এবং """"বৈধ"""" দেয়াল রয়েছে। এই প্রসঙ্গে গ্রাফিতি চিত্রগুলি প্রায়শই দুর্বোধ্য উদ্ধৃতির চেয়ে শিল্পকর্মের সাথে বেশি সাদৃশ্যপূর্ণ।"""
1776	entertainment	অনেক ফরাসি মদ থাকবে, তবে নিউজিল্যান্ড এবং অস্ট্রেলিয়ান মদগুলো আরও ভাল চলবে।
1845	travel	চূড়াগুলোতে শ্বাসরুদ্ধকর দৃশ্য অন্তর্ভুক্ত। পৃথিবীর সব প্রান্তের পর্বতারোহীরা এর অসীম সম্ভাবনার দেয়ালগুলোতে নতুন নতুন পথ বানানোর কাজ চালিয়ে যাচ্ছে।
1151	sports	দক্ষিণ আফ্রিকা তাদের দক্ষিণী বোনদের বিরুদ্ধে নিশ্চিতভাবে হতাশার সাথে খেললেও, টুর্নামেন্ট এগিয়ে যাওয়ার সাথে সাথে ধারাবাহিকভাবে উন্নতি করেছে।
1054	politics	"""এই বিতর্কটি হারিকেন ক্যাটরিনার সময় ত্রাণ ও পুনর্নির্মাণের উপর ব্যয়কে কেন্দ্র করে বেশি ছড়িয়েছিল; যেটাকে কিছু অর্থ সংশ্লিষ্ট রক্ষণশীলরা হাস্যকরভাবে """"বুশের নিউ অরলিন্স চুক্তি"""" বলে অবহিত করেছিল।"""
1859	geography	ভৌগলিক স্থান অনুযায়ী সংজ্ঞাটি পরিবর্তনশীল, যেখানে বয়সের সীমা ইউরোপের চেয়ে উত্তর আমেরিকায় কম হতে পারে।
1007	health	যদিও এখনও পর্যন্ত পরীক্ষামূলক ভাবে একটি ভ্যাকসিন ইবোলা মৃত্যুর হার হ্রাস করতে সক্ষম হয়েছে, তবে উপস্থিত সংক্রমণের চিকিৎসার জন্য উপযুক্ত কোন ওষুধ ভালোভাবে প্রকাশ হয়নি।
1076	politics	"""বুশের মুখপাত্র গর্ডন জনড্রো উত্তর কোরিয়ার এই প্রতিশ্রুতিকে """"কোরিয়ান উপদ্বীপে যাচাইযোগ্য পারমাণবিক নিরস্ত্রীকরণ অর্জনের লক্ষ্যে একটি বড় পদক্ষেপ"""" বলে অভিহিত করেছেন।"""
1099	geography	এই স্যাটেলাইটগুলি যাদের উভয়ের ওজন 1,000 পাউন্ডের বেশি, এবং প্রতি ঘন্টায় প্রায় 17,500 মাইল বেগে ভ্রমণ করেছিল, পৃথিবীপৃষ্ঠ থেকে 491 মাইল উপরে সংঘর্ষপ্রাপ্ত হয়েছিল।
1100	science/technology	বিজ্ঞানীরা জানাচ্ছেন সংঘর্ষের ফলে সৃষ্ট বিস্ফোরণ ছিল বিপুল।
367	science/technology	রক্ত হৃৎপিণ্ড থেকে চলে যায় ধমনী নামক নলির মধ্য দিয়ে এবং ফিরে আসে শিরা নামক নলির মধ্য দিয়ে। সব থেকে ক্ষুদ্রতম নলিকে বলে কৈশিক নাড়ী।
770	entertainment	মন্দিরগুলোর বেশিরভাগ উৎসব মন্দিরগুলোর  বাৎসরিক অনুষ্ঠান অথবা দেবতার জন্মদিন অথবা মন্দিরগুলোর সাথে জড়িত গুরুত্বপূর্ণ ঘটনায় উদযাপিত হয়।
279	politics	সমস্ত রাজ্যে বিজয়ী হিসাবে, ফ্লোরিডা তার পঞ্চাশটি প্রতিনিধির সবকটি দিয়ে রোমনিকে পুরস্কৃত করেছিল, তাকে রিপাবলিকান পার্টির মনোনয়নের জন্য নেতৃত্বকারী হিসাবে এগিয়ে নিয়ে এসেছিল।
357	science/technology	পূর্ববর্তী শক্তি স্তরে ফিরে আসতে তাদের অবশ্যই আলোক থেকে প্রাপ্ত অতিরিক্ত শক্তি মুক্ত করতে হবে।
797	science/technology	ল্যাপটপ অথবা ট্যাবলেট নিয়ে ভ্রমণ করলে একটি কপি এর মেমোরি অথবা ডিস্কে (যেটিতে ইন্টারনেট ছাড়াই প্রবেশ করা যায়) সংরক্ষণ করুন।
211	health	গুরুতর ক্ষতির কোন খবর পাওয়া যায়নি, তবে বিস্ফোরণের সময় সেই স্থানে থাকা কম করে পাঁচ জনের মধ্যে শকের লক্ষণ থাকার জন্য চিকিৎসা করা হয়েছিল।
815	travel	আন্তর্জাতিকভাবে, প্রায় ২০০ চলমান ভ্রমন সংস্থা আছে। তাদের বেশির ভাগই  স্বাধীনভাবে কাজ করে।
238	geography	"""যতদূর আমরা জানি, এখানে শুধুমাত্র একটিই গ্রহ আছে যা টাইট্যানের তুলনায় বেশি গতিময়তা প্রদর্শন করে, এবং এর নাম হল পৃথিবী,""""যোগ করলেন স্টোফান।"""
1636	science/technology	ক্যালসিয়াম এবং পটাসিয়ামের মতো বস্তুগুলিকে ধাতু হিসেবে ধরা হয়। তবে রুপো এবং সোনার মতো ধাতুও অবশ্যই আছে।
761	travel	তারপরে উপলভ্য হোস্টগুলির একটি তালিকা মুদ্রণ এবং/অথবা অনলাইনে দেওয়া হয়। কখনো কখনো অন্যান্য ভ্রমণকারীদের দ্বারা উল্লেখ এবং পর্যালোচনার সাথে।
1676	science/technology	এআইয়ের গবেষণার মধ্যে আছে বুদ্ধিমান আচরণ প্রয়োজন এমন কাজগুলোকে স্বয়ংক্রিয় করতে পারে এমন মেশিন তৈরি করা।
848	entertainment	অস্ট্রেলিয়াতে যেসব বুমেরাং পাওয়া যায়, তার অধিকাংশই ফিরে আসেনা। যারা সবে হাত পাকাতে শুরু করেছেন, তাদের বেশি হাওয়ার মধ্যে এগুলি ছোঁড়ার চেষ্টা না করাই ভালো।
1089	science/technology	এই তত্ত্ব মতে একটি ছায়াপথের চারপাশের ডার্ক ম্যাটার ছায়াপথের চারপাশে এক ধরণের বর্ণবলয় হয়ে অবস্থান করে এবং যা অসংখ্য ছোট ছোট কণা দিয়ে গঠিত।
984	health	হাজারেরও কম মামলা দায়ের করা হয়েছে মানুষের মধ্যে, কিন্তু এর মধ্যে কিছু রয়েছে মারাত্মক।
305	sports	জাপানি জুডোকা হিটোশি সাইতো, 2জন অলিম্পিক স্বর্ণপদক বিজয়ী, 54 বছর বয়সে মারা গেছেন।
697	travel	জেরুজালেমে অনেক ঐতিহাসিক বিষয়, প্রত্নতাত্ত্বিক এবং সাংস্কৃতিক জায়গা, সেই সাথে উজ্জ্বল ও লোকারণ্য বাজার, ক্যাফে এবং রেস্তোরাঁ আছে।
826	travel	মূলত, তাঁরা দুটি বিভাগের মধ্যে পড়েঃ হয় তুমি ভ্রমনের সময় কাজ করো অথবা  তোমার ব্যয় সীমাবদ্ধ করার চেষ্টা করো। এই নিবন্ধটি পরবর্তী জিনিসটির উপর দৃষ্টি নিবদ্ধ করে।
1672	health	এটা অনেক দিন ধরে জানা গেছে যে বিভিন্ন ধরনের মস্তিষ্কের ক্ষতি, মানসিক আঘাত, ক্ষত, এবং টিউমার আচরণকে প্রভাবিত করে এবং কিছু মানসিক ক্রিয়াকলাপে পরিবর্তন ঘটায়।
536	travel	মাঝে মধ্যে সমুদ্রসৈকত, থিম পার্ক এবং ক্যাম্পের মাঠ বিনোদনমূলক পর্যটকদের দ্বারা সাধারণ জায়গা হয়ে ওঠে।
1909	science/technology	এই পরিষেবার সাথে সংযুক্ত হওয়ার জন্য আপনার স্থানীয় টেলিফোন পরিষেবা সরবরাহকারীকে আরও তথ্য দেওয়া উচিত।
611	science/technology	পরিশীলিত অ্যানিমেশনগুলো কম্পিউটারে তৈরি করা যেতে পারে এবং এইধরণের অ্যানিমেশনগুলোর ব্যবহার টেলিভিশন এবং চলচ্চিত্রের ক্ষেত্রে ক্রমশবেড়ে চলেছে।
157	sports	এই প্রতিযোগীতায় কেসেলোভস্কি ২,২৫০ পয়েন্ট নিয়ে ড্রাইভারস' চ্যাম্পিয়নশিপ নেতা হন।
1294	politics	মারটেলি গতকাল নয় সদস্যের একটি নতুন অস্থায়ী ইলেক্টোরাল কাউন্সিলের (CEP) শপথ গ্রহণ করেছেন।
1803	travel	অন্যদিকে, বেশ কিছু দেশে বরফ এবং তুষারময় পরিস্থিতি স্বাভাবিক, এবং ট্র্যাফিক সারা বছর নিরবিচ্ছিন্ন ভাবে চলে।
359	science/technology	"""বিজ্ঞানীরা এই প্রক্রিয়াটিকে """"উদ্দীপিত রেডিয়েশন নিঃসরণ"""" হিসাবে আখ্যা দিয়েছেন কারণ পরমাণুগুলি উজ্জ্বল আলো দ্বারা উদ্দীপিত হয় যা আলোকের ফোটন কণার নির্গমন ঘটায় এবং আলো এক ধরণের বিকিরণ। """
302	politics	ফরাসি আইনে পরিবর্তন হয়েছে। তিনি 15 বছর বয়স থেকে আন্দোলন শুরু করেছিলেন যখন তিনি দ্বিতীয় বিশ্বযুদ্ধের সময় ফরাসি বিপ্লবীদের সঙ্গে যোগ দেন।
455	science/technology	লেন্স উৎপাদন কারীরা লেন্স উৎপাদনে উচ্চতর মান অর্জন করায় এর সমস্যা কম হয়ে গেছে।
25	sports	ওভেচকিনের রাতের প্রথম সহায়তা ছিল রুকি নিকলাস ব্যাকস্ট্রম দ্বারা গেম বিজয়ী গোলে;
1606	science/technology	বিজ্ঞান এখন ইঙ্গিত দেয় যে এই বিশাল কার্বন ভিত্তিক অর্থনীতি বায়োস্ফিয়ারকে তার স্থিতিশীল অবস্থা থেকে  নাড়িয়ে দিয়েছে যা বিগত ২ মিলিয়ন বছর ধরে মানব বিবর্তনের জন্য উপযুক্ত ছিল।
79	sports	2 পক্ষের মুখোমুখি হবে প্রধান সেমিফাইনালে যেখানে নূসা 11 পয়েন্ট নিয়ে বিজয়ীকে হারিয়েছিল।
952	travel	যদিও আপনি মনে করতে পারেন যে আপনি সবচেয়ে বেশি যে উড়ান সংস্থাটিতে যাতায়াত করেন সেখানে যোগদান করাটাই স্বাভাবিক, তবুও প্রদত্ত সুযোগ-সুবিধাগুলি প্রায়শই আলাদা হয় এবং একই জোটে একটি আলাদা বিমানের অধীনে ফ্রিকুয়েন্ট ফ্লায়ার পয়েন্টগুলি আরও বেশি কিছু অফার করতে পারে সেই সম্পর্কে আপনার অবগত হওয়া উচিত।
995	travel	মার্কিন যুক্তরাষ্ট্র বা কানাডা এবং ওয়েস্ট জেট থেকে আগত ফ্লাইটগুলোর জন্য যে বিমান সংস্থাগুলো এসব অফার করে সেগুলোর মধ্যে এয়ার কানাডা, ডেল্টা এয়ার লাইন্স, লুফথানসা অন্তর্ভুক্ত রয়েছে।
266	science/technology	রাশিয়ান স্থল নিয়ন্ত্রক জেট বিমানগুলো সক্রিয় করেছিল এবং স্টেশনটি তার স্বাভাবিক অবস্থা ফিরে পেয়েছিল।
112	politics	মিস্টার রুডের কিয়োটো জলবায়ু চুক্তি স্বাক্ষরের সিদ্ধান্ত মার্কিন যুক্তরাষ্ট্রকে পৃথক করেছে, যা এখন একমাত্র উন্নত জাতি যারা এই চুক্তি অনুমোদন করবে না।
1050	politics	ইরাক নিয়ে কার্যকর্তাদের বর্তমান নীতির প্রায় সবদিক থেকেই কড়া সমালোচনা করেছে ওই রিপোর্ট। সেইসঙ্গে অবিলম্বে দিক বদলের কথা বলেছে।
1609	travel	কেন পরিবহন ব্যাবস্থা এই জাতীয় অভিযোগগুলো উত্থাপন করে, কেন তাঁরা প্রতিদিনের ভিত্তিতে ব্যর্থ হয়? পরিবহন প্রকৌশলীরা কি কেবল অদক্ষ? নাকি আরও মৌলিক কিছু বিষয় চলছে?
1316	sports	সহকর্মী কুস্তিগীররা এমনকি লুনাকে শ্রদ্ধা জানিয়েছিল।
