index_id	category	text
431	geography	3দিকে সমুদ্র দিয়ে ঘেরা তুরস্ক: পশ্চিমে এজিয়ান সাগর, উত্তরে কৃষ্ণ সাগর এবং দক্ষিণে ভূমধ্যসাগর।
403	science/technology	যুদ্ধের শুরুতে ডুবোজাহাজ সমুদ্রের উপরে যাতায়াত করতো কিন্তু রাডার সৃষ্টি হওয়ায় এবং সঠিক তথ্য দেওয়ার কারণ এ যাতে দেখা না যায় এজন্য ওগুলো জলের নীচে যেতে বাধ্য হয়।
1592	science/technology	গ্রীস সম্পর্কে জ্ঞান অস্বীকার করায় পাশ্চাত্য নিজেকে গ্রীক দার্শনিক ও বিজ্ঞানসম্মত শিকড় থেকে বিচ্ছিন্ন হওয়া শুরু করল।
993	entertainment	যাইহোক, শীতের সময় তাদের নানা রকমের সৌন্দর্য এবং আকর্ষণ থাকে, অনেক হিল স্টেশনে ভালো পরিমাণে তুষারপাত হয়ে থাকে এবং স্কিইং এবং স্নোবোর্ডিংয়ের মতো বিষয়গুলি করা যায়।
755	entertainment	এই হোটেলগুলিতে সেই সময়ের ধনী ও বিখ্যাত ব্যক্তিরা থাকতেন এবং প্রায়শই সান্ধ্যভোজ এবং রাত্রিকালীন আমোদে সময় কাটাতেন।
1936	politics	১৯৯৪ সালে এই দ্বন্দ্ব পূর্ব মলদোভায় স্ব-ঘোষিত ট্র‍্যান্সনিস্ট্রিয়া রিপাবলিকের জন্ম দেয়, দেশটির নিজস্ব সরকার এবং মুদ্রা ছিল কিন্তু রাষ্ট্রসংঘের কোন সদস্য রাষ্ট্র দেশটিকে স্বীকৃতি দেয়নি।
1205	health	এই রোগের বিষয়ে জাতিসংঘের বিশেষজ্ঞ ড্যানিয়েল ল্যান্টাগন জানিয়েছিলেন, সম্ভবত এই রোগের প্রাদুর্ভাবটি শান্তিরক্ষাকারীদের থেকে হয়েছিল।
1692	geography	আরও উত্তরের বিস্তীর্ণ অঞ্চলগুলি বেশ কমই জনবহুল এবং কাছাকাছি কিছুটা প্রায় জনশূন্য প্রান্তর।
280	politics	বিক্ষুব্ধকারীরা বলেছিলেন যে বার্লিন, কোলোন, হামবুর্গ এবং হ্যানোভারের মতো জার্মান শহরগুলিতে প্রায় 100,000 লোক উঠে এসেছিল।
247	politics	পাকিস্তানের সংবিধানের ২৪৭ নম্বর ধরা অনুযায়ী প্রশাসনিক সুবিধা প্রদান ও সরকারি ব্যবস্থাপনার জন্য এই এজেন্টগুলিই দায়ী।
1439	politics	যুদ্ধ ছড়িয়ে পড়ার পরপরই, ব্রিটেন জার্মানির ওপর একটি নৌ অবরোধ আরোপ করে।
1239	entertainment	"""তিনি একটি সাংবাদিক সম্মেলনে একটি অনুলিপি অনুসরণ করে বলেছিলেন, """"তিনি খুব সুন্দর এবং খুব ভাল গান গেয়েছেন।"""""""
743	geography	কুক দ্বীপপুঞ্জের কোনও শহর নেই তবে এটি ১৫ টি পৃথক দ্বীপ নিয়ে গঠিত। মূলগুলি হল রারোটোঙ্গা এবং আইতুটাকি।
18	politics	সারা বিশ্ব জুড়ে আন্দোলন হয়েছিল, বিভিন্ন অপরাধমূলক মামলা হয়েছে এবং উভয় আইসল্যান্ড ও পাকিস্তানের সরকারের নেতারা পদত্যাগ করেছেন।
1344	science/technology	হাইড্রোজেন আয়নগুলি হলো এমন ধরণের প্রোটন যাদের ইলেক্ট্রনগুলোকে তাদের থেকে বিচ্ছিন্ন করা হয়েছে (হাইড্রোজেন পরমাণুগুলোতে একটা প্রোটন এবং একটা ইলেক্ট্রন থাকে)।
688	travel	সীমিত সময়ের জন্য আসা দর্শকদের অন্যত্র সময় কাটানোই ভালো।
556	science/technology	পরমাণুকে বলা যেতে পারে সকল বস্তুর গঠনের মৌলিক এককগুলোর একটি।
1645	science/technology	পাহাড়ের উপরে একটি ভারী মালগাড়ি ঠেলে তোলার মত। নিউক্লিয়াসগুলো বিভক্ত করছে আবার এরপরে সেই শক্তি কিছু নির্গত করছে।
907	science/technology	তারা সাধারণত উচ্চতর ব্যান্ডউইডথ এবং উন্নত সেবা দিয়ে থাকে। তারা এনক্রিপটেড এবং এ কারণে তাদের উপর গুপ্তচরবৃত্তি চালানো কঠিন।
1071	politics	তবে প্রধানমন্ত্রী জন হাওয়ার্ড বলেছিলেন যে এই আইনটি কেবলমাত্র তাসমানিয়ান সরকার প্রদত্ত অতিরিক্ত 45 মিলিয়ন অস্ট্রেলিয়ান ডলার ব্যয় করে হাসপাতালের সুবিধাগুলি হ্রাস হয়ে যাওয়া থেকে রক্ষা করার জন্য।
555	sports	অ্যাথলিটরা অনুভব করতে পারে যে তারা এমনও পণ্য ব্যবহার করছেন যা তাদের কোনও সুবিধা প্রদান করে না।
1203	health	সৈন্যদের আসার আগে, হাইতি 1800 দশক থেকে এই রোগের সম্মুখীন হয়নি।
58	politics	পুলিশ জানিয়েছে লো পিকোলোর জন্য সুবিধা ছিল বেশি কারণ তিনি পালের্মোতে প্রোভেনজানোর ডান হাত ছিলেন এবং তার বৃহত্তর অভিজ্ঞতার কারণে তিনি তার প্রবীণ প্রজন্মের কর্তাদের সম্মান অর্জন করেছিলেন, যারা আড়ালে থেকে নিজের শক্তি বাড়ানোর ব্যাপারে প্রোভেনজানোর নীতি অনুসরণ করতেন।
1764	travel	এ ছাড়াও, সচেতন থাকুন যে গন্ধগুলো ভালুক এবং অন্যান্য বন্যজীবনকে আকর্ষণ করে, তাই দুর্গন্ধযুক্ত খাবার বহন বা রান্না করা খাবার এড়িয়ে চলুন এবং ক্যাম্পটি পরিষ্কার রাখুন।
195	sports	মাসা অন্তত 2009 সালের বাকি মরসুম বাইরে থাকবেন।
1785	travel	অগ্রিম বুকিং করলে ভ্রমণকারীরা এটা ভেবে মানসিক শান্তি পায় যে গন্তব্যে পৌঁছানোর পরে ঘুমানোর জন্য তাদের কোন স্থান থাকবে।
600	science/technology	উপাদান এবং যৌগগুলি এক অবস্থান থেকে অন্য অবস্থানে চলে যেতে পারে এবং অপরিবর্তিত থাকতে পারে।
553	sports	মধ্যদূরত্ব দৌড় হল এক তুলনামূলক সস্তা খেলা; তবুও, অনেক ভুল ধারণা রয়েছে দরকারি কিছু সরঞ্জাম সম্পর্কে যা অংশগ্রহণের জন্য  প্রয়োজন।
1720	geography	পার্কটি ১৯,৫০০ বর্গকিলোমিটার জুড়ে রয়েছে এবং ১৪ টি ভিন্ন বাস্তু বলয়ে বিভক্ত হয়েছে যার প্রত্যেকটি বিভিন্ন বন্যপ্রাণীদের আবাসস্থল।
1622	geography	অ্যামাজন নদী পৃথিবীর দ্বিতীয় দীর্ঘতম এবং বৃহত্তম নদী। এটি দ্বিতীয় বৃহত্তম নদীর থেকে 8 গুণ বেশি জল বহন করে।
1441	politics	সমুদ্রের সম্পূর্ণ অংশে কোনও জাহাজ প্রবেশ না করতে পারার জন্য ব্রিটেন আন্তর্জাতিক জলাশয় খনন করে, যা নিরপেক্ষ জাহাজগুলির ক্ষেত্রেও বিপদ ডেকে আনে।
566	health	ভিজ্যুয়াল সিস্টেম সংবেদক অঙ্গ বা চোখের উপর দৃষ্টিশক্তি, বা দেখার ক্ষমতা নির্ভর করে।
1515	science/technology	ইন্টারনেটের স্বতন্ত্র বৈশিষ্ট্যগুলি ব্যবহার ও তুষ্টির দৃষ্টিকোণ থেকে অতিরিক্ত মাত্রা যোগ করেছে।
585	science/technology	তবে, 16 শতকের শেষ দিকে ইউরোপে প্রথম প্রকৃত দূরবীনগুলি তৈরি হয়েছিল।
1689	geography	ওট্টায়া কানাডার মনোরম, দ্বিভাষিক রাজধানী যা বিভিন্ন শিল্প প্রদর্শনী এবং সংগ্রহশালার মধ্য দিয়ে কানাডার অতীত ও বর্তমানকে তুলে ধরে।
1256	health	এই স্ফটিকগুলির গঠন আক্রান্ত পালিত পশুগুলির মূত্র থেকে পাওয়াগুলির সাথে মিলে যায় যখন অবলোহিত বর্ণালীবিক্ষণ যন্ত্রের ( FTIR ) দ্বারা তুলনা করা হয়।
60	science/technology	অ্যাপেল সিইও স্টিভ জোভস হেঁটে মঞ্চে উঠলেন এবং তারপর নিজের জিন্সের পকেট থেকে আইফোনটি বের করে তা জনগণের সামনে তুলে ধরলেন।
32	sports	অ্যালোনসোর সামনে থাকা গাড়িগুলি সেফটি কারের নীচে জ্বালানির জন্য চলে যাওয়ায় বিজয়ী হিসাবে তার সঙ্গীদের নিয়ে এগিয়ে যান।
1411	politics	বিপ্লবী যুদ্ধের সময়, কনফেডারেশনের নিবন্ধের অধীনে, তেরটি রাজ্য প্রথমে একটি দুর্বল কেন্দ্রীয় সরকার গঠন করেছিল - যেখানে কংগ্রেস এর একমাত্র অংশ ছিলো।
13	sports	নাদাল প্রথম সার্ভে ৭৬ পয়েন্ট নিয়ে ম্যাচটিতে ৮৮% নেট পয়েন্ট দখল করেছিল।
1941	travel	শহরের চওড়া রাস্তাগুলি, কাঁচের আচ্ছাদনযুক্ত ভবন এবং আধুনিক শপিং কেন্দ্রগুলো ঐতিহ্যবাহী লাল-টালির ছাদ আচ্ছাদিত থাকত, 18 শতাব্দীর বাজার এবং পুরাতন মসজিদ এবং গীর্জাগুলি, যদিও এই শহরের আবহাওয়া তুরস্কের ঐতিহ্যের তুলনায় ভূমধ্যসাগরীয় ইউরোপের সাথে সদৃশ।
732	sports	হুইসলার (ভ্যানকুভার থেকে 1.5 ঘন্টা ড্রাইভের পথ) ব্যয়বহুল তবে  2010 এর শীতকালীন অলিম্পিকের কারণে সুপরিচিত।
871	entertainment	সকালে একটি সমৃদ্ধ কফি এবং রাতে স্বাচ্ছন্দ্যযুক্ত চ্যামোমিল চা দিয়ে আপনার নীড় পরিপূর্ণ করুন।
886	geography	অ্যান্টার্কটিকা পৃথিবীর সবচেয়ে শীতলতম স্থান এবং এটি দক্ষিণ মেরুকে ঘিরে রয়েছে।
362	science/technology	ঘণ্টার পর ঘন্টা কাজ করার পরে বাল্বের ফিলামেন্টটি অবশেষে ক্ষয় হয়ে যায় এবং লাইট বাল্বটি আর কাজ করে না।
1578	health	নির্দিষ্ট বিষের জন্য নির্দিষ্ট প্রাথমিক চিকিৎসার নির্দেশনা অনুযায়ী লেবেলটি পরীক্ষা করুন।
996	travel	সব ক্ষেত্রে, আপনাকে অবশ্যই সরাসরি ফোনের মাধ্যমে এয়ারলাইন্সে বুক করতে হবে।
197	health	রাষ্ট্রপতির অবস্থা স্থিতিশীল, যদিও তিনি বাড়িতে বেশ কয়েকদিনের জন্য আলাদা থাকবেন।
460	entertainment	বেশিরভাগ টেলিভিশনগুলো সাধারণ জনগণকে খুশি করার জন্য তৈরি করা হয়।
154	geography	পৃথিবীতে পতিত হওয়া প্রায় 24,000 পরিচিত উল্কাপিণ্ডের মধ্যে মাত্র প্রায় ৩৪ টির উৎপত্তি মঙ্গল গ্রহে বলে নিশ্চিত হওয়া গেছে।
1160	politics	কর্মকর্তারা ভোটারের পরিচয় যাচাই করার পর, ভোটার খামটি ব্যালট বাক্সে ফেলে এবং ভোটদানের তালিকায় স্বাক্ষর করে।
1223	entertainment	5'ই আগস্ট অভিনয় করার সময় মঞ্চ থেকে পড়ে গিয়ে প্রধান সংগীতশিল্পী স্টিভেন টাইলার আহত হওয়ার পরে তারা এই সফর বাতিল করেছেন।
54	politics	পিটার কষ্টেলো, অস্ট্রেলিয়ার অর্থপাল এবং লিবারেল পার্টি-র নেতা হিসাবে সম্ভবত প্রধানমন্ত্রী জন হাওয়ার্ড এর উত্তরাধিকারী অস্ট্রেলিয়ার এক নিউক্লিয়ার পাওয়ার ইনডাস্ট্রির পিছনে তার সহায়তা দিয়েছেন।
7	politics	প্রধানমন্ত্রীর সরকারি বাসভবন, ডাউনিং স্ট্রিটের পুলিশ-রক্ষিত প্রবেশ দ্বারের সামনে হোয়াইটহলে স্থানীয় সময় (UTC +1) বেলা 11:00 টার দিকে বিক্ষোভ শুরু হয়েছিল।
1010	sports	ইউএসএ জিমন্যাস্টিকস মার্কিন যুক্তরাষ্ট্রের অলিম্পিক কমিটির চিঠিকে সমর্থন করে এবং আমাদের সকল অ্যাথলিটদের ক্ষেত্রে নিরাপদ পরিবেশকে আরও বাড়িয়ে তুলতে অলিম্পিক পরিবারের প্রকৃত প্রয়োজনীয়তার কথা স্বীকার করে।
1174	sports	চূড়ান্ত স্কোরটি ছিল এক পয়েন্টের জয়, 21 থেকে 20, যা অল ব্ল্যাকদের 15 টি গেম জয়ের ধারাবাহিকতার সমাপ্তি ঘটায়।
1202	health	মামলা অনুযায়ী, জাতিসংঘের শিবির থেকে বর্জ্য সঠিকভাবে শোধন করা হয়নি। ফলে হাইতির আর্টিবোনাইট নদীর অন্যতম দীর্ঘ শাখাটিতে ব্যাকটেরিয়া প্রবেশ করেছিল।
958	travel	কোন এয়ারলাইন জোটই দক্ষিণ গোলার্ধের তিনটি সামুদ্রিক মোড়ের সবগুলোতে যায় না (এবং স্কাইটিম এগুলোর কোন মোড়েই যায় না)।
354	science/technology	একটি আধুনিক আইস স্কেটের ব্লেডের 2 টি প্রান্ত রয়েছে যার মধ্যে একটি অবতল ফাঁক রয়েছে। কাত হয়ে গেলেও ওই দুটি প্রান্ত পাকে বরফে আঁকড়ে ধরে রাখতে সাহায্য করে।
505	science/technology	এই ওয়েবসাইটগুলোর ইতিবাচক দিক রয়েছে, যার মধ্যে অন্তর্ভুক্ত, সহজেই কোনও ক্লাসের পৃষ্ঠা সাজাতে সক্ষম হওয়া যাতে অন্তর্ভুক্ত থাকে ব্লগ, ভিডিও, ছবি, এবং অন্যান্য বৈশিষ্ট্য।
1333	science/technology	এটি বিমানের ট্র্যাফিক নিয়ন্ত্রণকারীদের আরও বেশি নির্ভুল ভাবে বিমান নির্ধারণ করার জন্য এবং পাইলটদের আরও বেশি সঠিক তথ্য পাঠানোর জন্য পুরানো গ্রাউন্ড-রাডার-ভিত্তিক প্রযুক্তির পরিবর্তে স্যাটেলাইট ভিত্তিক প্রযুক্তি ব্যবহার করে।
1173	sports	দক্ষিণ আফ্রিকার রুস্টেনবার্গের রয়্যাল বাফোকেং স্টেডিয়ামে রাগবি ইউনিয়ন ট্রাই নেশনস ম্যাচে অল ব্ল্যাকসকে (নিউজিল্যান্ড) পরাজিত করেছে দক্ষিণ আফ্রিকা।
945	travel	ভাইকিংরা কৃষ্ণ সাগর এবং ক্যাস্পিয়ান সাগরে যাওয়ার জন্য রাশিয়ান জলপথ ব্যবহার করেছিল। এই রুটের অংশগুলি এখনও ব্যবহার করা যেতে পারে। পাওয়া কঠিন হতে পারে এমন বিশেষ পারমিটের সম্ভাব্য প্রয়োজনীয়তা পরীক্ষা করুন।
1012	sports	মার্কিন শারীরক্রীড়াঙ্গন একটি স্বতন্ত্র তদন্তের সমর্থন করে যেটা আলোকপাত করতে পারে কিভাবে ল্যারী নাসার এর উত্তরজীবীরা বিভিন্ন অংশের অপব্যবহারকে নির্ভীকভাবে বর্ণনা করেছিলেন যেটা দীর্ঘ সময়ের জন্য ধরা পড়েনি এবং যথাযথ ও উপযুক্ত পরিবর্তনকে স্বেচ্ছায় গ্রহণ করে।
712	travel	৬০টির বেশী প্রমোদ তরী গালাপাগোসের জলে সতেজে চলছে-৮ থেকে ১০০ যাত্রী বহনের পরিসর এদের।
1654	science/technology	2 টি জনপ্রিয় বিষয়বস্তু তত্ত্ব হল মাসলোর চাহিদা তত্ত্বের শ্রেণীবিন্যাস এবং হার্জবার্গের 2 ফ্যাক্টর তত্ত্ব।
76	politics	"""সে করেছে, যদিও, তার পূর্বের বিবৃতির পুনরাবৃত্তি করেছিল যে রয় ভি ওয়েড ছিলেন """"জমির স্থায়ী আইন"""", সুপ্রিম কোর্টের ধারাবাহিক গুরুত্বের ওপর জোর দেয়া হয় ।"""
637	science/technology	চার বছর পরে একটি পেটেন্টের মঞ্জুরি দেওয়া হয়, যা  ছিল MRI-এর ক্ষেত্রে বিশ্বের প্রথম পেটেন্ট।
1694	geography	পূর্ব আফ্রিকান দ্বীপপুঞ্জগুলি আফ্রিকার পূর্ব উপকূলবর্তী ভারত মহাসাগরে অবস্থিত।
1559	travel	প্রথম পরিবহন ব্যবস্থা ছিল পায়ে হাঁটা। মানুষ পায়ে হাঁটতে শুরু করল কুড়ি লক্ষ বছর আগে যখন থেকে হোমো ইরেকটাস প্রজাতির মানুষ দুই পায়ে সম্পূর্ণ সোজা হয়ে দাঁড়াতে পারল।
679	geography	জিম্বাবুয়ের পশ্চিমাংশে অবস্থিত ভিক্টোরিয়া ফল শহরটি লিভিংস্টোন, জাম্বিয়া এবং বোতসওয়ানার কাছাকাছি সীমানা জুড়ে বিস্তৃত।
1049	politics	এই রিপোর্ট মুক্ত বিতর্ক এবং মধ্যপ্রাচ্য নীতি বিষয়ে যুক্তরাষ্টের ঐক্যমত্য গঠনের অনুরোধ প্রকাশ করে।
557	science/technology	এটি একটি খুব জটিল বিষয় যেখানে রয়েছে, একটি সরল বোহর মডেল অনুসারে ইলেকট্রন দ্বারা প্রদক্ষিত একটি কেন্দ্রীয় নিউক্লিয়াস, কিছুটা গ্রহগুলির সূর্যকে প্রদক্ষিণের মতো - চিত্র 1.1দেখুন।
