index_id	category	text
450	geography	সেরেঙ্গেতি অঞ্চলে সেরেঙ্গেটি ন্যাশনাল পার্ক, এনগোরোঙ্গোরো সংরক্ষণ এলাকা এবং তানজানিয়ার মাসওয়া গেম রিজার্ভ এবং কেনিয়ার মাসাই মারা ন্যাশনাল রিজার্ভ রয়েছে।
1019	entertainment	অন্যান্য মনোনয়নের মধ্যে রয়েছে সেরা ছবি, পরিচালক, সিনেমাটোগ্রাফি, কস্টিউম ডিজাইন, চলচ্চিত্র-সম্পাদনা, অরিজিনাল স্কোর, প্রোডাকশন ডিজাইন, শব্দ সম্পাদনা, সাউন্ড মিক্সিং এবং মূল চিত্রনাট্য।
26	sports	তার সে রাতের দ্বিতীয় গোল ছিল মৌসুমের ৬০তম, প্রথম কোন খেলোয়াড় হয়ে যিনি 1995-96 সাল থেকে একই মৌসুমে 60 বা ততোধিক গোল করেছেন, যখন ইয়ারোমির ইয়াগোর ও মারিও লেমিউ প্রত্যেকে সেই মাইলফলকে পৌঁছেছিলেন।
1292	sports	NPWS এবং স্পোর্টিং শ্যুটারস অ্যাসোসিয়েশন অফ অস্ট্রেলিয়া (NSW) আইএনসি এর অংশীদারিত্বে, স্পোর্টিং শ্যুটারস অ্যাসোসিয়েশনের শিকার কর্মসূচীতে যোগ্য স্বেচ্ছাসেবীদের নিয়োগ করা হয়েছিল।
1795	travel	সেন্ট পিটার্সবার্গ ক্রুজ শহরে সময় অন্তর্ভুক্ত। ক্রুজ যাত্রীদের ভিসার প্রয়োজনীয়তা থেকে ছাড় দেওয়া হয়েছে (শর্তাবলী পরীক্ষা করুন)।
939	travel	এ ব্যাপারে নিশ্চিত হও যে তুমি জানো ভেতরে কি আনতে পারবে বা আনতে পারবে না এবং আইনী সীমার বাইরে কিছু ঘোষণা দেয়ার ব্যাপারে।
693	geography	জেরুজালেম ইসরায়েলের রাজধানী এবং বৃহত্তম শহর, যদিও বেশিরভাগ দেশ এবং জাতিসংঘ এটিকে ইসরায়েলের রাজধানী হিসাবে স্বীকৃতি দেয় না।
778	science/technology	এটি ফুরিয়ে গেলে অনায়াসেই তা পূরণীয় হবে এবং তাতে বর্তমান ডিসিএলএর-এর মতোই স্বচ্ছ ছবি উঠবে।
1147	health	মেডিকেল চ্যারিটি ম্যাঙ্গোলা, মেডিসিনস সানস ফ্রন্টিয়ার এবং বিশ্ব স্বাস্থ্য সংস্থা অনুযায়ী এটি দেশে নথিভুক্ত সবচেয়ে ভয়ঙ্কর প্রাদুর্ভাব।
1263	politics	আজ সকালে পাবলিক প্রসিকিউশনের পরিচালক কায়ার স্টারমার QC তার এক বক্তব্যে হুহনে ও প্রাইস দুইয়ের বিরুদ্ধে মামলা করার কথা বলেছিলেন।
1847	sports	"""অনেক উৎসাহী ব্যক্তিদের জন্য স্কিইং একটি প্রধান ভ্রমণমূলক কার্যক্রম, যা কোনও নির্দিষ্ট জায়গায় স্কিইংয়ের আশেপাশে সম্পূর্ণ ছুটি কাটানোর পরিকল্পনা """"স্কি বামস"""" নামে পরিচিত।"""
994	travel	শুধুমাত্র কিছু বিমানসংস্থাই আত্মীয়বিয়োগের ভাড়া প্রদান করে, যেখানে শেষ মুহূর্তে অন্ত্যেষ্টিক্রিয়ার যাত্রায় ভাড়ায় কিছুটা ছাড় দেওয়া হয়।
927	science/technology	আপনার অঞ্চলে অবৈধ না হলেও বিমানবন্দরের নিকটে বা একটি কোলাহলপূর্ণ স্থানে ড্রোন উড়ানো প্রায়শই একটি বাজে পরিকল্পনা।
811	sports	পর্বত আরোহন একটি বাহ্যিক ক্রিয়াকলাপ যা প্রায়শই প্রাকৃতিক পরিবেশে বিশেষ করে পর্বতরোহনকে বোঝায়।
285	politics	লাটভিয়া এবং স্লোভাকিয়া দুটি দেশই ACTA-তে যোগদানের প্রক্রিয়াতে বিলম্ব করেছিল।
1342	science/technology	বাঁধাকপির রস আম্লিক বা ক্ষারীয় (ক্ষারধর্মী) রাসায়নিকের উপর নির্ভর করে রঙ পরিবর্তন করে।
1800	travel	বরফ এবং তুষারময় রাস্তাঘাটে, ঘর্ষণ কম এবং আপনি যেন আপনি অনাবৃত পিচের ওপর আছেন  তেমন গাড়ি চালাতে পারবেন না।
1297	politics	অক্টোবরে শুরু হওয়া ক্ষমতাবানদের বিরুদ্ধে ব্যাপক  বিক্ষোভে মার্টেলির  প্রতিক্রিয়া হল এই কমিশন।
1048	politics	এটি সতর্ক করে যে এই মুহুর্তে ইরাকে নেওয়া কোনো পদক্ষেপ যে সাম্প্রদায়িক দাঙ্গা, ক্রমবর্ধমান হিংস্রতা বা বিশৃঙ্খলার দিকে অগ্রসর হওয়াকে আটকাবে তার গ্যারান্টি কেউ দিতে পারে না।
547	politics	2,400 জন পুরুষের মূল আক্রমণকারী দলটি ট্রেনটনের নয় মাইল উত্তরে নদীটি অতিক্রম করবে এবং তারপরে ভোরের হওয়ার পূর্বে আক্রমণ চালানোর জন্য একদল গ্রীন এবং অপরদলটি সুলিভানের অধীনে দুটি দলে বিভক্ত হয়ে যাবে।
1127	health	ফ্লুক লিখেছিলেন যে মহিলাদের স্বাস্থ্যের বিষয়ে কথা বলার প্রচেষ্টাকে ডুবিয়ে দেয়ার জন্য কিছু লোকের প্রচেষ্টাগুলো ব্যর্থ হয়েছিল।
120	entertainment	এছাড়াও ACMA খুঁজে পায় যে ভিডিওটি ইন্টারনেটে স্ট্রিম হওয়া সত্ত্বেও, বিগ ব্রাদারের ওয়েবসাইটে মিডিয়াটি সংরক্ষণ না হওয়ার কারণে বিগ ব্রাদার অনলাইন কন্টেন্ট সেন্সরশিপ আইন লঙ্ঘন করেন নি।
1113	health	তহবিলের অভাব ও অন্যান্য রোগের তুলনায় কম অগ্রাধিকারের কারণে ঐতিহাসিকভাবে এ বছর সবচেয়ে বেশি ক্ষতিগ্রস্থ অঞ্চলে ভ্যাকসিন সরবরাহের পরিকল্পনাতে দেরি হয়েছিল।
1442	politics	যেহেতু এই কৌশলটির সীমিত প্রতিক্রিয়া মিলেছিল, জার্মানি তার অবাধ সাবমেরিন যুদ্ধযাত্রার ক্ষেত্রে এরকম প্রতিক্রিয়া আশা করেছিল।
830	travel	কিছু ক্রস-বর্ডার ট্রেনে চলন্ত অবস্থায় অনুসন্ধান করা হয় এবং সেই ট্রেনগুলির একটিতে চড়ার সময় আপনার সাথে বৈধ আইডি থাকা উচিত।
1824	travel	অতিরিক্ত কর আরোপকারী দেশগুলোতে যাওয়ার ফলে ভ্রমণকারীরা কখনও কখনও বিশেষত অ্যালকোহলযুক্ত পানীয় এবং তামাক জাতীয় পণ্যগুলো ক্ষেত্রে অনেক বেশি পরিমানে অর্থ বাঁচাতে পারে।
1533	health	অন্যান্য বায়োরিদম-ভিত্তিক বিকল্পগুলোর মধ্যে থাকে প্রচুর তরল পান (বিশেষত জল বা চা, এক পরিচিত মূত্রবর্ধক) ঘুমের পূর্বে, যা একজনকে উঠে প্রস্রাব করতে বাধ্য করে।
1982	entertainment	আটের দশক থেকে হানামি, অর্থাৎ চেরিকে ফুটতে দেখা জাপানি সংস্কৃতির অঙ্গ।
657	health	গ্রীষ্মকালে লম্বা দিনে অপর্যাপ্ত ঘুম সহ স্বাস্থ্য সম্পর্কিত বিভিন্ন সমস্যা হতে পারে।
948	travel	বিশ্বাস রাখুন, একবার ঠিক বন্দরে পৌঁছতে পারলে সব কিছু সহজ হয়ে যাবে। সেখানে অন্য নৌবাহীদের সাথে আপনার দেখা হবে এবং তারা আপনার সাথে তথ্য আদান-প্রদান করবে।
1892	travel	যখন বিদেশে বাস করে দেশে ফেরা হয়, তখন তুমি নতুন সংস্কৃতিতে খাপ খাইয়ে ফেলেছ এবং নিজের সংস্কৃতির তোমার কিছু অভ্যাস হারিয়ে ফেলেছ।
1707	travel	কেনাকাটা করার জন্য সমস্ত মরক্কোতে ক্যাসাব্ল্যাঙ্কা হল সবচেয়ে কম আকর্ষণীয় জায়গা।
1729	geography	সুন্দরবন বিশ্বের সবথেকে বড় উপকূলবর্তী ম্যানগ্রোভ বন্ধনী, যার পশ্চাজভূমি বাংলাদেশ এবং ভারতের উপকূলে 80 ‌কিমি (50 মাইল) পর্যন্ত প্রসারিত।
1574	science/technology	বস্তুত এখন ব্যবহার করা সমস্ত কম্পিউটার বাইনারি সংখ্যার সাংকেতিক আকারে তথ্যের হেরফেরের উপর নির্ভর করে ব্যবহার করা হয়।
692	travel	মন্দিরে ঢুকতে গেলে অ্যাঙ্গকোর পাসের প্রয়োজন হয় তাই টনলে স্যাপ গেলে আপনার পাসপোর্টটা সঙ্গে নিতে ভুলবেন না।
1155	geography	"""গুহার সমস্ত প্রবেশপথগুলি যা """"দ্য সেভেন সিস্টার্স"""" নামে পরিচিত তাদের সবকটির ব্যস কমপক্ষে 100 থেকে 250 মিটার (328 থেকে 820 ফুট)।"""
1810	sports	টোকিও হল এশীয়ার একমাত্র শহর যা 1964 সালে দুটি গ্রীষ্মকালীন অলিম্পিক খেলা আয়োজিত করেছিল।
64	politics	মূল বিলটির খসড়া তৈরি করেছিলেন সাও পাওলোর প্রাক্তন মেয়র,  মারটা সুপ্লেসি। প্রস্তাবিত আইন সংশোধনের পর এখন রবার্তো জেফার্সনের  হাতে রয়েছে।
1330	politics	তিনি এইসব গুজবকে “রাজনৈতিক বকবকানি আর বোকামি“ হিসাবে উল্লেখ করেছেন।
1448	politics	এছাড়াও প্রতিটি রাজবংশের মধ্যে বিভক্ত প্রদেশগুলিতে অস্থিরতার সময় চলছিল। এই সময়কালের সর্বাধিক পরিচিত হান এবং জিন রাজবংশের মধ্যে 60 বছর ধরে তিনটি পর্বের রাজত্ব চলেছিল।
636	science/technology	1970 সালে, চিকিৎসক এবং গবেষণা বিজ্ঞানী, রেমন্ড দামাদিয়ান চিকিৎসায় রোগ নির্ণয়ের একটি পদ্ধতি হিসাবে ম্যাগনেটিং রেসোনেন্স ইমেজিং ব্যবহারের ভিত্তি আবিষ্কার করেছিলেন।
1677	science/technology	উদাহরণের মধ্যে রয়েছে নিয়ন্ত্রণ, পরিকল্পনা এবং সময়সূচী, গ্রাহক এর চাহিদা এবং প্রশ্নের উত্তর দেওয়ার ক্ষমতা, সেই সাথে হাতের লেখা, কণ্ঠস্বর এবং চেহারা চেনা।
1398	entertainment	যদি তুমি ন্যাশনাল ট্রেজার সিনেমা টি দেখে থাকো, তুমি হয়তো ভাবতে পারো যে সম্পদের মানচিত্র লেখা হয়েছিল স্বাধীনতা ঘোষণার পশ্চাৎ দিকে।
1605	travel	এই গতিশীল শাটল পরিবহন ব্যবস্থায় প্রত্যেকেই ব্যক্তিগত গাড়ির উপর ভিত্তি করে একটি পরিবহন ব্যবস্থার সাথে কোনওভাবে সংযুক্ত এবং সমর্থন করছেন।
982	travel	এমনকি যদি তুমি প্রায় গ্রীষ্মমণ্ডলীয় ঘণ বৃষ্টিপাতের এলাকায় গাড়ী চালাও, গাড়ীর ভিতরে ঢোকার জন্য কয়েক মুহূর্ত গাড়ীর দরজা খোলা রাখাই গাড়ীতে মশা ঢোকার জন্য যথেষ্ট।
366	science/technology	সংবহনতন্ত্রের প্রধান অঙ্গ হল হৃৎপিণ্ড, যা রক্ত সরবরাহে সাহায্য করে।
1651	science/technology	কনন্টেন্ট তত্ত্বগুলোর লক্ষ্য হলো লোকেরা কোন বিষয়গুলোতে টিক চিহ্ন দেয় বা কোন বিষয়গুলো তাদের জন্য আবেদনীয় তা খুঁজে বের করা।
941	science/technology	ওয়েবে ফর্ম্যাট এবং এডিটে পারদর্শী বোধ করার পরে আপনি আপনার নিজের ওয়েবসাইট তৈরি করতে পারেন।
876	health	যারা চিকিৎসা বিজ্ঞানের সাথে অপরিচিত, তাদের জন্য ছোঁয়াচে  এবং সংক্রামক শব্দের আলাদা অর্থ আছে।
661	entertainment	সংগীত, ছায়াছবি, সাহিত্য এবং জনপ্রিয় সংস্কৃতিতে এর ক্রমাগত বর্ণনা শহরটি এবং এর পরিচিত স্থানসমূহ বিশ্বজুড়ে পরিচিতপ্রাপ্ত হতে সাহায্য করছে।
1112	health	সরকার লক্ষাধিক এনসেফ্যালাইটিস টিকাপূর্ণ শিশি প্রদানের প্রতিশ্রুতি দিয়েছে যা স্বাস্থ্য সচেতন সংস্থাগুলিকে আগামী বছরের জন্য প্রস্তুত হতে সাহায্য করবে।
1329	politics	৫৩ বছর বয়সী কিউমো এই বছরের শুরুতে গভর্নরের কাজ শুরু করেন এবং গত মাসে সমকামীদের বিয়ে বৈধ করার জন্য একটি প্রস্তাবিত আইনের খসড়ায় স্বাক্ষর করেন।
1053	politics	মিসেস কার্চনার প্রেসিডেন্ট প্রার্থী হিসেবে লড়ার ইচ্ছা প্রকাশ করে ঘোষণা দিয়েছেন আর্জেন্টাইন থিয়েটারে, একই জায়গায় যেখান থেকে সে ২০০৫ সালে বুয়েন্স আইরেস প্রদেশের সিনেট প্রতিনিধি দলের সভ্য হওয়ার প্রচারণা শুরু করেছিলেন।
1948	travel	দয়া করে মনে রাখবেন যে আপনি মূলত একটি গণকবরের স্থান পরিদর্শন করছেন, সেইসাথে এমন একটি স্থানে যাচ্ছেন যা বিশ্বের জনসংখ্যার উল্লেখযোগ্য অংশের কাছে প্রায় ধারণাতীত অর্থবহন করে ।
923	science/technology	এই পরিষেবাগুলিতে অ্যাক্সেস প্রায়শই টোল-ফ্রি টেলিফোন নম্বর দিয়ে হয় যা বেশিরভাগ ফোন থেকে বিনা মূল্যে কল করা যেতে পারে।
173	science/technology	সমুদ্র তলদেশের ম্যাপিংয়ের পরে ধ্বংসপ্রাপ্ত জাহাজটি একটি আরওভি ব্যবহার করে পাওয়া গিয়েছিল।
1087	science/technology	চাঁদ যেমন পৃথিবীতে একটি টান প্রয়োগ করে যার ফলে জোয়ারের সৃষ্টি হয়, তেমনি আকাশগঙ্গাও সাগিটারিয়াস ছায়াপথের উপরে একটি চাপ প্রয়োগ করে।
1328	science/technology	বিজ্ঞানীরা বুঝার আশা করে যে কিভাবে গ্রহগুলো গঠিত হয়,  বিশেষ করে  পৃথিবী কিভাবে গঠিত হয়েছিল, যেহেতু ধুমকেতুগুলো পৃথিবীর সাথে অনেক আগে সংঘর্ষ করেছিল।
914	science/technology	প্রকৃত-সময়ে অক্ষর অনুবাদক অ্যাপপ্লিকেশন - অ্যাপপ্লিকেশনস যেগুলো সক্ষম স্বয়ংক্রিয়ভাবে অক্ষরের সম্পূর্ণ অংশগুলো 1 ভাষা থেকে অন্য ভাষায় অনুবাদ করতে।
1341	science/technology	এটিকে বলা হয় রাসায়নিকের পিএইচ। আপনি লাল বাঁধাকপি রস ব্যবহার করে একটি সূচক বানাতে পারেন।
336	entertainment	"""শেষে, তুর্কি নাচের দল ফায়ার অফ অ্যানাটোলিয়া """"ট্রয়"""" পরিবেশন করল। """
1005	entertainment	2017 এর শেষের দিকে, সিমিনফ-কে শপিং টেলিভিশন চ্যানেল QVC-তে দেখা গিয়েছিল।
1671	science/technology	মস্তিষ্কের গঠন এবং আচরণের মধ্যে পারস্পরিক সম্পর্ক  বিজ্ঞানীদের গবেষণাকে সমর্থন করে।
1597	science/technology	হার্শে এবং চেজ তাদের নিজস্ব ডিএনএকে একটি ব্যাকটিরিয়ায় স্থাপন করার জন্য ফেজ বা ভাইরাস ব্যবহার করেছিল।
1008	health	ZMapp নামে একটি অ্যান্টিবডি মিশ্রণ, প্রথমে এক্ষেত্রে প্রতিশ্রুতি দেখিয়েছিল, তবে  গবেষণায় ইঙ্গিত পাওয়া গেছে যে, এটি মৃত্যু রোধ করার চেয়ে কম উপকারী।
1313	health	তিনি যখন হাসপাতালে কাজ করছিলেন তখন লিগিনস তার অবসর সময়ে অকাল প্রসবের তদন্ত শুরু করেছিলেন।
665	travel	এক্ষেত্রে আদর্শ ভ্রমণের মধ্যে থাকে অরল্যান্ডো বিমানবন্দরে নামা, বাসে করে ডিজনির কোনো হোটেলে পৌঁছনো, ডিজনির সীমানার বাইরে না গিয়ে সপ্তাহখানেক কাটানো আর তারপর বাড়ি ফিরে যাওয়া।
242	geography	তিনটি গুরুত্বপূর্ণ বৈজ্ঞানিক যন্ত্র বহন করার পাশাপাশি, লুনার প্রোব চারপাশে আঁকা ভারতীয় জাতীয় পতাকার চিত্রও বহন করেছিল।
383	politics	ডেনিশ আধিপত্য থেকে দেশকে পুনরুদ্ধার করতে এই নৌবহরটির নেতৃত্ব দিয়েছিলেন নরওয়েবাসী ওলাফ ট্রাইগভাসন।
954	travel	2014 অনুযায়ী তুর্কি বিমান সংস্থা 30 টি আফ্রিকান দেশের 39 টি গন্তব্যস্থলে উড়েছে।
979	travel	পর্যটক যদি তার মূল্যবান শক্তি এবং অবশিষ্ট জল অপচয় করে মরীচিকার পিছনে ছোটেন, তবে তা বিপজ্জনক হবে।
217	sports	IOC-এর কোপেনহেগেনে ঘটিত অক্টোবর মাসের সভাতে এই ভোটগুলি অবশ্যই আনুমদন করা হবে।
1036	travel	ইভাশাকি তাঁর ভ্রমণকালে অনেক সময় অনেক সমস্যার মধ্যে পড়েছিলেন।
1583	health	এমএস এমন একটি রোগ যা কেন্দ্রীয় স্নায়ুতন্ত্রকে আক্রমণ করে, যার মধ্যে আছে মস্তিষ্ক, মেরুরজ্জু এবং অপটিক স্নায়ু।
