index_id	category	text
1412	politics	কর আরোপ করার বিষয়ে কংগ্রেসের কোনও ক্ষমতা ছিল না, কারণ সে সময় কোনও জাতীয় কার্যনির্বাহী অথবা বিচারবিভাগীয় কমিটি ছিল না। কর আরোপ করা এবং কার্যকর করার বিষয়ে কংগ্রেস রাজ্য সরকারের উপরেই নির্ভর করত। অন্য দিকে, রাজ্য সরকারেরা বেশিরভাগ সময়েই তাদের সঙ্গে অসহযোগিতা করত।
1811	travel	যদি 2020-তে বাতিল হওয়ার আগে আপনি বিমান এবং থাকার জায়গা বুক করে থাকেন, তাহলে আপনি খুব বিব্রতকর পরিস্থিতিতে পড়েছেন।
1681	science/technology	প্রত্যেকটি অপার্থিব ক্ষেত্রে প্রযুক্তি তার সমাধান দিয়ে থাকে। শিক্ষার্থীরা তাদের ক্লাসে বসে থেকেই যাদুঘরের নিদর্শনগুলি দেখতে, অ্যাকোয়ারিয়াম দর্শন বা সুন্দর শিল্পের প্রশংসা করতে পারে।
335	entertainment	তুর্কি গায়িকা সেজেন আকসু ইতালিয়ান গায়ক অ্যাালেসান্দ্রো সাফিনা এবং গ্রীক গায়ক হ্যারিস অ্যাালেক্সিওর সাথে গান গেয়েছিল।
378	science/technology	প্রায় তিন হাজার বছর পরে, 1610 সালে, ইতালীয় জ্যোতির্বিদ গ্যালিলিও গ্যালিলি দূরবীনের মাধ্যমে দেখেছিলেন যে, চাঁদের মতো সূর্যেরও কলা আছে।
1367	science/technology	বিজ্ঞানীরা মনে করেন যে ওসেলোটগুলি অনুসরণ কর এবং গন্ধ দ্বারা খাওয়া (শিকার) করে, যেখানে তারা মাটিতে চলার সময় ঘ্রাণ নিয়ে প্রাণীদের খুঁজে।
703	travel	অপেক্ষাকৃত বড় দলে ভ্রমণের জন্য ট্যুরগুলি সস্তা। তাই একা অথবা একজন বন্ধুর সাথে ভ্রমণকালীন জন প্রতি কম খরচে ঘোরার জন্য চার থেকে ছয়জনের একটি দল গঠন করুন।
297	politics	প্রস্তাবিত সংশোধনীটি এর মধ্যে ২০১১ সালে উভয় পক্ষেই পাশ করেছে।
80	sports	প্রস্তুতিমূলক ফাইনালে মারুশাইডোর তখন কাবুলচারকে পরাজিত করেছিল।
1823	travel	শুল্কমুক্ত কেনাকাটা হলো নির্দিষ্ট কিছু জায়গায় কর এবং আবগারী শুল্ক ছাড়ে পণ্য কেনার সুযোগ।
836	travel	স্থাপত্যশিল্প সাধারণত বিল্ডিংগুলির নকশা এবং নির্মাণের সাথে জড়িত। কোনও জায়গার স্থাপত্য প্রায়শই তার নিজস্ব সত্তার জন্য পর্যটকদের আকর্ষণকরে থাকে।
880	travel	একজন পর্যটক কোন কোন দেশ ঘুরেছেন বা ভ্রমণ করতে চলেছেন তার উপর এই প্রয়োজনীয়তাগুলি নির্ভর করে।
1143	politics	ক্ষমতাসীন দল, সাউথ-ওয়েস্ট আফ্রিকা পিপলস অর্গানাইজেশন (SWAPO) সংসদ নির্বাচনেও সংখ্যাগরিষ্ঠতা ধরে রেখেছে।
650	science/technology	আপনার হোটেল বা অতিথিসেবকের (যদি কোন অতিথিশালা বা ব্যক্তিগত বাড়িতে থাকেন) সম্ভবত ওয়াইফাই বা ইন্টারনেট সংযুক্ত পিসি থাকবে, এবং সকল বসতিতে একটি ইন্টারনেট ক্যাফে বা কিছু এলাকায় পাবলিক ওয়াইফাই আছে।
702	travel	আপনার পাসপোর্টটি আপনার ভ্রমণের তারিখের বাইরে কমপক্ষে 6 মাসের জন্য বৈধ হতে হবে। আপনার থাকার সময়কাল প্রমানের জন্য রাউন্ড/যাওয়ার টিকিট দেখানো প্রয়োজন।
1604	travel	প্রতিদিন সকালে কর্মীরা তাদের কর্মক্ষেত্রে যাওয়ার জন্য ছোটো শহরগুলিকে ছেড়ে গাড়িতে করে যায় এবং পথে তাদেরকে অতিক্রম করে যাদের বাসস্থান অন্যদের কর্মক্ষেত্র।
817	sports	বার্সেলোনার রানিং ট্যুর্স বার্সেলোনা এবং কোপেনহেগেনের রানিংকোপেনহেগেনের শিকড়গুলির সাথে, প্রাগ এবং অন্যদের উপর ভিত্তি করা রানিংট্যুরস প্রাগের সাথে এটির সাথে দ্রুত যোগদান করেছিল।
1763	travel	যথাযথ দূরত্ব না বজায় রাখার কারণে প্রতি বছর কয়েক ডজন দর্শক ক্ষতিগ্রস্ত হয়। এই প্রাণীগুলি সাধারণত বড়, বন্য এবং সম্ভাব্য বিপজ্জনক হয়ে থাকে, তাই তাদেরকে তাদের নিজস্ব স্থানে থাকতে দিন।
1290	politics	চুক্তি স্বাক্ষরিত হওয়ার পরে ইসরাইল উপত্যকায় বর্তমান সামরিক বাহিনীর উপস্থিতি দশ বছর ধরে রাখার দাবি করেছে যেখানে PA এই উপস্থিতিটি কেবল পাঁচ বছরের জন্য ছেড়ে দিতে রাজি হয়েছে।
1775	entertainment	"""স্থানীয় মূল বিয়ার হল 'নাম্বার ওয়ান', এটি কোনও যৌগিক বিয়ার নয়, কিন্তু আনন্দদায়ক এবং সতেজকর। অপর স্থানীয় বিয়ার হল """"ম্যান্টা""""।"""
642	science/technology	ইন্টারনেট এবং ওয়ার্ল্ড ওয়াইড ওয়েবের ব্যবহার  শিক্ষার্থীদের সর্বদা তথ্যের অধিগম্যতা প্রদান করে।
1544	politics	সেপ্টেম্বর 17, 1939 পোলিশ প্রতিরক্ষা ইতিমধ্যে ভাঙ্গা হয় এবং একমাত্র আশা ছিল পিছু হটানো এবং রোমানিয়ান ব্রিজহেড ধরে পুনর্গঠন করা।
1148	health	"""মেডেসিনস স্যানস ফ্রন্টিয়ের-এর মুখপাত্র রিচার্ড ভীরম্যান বলেছেনঃ “ অ্যাঙ্গোলা এখন সবচেয়ে খারাপ দুর্যোগের দিকে চলেছে এবং অ্যাঙ্গোলার পরিস্থিতি খুবই খারাপ।"""""""
801	health	সংযত মাত্রায় মদ্যপান করুন। মদ প্রত্যেককে ভিন্ন ভিন্ন ভাবে ক্ষতিগ্রস্ত করে, এবং নিজের সঠিক মাত্রা জানাটা খুব জরুরি।
1741	travel	2017 এর সেপ্টেম্বরে সেতুটি পুরোপুরি চালু হওয়ার কথা রয়েছে যখন ব্রাজিলের কাস্টমস চেকপয়েন্টগুলি শেষ হওয়ার আশা করা হচ্ছে।
1140	entertainment	যদিও  উইনফ্রে তার শেষ বিদায়ে আবেগ আপ্লুত ছিল,  সে তার ভক্তদের নিকট পরিস্কার করেছিল যে ফিরে আসবে।
1267	health	এডগার ভেগুইলা হাত এবং চোয়ালে আঘাত পেয়েছিলেন, যখন ক্রিস্টোফার স্নাইডারের মুখের পুনর্গঠনমূলক সার্জারির প্রয়োজন ছিল।
1774	entertainment	এগুলো মাঝেমাঝে ঘনসন্নিবিষ্ট, পরিবার উপযোগী সৈকত, যেখানে উপকূলবর্তী যথেস্ট ভালো পরিসরের দোকান আছে। সাঁতার কাটা নিরাপদ।
862	health	কিন্তু পৃথিবীর অন্যান্য কিছু অংশ যেখানে ব্যাকটেরিয়াতাত্ত্বিক প্রাণী আপনার কাছে নতুন, সেখানে আপনার সমস্যায় পড়ার সম্ভাবনা অনেক বেশি।
1069	politics	"""প্রধানমন্ত্রীর সাথে সাখ্যাৎকালে লেটন কনজারভেটিভ পার্টির পরিবেশ বিলের """"পুঙ্খানুপুঙ্খ ও সম্পূর্ণ পুনর্লিখন"""" করার জন্য কনজারভেটিভ পরিবেশ বিলে পরিবর্তন করার জন্য বলেছিলেন।"""
325	geography	জাতীয় হ্যারিকেন কেন্দ্রের বিজ্ঞানীরা ভবিষ্যদ্বাণী করছেন যে বুধবারের মধ্যে ড্যানিয়েল শক্তিশালী হ্যারিকেনে পরিণত হবে।
1314	health	তার গবেষণা এটা দেখায় যে কোনও হরমোন যদি প্রতিপালনযোগ্য হয়, তবে তা জাইগোটের ফুসফুসের গঠনের পরিপক্কতাকে তরাণ্বিত করবে।
704	travel	যাইহোক, এটি অবশ্যই আপনার উদ্বেগের কারণ হওয়া উচিত নয়, যেহেতু পর্যটকরা প্রায়শই গাড়ি ভরাট করার জন্য আশেপাশে ঘুরে বেড়াচ্ছেন।
528	sports	বিশ্ববিদ্যালয়ের শিক্ষার্থীদের শিক্ষা অর্জন থেকে শুরু করে পেশাদার পর্যন্ত এবং অলিম্পিক প্রতিযোগিতার বিভিন্ন স্তরেও ফেন্সিং এর এই আধুনিক খেলাটি খেলা হয়।
532	sports	সে খেলোয়াড় জিতেন যিনি কোর্সটি সম্পন্ন করতে সবচেয়ে কম সংখ্যকবার স্ট্রোক নেন বা ক্লাবটি দোলান।
1643	science/technology	একজন শুধুমাত্র আশ্চর্য হতে পারে এই ভেবে যে যখন নতুন কিছু আসে তখন কী-বোর্ড কীরকম হবে।
868	travel	বিশেষ করে আপনার প্রাথমিক দিনগুলিতে, পশ্চিমা ধাঁচের এবং ভালো মানের হোটেল, খাবার এবং পরিষেবাগুলিকে অভ্যস্ত হতে অবাধে খরচের ব্যাপারে বিবেচনা করুন।
124	entertainment	ডেইলি শো এবং দ্য কোলবার্ট রিপোর্টের অনেক আগে, 1988 সালে UW তে শিক্ষার্থী থাকা অবস্থায় হেক এবং জনসন এমন একটি প্রকাশনার কল্পনা করেছিলেন যা এই সংবাদ এবং সংবাদ প্রতিবেদনকে বিদ্রূপ করবে
1159	politics	ফ্রান্সে, ঐতিহ্যগতভাবে ভোটদান একটি স্বল্প প্রযুক্তির অভিজ্ঞতা: ভোটাররা একটি বুথে নিজেদেরকে আলাদা করে, আগে থেকে ছাপানো একটি কাগজে তাদের পছন্দের প্রার্থীকে চিহ্নিত করে একটি খামে রাখে।
701	travel	যেসব কিউবান নাগরিক আমেরিকান গ্রিন কার্ডধারী তাদের এই প্রয়োজন থেকে ছাড় পাওয়ার জন্য ইকুয়েডর-এর দূতাবাসে যাওয়া উচিত।
560	health	ক্ষতিগ্রস্থটিকে নিরীক্ষা করতে,  আপনাকে প্রথমে দৃশ্যের নিরীক্ষা করতে হবে, আপনার নিরাপত্তা নিশ্চিত করতে।
167	politics	এই আক্রমণ ভারত ও পাকিস্তানের সম্পর্কে এক বিরাট ফাটল তৈরি করে।
301	politics	পরিচালনার বাইরে ভৌটিয়ের কৃতিত্বের মধ্যে রয়েছে ১৯৭৩ সালের অনশনও যা তিনি পর্যালোচনা করেছিলেন রাজনৈতিক সেন্সরশিপ এর বিরুদ্ধে।
40	entertainment	"""জন গ্রান্ট , উইন্ড বাফেলো থেকে (পড়া হচ্ছে রেইনবো-এর হোম স্টেশন ) বলেছে """" রেইনবো পড়া বাচ্চাদেরকে শেখায় কেন পড়তে হবে ...পড়ার ভালোবাসা -[ প্রদর্শনী ] উৎসাহিত করেছিল বাচ্চাদেরকে একটি বই বেছে নিতে এবং পড়তে।"""" """
1414	politics	অনুচ্ছেদগুলি সংশোধন করার পূর্বে সমস্ত রাজ্যের সম্মতির প্রয়োজন ছিল এবং রাজ্যগুলি কেন্দ্রীয় সরকারকে এতই হালকাভাবে নিয়েছিল যে তাদের প্রতিনিধিরা প্রায়শই অনুপস্থিত থাকতেন।
1789	travel	যে কোনও সংশোধন বা অনুরোধের জন্য সরাসরি হোটেলের সঙ্গে যোগাযোগ না করে আগে ট্র্যাভেল এজেন্টের সাথে কথা বলা উচিত।
754	travel	দ্বিতীয় বিশ্বযুদ্ধের আগে, 19 শতকে বা 20 শতকের প্রথম দিকের কিছু হোটেল স্টীম ইঞ্জিন ও জাহাজ সমৃদ্ধ স্বর্ণযুগের ঐতিহ্য বহন করে।
1142	politics	নামিবিয়ার রাষ্ট্রপতি ও সংসদ নির্বাচনের চূড়ান্ত ফলাফল ইঙ্গিত দেয় যে বর্তমান রাষ্ট্রপতি হিফিকেপুনিয়ে পোহাম্বা বড় ব্যবধানে পুনঃনির্বাচিত হয়েছেন।
1022	politics	ফোনে তুরস্কের রাষ্ট্রপতি রেসেপ তাইয়েপ Erdoğan-এর সাথে ট্রাম্পের কথোপকথনের পরে এই ঘোষণাটি করা হয়েছিল।
538	travel	পর্যটকরা যেতে পারে বিভিন্ন নিদর্শনে কোন নির্দিষ্ট দেশের অথবা তারা মনোযোগ কেন্দ্রীভূত করতে পারে কেবলমাত্র 1টি ক্ষেত্রে।
155	geography	গত জুলাই মাসের উল্কাপাতের জন্য এর মধ্যে পনেরোটি উল্কাপিন্ড দায়ী।
1278	health	যদিও তিনজন মানুষ বাড়িটির ভিতর ছিল যখন গাড়িটি এটিকে ধাক্কা মারে, তাদের মধ্যে কেউ আঘাত পায়নি।
1197	sports	তারা নেদারল্যান্ডকে অন্তর্ভুক্ত করে, অ্যানা জচেমসেন এর Super-G তে মহিলা প্রতিযোগীদের মধ্যে নবম স্থান অধিকার করার সাথে, এবং একই খেলায় ফিনল্যান্ড, কাটজা সারিনেনের  দশম স্থান অধিকারের সাথে।
1541	politics	দ্বিতীয় বিশ্বযুদ্ধের প্রধান শত্রু জার্মানি সোভিয়েত ইউনিয়ন এবং আমেরিকার মধ্যে সহযোগিতার মুখ্য ভূমিকা পালন করছিল। যুদ্ধ শেষের সাথে সিস্টেম, প্রক্রিয়া এবং সংস্কৃতি নিয়ে অন্তর্কলহের ফলে দেশগুলির মধ্যে বচসা বাধে।
1111	health	এই প্রাদুর্ভাবটি ভারত সরকারকে গুরুতরভাবে ক্ষতিগ্রস্থ অঞ্চলগুলিতে শূকর শিকারিদের স্থাপনে, হাজার হাজার মশার বিনষ্ট করতে এবং কীটনাশক স্প্রে করার মতো বিভিন্ন পদক্ষেপ গ্রহণে বাধ্য করেছে।
889	geography	ইনল্যান্ড অ্যান্টার্কটিকা হলো একটি জনশূন্য মালভূমি যা 2-3 কিলোমিটার বিস্তৃত বরফ দ্বারা আচ্ছাদিত।
324	geography	মায়ামি, ফ্লোরিডা থেকে ৩০০০ মাইল দূরে অবস্থানরত ঝড়টি ঘন্টায় সর্বোচ্চ ৪০ মাইল (ঘণ্টায় ৬৪ কিলোমিটার) বেগের বাতাস বহন করেছে।
118	entertainment	গেমের প্রকাশক Konami একটি জাপানি সংবাদপত্রে আজ জানিয়েছে যে তারা Six Days in Fallujah গেম প্রকাশ করবে না।
1018	entertainment	গোসলিং এবং স্টোন যথাক্রমে সেরা অভিনেতা ও অভিনেত্রীর জন্য মনোনয়ন পেয়েছিলেন।
523	health	এটা এই রকম ক্লান্তিকর, আপনি যদি প্রতি বিশ-ত্রিশ মিনিট অন্তর জেগে উঠেন এবং টিভি দেখন।
1637	science/technology	আপনার কাছে সঙ্কর ধাতুও থাকতে পারে যাতে অল্প পরিমানে অ-ধাতব উপাদান যেমন কার্বন থাকে।
749	travel	আপনার নিজের গাড়িতে করে দীর্ঘ রাস্তা ভ্রমণের উদ্দেশ্যে যাত্রা করার স্বাচ্ছন্দ্যের মধ্যে একটি অন্তর্নিহিত ভাল লাগা রয়েছে।
1575	science/technology	একটি বাইনারি সংখ্যায় শুধুমাত্র ০ বা ১ এই দুটি মানের মধ্যে একটি থাকতে পারে এবং কম্পিউটারের ভাষা হিসাবে ব্যবহার করতে এই সংখ্যাগুলিকে বাইনারি ডিজিট বা বিট হিসাবে উল্লেখ করা হয়।
524	health	প্রভাবটি নির্ভর করে আপনার মস্তিষ্ক প্রতি রাতে কতবার স্বপ্ন দেখার চেষ্টা করে তার উপর।
358	science/technology	"""তারা """"ফোটন"""" নামক একটি ক্ষুদ্র আলোর কণা নির্গত করার মাধ্যমে এটি করে থাকে।"""
999	health	বহুমূত্র নিরাময়যোগ্য কিনা তা নিয়ে অন্যান্য বিশেষজ্ঞদের মতো তিনিও সংশয়ে আছেন। এমন লোক যাদের আগে থেকেই টাইপ 1 বহুমূত্র রোগ আছে, তাদের সাথে এই আবিস্কারের কোনও সম্পর্ক নেই।
1359	science/technology	সিংহ সবচেয়ে সামাজিক বিড়াল, প্রাইড নামক বড় দলে বাস করে।
311	entertainment	এই দম্পতি এক বছর আগে টেক্সাসে বিয়ে করেছিলেন ও বন্ধু এবং আত্মীয়দের সাথে আনন্দ উদযাপন করতে বাফেলোয় এসেছিলেন।
1917	entertainment	একটি নৌকায় সাত বা আট জন নিয়ে হওয়া নৌকা বাইচ ফিনল্যান্ডে একটি জাতীয় বিনোদন।
1771	geography	উত্তরকূলের সমুদ্র সৈকত (উত্তর পোতাশ্রয় জেলাতে) প্রশান্ত মহাসাগরে অবস্থিত এবং উত্তরে লং বে থেকে দক্ষিণে ডেভনপোর্ট পর্যন্ত প্রসারিত।
361	science/technology	ফোটন পরমাণু তৈরি করা উপাদানের চেয়েও ছোট!
196	health	রাষ্ট্রপতির মন্ত্রী রদ্রিগো আরিয়াস আরিয়াস বলেছেন, সামান্য ভাইরাসের ক্ষেত্রে আরিয়াসের রিপোর্ট পজিটিভ পাওয়া গেছে।
951	travel	সতর্কতা মেনে ঘনঘন আসে এমন ফ্লাইয়ার এয়ারলাইনটি আপনার বেছে নেওয়া উচিত।
878	health	একটি সংক্রামক রোগ হলো একটি রোগ যেটি একজন আক্রান্ত রোগীর সান্নিধ্যে যাওয়ার মাধ্যমে ছড়ায়।
